id,name,price,short_description,description,rating_average,review_count,image_base_url,image_large_url,image_medium_url,image_small_url,image_thumbnail_url,stock,quantity_sold
275852640,Elon Musk Hardback,599000,"Quy cách: Bìa cứngNXB: Harper CollinsNgôn ngữ: tiếng Anh####South African born Elon Musk is the renowned entrepreneur and innovator behind PayPal, SpaceX, Tesla, and SolarCity. Musk wants to save o...","Quy cách : Bìa cứng NXB: Harper Collins Ngôn ngữ: tiếng Anh #### South African born Elon Musk is the renowned entrepreneur and innovator behind PayPal, SpaceX, Tesla, and SolarCity. Musk wants to save our planet; he wants to send citizens into space, to form a colony on Mars; he wants to make money while doing these things; and he wants us all to know about it. He is the real-life inspiration for the Iron Man series of films starring Robert Downey Junior. The personal tale of Musk's life comes with all the trappings one associates with a great, drama-filled story. He was a freakishly bright kid who was bullied brutally at school, and abused by his father. In the midst of these rough conditions, and the violence of apartheid South Africa, Musk still thrived academically and attended the University of Pennsylvania, where he paid his own way through school by turning his house into a club and throwing massive parties. Giá sản phẩm trên Tiki đã bao gồm thuế theo luật hiện hành. Bên cạnh đó, tuỳ vào loại sản phẩm, hình thức và địa chỉ giao hàng mà có thể phát sinh thêm chi phí khác như phí vận chuyển, phụ phí hàng cồng kềnh, thuế nhập khẩu (đối với đơn hàng giao từ nước ngoài có giá trị trên 1 triệu đồng).....",0,0,https://salt.tikicdn.com/ts/product/5c/5b/be/abd3f325074137cc9c17de5c18b1924c.jpg,https://salt.tikicdn.com/cache/w1200/ts/product/5c/5b/be/abd3f325074137cc9c17de5c18b1924c.jpg,https://salt.tikicdn.com/cache/w300/ts/product/5c/5b/be/abd3f325074137cc9c17de5c18b1924c.jpg,https://salt.tikicdn.com/cache/200x280/ts/product/5c/5b/be/abd3f325074137cc9c17de5c18b1924c.jpg,https://salt.tikicdn.com/cache/200x280/ts/product/5c/5b/be/abd3f325074137cc9c17de5c18b1924c.jpg,1000,0
275198955,Transitional,499000,WATERSTONES' BEST BOOKS OF 2023: POLITICS'A riveting blend of memoir and manifesto  I found myself dog-earing every page' Elizabeth Day'Profoundly articulate. Entirely wise. Beautifully real.' Attitud...,"WATERSTONES' BEST BOOKS OF 2023: POLITICS ' A riveting blend of memoir and manifesto  I found myself dog-earing every page ' Elizabeth Day 'Profoundly articulate. Entirely wise. Beautifully real .' Attitude ' Transitional is a clever, moving book that packs a lot into its 194 pages ' Guardian Transitioning is an alignment of the invisible and the physical. It is truth rising to the surface. It is one of the most fundamental aspects of the human condition – a part of our experience as a conscious being, no matter who we are. As time goes on, we all develop as people. We all transition. It's what unites us, not what separates us. In this life-affirming, heartfelt and intimate book, activist and model Munroe Bergdorf shares reflections from her own life to illustrate how transitioning is an essential part of all our lives. Through the story of one woman's extraordinary mission to live with authenticity, Transitional shows us how to heal, how to build a stronger community and how to evolve as a society out of shame and into pride. Giá sản phẩm trên Tiki đã bao gồm thuế theo luật hiện hành. Bên cạnh đó, tuỳ vào loại sản phẩm, hình thức và địa chỉ giao hàng mà có thể phát sinh thêm chi phí khác như phí vận chuyển, phụ phí hàng cồng kềnh, thuế nhập khẩu (đối với đơn hàng giao từ nước ngoài có giá trị trên 1 triệu đồng).....",0,0,https://salt.tikicdn.com/ts/product/82/67/62/1617a04b7c9a997edf4b90100e075bad.jpg,https://salt.tikicdn.com/cache/w1200/ts/product/82/67/62/1617a04b7c9a997edf4b90100e075bad.jpg,https://salt.tikicdn.com/cache/w300/ts/product/82/67/62/1617a04b7c9a997edf4b90100e075bad.jpg,https://salt.tikicdn.com/cache/200x280/ts/product/82/67/62/1617a04b7c9a997edf4b90100e075bad.jpg,https://salt.tikicdn.com/cache/200x280/ts/product/82/67/62/1617a04b7c9a997edf4b90100e075bad.jpg,1000,0
274468864,Elon Musk (Hardcover),744800,"    Elon Musk   #1 New York Times bestseller   From the author of Steve Jobs and other bestselling biographies, this is the astonishingly intimate story of the most fascinating and controversial ...","Elon Musk #1 New York Times bestseller From the author of Steve Jobs and other bestselling biographies, this is the astonishingly intimate story of the most fascinating and controversial innovator of our era—a rule-breaking visionary who helped to lead the world into the era of electric vehicles, private space exploration, and artificial intelligence. Oh, and took over Twitter. When Elon Musk was a kid in South Africa, he was regularly beaten by bullies. One day a group pushed him down some concrete steps and kicked him until his face was a swollen ball of flesh. He was in the hospital for a week. But the physical scars were minor compared to the emotional ones inflicted by his father, an engineer, rogue, and charismatic fantasist. His father’s impact on his psyche would linger. He developed into a tough yet vulnerable man-child, prone to abrupt Jekyll-and-Hyde mood swings, with an exceedingly high tolerance for risk, a craving for drama, an epic sense of mission, and a maniacal intensity that was callous and at times destructive. At the beginning of 2022—after a year marked by SpaceX launching thirty-one rockets into orbit, Tesla selling a million cars, and him becoming the richest man on earth—Musk spoke ruefully about his compulsion to stir up dramas. “I need to shift my mindset away from being in crisis mode, which it has been for about fourteen years now, or arguably most of my life,” he said. It was a wistful comment, not a New Year’s resolution. Even as he said it, he was secretly buying up shares of Twitter, the world’s ultimate playground. Over the years, whenever he was in a dark place, his mind went back to being bullied on the playground. Now he had the chance to own the playground. For two years, Isaacson shadowed Musk, attended his meetings, walked his factories with him, and spent hours interviewing him, his family, friends, coworkers, and adversaries. The result is the revealing inside story, filled with amazing tales of triumphs and turmoil, that ses the question: are the demons that drive Musk also what it takes to drive innovation and progress? Giá sản phẩm trên Tiki đã bao gồm thuế theo luật hiện hành. Bên cạnh đó, tuỳ vào loại sản phẩm, hình thức và địa chỉ giao hàng mà có thể phát sinh thêm chi phí khác như phí vận chuyển, phụ phí hàng cồng kềnh, thuế nhập khẩu (đối với đơn hàng giao từ nước ngoài có giá trị trên 1 triệu đồng).....",5,1,"https://salt.tikicdn.com/ts/product/ae/4a/47/cd74ff05e1a49abb7befa4690192d57f.jpg, https://salt.tikicdn.com/ts/product/2b/3b/bd/74b118afd519be5491ce4e5d937d236f.jpg, https://salt.tikicdn.com/ts/product/7e/4d/96/08998540a808b42b7921c336f9ac7694.jpg, https://salt.tikicdn.com/ts/product/2f/c7/8f/0a7d762d7b51d5e87c31bfc9de34d813.jpg, https://salt.tikicdn.com/ts/product/f3/80/12/75fc53e71f7a37d1567ed3b7d1db047b.jpg, https://salt.tikicdn.com/ts/product/c4/db/28/b0e47d834c5c22eddce8c52c7981f66f.jpg, https://salt.tikicdn.com/ts/product/63/01/02/4fc61d13f308855b64561133b5766797.jpg, https://salt.tikicdn.com/ts/product/02/97/41/67fcc04d40a1de06bfd1cf5caab96270.jpg, https://salt.tikicdn.com/ts/product/b4/53/a2/b747d714717a541079f53fd7ffb89b66.jpg, https://salt.tikicdn.com/ts/product/c4/b0/fc/594f72162fa308ab4a4d3700ce2af4b5.jpg, https://salt.tikicdn.com/ts/product/36/82/02/976d9bbddb9f10d8dcdc35ef318037d7.jpg, https://salt.tikicdn.com/ts/product/b2/14/d3/a99095663a3ed6da7d375913bf828f9d.jpg, https://salt.tikicdn.com/ts/product/82/12/a2/4034e4b63cd410a935f659334ca8bf60.jpg","https://salt.tikicdn.com/cache/w1200/ts/product/ae/4a/47/cd74ff05e1a49abb7befa4690192d57f.jpg, https://salt.tikicdn.com/cache/w1200/ts/product/2b/3b/bd/74b118afd519be5491ce4e5d937d236f.jpg, https://salt.tikicdn.com/cache/w1200/ts/product/7e/4d/96/08998540a808b42b7921c336f9ac7694.jpg, https://salt.tikicdn.com/cache/w1200/ts/product/2f/c7/8f/0a7d762d7b51d5e87c31bfc9de34d813.jpg, https://salt.tikicdn.com/cache/w1200/ts/product/f3/80/12/75fc53e71f7a37d1567ed3b7d1db047b.jpg, https://salt.tikicdn.com/cache/w1200/ts/product/c4/db/28/b0e47d834c5c22eddce8c52c7981f66f.jpg, https://salt.tikicdn.com/cache/w1200/ts/product/63/01/02/4fc61d13f308855b64561133b5766797.jpg, https://salt.tikicdn.com/cache/w1200/ts/product/02/97/41/67fcc04d40a1de06bfd1cf5caab96270.jpg, https://salt.tikicdn.com/cache/w1200/ts/product/b4/53/a2/b747d714717a541079f53fd7ffb89b66.jpg, https://salt.tikicdn.com/cache/w1200/ts/product/c4/b0/fc/594f72162fa308ab4a4d3700ce2af4b5.jpg, https://salt.tikicdn.com/cache/w1200/ts/product/36/82/02/976d9bbddb9f10d8dcdc35ef318037d7.jpg, https://salt.tikicdn.com/cache/w1200/ts/product/b2/14/d3/a99095663a3ed6da7d375913bf828f9d.jpg, https://salt.tikicdn.com/cache/w1200/ts/product/82/12/a2/4034e4b63cd410a935f659334ca8bf60.jpg","https://salt.tikicdn.com/cache/w300/ts/product/ae/4a/47/cd74ff05e1a49abb7befa4690192d57f.jpg, https://salt.tikicdn.com/cache/w300/ts/product/2b/3b/bd/74b118afd519be5491ce4e5d937d236f.jpg, https://salt.tikicdn.com/cache/w300/ts/product/7e/4d/96/08998540a808b42b7921c336f9ac7694.jpg, https://salt.tikicdn.com/cache/w300/ts/product/2f/c7/8f/0a7d762d7b51d5e87c31bfc9de34d813.jpg, https://salt.tikicdn.com/cache/w300/ts/product/f3/80/12/75fc53e71f7a37d1567ed3b7d1db047b.jpg, https://salt.tikicdn.com/cache/w300/ts/product/c4/db/28/b0e47d834c5c22eddce8c52c7981f66f.jpg, https://salt.tikicdn.com/cache/w300/ts/product/63/01/02/4fc61d13f308855b64561133b5766797.jpg, https://salt.tikicdn.com/cache/w300/ts/product/02/97/41/67fcc04d40a1de06bfd1cf5caab96270.jpg, https://salt.tikicdn.com/cache/w300/ts/product/b4/53/a2/b747d714717a541079f53fd7ffb89b66.jpg, https://salt.tikicdn.com/cache/w300/ts/product/c4/b0/fc/594f72162fa308ab4a4d3700ce2af4b5.jpg, https://salt.tikicdn.com/cache/w300/ts/product/36/82/02/976d9bbddb9f10d8dcdc35ef318037d7.jpg, https://salt.tikicdn.com/cache/w300/ts/product/b2/14/d3/a99095663a3ed6da7d375913bf828f9d.jpg, https://salt.tikicdn.com/cache/w300/ts/product/82/12/a2/4034e4b63cd410a935f659334ca8bf60.jpg","https://salt.tikicdn.com/cache/200x280/ts/product/ae/4a/47/cd74ff05e1a49abb7befa4690192d57f.jpg, https://salt.tikicdn.com/cache/200x280/ts/product/2b/3b/bd/74b118afd519be5491ce4e5d937d236f.jpg, https://salt.tikicdn.com/cache/200x280/ts/product/7e/4d/96/08998540a808b42b7921c336f9ac7694.jpg, https://salt.tikicdn.com/cache/200x280/ts/product/2f/c7/8f/0a7d762d7b51d5e87c31bfc9de34d813.jpg, https://salt.tikicdn.com/cache/200x280/ts/product/f3/80/12/75fc53e71f7a37d1567ed3b7d1db047b.jpg, https://salt.tikicdn.com/cache/200x280/ts/product/c4/db/28/b0e47d834c5c22eddce8c52c7981f66f.jpg, https://salt.tikicdn.com/cache/200x280/ts/product/63/01/02/4fc61d13f308855b64561133b5766797.jpg, https://salt.tikicdn.com/cache/200x280/ts/product/02/97/41/67fcc04d40a1de06bfd1cf5caab96270.jpg, https://salt.tikicdn.com/cache/200x280/ts/product/b4/53/a2/b747d714717a541079f53fd7ffb89b66.jpg, https://salt.tikicdn.com/cache/200x280/ts/product/c4/b0/fc/594f72162fa308ab4a4d3700ce2af4b5.jpg, https://salt.tikicdn.com/cache/200x280/ts/product/36/82/02/976d9bbddb9f10d8dcdc35ef318037d7.jpg, https://salt.tikicdn.com/cache/200x280/ts/product/b2/14/d3/a99095663a3ed6da7d375913bf828f9d.jpg, https://salt.tikicdn.com/cache/200x280/ts/product/82/12/a2/4034e4b63cd410a935f659334ca8bf60.jpg","https://salt.tikicdn.com/cache/200x280/ts/product/ae/4a/47/cd74ff05e1a49abb7befa4690192d57f.jpg, https://salt.tikicdn.com/cache/200x280/ts/product/2b/3b/bd/74b118afd519be5491ce4e5d937d236f.jpg, https://salt.tikicdn.com/cache/200x280/ts/product/7e/4d/96/08998540a808b42b7921c336f9ac7694.jpg, https://salt.tikicdn.com/cache/200x280/ts/product/2f/c7/8f/0a7d762d7b51d5e87c31bfc9de34d813.jpg, https://salt.tikicdn.com/cache/200x280/ts/product/f3/80/12/75fc53e71f7a37d1567ed3b7d1db047b.jpg, https://salt.tikicdn.com/cache/200x280/ts/product/c4/db/28/b0e47d834c5c22eddce8c52c7981f66f.jpg, https://salt.tikicdn.com/cache/200x280/ts/product/63/01/02/4fc61d13f308855b64561133b5766797.jpg, https://salt.tikicdn.com/cache/200x280/ts/product/02/97/41/67fcc04d40a1de06bfd1cf5caab96270.jpg, https://salt.tikicdn.com/cache/200x280/ts/product/b4/53/a2/b747d714717a541079f53fd7ffb89b66.jpg, https://salt.tikicdn.com/cache/200x280/ts/product/c4/b0/fc/594f72162fa308ab4a4d3700ce2af4b5.jpg, https://salt.tikicdn.com/cache/200x280/ts/product/36/82/02/976d9bbddb9f10d8dcdc35ef318037d7.jpg, https://salt.tikicdn.com/cache/200x280/ts/product/b2/14/d3/a99095663a3ed6da7d375913bf828f9d.jpg, https://salt.tikicdn.com/cache/200x280/ts/product/82/12/a2/4034e4b63cd410a935f659334ca8bf60.jpg",1000,1
273319779,Elon Musk: How the Billionaire CEO of SpaceX and Tesla is shaping our Future,269000,"Elon Musk: How the Billionaire CEO of SpaceX and Tesla is shaping our FutureSouth African born Elon Musk is the renowned entrepreneur and innovator behind PayPal, SpaceX, Tesla, and SolarCity. Musk w...","Elon Musk: How the Billionaire CEO of SpaceX and Tesla is shaping our Future South African born Elon Musk is the renowned entrepreneur and innovator behind PayPal, SpaceX, Tesla, and SolarCity. Musk wants to save our planet; he wants to send citizens into space, to form a colony on Mars; he wants to make money while doing these things; and he wants us all to know about it. He is the real-life inspiration for the Iron Man series of films starring Robert Downey Junior. The personal tale of Musk's life comes with all the trappings one associates with a great, drama-filled story. He was a freakishly bright kid who was bullied brutally at school, and abused by his father. In the midst of these rough conditions, and the violence of apartheid South Africa, Musk still thrived academically and attended the University of Pennsylvania, where he paid his own way through school by turning his house into a club and throwing massive parties. He started a pair of huge dot-com successes, including PayPal, which eBay acquired for $1.5 billion in 2002. Musk was forced out as CEO and so began his lost years in which he decided to go it alone and baffled friends by investing his fortune in rockets and electric cars. Meanwhile Musk's marriage disintegrated as his technological obsessions took over his Elon Musk is the Steve Jobs of the present and the future, and for the past twelve months, he has been shadowed by tech reporter, Ashlee Vance. Elon Musk: How the Billionaire CEO of Spacex and Tesla is Shaping our Future is an important, exciting and intelligent account of the real-life Iron Man. Giá sản phẩm trên Tiki đã bao gồm thuế theo luật hiện hành. Bên cạnh đó, tuỳ vào loại sản phẩm, hình thức và địa chỉ giao hàng mà có thể phát sinh thêm chi phí khác như phí vận chuyển, phụ phí hàng cồng kềnh, thuế nhập khẩu (đối với đơn hàng giao từ nước ngoài có giá trị trên 1 triệu đồng).....",0,0,https://salt.tikicdn.com/ts/product/9d/17/db/f7ce42006c0d7108877b2ff2e08ce948.jpg,https://salt.tikicdn.com/cache/w1200/ts/product/9d/17/db/f7ce42006c0d7108877b2ff2e08ce948.jpg,https://salt.tikicdn.com/cache/w300/ts/product/9d/17/db/f7ce42006c0d7108877b2ff2e08ce948.jpg,https://salt.tikicdn.com/cache/200x280/ts/product/9d/17/db/f7ce42006c0d7108877b2ff2e08ce948.jpg,https://salt.tikicdn.com/cache/200x280/ts/product/9d/17/db/f7ce42006c0d7108877b2ff2e08ce948.jpg,1000,0
248732627,Steve Jobs The Man Who Thought Different,549000,"Inventor. Visionary. Genius. Dropout. Adopted. Steve Jobs was the founder of Apple and he was all of these things. Steve Jobs has been described as a showman, artist, tyrant, genius, jerk. Through his...","Inventor. Visionary. Genius. Dropout. Adopted. Steve Jobs was the founder of Apple and he was all of these things. Steve Jobs has been described as a showman, artist, tyrant, genius, jerk. Through his life he was loved, hated, admired and dismissed, yet he was a living legend; the genius who founded Apple in his parent's garage when he was just 21 years-old, revolutionising the music world. He single-handedly introduced the first computer that could sit on your desk and founded and nurtured a company called Pixar bringing to life Oscar wining animations Toy Story and Finding Nemo. So how did the man, who was neither engineer nor computer geek change the world we live in, making us want every product he touched? Giá sản phẩm trên Tiki đã bao gồm thuế theo luật hiện hành. Bên cạnh đó, tuỳ vào loại sản phẩm, hình thức và địa chỉ giao hàng mà có thể phát sinh thêm chi phí khác như phí vận chuyển, phụ phí hàng cồng kềnh, thuế nhập khẩu (đối với đơn hàng giao từ nước ngoài có giá trị trên 1 triệu đồng).....",0,0,https://salt.tikicdn.com/ts/product/dd/81/71/dad970c255dd6fafb9027b8b493ffad7.png,https://salt.tikicdn.com/cache/w1200/ts/product/dd/81/71/dad970c255dd6fafb9027b8b493ffad7.png,https://salt.tikicdn.com/cache/w300/ts/product/dd/81/71/dad970c255dd6fafb9027b8b493ffad7.png,https://salt.tikicdn.com/cache/200x280/ts/product/dd/81/71/dad970c255dd6fafb9027b8b493ffad7.png,https://salt.tikicdn.com/cache/200x280/ts/product/dd/81/71/dad970c255dd6fafb9027b8b493ffad7.png,1000,0
