id,name,price,short_description,description,rating_average,review_count,image_base_url,image_large_url,image_medium_url,image_small_url,image_thumbnail_url,stock,quantity_sold
198495127,"The Inklings: C. S. Lewis, J. R. R. Tolkien And Their Friends",194900,"    The Inklings: C. S. Lewis, J. R. R. Tolkien And Their Friends   Critically acclaimed, award-winning biography of CS Lewis, JRR Tolkien and the brilliant group of writers to come out of Oxford ...","The Inklings: C. S. Lewis, J. R. R. Tolkien And Their Friends Critically acclaimed, award-winning biography of CS Lewis, JRR Tolkien and the brilliant group of writers to come out of Oxford during the Second World War. C.S. Lewis, J.R.R. Tolkien and their friends were a regular feature of the Oxford scenery in the years during and after the Second World War. They drank beer on Tuesdays at the 'Bird and Baby', and on Thursday nights they met in Lewis' Magdalen College rooms to read aloud from the books they were writing; jokingly they called themselves 'The Inklings'. C.S. Lewis and J.R.R. Tolkien first introduced The Screwtape Letters and The Lord of the Rings to an audience in this company and Charles Williams, poet and writer of supernatural thrillers, was another prominent member of the group. Humphrey Carpenter, who wrote the acclaimed biography of J.R.R. Tolkien, draws upon unpublished letters and diaries, to which he was given special access, in this engrossing story. Giá sản phẩm trên Tiki đã bao gồm thuế theo luật hiện hành. Bên cạnh đó, tuỳ vào loại sản phẩm, hình thức và địa chỉ giao hàng mà có thể phát sinh thêm chi phí khác như phí vận chuyển, phụ phí hàng cồng kềnh, thuế nhập khẩu (đối với đơn hàng giao từ nước ngoài có giá trị trên 1 triệu đồng).....",0,0,"https://salt.tikicdn.com/ts/product/3f/16/29/60730193787b77a3cf30a7616a7cccbf.jpg, https://salt.tikicdn.com/ts/product/60/fb/cb/daae543139edcf470abe9ad6bb2e5ce8.png, https://salt.tikicdn.com/ts/product/5a/82/67/c159cb0c48e5442ec754d5dda132c494.png, https://salt.tikicdn.com/ts/product/ec/1a/95/864ffde2a4e93bd2b584f9fb266fa162.png, https://salt.tikicdn.com/ts/product/db/5b/40/d98c906d31a35130b8d05c0f582bd4b4.png, https://salt.tikicdn.com/ts/product/5e/f3/52/972a36182b1e475029152cac8b6b6efd.png, https://salt.tikicdn.com/ts/product/18/05/45/f9219f759eaa40e8ebb01c056d8bdab0.png, https://salt.tikicdn.com/ts/product/45/08/0f/84f389179736ae7dc7b8cef3be11596d.png, https://salt.tikicdn.com/ts/product/9d/10/3a/26cadc571096dc1887fa78166044171f.png, https://salt.tikicdn.com/ts/product/63/64/b3/bba2cfc3dae8e99ee2c5fa7e16bcb7ff.png, https://salt.tikicdn.com/ts/product/97/00/9f/f1b91544293c7d58084e096ae37fe1c3.png","https://salt.tikicdn.com/cache/w1200/ts/product/3f/16/29/60730193787b77a3cf30a7616a7cccbf.jpg, https://salt.tikicdn.com/cache/w1200/ts/product/60/fb/cb/daae543139edcf470abe9ad6bb2e5ce8.png, https://salt.tikicdn.com/cache/w1200/ts/product/5a/82/67/c159cb0c48e5442ec754d5dda132c494.png, https://salt.tikicdn.com/cache/w1200/ts/product/ec/1a/95/864ffde2a4e93bd2b584f9fb266fa162.png, https://salt.tikicdn.com/cache/w1200/ts/product/db/5b/40/d98c906d31a35130b8d05c0f582bd4b4.png, https://salt.tikicdn.com/cache/w1200/ts/product/5e/f3/52/972a36182b1e475029152cac8b6b6efd.png, https://salt.tikicdn.com/cache/w1200/ts/product/18/05/45/f9219f759eaa40e8ebb01c056d8bdab0.png, https://salt.tikicdn.com/cache/w1200/ts/product/45/08/0f/84f389179736ae7dc7b8cef3be11596d.png, https://salt.tikicdn.com/cache/w1200/ts/product/9d/10/3a/26cadc571096dc1887fa78166044171f.png, https://salt.tikicdn.com/cache/w1200/ts/product/63/64/b3/bba2cfc3dae8e99ee2c5fa7e16bcb7ff.png, https://salt.tikicdn.com/cache/w1200/ts/product/97/00/9f/f1b91544293c7d58084e096ae37fe1c3.png","https://salt.tikicdn.com/cache/w300/ts/product/3f/16/29/60730193787b77a3cf30a7616a7cccbf.jpg, https://salt.tikicdn.com/cache/w300/ts/product/60/fb/cb/daae543139edcf470abe9ad6bb2e5ce8.png, https://salt.tikicdn.com/cache/w300/ts/product/5a/82/67/c159cb0c48e5442ec754d5dda132c494.png, https://salt.tikicdn.com/cache/w300/ts/product/ec/1a/95/864ffde2a4e93bd2b584f9fb266fa162.png, https://salt.tikicdn.com/cache/w300/ts/product/db/5b/40/d98c906d31a35130b8d05c0f582bd4b4.png, https://salt.tikicdn.com/cache/w300/ts/product/5e/f3/52/972a36182b1e475029152cac8b6b6efd.png, https://salt.tikicdn.com/cache/w300/ts/product/18/05/45/f9219f759eaa40e8ebb01c056d8bdab0.png, https://salt.tikicdn.com/cache/w300/ts/product/45/08/0f/84f389179736ae7dc7b8cef3be11596d.png, https://salt.tikicdn.com/cache/w300/ts/product/9d/10/3a/26cadc571096dc1887fa78166044171f.png, https://salt.tikicdn.com/cache/w300/ts/product/63/64/b3/bba2cfc3dae8e99ee2c5fa7e16bcb7ff.png, https://salt.tikicdn.com/cache/w300/ts/product/97/00/9f/f1b91544293c7d58084e096ae37fe1c3.png","https://salt.tikicdn.com/cache/200x280/ts/product/3f/16/29/60730193787b77a3cf30a7616a7cccbf.jpg, https://salt.tikicdn.com/cache/200x280/ts/product/60/fb/cb/daae543139edcf470abe9ad6bb2e5ce8.png, https://salt.tikicdn.com/cache/200x280/ts/product/5a/82/67/c159cb0c48e5442ec754d5dda132c494.png, https://salt.tikicdn.com/cache/200x280/ts/product/ec/1a/95/864ffde2a4e93bd2b584f9fb266fa162.png, https://salt.tikicdn.com/cache/200x280/ts/product/db/5b/40/d98c906d31a35130b8d05c0f582bd4b4.png, https://salt.tikicdn.com/cache/200x280/ts/product/5e/f3/52/972a36182b1e475029152cac8b6b6efd.png, https://salt.tikicdn.com/cache/200x280/ts/product/18/05/45/f9219f759eaa40e8ebb01c056d8bdab0.png, https://salt.tikicdn.com/cache/200x280/ts/product/45/08/0f/84f389179736ae7dc7b8cef3be11596d.png, https://salt.tikicdn.com/cache/200x280/ts/product/9d/10/3a/26cadc571096dc1887fa78166044171f.png, https://salt.tikicdn.com/cache/200x280/ts/product/63/64/b3/bba2cfc3dae8e99ee2c5fa7e16bcb7ff.png, https://salt.tikicdn.com/cache/200x280/ts/product/97/00/9f/f1b91544293c7d58084e096ae37fe1c3.png","https://salt.tikicdn.com/cache/200x280/ts/product/3f/16/29/60730193787b77a3cf30a7616a7cccbf.jpg, https://salt.tikicdn.com/cache/200x280/ts/product/60/fb/cb/daae543139edcf470abe9ad6bb2e5ce8.png, https://salt.tikicdn.com/cache/200x280/ts/product/5a/82/67/c159cb0c48e5442ec754d5dda132c494.png, https://salt.tikicdn.com/cache/200x280/ts/product/ec/1a/95/864ffde2a4e93bd2b584f9fb266fa162.png, https://salt.tikicdn.com/cache/200x280/ts/product/db/5b/40/d98c906d31a35130b8d05c0f582bd4b4.png, https://salt.tikicdn.com/cache/200x280/ts/product/5e/f3/52/972a36182b1e475029152cac8b6b6efd.png, https://salt.tikicdn.com/cache/200x280/ts/product/18/05/45/f9219f759eaa40e8ebb01c056d8bdab0.png, https://salt.tikicdn.com/cache/200x280/ts/product/45/08/0f/84f389179736ae7dc7b8cef3be11596d.png, https://salt.tikicdn.com/cache/200x280/ts/product/9d/10/3a/26cadc571096dc1887fa78166044171f.png, https://salt.tikicdn.com/cache/200x280/ts/product/63/64/b3/bba2cfc3dae8e99ee2c5fa7e16bcb7ff.png, https://salt.tikicdn.com/cache/200x280/ts/product/97/00/9f/f1b91544293c7d58084e096ae37fe1c3.png",1000,0
197821209,Business Is Personal: The Truth About What It Takes To Be Successful While Staying True To Yourself,576900,    Business Is Personal: The Truth About What It Takes To Be Successful While Staying True To Yourself   A New York Times bestselling author and successful businesswoman shares the important tips...,"Business Is Personal: The Truth About What It Takes To Be Successful While Staying True To Yourself A New York Times bestselling author and successful businesswoman shares the important tips and tricks she used to build a business and maintain balance as a media personality, mogul, and mother. Consider this book your strategic toolbox, full of Bethenny’s smartest and most practical no-nonsense business principles and tactics, illustrated through her own compelling stories and lessons from the entrepreneurial front and experience building the successful Skinnygirl and Bethenny brands, becoming a successful television and podcast producer, and managing her philanthropic foundation. She also shares wisdom from her conversations with highly accomplished people from Mark Cuban to Hillary Clinton, Candace Bushnell to Matthew McConaughey and many more, on what it takes to be successful at every level in an authentic way. So many women, including stay-at-home moms yearning for more, entrepreneurs, and 9-to-5ers see this time of disruption as an open road. As Bethenny says, the snow globe has been shaken. This is THE handbook to navigate what will come next. Whether you are new to business, a seasoned rainmaker, pivoting from a loss or layoff– or just finding your way– you will find value within these pages. This book will inspire you to act without fear, turn mistakes into masterstrokes, and keep you laughing along the way. Giá sản phẩm trên Tiki đã bao gồm thuế theo luật hiện hành. Bên cạnh đó, tuỳ vào loại sản phẩm, hình thức và địa chỉ giao hàng mà có thể phát sinh thêm chi phí khác như phí vận chuyển, phụ phí hàng cồng kềnh, thuế nhập khẩu (đối với đơn hàng giao từ nước ngoài có giá trị trên 1 triệu đồng).....",0,0,"https://salt.tikicdn.com/ts/product/c2/ce/be/95d049a79c7b23f0b4337d647b52c1c1.jpg, https://salt.tikicdn.com/ts/product/fd/d7/e1/f06df0d23a0aba4560f3202038d76a54.jpg, https://salt.tikicdn.com/ts/product/b9/ec/01/8d038e8d3a54f4d9ddf57a4157799dee.jpg, https://salt.tikicdn.com/ts/product/06/80/e4/b25633f2f2d6a354e1f709c75d009237.jpg, https://salt.tikicdn.com/ts/product/71/b3/ba/47cb60ea7ba6b001cc7f100f5f26fa5b.jpg, https://salt.tikicdn.com/ts/product/a4/7f/66/39057dcb6d36b3eb0990cf3605fe5389.jpg, https://salt.tikicdn.com/ts/product/02/8d/0a/f7212a08961ba929e514d3720025e87b.jpg, https://salt.tikicdn.com/ts/product/a2/5e/7c/37f3eb391251eb27519ac769b6f1e709.jpg, https://salt.tikicdn.com/ts/product/78/27/91/780f7ee7a953c156f05c328491e1e2f4.jpg, https://salt.tikicdn.com/ts/product/a9/af/3f/350b5e99bc934050b8aa2c4dd89a7558.jpg, https://salt.tikicdn.com/ts/product/a2/03/c9/1b03c9d51bf28af1d0420f278568dd11.jpg, https://salt.tikicdn.com/ts/product/36/b9/e5/34bfad3303b070facb4af8ef9e9e4663.jpg, https://salt.tikicdn.com/ts/product/8f/81/cf/af73c63e3eaa8b418ad9b215dfd5fc5d.jpg, https://salt.tikicdn.com/ts/product/90/2c/ec/be2970714daf54f72bc2eb60d3a933bc.jpg, https://salt.tikicdn.com/ts/product/ba/b0/57/1cec7b7d3fb63f0889d251a0cd968ea1.jpg","https://salt.tikicdn.com/cache/w1200/ts/product/c2/ce/be/95d049a79c7b23f0b4337d647b52c1c1.jpg, https://salt.tikicdn.com/cache/w1200/ts/product/fd/d7/e1/f06df0d23a0aba4560f3202038d76a54.jpg, https://salt.tikicdn.com/cache/w1200/ts/product/b9/ec/01/8d038e8d3a54f4d9ddf57a4157799dee.jpg, https://salt.tikicdn.com/cache/w1200/ts/product/06/80/e4/b25633f2f2d6a354e1f709c75d009237.jpg, https://salt.tikicdn.com/cache/w1200/ts/product/71/b3/ba/47cb60ea7ba6b001cc7f100f5f26fa5b.jpg, https://salt.tikicdn.com/cache/w1200/ts/product/a4/7f/66/39057dcb6d36b3eb0990cf3605fe5389.jpg, https://salt.tikicdn.com/cache/w1200/ts/product/02/8d/0a/f7212a08961ba929e514d3720025e87b.jpg, https://salt.tikicdn.com/cache/w1200/ts/product/a2/5e/7c/37f3eb391251eb27519ac769b6f1e709.jpg, https://salt.tikicdn.com/cache/w1200/ts/product/78/27/91/780f7ee7a953c156f05c328491e1e2f4.jpg, https://salt.tikicdn.com/cache/w1200/ts/product/a9/af/3f/350b5e99bc934050b8aa2c4dd89a7558.jpg, https://salt.tikicdn.com/cache/w1200/ts/product/a2/03/c9/1b03c9d51bf28af1d0420f278568dd11.jpg, https://salt.tikicdn.com/cache/w1200/ts/product/36/b9/e5/34bfad3303b070facb4af8ef9e9e4663.jpg, https://salt.tikicdn.com/cache/w1200/ts/product/8f/81/cf/af73c63e3eaa8b418ad9b215dfd5fc5d.jpg, https://salt.tikicdn.com/cache/w1200/ts/product/90/2c/ec/be2970714daf54f72bc2eb60d3a933bc.jpg, https://salt.tikicdn.com/cache/w1200/ts/product/ba/b0/57/1cec7b7d3fb63f0889d251a0cd968ea1.jpg","https://salt.tikicdn.com/cache/w300/ts/product/c2/ce/be/95d049a79c7b23f0b4337d647b52c1c1.jpg, https://salt.tikicdn.com/cache/w300/ts/product/fd/d7/e1/f06df0d23a0aba4560f3202038d76a54.jpg, https://salt.tikicdn.com/cache/w300/ts/product/b9/ec/01/8d038e8d3a54f4d9ddf57a4157799dee.jpg, https://salt.tikicdn.com/cache/w300/ts/product/06/80/e4/b25633f2f2d6a354e1f709c75d009237.jpg, https://salt.tikicdn.com/cache/w300/ts/product/71/b3/ba/47cb60ea7ba6b001cc7f100f5f26fa5b.jpg, https://salt.tikicdn.com/cache/w300/ts/product/a4/7f/66/39057dcb6d36b3eb0990cf3605fe5389.jpg, https://salt.tikicdn.com/cache/w300/ts/product/02/8d/0a/f7212a08961ba929e514d3720025e87b.jpg, https://salt.tikicdn.com/cache/w300/ts/product/a2/5e/7c/37f3eb391251eb27519ac769b6f1e709.jpg, https://salt.tikicdn.com/cache/w300/ts/product/78/27/91/780f7ee7a953c156f05c328491e1e2f4.jpg, https://salt.tikicdn.com/cache/w300/ts/product/a9/af/3f/350b5e99bc934050b8aa2c4dd89a7558.jpg, https://salt.tikicdn.com/cache/w300/ts/product/a2/03/c9/1b03c9d51bf28af1d0420f278568dd11.jpg, https://salt.tikicdn.com/cache/w300/ts/product/36/b9/e5/34bfad3303b070facb4af8ef9e9e4663.jpg, https://salt.tikicdn.com/cache/w300/ts/product/8f/81/cf/af73c63e3eaa8b418ad9b215dfd5fc5d.jpg, https://salt.tikicdn.com/cache/w300/ts/product/90/2c/ec/be2970714daf54f72bc2eb60d3a933bc.jpg, https://salt.tikicdn.com/cache/w300/ts/product/ba/b0/57/1cec7b7d3fb63f0889d251a0cd968ea1.jpg","https://salt.tikicdn.com/cache/200x280/ts/product/c2/ce/be/95d049a79c7b23f0b4337d647b52c1c1.jpg, https://salt.tikicdn.com/cache/200x280/ts/product/fd/d7/e1/f06df0d23a0aba4560f3202038d76a54.jpg, https://salt.tikicdn.com/cache/200x280/ts/product/b9/ec/01/8d038e8d3a54f4d9ddf57a4157799dee.jpg, https://salt.tikicdn.com/cache/200x280/ts/product/06/80/e4/b25633f2f2d6a354e1f709c75d009237.jpg, https://salt.tikicdn.com/cache/200x280/ts/product/71/b3/ba/47cb60ea7ba6b001cc7f100f5f26fa5b.jpg, https://salt.tikicdn.com/cache/200x280/ts/product/a4/7f/66/39057dcb6d36b3eb0990cf3605fe5389.jpg, https://salt.tikicdn.com/cache/200x280/ts/product/02/8d/0a/f7212a08961ba929e514d3720025e87b.jpg, https://salt.tikicdn.com/cache/200x280/ts/product/a2/5e/7c/37f3eb391251eb27519ac769b6f1e709.jpg, https://salt.tikicdn.com/cache/200x280/ts/product/78/27/91/780f7ee7a953c156f05c328491e1e2f4.jpg, https://salt.tikicdn.com/cache/200x280/ts/product/a9/af/3f/350b5e99bc934050b8aa2c4dd89a7558.jpg, https://salt.tikicdn.com/cache/200x280/ts/product/a2/03/c9/1b03c9d51bf28af1d0420f278568dd11.jpg, https://salt.tikicdn.com/cache/200x280/ts/product/36/b9/e5/34bfad3303b070facb4af8ef9e9e4663.jpg, https://salt.tikicdn.com/cache/200x280/ts/product/8f/81/cf/af73c63e3eaa8b418ad9b215dfd5fc5d.jpg, https://salt.tikicdn.com/cache/200x280/ts/product/90/2c/ec/be2970714daf54f72bc2eb60d3a933bc.jpg, https://salt.tikicdn.com/cache/200x280/ts/product/ba/b0/57/1cec7b7d3fb63f0889d251a0cd968ea1.jpg","https://salt.tikicdn.com/cache/200x280/ts/product/c2/ce/be/95d049a79c7b23f0b4337d647b52c1c1.jpg, https://salt.tikicdn.com/cache/200x280/ts/product/fd/d7/e1/f06df0d23a0aba4560f3202038d76a54.jpg, https://salt.tikicdn.com/cache/200x280/ts/product/b9/ec/01/8d038e8d3a54f4d9ddf57a4157799dee.jpg, https://salt.tikicdn.com/cache/200x280/ts/product/06/80/e4/b25633f2f2d6a354e1f709c75d009237.jpg, https://salt.tikicdn.com/cache/200x280/ts/product/71/b3/ba/47cb60ea7ba6b001cc7f100f5f26fa5b.jpg, https://salt.tikicdn.com/cache/200x280/ts/product/a4/7f/66/39057dcb6d36b3eb0990cf3605fe5389.jpg, https://salt.tikicdn.com/cache/200x280/ts/product/02/8d/0a/f7212a08961ba929e514d3720025e87b.jpg, https://salt.tikicdn.com/cache/200x280/ts/product/a2/5e/7c/37f3eb391251eb27519ac769b6f1e709.jpg, https://salt.tikicdn.com/cache/200x280/ts/product/78/27/91/780f7ee7a953c156f05c328491e1e2f4.jpg, https://salt.tikicdn.com/cache/200x280/ts/product/a9/af/3f/350b5e99bc934050b8aa2c4dd89a7558.jpg, https://salt.tikicdn.com/cache/200x280/ts/product/a2/03/c9/1b03c9d51bf28af1d0420f278568dd11.jpg, https://salt.tikicdn.com/cache/200x280/ts/product/36/b9/e5/34bfad3303b070facb4af8ef9e9e4663.jpg, https://salt.tikicdn.com/cache/200x280/ts/product/8f/81/cf/af73c63e3eaa8b418ad9b215dfd5fc5d.jpg, https://salt.tikicdn.com/cache/200x280/ts/product/90/2c/ec/be2970714daf54f72bc2eb60d3a933bc.jpg, https://salt.tikicdn.com/cache/200x280/ts/product/ba/b0/57/1cec7b7d3fb63f0889d251a0cd968ea1.jpg",1000,0
195994059,Cowgirl Power: How To Kick Ass In Business And Life,318600,"    Cowgirl Power: How To Kick Ass In Business And Life   Kick Ass Your Way   As the owner of one of the largest woman-owned advertising agencies in the U.S., Gay Gaddis knows a thing or two abou...","Cowgirl Power: How To Kick Ass In Business And Life Kick Ass Your Way As the owner of one of the largest woman-owned advertising agencies in the U.S., Gay Gaddis knows a thing or two about empowerment. Gay's insights are rooted in the spirited strength of the real cowgirl heroines of the 1920s and '30s-gutsy risk -takers in everything they did. In Cowgirl Power, these cowgirls are celebrated as a metaphor for the power we all have to achieve far more than we think. Whether your goal is to start a family, own a business, advance your career, organize community outreach, or run for office, it all comes down to power: knowing how to develop it and not being afraid to take it when it comes your way. Gay's book and Cowgirl Power Toolkit will help you blaze a path to success, on your terms: - Taking responsibility for yourself - Building your own competence - Finding your assertiveness - Designing your own life - Building a kick-ass culture - Recognizing good ideas - Becoming a fearless leader Cowgirl Power is not about changing you. You are just fine. It's about understanding your strengths, building on them, and unlocking your power to kick ass-your way. Giá sản phẩm trên Tiki đã bao gồm thuế theo luật hiện hành. Bên cạnh đó, tuỳ vào loại sản phẩm, hình thức và địa chỉ giao hàng mà có thể phát sinh thêm chi phí khác như phí vận chuyển, phụ phí hàng cồng kềnh, thuế nhập khẩu (đối với đơn hàng giao từ nước ngoài có giá trị trên 1 triệu đồng).....",0,0,"https://salt.tikicdn.com/ts/product/c4/33/fa/7298cfdb6994638d897aed4960d3a04b.jpg, https://salt.tikicdn.com/ts/product/30/e9/e0/be08ce8c5b6d4ec29a9adebec06b33ce.jpg, https://salt.tikicdn.com/ts/product/d2/26/40/6062026fc63102a764f52c7143476a4a.png, https://salt.tikicdn.com/ts/product/c3/12/7b/d65d0e56b7204b09431efc5f87b9b06d.png, https://salt.tikicdn.com/ts/product/d6/e5/f5/06c7d753ee29e2b1d4e8f4d4b5d541bc.png, https://salt.tikicdn.com/ts/product/25/b3/86/75c611d5d0d67fd14a6ac3c15dce2315.png, https://salt.tikicdn.com/ts/product/7c/0f/65/a9d38171cb3428e1a33abfe30af65d09.png, https://salt.tikicdn.com/ts/product/b8/ed/59/92bb85c691ce910899a777ac01f56e9b.png, https://salt.tikicdn.com/ts/product/d1/f5/1b/80c8f4c6e7f794b132804dc6d7efe086.png, https://salt.tikicdn.com/ts/product/05/b9/16/69a36fc7400a7f23ca0f94983cbb29f9.png, https://salt.tikicdn.com/ts/product/16/d2/fc/67894bbd8762c41064fe1c0719ccfe22.png, https://salt.tikicdn.com/ts/product/e6/0d/b8/1a9ed0dcb72f45225d7b1191d965747f.png, https://salt.tikicdn.com/ts/product/61/50/17/1a80b3d731c4f03f91dbdd428de678aa.jpg, https://salt.tikicdn.com/ts/product/71/32/12/165b8ca39212d5d55b3fa55a82277ed0.png, https://salt.tikicdn.com/ts/product/48/74/66/32e3780122b8a3c56d3950a377b085d4.png","https://salt.tikicdn.com/cache/w1200/ts/product/c4/33/fa/7298cfdb6994638d897aed4960d3a04b.jpg, https://salt.tikicdn.com/cache/w1200/ts/product/30/e9/e0/be08ce8c5b6d4ec29a9adebec06b33ce.jpg, https://salt.tikicdn.com/cache/w1200/ts/product/d2/26/40/6062026fc63102a764f52c7143476a4a.png, https://salt.tikicdn.com/cache/w1200/ts/product/c3/12/7b/d65d0e56b7204b09431efc5f87b9b06d.png, https://salt.tikicdn.com/cache/w1200/ts/product/d6/e5/f5/06c7d753ee29e2b1d4e8f4d4b5d541bc.png, https://salt.tikicdn.com/cache/w1200/ts/product/25/b3/86/75c611d5d0d67fd14a6ac3c15dce2315.png, https://salt.tikicdn.com/cache/w1200/ts/product/7c/0f/65/a9d38171cb3428e1a33abfe30af65d09.png, https://salt.tikicdn.com/cache/w1200/ts/product/b8/ed/59/92bb85c691ce910899a777ac01f56e9b.png, https://salt.tikicdn.com/cache/w1200/ts/product/d1/f5/1b/80c8f4c6e7f794b132804dc6d7efe086.png, https://salt.tikicdn.com/cache/w1200/ts/product/05/b9/16/69a36fc7400a7f23ca0f94983cbb29f9.png, https://salt.tikicdn.com/cache/w1200/ts/product/16/d2/fc/67894bbd8762c41064fe1c0719ccfe22.png, https://salt.tikicdn.com/cache/w1200/ts/product/e6/0d/b8/1a9ed0dcb72f45225d7b1191d965747f.png, https://salt.tikicdn.com/cache/w1200/ts/product/61/50/17/1a80b3d731c4f03f91dbdd428de678aa.jpg, https://salt.tikicdn.com/cache/w1200/ts/product/71/32/12/165b8ca39212d5d55b3fa55a82277ed0.png, https://salt.tikicdn.com/cache/w1200/ts/product/48/74/66/32e3780122b8a3c56d3950a377b085d4.png","https://salt.tikicdn.com/cache/w300/ts/product/c4/33/fa/7298cfdb6994638d897aed4960d3a04b.jpg, https://salt.tikicdn.com/cache/w300/ts/product/30/e9/e0/be08ce8c5b6d4ec29a9adebec06b33ce.jpg, https://salt.tikicdn.com/cache/w300/ts/product/d2/26/40/6062026fc63102a764f52c7143476a4a.png, https://salt.tikicdn.com/cache/w300/ts/product/c3/12/7b/d65d0e56b7204b09431efc5f87b9b06d.png, https://salt.tikicdn.com/cache/w300/ts/product/d6/e5/f5/06c7d753ee29e2b1d4e8f4d4b5d541bc.png, https://salt.tikicdn.com/cache/w300/ts/product/25/b3/86/75c611d5d0d67fd14a6ac3c15dce2315.png, https://salt.tikicdn.com/cache/w300/ts/product/7c/0f/65/a9d38171cb3428e1a33abfe30af65d09.png, https://salt.tikicdn.com/cache/w300/ts/product/b8/ed/59/92bb85c691ce910899a777ac01f56e9b.png, https://salt.tikicdn.com/cache/w300/ts/product/d1/f5/1b/80c8f4c6e7f794b132804dc6d7efe086.png, https://salt.tikicdn.com/cache/w300/ts/product/05/b9/16/69a36fc7400a7f23ca0f94983cbb29f9.png, https://salt.tikicdn.com/cache/w300/ts/product/16/d2/fc/67894bbd8762c41064fe1c0719ccfe22.png, https://salt.tikicdn.com/cache/w300/ts/product/e6/0d/b8/1a9ed0dcb72f45225d7b1191d965747f.png, https://salt.tikicdn.com/cache/w300/ts/product/61/50/17/1a80b3d731c4f03f91dbdd428de678aa.jpg, https://salt.tikicdn.com/cache/w300/ts/product/71/32/12/165b8ca39212d5d55b3fa55a82277ed0.png, https://salt.tikicdn.com/cache/w300/ts/product/48/74/66/32e3780122b8a3c56d3950a377b085d4.png","https://salt.tikicdn.com/cache/200x280/ts/product/c4/33/fa/7298cfdb6994638d897aed4960d3a04b.jpg, https://salt.tikicdn.com/cache/200x280/ts/product/30/e9/e0/be08ce8c5b6d4ec29a9adebec06b33ce.jpg, https://salt.tikicdn.com/cache/200x280/ts/product/d2/26/40/6062026fc63102a764f52c7143476a4a.png, https://salt.tikicdn.com/cache/200x280/ts/product/c3/12/7b/d65d0e56b7204b09431efc5f87b9b06d.png, https://salt.tikicdn.com/cache/200x280/ts/product/d6/e5/f5/06c7d753ee29e2b1d4e8f4d4b5d541bc.png, https://salt.tikicdn.com/cache/200x280/ts/product/25/b3/86/75c611d5d0d67fd14a6ac3c15dce2315.png, https://salt.tikicdn.com/cache/200x280/ts/product/7c/0f/65/a9d38171cb3428e1a33abfe30af65d09.png, https://salt.tikicdn.com/cache/200x280/ts/product/b8/ed/59/92bb85c691ce910899a777ac01f56e9b.png, https://salt.tikicdn.com/cache/200x280/ts/product/d1/f5/1b/80c8f4c6e7f794b132804dc6d7efe086.png, https://salt.tikicdn.com/cache/200x280/ts/product/05/b9/16/69a36fc7400a7f23ca0f94983cbb29f9.png, https://salt.tikicdn.com/cache/200x280/ts/product/16/d2/fc/67894bbd8762c41064fe1c0719ccfe22.png, https://salt.tikicdn.com/cache/200x280/ts/product/e6/0d/b8/1a9ed0dcb72f45225d7b1191d965747f.png, https://salt.tikicdn.com/cache/200x280/ts/product/61/50/17/1a80b3d731c4f03f91dbdd428de678aa.jpg, https://salt.tikicdn.com/cache/200x280/ts/product/71/32/12/165b8ca39212d5d55b3fa55a82277ed0.png, https://salt.tikicdn.com/cache/200x280/ts/product/48/74/66/32e3780122b8a3c56d3950a377b085d4.png","https://salt.tikicdn.com/cache/200x280/ts/product/c4/33/fa/7298cfdb6994638d897aed4960d3a04b.jpg, https://salt.tikicdn.com/cache/200x280/ts/product/30/e9/e0/be08ce8c5b6d4ec29a9adebec06b33ce.jpg, https://salt.tikicdn.com/cache/200x280/ts/product/d2/26/40/6062026fc63102a764f52c7143476a4a.png, https://salt.tikicdn.com/cache/200x280/ts/product/c3/12/7b/d65d0e56b7204b09431efc5f87b9b06d.png, https://salt.tikicdn.com/cache/200x280/ts/product/d6/e5/f5/06c7d753ee29e2b1d4e8f4d4b5d541bc.png, https://salt.tikicdn.com/cache/200x280/ts/product/25/b3/86/75c611d5d0d67fd14a6ac3c15dce2315.png, https://salt.tikicdn.com/cache/200x280/ts/product/7c/0f/65/a9d38171cb3428e1a33abfe30af65d09.png, https://salt.tikicdn.com/cache/200x280/ts/product/b8/ed/59/92bb85c691ce910899a777ac01f56e9b.png, https://salt.tikicdn.com/cache/200x280/ts/product/d1/f5/1b/80c8f4c6e7f794b132804dc6d7efe086.png, https://salt.tikicdn.com/cache/200x280/ts/product/05/b9/16/69a36fc7400a7f23ca0f94983cbb29f9.png, https://salt.tikicdn.com/cache/200x280/ts/product/16/d2/fc/67894bbd8762c41064fe1c0719ccfe22.png, https://salt.tikicdn.com/cache/200x280/ts/product/e6/0d/b8/1a9ed0dcb72f45225d7b1191d965747f.png, https://salt.tikicdn.com/cache/200x280/ts/product/61/50/17/1a80b3d731c4f03f91dbdd428de678aa.jpg, https://salt.tikicdn.com/cache/200x280/ts/product/71/32/12/165b8ca39212d5d55b3fa55a82277ed0.png, https://salt.tikicdn.com/cache/200x280/ts/product/48/74/66/32e3780122b8a3c56d3950a377b085d4.png",1000,0
