id,name,price,short_description,description,rating_average,review_count,image_base_url,image_large_url,image_medium_url,image_small_url,image_thumbnail_url,stock,quantity_sold
34356934,Mực T10 Black - Đen,150000,T10 là loại ống bơm mực cao cấp sản xuất 100% tại ĐứcMàu mực Black - ĐenChỉ sử dụng được một lầnDành cho các sản phẩm bút máy Lamy1 hộp bên trong có 5 ốngKhách hàng có nhu cầu khắc bút/ logo công ty ...,"T10 là loại ống bơm mực cao cấp sản xuất 100% tại Đức Màu mực Black - Đen Chỉ sử dụng được một lần Dành cho các sản phẩm bút máy Lamy 1 hộp bên trong có 5 ống Khách hàng có nhu c ầ u kh ắ c bút/ logo công ty vui lòng liên h ệ shop đ ể đ ượ c t ư v ấ n và h ỗ tr ợ . Giá sản phẩm trên Tiki đã bao gồm thuế theo luật hiện hành. Bên cạnh đó, tuỳ vào loại sản phẩm, hình thức và địa chỉ giao hàng mà có thể phát sinh thêm chi phí khác như phí vận chuyển, phụ phí hàng cồng kềnh, thuế nhập khẩu (đối với đơn hàng giao từ nước ngoài có giá trị trên 1 triệu đồng).....",5,1,"https://salt.tikicdn.com/ts/product/1a/b7/e5/818e231fd19c10b2866f2d310be9de7c.jpg, https://salt.tikicdn.com/ts/product/09/1c/db/6235908e869eff033d9321c53b76df01.jpg, https://salt.tikicdn.com/ts/product/2d/ae/c3/7a1498b6a9f7b52e2aa394ee16ac4038.jpg, https://salt.tikicdn.com/ts/product/5a/4d/80/3b029e30d994d4b14876f4a9c3766c02.jpg, https://salt.tikicdn.com/ts/product/90/83/55/5c017c35c097fbd70b6d94eb4e10f5d4.jpg","https://salt.tikicdn.com/cache/w1200/ts/product/1a/b7/e5/818e231fd19c10b2866f2d310be9de7c.jpg, https://salt.tikicdn.com/cache/w1200/ts/product/09/1c/db/6235908e869eff033d9321c53b76df01.jpg, https://salt.tikicdn.com/cache/w1200/ts/product/2d/ae/c3/7a1498b6a9f7b52e2aa394ee16ac4038.jpg, https://salt.tikicdn.com/cache/w1200/ts/product/5a/4d/80/3b029e30d994d4b14876f4a9c3766c02.jpg, https://salt.tikicdn.com/cache/w1200/ts/product/90/83/55/5c017c35c097fbd70b6d94eb4e10f5d4.jpg","https://salt.tikicdn.com/cache/w300/ts/product/1a/b7/e5/818e231fd19c10b2866f2d310be9de7c.jpg, https://salt.tikicdn.com/cache/w300/ts/product/09/1c/db/6235908e869eff033d9321c53b76df01.jpg, https://salt.tikicdn.com/cache/w300/ts/product/2d/ae/c3/7a1498b6a9f7b52e2aa394ee16ac4038.jpg, https://salt.tikicdn.com/cache/w300/ts/product/5a/4d/80/3b029e30d994d4b14876f4a9c3766c02.jpg, https://salt.tikicdn.com/cache/w300/ts/product/90/83/55/5c017c35c097fbd70b6d94eb4e10f5d4.jpg","https://salt.tikicdn.com/cache/200x280/ts/product/1a/b7/e5/818e231fd19c10b2866f2d310be9de7c.jpg, https://salt.tikicdn.com/cache/200x280/ts/product/09/1c/db/6235908e869eff033d9321c53b76df01.jpg, https://salt.tikicdn.com/cache/200x280/ts/product/2d/ae/c3/7a1498b6a9f7b52e2aa394ee16ac4038.jpg, https://salt.tikicdn.com/cache/200x280/ts/product/5a/4d/80/3b029e30d994d4b14876f4a9c3766c02.jpg, https://salt.tikicdn.com/cache/200x280/ts/product/90/83/55/5c017c35c097fbd70b6d94eb4e10f5d4.jpg","https://salt.tikicdn.com/cache/200x280/ts/product/1a/b7/e5/818e231fd19c10b2866f2d310be9de7c.jpg, https://salt.tikicdn.com/cache/200x280/ts/product/09/1c/db/6235908e869eff033d9321c53b76df01.jpg, https://salt.tikicdn.com/cache/200x280/ts/product/2d/ae/c3/7a1498b6a9f7b52e2aa394ee16ac4038.jpg, https://salt.tikicdn.com/cache/200x280/ts/product/5a/4d/80/3b029e30d994d4b14876f4a9c3766c02.jpg, https://salt.tikicdn.com/cache/200x280/ts/product/90/83/55/5c017c35c097fbd70b6d94eb4e10f5d4.jpg",1000,1
27804342,Ruột mực Lamy M21 - Xanh lá,98000,"M21 là ruột bút bi của thương hiệu LamyNgòi bút sử dụng được cho các loại bút đa chức năng, đa màu và dòng bút bi Lamy SpiritMàu mực Xanh láSản xuất tại Đức...","M21 là ruột bút bi của thương hiệu Lamy Ngòi bút sử dụng được cho các loại bút đa chức năng, đa màu và dòng bút bi Lamy Spirit Màu mực Xanh lá Sản xuất tại Đức Giá sản phẩm trên Tiki đã bao gồm thuế theo luật hiện hành. Bên cạnh đó, tuỳ vào loại sản phẩm, hình thức và địa chỉ giao hàng mà có thể phát sinh thêm chi phí khác như phí vận chuyển, phụ phí hàng cồng kềnh, thuế nhập khẩu (đối với đơn hàng giao từ nước ngoài có giá trị trên 1 triệu đồng).....",0,0,"https://salt.tikicdn.com/ts/product/47/60/2b/3a46c654a2c0b7fb2bb1fddadc3769b3.jpg, https://salt.tikicdn.com/ts/product/3c/2b/e3/e859c23f09de58b9bb1c648532bb6942.jpg, https://salt.tikicdn.com/ts/product/81/7d/5d/038c00cf0b94764288826f193bf6c8df.jpg","https://salt.tikicdn.com/cache/w1200/ts/product/47/60/2b/3a46c654a2c0b7fb2bb1fddadc3769b3.jpg, https://salt.tikicdn.com/cache/w1200/ts/product/3c/2b/e3/e859c23f09de58b9bb1c648532bb6942.jpg, https://salt.tikicdn.com/cache/w1200/ts/product/81/7d/5d/038c00cf0b94764288826f193bf6c8df.jpg","https://salt.tikicdn.com/cache/w300/ts/product/47/60/2b/3a46c654a2c0b7fb2bb1fddadc3769b3.jpg, https://salt.tikicdn.com/cache/w300/ts/product/3c/2b/e3/e859c23f09de58b9bb1c648532bb6942.jpg, https://salt.tikicdn.com/cache/w300/ts/product/81/7d/5d/038c00cf0b94764288826f193bf6c8df.jpg","https://salt.tikicdn.com/cache/200x280/ts/product/47/60/2b/3a46c654a2c0b7fb2bb1fddadc3769b3.jpg, https://salt.tikicdn.com/cache/200x280/ts/product/3c/2b/e3/e859c23f09de58b9bb1c648532bb6942.jpg, https://salt.tikicdn.com/cache/200x280/ts/product/81/7d/5d/038c00cf0b94764288826f193bf6c8df.jpg","https://salt.tikicdn.com/cache/200x280/ts/product/47/60/2b/3a46c654a2c0b7fb2bb1fddadc3769b3.jpg, https://salt.tikicdn.com/cache/200x280/ts/product/3c/2b/e3/e859c23f09de58b9bb1c648532bb6942.jpg, https://salt.tikicdn.com/cache/200x280/ts/product/81/7d/5d/038c00cf0b94764288826f193bf6c8df.jpg",1000,0
27781521,Ruột mực Lamy M55 - Cam,98000,"M55là ruột viết của thương hiệu LamySản phẩm thiết kế ngòi bút dạ quang, mực nước.Sản phẩm dành cho các loại bút đa năng của dòng sản phẩm LamySản xuất tại Đức...","M55là ruột viết của thương hiệu Lamy Sản phẩm thiết kế ngòi bút dạ quang, mực nước. Sản phẩm dành cho các loại bút đa năng của dòng sản phẩm Lamy Sản xuất tại Đức Giá sản phẩm trên Tiki đã bao gồm thuế theo luật hiện hành. Bên cạnh đó, tuỳ vào loại sản phẩm, hình thức và địa chỉ giao hàng mà có thể phát sinh thêm chi phí khác như phí vận chuyển, phụ phí hàng cồng kềnh, thuế nhập khẩu (đối với đơn hàng giao từ nước ngoài có giá trị trên 1 triệu đồng).....",5,1,"https://salt.tikicdn.com/ts/product/d1/7b/49/f404a254fb6ae9f163fecd948b547058.jpeg, https://salt.tikicdn.com/ts/product/df/f1/5a/4d227c8dc2532a49f662f5af0ca86a47.jpg, https://salt.tikicdn.com/ts/product/90/83/55/2f07d2b23e160d6bcbec4c0915d4ec54.jpg, https://salt.tikicdn.com/ts/product/32/93/20/c8ed19b0c7c9f56032c55d271f3534a0.jpg, https://salt.tikicdn.com/ts/product/e4/84/73/ba4163b22b18b6c6c417f8193ff9f580.jpg","https://salt.tikicdn.com/cache/w1200/ts/product/d1/7b/49/f404a254fb6ae9f163fecd948b547058.jpeg, https://salt.tikicdn.com/cache/w1200/ts/product/df/f1/5a/4d227c8dc2532a49f662f5af0ca86a47.jpg, https://salt.tikicdn.com/cache/w1200/ts/product/90/83/55/2f07d2b23e160d6bcbec4c0915d4ec54.jpg, https://salt.tikicdn.com/cache/w1200/ts/product/32/93/20/c8ed19b0c7c9f56032c55d271f3534a0.jpg, https://salt.tikicdn.com/cache/w1200/ts/product/e4/84/73/ba4163b22b18b6c6c417f8193ff9f580.jpg","https://salt.tikicdn.com/cache/w300/ts/product/d1/7b/49/f404a254fb6ae9f163fecd948b547058.jpeg, https://salt.tikicdn.com/cache/w300/ts/product/df/f1/5a/4d227c8dc2532a49f662f5af0ca86a47.jpg, https://salt.tikicdn.com/cache/w300/ts/product/90/83/55/2f07d2b23e160d6bcbec4c0915d4ec54.jpg, https://salt.tikicdn.com/cache/w300/ts/product/32/93/20/c8ed19b0c7c9f56032c55d271f3534a0.jpg, https://salt.tikicdn.com/cache/w300/ts/product/e4/84/73/ba4163b22b18b6c6c417f8193ff9f580.jpg","https://salt.tikicdn.com/cache/200x280/ts/product/d1/7b/49/f404a254fb6ae9f163fecd948b547058.jpeg, https://salt.tikicdn.com/cache/200x280/ts/product/df/f1/5a/4d227c8dc2532a49f662f5af0ca86a47.jpg, https://salt.tikicdn.com/cache/200x280/ts/product/90/83/55/2f07d2b23e160d6bcbec4c0915d4ec54.jpg, https://salt.tikicdn.com/cache/200x280/ts/product/32/93/20/c8ed19b0c7c9f56032c55d271f3534a0.jpg, https://salt.tikicdn.com/cache/200x280/ts/product/e4/84/73/ba4163b22b18b6c6c417f8193ff9f580.jpg","https://salt.tikicdn.com/cache/200x280/ts/product/d1/7b/49/f404a254fb6ae9f163fecd948b547058.jpeg, https://salt.tikicdn.com/cache/200x280/ts/product/df/f1/5a/4d227c8dc2532a49f662f5af0ca86a47.jpg, https://salt.tikicdn.com/cache/200x280/ts/product/90/83/55/2f07d2b23e160d6bcbec4c0915d4ec54.jpg, https://salt.tikicdn.com/cache/200x280/ts/product/32/93/20/c8ed19b0c7c9f56032c55d271f3534a0.jpg, https://salt.tikicdn.com/cache/200x280/ts/product/e4/84/73/ba4163b22b18b6c6c417f8193ff9f580.jpg",1000,1
27602271,Bình mực Lamy T53 Beryl - Tím,498000,Dòng mực LAMY T53 là dòng mực mới trong đại gia đình LAMY. Dòng mực này còn được gọi là dòng mực Pha Lê. Bao gồm 10 màu sắc nổi bật và ấn tượng. LAMY tạo ra dòng sản phẩm này không chỉ làm phong phú t...,"Dòng mực LAMY T53 là dòng mực mới trong đại gia đình LAMY. Dòng mực này còn được gọi là dòng mực Pha Lê. Bao gồm 10 màu sắc nổi bật và ấn tượng. LAMY tạo ra dòng sản phẩm này không chỉ làm phong phú thêm những sản phẩm mực dành cho bút máy của mình. Nó còn làm cho bạn thể hiện rõ cá tính và phong cách khi sử dụng. Bên cạnh đó, mực LAMY T53 vẫn được sản xuất hoàn toàn tại Đức. Chắc chắn đây sẽ là sự lựa chọn mới thật cá tính và phong cách dành cho bạn. Khách hàng có nhu c ầ u kh ắ c bút/ logo công ty vui lòng liên h ệ shop đ ể đ ượ c t ư v ấ n và h ỗ tr ợ . Giá sản phẩm trên Tiki đã bao gồm thuế theo luật hiện hành. Bên cạnh đó, tuỳ vào loại sản phẩm, hình thức và địa chỉ giao hàng mà có thể phát sinh thêm chi phí khác như phí vận chuyển, phụ phí hàng cồng kềnh, thuế nhập khẩu (đối với đơn hàng giao từ nước ngoài có giá trị trên 1 triệu đồng).....",5,1,"https://salt.tikicdn.com/ts/product/a5/73/a4/f5debd2aa4925e239682f8f991ad7874.jpg, https://salt.tikicdn.com/ts/product/cd/b8/b6/89b8216495e3ae769e598be22d91bb46.jpg, https://salt.tikicdn.com/ts/product/9c/ae/57/9de3b1540b23b9142d2a4d59e7441e85.jpg, https://salt.tikicdn.com/ts/product/5a/4d/80/bee10a23fe0a6736add23df7c361f87d.jpg","https://salt.tikicdn.com/cache/w1200/ts/product/a5/73/a4/f5debd2aa4925e239682f8f991ad7874.jpg, https://salt.tikicdn.com/cache/w1200/ts/product/cd/b8/b6/89b8216495e3ae769e598be22d91bb46.jpg, https://salt.tikicdn.com/cache/w1200/ts/product/9c/ae/57/9de3b1540b23b9142d2a4d59e7441e85.jpg, https://salt.tikicdn.com/cache/w1200/ts/product/5a/4d/80/bee10a23fe0a6736add23df7c361f87d.jpg","https://salt.tikicdn.com/cache/w300/ts/product/a5/73/a4/f5debd2aa4925e239682f8f991ad7874.jpg, https://salt.tikicdn.com/cache/w300/ts/product/cd/b8/b6/89b8216495e3ae769e598be22d91bb46.jpg, https://salt.tikicdn.com/cache/w300/ts/product/9c/ae/57/9de3b1540b23b9142d2a4d59e7441e85.jpg, https://salt.tikicdn.com/cache/w300/ts/product/5a/4d/80/bee10a23fe0a6736add23df7c361f87d.jpg","https://salt.tikicdn.com/cache/200x280/ts/product/a5/73/a4/f5debd2aa4925e239682f8f991ad7874.jpg, https://salt.tikicdn.com/cache/200x280/ts/product/cd/b8/b6/89b8216495e3ae769e598be22d91bb46.jpg, https://salt.tikicdn.com/cache/200x280/ts/product/9c/ae/57/9de3b1540b23b9142d2a4d59e7441e85.jpg, https://salt.tikicdn.com/cache/200x280/ts/product/5a/4d/80/bee10a23fe0a6736add23df7c361f87d.jpg","https://salt.tikicdn.com/cache/200x280/ts/product/a5/73/a4/f5debd2aa4925e239682f8f991ad7874.jpg, https://salt.tikicdn.com/cache/200x280/ts/product/cd/b8/b6/89b8216495e3ae769e598be22d91bb46.jpg, https://salt.tikicdn.com/cache/200x280/ts/product/9c/ae/57/9de3b1540b23b9142d2a4d59e7441e85.jpg, https://salt.tikicdn.com/cache/200x280/ts/product/5a/4d/80/bee10a23fe0a6736add23df7c361f87d.jpg",1000,1
27178524,Ống bơm mực Lamy Z28,124900,"Ống mực Lamy Z28 là loại ống bơm mực cao cấp sản xuất tại Đức, có thể tái nạp bằng lọ mực T 51 hoặc T 52 để sử dụng được nhiều lần. Sản phẩm có thể sử dụng nhiều lần bằng cách bơm thêm mực vào ống. Ốn...","Ống mực Lamy Z28 là loại ống bơm mực cao cấp sản xuất tại Đức, có thể tái nạp bằng lọ mực T 51 hoặc T 52 để sử dụng được nhiều lần. Sản phẩm có thể sử dụng nhiều lần bằng cách bơm thêm mực vào ống. Ống mực Lamy Z28 dành cho các sản phẩm Lamy LX, safari, vista, joy, AL-star, nexx, nexx M, abc. Model LAMY Z28 converter Nhà sản xuất LAMY Nạp bằng Ống mực T 51 hoặc T 52, T53 Dùng cho Các sản phẩm Lamy Lx, safari, vista, joy, AL-star, nexx, nexx M, abc. Khách hàng có nhu c ầ u kh ắ c bút/ logo công ty vui lòng liên h ệ shop đ ể đ ượ c t ư v ấ n và h ỗ tr ợ . LAMY Converter Z28 (bộ chuyển đổi không bao gồm khi mua bút) Thương hiệu Lamy Trên khắp thế giới, thương hiệu LAMY là viết tắt của các công cụ viết thiết kế chất lượng cao được xác định bởi tính thẩm mỹ hiện đại vượt thời gian và chức năng hoàn hảo. Câu chuyện thành công của chúng tôi bắt đầu từ hơn 50 năm trước với LAMY 2000: vào năm 1966, mô hình này đã thiết lập thiết kế rõ ràng và không thể nhầm lẫn, vẫn xác định phong cách của tất cả các sản phẩm thương hiệu ngày nay - thiết kế Lamy. Là một doanh nghiệp gia đình độc lập, Lamy đã liên kết với Heidelberg kể từ khi được thành lập lần đầu tiên vào năm 1930 và do đó đảm bảo chất lượng cao nhất quán, được sản xuất tại Đức. Với sản lượng hàng năm trên 9 triệu dụng cụ viết và doanh thu hơn 130 triệu euro trong năm 2017, Lamy ngày nay không chỉ là công ty dẫn đầu thị trường ở Đức, mà còn phát triển để trở thành một thương hiệu được quốc tế săn đón. Lamy ghi nhận khoảng một nửa doanh thu từ bên ngoài nước Đức. Ngày nay, thương hiệu được đại diện trên toàn thế giới tại hơn 80 quốc gia với hơn 15.600 cửa hàng bán hàng, bao gồm khoảng 200 cửa hàng thương hiệu đơn sắc. Công ty tiếp tục thiết lập xu hướng, không chỉ thông qua các phiên bản đặc biệt hàng năm và đã truyền cảm hứng cho những người đam mê viết lách trên khắp thế giới với màu sắc sáng tạo và bề mặt hoàn thiện. Bằng cách này, Lamy tiếp tục phát minh lại chính mình và chứng minh rằng một công cụ viết không chỉ là một vật dụng hàng ngày: mà chính là một phụ kiện lối sống chân chính thể hiện niềm vui viết tay và làm nổi bật cá tính của chủ nhân. Giá sản phẩm trên Tiki đã bao gồm thuế theo luật hiện hành. Bên cạnh đó, tuỳ vào loại sản phẩm, hình thức và địa chỉ giao hàng mà có thể phát sinh thêm chi phí khác như phí vận chuyển, phụ phí hàng cồng kềnh, thuế nhập khẩu (đối với đơn hàng giao từ nước ngoài có giá trị trên 1 triệu đồng).....",5,53,"https://salt.tikicdn.com/ts/product/13/ef/ae/8674d7d26d9cbfa39b9b4ec812856df5.jpg, https://salt.tikicdn.com/ts/product/ee/e9/e8/123891406f87e15b59b916fdf7f0d1d6.jpg, https://salt.tikicdn.com/ts/product/5a/4d/80/13a0d05bd9c7e62b5843698b1dc9d4d1.jpg, https://salt.tikicdn.com/ts/product/90/83/55/f82b93c25a38e27de7c578f770793c44.jpg","https://salt.tikicdn.com/cache/w1200/ts/product/13/ef/ae/8674d7d26d9cbfa39b9b4ec812856df5.jpg, https://salt.tikicdn.com/cache/w1200/ts/product/ee/e9/e8/123891406f87e15b59b916fdf7f0d1d6.jpg, https://salt.tikicdn.com/cache/w1200/ts/product/5a/4d/80/13a0d05bd9c7e62b5843698b1dc9d4d1.jpg, https://salt.tikicdn.com/cache/w1200/ts/product/90/83/55/f82b93c25a38e27de7c578f770793c44.jpg","https://salt.tikicdn.com/cache/w300/ts/product/13/ef/ae/8674d7d26d9cbfa39b9b4ec812856df5.jpg, https://salt.tikicdn.com/cache/w300/ts/product/ee/e9/e8/123891406f87e15b59b916fdf7f0d1d6.jpg, https://salt.tikicdn.com/cache/w300/ts/product/5a/4d/80/13a0d05bd9c7e62b5843698b1dc9d4d1.jpg, https://salt.tikicdn.com/cache/w300/ts/product/90/83/55/f82b93c25a38e27de7c578f770793c44.jpg","https://salt.tikicdn.com/cache/200x280/ts/product/13/ef/ae/8674d7d26d9cbfa39b9b4ec812856df5.jpg, https://salt.tikicdn.com/cache/200x280/ts/product/ee/e9/e8/123891406f87e15b59b916fdf7f0d1d6.jpg, https://salt.tikicdn.com/cache/200x280/ts/product/5a/4d/80/13a0d05bd9c7e62b5843698b1dc9d4d1.jpg, https://salt.tikicdn.com/cache/200x280/ts/product/90/83/55/f82b93c25a38e27de7c578f770793c44.jpg","https://salt.tikicdn.com/cache/200x280/ts/product/13/ef/ae/8674d7d26d9cbfa39b9b4ec812856df5.jpg, https://salt.tikicdn.com/cache/200x280/ts/product/ee/e9/e8/123891406f87e15b59b916fdf7f0d1d6.jpg, https://salt.tikicdn.com/cache/200x280/ts/product/5a/4d/80/13a0d05bd9c7e62b5843698b1dc9d4d1.jpg, https://salt.tikicdn.com/cache/200x280/ts/product/90/83/55/f82b93c25a38e27de7c578f770793c44.jpg",1000,53
26956314,Mực T10 Turquse - Xanh ngọc,150000,T10 là loại ống mực cao cấp sản xuất 100% tại ĐứcMàu mực Turquoise - Xanh ngọcChỉ sử dụng được một lầnDành cho các sản phẩm bút máy Lamy1 hộp bên trong có 5 ống mựcKhách hàng có nhu cầu khắc bút/ log...,"T10 là loại ống mực cao cấp sản xuất 100% tại Đức Màu mực Turquoise - Xanh ngọc Chỉ sử dụng được một lần Dành cho các sản phẩm bút máy Lamy 1 hộp bên trong có 5 ống mực Khách hàng có nhu c ầ u kh ắ c bút/ logo công ty vui lòng liên h ệ shop đ ể đ ượ c t ư v ấ n và h ỗ tr ợ . Giá sản phẩm trên Tiki đã bao gồm thuế theo luật hiện hành. Bên cạnh đó, tuỳ vào loại sản phẩm, hình thức và địa chỉ giao hàng mà có thể phát sinh thêm chi phí khác như phí vận chuyển, phụ phí hàng cồng kềnh, thuế nhập khẩu (đối với đơn hàng giao từ nước ngoài có giá trị trên 1 triệu đồng).....",5,3,"https://salt.tikicdn.com/ts/product/4d/41/ce/95411ce951726e9cb2d76fef544098ad.jpg, https://salt.tikicdn.com/ts/product/c6/a3/0b/5765f82978b77702c981dafcab684400.jpg, https://salt.tikicdn.com/ts/product/c1/23/0f/16f1d5f48e145111487cd5f800e36bd3.jpg, https://salt.tikicdn.com/ts/product/5a/4d/80/befef15c1809a04e0a6a154e2735d22f.jpg","https://salt.tikicdn.com/cache/w1200/ts/product/4d/41/ce/95411ce951726e9cb2d76fef544098ad.jpg, https://salt.tikicdn.com/cache/w1200/ts/product/c6/a3/0b/5765f82978b77702c981dafcab684400.jpg, https://salt.tikicdn.com/cache/w1200/ts/product/c1/23/0f/16f1d5f48e145111487cd5f800e36bd3.jpg, https://salt.tikicdn.com/cache/w1200/ts/product/5a/4d/80/befef15c1809a04e0a6a154e2735d22f.jpg","https://salt.tikicdn.com/cache/w300/ts/product/4d/41/ce/95411ce951726e9cb2d76fef544098ad.jpg, https://salt.tikicdn.com/cache/w300/ts/product/c6/a3/0b/5765f82978b77702c981dafcab684400.jpg, https://salt.tikicdn.com/cache/w300/ts/product/c1/23/0f/16f1d5f48e145111487cd5f800e36bd3.jpg, https://salt.tikicdn.com/cache/w300/ts/product/5a/4d/80/befef15c1809a04e0a6a154e2735d22f.jpg","https://salt.tikicdn.com/cache/200x280/ts/product/4d/41/ce/95411ce951726e9cb2d76fef544098ad.jpg, https://salt.tikicdn.com/cache/200x280/ts/product/c6/a3/0b/5765f82978b77702c981dafcab684400.jpg, https://salt.tikicdn.com/cache/200x280/ts/product/c1/23/0f/16f1d5f48e145111487cd5f800e36bd3.jpg, https://salt.tikicdn.com/cache/200x280/ts/product/5a/4d/80/befef15c1809a04e0a6a154e2735d22f.jpg","https://salt.tikicdn.com/cache/200x280/ts/product/4d/41/ce/95411ce951726e9cb2d76fef544098ad.jpg, https://salt.tikicdn.com/cache/200x280/ts/product/c6/a3/0b/5765f82978b77702c981dafcab684400.jpg, https://salt.tikicdn.com/cache/200x280/ts/product/c1/23/0f/16f1d5f48e145111487cd5f800e36bd3.jpg, https://salt.tikicdn.com/cache/200x280/ts/product/5a/4d/80/befef15c1809a04e0a6a154e2735d22f.jpg",1000,3
26730055,Ruột mực Lamy M66 Blue - Xanh dương,198000,M66 là loại ống mực cao cấp sản xuất 100% tại ĐứcMàu mực Blue M- Xanh dương M66 blue MChỉ sử dụng được một lầnDành cho các sản phẩm bút bi nước Lamy...,"M66 là loại ống mực cao cấp sản xuất 100% tại Đức Màu mực Blue M- Xanh dương M66 blue M Chỉ sử dụng được một lần Dành cho các sản phẩm bút bi nước Lamy Giá sản phẩm trên Tiki đã bao gồm thuế theo luật hiện hành. Bên cạnh đó, tuỳ vào loại sản phẩm, hình thức và địa chỉ giao hàng mà có thể phát sinh thêm chi phí khác như phí vận chuyển, phụ phí hàng cồng kềnh, thuế nhập khẩu (đối với đơn hàng giao từ nước ngoài có giá trị trên 1 triệu đồng).....",5,1,"https://salt.tikicdn.com/ts/product/88/62/b7/3292d27115ae5aee9b0a30d80e9c1eb3.jpeg, https://salt.tikicdn.com/ts/product/1f/34/20/1004ee90e150d47de63e6939264ec465.jpg, https://salt.tikicdn.com/ts/product/ad/d3/0d/aff293287ae9f1747671ed396ade701f.jpg, https://salt.tikicdn.com/ts/product/fc/9c/fd/73e5bd5ffdc8d98281274f67a4c9817f.jpg, https://salt.tikicdn.com/ts/product/65/78/34/7ab0ea4c608ee497a0ffe5f2e27c83fe.jpg, https://salt.tikicdn.com/ts/product/32/93/20/eebe09ee2c15fa3bc17b23de0c3f6909.jpg, https://salt.tikicdn.com/ts/product/90/83/55/0878bf5d0b39c96cb9d6122ae39a058c.jpg","https://salt.tikicdn.com/cache/w1200/ts/product/88/62/b7/3292d27115ae5aee9b0a30d80e9c1eb3.jpeg, https://salt.tikicdn.com/cache/w1200/ts/product/1f/34/20/1004ee90e150d47de63e6939264ec465.jpg, https://salt.tikicdn.com/cache/w1200/ts/product/ad/d3/0d/aff293287ae9f1747671ed396ade701f.jpg, https://salt.tikicdn.com/cache/w1200/ts/product/fc/9c/fd/73e5bd5ffdc8d98281274f67a4c9817f.jpg, https://salt.tikicdn.com/cache/w1200/ts/product/65/78/34/7ab0ea4c608ee497a0ffe5f2e27c83fe.jpg, https://salt.tikicdn.com/cache/w1200/ts/product/32/93/20/eebe09ee2c15fa3bc17b23de0c3f6909.jpg, https://salt.tikicdn.com/cache/w1200/ts/product/90/83/55/0878bf5d0b39c96cb9d6122ae39a058c.jpg","https://salt.tikicdn.com/cache/w300/ts/product/88/62/b7/3292d27115ae5aee9b0a30d80e9c1eb3.jpeg, https://salt.tikicdn.com/cache/w300/ts/product/1f/34/20/1004ee90e150d47de63e6939264ec465.jpg, https://salt.tikicdn.com/cache/w300/ts/product/ad/d3/0d/aff293287ae9f1747671ed396ade701f.jpg, https://salt.tikicdn.com/cache/w300/ts/product/fc/9c/fd/73e5bd5ffdc8d98281274f67a4c9817f.jpg, https://salt.tikicdn.com/cache/w300/ts/product/65/78/34/7ab0ea4c608ee497a0ffe5f2e27c83fe.jpg, https://salt.tikicdn.com/cache/w300/ts/product/32/93/20/eebe09ee2c15fa3bc17b23de0c3f6909.jpg, https://salt.tikicdn.com/cache/w300/ts/product/90/83/55/0878bf5d0b39c96cb9d6122ae39a058c.jpg","https://salt.tikicdn.com/cache/200x280/ts/product/88/62/b7/3292d27115ae5aee9b0a30d80e9c1eb3.jpeg, https://salt.tikicdn.com/cache/200x280/ts/product/1f/34/20/1004ee90e150d47de63e6939264ec465.jpg, https://salt.tikicdn.com/cache/200x280/ts/product/ad/d3/0d/aff293287ae9f1747671ed396ade701f.jpg, https://salt.tikicdn.com/cache/200x280/ts/product/fc/9c/fd/73e5bd5ffdc8d98281274f67a4c9817f.jpg, https://salt.tikicdn.com/cache/200x280/ts/product/65/78/34/7ab0ea4c608ee497a0ffe5f2e27c83fe.jpg, https://salt.tikicdn.com/cache/200x280/ts/product/32/93/20/eebe09ee2c15fa3bc17b23de0c3f6909.jpg, https://salt.tikicdn.com/cache/200x280/ts/product/90/83/55/0878bf5d0b39c96cb9d6122ae39a058c.jpg","https://salt.tikicdn.com/cache/200x280/ts/product/88/62/b7/3292d27115ae5aee9b0a30d80e9c1eb3.jpeg, https://salt.tikicdn.com/cache/200x280/ts/product/1f/34/20/1004ee90e150d47de63e6939264ec465.jpg, https://salt.tikicdn.com/cache/200x280/ts/product/ad/d3/0d/aff293287ae9f1747671ed396ade701f.jpg, https://salt.tikicdn.com/cache/200x280/ts/product/fc/9c/fd/73e5bd5ffdc8d98281274f67a4c9817f.jpg, https://salt.tikicdn.com/cache/200x280/ts/product/65/78/34/7ab0ea4c608ee497a0ffe5f2e27c83fe.jpg, https://salt.tikicdn.com/cache/200x280/ts/product/32/93/20/eebe09ee2c15fa3bc17b23de0c3f6909.jpg, https://salt.tikicdn.com/cache/200x280/ts/product/90/83/55/0878bf5d0b39c96cb9d6122ae39a058c.jpg",1000,1
