id,name,price,short_description,description,rating_average,review_count,image_base_url,image_large_url,image_medium_url,image_small_url,image_thumbnail_url,stock,quantity_sold
277490219,Bình mực cao cấp LAMY - T52 bản 2025,498000,"Bình mực cao cấp LAMY T 52 sản xuất 100% tại Đức- là sản phẩm mực cao cấp thuộc thương hiệu LAMY.- Thân bình có thiết kế đặc biệt, bã mực sẽ lắng xuống phần lõm đáy bình khi bơm, ngoài ra phần giấy ...","Bình mực cao cấp LAMY T 52 sản xuất 100% tại Đức - là sản phẩm mực cao cấp thuộc thương hiệu LAMY. - Thân bình có thiết kế đặc biệt, bã mực sẽ lắng xuống phần lõm đáy bình khi bơm, ngoài ra phần giấy cuộn giúp lau mực khi bơm và giữ bình mực sạch sẽ, không lem mực ra ngoài. - Thiết kể cổ bình rộng giúp việc lấy mực được dễ dàng hơn. Mô tả sản phẩm: - Dung tích: 50 ml - Loại mực: Mực nước - Dùng cho: Tất cả các sản phẩm bút máy Lamy - Màu mực: Gồm 2 màu + Sepia + Petrol Giá sản phẩm trên Tiki đã bao gồm thuế theo luật hiện hành. Bên cạnh đó, tuỳ vào loại sản phẩm, hình thức và địa chỉ giao hàng mà có thể phát sinh thêm chi phí khác như phí vận chuyển, phụ phí hàng cồng kềnh, thuế nhập khẩu (đối với đơn hàng giao từ nước ngoài có giá trị trên 1 triệu đồng).....",0,0,"https://salt.tikicdn.com/ts/product/53/b6/5c/1b8fc03a8765289e12a3989e5a66d21b.png, https://salt.tikicdn.com/ts/product/fe/59/76/bc8b753d4a0737b8f2889dd5e7f83e5e.png","https://salt.tikicdn.com/cache/w1200/ts/product/53/b6/5c/1b8fc03a8765289e12a3989e5a66d21b.png, https://salt.tikicdn.com/cache/w1200/ts/product/fe/59/76/bc8b753d4a0737b8f2889dd5e7f83e5e.png","https://salt.tikicdn.com/cache/w300/ts/product/53/b6/5c/1b8fc03a8765289e12a3989e5a66d21b.png, https://salt.tikicdn.com/cache/w300/ts/product/fe/59/76/bc8b753d4a0737b8f2889dd5e7f83e5e.png","https://salt.tikicdn.com/cache/200x280/ts/product/53/b6/5c/1b8fc03a8765289e12a3989e5a66d21b.png, https://salt.tikicdn.com/cache/200x280/ts/product/fe/59/76/bc8b753d4a0737b8f2889dd5e7f83e5e.png","https://salt.tikicdn.com/cache/200x280/ts/product/53/b6/5c/1b8fc03a8765289e12a3989e5a66d21b.png, https://salt.tikicdn.com/cache/200x280/ts/product/fe/59/76/bc8b753d4a0737b8f2889dd5e7f83e5e.png",1000,0
276296399,"(300ml) Dung Dịch Tẩy Vết Mực Bút Màu, Bút Bi, Bút Lông, Bút Chì Trên Quần Áo - Hàng Nhập Khẩu",95000,"Dung dịch tẩy mực bút bi trên quần áoĐây là nỗi trăn trở của rất nhiều chị em phụ nữ . Hôm nay, chúng tôi sẽ mách bạn cách xử lý nhé!HƯỚNG DẪN SỬ DỤNG:Bước 1: Trải quần áo ra mặt phẳng;Bước 2: Nhỏ du...","Dung dịch tẩy mực bút bi trên quần áo Đây là nỗi trăn trở của rất nhiều chị em phụ nữ . Hôm nay, chúng tôi sẽ mách bạn cách xử lý nhé! HƯỚNG DẪN SỬ DỤNG: Bước 1: Trải quần áo ra mặt phẳng; Bước 2: Nhỏ dung dịch tẩy mực lên trên vết mực (để mực tan ra); Bước 3: Dùng tăm bông hoặc giấy thấm, chà vết mực đã tan, chà đến khi hết vết mực, nếu vẫn còn tiếp tục nhỏ thêm dung dịch và thao tác tương tự. Bước 4: Giặt lại với nước (nước ấm và chút xà phòng thì càng tốt) THÔNG TIN SẢN PHẨM: - Tên sản phẩm: Dung Dịch Tẩy Vết Mực Bút Bi Bút Lông Trên Quần Áo - Phù hợp: tẩy mực bi trên quần áo, đồ da túi xách... - Màu sắc: không màu; - Thể tích: 300ml Giá sản phẩm trên Tiki đã bao gồm thuế theo luật hiện hành. Bên cạnh đó, tuỳ vào loại sản phẩm, hình thức và địa chỉ giao hàng mà có thể phát sinh thêm chi phí khác như phí vận chuyển, phụ phí hàng cồng kềnh, thuế nhập khẩu (đối với đơn hàng giao từ nước ngoài có giá trị trên 1 triệu đồng).....",0,0,"https://salt.tikicdn.com/ts/product/02/49/6c/5f5c8faf017294e936211ec03cdc2574.jpg, https://salt.tikicdn.com/ts/product/f0/7f/d0/9b11301eca62fdb6bb51f1f9738b59fc.jpg, https://salt.tikicdn.com/ts/product/11/71/93/0d5911a6ab5b992f2f64ab0b1eb7a037.jpg, https://salt.tikicdn.com/ts/product/4e/50/2a/bbab89e057fbde04f69b16dabec6f1a0.jpg, https://salt.tikicdn.com/ts/product/52/91/f5/357cbd406689ada8d3b082783c931480.jpg, https://salt.tikicdn.com/ts/product/69/22/0d/efa42672e21ea404da9ad876f4ac1f89.jpg, https://salt.tikicdn.com/ts/product/7b/49/a0/ea66c24d4250869b04150868a4af056b.jpg, https://salt.tikicdn.com/ts/product/8d/af/01/3c0ebf1f8dd7ba277277740689e83599.jpg, https://salt.tikicdn.com/ts/product/ff/5f/86/bbca9333a37b342567d336615858eb09.jpg","https://salt.tikicdn.com/cache/w1200/ts/product/02/49/6c/5f5c8faf017294e936211ec03cdc2574.jpg, https://salt.tikicdn.com/cache/w1200/ts/product/f0/7f/d0/9b11301eca62fdb6bb51f1f9738b59fc.jpg, https://salt.tikicdn.com/cache/w1200/ts/product/11/71/93/0d5911a6ab5b992f2f64ab0b1eb7a037.jpg, https://salt.tikicdn.com/cache/w1200/ts/product/4e/50/2a/bbab89e057fbde04f69b16dabec6f1a0.jpg, https://salt.tikicdn.com/cache/w1200/ts/product/52/91/f5/357cbd406689ada8d3b082783c931480.jpg, https://salt.tikicdn.com/cache/w1200/ts/product/69/22/0d/efa42672e21ea404da9ad876f4ac1f89.jpg, https://salt.tikicdn.com/cache/w1200/ts/product/7b/49/a0/ea66c24d4250869b04150868a4af056b.jpg, https://salt.tikicdn.com/cache/w1200/ts/product/8d/af/01/3c0ebf1f8dd7ba277277740689e83599.jpg, https://salt.tikicdn.com/cache/w1200/ts/product/ff/5f/86/bbca9333a37b342567d336615858eb09.jpg","https://salt.tikicdn.com/cache/w300/ts/product/02/49/6c/5f5c8faf017294e936211ec03cdc2574.jpg, https://salt.tikicdn.com/cache/w300/ts/product/f0/7f/d0/9b11301eca62fdb6bb51f1f9738b59fc.jpg, https://salt.tikicdn.com/cache/w300/ts/product/11/71/93/0d5911a6ab5b992f2f64ab0b1eb7a037.jpg, https://salt.tikicdn.com/cache/w300/ts/product/4e/50/2a/bbab89e057fbde04f69b16dabec6f1a0.jpg, https://salt.tikicdn.com/cache/w300/ts/product/52/91/f5/357cbd406689ada8d3b082783c931480.jpg, https://salt.tikicdn.com/cache/w300/ts/product/69/22/0d/efa42672e21ea404da9ad876f4ac1f89.jpg, https://salt.tikicdn.com/cache/w300/ts/product/7b/49/a0/ea66c24d4250869b04150868a4af056b.jpg, https://salt.tikicdn.com/cache/w300/ts/product/8d/af/01/3c0ebf1f8dd7ba277277740689e83599.jpg, https://salt.tikicdn.com/cache/w300/ts/product/ff/5f/86/bbca9333a37b342567d336615858eb09.jpg","https://salt.tikicdn.com/cache/200x280/ts/product/02/49/6c/5f5c8faf017294e936211ec03cdc2574.jpg, https://salt.tikicdn.com/cache/200x280/ts/product/f0/7f/d0/9b11301eca62fdb6bb51f1f9738b59fc.jpg, https://salt.tikicdn.com/cache/200x280/ts/product/11/71/93/0d5911a6ab5b992f2f64ab0b1eb7a037.jpg, https://salt.tikicdn.com/cache/200x280/ts/product/4e/50/2a/bbab89e057fbde04f69b16dabec6f1a0.jpg, https://salt.tikicdn.com/cache/200x280/ts/product/52/91/f5/357cbd406689ada8d3b082783c931480.jpg, https://salt.tikicdn.com/cache/200x280/ts/product/69/22/0d/efa42672e21ea404da9ad876f4ac1f89.jpg, https://salt.tikicdn.com/cache/200x280/ts/product/7b/49/a0/ea66c24d4250869b04150868a4af056b.jpg, https://salt.tikicdn.com/cache/200x280/ts/product/8d/af/01/3c0ebf1f8dd7ba277277740689e83599.jpg, https://salt.tikicdn.com/cache/200x280/ts/product/ff/5f/86/bbca9333a37b342567d336615858eb09.jpg","https://salt.tikicdn.com/cache/200x280/ts/product/02/49/6c/5f5c8faf017294e936211ec03cdc2574.jpg, https://salt.tikicdn.com/cache/200x280/ts/product/f0/7f/d0/9b11301eca62fdb6bb51f1f9738b59fc.jpg, https://salt.tikicdn.com/cache/200x280/ts/product/11/71/93/0d5911a6ab5b992f2f64ab0b1eb7a037.jpg, https://salt.tikicdn.com/cache/200x280/ts/product/4e/50/2a/bbab89e057fbde04f69b16dabec6f1a0.jpg, https://salt.tikicdn.com/cache/200x280/ts/product/52/91/f5/357cbd406689ada8d3b082783c931480.jpg, https://salt.tikicdn.com/cache/200x280/ts/product/69/22/0d/efa42672e21ea404da9ad876f4ac1f89.jpg, https://salt.tikicdn.com/cache/200x280/ts/product/7b/49/a0/ea66c24d4250869b04150868a4af056b.jpg, https://salt.tikicdn.com/cache/200x280/ts/product/8d/af/01/3c0ebf1f8dd7ba277277740689e83599.jpg, https://salt.tikicdn.com/cache/200x280/ts/product/ff/5f/86/bbca9333a37b342567d336615858eb09.jpg",1000,0
263266515,Mực lọ Hồng Hà màu tím 3468 - dành cho bút máy (dung tích 60ml),10700,"       Mực lọ Hồng Hà 3468 màu tím dung tích 60ml phù hợp cho học sinh, sinh viên.   TÍNH NĂNG NỔI BẬT   - Được làm từ nước khử ion và hóa chất an toàn cho người sử dụng.   - Viết khô nhanh - k...","Mực lọ Hồng Hà 3468 màu tím dung tích 60ml phù hợp cho học sinh, sinh viên. TÍNH NĂNG NỔI BẬT - Được làm từ nước khử ion và hóa chất an toàn cho người sử dụng. - Viết khô nhanh - không cặn - không nhòe - bền màu THÔNG SỐ KỸ THUẬT - Dung tích: 60 ± 5 ml - Khối lượng: 70 ± 2 g - Màu sắc: Tím hồng - Thương hiệu: Văn phòng phẩm Hồng Hà - Xuất xứ: Việt Nam HƯỚNG DẪN SỬ DỤNG VÀ BẢO QUẢN - Bảo quản nơi khô ráo, thoáng mát. Tránh nơi ẩm ướt hoặc nơi có nguồn nhiệt . - Đậy kín nắp sau khi sử dụng CẢNH BÁO - Để xa tầm tay trẻ em dưới 3 tuổi - Tránh nguồn nhiệt Quý khách vui lòng quay lại clip khi mở hàng để làm bằng chứng khiếu nại với shop khi gặp vấn đề liên quan đến sản phẩm. Shop chỉ giải quyết khiếu nại khi có video clip đầy đủ. Giá sản phẩm trên Tiki đã bao gồm thuế theo luật hiện hành. Bên cạnh đó, tuỳ vào loại sản phẩm, hình thức và địa chỉ giao hàng mà có thể phát sinh thêm chi phí khác như phí vận chuyển, phụ phí hàng cồng kềnh, thuế nhập khẩu (đối với đơn hàng giao từ nước ngoài có giá trị trên 1 triệu đồng).....",0,0,"https://salt.tikicdn.com/ts/product/9f/5b/ea/c20df709202cebe494de208b7beddb96.jpg, https://salt.tikicdn.com/ts/product/b2/1f/a2/3dd06fd86385a19ea3b70d33982bc051.jpg, https://salt.tikicdn.com/ts/product/97/80/38/9fba27a853d8451e2cb0fb7395c4218a.jpg, https://salt.tikicdn.com/ts/product/6a/96/16/7f0d7315131ac93de3330a7461d82cd4.jpg","https://salt.tikicdn.com/cache/w1200/ts/product/9f/5b/ea/c20df709202cebe494de208b7beddb96.jpg, https://salt.tikicdn.com/cache/w1200/ts/product/b2/1f/a2/3dd06fd86385a19ea3b70d33982bc051.jpg, https://salt.tikicdn.com/cache/w1200/ts/product/97/80/38/9fba27a853d8451e2cb0fb7395c4218a.jpg, https://salt.tikicdn.com/cache/w1200/ts/product/6a/96/16/7f0d7315131ac93de3330a7461d82cd4.jpg","https://salt.tikicdn.com/cache/w300/ts/product/9f/5b/ea/c20df709202cebe494de208b7beddb96.jpg, https://salt.tikicdn.com/cache/w300/ts/product/b2/1f/a2/3dd06fd86385a19ea3b70d33982bc051.jpg, https://salt.tikicdn.com/cache/w300/ts/product/97/80/38/9fba27a853d8451e2cb0fb7395c4218a.jpg, https://salt.tikicdn.com/cache/w300/ts/product/6a/96/16/7f0d7315131ac93de3330a7461d82cd4.jpg","https://salt.tikicdn.com/cache/200x280/ts/product/9f/5b/ea/c20df709202cebe494de208b7beddb96.jpg, https://salt.tikicdn.com/cache/200x280/ts/product/b2/1f/a2/3dd06fd86385a19ea3b70d33982bc051.jpg, https://salt.tikicdn.com/cache/200x280/ts/product/97/80/38/9fba27a853d8451e2cb0fb7395c4218a.jpg, https://salt.tikicdn.com/cache/200x280/ts/product/6a/96/16/7f0d7315131ac93de3330a7461d82cd4.jpg","https://salt.tikicdn.com/cache/200x280/ts/product/9f/5b/ea/c20df709202cebe494de208b7beddb96.jpg, https://salt.tikicdn.com/cache/200x280/ts/product/b2/1f/a2/3dd06fd86385a19ea3b70d33982bc051.jpg, https://salt.tikicdn.com/cache/200x280/ts/product/97/80/38/9fba27a853d8451e2cb0fb7395c4218a.jpg, https://salt.tikicdn.com/cache/200x280/ts/product/6a/96/16/7f0d7315131ac93de3330a7461d82cd4.jpg",1000,0
263266443,"Hộp 6 ống mực Hồng Hà 3,4mm dùng cho bút máy 2276 - (3481)",14500,"       Hộp 6 ống mực Hồng Hà 3,4mm 3481   Mực ống Hồng Hà 3481 dùng cho các loại bút viết máy - ống mực viết khô nhanh - không cặn - không nhòe. Sản phẩm được kiểm định KCS khi đưa vào sử dụng. S...","Hộp 6 ống mực Hồng Hà 3,4mm 3481 Mực ống Hồng Hà 3481 dùng cho các loại bút viết máy - ống mực viết khô nhanh - không cặn - không nhòe. Sản phẩm được kiểm định KCS khi đưa vào sử dụng. Sản phẩm có 03 màu tùy theo nhu cầu của bạn. THÔNG SỐ KỸ THUẬT - Dung tích: 0,9 ± 0,1 ml - Đường kính ống mực: 3.4 mm - Màu sắc: Xanh - Tím - Đen - Sản phẩm dùng cho bút máy: 2273, 2274,2275, 2276, - Đóng gói: 6 ống/hộp nhỏ - Thương hiệu: Văn phòng phẩm Hồng Hà - Xuất xứ: Việt Nam HƯỚNG DẪN BẢO QUẢN VÀ SỬ DỤNG - Bảo quản nơi khô ráo, thoáng mát. - Sử dụng thay thế cho piston của bút máy. CẢNH BÁO - Để xa tầm tay trẻ em Quý khách vui lòng quay lại clip khi mở hàng để làm bằng chứng khiếu nại với shop khi gặp vấn đề liên quan đến sản phẩm. Shop chỉ giải quyết khiếu nại khi có video clip đầy đủ. Để mua sỉ, mua số lượng lớn Hộp 6 ống mực Hồng Hà 3,4mm 3481, Quý khách hàng vui lòng nhắn tin trực tiếp với shop nhé. Giá sản phẩm trên Tiki đã bao gồm thuế theo luật hiện hành. Bên cạnh đó, tuỳ vào loại sản phẩm, hình thức và địa chỉ giao hàng mà có thể phát sinh thêm chi phí khác như phí vận chuyển, phụ phí hàng cồng kềnh, thuế nhập khẩu (đối với đơn hàng giao từ nước ngoài có giá trị trên 1 triệu đồng).....",0,0,"https://salt.tikicdn.com/ts/product/02/69/96/f29527f3e8f59a691777967d1944355c.jpg, https://salt.tikicdn.com/ts/product/49/af/e8/00c44eaf24efa95f12fe8fa4d0b01d21.jpg, https://salt.tikicdn.com/ts/product/f3/67/42/7336a62190c23b4da8f5ddb525342e79.jpg, https://salt.tikicdn.com/ts/product/fa/27/50/a20b297bef6d7acccf0792f451da39e1.jpg, https://salt.tikicdn.com/ts/product/08/a6/a7/3d06c1f8e38d36980eb6f341fbe65c22.jpg, https://salt.tikicdn.com/ts/product/46/1d/d1/391f819a04e904771bf313a7896165a0.jpg, https://salt.tikicdn.com/ts/product/46/ed/a6/d82f02891723405b3fdf6bfb5bcf466b.jpg","https://salt.tikicdn.com/cache/w1200/ts/product/02/69/96/f29527f3e8f59a691777967d1944355c.jpg, https://salt.tikicdn.com/cache/w1200/ts/product/49/af/e8/00c44eaf24efa95f12fe8fa4d0b01d21.jpg, https://salt.tikicdn.com/cache/w1200/ts/product/f3/67/42/7336a62190c23b4da8f5ddb525342e79.jpg, https://salt.tikicdn.com/cache/w1200/ts/product/fa/27/50/a20b297bef6d7acccf0792f451da39e1.jpg, https://salt.tikicdn.com/cache/w1200/ts/product/08/a6/a7/3d06c1f8e38d36980eb6f341fbe65c22.jpg, https://salt.tikicdn.com/cache/w1200/ts/product/46/1d/d1/391f819a04e904771bf313a7896165a0.jpg, https://salt.tikicdn.com/cache/w1200/ts/product/46/ed/a6/d82f02891723405b3fdf6bfb5bcf466b.jpg","https://salt.tikicdn.com/cache/w300/ts/product/02/69/96/f29527f3e8f59a691777967d1944355c.jpg, https://salt.tikicdn.com/cache/w300/ts/product/49/af/e8/00c44eaf24efa95f12fe8fa4d0b01d21.jpg, https://salt.tikicdn.com/cache/w300/ts/product/f3/67/42/7336a62190c23b4da8f5ddb525342e79.jpg, https://salt.tikicdn.com/cache/w300/ts/product/fa/27/50/a20b297bef6d7acccf0792f451da39e1.jpg, https://salt.tikicdn.com/cache/w300/ts/product/08/a6/a7/3d06c1f8e38d36980eb6f341fbe65c22.jpg, https://salt.tikicdn.com/cache/w300/ts/product/46/1d/d1/391f819a04e904771bf313a7896165a0.jpg, https://salt.tikicdn.com/cache/w300/ts/product/46/ed/a6/d82f02891723405b3fdf6bfb5bcf466b.jpg","https://salt.tikicdn.com/cache/200x280/ts/product/02/69/96/f29527f3e8f59a691777967d1944355c.jpg, https://salt.tikicdn.com/cache/200x280/ts/product/49/af/e8/00c44eaf24efa95f12fe8fa4d0b01d21.jpg, https://salt.tikicdn.com/cache/200x280/ts/product/f3/67/42/7336a62190c23b4da8f5ddb525342e79.jpg, https://salt.tikicdn.com/cache/200x280/ts/product/fa/27/50/a20b297bef6d7acccf0792f451da39e1.jpg, https://salt.tikicdn.com/cache/200x280/ts/product/08/a6/a7/3d06c1f8e38d36980eb6f341fbe65c22.jpg, https://salt.tikicdn.com/cache/200x280/ts/product/46/1d/d1/391f819a04e904771bf313a7896165a0.jpg, https://salt.tikicdn.com/cache/200x280/ts/product/46/ed/a6/d82f02891723405b3fdf6bfb5bcf466b.jpg","https://salt.tikicdn.com/cache/200x280/ts/product/02/69/96/f29527f3e8f59a691777967d1944355c.jpg, https://salt.tikicdn.com/cache/200x280/ts/product/49/af/e8/00c44eaf24efa95f12fe8fa4d0b01d21.jpg, https://salt.tikicdn.com/cache/200x280/ts/product/f3/67/42/7336a62190c23b4da8f5ddb525342e79.jpg, https://salt.tikicdn.com/cache/200x280/ts/product/fa/27/50/a20b297bef6d7acccf0792f451da39e1.jpg, https://salt.tikicdn.com/cache/200x280/ts/product/08/a6/a7/3d06c1f8e38d36980eb6f341fbe65c22.jpg, https://salt.tikicdn.com/cache/200x280/ts/product/46/1d/d1/391f819a04e904771bf313a7896165a0.jpg, https://salt.tikicdn.com/cache/200x280/ts/product/46/ed/a6/d82f02891723405b3fdf6bfb5bcf466b.jpg",1000,0
263105094,Mực Bút Máy Điểm 10 FPI-08/DO - Mực Xanh,11200,"    Mực Bút Máy Điểm 10 FPI-08/DO - Mực Xanh   Đặc điểm:   - Có thể dễ dàng tẩy sạch vết mực dính trên da, trên quần áo bằng nước sạch   - Mực không lem trên giấy   - Thích hợp cho các loại bút...","Mực Bút Máy Điểm 10 FPI-08/DO - Mực Xanh Đặc điểm: - Có thể dễ dàng tẩy sạch vết mực dính trên da, trên quần áo bằng nước sạch - Mực không lem trên giấy - Thích hợp cho các loại bút máy - Không độc hại, đạt tiêu chuẩn Châu Âu EN71/3, EN71/9, và Mỹ ASTM D-4236 Bảo quản: - Luôn đậy nắp ngay sau khi sử dụng. - Bảo quản nơi không ráo. - Tuyệt đối tránh lửa và nhiệt độ cao - Sản phẩm có kèm giấy hướng dẫn sử dụng trong hộp Giá sản phẩm trên Tiki đã bao gồm thuế theo luật hiện hành. Bên cạnh đó, tuỳ vào loại sản phẩm, hình thức và địa chỉ giao hàng mà có thể phát sinh thêm chi phí khác như phí vận chuyển, phụ phí hàng cồng kềnh, thuế nhập khẩu (đối với đơn hàng giao từ nước ngoài có giá trị trên 1 triệu đồng).....",0,0,"https://salt.tikicdn.com/ts/product/85/42/d7/2b2758f5269ecc1b34b99d479632dcae.jpg, https://salt.tikicdn.com/ts/product/6f/d4/89/64e14e2d5b1709354bb40381a19608b6.jpg, https://salt.tikicdn.com/ts/product/63/00/07/7789bf1ff066701353994feb8088b83f.jpg, https://salt.tikicdn.com/ts/product/4e/ef/ed/8eb0b4bb1904a1cff49709d4a59e98f1.jpg","https://salt.tikicdn.com/cache/w1200/ts/product/85/42/d7/2b2758f5269ecc1b34b99d479632dcae.jpg, https://salt.tikicdn.com/cache/w1200/ts/product/6f/d4/89/64e14e2d5b1709354bb40381a19608b6.jpg, https://salt.tikicdn.com/cache/w1200/ts/product/63/00/07/7789bf1ff066701353994feb8088b83f.jpg, https://salt.tikicdn.com/cache/w1200/ts/product/4e/ef/ed/8eb0b4bb1904a1cff49709d4a59e98f1.jpg","https://salt.tikicdn.com/cache/w300/ts/product/85/42/d7/2b2758f5269ecc1b34b99d479632dcae.jpg, https://salt.tikicdn.com/cache/w300/ts/product/6f/d4/89/64e14e2d5b1709354bb40381a19608b6.jpg, https://salt.tikicdn.com/cache/w300/ts/product/63/00/07/7789bf1ff066701353994feb8088b83f.jpg, https://salt.tikicdn.com/cache/w300/ts/product/4e/ef/ed/8eb0b4bb1904a1cff49709d4a59e98f1.jpg","https://salt.tikicdn.com/cache/200x280/ts/product/85/42/d7/2b2758f5269ecc1b34b99d479632dcae.jpg, https://salt.tikicdn.com/cache/200x280/ts/product/6f/d4/89/64e14e2d5b1709354bb40381a19608b6.jpg, https://salt.tikicdn.com/cache/200x280/ts/product/63/00/07/7789bf1ff066701353994feb8088b83f.jpg, https://salt.tikicdn.com/cache/200x280/ts/product/4e/ef/ed/8eb0b4bb1904a1cff49709d4a59e98f1.jpg","https://salt.tikicdn.com/cache/200x280/ts/product/85/42/d7/2b2758f5269ecc1b34b99d479632dcae.jpg, https://salt.tikicdn.com/cache/200x280/ts/product/6f/d4/89/64e14e2d5b1709354bb40381a19608b6.jpg, https://salt.tikicdn.com/cache/200x280/ts/product/63/00/07/7789bf1ff066701353994feb8088b83f.jpg, https://salt.tikicdn.com/cache/200x280/ts/product/4e/ef/ed/8eb0b4bb1904a1cff49709d4a59e98f1.jpg",1000,0
263105033,Mực Bút Máy Điểm 10 Thiên Long FPI-07 - Mực Xanh,9000,"    Mực Bút Máy Điểm 10 Thiên Long FPI-07 - Mực Xanh   Đặc điểm:   - Mực không lem trên giấy - Thích hợp cho các loại bút máy - Không độc hại, đạt tiêu chuẩn Châu Âu EN71/3, EN71/9, và Mỹ ASTM D-...","Mực Bút Máy Điểm 10 Thiên Long FPI-07 - Mực Xanh Đặc điểm: - Mực không lem trên giấy - Thích hợp cho các loại bút máy - Không độc hại, đạt tiêu chuẩn Châu Âu EN71/3, EN71/9, và Mỹ ASTM D-4236 Bảo quản: - Luôn đậy nắp ngay sau khi sử dụng. - Bảo quản nơi không ráo. - Tuyệt đối tránh lửa và nhiệt độ cao - Sản phẩm có kèm giấy hướng dẫn sử dụng trong hộp Giá sản phẩm trên Tiki đã bao gồm thuế theo luật hiện hành. Bên cạnh đó, tuỳ vào loại sản phẩm, hình thức và địa chỉ giao hàng mà có thể phát sinh thêm chi phí khác như phí vận chuyển, phụ phí hàng cồng kềnh, thuế nhập khẩu (đối với đơn hàng giao từ nước ngoài có giá trị trên 1 triệu đồng).....",5,1,"https://salt.tikicdn.com/ts/product/7b/2e/86/ca586e32887b04cca2ca440f87f48df6.jpg, https://salt.tikicdn.com/ts/product/81/11/88/37e18f427124488a16da6badbcd291cd.jpg, https://salt.tikicdn.com/ts/product/53/af/9d/fa0695ed10c0abdf2728e0c123ef4726.jpg, https://salt.tikicdn.com/ts/product/c5/16/91/c0dcfab507cf63c583a502931fbd61bb.jpg","https://salt.tikicdn.com/cache/w1200/ts/product/7b/2e/86/ca586e32887b04cca2ca440f87f48df6.jpg, https://salt.tikicdn.com/cache/w1200/ts/product/81/11/88/37e18f427124488a16da6badbcd291cd.jpg, https://salt.tikicdn.com/cache/w1200/ts/product/53/af/9d/fa0695ed10c0abdf2728e0c123ef4726.jpg, https://salt.tikicdn.com/cache/w1200/ts/product/c5/16/91/c0dcfab507cf63c583a502931fbd61bb.jpg","https://salt.tikicdn.com/cache/w300/ts/product/7b/2e/86/ca586e32887b04cca2ca440f87f48df6.jpg, https://salt.tikicdn.com/cache/w300/ts/product/81/11/88/37e18f427124488a16da6badbcd291cd.jpg, https://salt.tikicdn.com/cache/w300/ts/product/53/af/9d/fa0695ed10c0abdf2728e0c123ef4726.jpg, https://salt.tikicdn.com/cache/w300/ts/product/c5/16/91/c0dcfab507cf63c583a502931fbd61bb.jpg","https://salt.tikicdn.com/cache/200x280/ts/product/7b/2e/86/ca586e32887b04cca2ca440f87f48df6.jpg, https://salt.tikicdn.com/cache/200x280/ts/product/81/11/88/37e18f427124488a16da6badbcd291cd.jpg, https://salt.tikicdn.com/cache/200x280/ts/product/53/af/9d/fa0695ed10c0abdf2728e0c123ef4726.jpg, https://salt.tikicdn.com/cache/200x280/ts/product/c5/16/91/c0dcfab507cf63c583a502931fbd61bb.jpg","https://salt.tikicdn.com/cache/200x280/ts/product/7b/2e/86/ca586e32887b04cca2ca440f87f48df6.jpg, https://salt.tikicdn.com/cache/200x280/ts/product/81/11/88/37e18f427124488a16da6badbcd291cd.jpg, https://salt.tikicdn.com/cache/200x280/ts/product/53/af/9d/fa0695ed10c0abdf2728e0c123ef4726.jpg, https://salt.tikicdn.com/cache/200x280/ts/product/c5/16/91/c0dcfab507cf63c583a502931fbd61bb.jpg",1000,1
