id,name,price,short_description,description,rating_average,review_count,image_base_url,image_large_url,image_medium_url,image_small_url,image_thumbnail_url,stock,quantity_sold
121228710,Mực lọ Hồng Hà tím nhạt -  3468,7900,"Mực tím hồng Hồng Hà - 3468 là dụng cụ học tập phổ biến và đặc biệt được học sinh tiểu học yêu thích.  1. THÔNG SỐ SẢN PHẨMBên cạnh các màu mực xanh và đen, mực tím hồng Hồng Hà cũng thường xuyên nh...","Mực tím hồng Hồng Hà - 3468 là dụng cụ học tập phổ biến và đặc biệt được học sinh tiểu học yêu thích. 1. THÔNG SỐ SẢN PHẨM Bên cạnh các màu mực xanh và đen, mực tím hồng Hồng Hà cũng thường xuyên nhận được những đơn hàng đặt số lượng lớn nhờ chất lượng tốt và giá cả phải chăng. Sản phẩm có thông số kỹ thuật nổi bật như: Dung tích: 60 ml (± 5 ml) Màu sắc: Tím hồng Khối lượng: 70g (± 2 g) Đóng gói: 6 hộp/lốc; Đơn vị sản xuất: Công ty Cổ phần Văn phòng phẩm Hồng Hà Xuất xứ: Việt Nam 2. ĐẶC ĐIỂM SẢN PHẨM Mực tím hồng Hồng Hà nổi bật hơn hẳn các sản phẩm khác nhờ: Chất lượng mực: Mực Hồng Hà có thành phần là nước khử ion và hóa chất an toàn cho người sử dụng. Đồng thời, mực có khả năng khô nhanh, không  lắng cặn và khả năng bám màu tốt trên nhiều chất liệu giấy. Thiết kế: Thiết kế lọ đựng mực nhỏ gọn, tiện dụng, nắp đậy chắc chắn. Do đó, các bé có thể mang theo đi học mà không cần phải lo lắng về vấn đề đổ mực, dây mực ra cặp sách, quần áo. Độ bền: Lọ mực được làm từ nhựa cao cấp, chịu lực tốt, không giòn nứt. 3. ĐỐI TƯỢNG SỬ DỤNG Sản phẩm phù hợp với nhiều đối tượng từ học sinh, giáo viên hoặc nhân viên văn phòng yêu thích dùng bút máy. 4. CÁCH SỬ DỤNG VÀ BẢO QUẢN Cách sử dụng: Mở nắp sản phẩm và đặt ở mặt phẳng để dễ bơm mực nhất cho bút máy. Cách bảo quản: Luôn đóng nắp lọ mực sau khi sử dụng. Đặt lọ mực ở những vị trí phù hợp, hạn chế để nơi cao để tránh dây mực ra khắp nơi. Không để lọ mực gần nơi dầu mỡ, nơi có nguồn nhiệt cao, tránh xa nguồn nhiệt. Có thể nói, mực tím hồng Hồng Hà 3468 là dụng cụ học tập mang tính thiết thực, vừa tiện dụng, vừa tiết kiệm. Sản phẩm giúp khả năng tái sử dụng của bút máy được nâng cao, khách hàng có thể tiết kiệm một khoản chi phí đáng kể. ️ Quý khách vui lòng quay lại clip khi mở hàng để làm bằng chứng khiếu nại với shop khi gặp vấn đề liên quan đến sản phẩm. Shop chỉ giải quyết khiếu nại khi có video clip đầy đủ. ️ Để mua sỉ, mua số lượng lớn, Quý khách hàng vui lòng nhắn tin trực tiếp với shop. Xin cảm ơn! Liên hệ với chúng tôi để đặt mua sản phẩm nhanh chóng và tham khảo thêm nhiều dụng cụ học tập thiết thực cho con yêu tại đây . Hân hạnh phục vụ quý khách! #vanphongphamhongha #vpphongha #hongha#mucbutmay#muc#dodunghocsinh#dungcuhoctap#muconghongha ------------------------------------------------------------ HỒNG HÀ – 62 NĂM XÂY DỰNG VÀ PHÁT TRIỂN Công ty CP Văn phòng phẩm Hồng Hà được thành lập vào ngày 1/10/1959, trải qua 62 năm trưởng thành và phát triển, thương hiệu Văn phòng phẩm Hồng Hà đã để lại dấu ấn sâu đậm trong tâm trí nhiều thế hệ người tiêu dùng Việt Nam với những sản phẩm như bút Trường Sơn, Hoàn Kiếm, Hồng Hà… Với phương châm sản xuất những sản phẩm chất lượng tốt nhất phục vụ người tiêu dùng, Công ty CP Văn phòng phẩm Hồng Hà luôn không ngừng nỗ lực mang đến cho khách hàng những sản phẩm vượt trội, thân thiện với môi trường và an toàn cho sức khỏe. Hiện tại, số lượng sản phẩm mang thương hiệu Hồng Hà đã lên tới hàng ngàn sản phẩm và được chia thành 10 ngành hàng chính: – Vở viết – Sổ – Bút – Dụng cụ học sinh – Xuất bản phẩm – Họa phẩm – Đồ dùng văn phòng – Ba lô, túi cặp – Đồ chơi thông minh – Vải không dệt ------------------------------------------------------------- "" Hân hạnh phục vụ bạn!"" Giá sản phẩm trên Tiki đã bao gồm thuế theo luật hiện hành. Bên cạnh đó, tuỳ vào loại sản phẩm, hình thức và địa chỉ giao hàng mà có thể phát sinh thêm chi phí khác như phí vận chuyển, phụ phí hàng cồng kềnh, thuế nhập khẩu (đối với đơn hàng giao từ nước ngoài có giá trị trên 1 triệu đồng).....",5,7,"https://salt.tikicdn.com/ts/product/9f/5b/ea/9fd7db276ca4bd44cc4736a738720a10.jpg, https://salt.tikicdn.com/ts/product/b2/1f/a2/4a3406a1672ba4b5a61009f6e6b2fd9b.jpg, https://salt.tikicdn.com/ts/product/97/80/38/27d588fb4fc31321db7175290212b619.jpg, https://salt.tikicdn.com/ts/product/6a/96/16/4de5d1e41dbd3e8dfb2b1ebaa8a2309b.jpg","https://salt.tikicdn.com/cache/w1200/ts/product/9f/5b/ea/9fd7db276ca4bd44cc4736a738720a10.jpg, https://salt.tikicdn.com/cache/w1200/ts/product/b2/1f/a2/4a3406a1672ba4b5a61009f6e6b2fd9b.jpg, https://salt.tikicdn.com/cache/w1200/ts/product/97/80/38/27d588fb4fc31321db7175290212b619.jpg, https://salt.tikicdn.com/cache/w1200/ts/product/6a/96/16/4de5d1e41dbd3e8dfb2b1ebaa8a2309b.jpg","https://salt.tikicdn.com/cache/w300/ts/product/9f/5b/ea/9fd7db276ca4bd44cc4736a738720a10.jpg, https://salt.tikicdn.com/cache/w300/ts/product/b2/1f/a2/4a3406a1672ba4b5a61009f6e6b2fd9b.jpg, https://salt.tikicdn.com/cache/w300/ts/product/97/80/38/27d588fb4fc31321db7175290212b619.jpg, https://salt.tikicdn.com/cache/w300/ts/product/6a/96/16/4de5d1e41dbd3e8dfb2b1ebaa8a2309b.jpg","https://salt.tikicdn.com/cache/200x280/ts/product/9f/5b/ea/9fd7db276ca4bd44cc4736a738720a10.jpg, https://salt.tikicdn.com/cache/200x280/ts/product/b2/1f/a2/4a3406a1672ba4b5a61009f6e6b2fd9b.jpg, https://salt.tikicdn.com/cache/200x280/ts/product/97/80/38/27d588fb4fc31321db7175290212b619.jpg, https://salt.tikicdn.com/cache/200x280/ts/product/6a/96/16/4de5d1e41dbd3e8dfb2b1ebaa8a2309b.jpg","https://salt.tikicdn.com/cache/200x280/ts/product/9f/5b/ea/9fd7db276ca4bd44cc4736a738720a10.jpg, https://salt.tikicdn.com/cache/200x280/ts/product/b2/1f/a2/4a3406a1672ba4b5a61009f6e6b2fd9b.jpg, https://salt.tikicdn.com/cache/200x280/ts/product/97/80/38/27d588fb4fc31321db7175290212b619.jpg, https://salt.tikicdn.com/cache/200x280/ts/product/6a/96/16/4de5d1e41dbd3e8dfb2b1ebaa8a2309b.jpg",1000,7
120472249,Hộp 10 Ống Mực Bút Máy FPIC-01 - Mực Tím,18000,"Hộp 10 Ống Mực Bút Máy FPIC-01 - Mực Tím   Được làm từ nhựa trong, mềm, dễ sử dụng, phù hợp cho các loại bút máy chuyên sử dụng ống mực như FTC-01, FTC-02 và một số loại bút chuyên sử dụng ống mực kh...","Hộp 10 Ống Mực Bút Máy FPIC-01 - Mực Tím Được làm từ nhựa trong, mềm, dễ sử dụng, phù hợp cho các loại bút máy chuyên sử dụng ống mực như FTC-01, FTC-02 và một số loại bút chuyên sử dụng ống mực khác có trên thị trường. Dễ dàng thay thế, cắm là sử dụng, tiện lợi và không lo bị bẩn tay như bơm mực truyền thống. Dung lượng 0.7 ml, viết được trên 10 trang giấy đủ để học sinh sử dụng trong một ngày học. Giá sản phẩm trên Tiki đã bao gồm thuế theo luật hiện hành. Bên cạnh đó, tuỳ vào loại sản phẩm, hình thức và địa chỉ giao hàng mà có thể phát sinh thêm chi phí khác như phí vận chuyển, phụ phí hàng cồng kềnh, thuế nhập khẩu (đối với đơn hàng giao từ nước ngoài có giá trị trên 1 triệu đồng).....",0,0,"https://salt.tikicdn.com/ts/product/f9/1f/1f/9a542d8992a5f1c48a8652e3cdefdc5f.jpg, https://salt.tikicdn.com/ts/product/f9/1f/1f/26570b3cd4054e4da0e10f1c8e8b4967.jpg, https://salt.tikicdn.com/ts/product/36/21/d2/57ff9ec0f59810eedcce5504ea4f6444.jpg, https://salt.tikicdn.com/ts/product/84/9f/63/a0011dbe10e414375b686da030a0e0a1.jpg, https://salt.tikicdn.com/ts/product/0c/90/b6/25d7cb3dcc3026f9880fbca0bf48eaad.jpg, https://salt.tikicdn.com/ts/product/e7/55/85/b3bc8ad7ff9aece452b0006c22dea032.jpg","https://salt.tikicdn.com/cache/w1200/ts/product/f9/1f/1f/9a542d8992a5f1c48a8652e3cdefdc5f.jpg, https://salt.tikicdn.com/cache/w1200/ts/product/f9/1f/1f/26570b3cd4054e4da0e10f1c8e8b4967.jpg, https://salt.tikicdn.com/cache/w1200/ts/product/36/21/d2/57ff9ec0f59810eedcce5504ea4f6444.jpg, https://salt.tikicdn.com/cache/w1200/ts/product/84/9f/63/a0011dbe10e414375b686da030a0e0a1.jpg, https://salt.tikicdn.com/cache/w1200/ts/product/0c/90/b6/25d7cb3dcc3026f9880fbca0bf48eaad.jpg, https://salt.tikicdn.com/cache/w1200/ts/product/e7/55/85/b3bc8ad7ff9aece452b0006c22dea032.jpg","https://salt.tikicdn.com/cache/w300/ts/product/f9/1f/1f/9a542d8992a5f1c48a8652e3cdefdc5f.jpg, https://salt.tikicdn.com/cache/w300/ts/product/f9/1f/1f/26570b3cd4054e4da0e10f1c8e8b4967.jpg, https://salt.tikicdn.com/cache/w300/ts/product/36/21/d2/57ff9ec0f59810eedcce5504ea4f6444.jpg, https://salt.tikicdn.com/cache/w300/ts/product/84/9f/63/a0011dbe10e414375b686da030a0e0a1.jpg, https://salt.tikicdn.com/cache/w300/ts/product/0c/90/b6/25d7cb3dcc3026f9880fbca0bf48eaad.jpg, https://salt.tikicdn.com/cache/w300/ts/product/e7/55/85/b3bc8ad7ff9aece452b0006c22dea032.jpg","https://salt.tikicdn.com/cache/200x280/ts/product/f9/1f/1f/9a542d8992a5f1c48a8652e3cdefdc5f.jpg, https://salt.tikicdn.com/cache/200x280/ts/product/f9/1f/1f/26570b3cd4054e4da0e10f1c8e8b4967.jpg, https://salt.tikicdn.com/cache/200x280/ts/product/36/21/d2/57ff9ec0f59810eedcce5504ea4f6444.jpg, https://salt.tikicdn.com/cache/200x280/ts/product/84/9f/63/a0011dbe10e414375b686da030a0e0a1.jpg, https://salt.tikicdn.com/cache/200x280/ts/product/0c/90/b6/25d7cb3dcc3026f9880fbca0bf48eaad.jpg, https://salt.tikicdn.com/cache/200x280/ts/product/e7/55/85/b3bc8ad7ff9aece452b0006c22dea032.jpg","https://salt.tikicdn.com/cache/200x280/ts/product/f9/1f/1f/9a542d8992a5f1c48a8652e3cdefdc5f.jpg, https://salt.tikicdn.com/cache/200x280/ts/product/f9/1f/1f/26570b3cd4054e4da0e10f1c8e8b4967.jpg, https://salt.tikicdn.com/cache/200x280/ts/product/36/21/d2/57ff9ec0f59810eedcce5504ea4f6444.jpg, https://salt.tikicdn.com/cache/200x280/ts/product/84/9f/63/a0011dbe10e414375b686da030a0e0a1.jpg, https://salt.tikicdn.com/cache/200x280/ts/product/0c/90/b6/25d7cb3dcc3026f9880fbca0bf48eaad.jpg, https://salt.tikicdn.com/cache/200x280/ts/product/e7/55/85/b3bc8ad7ff9aece452b0006c22dea032.jpg",1000,0
119026575,Mực Bút Lông Dầu Flexoffice FO-PMI02 - Mực Đỏ,12300,"Mực Bút Lông Dầu Flexoffice FO-PMI02 - Mực Đỏ   Mực tươi sáng, bám dính tốt, không độc hại (theo tiêu chuẩn Châu Âu và Mỹ).   Thiết kế hộp khoa học giúp tránh bay hơi và chảy mự   Van tiết lưu giúp...","Mực Bút Lông Dầu Flexoffice FO-PMI02 - Mực Đỏ Mực tươi sáng, bám dính tốt, không độc hại (theo tiêu chuẩn Châu Âu và Mỹ). Thiết kế hộp khoa học giúp tránh bay hơi và chảy mự Van tiết lưu giúp mực luôn nhỏ thành dạng giọt khi bơm, giúp cho việc bơm mực dễ dàng và thuận tiện. Kiểu dáng lọ có đầu bơm nhỏ , dài thuận tiện cho việc châm thêm mực vào ruột bút. Giá sản phẩm trên Tiki đã bao gồm thuế theo luật hiện hành. Bên cạnh đó, tuỳ vào loại sản phẩm, hình thức và địa chỉ giao hàng mà có thể phát sinh thêm chi phí khác như phí vận chuyển, phụ phí hàng cồng kềnh, thuế nhập khẩu (đối với đơn hàng giao từ nước ngoài có giá trị trên 1 triệu đồng).....",0,0,"https://salt.tikicdn.com/ts/product/91/fe/cd/3bc291983f4b97420eb3ca0f6ad7dc35.jpg, https://salt.tikicdn.com/ts/product/3e/87/1b/eb889bed4ab55880808402b55f7803e0.jpg, https://salt.tikicdn.com/ts/product/93/d5/f6/3f6d0df45ec0016f74af337a3f3de52d.jpg, https://salt.tikicdn.com/ts/product/e8/67/ee/7c3bc5503b470485bcd0cb4144dccb40.jpg","https://salt.tikicdn.com/cache/w1200/ts/product/91/fe/cd/3bc291983f4b97420eb3ca0f6ad7dc35.jpg, https://salt.tikicdn.com/cache/w1200/ts/product/3e/87/1b/eb889bed4ab55880808402b55f7803e0.jpg, https://salt.tikicdn.com/cache/w1200/ts/product/93/d5/f6/3f6d0df45ec0016f74af337a3f3de52d.jpg, https://salt.tikicdn.com/cache/w1200/ts/product/e8/67/ee/7c3bc5503b470485bcd0cb4144dccb40.jpg","https://salt.tikicdn.com/cache/w300/ts/product/91/fe/cd/3bc291983f4b97420eb3ca0f6ad7dc35.jpg, https://salt.tikicdn.com/cache/w300/ts/product/3e/87/1b/eb889bed4ab55880808402b55f7803e0.jpg, https://salt.tikicdn.com/cache/w300/ts/product/93/d5/f6/3f6d0df45ec0016f74af337a3f3de52d.jpg, https://salt.tikicdn.com/cache/w300/ts/product/e8/67/ee/7c3bc5503b470485bcd0cb4144dccb40.jpg","https://salt.tikicdn.com/cache/200x280/ts/product/91/fe/cd/3bc291983f4b97420eb3ca0f6ad7dc35.jpg, https://salt.tikicdn.com/cache/200x280/ts/product/3e/87/1b/eb889bed4ab55880808402b55f7803e0.jpg, https://salt.tikicdn.com/cache/200x280/ts/product/93/d5/f6/3f6d0df45ec0016f74af337a3f3de52d.jpg, https://salt.tikicdn.com/cache/200x280/ts/product/e8/67/ee/7c3bc5503b470485bcd0cb4144dccb40.jpg","https://salt.tikicdn.com/cache/200x280/ts/product/91/fe/cd/3bc291983f4b97420eb3ca0f6ad7dc35.jpg, https://salt.tikicdn.com/cache/200x280/ts/product/3e/87/1b/eb889bed4ab55880808402b55f7803e0.jpg, https://salt.tikicdn.com/cache/200x280/ts/product/93/d5/f6/3f6d0df45ec0016f74af337a3f3de52d.jpg, https://salt.tikicdn.com/cache/200x280/ts/product/e8/67/ee/7c3bc5503b470485bcd0cb4144dccb40.jpg",1000,0
115767413,Mực bút máy Quink cao cấp PARKER,212400,Thông số kĩ thuật :Tên danh mụcMực bút máy cao cấp ParkerThương hiệuParkerLoại mựcQuinkMàu mựcXanh / ĐenDung tích57 mlMực bút máy cao cấp PARKER được Công ty cổ phần tập đoàn Thiên Long phâ...,"Thông số kĩ thuật : Tên danh mục Mực bút máy cao cấp Parker Thương hiệu Parker Loại mực Quink Màu mực Xanh / Đen Dung tích 57 ml Mực bút máy cao cấp PARKER được Công ty cổ phần tập đoàn Thiên Long phân phối chính thức tại Việt Nam. Giá sản phẩm trên Tiki đã bao gồm thuế theo luật hiện hành. Bên cạnh đó, tuỳ vào loại sản phẩm, hình thức và địa chỉ giao hàng mà có thể phát sinh thêm chi phí khác như phí vận chuyển, phụ phí hàng cồng kềnh, thuế nhập khẩu (đối với đơn hàng giao từ nước ngoài có giá trị trên 1 triệu đồng).....",4.7,50,"https://salt.tikicdn.com/ts/product/5f/be/d6/9d2cee16322edaaff3e34808e8515bb5.jpg, https://salt.tikicdn.com/ts/product/bf/ec/06/35d018be31158d68d4ef602248ba203e.jpg","https://salt.tikicdn.com/cache/w1200/ts/product/5f/be/d6/9d2cee16322edaaff3e34808e8515bb5.jpg, https://salt.tikicdn.com/cache/w1200/ts/product/bf/ec/06/35d018be31158d68d4ef602248ba203e.jpg","https://salt.tikicdn.com/cache/w300/ts/product/5f/be/d6/9d2cee16322edaaff3e34808e8515bb5.jpg, https://salt.tikicdn.com/cache/w300/ts/product/bf/ec/06/35d018be31158d68d4ef602248ba203e.jpg","https://salt.tikicdn.com/cache/200x280/ts/product/5f/be/d6/9d2cee16322edaaff3e34808e8515bb5.jpg, https://salt.tikicdn.com/cache/200x280/ts/product/bf/ec/06/35d018be31158d68d4ef602248ba203e.jpg","https://salt.tikicdn.com/cache/200x280/ts/product/5f/be/d6/9d2cee16322edaaff3e34808e8515bb5.jpg, https://salt.tikicdn.com/cache/200x280/ts/product/bf/ec/06/35d018be31158d68d4ef602248ba203e.jpg",1000,50
97503137,Mực Viết Máy Queen - Mực Tím,16600,"Mực Viết Máy Queen   Những chiếc bút mực là vật dụng gắn bó trong suốt quãng đời đi học với các em học sinh.   Để viết được nét chữ nhanh, đẹp và không bị dây bẩn, các em cần lựa chọn loại mực có ch...","Mực Viết Máy Queen Những chiếc bút mực là vật dụng gắn bó trong suốt quãng đời đi học với các em học sinh. Để viết được nét chữ nhanh, đẹp và không bị dây bẩn, các em cần lựa chọn loại mực có chất lượng tốt. Sản phẩm Mực Queen có màu mực đẹp, rõ nét, không bị nhòe và bay màu sẽ là sự lựa chọn tuyệt vời cho các em. Mực Queen phù hợp với tất cả các dòng bút máy, mực không bị lắng cặn nên sẽ giúp bảo trì ngòi bút hiệu quả hơn so với các dòng mực thông thường. Mực Queen có dung tích 30ml giúp bạn có thể sử dụng được nhiều lần, lâu dài mà vẫn đảm bảo chất lượng của sản phẩm. Giá sản phẩm trên Tiki đã bao gồm thuế theo luật hiện hành. Bên cạnh đó, tuỳ vào loại sản phẩm, hình thức và địa chỉ giao hàng mà có thể phát sinh thêm chi phí khác như phí vận chuyển, phụ phí hàng cồng kềnh, thuế nhập khẩu (đối với đơn hàng giao từ nước ngoài có giá trị trên 1 triệu đồng).....",5,14,"https://salt.tikicdn.com/ts/product/2d/4a/93/5c66a1dc07458038e599a09e05db5d6b.jpg, https://salt.tikicdn.com/ts/product/5a/76/52/17fb1f47b90663b1554713c2c8c4bff4.jpg, https://salt.tikicdn.com/ts/product/73/de/46/052fec667583bc6b45834667d44cf422.jpg","https://salt.tikicdn.com/cache/w1200/ts/product/2d/4a/93/5c66a1dc07458038e599a09e05db5d6b.jpg, https://salt.tikicdn.com/cache/w1200/ts/product/5a/76/52/17fb1f47b90663b1554713c2c8c4bff4.jpg, https://salt.tikicdn.com/cache/w1200/ts/product/73/de/46/052fec667583bc6b45834667d44cf422.jpg","https://salt.tikicdn.com/cache/w300/ts/product/2d/4a/93/5c66a1dc07458038e599a09e05db5d6b.jpg, https://salt.tikicdn.com/cache/w300/ts/product/5a/76/52/17fb1f47b90663b1554713c2c8c4bff4.jpg, https://salt.tikicdn.com/cache/w300/ts/product/73/de/46/052fec667583bc6b45834667d44cf422.jpg","https://salt.tikicdn.com/cache/200x280/ts/product/2d/4a/93/5c66a1dc07458038e599a09e05db5d6b.jpg, https://salt.tikicdn.com/cache/200x280/ts/product/5a/76/52/17fb1f47b90663b1554713c2c8c4bff4.jpg, https://salt.tikicdn.com/cache/200x280/ts/product/73/de/46/052fec667583bc6b45834667d44cf422.jpg","https://salt.tikicdn.com/cache/200x280/ts/product/2d/4a/93/5c66a1dc07458038e599a09e05db5d6b.jpg, https://salt.tikicdn.com/cache/200x280/ts/product/5a/76/52/17fb1f47b90663b1554713c2c8c4bff4.jpg, https://salt.tikicdn.com/cache/200x280/ts/product/73/de/46/052fec667583bc6b45834667d44cf422.jpg",1000,14
73207703,Hộp 5 Ống Mực Parker 1950382 - Mực Đen,116100,"Hộp 5 Ống Mực Parker 1950382 - Mực Đen   Được thiết kế dùng cho các dòng bút máy Parker, giúp bạn dễ dàng hơn trong việc thay thế lõi mực, dù ở bất kì nơi đâu.    Ghép nối dễ dàng giúp thay mực...","Hộp 5 Ống Mực Parker 1950382 - Mực Đen Được thiết kế dùng cho các dòng bút máy Parker, giúp bạn dễ dàng hơn trong việc thay thế lõi mực, dù ở bất kì nơi đâu. Ghép nối dễ dàng giúp thay mực bút ở bất kì nơi đâu, tiết kiệm thời gian và công sức cho bạn. Mực Parker ER QUINK đậm màu trơn tru và khô lại nhanh chóng, tránh mực nhòe khi viết trên trang giấy. Sản phẩm chỉ dành riêng cho dòng bút máy Parker. Màu mực cực đậm, mực khô nhanh chóng, mịn màng giúp bạn trải nghiệm những nét chữ uyển chuyển, đầy đặn. Bạn sẽ tận hưởng những vệt mực đẹp mắt ngay khi ngòi bút chạm vào giấy. Giá sản phẩm trên Tiki đã bao gồm thuế theo luật hiện hành. Bên cạnh đó, tuỳ vào loại sản phẩm, hình thức và địa chỉ giao hàng mà có thể phát sinh thêm chi phí khác như phí vận chuyển, phụ phí hàng cồng kềnh, thuế nhập khẩu (đối với đơn hàng giao từ nước ngoài có giá trị trên 1 triệu đồng).....",5,1,"https://salt.tikicdn.com/ts/product/1c/17/b1/3187f4f1c821ddc6eee0566a3805c8cf.jpg, https://salt.tikicdn.com/ts/product/20/b2/52/1fb32f99103439ebc9cccb1b5024d9bf.jpg, https://salt.tikicdn.com/ts/product/ec/50/50/c092304b1942b51e28b69ff2449a239e.jpg, https://salt.tikicdn.com/ts/product/3c/aa/b3/8fe900e5627f3595c415e5d5632fd4be.jpg","https://salt.tikicdn.com/cache/w1200/ts/product/1c/17/b1/3187f4f1c821ddc6eee0566a3805c8cf.jpg, https://salt.tikicdn.com/cache/w1200/ts/product/20/b2/52/1fb32f99103439ebc9cccb1b5024d9bf.jpg, https://salt.tikicdn.com/cache/w1200/ts/product/ec/50/50/c092304b1942b51e28b69ff2449a239e.jpg, https://salt.tikicdn.com/cache/w1200/ts/product/3c/aa/b3/8fe900e5627f3595c415e5d5632fd4be.jpg","https://salt.tikicdn.com/cache/w300/ts/product/1c/17/b1/3187f4f1c821ddc6eee0566a3805c8cf.jpg, https://salt.tikicdn.com/cache/w300/ts/product/20/b2/52/1fb32f99103439ebc9cccb1b5024d9bf.jpg, https://salt.tikicdn.com/cache/w300/ts/product/ec/50/50/c092304b1942b51e28b69ff2449a239e.jpg, https://salt.tikicdn.com/cache/w300/ts/product/3c/aa/b3/8fe900e5627f3595c415e5d5632fd4be.jpg","https://salt.tikicdn.com/cache/200x280/ts/product/1c/17/b1/3187f4f1c821ddc6eee0566a3805c8cf.jpg, https://salt.tikicdn.com/cache/200x280/ts/product/20/b2/52/1fb32f99103439ebc9cccb1b5024d9bf.jpg, https://salt.tikicdn.com/cache/200x280/ts/product/ec/50/50/c092304b1942b51e28b69ff2449a239e.jpg, https://salt.tikicdn.com/cache/200x280/ts/product/3c/aa/b3/8fe900e5627f3595c415e5d5632fd4be.jpg","https://salt.tikicdn.com/cache/200x280/ts/product/1c/17/b1/3187f4f1c821ddc6eee0566a3805c8cf.jpg, https://salt.tikicdn.com/cache/200x280/ts/product/20/b2/52/1fb32f99103439ebc9cccb1b5024d9bf.jpg, https://salt.tikicdn.com/cache/200x280/ts/product/ec/50/50/c092304b1942b51e28b69ff2449a239e.jpg, https://salt.tikicdn.com/cache/200x280/ts/product/3c/aa/b3/8fe900e5627f3595c415e5d5632fd4be.jpg",1000,1
34357670,Mực bút máy Thiên Long Điểm 10 FPI-07,6700,Mô tả sản phẩmThông số kĩ thuật :Tên danh mụcMực bút máyThương hiệuĐiểm 10Dung tích mực40 mlĐóng gói1 lọ/hộpTrọng lượng63 gramMàu mựcXanh/Tím/ĐenĐặc điểm:- Mực không lem trên giấy-...,"Mô tả sản phẩm Thông số kĩ thuật : Tên danh mục Mực bút máy Thương hiệu Điểm 10 Dung tích mực 40 ml Đóng gói 1 lọ/hộp Trọng lượng 63 gram Màu mực Xanh/Tím/Đen Đặc điểm: - Mực không lem trên giấy - Thích hợp cho các loại bút máy - Không độc hại, đạt tiêu chuẩn Châu Âu EN71/3, EN71/9, và Mỹ ASTM D-4236 Bảo quản: - Luôn đậy nắp ngay sau khi sử dụng. - Bảo quản nơi khô ráo. - Tuyệt đối tránh lửa và nhiệt độ cao - Sản phẩm có kèm giấy hướng dẫn sử dụng trong hộp Giá sản phẩm trên Tiki đã bao gồm thuế theo luật hiện hành. Bên cạnh đó, tuỳ vào loại sản phẩm, hình thức và địa chỉ giao hàng mà có thể phát sinh thêm chi phí khác như phí vận chuyển, phụ phí hàng cồng kềnh, thuế nhập khẩu (đối với đơn hàng giao từ nước ngoài có giá trị trên 1 triệu đồng).....",4.3,28,"https://salt.tikicdn.com/ts/product/cd/d8/cf/efd04574503378a6c713df9c2f1e2cc5.jpg, https://salt.tikicdn.com/ts/product/e6/b1/8b/5c60fb35c1f66e7a28e033e5b79e1b11.jpg","https://salt.tikicdn.com/cache/w1200/ts/product/cd/d8/cf/efd04574503378a6c713df9c2f1e2cc5.jpg, https://salt.tikicdn.com/cache/w1200/ts/product/e6/b1/8b/5c60fb35c1f66e7a28e033e5b79e1b11.jpg","https://salt.tikicdn.com/cache/w300/ts/product/cd/d8/cf/efd04574503378a6c713df9c2f1e2cc5.jpg, https://salt.tikicdn.com/cache/w300/ts/product/e6/b1/8b/5c60fb35c1f66e7a28e033e5b79e1b11.jpg","https://salt.tikicdn.com/cache/200x280/ts/product/cd/d8/cf/efd04574503378a6c713df9c2f1e2cc5.jpg, https://salt.tikicdn.com/cache/200x280/ts/product/e6/b1/8b/5c60fb35c1f66e7a28e033e5b79e1b11.jpg","https://salt.tikicdn.com/cache/200x280/ts/product/cd/d8/cf/efd04574503378a6c713df9c2f1e2cc5.jpg, https://salt.tikicdn.com/cache/200x280/ts/product/e6/b1/8b/5c60fb35c1f66e7a28e033e5b79e1b11.jpg",1000,28
