id,name,price,short_description,description,rating_average,review_count,image_base_url,image_large_url,image_medium_url,image_small_url,image_thumbnail_url,stock,quantity_sold
147799064,Hộp 8 Mực Bút Máy Thiên Long FPI-08/DO (40ml x 8),78000,"Hộp 8 Mực Bút Máy Thiên Long FPI-08/DO - Tím được các em học sinh cấp 1, cấp 2 sử dụng thường xuyên. Đây là loại mực chuyên dùng cho bút máy học sinh. Dung tích 40ml, sử dụng lâu dài, tiết kiệm.Thiế...","Hộp 8 Mực Bút Máy Thiên Long FPI-08/DO - Tím được các em học sinh cấp 1, cấp 2 sử dụng thường xuyên. Đây là loại mực chuyên dùng cho bút máy học sinh. Dung tích 40ml, sử dụng lâu dài, tiết kiệm. Thiết kế lọ đựng mực nhỏ gọn, tiện dụng, nắp đậy chắc chắn giúp mực không bị đổ, không dây ra ngoài, nhất là khi các em mang theo khi đi học. Chất liệu nhựa cao cấp, chịu lực tốt, không giòn nứt. Đây là loại mực có thể viết tốt trên nhiều chất liệu giấy. Mực đậm, độ bền màu cực cao, hạn chế phai màu, lem nhòe trong thời gian dài. Sản phẩm được kiểm định và chứng nhận không độc hại, an toàn với sức khỏe. Sản phẩm được đánh giá là dòng văn phòng phẩm mang tính thiết thực, vừa tiện dụng, vừa tiết kiệm. Khả năng tái sử dụng của bút máy nhờ đó được nâng cao. Khi bút hết mực chỉ việc thay mực dễ dàng, bạn sẽ tiết kiệm một khoản chi phí đáng kể. Giá sản phẩm trên Tiki đã bao gồm thuế theo luật hiện hành. Bên cạnh đó, tuỳ vào loại sản phẩm, hình thức và địa chỉ giao hàng mà có thể phát sinh thêm chi phí khác như phí vận chuyển, phụ phí hàng cồng kềnh, thuế nhập khẩu (đối với đơn hàng giao từ nước ngoài có giá trị trên 1 triệu đồng).....",5,7,"https://salt.tikicdn.com/ts/product/b8/a6/a8/1b5ec8975d1305527f41f3ac45945567.jpg, https://salt.tikicdn.com/media/catalog/producttmp/da/a7/1b/b93cab42a851e7aaf068721315896107.jpg, https://salt.tikicdn.com/ts/product/af/ce/a6/eb0355ca2140ebd113025b2cde6ddb99.jpg, https://salt.tikicdn.com/ts/product/84/e0/75/0e4fa0051a10a28b52eafbf9668a8f18.jpg, https://salt.tikicdn.com/ts/product/92/f7/2b/b77656f71291cf8e67e0e20057913535.jpg, https://salt.tikicdn.com/ts/product/7a/fe/1f/155d1f17229b7f1e488c420d90a9bd25.jpg","https://salt.tikicdn.com/cache/w1200/ts/product/b8/a6/a8/1b5ec8975d1305527f41f3ac45945567.jpg, https://salt.tikicdn.com/cache/w1200/media/catalog/producttmp/da/a7/1b/b93cab42a851e7aaf068721315896107.jpg, https://salt.tikicdn.com/cache/w1200/ts/product/af/ce/a6/eb0355ca2140ebd113025b2cde6ddb99.jpg, https://salt.tikicdn.com/cache/w1200/ts/product/84/e0/75/0e4fa0051a10a28b52eafbf9668a8f18.jpg, https://salt.tikicdn.com/cache/w1200/ts/product/92/f7/2b/b77656f71291cf8e67e0e20057913535.jpg, https://salt.tikicdn.com/cache/w1200/ts/product/7a/fe/1f/155d1f17229b7f1e488c420d90a9bd25.jpg","https://salt.tikicdn.com/cache/w300/ts/product/b8/a6/a8/1b5ec8975d1305527f41f3ac45945567.jpg, https://salt.tikicdn.com/cache/w300/media/catalog/producttmp/da/a7/1b/b93cab42a851e7aaf068721315896107.jpg, https://salt.tikicdn.com/cache/w300/ts/product/af/ce/a6/eb0355ca2140ebd113025b2cde6ddb99.jpg, https://salt.tikicdn.com/cache/w300/ts/product/84/e0/75/0e4fa0051a10a28b52eafbf9668a8f18.jpg, https://salt.tikicdn.com/cache/w300/ts/product/92/f7/2b/b77656f71291cf8e67e0e20057913535.jpg, https://salt.tikicdn.com/cache/w300/ts/product/7a/fe/1f/155d1f17229b7f1e488c420d90a9bd25.jpg","https://salt.tikicdn.com/cache/200x280/ts/product/b8/a6/a8/1b5ec8975d1305527f41f3ac45945567.jpg, https://salt.tikicdn.com/cache/200x280/media/catalog/producttmp/da/a7/1b/b93cab42a851e7aaf068721315896107.jpg, https://salt.tikicdn.com/cache/200x280/ts/product/af/ce/a6/eb0355ca2140ebd113025b2cde6ddb99.jpg, https://salt.tikicdn.com/cache/200x280/ts/product/84/e0/75/0e4fa0051a10a28b52eafbf9668a8f18.jpg, https://salt.tikicdn.com/cache/200x280/ts/product/92/f7/2b/b77656f71291cf8e67e0e20057913535.jpg, https://salt.tikicdn.com/cache/200x280/ts/product/7a/fe/1f/155d1f17229b7f1e488c420d90a9bd25.jpg","https://salt.tikicdn.com/cache/200x280/ts/product/b8/a6/a8/1b5ec8975d1305527f41f3ac45945567.jpg, https://salt.tikicdn.com/cache/200x280/media/catalog/producttmp/da/a7/1b/b93cab42a851e7aaf068721315896107.jpg, https://salt.tikicdn.com/cache/200x280/ts/product/af/ce/a6/eb0355ca2140ebd113025b2cde6ddb99.jpg, https://salt.tikicdn.com/cache/200x280/ts/product/84/e0/75/0e4fa0051a10a28b52eafbf9668a8f18.jpg, https://salt.tikicdn.com/cache/200x280/ts/product/92/f7/2b/b77656f71291cf8e67e0e20057913535.jpg, https://salt.tikicdn.com/cache/200x280/ts/product/7a/fe/1f/155d1f17229b7f1e488c420d90a9bd25.jpg",1000,7
131843719,Ống mực Đức Hồng Hà đen 2.5mm (hộp 6 ống) - 3479,11400,Ống mực Hồng Hà đen -  3479 dùng cho các loại bút viết máy - ống mực viết khô nhanh - không cặn - không nhòe. Sản phẩm được kiểm tra KCS trước khi lưu hành trên thị trường. Sản phẩm thích hợp với các ...,"Ống mực Hồng Hà đen -  3479 dùng cho các loại bút viết máy - ống mực viết khô nhanh - không cặn - không nhòe. Sản phẩm được kiểm tra KCS trước khi lưu hành trên thị trường. Sản phẩm thích hợp với các sản phẩm bút máy trên thị trường. 1. THÔNG SỐ SẢN PHẨM: Dung tích:   0,6 ± 0,1 ml Màu sắc:      Đen Khối lượng: 1,3 ± 0,1 g Đóng gói:     6 ống/hộp nhỏ Sản xuất tại: Công ty Cổ phần Văn phòng phẩm Hồng Hà Xuất xứ:       Việt Nam 2. ĐẶC ĐIỂM SẢN PHẨM Mực ống Hồng Hà 3479 dùng cho các loại bút viết máy - ống mực viết khô nhanh - không cặn - không nhòe. Sản phẩm được kiểm tra KCS trước khi lưu hành trên thị trường. Sản phẩm thích hợp với các sản phẩm bút máy trên thị trường. 3. ĐỐI TƯỢNG SỬ DỤNG Phù hợp với mọi đối tượng sử dụng bút máy, có kích thước ống mực sử dụng phù hợp 4. CÁCH SỬ DỤNG VÀ BẢO QUẢN Bảo quản nơi khô ráo, thoáng mát Để xa nguồn nhiệt Có chi thiết nhỏ nên để xa tầm tay trẻ em dưới 3 tuổi ️ Quý khách vui lòng quay lại clip khi mở hàng để làm bằng chứng khiếu nại với shop khi gặp vấn đề liên quan đến sản phẩm. Shop chỉ giải quyết khiếu nại khi có video clip đầy đủ. ️ Để mua sỉ, mua số lượng lớn, Quý khách hàng vui lòng nhắn tin trực tiếp với shop. Xin cảm ơn! Liên hệ với chúng tôi để đặt mua sản phẩm nhanh chóng và tham khảo thêm nhiều dụng cụ học tập thiết thực cho con yêu tại đây . Hân hạnh phục vụ quý khách! #vanphongphamhongha #vpphongha #hongha#ongmuc#muc#dodunghocsinh#dungcuhoctap#muconghongha ------------------------------------------------------------ HỒNG HÀ – 62 NĂM XÂY DỰNG VÀ PHÁT TRIỂN Công ty CP Văn phòng phẩm Hồng Hà được thành lập vào ngày 1/10/1959, trải qua 62 năm trưởng thành và phát triển, thương hiệu Văn phòng phẩm Hồng Hà đã để lại dấu ấn sâu đậm trong tâm trí nhiều thế hệ người tiêu dùng Việt Nam với những sản phẩm như bút Trường Sơn, Hoàn Kiếm, Hồng Hà… Với phương châm sản xuất những sản phẩm chất lượng tốt nhất phục vụ người tiêu dùng, Công ty CP Văn phòng phẩm Hồng Hà luôn không ngừng nỗ lực mang đến cho khách hàng những sản phẩm vượt trội, thân thiện với môi trường và an toàn cho sức khỏe. Hiện tại, số lượng sản phẩm mang thương hiệu Hồng Hà đã lên tới hàng ngàn sản phẩm và được chia thành 10 ngành hàng chính: – Vở viết – Sổ – Bút – Dụng cụ học sinh – Xuất bản phẩm – Họa phẩm – Đồ dùng văn phòng – Ba lô, túi cặp – Đồ chơi thông minh – Vải không dệt ------------------------------------------------------------- Hân hạnh phục vụ bạn! Giá sản phẩm trên Tiki đã bao gồm thuế theo luật hiện hành. Bên cạnh đó, tuỳ vào loại sản phẩm, hình thức và địa chỉ giao hàng mà có thể phát sinh thêm chi phí khác như phí vận chuyển, phụ phí hàng cồng kềnh, thuế nhập khẩu (đối với đơn hàng giao từ nước ngoài có giá trị trên 1 triệu đồng).....",4.5,2,"https://salt.tikicdn.com/ts/product/5e/61/05/70426df66541873256b884932f60428d.jpg, https://salt.tikicdn.com/ts/product/75/88/e2/fcba05250b8c7017e497cc92157f3f38.jpg, https://salt.tikicdn.com/ts/product/15/fe/f3/c5dc80cf973490edc5210ec52a36dd47.jpg, https://salt.tikicdn.com/ts/product/2a/88/0e/b47c67981f27c54a4694ab7cb6558a87.jpg, https://salt.tikicdn.com/ts/product/62/da/43/257ccf1687a699e4b195dd64729b68af.jpg","https://salt.tikicdn.com/cache/w1200/ts/product/5e/61/05/70426df66541873256b884932f60428d.jpg, https://salt.tikicdn.com/cache/w1200/ts/product/75/88/e2/fcba05250b8c7017e497cc92157f3f38.jpg, https://salt.tikicdn.com/cache/w1200/ts/product/15/fe/f3/c5dc80cf973490edc5210ec52a36dd47.jpg, https://salt.tikicdn.com/cache/w1200/ts/product/2a/88/0e/b47c67981f27c54a4694ab7cb6558a87.jpg, https://salt.tikicdn.com/cache/w1200/ts/product/62/da/43/257ccf1687a699e4b195dd64729b68af.jpg","https://salt.tikicdn.com/cache/w300/ts/product/5e/61/05/70426df66541873256b884932f60428d.jpg, https://salt.tikicdn.com/cache/w300/ts/product/75/88/e2/fcba05250b8c7017e497cc92157f3f38.jpg, https://salt.tikicdn.com/cache/w300/ts/product/15/fe/f3/c5dc80cf973490edc5210ec52a36dd47.jpg, https://salt.tikicdn.com/cache/w300/ts/product/2a/88/0e/b47c67981f27c54a4694ab7cb6558a87.jpg, https://salt.tikicdn.com/cache/w300/ts/product/62/da/43/257ccf1687a699e4b195dd64729b68af.jpg","https://salt.tikicdn.com/cache/200x280/ts/product/5e/61/05/70426df66541873256b884932f60428d.jpg, https://salt.tikicdn.com/cache/200x280/ts/product/75/88/e2/fcba05250b8c7017e497cc92157f3f38.jpg, https://salt.tikicdn.com/cache/200x280/ts/product/15/fe/f3/c5dc80cf973490edc5210ec52a36dd47.jpg, https://salt.tikicdn.com/cache/200x280/ts/product/2a/88/0e/b47c67981f27c54a4694ab7cb6558a87.jpg, https://salt.tikicdn.com/cache/200x280/ts/product/62/da/43/257ccf1687a699e4b195dd64729b68af.jpg","https://salt.tikicdn.com/cache/200x280/ts/product/5e/61/05/70426df66541873256b884932f60428d.jpg, https://salt.tikicdn.com/cache/200x280/ts/product/75/88/e2/fcba05250b8c7017e497cc92157f3f38.jpg, https://salt.tikicdn.com/cache/200x280/ts/product/15/fe/f3/c5dc80cf973490edc5210ec52a36dd47.jpg, https://salt.tikicdn.com/cache/200x280/ts/product/2a/88/0e/b47c67981f27c54a4694ab7cb6558a87.jpg, https://salt.tikicdn.com/cache/200x280/ts/product/62/da/43/257ccf1687a699e4b195dd64729b68af.jpg",1000,2
127796710,Mực lọ Hồng Hà - 3432,7900,"Mực lọ Hồng Hà - 3432 phù hợp cho học sinh, sinh viên. Mực viết khô nhanh, không nhòe ra giấy và thích hợp dùng làm mực để viết vở sạch chữ đẹp. Bên cạnh đó mực không chút cặn bã ngay cả khi đến cuối ...","Mực lọ Hồng Hà - 3432 phù hợp cho học sinh, sinh viên. Mực viết khô nhanh, không nhòe ra giấy và thích hợp dùng làm mực để viết vở sạch chữ đẹp. Bên cạnh đó mực không chút cặn bã ngay cả khi đến cuối đáy hộp, điều này không chỉ giúp viết chữ đẹp mà còn giữ cho bút máy của bé bền lâu hơn. 1. THÔNG SỐ SẢN PHẨM Thương hiệu: Hồng Hà Màu mực: Xanh - Tím đậm Dung tích: 60 ± 5 ml Khối lượng: 70 ± 2 g Quy cách đóng gói: 1 lọ/ hộp giấy 2. ĐẶC ĐIỂM SẢN PHẨM Sản phẩm mực ống phù hợp với tất cả các loại bút máy. Được làm từ nước khử ion và hóa chất an toàn cho người sử dụng Mực tươi sáng. Không chút cặn bã, viết chữ trơn và đẹp hơn. Được bảo vệ tốt trong lọ thủy tinh. Mực bút máy Hồng Hà 3432 được chứa đựng trong lọ thủy tinh đậy nắp chắc chắn, không bị tác động của không khí, nhiệt độ hay độ ẩm. Mực lọ Hồng Hà phù hợp cho tất cả các loại bút máy, thể tích lớn có thể sử dụng lâu dài. 3. ĐỐI TƯỢNG SỬ DỤNG Sử dụng phù hợp cho cả học sinh, sinh viên và nhân viên văn phòng . 4. CÁCH SỬ DỤNG VÀ BẢO QUẢN Bảo quản nơi khô ráo, tránh nguồn nhiệt Đậy kín nắp sau khi sử dụng ️ Quý khách vui lòng quay lại clip khi mở hàng để làm bằng chứng khiếu nại với shop khi gặp vấn đề liên quan đến sản phẩm. Shop chỉ giải quyết khiếu nại khi có video clip đầy đủ. ️ Để mua sỉ, mua số lượng lớn, Quý khách hàng vui lòng nhắn tin trực tiếp với shop. Xin cảm ơn! Liên hệ với chúng tôi để đặt mua sản phẩm nhanh chóng và tham khảo thêm nhiều dụng cụ học tập thiết thực cho con yêu tại đây . Hân hạnh phục vụ quý khách! #vanphongphamhongha #vpphongha #hongha#muc#muclo#dodunghocsinh#dungcuhoctap#muconghongha#mucbutmay ------------------------------------------------------------ HỒNG HÀ – 62 NĂM XÂY DỰNG VÀ PHÁT TRIỂN Công ty CP Văn phòng phẩm Hồng Hà được thành lập vào ngày 1/10/1959, trải qua 62 năm trưởng thành và phát triển, thương hiệu Văn phòng phẩm Hồng Hà đã để lại dấu ấn sâu đậm trong tâm trí nhiều thế hệ người tiêu dùng Việt Nam với những sản phẩm như bút Trường Sơn, Hoàn Kiếm, Hồng Hà… Với phương châm sản xuất những sản phẩm chất lượng tốt nhất phục vụ người tiêu dùng, Công ty Cổ Phần Văn phòng phẩm Hồng Hà luôn không ngừng nỗ lực mang đến cho khách hàng những sản phẩm vượt trội, thân thiện với môi trường và an toàn cho sức khỏe. Hiện tại, số lượng sản phẩm mang thương hiệu Hồng Hà đã lên tới hàng ngàn sản phẩm và được chia thành 10 ngành hàng chính: – Vở viết – Sổ – Bút – Dụng cụ học sinh – Xuất bản phẩm – Họa phẩm – Đồ dùng văn phòng – Ba lô, túi cặp – Đồ chơi thông minh – Vải không dệt Hân hạnh phục vụ bạn! Giá sản phẩm trên Tiki đã bao gồm thuế theo luật hiện hành. Bên cạnh đó, tuỳ vào loại sản phẩm, hình thức và địa chỉ giao hàng mà có thể phát sinh thêm chi phí khác như phí vận chuyển, phụ phí hàng cồng kềnh, thuế nhập khẩu (đối với đơn hàng giao từ nước ngoài có giá trị trên 1 triệu đồng).....",4.1,7,"https://salt.tikicdn.com/ts/product/50/5b/49/892aa829a031f5614a520e6ebb0fcbe0.jpg, https://salt.tikicdn.com/ts/product/3b/8d/ed/f80da2e001acaa09ae240c97586d2063.jpg, https://salt.tikicdn.com/ts/product/14/d7/14/bd808516f9a29526d1dc500ce03a625c.jpg, https://salt.tikicdn.com/ts/product/e2/6f/a3/8e27ddef79522009f955000f42b07d34.jpg, https://salt.tikicdn.com/ts/product/0c/de/93/925205773f3a4abd6b96fce969ed7680.jpg, https://salt.tikicdn.com/ts/product/ed/67/b6/9038e9f58adb660fa096e93d5c4fd05d.jpg","https://salt.tikicdn.com/cache/w1200/ts/product/50/5b/49/892aa829a031f5614a520e6ebb0fcbe0.jpg, https://salt.tikicdn.com/cache/w1200/ts/product/3b/8d/ed/f80da2e001acaa09ae240c97586d2063.jpg, https://salt.tikicdn.com/cache/w1200/ts/product/14/d7/14/bd808516f9a29526d1dc500ce03a625c.jpg, https://salt.tikicdn.com/cache/w1200/ts/product/e2/6f/a3/8e27ddef79522009f955000f42b07d34.jpg, https://salt.tikicdn.com/cache/w1200/ts/product/0c/de/93/925205773f3a4abd6b96fce969ed7680.jpg, https://salt.tikicdn.com/cache/w1200/ts/product/ed/67/b6/9038e9f58adb660fa096e93d5c4fd05d.jpg","https://salt.tikicdn.com/cache/w300/ts/product/50/5b/49/892aa829a031f5614a520e6ebb0fcbe0.jpg, https://salt.tikicdn.com/cache/w300/ts/product/3b/8d/ed/f80da2e001acaa09ae240c97586d2063.jpg, https://salt.tikicdn.com/cache/w300/ts/product/14/d7/14/bd808516f9a29526d1dc500ce03a625c.jpg, https://salt.tikicdn.com/cache/w300/ts/product/e2/6f/a3/8e27ddef79522009f955000f42b07d34.jpg, https://salt.tikicdn.com/cache/w300/ts/product/0c/de/93/925205773f3a4abd6b96fce969ed7680.jpg, https://salt.tikicdn.com/cache/w300/ts/product/ed/67/b6/9038e9f58adb660fa096e93d5c4fd05d.jpg","https://salt.tikicdn.com/cache/200x280/ts/product/50/5b/49/892aa829a031f5614a520e6ebb0fcbe0.jpg, https://salt.tikicdn.com/cache/200x280/ts/product/3b/8d/ed/f80da2e001acaa09ae240c97586d2063.jpg, https://salt.tikicdn.com/cache/200x280/ts/product/14/d7/14/bd808516f9a29526d1dc500ce03a625c.jpg, https://salt.tikicdn.com/cache/200x280/ts/product/e2/6f/a3/8e27ddef79522009f955000f42b07d34.jpg, https://salt.tikicdn.com/cache/200x280/ts/product/0c/de/93/925205773f3a4abd6b96fce969ed7680.jpg, https://salt.tikicdn.com/cache/200x280/ts/product/ed/67/b6/9038e9f58adb660fa096e93d5c4fd05d.jpg","https://salt.tikicdn.com/cache/200x280/ts/product/50/5b/49/892aa829a031f5614a520e6ebb0fcbe0.jpg, https://salt.tikicdn.com/cache/200x280/ts/product/3b/8d/ed/f80da2e001acaa09ae240c97586d2063.jpg, https://salt.tikicdn.com/cache/200x280/ts/product/14/d7/14/bd808516f9a29526d1dc500ce03a625c.jpg, https://salt.tikicdn.com/cache/200x280/ts/product/e2/6f/a3/8e27ddef79522009f955000f42b07d34.jpg, https://salt.tikicdn.com/cache/200x280/ts/product/0c/de/93/925205773f3a4abd6b96fce969ed7680.jpg, https://salt.tikicdn.com/cache/200x280/ts/product/ed/67/b6/9038e9f58adb660fa096e93d5c4fd05d.jpg",1000,7
123442201,Vỉ 6 Ống Mực Xanh Smart Kids SKFI2002BU,10800,"Vỉ 6 Ống Mực Xanh Smart Kids SKFI2002BU    Ống mực chuyên dùng cho bút máy.   Mực chảy êm không đóng cặn, giữ bút không bị gỉ.   Nạp ống mực dễ dàng, nhanh chóng, tiện lợi và vệ sinh   Thể tích ốn...","Vỉ 6 Ống Mực Xanh Smart Kids SKFI2002BU Ống mực chuyên dùng cho bút máy. Mực chảy êm không đóng cặn, giữ bút không bị gỉ. Nạp ống mực dễ dàng, nhanh chóng, tiện lợi và vệ sinh Thể tích ống mực lớn, giúp viết được nhiều hơn. Đạt tiêu chuẩn châu Âu EN 71-3, và tiêu chuẩn Reach. Giá sản phẩm trên Tiki đã bao gồm thuế theo luật hiện hành. Bên cạnh đó, tuỳ vào loại sản phẩm, hình thức và địa chỉ giao hàng mà có thể phát sinh thêm chi phí khác như phí vận chuyển, phụ phí hàng cồng kềnh, thuế nhập khẩu (đối với đơn hàng giao từ nước ngoài có giá trị trên 1 triệu đồng).....",0,0,"https://salt.tikicdn.com/ts/product/4e/22/da/e63d66050c1c3a85c78c18d0708ef6ac.jpg, https://salt.tikicdn.com/ts/product/4e/22/da/08b3b828ae79a737316dd85c1139a81d.jpg, https://salt.tikicdn.com/ts/product/5b/17/40/09225daf2095fa9f8f0ce8e4a15d74f4.jpg, https://salt.tikicdn.com/ts/product/5b/17/40/674f52e8bd8b06f4f99e85a2ccced9b9.jpg","https://salt.tikicdn.com/cache/w1200/ts/product/4e/22/da/e63d66050c1c3a85c78c18d0708ef6ac.jpg, https://salt.tikicdn.com/cache/w1200/ts/product/4e/22/da/08b3b828ae79a737316dd85c1139a81d.jpg, https://salt.tikicdn.com/cache/w1200/ts/product/5b/17/40/09225daf2095fa9f8f0ce8e4a15d74f4.jpg, https://salt.tikicdn.com/cache/w1200/ts/product/5b/17/40/674f52e8bd8b06f4f99e85a2ccced9b9.jpg","https://salt.tikicdn.com/cache/w300/ts/product/4e/22/da/e63d66050c1c3a85c78c18d0708ef6ac.jpg, https://salt.tikicdn.com/cache/w300/ts/product/4e/22/da/08b3b828ae79a737316dd85c1139a81d.jpg, https://salt.tikicdn.com/cache/w300/ts/product/5b/17/40/09225daf2095fa9f8f0ce8e4a15d74f4.jpg, https://salt.tikicdn.com/cache/w300/ts/product/5b/17/40/674f52e8bd8b06f4f99e85a2ccced9b9.jpg","https://salt.tikicdn.com/cache/200x280/ts/product/4e/22/da/e63d66050c1c3a85c78c18d0708ef6ac.jpg, https://salt.tikicdn.com/cache/200x280/ts/product/4e/22/da/08b3b828ae79a737316dd85c1139a81d.jpg, https://salt.tikicdn.com/cache/200x280/ts/product/5b/17/40/09225daf2095fa9f8f0ce8e4a15d74f4.jpg, https://salt.tikicdn.com/cache/200x280/ts/product/5b/17/40/674f52e8bd8b06f4f99e85a2ccced9b9.jpg","https://salt.tikicdn.com/cache/200x280/ts/product/4e/22/da/e63d66050c1c3a85c78c18d0708ef6ac.jpg, https://salt.tikicdn.com/cache/200x280/ts/product/4e/22/da/08b3b828ae79a737316dd85c1139a81d.jpg, https://salt.tikicdn.com/cache/200x280/ts/product/5b/17/40/09225daf2095fa9f8f0ce8e4a15d74f4.jpg, https://salt.tikicdn.com/cache/200x280/ts/product/5b/17/40/674f52e8bd8b06f4f99e85a2ccced9b9.jpg",1000,0
121532179,"Hộp 6 ống mực Hồng Hà 3.4 mm, 3 màu xanh-đen-tím -  3481",10800,Mực ống Hồng Hà 3481 dùng cho các loại bút viết máy - ống mực viết khô nhanh - không cặn - không nhòe. Sản phẩm được kiểm định KCS khi đưa vào sử dụng. Sản phẩm có 03 màu tùy theo nhu cầu của bạn.1. ...,"Mực ống Hồng Hà 3481 dùng cho các loại bút viết máy - ống mực viết khô nhanh - không cặn - không nhòe. Sản phẩm được kiểm định KCS khi đưa vào sử dụng. Sản phẩm có 03 màu tùy theo nhu cầu của bạn. 1. THÔNG SỐ SẢN PHẨM: Dung tích:      0,9 ± 0,1 ml Đường kính ống mực: 3.4 mm Màu sắc:      Xanh - Tím - Đen Sản phẩm dùng cho bút máy: 2273, 2274,2275, 2276,..... Đóng gói:     6 ống/hộp nhỏ Sản xuất tại: Công ty Cổ phần Văn phòng phẩm Hồng Hà Xuất xứ:       Việt Nam 2. ĐẶC ĐIỂM SẢN PHẨM Mực ống Hồng Hà 3481 dùng cho các loại bút viết máy - ống mực viết khô nhanh - không cặn - không nhòe. Sản phẩm được kiểm định KCS khi đưa vào sử dụng. Sản phẩm có 03 màu tùy theo nhu cầu của bạn. 3. ĐỐI TƯỢNG SỬ DỤNG Học sinh, sinh viên cần thay thế ống mực phù hợp. 4. CÁCH SỬ DỤNG VÀ BẢO QUẢN Bảo quản nơi khô ráo, thoáng mát Để xa nguồn nhiệt Có chi thiết nhỏ nên để xa tầm tay trẻ em dưới 3 tuổi ️ Quý khách vui lòng quay lại clip khi mở hàng để làm bằng chứng khiếu nại với shop khi gặp vấn đề liên quan đến sản phẩm. Shop chỉ giải quyết khiếu nại khi có video clip đầy đủ. ️ Để mua sỉ, mua số lượng lớn, Quý khách hàng vui lòng nhắn tin trực tiếp với shop. Xin cảm ơn! Giá sản phẩm trên Tiki đã bao gồm thuế theo luật hiện hành. Bên cạnh đó, tuỳ vào loại sản phẩm, hình thức và địa chỉ giao hàng mà có thể phát sinh thêm chi phí khác như phí vận chuyển, phụ phí hàng cồng kềnh, thuế nhập khẩu (đối với đơn hàng giao từ nước ngoài có giá trị trên 1 triệu đồng).....",3.7,3,"https://salt.tikicdn.com/ts/product/c6/37/5d/48f32ec4db369256716e2140174a0cca.png, https://salt.tikicdn.com/ts/product/5c/47/a1/b6f7e60e956cfe85935e6decf39a1789.png, https://salt.tikicdn.com/ts/product/51/68/bd/c304760efe98818b8d32f5ce0f79b163.jpg","https://salt.tikicdn.com/cache/w1200/ts/product/c6/37/5d/48f32ec4db369256716e2140174a0cca.png, https://salt.tikicdn.com/cache/w1200/ts/product/5c/47/a1/b6f7e60e956cfe85935e6decf39a1789.png, https://salt.tikicdn.com/cache/w1200/ts/product/51/68/bd/c304760efe98818b8d32f5ce0f79b163.jpg","https://salt.tikicdn.com/cache/w300/ts/product/c6/37/5d/48f32ec4db369256716e2140174a0cca.png, https://salt.tikicdn.com/cache/w300/ts/product/5c/47/a1/b6f7e60e956cfe85935e6decf39a1789.png, https://salt.tikicdn.com/cache/w300/ts/product/51/68/bd/c304760efe98818b8d32f5ce0f79b163.jpg","https://salt.tikicdn.com/cache/200x280/ts/product/c6/37/5d/48f32ec4db369256716e2140174a0cca.png, https://salt.tikicdn.com/cache/200x280/ts/product/5c/47/a1/b6f7e60e956cfe85935e6decf39a1789.png, https://salt.tikicdn.com/cache/200x280/ts/product/51/68/bd/c304760efe98818b8d32f5ce0f79b163.jpg","https://salt.tikicdn.com/cache/200x280/ts/product/c6/37/5d/48f32ec4db369256716e2140174a0cca.png, https://salt.tikicdn.com/cache/200x280/ts/product/5c/47/a1/b6f7e60e956cfe85935e6decf39a1789.png, https://salt.tikicdn.com/cache/200x280/ts/product/51/68/bd/c304760efe98818b8d32f5ce0f79b163.jpg",1000,3
