id,name,price,short_description,description,rating_average,review_count,image_base_url,image_large_url,image_medium_url,image_small_url,image_thumbnail_url,stock,quantity_sold
2209229,Truyện đọc tiếng Anh - Usborne Middle Grade Fiction: The House with Chicken Legs,192600,"The House With Chicken LegsMarinka dreams of a normal life, where her house stays in one place long enough for her to make friends. But her house has chicken legs and moves on without warning.For Ma...","The House With Chicken Legs Marinka dreams of a normal life, where her house stays in one place long enough for her to make friends. But her house has chicken legs and moves on without warning. For Marinka's grandmother is Baba Yaga, who guides spirits between this world and the next. Marinka longs to change her destiny and sets out to break free from her grandmother's footsteps, but her house has other ideas... Giá sản phẩm trên Tiki đã bao gồm thuế theo luật hiện hành. Bên cạnh đó, tuỳ vào loại sản phẩm, hình thức và địa chỉ giao hàng mà có thể phát sinh thêm chi phí khác như phí vận chuyển, phụ phí hàng cồng kềnh, thuế nhập khẩu (đối với đơn hàng giao từ nước ngoài có giá trị trên 1 triệu đồng).....",5,2,"https://salt.tikicdn.com/ts/product/43/28/36/8bcb534ec99031b0b3cfb88c19dcb334.jpg, https://salt.tikicdn.com/ts/product/e6/df/4a/6d1027982a734137aa915f536cff968b.jpg, https://salt.tikicdn.com/ts/product/c6/5e/4d/9aa17c1f70018e2ae0a8137bd76e60c2.jpg, https://salt.tikicdn.com/ts/product/84/b0/50/3299f154f0a36a2c2ac604bb2f9d70b0.jpg, https://salt.tikicdn.com/ts/product/f9/00/c6/593de869bfccc65b851604d70b90692d.jpg, https://salt.tikicdn.com/ts/product/2f/91/75/e0d651c361c55116ea5813ced7adef00.jpg, https://salt.tikicdn.com/ts/product/55/87/09/2f9fe214bfbb1760f773601f1762c014.jpg, https://salt.tikicdn.com/ts/product/07/7f/19/5dd5da1c85409c50d8df29d29b474137.jpg, https://salt.tikicdn.com/ts/product/e8/f7/d0/fa1091a87fb28f25020e809048f20f57.jpg, https://salt.tikicdn.com/ts/product/d6/dd/0b/f08d60f8a70f33b313b955eb05972b94.jpg, https://salt.tikicdn.com/ts/product/3c/92/93/28c6f44fbd83d79e41aa0077413c1d2f.jpg, https://salt.tikicdn.com/ts/product/c7/90/6f/b1bfcc1693d7e7245a19a0c22e49d29e.jpg, https://salt.tikicdn.com/ts/product/fb/40/49/ff3ce5add5d1b24379372cf2b3af3d58.jpg, https://salt.tikicdn.com/ts/product/ac/31/34/7e96d414d30ebc0f436fef196e043e9c.jpg, https://salt.tikicdn.com/ts/product/03/05/59/93662a15a9fd9abfe8a27d7f13d20c79.jpg, https://salt.tikicdn.com/ts/product/57/b7/7b/d156783d396ec26c89b1b4f03bba87f2.jpg","https://salt.tikicdn.com/cache/w1200/ts/product/43/28/36/8bcb534ec99031b0b3cfb88c19dcb334.jpg, https://salt.tikicdn.com/cache/w1200/ts/product/e6/df/4a/6d1027982a734137aa915f536cff968b.jpg, https://salt.tikicdn.com/cache/w1200/ts/product/c6/5e/4d/9aa17c1f70018e2ae0a8137bd76e60c2.jpg, https://salt.tikicdn.com/cache/w1200/ts/product/84/b0/50/3299f154f0a36a2c2ac604bb2f9d70b0.jpg, https://salt.tikicdn.com/cache/w1200/ts/product/f9/00/c6/593de869bfccc65b851604d70b90692d.jpg, https://salt.tikicdn.com/cache/w1200/ts/product/2f/91/75/e0d651c361c55116ea5813ced7adef00.jpg, https://salt.tikicdn.com/cache/w1200/ts/product/55/87/09/2f9fe214bfbb1760f773601f1762c014.jpg, https://salt.tikicdn.com/cache/w1200/ts/product/07/7f/19/5dd5da1c85409c50d8df29d29b474137.jpg, https://salt.tikicdn.com/cache/w1200/ts/product/e8/f7/d0/fa1091a87fb28f25020e809048f20f57.jpg, https://salt.tikicdn.com/cache/w1200/ts/product/d6/dd/0b/f08d60f8a70f33b313b955eb05972b94.jpg, https://salt.tikicdn.com/cache/w1200/ts/product/3c/92/93/28c6f44fbd83d79e41aa0077413c1d2f.jpg, https://salt.tikicdn.com/cache/w1200/ts/product/c7/90/6f/b1bfcc1693d7e7245a19a0c22e49d29e.jpg, https://salt.tikicdn.com/cache/w1200/ts/product/fb/40/49/ff3ce5add5d1b24379372cf2b3af3d58.jpg, https://salt.tikicdn.com/cache/w1200/ts/product/ac/31/34/7e96d414d30ebc0f436fef196e043e9c.jpg, https://salt.tikicdn.com/cache/w1200/ts/product/03/05/59/93662a15a9fd9abfe8a27d7f13d20c79.jpg, https://salt.tikicdn.com/cache/w1200/ts/product/57/b7/7b/d156783d396ec26c89b1b4f03bba87f2.jpg","https://salt.tikicdn.com/cache/w300/ts/product/43/28/36/8bcb534ec99031b0b3cfb88c19dcb334.jpg, https://salt.tikicdn.com/cache/w300/ts/product/e6/df/4a/6d1027982a734137aa915f536cff968b.jpg, https://salt.tikicdn.com/cache/w300/ts/product/c6/5e/4d/9aa17c1f70018e2ae0a8137bd76e60c2.jpg, https://salt.tikicdn.com/cache/w300/ts/product/84/b0/50/3299f154f0a36a2c2ac604bb2f9d70b0.jpg, https://salt.tikicdn.com/cache/w300/ts/product/f9/00/c6/593de869bfccc65b851604d70b90692d.jpg, https://salt.tikicdn.com/cache/w300/ts/product/2f/91/75/e0d651c361c55116ea5813ced7adef00.jpg, https://salt.tikicdn.com/cache/w300/ts/product/55/87/09/2f9fe214bfbb1760f773601f1762c014.jpg, https://salt.tikicdn.com/cache/w300/ts/product/07/7f/19/5dd5da1c85409c50d8df29d29b474137.jpg, https://salt.tikicdn.com/cache/w300/ts/product/e8/f7/d0/fa1091a87fb28f25020e809048f20f57.jpg, https://salt.tikicdn.com/cache/w300/ts/product/d6/dd/0b/f08d60f8a70f33b313b955eb05972b94.jpg, https://salt.tikicdn.com/cache/w300/ts/product/3c/92/93/28c6f44fbd83d79e41aa0077413c1d2f.jpg, https://salt.tikicdn.com/cache/w300/ts/product/c7/90/6f/b1bfcc1693d7e7245a19a0c22e49d29e.jpg, https://salt.tikicdn.com/cache/w300/ts/product/fb/40/49/ff3ce5add5d1b24379372cf2b3af3d58.jpg, https://salt.tikicdn.com/cache/w300/ts/product/ac/31/34/7e96d414d30ebc0f436fef196e043e9c.jpg, https://salt.tikicdn.com/cache/w300/ts/product/03/05/59/93662a15a9fd9abfe8a27d7f13d20c79.jpg, https://salt.tikicdn.com/cache/w300/ts/product/57/b7/7b/d156783d396ec26c89b1b4f03bba87f2.jpg","https://salt.tikicdn.com/cache/200x280/ts/product/43/28/36/8bcb534ec99031b0b3cfb88c19dcb334.jpg, https://salt.tikicdn.com/cache/200x280/ts/product/e6/df/4a/6d1027982a734137aa915f536cff968b.jpg, https://salt.tikicdn.com/cache/200x280/ts/product/c6/5e/4d/9aa17c1f70018e2ae0a8137bd76e60c2.jpg, https://salt.tikicdn.com/cache/200x280/ts/product/84/b0/50/3299f154f0a36a2c2ac604bb2f9d70b0.jpg, https://salt.tikicdn.com/cache/200x280/ts/product/f9/00/c6/593de869bfccc65b851604d70b90692d.jpg, https://salt.tikicdn.com/cache/200x280/ts/product/2f/91/75/e0d651c361c55116ea5813ced7adef00.jpg, https://salt.tikicdn.com/cache/200x280/ts/product/55/87/09/2f9fe214bfbb1760f773601f1762c014.jpg, https://salt.tikicdn.com/cache/200x280/ts/product/07/7f/19/5dd5da1c85409c50d8df29d29b474137.jpg, https://salt.tikicdn.com/cache/200x280/ts/product/e8/f7/d0/fa1091a87fb28f25020e809048f20f57.jpg, https://salt.tikicdn.com/cache/200x280/ts/product/d6/dd/0b/f08d60f8a70f33b313b955eb05972b94.jpg, https://salt.tikicdn.com/cache/200x280/ts/product/3c/92/93/28c6f44fbd83d79e41aa0077413c1d2f.jpg, https://salt.tikicdn.com/cache/200x280/ts/product/c7/90/6f/b1bfcc1693d7e7245a19a0c22e49d29e.jpg, https://salt.tikicdn.com/cache/200x280/ts/product/fb/40/49/ff3ce5add5d1b24379372cf2b3af3d58.jpg, https://salt.tikicdn.com/cache/200x280/ts/product/ac/31/34/7e96d414d30ebc0f436fef196e043e9c.jpg, https://salt.tikicdn.com/cache/200x280/ts/product/03/05/59/93662a15a9fd9abfe8a27d7f13d20c79.jpg, https://salt.tikicdn.com/cache/200x280/ts/product/57/b7/7b/d156783d396ec26c89b1b4f03bba87f2.jpg","https://salt.tikicdn.com/cache/200x280/ts/product/43/28/36/8bcb534ec99031b0b3cfb88c19dcb334.jpg, https://salt.tikicdn.com/cache/200x280/ts/product/e6/df/4a/6d1027982a734137aa915f536cff968b.jpg, https://salt.tikicdn.com/cache/200x280/ts/product/c6/5e/4d/9aa17c1f70018e2ae0a8137bd76e60c2.jpg, https://salt.tikicdn.com/cache/200x280/ts/product/84/b0/50/3299f154f0a36a2c2ac604bb2f9d70b0.jpg, https://salt.tikicdn.com/cache/200x280/ts/product/f9/00/c6/593de869bfccc65b851604d70b90692d.jpg, https://salt.tikicdn.com/cache/200x280/ts/product/2f/91/75/e0d651c361c55116ea5813ced7adef00.jpg, https://salt.tikicdn.com/cache/200x280/ts/product/55/87/09/2f9fe214bfbb1760f773601f1762c014.jpg, https://salt.tikicdn.com/cache/200x280/ts/product/07/7f/19/5dd5da1c85409c50d8df29d29b474137.jpg, https://salt.tikicdn.com/cache/200x280/ts/product/e8/f7/d0/fa1091a87fb28f25020e809048f20f57.jpg, https://salt.tikicdn.com/cache/200x280/ts/product/d6/dd/0b/f08d60f8a70f33b313b955eb05972b94.jpg, https://salt.tikicdn.com/cache/200x280/ts/product/3c/92/93/28c6f44fbd83d79e41aa0077413c1d2f.jpg, https://salt.tikicdn.com/cache/200x280/ts/product/c7/90/6f/b1bfcc1693d7e7245a19a0c22e49d29e.jpg, https://salt.tikicdn.com/cache/200x280/ts/product/fb/40/49/ff3ce5add5d1b24379372cf2b3af3d58.jpg, https://salt.tikicdn.com/cache/200x280/ts/product/ac/31/34/7e96d414d30ebc0f436fef196e043e9c.jpg, https://salt.tikicdn.com/cache/200x280/ts/product/03/05/59/93662a15a9fd9abfe8a27d7f13d20c79.jpg, https://salt.tikicdn.com/cache/200x280/ts/product/57/b7/7b/d156783d396ec26c89b1b4f03bba87f2.jpg",1000,2
2208949,Truyện đọc tiếng Anh - Usborne Middle Grade Fiction: The Rose Muddle Mysteries The Amber Pendant,255000,"The Amber PendantWhen Rose Muddle is plucked from the workhouse to become a maid in a grand mansion, she discovers that her new mistress has secret plans for her – plans which involve a strange amber...","The Amber Pendant When Rose Muddle is plucked from the workhouse to become a maid in a grand mansion, she discovers that her new mistress has secret plans for her – plans which involve a strange amber pendant with extraordinary powers. But fearsome enemies lurk in the shadows, intent on finding the mysterious pendant. As the shadows begin to close in, can Rose uncover the truth of her own destiny to stop these forces of evil? Giá sản phẩm trên Tiki đã bao gồm thuế theo luật hiện hành. Bên cạnh đó, tuỳ vào loại sản phẩm, hình thức và địa chỉ giao hàng mà có thể phát sinh thêm chi phí khác như phí vận chuyển, phụ phí hàng cồng kềnh, thuế nhập khẩu (đối với đơn hàng giao từ nước ngoài có giá trị trên 1 triệu đồng).....",0,0,https://salt.tikicdn.com/ts/product/ee/de/37/05325fd7531010e02cfc1a171afa6ecf.jpg,https://salt.tikicdn.com/cache/w1200/ts/product/ee/de/37/05325fd7531010e02cfc1a171afa6ecf.jpg,https://salt.tikicdn.com/cache/w300/ts/product/ee/de/37/05325fd7531010e02cfc1a171afa6ecf.jpg,https://salt.tikicdn.com/cache/200x280/ts/product/ee/de/37/05325fd7531010e02cfc1a171afa6ecf.jpg,https://salt.tikicdn.com/cache/200x280/ts/product/ee/de/37/05325fd7531010e02cfc1a171afa6ecf.jpg,1000,0
2208173,Truyện đọc tiếng Anh - Usborne Middle Grade Fiction: Bad Magic,255000,Bad MagicThis book is incredibly BAD. It does not contain MAGIC. Or a mysterious ghost girl. Or spontaneous combustion. Or Spanish-speaking llamas.Nope. None of these things. Okay... maybe one of th...,"Bad Magic This book is incredibly BAD. It does not contain MAGIC. Or a mysterious ghost girl. Or spontaneous combustion. Or Spanish-speaking llamas. Nope. None of these things. Okay... maybe one of these things. But certainly not magic. It’s just an ordinary tale of a normal boy who goes to summer camp on a desert island. Nothing exciting or weird happens. The camp is definitely not for crazy, badly-behaved kids, and there are no secrets or mysteries at all. And absolutely no magic whatsoever... Giá sản phẩm trên Tiki đã bao gồm thuế theo luật hiện hành. Bên cạnh đó, tuỳ vào loại sản phẩm, hình thức và địa chỉ giao hàng mà có thể phát sinh thêm chi phí khác như phí vận chuyển, phụ phí hàng cồng kềnh, thuế nhập khẩu (đối với đơn hàng giao từ nước ngoài có giá trị trên 1 triệu đồng).....",0,0,https://salt.tikicdn.com/ts/product/20/5d/8f/23d61b1d8fe812b7b6a548eec8ea9024.jpg,https://salt.tikicdn.com/cache/w1200/ts/product/20/5d/8f/23d61b1d8fe812b7b6a548eec8ea9024.jpg,https://salt.tikicdn.com/cache/w300/ts/product/20/5d/8f/23d61b1d8fe812b7b6a548eec8ea9024.jpg,https://salt.tikicdn.com/cache/200x280/ts/product/20/5d/8f/23d61b1d8fe812b7b6a548eec8ea9024.jpg,https://salt.tikicdn.com/cache/200x280/ts/product/20/5d/8f/23d61b1d8fe812b7b6a548eec8ea9024.jpg,1000,0
2202613,Truyện đọc tiếng Anh - Usborne Middle Grade Fiction: The Most Powerful Boy in the Universe,298000,"Compton Valance - The Most Powerful Boy In The UniverseWhen Compton Valance and his best friend Bryan Nylon discover the world's first TIME MACHINE (aka a mouldy, thirteen-week-old-cheese-and-pickled...","Compton Valance - The Most Powerful Boy In The Universe When Compton Valance and his best friend Bryan Nylon discover the world's first TIME MACHINE (aka a mouldy, thirteen-week-old-cheese-and-pickled-egg sandwich), they become the most powerful boys in the universe. But how will Compton and Bryan decide to use their incredible new time-travelling powers? Will they use them for good? Will they use them for evil? Or will they just focus their efforts on perfecting a formula for the world's first pair of custard trousers? Things are about to get totally scrambled for Compton Valance. Giá sản phẩm trên Tiki đã bao gồm thuế theo luật hiện hành. Bên cạnh đó, tuỳ vào loại sản phẩm, hình thức và địa chỉ giao hàng mà có thể phát sinh thêm chi phí khác như phí vận chuyển, phụ phí hàng cồng kềnh, thuế nhập khẩu (đối với đơn hàng giao từ nước ngoài có giá trị trên 1 triệu đồng).....",0,0,https://salt.tikicdn.com/ts/product/a6/4d/35/bb83df3beff3b6a4a09bc96b20b7fe4f.jpg,https://salt.tikicdn.com/cache/w1200/ts/product/a6/4d/35/bb83df3beff3b6a4a09bc96b20b7fe4f.jpg,https://salt.tikicdn.com/cache/w300/ts/product/a6/4d/35/bb83df3beff3b6a4a09bc96b20b7fe4f.jpg,https://salt.tikicdn.com/cache/200x280/ts/product/a6/4d/35/bb83df3beff3b6a4a09bc96b20b7fe4f.jpg,https://salt.tikicdn.com/cache/200x280/ts/product/a6/4d/35/bb83df3beff3b6a4a09bc96b20b7fe4f.jpg,1000,0
317681,"The Temple of the Ruby of Fire (Geronimo Stilton, No. 14)",192000,"It was my most thrilling adventure yet! My old friend Professor von Volt had discovered the location of the famous Ruby of Fire. And before I could let out a squeak of protest, my sister Thea had drag...","It was my most thrilling adventure yet! My old friend Professor von Volt had discovered the location of the famous Ruby of Fire. And before I could let out a squeak of protest, my sister Thea had dragged me into race to be the first to find the legendary gem. The jewel was protected by thousands of ancient booby-traps -- a 'fraidy mouse's worst nightmare? Would I make it through with my fur? Giá sản phẩm trên Tiki đã bao gồm thuế theo luật hiện hành. Bên cạnh đó, tuỳ vào loại sản phẩm, hình thức và địa chỉ giao hàng mà có thể phát sinh thêm chi phí khác như phí vận chuyển, phụ phí hàng cồng kềnh, thuế nhập khẩu (đối với đơn hàng giao từ nước ngoài có giá trị trên 1 triệu đồng).....",0,0,"https://salt.tikicdn.com/ts/product/e0/48/79/7d9b29be5d72158e0baad63466409250.jpg, https://salt.tikicdn.com/media/catalog/product/i/m/image_3068.jpg","https://salt.tikicdn.com/cache/w1200/ts/product/e0/48/79/7d9b29be5d72158e0baad63466409250.jpg, https://salt.tikicdn.com/cache/w1200/media/catalog/product/i/m/image_3068.jpg","https://salt.tikicdn.com/cache/w300/ts/product/e0/48/79/7d9b29be5d72158e0baad63466409250.jpg, https://salt.tikicdn.com/cache/w300/media/catalog/product/i/m/image_3068.jpg","https://salt.tikicdn.com/cache/200x280/ts/product/e0/48/79/7d9b29be5d72158e0baad63466409250.jpg, https://salt.tikicdn.com/cache/200x280/media/catalog/product/i/m/image_3068.jpg","https://salt.tikicdn.com/cache/200x280/ts/product/e0/48/79/7d9b29be5d72158e0baad63466409250.jpg, https://salt.tikicdn.com/cache/200x280/media/catalog/product/i/m/image_3068.jpg",1000,0
317676,"My Name Is Stilton, Geronimo Stilton (Geronimo Stilton, No. 19)",160200,"Have you met my very young assistant editor, Pinky Pick? She is only thirteen years old, but she is one of the cleverest mice I've ever known. If you've ever wondered how Pinky came to work for me at ...","Have you met my very young assistant editor, Pinky Pick? She is only thirteen years old, but she is one of the cleverest mice I've ever known. If you've ever wondered how Pinky came to work for me at The Rodent's Gazette, this is the book for you! It's a looooong  and one that's full of adventure, laughs, and of course, like all of my books, lots of embarrassing moments for yours truly! Giá sản phẩm trên Tiki đã bao gồm thuế theo luật hiện hành. Bên cạnh đó, tuỳ vào loại sản phẩm, hình thức và địa chỉ giao hàng mà có thể phát sinh thêm chi phí khác như phí vận chuyển, phụ phí hàng cồng kềnh, thuế nhập khẩu (đối với đơn hàng giao từ nước ngoài có giá trị trên 1 triệu đồng).....",0,0,https://salt.tikicdn.com/media/catalog/product/i/m/image_3063.jpg,https://salt.tikicdn.com/cache/w1200/media/catalog/product/i/m/image_3063.jpg,https://salt.tikicdn.com/cache/w300/media/catalog/product/i/m/image_3063.jpg,https://salt.tikicdn.com/cache/200x280/media/catalog/product/i/m/image_3063.jpg,https://salt.tikicdn.com/cache/200x280/media/catalog/product/i/m/image_3063.jpg,1000,0
317670,"Field Trip to Niagara Falls (Geronimo Stilton, No. 24)",192000,"Holey cheese, what an adventure! I was off to Niagara Falls with my nephew Benjamin's class. It was a beautiful place -- truly one of the most amazing sights I'd ever seen. But unfortunately, I was su...","Holey cheese, what an adventure! I was off to Niagara Falls with my nephew Benjamin's class. It was a beautiful place -- truly one of the most amazing sights I'd ever seen. But unfortunately, I was surrounded by mischievous young mouselets who were determined send me over the Falls in a barrel! Oh, would I ever make it back to Mouse Island alive? Giá sản phẩm trên Tiki đã bao gồm thuế theo luật hiện hành. Bên cạnh đó, tuỳ vào loại sản phẩm, hình thức và địa chỉ giao hàng mà có thể phát sinh thêm chi phí khác như phí vận chuyển, phụ phí hàng cồng kềnh, thuế nhập khẩu (đối với đơn hàng giao từ nước ngoài có giá trị trên 1 triệu đồng).....",0,0,https://salt.tikicdn.com/media/catalog/product/i/m/image_3057.jpg,https://salt.tikicdn.com/cache/w1200/media/catalog/product/i/m/image_3057.jpg,https://salt.tikicdn.com/cache/w300/media/catalog/product/i/m/image_3057.jpg,https://salt.tikicdn.com/cache/200x280/media/catalog/product/i/m/image_3057.jpg,https://salt.tikicdn.com/cache/200x280/media/catalog/product/i/m/image_3057.jpg,1000,0
317665,"Down and Out Down Under (Geronimo Stilton, No. 29)",192000,"G'day, mate!  I was searching for ideas for my new book, and my friend Petunia Pretty Paws knew just where to find them -- in Australia.  Holey cheese, it sounded like a fabumouse adventure!  But betw...","G'day, mate!  I was searching for ideas for my new book, and my friend Petunia Pretty Paws knew just where to find them -- in Australia.  Holey cheese, it sounded like a fabumouse adventure!  But between surfing with sharks, being chased by poisonous snakes, and getting lost in the outback, I was beginning to wonder if this trip down under was really a good idea.  Kangaroos and koalas and crocs -- oh, my!  Would I ever see New Mouse City again? Giá sản phẩm trên Tiki đã bao gồm thuế theo luật hiện hành. Bên cạnh đó, tuỳ vào loại sản phẩm, hình thức và địa chỉ giao hàng mà có thể phát sinh thêm chi phí khác như phí vận chuyển, phụ phí hàng cồng kềnh, thuế nhập khẩu (đối với đơn hàng giao từ nước ngoài có giá trị trên 1 triệu đồng).....",0,0,https://salt.tikicdn.com/media/catalog/product/i/m/image_3052.jpg,https://salt.tikicdn.com/cache/w1200/media/catalog/product/i/m/image_3052.jpg,https://salt.tikicdn.com/cache/w300/media/catalog/product/i/m/image_3052.jpg,https://salt.tikicdn.com/cache/200x280/media/catalog/product/i/m/image_3052.jpg,https://salt.tikicdn.com/cache/200x280/media/catalog/product/i/m/image_3052.jpg,1000,0
317662,"The Mysterious Cheese Thief (Geronimo Stilton, No. 31)",192000,"I, Geronimo Stilton, am not a big fan of spooky things.  But when the Stilton cheese began disappearing all around me, I had to do something!  Could I find the mysterious cheese thief, or was I in for...","I, Geronimo Stilton, am not a big fan of spooky things.  But when the Stilton cheese began disappearing all around me, I had to do something!  Could I find the mysterious cheese thief, or was I in for a big scare?  Putrid cheese puffs, what an adventure! Giá sản phẩm trên Tiki đã bao gồm thuế theo luật hiện hành. Bên cạnh đó, tuỳ vào loại sản phẩm, hình thức và địa chỉ giao hàng mà có thể phát sinh thêm chi phí khác như phí vận chuyển, phụ phí hàng cồng kềnh, thuế nhập khẩu (đối với đơn hàng giao từ nước ngoài có giá trị trên 1 triệu đồng).....",0,0,https://salt.tikicdn.com/media/catalog/product/i/m/image_3049.jpg,https://salt.tikicdn.com/cache/w1200/media/catalog/product/i/m/image_3049.jpg,https://salt.tikicdn.com/cache/w300/media/catalog/product/i/m/image_3049.jpg,https://salt.tikicdn.com/cache/200x280/media/catalog/product/i/m/image_3049.jpg,https://salt.tikicdn.com/cache/200x280/media/catalog/product/i/m/image_3049.jpg,1000,0
317659,"Geronimo Stilton, Secret Agent (Geronimo Stilton, No. 34)",192000,"My sister, Thea, is the mystery-loving rodent, not me!   But somehow I found myself going undercover to get to the bottom of a case.  Slimy Swiss balls -- I hardly knew where to start!  Geronimo Stilt...","My sister, Thea, is the mystery-loving rodent, not me!   But somehow I found myself going undercover to get to the bottom of a case.  Slimy Swiss balls -- I hardly knew where to start!  Geronimo Stilton, Secret Agent Mouse?  Maybe I could get used to that. . . . Giá sản phẩm trên Tiki đã bao gồm thuế theo luật hiện hành. Bên cạnh đó, tuỳ vào loại sản phẩm, hình thức và địa chỉ giao hàng mà có thể phát sinh thêm chi phí khác như phí vận chuyển, phụ phí hàng cồng kềnh, thuế nhập khẩu (đối với đơn hàng giao từ nước ngoài có giá trị trên 1 triệu đồng).....",0,0,https://salt.tikicdn.com/media/catalog/product/i/m/image_3046.jpg,https://salt.tikicdn.com/cache/w1200/media/catalog/product/i/m/image_3046.jpg,https://salt.tikicdn.com/cache/w300/media/catalog/product/i/m/image_3046.jpg,https://salt.tikicdn.com/cache/200x280/media/catalog/product/i/m/image_3046.jpg,https://salt.tikicdn.com/cache/200x280/media/catalog/product/i/m/image_3046.jpg,1000,0
277460979,Sách thiếu nhi tiếng Pháp - Charlie Et Le Grand Ascenseur De Verre,342900,"THÔNG TIN CƠ BẢN: Công ty phát hành: Gallimard jeunesse Nhà xuất bản: Gallimard jeunesse Tác giả: Roald Dahl Kích thước: 12,5 cm × 17,8 cm × 1,4 cm Số trang: 208  Năm xuất bản: 16/06/2016Loại b...","THÔNG TIN CƠ BẢN: Công ty phát hành: Gallimard jeunesse Nhà xuất bản: Gallimard jeunesse Tác giả: Roald Dahl Kích thước: 12,5 cm × 17,8 cm × 1,4 cm Số trang: 208 Năm xuất bản: 16/06/2016 Loại bìa: Bìa mềm NỘI DUNG: ""Thật là may mắn!"", ông Wonka kêu lên. ""Chúng ta đã tình cờ gặp đúng sự kiện vũ trụ vĩ đại nhất mọi thời đại!"" **Vút!** Trong thang máy kính khổng lồ, Willy Wonka, Charlie Bucket và gia đình của cậu đang lơ lửng trên nhà máy socola! Họ có thể nhìn thấy thế giới bên dưới, nhưng họ không hề đơn độc: khách sạn vũ trụ đầu tiên đã mở cửa. Và ở đó, những sinh vật độc ác, hiểm độc và nguy hiểm nhất trong toàn bộ vũ trụ đang lảng vảng: **Kpoux Vermicieux.** Hãy chuẩn bị sẵn sàng tinh thần, giữ chặt dạ dày và mũ của bạn! Chỉ có Charlie và Willy Wonka mới có thể ngăn chặn Kpoux phá hủy mọi thứ. ""Quelle chance, s'écria Mr Wonka, nous sommes tombés pile sur le plus grand événement spatial de tous les temps ! "" Woush ! Dans le grand ascenseur de verre, Willy Wonka, Charlie Bucket et sa famille survolent la chocolaterie ! Ils voient le monde en bas mais ils ne sont pas seuls : le premier hôtel spatial a ouvert. Et les bêtes les plus méchantes, les plus vindicatives, les plus meurtrières de tout l'univers y rôdent : les Kpoux Vermicieux. Alors accrochez bien vos estomacs et vos chapeaux ! Seuls Charlie et Willy Wonka peuvent empêcher les Kpoux de tout détruire. Giá sản phẩm trên Tiki đã bao gồm thuế theo luật hiện hành. Bên cạnh đó, tuỳ vào loại sản phẩm, hình thức và địa chỉ giao hàng mà có thể phát sinh thêm chi phí khác như phí vận chuyển, phụ phí hàng cồng kềnh, thuế nhập khẩu (đối với đơn hàng giao từ nước ngoài có giá trị trên 1 triệu đồng).....",0,0,https://salt.tikicdn.com/ts/product/66/ed/28/e68abc5cf1478cfbbd9943f101593d9f.jpg,https://salt.tikicdn.com/cache/w1200/ts/product/66/ed/28/e68abc5cf1478cfbbd9943f101593d9f.jpg,https://salt.tikicdn.com/cache/w300/ts/product/66/ed/28/e68abc5cf1478cfbbd9943f101593d9f.jpg,https://salt.tikicdn.com/cache/200x280/ts/product/66/ed/28/e68abc5cf1478cfbbd9943f101593d9f.jpg,https://salt.tikicdn.com/cache/200x280/ts/product/66/ed/28/e68abc5cf1478cfbbd9943f101593d9f.jpg,1000,0
