id,name,price,short_description,description,rating_average,review_count,image_base_url,image_large_url,image_medium_url,image_small_url,image_thumbnail_url,stock,quantity_sold
2499695,The Adventures of Miss Petitfour,171000,The Adventures of Miss PetitfourMeet the utterly irresistible Miss Petitfour (a name of unknown origin but possibly descended from bakers of tiny delicious cakes). She loves baking and making and dan...,"The Adventures of Miss Petitfour Meet the utterly irresistible Miss Petitfour (a name of unknown origin but possibly descended from bakers of tiny delicious cakes). She loves baking and making and dancing with her cats, but most of all she loves to fly. All she has to do is pick up a favourite tablecloth (preferably the one with the paisley print), catch the breeze and she swooshes off on an adventure – with her many cats (Minky, Misty, Taffy, Purrsia, Pirate, Mustard, Moutarde, Hemdala, Earring, Grigorovich, Clasby, Captain Captain, Captain Catkin, Captain Clothespin, Your Shyness and Sizzles) dangling paw-to-tail behind her. In five utterly captivating stories of gentle adventure, delicious edibles (with cheese for the cats), occasional peril and heart-zinging warmth, poet and novelist Anne Michaels (author of bestselling, award-winning Fugitive Pieces) makes a charming, purrfect debut as a children's author. Giá sản phẩm trên Tiki đã bao gồm thuế theo luật hiện hành. Bên cạnh đó, tuỳ vào loại sản phẩm, hình thức và địa chỉ giao hàng mà có thể phát sinh thêm chi phí khác như phí vận chuyển, phụ phí hàng cồng kềnh, thuế nhập khẩu (đối với đơn hàng giao từ nước ngoài có giá trị trên 1 triệu đồng).....",0,0,https://salt.tikicdn.com/ts/product/71/6a/4f/54d575587b161570d13f3c614ad74bb0.jpg,https://salt.tikicdn.com/cache/w1200/ts/product/71/6a/4f/54d575587b161570d13f3c614ad74bb0.jpg,https://salt.tikicdn.com/cache/w300/ts/product/71/6a/4f/54d575587b161570d13f3c614ad74bb0.jpg,https://salt.tikicdn.com/cache/200x280/ts/product/71/6a/4f/54d575587b161570d13f3c614ad74bb0.jpg,https://salt.tikicdn.com/cache/200x280/ts/product/71/6a/4f/54d575587b161570d13f3c614ad74bb0.jpg,1000,0
2361221,"Horse Called Hero, A",134000,"War took his hope, a horse gave him courageIt is 1940. As the Second World War escalates and London becomes a target for German bombs, Dodo and her horse-mad little brother Wolfie are evacuated to th...","War took his hope, a horse gave him courage It is 1940. As the Second World War escalates and London becomes a target for German bombs, Dodo and her horse-mad little brother Wolfie are evacuated to the country, away from everything they know. After weeks of homesick loneliness, they come across an orphaned foal. They name the horse Hero for surviving against the odds and together they raise him, train him, and learn to ride. Their days are suddenly full of life and excitement again, but the shadow of war looms over their peaceful existence, and soon Hero must live up to his Giá sản phẩm trên Tiki đã bao gồm thuế theo luật hiện hành. Bên cạnh đó, tuỳ vào loại sản phẩm, hình thức và địa chỉ giao hàng mà có thể phát sinh thêm chi phí khác như phí vận chuyển, phụ phí hàng cồng kềnh, thuế nhập khẩu (đối với đơn hàng giao từ nước ngoài có giá trị trên 1 triệu đồng).....",0,0,https://salt.tikicdn.com/ts/product/68/0e/16/fac588d92d6150c178606f6aa6ae522f.jpg,https://salt.tikicdn.com/cache/w1200/ts/product/68/0e/16/fac588d92d6150c178606f6aa6ae522f.jpg,https://salt.tikicdn.com/cache/w300/ts/product/68/0e/16/fac588d92d6150c178606f6aa6ae522f.jpg,https://salt.tikicdn.com/cache/200x280/ts/product/68/0e/16/fac588d92d6150c178606f6aa6ae522f.jpg,https://salt.tikicdn.com/cache/200x280/ts/product/68/0e/16/fac588d92d6150c178606f6aa6ae522f.jpg,1000,0
331576,Charlie and the Great Glass Elevator,229000,"WHOOSH! Inside the Great Glass Elevator, Willy Wonka, Charlie Bucket and his family are cruising a thousand feet above the chocolate factory.They can see the whole world below them, but they're not a...","WHOOSH! Inside the Great Glass Elevator , Willy Wonka, Charlie Bucket and his family are cruising a thousand feet above the chocolate factory. They can see the whole world below them, but they're not alone. The American Space Hotel has just launched. Lurking inside are the Vernicious Knids - the most brutal, vindictive murderous beasts in the universe. So grab your gizzard! Hold your hats! Only Charlie and Willy Wonka can stop the Knids from destroying everything! Giá sản phẩm trên Tiki đã bao gồm thuế theo luật hiện hành. Bên cạnh đó, tuỳ vào loại sản phẩm, hình thức và địa chỉ giao hàng mà có thể phát sinh thêm chi phí khác như phí vận chuyển, phụ phí hàng cồng kềnh, thuế nhập khẩu (đối với đơn hàng giao từ nước ngoài có giá trị trên 1 triệu đồng).....",5,2,"https://salt.tikicdn.com/ts/product/ab/5c/45/de49a9318bfabd0a0575cb5da0f5b86c.jpg, https://salt.tikicdn.com/ts/product/41/ec/7e/102de21b34a07d62721420dc078e26b6.jpg","https://salt.tikicdn.com/cache/w1200/ts/product/ab/5c/45/de49a9318bfabd0a0575cb5da0f5b86c.jpg, https://salt.tikicdn.com/cache/w1200/ts/product/41/ec/7e/102de21b34a07d62721420dc078e26b6.jpg","https://salt.tikicdn.com/cache/w300/ts/product/ab/5c/45/de49a9318bfabd0a0575cb5da0f5b86c.jpg, https://salt.tikicdn.com/cache/w300/ts/product/41/ec/7e/102de21b34a07d62721420dc078e26b6.jpg","https://salt.tikicdn.com/cache/200x280/ts/product/ab/5c/45/de49a9318bfabd0a0575cb5da0f5b86c.jpg, https://salt.tikicdn.com/cache/200x280/ts/product/41/ec/7e/102de21b34a07d62721420dc078e26b6.jpg","https://salt.tikicdn.com/cache/200x280/ts/product/ab/5c/45/de49a9318bfabd0a0575cb5da0f5b86c.jpg, https://salt.tikicdn.com/cache/200x280/ts/product/41/ec/7e/102de21b34a07d62721420dc078e26b6.jpg",1000,2
318880,Backpack Second Edition 2: Workbook With Audio CD,167200,Backpack Second Edition 2: Workbook With Audio CD The Workbook pages provide additional practice to reinforce language and grammar presented in classroom lessons. A bound-in Audio CD allows the Workb...,"Backpack Second Edition 2: Workbook With Audio CD The Workbook pages provide additional practice to reinforce language and grammar presented in classroom lessons. A bound-in Audio CD allows the Workbook to be used at home, or in the classroom. Bold, beautiful and bursting with color! Packed with tools to learn! Backpack, brings to life a love of learning through songs and chants, stickers, and hands-on activities. Your students will want to speak English with Backpack and enjoy doing the fun-filled activities in the classroom! With seven levels, Backpack has a strong focus on grammar and writing and is packed with the latest trends and up to the minute technology, including Active Teach, for use in your classroom. From singing to games, your students will love learning with Backpack! Giá sản phẩm trên Tiki đã bao gồm thuế theo luật hiện hành. Bên cạnh đó, tuỳ vào loại sản phẩm, hình thức và địa chỉ giao hàng mà có thể phát sinh thêm chi phí khác như phí vận chuyển, phụ phí hàng cồng kềnh, thuế nhập khẩu (đối với đơn hàng giao từ nước ngoài có giá trị trên 1 triệu đồng).....",0,0,https://salt.tikicdn.com/ts/product/61/48/5b/f2e5a7424993c0abf2698cf5f01e0972.jpg,https://salt.tikicdn.com/cache/w1200/ts/product/61/48/5b/f2e5a7424993c0abf2698cf5f01e0972.jpg,https://salt.tikicdn.com/cache/w300/ts/product/61/48/5b/f2e5a7424993c0abf2698cf5f01e0972.jpg,https://salt.tikicdn.com/cache/200x280/ts/product/61/48/5b/f2e5a7424993c0abf2698cf5f01e0972.jpg,https://salt.tikicdn.com/cache/200x280/ts/product/61/48/5b/f2e5a7424993c0abf2698cf5f01e0972.jpg,1000,0
317679,Geronimo Stilton A Cheese Colored Camper (No. 16),160200,"My grandfather William Shortpaws -- also known as Cheap Mouse Willy -- was back at The Rodent's Gazette, and he was determined to torture me.  He wanted to publish a guide book to Ratzikistan, the Sib...","My grandfather William Shortpaws -- also known as Cheap Mouse Willy -- was back at The Rodent's Gazette, and he was determined to torture me.  He wanted to publish a guide book to Ratzikistan, the Siberia of Mouse Island. And he ordered *me* to go there to write it! But as you know, dear reader, I HATE TRAVELING! Giá sản phẩm trên Tiki đã bao gồm thuế theo luật hiện hành. Bên cạnh đó, tuỳ vào loại sản phẩm, hình thức và địa chỉ giao hàng mà có thể phát sinh thêm chi phí khác như phí vận chuyển, phụ phí hàng cồng kềnh, thuế nhập khẩu (đối với đơn hàng giao từ nước ngoài có giá trị trên 1 triệu đồng).....",0,0,"https://salt.tikicdn.com/ts/product/58/39/fb/b1666574370a7e107246c3a328ca71b6.jpg, https://salt.tikicdn.com/ts/product/5d/f9/9d/99ec6920f7db590575362c2c556c188a.jpg, https://salt.tikicdn.com/ts/product/e3/70/c8/227511cbfef9bf2f93fbf7fd559090e0.jpg, https://salt.tikicdn.com/ts/product/55/95/93/3183c25755bce1c4d7aa2b7908df0b57.jpg, https://salt.tikicdn.com/ts/product/8c/dd/cc/d546ef383a94c089f28a95512f0baf29.jpg, https://salt.tikicdn.com/ts/product/72/0d/5d/a76d47d4edce9461d0efec8c0530746f.jpg, https://salt.tikicdn.com/ts/product/af/b7/eb/e873ff7aa8e3fc5188b85059344de28d.jpg, https://salt.tikicdn.com/ts/product/57/8a/45/9f5948036e5c5009745bba49f98da242.jpg, https://salt.tikicdn.com/ts/product/87/1d/83/de344bede0ecaeb63b23497a27f6cd8c.jpg, https://salt.tikicdn.com/ts/product/fa/3e/46/19c0f8ba7fd34b31498a987945f83147.jpg, https://salt.tikicdn.com/ts/product/be/6e/d6/6ebc2f6c7a98ffc795d913167c1f8626.jpg, https://salt.tikicdn.com/ts/product/bf/a9/fa/a258b2fe26400688fd585a3bed94fe87.jpg, https://salt.tikicdn.com/ts/product/5a/42/9b/8d5dbf99668555fa77b16b7c0cc868c2.jpg, https://salt.tikicdn.com/ts/product/cc/fb/c2/1dad741ae1fe9c1980bd0b56cfdd3f01.jpg, https://salt.tikicdn.com/ts/product/3c/07/6b/8cc794735d95bdb1d8ffcd21fc8fcc10.jpg, https://salt.tikicdn.com/ts/product/0a/13/4e/e471f3062e90bc1adfeab798b71f97f2.jpg","https://salt.tikicdn.com/cache/w1200/ts/product/58/39/fb/b1666574370a7e107246c3a328ca71b6.jpg, https://salt.tikicdn.com/cache/w1200/ts/product/5d/f9/9d/99ec6920f7db590575362c2c556c188a.jpg, https://salt.tikicdn.com/cache/w1200/ts/product/e3/70/c8/227511cbfef9bf2f93fbf7fd559090e0.jpg, https://salt.tikicdn.com/cache/w1200/ts/product/55/95/93/3183c25755bce1c4d7aa2b7908df0b57.jpg, https://salt.tikicdn.com/cache/w1200/ts/product/8c/dd/cc/d546ef383a94c089f28a95512f0baf29.jpg, https://salt.tikicdn.com/cache/w1200/ts/product/72/0d/5d/a76d47d4edce9461d0efec8c0530746f.jpg, https://salt.tikicdn.com/cache/w1200/ts/product/af/b7/eb/e873ff7aa8e3fc5188b85059344de28d.jpg, https://salt.tikicdn.com/cache/w1200/ts/product/57/8a/45/9f5948036e5c5009745bba49f98da242.jpg, https://salt.tikicdn.com/cache/w1200/ts/product/87/1d/83/de344bede0ecaeb63b23497a27f6cd8c.jpg, https://salt.tikicdn.com/cache/w1200/ts/product/fa/3e/46/19c0f8ba7fd34b31498a987945f83147.jpg, https://salt.tikicdn.com/cache/w1200/ts/product/be/6e/d6/6ebc2f6c7a98ffc795d913167c1f8626.jpg, https://salt.tikicdn.com/cache/w1200/ts/product/bf/a9/fa/a258b2fe26400688fd585a3bed94fe87.jpg, https://salt.tikicdn.com/cache/w1200/ts/product/5a/42/9b/8d5dbf99668555fa77b16b7c0cc868c2.jpg, https://salt.tikicdn.com/cache/w1200/ts/product/cc/fb/c2/1dad741ae1fe9c1980bd0b56cfdd3f01.jpg, https://salt.tikicdn.com/cache/w1200/ts/product/3c/07/6b/8cc794735d95bdb1d8ffcd21fc8fcc10.jpg, https://salt.tikicdn.com/cache/w1200/ts/product/0a/13/4e/e471f3062e90bc1adfeab798b71f97f2.jpg","https://salt.tikicdn.com/cache/w300/ts/product/58/39/fb/b1666574370a7e107246c3a328ca71b6.jpg, https://salt.tikicdn.com/cache/w300/ts/product/5d/f9/9d/99ec6920f7db590575362c2c556c188a.jpg, https://salt.tikicdn.com/cache/w300/ts/product/e3/70/c8/227511cbfef9bf2f93fbf7fd559090e0.jpg, https://salt.tikicdn.com/cache/w300/ts/product/55/95/93/3183c25755bce1c4d7aa2b7908df0b57.jpg, https://salt.tikicdn.com/cache/w300/ts/product/8c/dd/cc/d546ef383a94c089f28a95512f0baf29.jpg, https://salt.tikicdn.com/cache/w300/ts/product/72/0d/5d/a76d47d4edce9461d0efec8c0530746f.jpg, https://salt.tikicdn.com/cache/w300/ts/product/af/b7/eb/e873ff7aa8e3fc5188b85059344de28d.jpg, https://salt.tikicdn.com/cache/w300/ts/product/57/8a/45/9f5948036e5c5009745bba49f98da242.jpg, https://salt.tikicdn.com/cache/w300/ts/product/87/1d/83/de344bede0ecaeb63b23497a27f6cd8c.jpg, https://salt.tikicdn.com/cache/w300/ts/product/fa/3e/46/19c0f8ba7fd34b31498a987945f83147.jpg, https://salt.tikicdn.com/cache/w300/ts/product/be/6e/d6/6ebc2f6c7a98ffc795d913167c1f8626.jpg, https://salt.tikicdn.com/cache/w300/ts/product/bf/a9/fa/a258b2fe26400688fd585a3bed94fe87.jpg, https://salt.tikicdn.com/cache/w300/ts/product/5a/42/9b/8d5dbf99668555fa77b16b7c0cc868c2.jpg, https://salt.tikicdn.com/cache/w300/ts/product/cc/fb/c2/1dad741ae1fe9c1980bd0b56cfdd3f01.jpg, https://salt.tikicdn.com/cache/w300/ts/product/3c/07/6b/8cc794735d95bdb1d8ffcd21fc8fcc10.jpg, https://salt.tikicdn.com/cache/w300/ts/product/0a/13/4e/e471f3062e90bc1adfeab798b71f97f2.jpg","https://salt.tikicdn.com/cache/200x280/ts/product/58/39/fb/b1666574370a7e107246c3a328ca71b6.jpg, https://salt.tikicdn.com/cache/200x280/ts/product/5d/f9/9d/99ec6920f7db590575362c2c556c188a.jpg, https://salt.tikicdn.com/cache/200x280/ts/product/e3/70/c8/227511cbfef9bf2f93fbf7fd559090e0.jpg, https://salt.tikicdn.com/cache/200x280/ts/product/55/95/93/3183c25755bce1c4d7aa2b7908df0b57.jpg, https://salt.tikicdn.com/cache/200x280/ts/product/8c/dd/cc/d546ef383a94c089f28a95512f0baf29.jpg, https://salt.tikicdn.com/cache/200x280/ts/product/72/0d/5d/a76d47d4edce9461d0efec8c0530746f.jpg, https://salt.tikicdn.com/cache/200x280/ts/product/af/b7/eb/e873ff7aa8e3fc5188b85059344de28d.jpg, https://salt.tikicdn.com/cache/200x280/ts/product/57/8a/45/9f5948036e5c5009745bba49f98da242.jpg, https://salt.tikicdn.com/cache/200x280/ts/product/87/1d/83/de344bede0ecaeb63b23497a27f6cd8c.jpg, https://salt.tikicdn.com/cache/200x280/ts/product/fa/3e/46/19c0f8ba7fd34b31498a987945f83147.jpg, https://salt.tikicdn.com/cache/200x280/ts/product/be/6e/d6/6ebc2f6c7a98ffc795d913167c1f8626.jpg, https://salt.tikicdn.com/cache/200x280/ts/product/bf/a9/fa/a258b2fe26400688fd585a3bed94fe87.jpg, https://salt.tikicdn.com/cache/200x280/ts/product/5a/42/9b/8d5dbf99668555fa77b16b7c0cc868c2.jpg, https://salt.tikicdn.com/cache/200x280/ts/product/cc/fb/c2/1dad741ae1fe9c1980bd0b56cfdd3f01.jpg, https://salt.tikicdn.com/cache/200x280/ts/product/3c/07/6b/8cc794735d95bdb1d8ffcd21fc8fcc10.jpg, https://salt.tikicdn.com/cache/200x280/ts/product/0a/13/4e/e471f3062e90bc1adfeab798b71f97f2.jpg","https://salt.tikicdn.com/cache/200x280/ts/product/58/39/fb/b1666574370a7e107246c3a328ca71b6.jpg, https://salt.tikicdn.com/cache/200x280/ts/product/5d/f9/9d/99ec6920f7db590575362c2c556c188a.jpg, https://salt.tikicdn.com/cache/200x280/ts/product/e3/70/c8/227511cbfef9bf2f93fbf7fd559090e0.jpg, https://salt.tikicdn.com/cache/200x280/ts/product/55/95/93/3183c25755bce1c4d7aa2b7908df0b57.jpg, https://salt.tikicdn.com/cache/200x280/ts/product/8c/dd/cc/d546ef383a94c089f28a95512f0baf29.jpg, https://salt.tikicdn.com/cache/200x280/ts/product/72/0d/5d/a76d47d4edce9461d0efec8c0530746f.jpg, https://salt.tikicdn.com/cache/200x280/ts/product/af/b7/eb/e873ff7aa8e3fc5188b85059344de28d.jpg, https://salt.tikicdn.com/cache/200x280/ts/product/57/8a/45/9f5948036e5c5009745bba49f98da242.jpg, https://salt.tikicdn.com/cache/200x280/ts/product/87/1d/83/de344bede0ecaeb63b23497a27f6cd8c.jpg, https://salt.tikicdn.com/cache/200x280/ts/product/fa/3e/46/19c0f8ba7fd34b31498a987945f83147.jpg, https://salt.tikicdn.com/cache/200x280/ts/product/be/6e/d6/6ebc2f6c7a98ffc795d913167c1f8626.jpg, https://salt.tikicdn.com/cache/200x280/ts/product/bf/a9/fa/a258b2fe26400688fd585a3bed94fe87.jpg, https://salt.tikicdn.com/cache/200x280/ts/product/5a/42/9b/8d5dbf99668555fa77b16b7c0cc868c2.jpg, https://salt.tikicdn.com/cache/200x280/ts/product/cc/fb/c2/1dad741ae1fe9c1980bd0b56cfdd3f01.jpg, https://salt.tikicdn.com/cache/200x280/ts/product/3c/07/6b/8cc794735d95bdb1d8ffcd21fc8fcc10.jpg, https://salt.tikicdn.com/cache/200x280/ts/product/0a/13/4e/e471f3062e90bc1adfeab798b71f97f2.jpg",1000,0
317677,"Shipwreck on the Pirate Islands (Geronimo Stilton, No. 18)",192000,My sister had come up with a new way to torment me. She'd combined my two least favorite things - travel and ghosts! Thea had heard rumors of a haunted pirate treasure buried on a desert island. And b...,"My sister had come up with a new way to torment me. She'd combined my two least favorite things - travel and ghosts! Thea had heard rumors of a haunted pirate treasure buried on a desert island. And before I could say ""avast ye scurvy rats,"" she'd dragged me into her treasure hunt! Giá sản phẩm trên Tiki đã bao gồm thuế theo luật hiện hành. Bên cạnh đó, tuỳ vào loại sản phẩm, hình thức và địa chỉ giao hàng mà có thể phát sinh thêm chi phí khác như phí vận chuyển, phụ phí hàng cồng kềnh, thuế nhập khẩu (đối với đơn hàng giao từ nước ngoài có giá trị trên 1 triệu đồng).....",0,0,https://salt.tikicdn.com/media/catalog/product/i/m/image_3064.jpg,https://salt.tikicdn.com/cache/w1200/media/catalog/product/i/m/image_3064.jpg,https://salt.tikicdn.com/cache/w300/media/catalog/product/i/m/image_3064.jpg,https://salt.tikicdn.com/cache/200x280/media/catalog/product/i/m/image_3064.jpg,https://salt.tikicdn.com/cache/200x280/media/catalog/product/i/m/image_3064.jpg,1000,0
317674,"Surf's Up, Geronimo! (Geronimo Stilton, No. 20)",192000,"Ah, there's nothing like a relaxing vacation on the beach! I would spread out by the crystal-clear water with a good book. What more could a mouse want? At least, that was the plan. But somehow, my va...","Ah, there's nothing like a relaxing vacation on the beach! I would spread out by the crystal-clear water with a good book. What more could a mouse want? At least, that was the plan. But somehow, my vacations never seem to go according to plan. Instead of a beautiful seaside resort, I found myself in a fleabag hotel that was falling down around my ears! Oh, would I ever be able to relax and enjoy my vacation?? Giá sản phẩm trên Tiki đã bao gồm thuế theo luật hiện hành. Bên cạnh đó, tuỳ vào loại sản phẩm, hình thức và địa chỉ giao hàng mà có thể phát sinh thêm chi phí khác như phí vận chuyển, phụ phí hàng cồng kềnh, thuế nhập khẩu (đối với đơn hàng giao từ nước ngoài có giá trị trên 1 triệu đồng).....",0,0,https://salt.tikicdn.com/media/catalog/product/i/m/image_3061.jpg,https://salt.tikicdn.com/cache/w1200/media/catalog/product/i/m/image_3061.jpg,https://salt.tikicdn.com/cache/w300/media/catalog/product/i/m/image_3061.jpg,https://salt.tikicdn.com/cache/200x280/media/catalog/product/i/m/image_3061.jpg,https://salt.tikicdn.com/cache/200x280/media/catalog/product/i/m/image_3061.jpg,1000,0
317668,The Mummy with No Name (Geronimo Stilton #26),192000,"Halloween and Egypt and mummies . . . oh, my!  I admit it, I am a 'fraidy mouse.  Halloween scares me out of my fur!  But this Halloween, I was heading off on an adventure in one of my very favorite p...","Halloween and Egypt and mummies . . . oh, my!  I admit it, I am a 'fraidy mouse.  Halloween scares me out of my fur!  But this Halloween, I was heading off on an adventure in one of my very favorite places: Egypt.  I couldn't wait to see the sights and soak up some sun far away from New Mouse City.  What I didn't realize was that Halloween is popular in Egypt, too -- with the mummies, that is!  Oh, what's a 'fraidy mouse to do? Giá sản phẩm trên Tiki đã bao gồm thuế theo luật hiện hành. Bên cạnh đó, tuỳ vào loại sản phẩm, hình thức và địa chỉ giao hàng mà có thể phát sinh thêm chi phí khác như phí vận chuyển, phụ phí hàng cồng kềnh, thuế nhập khẩu (đối với đơn hàng giao từ nước ngoài có giá trị trên 1 triệu đồng).....",0,0,https://salt.tikicdn.com/ts/product/22/d3/66/9930e99bbb1cfb51718c943842976911.jpg,https://salt.tikicdn.com/cache/w1200/ts/product/22/d3/66/9930e99bbb1cfb51718c943842976911.jpg,https://salt.tikicdn.com/cache/w300/ts/product/22/d3/66/9930e99bbb1cfb51718c943842976911.jpg,https://salt.tikicdn.com/cache/200x280/ts/product/22/d3/66/9930e99bbb1cfb51718c943842976911.jpg,https://salt.tikicdn.com/cache/200x280/ts/product/22/d3/66/9930e99bbb1cfb51718c943842976911.jpg,1000,0
317651,"Attack of the Bandit Cats (Geronimo Stilton, No. 8)",192000,Ahoy! Geronimo's on a quest for pirate booty!Bìa sách có thể thay đổi theo ngày tái bản...,"Ahoy! Geronimo's on a quest for pirate booty! Bìa sách có thể thay đổi theo ngày tái bản Giá sản phẩm trên Tiki đã bao gồm thuế theo luật hiện hành. Bên cạnh đó, tuỳ vào loại sản phẩm, hình thức và địa chỉ giao hàng mà có thể phát sinh thêm chi phí khác như phí vận chuyển, phụ phí hàng cồng kềnh, thuế nhập khẩu (đối với đơn hàng giao từ nước ngoài có giá trị trên 1 triệu đồng).....",0,0,"https://salt.tikicdn.com/ts/product/07/bd/e7/29c03cb04efb3ae4911cb6d3b6659abd.jpg, https://salt.tikicdn.com/media/catalog/product/i/m/image_3038.jpg","https://salt.tikicdn.com/cache/w1200/ts/product/07/bd/e7/29c03cb04efb3ae4911cb6d3b6659abd.jpg, https://salt.tikicdn.com/cache/w1200/media/catalog/product/i/m/image_3038.jpg","https://salt.tikicdn.com/cache/w300/ts/product/07/bd/e7/29c03cb04efb3ae4911cb6d3b6659abd.jpg, https://salt.tikicdn.com/cache/w300/media/catalog/product/i/m/image_3038.jpg","https://salt.tikicdn.com/cache/200x280/ts/product/07/bd/e7/29c03cb04efb3ae4911cb6d3b6659abd.jpg, https://salt.tikicdn.com/cache/200x280/media/catalog/product/i/m/image_3038.jpg","https://salt.tikicdn.com/cache/200x280/ts/product/07/bd/e7/29c03cb04efb3ae4911cb6d3b6659abd.jpg, https://salt.tikicdn.com/cache/200x280/media/catalog/product/i/m/image_3038.jpg",1000,0
51591006,Truyện đọc tiếng Anh - Smart,435000,"Có một vụ giết người, nhưng cảnh sát không quan tâm. Rốt cuộc nạn nhân cũng chỉ là một ông già vô gia cư. Nhưng Kieran quan tâm. Anh ấy sẽ tìm hiểu những gì thực sự đã xảy ra.There's been a murder, b...","Có một vụ giết người, nhưng cảnh sát không quan tâm. Rốt cuộc nạn nhân cũng chỉ là một ông già vô gia cư. Nhưng Kieran quan tâm. Anh ấy sẽ tìm hiểu những gì thực sự đã xảy ra. There's been a murder, but the police don't care. It was only a homeless old man after all. Kieran cares. He's going to find out what really happened. To Colin. And to his grandma, who just stopped coming round one day. It's good that Kieran's a master of observation, and knows all the detective tricks of the trade. But being a detective is difficult when you're amazing at drawing but terrible at fitting in. And when there are dangerous secrets everywhere, not just outside, but under your own roof. Giá sản phẩm trên Tiki đã bao gồm thuế theo luật hiện hành. Bên cạnh đó, tuỳ vào loại sản phẩm, hình thức và địa chỉ giao hàng mà có thể phát sinh thêm chi phí khác như phí vận chuyển, phụ phí hàng cồng kềnh, thuế nhập khẩu (đối với đơn hàng giao từ nước ngoài có giá trị trên 1 triệu đồng).....",0,0,"https://salt.tikicdn.com/ts/product/36/c3/54/e7ccfca550b1d8c1a9827cb83fcdbdd8.jpg, https://salt.tikicdn.com/ts/product/10/b8/d4/a444f01c85872fc53c11cff90d052d6c.jpg, https://salt.tikicdn.com/ts/product/47/31/8f/4daf53815658fa2a19c0aaf2c2fe753e.jpg, https://salt.tikicdn.com/ts/product/72/97/5c/4d28f26227d1126101f9450c09f95158.jpg","https://salt.tikicdn.com/cache/w1200/ts/product/36/c3/54/e7ccfca550b1d8c1a9827cb83fcdbdd8.jpg, https://salt.tikicdn.com/cache/w1200/ts/product/10/b8/d4/a444f01c85872fc53c11cff90d052d6c.jpg, https://salt.tikicdn.com/cache/w1200/ts/product/47/31/8f/4daf53815658fa2a19c0aaf2c2fe753e.jpg, https://salt.tikicdn.com/cache/w1200/ts/product/72/97/5c/4d28f26227d1126101f9450c09f95158.jpg","https://salt.tikicdn.com/cache/w300/ts/product/36/c3/54/e7ccfca550b1d8c1a9827cb83fcdbdd8.jpg, https://salt.tikicdn.com/cache/w300/ts/product/10/b8/d4/a444f01c85872fc53c11cff90d052d6c.jpg, https://salt.tikicdn.com/cache/w300/ts/product/47/31/8f/4daf53815658fa2a19c0aaf2c2fe753e.jpg, https://salt.tikicdn.com/cache/w300/ts/product/72/97/5c/4d28f26227d1126101f9450c09f95158.jpg","https://salt.tikicdn.com/cache/200x280/ts/product/36/c3/54/e7ccfca550b1d8c1a9827cb83fcdbdd8.jpg, https://salt.tikicdn.com/cache/200x280/ts/product/10/b8/d4/a444f01c85872fc53c11cff90d052d6c.jpg, https://salt.tikicdn.com/cache/200x280/ts/product/47/31/8f/4daf53815658fa2a19c0aaf2c2fe753e.jpg, https://salt.tikicdn.com/cache/200x280/ts/product/72/97/5c/4d28f26227d1126101f9450c09f95158.jpg","https://salt.tikicdn.com/cache/200x280/ts/product/36/c3/54/e7ccfca550b1d8c1a9827cb83fcdbdd8.jpg, https://salt.tikicdn.com/cache/200x280/ts/product/10/b8/d4/a444f01c85872fc53c11cff90d052d6c.jpg, https://salt.tikicdn.com/cache/200x280/ts/product/47/31/8f/4daf53815658fa2a19c0aaf2c2fe753e.jpg, https://salt.tikicdn.com/cache/200x280/ts/product/72/97/5c/4d28f26227d1126101f9450c09f95158.jpg",1000,0
