id,name,price,short_description,description,rating_average,review_count,image_base_url,image_large_url,image_medium_url,image_small_url,image_thumbnail_url,stock,quantity_sold
274674682,Sabotage On The Solar Express,169200,"    Sabotage On The Solar Express   Ride into danger with Hal and Uncle Nat on the fifth breathtaking Adventures on Trains Mystery, Sabotage on the Solar Express, from bestselling award-winners M....","Sabotage On The Solar Express Ride into danger with Hal and Uncle Nat on the fifth breathtaking Adventures on Trains Mystery, Sabotage on the Solar Express, from bestselling award-winners M. G. Leonard and Sam Sedgman. Perfect for readers of 8 to 12 and brilliantly illustrated in black and white throughout by Elisa Paganelli. 'A thrilling and hugely entertaining adventure story' - David Walliams on The Highland Falcon Thief, the first book in the series. Billionaire train enthusiast August Reza has invited Harrison Beck and Uncle Nat on the maiden voyage of the Solar Express - the winning design of his Reza's Rocket competition. But during the journey, they discover the train has been sabotaged, hurtling passengers into a heart-stopping, action-packed, thrill ride across the Australian Outback. Can Hal find the saboteur and stop the runaway train before disaster strikes? Sabotage on the Solar Express can be read as a stand-alone novel, or enjoyed as part of the Adventures on Trains series. Join Hal and Uncle Nat on more stops in this thrilling series with: The Highland Falcon Thief, Kidnap on the California Comet, Murder on the Safari Star, and Danger at Dead Man's Pass. Praise for the Series: 'Like Murder on the Orient Express but better!' - Frank Cottrell-Boyce on The Highland Falcon Thief 'A first class choo-choo-dunnit!' - David Solomons on Kidnap on the California Comet 'A high-speed train journey worth catching . . .The best yet' - The Times on Murder on the Safari Star 'This series just gets better and better' - Maz Evans on Danger at Dead Man's Pass Giá sản phẩm trên Tiki đã bao gồm thuế theo luật hiện hành. Bên cạnh đó, tuỳ vào loại sản phẩm, hình thức và địa chỉ giao hàng mà có thể phát sinh thêm chi phí khác như phí vận chuyển, phụ phí hàng cồng kềnh, thuế nhập khẩu (đối với đơn hàng giao từ nước ngoài có giá trị trên 1 triệu đồng).....",0,0,"https://salt.tikicdn.com/ts/product/25/d0/2c/b8a5d0dfe277c5596d64eb963477ca53.jpg, https://salt.tikicdn.com/ts/product/62/f3/b3/c846eeba57a2a9bf099c8c4d310bceb5.jpg, https://salt.tikicdn.com/ts/product/f9/c2/fa/69d857e6209dba04a6b6a5ce61ae169e.jpg, https://salt.tikicdn.com/ts/product/d0/6c/05/8fc0b5eb063743451fd1bf40445aeb94.jpg, https://salt.tikicdn.com/ts/product/7c/f8/04/190bd0910306edc58ff4adeb6801d563.jpg, https://salt.tikicdn.com/ts/product/47/3f/d4/ac7d3b68d14288566e089ce15c6fce2f.jpg","https://salt.tikicdn.com/cache/w1200/ts/product/25/d0/2c/b8a5d0dfe277c5596d64eb963477ca53.jpg, https://salt.tikicdn.com/cache/w1200/ts/product/62/f3/b3/c846eeba57a2a9bf099c8c4d310bceb5.jpg, https://salt.tikicdn.com/cache/w1200/ts/product/f9/c2/fa/69d857e6209dba04a6b6a5ce61ae169e.jpg, https://salt.tikicdn.com/cache/w1200/ts/product/d0/6c/05/8fc0b5eb063743451fd1bf40445aeb94.jpg, https://salt.tikicdn.com/cache/w1200/ts/product/7c/f8/04/190bd0910306edc58ff4adeb6801d563.jpg, https://salt.tikicdn.com/cache/w1200/ts/product/47/3f/d4/ac7d3b68d14288566e089ce15c6fce2f.jpg","https://salt.tikicdn.com/cache/w300/ts/product/25/d0/2c/b8a5d0dfe277c5596d64eb963477ca53.jpg, https://salt.tikicdn.com/cache/w300/ts/product/62/f3/b3/c846eeba57a2a9bf099c8c4d310bceb5.jpg, https://salt.tikicdn.com/cache/w300/ts/product/f9/c2/fa/69d857e6209dba04a6b6a5ce61ae169e.jpg, https://salt.tikicdn.com/cache/w300/ts/product/d0/6c/05/8fc0b5eb063743451fd1bf40445aeb94.jpg, https://salt.tikicdn.com/cache/w300/ts/product/7c/f8/04/190bd0910306edc58ff4adeb6801d563.jpg, https://salt.tikicdn.com/cache/w300/ts/product/47/3f/d4/ac7d3b68d14288566e089ce15c6fce2f.jpg","https://salt.tikicdn.com/cache/200x280/ts/product/25/d0/2c/b8a5d0dfe277c5596d64eb963477ca53.jpg, https://salt.tikicdn.com/cache/200x280/ts/product/62/f3/b3/c846eeba57a2a9bf099c8c4d310bceb5.jpg, https://salt.tikicdn.com/cache/200x280/ts/product/f9/c2/fa/69d857e6209dba04a6b6a5ce61ae169e.jpg, https://salt.tikicdn.com/cache/200x280/ts/product/d0/6c/05/8fc0b5eb063743451fd1bf40445aeb94.jpg, https://salt.tikicdn.com/cache/200x280/ts/product/7c/f8/04/190bd0910306edc58ff4adeb6801d563.jpg, https://salt.tikicdn.com/cache/200x280/ts/product/47/3f/d4/ac7d3b68d14288566e089ce15c6fce2f.jpg","https://salt.tikicdn.com/cache/200x280/ts/product/25/d0/2c/b8a5d0dfe277c5596d64eb963477ca53.jpg, https://salt.tikicdn.com/cache/200x280/ts/product/62/f3/b3/c846eeba57a2a9bf099c8c4d310bceb5.jpg, https://salt.tikicdn.com/cache/200x280/ts/product/f9/c2/fa/69d857e6209dba04a6b6a5ce61ae169e.jpg, https://salt.tikicdn.com/cache/200x280/ts/product/d0/6c/05/8fc0b5eb063743451fd1bf40445aeb94.jpg, https://salt.tikicdn.com/cache/200x280/ts/product/7c/f8/04/190bd0910306edc58ff4adeb6801d563.jpg, https://salt.tikicdn.com/cache/200x280/ts/product/47/3f/d4/ac7d3b68d14288566e089ce15c6fce2f.jpg",1000,0
274674510,Nate the Great,128200,"    Shortly after a breakfast generously supplied with pancakes, Natethe Great got an urgent call from Annie.   ""I lost a picture, "" said Annie. ""Can you help me find it?""   ""Of course, "" said Na...","Shortly after a breakfast generously supplied with pancakes, Natethe Great got an urgent call from Annie. ""I lost a picture, "" said Annie. ""Can you help me find it?"" ""Of course, "" said Nate. ""I have found lost balloons, books, slippers, chickens. Even a lost goldfish. Now I, Nate the Great, will find a lost picture."" ""Oh, good, "" Annie said. Nate, with the cool detachment of a Sam Spade, immediately plunges into his new and baffling case. Gatting all the facts, asking the right questions, narrowing down the suspects. Nate, the boy detective who ""likes to work alone, "" solves the mystery and tracks down the culprit. In the process he also discovers the whereabouts of Super Hex, the missing cat. Giá sản phẩm trên Tiki đã bao gồm thuế theo luật hiện hành. Bên cạnh đó, tuỳ vào loại sản phẩm, hình thức và địa chỉ giao hàng mà có thể phát sinh thêm chi phí khác như phí vận chuyển, phụ phí hàng cồng kềnh, thuế nhập khẩu (đối với đơn hàng giao từ nước ngoài có giá trị trên 1 triệu đồng).....",0,0,"https://salt.tikicdn.com/ts/product/d7/00/f2/72fd41bf93019f23fb55af55398042ae.jpg, https://salt.tikicdn.com/ts/product/fb/a5/fd/2b1286e3dc75e6c38a009ac8497afb1f.jpg, https://salt.tikicdn.com/ts/product/a5/c6/ef/5534b30543ee16f95f68b958c2fb833b.jpg, https://salt.tikicdn.com/ts/product/e6/6b/e2/16166809b8a94749d9eeba11290fda13.jpg, https://salt.tikicdn.com/ts/product/49/7a/ea/d8795cdee7c398b4e72eb1d6a24b0ea8.jpg, https://salt.tikicdn.com/ts/product/9b/89/3b/4bf487bbf1afede4a36aec574a7eeee8.jpg, https://salt.tikicdn.com/ts/product/65/06/af/c65d53db6c4849828e7e7a415ba1e6bb.jpg, https://salt.tikicdn.com/ts/product/ff/65/c5/c2afb9cb13bc8570cf6390c16d670896.jpg, https://salt.tikicdn.com/ts/product/a9/14/d2/42c492123b16efc8f237a2b99914999a.jpg, https://salt.tikicdn.com/ts/product/81/e8/ba/906f0d3080dd70a46de69dee7ebd2f85.jpg","https://salt.tikicdn.com/cache/w1200/ts/product/d7/00/f2/72fd41bf93019f23fb55af55398042ae.jpg, https://salt.tikicdn.com/cache/w1200/ts/product/fb/a5/fd/2b1286e3dc75e6c38a009ac8497afb1f.jpg, https://salt.tikicdn.com/cache/w1200/ts/product/a5/c6/ef/5534b30543ee16f95f68b958c2fb833b.jpg, https://salt.tikicdn.com/cache/w1200/ts/product/e6/6b/e2/16166809b8a94749d9eeba11290fda13.jpg, https://salt.tikicdn.com/cache/w1200/ts/product/49/7a/ea/d8795cdee7c398b4e72eb1d6a24b0ea8.jpg, https://salt.tikicdn.com/cache/w1200/ts/product/9b/89/3b/4bf487bbf1afede4a36aec574a7eeee8.jpg, https://salt.tikicdn.com/cache/w1200/ts/product/65/06/af/c65d53db6c4849828e7e7a415ba1e6bb.jpg, https://salt.tikicdn.com/cache/w1200/ts/product/ff/65/c5/c2afb9cb13bc8570cf6390c16d670896.jpg, https://salt.tikicdn.com/cache/w1200/ts/product/a9/14/d2/42c492123b16efc8f237a2b99914999a.jpg, https://salt.tikicdn.com/cache/w1200/ts/product/81/e8/ba/906f0d3080dd70a46de69dee7ebd2f85.jpg","https://salt.tikicdn.com/cache/w300/ts/product/d7/00/f2/72fd41bf93019f23fb55af55398042ae.jpg, https://salt.tikicdn.com/cache/w300/ts/product/fb/a5/fd/2b1286e3dc75e6c38a009ac8497afb1f.jpg, https://salt.tikicdn.com/cache/w300/ts/product/a5/c6/ef/5534b30543ee16f95f68b958c2fb833b.jpg, https://salt.tikicdn.com/cache/w300/ts/product/e6/6b/e2/16166809b8a94749d9eeba11290fda13.jpg, https://salt.tikicdn.com/cache/w300/ts/product/49/7a/ea/d8795cdee7c398b4e72eb1d6a24b0ea8.jpg, https://salt.tikicdn.com/cache/w300/ts/product/9b/89/3b/4bf487bbf1afede4a36aec574a7eeee8.jpg, https://salt.tikicdn.com/cache/w300/ts/product/65/06/af/c65d53db6c4849828e7e7a415ba1e6bb.jpg, https://salt.tikicdn.com/cache/w300/ts/product/ff/65/c5/c2afb9cb13bc8570cf6390c16d670896.jpg, https://salt.tikicdn.com/cache/w300/ts/product/a9/14/d2/42c492123b16efc8f237a2b99914999a.jpg, https://salt.tikicdn.com/cache/w300/ts/product/81/e8/ba/906f0d3080dd70a46de69dee7ebd2f85.jpg","https://salt.tikicdn.com/cache/200x280/ts/product/d7/00/f2/72fd41bf93019f23fb55af55398042ae.jpg, https://salt.tikicdn.com/cache/200x280/ts/product/fb/a5/fd/2b1286e3dc75e6c38a009ac8497afb1f.jpg, https://salt.tikicdn.com/cache/200x280/ts/product/a5/c6/ef/5534b30543ee16f95f68b958c2fb833b.jpg, https://salt.tikicdn.com/cache/200x280/ts/product/e6/6b/e2/16166809b8a94749d9eeba11290fda13.jpg, https://salt.tikicdn.com/cache/200x280/ts/product/49/7a/ea/d8795cdee7c398b4e72eb1d6a24b0ea8.jpg, https://salt.tikicdn.com/cache/200x280/ts/product/9b/89/3b/4bf487bbf1afede4a36aec574a7eeee8.jpg, https://salt.tikicdn.com/cache/200x280/ts/product/65/06/af/c65d53db6c4849828e7e7a415ba1e6bb.jpg, https://salt.tikicdn.com/cache/200x280/ts/product/ff/65/c5/c2afb9cb13bc8570cf6390c16d670896.jpg, https://salt.tikicdn.com/cache/200x280/ts/product/a9/14/d2/42c492123b16efc8f237a2b99914999a.jpg, https://salt.tikicdn.com/cache/200x280/ts/product/81/e8/ba/906f0d3080dd70a46de69dee7ebd2f85.jpg","https://salt.tikicdn.com/cache/200x280/ts/product/d7/00/f2/72fd41bf93019f23fb55af55398042ae.jpg, https://salt.tikicdn.com/cache/200x280/ts/product/fb/a5/fd/2b1286e3dc75e6c38a009ac8497afb1f.jpg, https://salt.tikicdn.com/cache/200x280/ts/product/a5/c6/ef/5534b30543ee16f95f68b958c2fb833b.jpg, https://salt.tikicdn.com/cache/200x280/ts/product/e6/6b/e2/16166809b8a94749d9eeba11290fda13.jpg, https://salt.tikicdn.com/cache/200x280/ts/product/49/7a/ea/d8795cdee7c398b4e72eb1d6a24b0ea8.jpg, https://salt.tikicdn.com/cache/200x280/ts/product/9b/89/3b/4bf487bbf1afede4a36aec574a7eeee8.jpg, https://salt.tikicdn.com/cache/200x280/ts/product/65/06/af/c65d53db6c4849828e7e7a415ba1e6bb.jpg, https://salt.tikicdn.com/cache/200x280/ts/product/ff/65/c5/c2afb9cb13bc8570cf6390c16d670896.jpg, https://salt.tikicdn.com/cache/200x280/ts/product/a9/14/d2/42c492123b16efc8f237a2b99914999a.jpg, https://salt.tikicdn.com/cache/200x280/ts/product/81/e8/ba/906f0d3080dd70a46de69dee7ebd2f85.jpg",1000,0
274540534,Warriors Series 4 Omen Of The Stars - 6 Books Collection Set By Erin Hunter,1684000,"THÔNG TIN SÁCH Loại bìa: BÌa mềmSố trang: 2256Kích thước: 198 x 130 x 135 mmThis collectible, giftable box set contains paperback editions of all six epic adventures in Erin Hunter's nationally be...","THÔNG TIN SÁCH Loại bìa: BÌa mềm Số trang: 2256 Kích thước: 198 x 130 x 135 mm This collectible, giftable box set contains paperback editions of all six epic adventures in Erin Hunter's nationally bestselling Warriors: Omen of the Stars story arc. It has been foretold that three ThunderClan cats-Jayfeather, Lionblaze, and Dovepaw-will hold the power of the stars in their paws. Together, they must unravel the truth behind the ancient words of the prophecy. But the dark shadows that have preyed on the Clans for many moons are gaining strength, determined to tear the four Clans apart. As a catastrophic battle with the Dark Forest draws nearer, Jayfeather, Lionblaze, and Dovepaw learn of another, more ominous prophecy, which reveals that a mysterious fourth cat must join them in order to save the warrior Clans from utter destruction. Each book in the Omen of the Stars story arc includes a mission in the Warriors Adventure Game. Bộ hộp sưu tập, quà tặng này chứa các phiên bản bìa mềm của tất cả sáu cuộc phiêu lưu hoành tráng trong vòng cung câu chuyện Warriors: Omen of the Stars bán chạy nhất toàn quốc của Erin Hunter. Người ta đã báo trước rằng ba con mèo ThunderClan - Jayfeather, Lionblaze và Dovepaw - sẽ giữ sức mạnh của các ngôi sao trong bàn chân của chúng. Cùng nhau, họ phải làm sáng tỏ sự thật đằng sau những lời tiên tri cổ xưa. Nhưng những bóng tối đã săn lùng các Gia tộc trong nhiều mặt trăng đang có được sức mạnh, quyết tâm xé nát bốn Gia tộc. Khi một trận chiến thảm khốc với Dark Forest đến gần, Jayfeather, Lionblaze và Dovepaw biết được một lời tiên tri khác, đáng ngại hơn, tiết lộ rằng một con mèo thứ tư bí ẩn phải tham gia cùng họ để cứu các gia tộc chiến binh khỏi sự hủy diệt hoàn toàn. Mỗi cuốn sách trong vòng cung câu chuyện Omen of the Stars bao gồm một nhiệm vụ trong Trò chơi Phiêu lưu Chiến binh. Giá sản phẩm trên Tiki đã bao gồm thuế theo luật hiện hành. Bên cạnh đó, tuỳ vào loại sản phẩm, hình thức và địa chỉ giao hàng mà có thể phát sinh thêm chi phí khác như phí vận chuyển, phụ phí hàng cồng kềnh, thuế nhập khẩu (đối với đơn hàng giao từ nước ngoài có giá trị trên 1 triệu đồng).....",0,0,https://salt.tikicdn.com/ts/product/3d/bf/bb/2d7c016e050763e88dbb14cd66a3a77b.jpeg,https://salt.tikicdn.com/cache/w1200/ts/product/3d/bf/bb/2d7c016e050763e88dbb14cd66a3a77b.jpeg,https://salt.tikicdn.com/cache/w300/ts/product/3d/bf/bb/2d7c016e050763e88dbb14cd66a3a77b.jpeg,https://salt.tikicdn.com/cache/200x280/ts/product/3d/bf/bb/2d7c016e050763e88dbb14cd66a3a77b.jpeg,https://salt.tikicdn.com/cache/200x280/ts/product/3d/bf/bb/2d7c016e050763e88dbb14cd66a3a77b.jpeg,1000,0
274387490,The P. K. Pinkerton Mysteries: The Case Of The Deadly Desperados,224000,The P. K. Pinkerton Mysteries: The Case Of The Deadly Desperados...,"The P. K. Pinkerton Mysteries: The Case Of The Deadly Desperados Giá sản phẩm trên Tiki đã bao gồm thuế theo luật hiện hành. Bên cạnh đó, tuỳ vào loại sản phẩm, hình thức và địa chỉ giao hàng mà có thể phát sinh thêm chi phí khác như phí vận chuyển, phụ phí hàng cồng kềnh, thuế nhập khẩu (đối với đơn hàng giao từ nước ngoài có giá trị trên 1 triệu đồng).....",0,0,https://salt.tikicdn.com/ts/product/99/64/1a/7fcc21bf14ef7e3e11229f78d8150ba8.jpg,https://salt.tikicdn.com/cache/w1200/ts/product/99/64/1a/7fcc21bf14ef7e3e11229f78d8150ba8.jpg,https://salt.tikicdn.com/cache/w300/ts/product/99/64/1a/7fcc21bf14ef7e3e11229f78d8150ba8.jpg,https://salt.tikicdn.com/cache/200x280/ts/product/99/64/1a/7fcc21bf14ef7e3e11229f78d8150ba8.jpg,https://salt.tikicdn.com/cache/200x280/ts/product/99/64/1a/7fcc21bf14ef7e3e11229f78d8150ba8.jpg,1000,0
274387478,The P. K. Pinkerton Mysteries: The Case Of The Pistol-Packing Widows,224000,The P. K. Pinkerton Mysteries: The Case Of The Pistol-Packing Widows...,"The P. K. Pinkerton Mysteries: The Case Of The Pistol-Packing Widows Giá sản phẩm trên Tiki đã bao gồm thuế theo luật hiện hành. Bên cạnh đó, tuỳ vào loại sản phẩm, hình thức và địa chỉ giao hàng mà có thể phát sinh thêm chi phí khác như phí vận chuyển, phụ phí hàng cồng kềnh, thuế nhập khẩu (đối với đơn hàng giao từ nước ngoài có giá trị trên 1 triệu đồng).....",0,0,https://salt.tikicdn.com/ts/product/37/61/cf/d65b386ead20cf28ad042ee1ee813fe4.jpg,https://salt.tikicdn.com/cache/w1200/ts/product/37/61/cf/d65b386ead20cf28ad042ee1ee813fe4.jpg,https://salt.tikicdn.com/cache/w300/ts/product/37/61/cf/d65b386ead20cf28ad042ee1ee813fe4.jpg,https://salt.tikicdn.com/cache/200x280/ts/product/37/61/cf/d65b386ead20cf28ad042ee1ee813fe4.jpg,https://salt.tikicdn.com/cache/200x280/ts/product/37/61/cf/d65b386ead20cf28ad042ee1ee813fe4.jpg,1000,0
274287365,The Bad Guys in Let the Games Begin (the Bad Guys 17) (Bad Guys),140000,"NOW A MAJOR MOTION PICTURE! ""I wish I'd had these books as a kid. Hilarious!"" -- Dav Pilkey, creator of Captain Underpants and Dog Man They may look like Bad Guys, but these wannabe heroes are doi...","NOW A MAJOR MOTION PICTURE! ""I wish I'd had these books as a kid. Hilarious!"" -- Dav Pilkey, creator of Captain Underpants and Dog Man They may look like Bad Guys, but these wannabe heroes are doing good  whether you like it or not in this New York Times bestselling illustrated series. OK. It’s time to stop messin’ around . . . In this book, the One IS going to be reunited with the Others. You ARE going to actually meet the REAL DREAD OVERLORD SPLAARGHÖN. And ONE CHARACTER is going to change EVERYTHING you thought you knew. This is the one you’ve been waiting for! Giá sản phẩm trên Tiki đã bao gồm thuế theo luật hiện hành. Bên cạnh đó, tuỳ vào loại sản phẩm, hình thức và địa chỉ giao hàng mà có thể phát sinh thêm chi phí khác như phí vận chuyển, phụ phí hàng cồng kềnh, thuế nhập khẩu (đối với đơn hàng giao từ nước ngoài có giá trị trên 1 triệu đồng).....",0,0,https://salt.tikicdn.com/ts/product/3a/87/71/e55f8be5584d8f251b1f31239f5d017f.jpg,https://salt.tikicdn.com/cache/w1200/ts/product/3a/87/71/e55f8be5584d8f251b1f31239f5d017f.jpg,https://salt.tikicdn.com/cache/w300/ts/product/3a/87/71/e55f8be5584d8f251b1f31239f5d017f.jpg,https://salt.tikicdn.com/cache/200x280/ts/product/3a/87/71/e55f8be5584d8f251b1f31239f5d017f.jpg,https://salt.tikicdn.com/cache/200x280/ts/product/3a/87/71/e55f8be5584d8f251b1f31239f5d017f.jpg,1000,0
274287338,The Bitter Past: A Mystery,280000,"In the tradition of Craig Johnson and C. J. Box, Bruce Borgos's The Bitter Past begins a compelling series set in the high desert of Nevada featuring Sheriff Porter Beck…Porter Beck is the sheriff in ...","In the tradition of Craig Johnson and C. J. Box, Bruce Borgos's The Bitter Past begins a compelling series set in the high desert of Nevada featuring Sheriff Porter Beck… Porter Beck is the sheriff in the high desert of Nevada, north of Las Vegas. Born and raised there, he left to join the Army, where he worked in Intelligence, deep in the shadows in far off places. Now he's back home, doing the same lawman's job his father once did, before his father started to develop dementia. All is relatively quiet in this corner of the world, until an old, retired FBI agent is found killed. He was brutally tortured before he was killed and clues at the scene point to a mystery dating back to the early days of the nuclear age. If that wasn't strange enough, a current FBI agent shows up to help Beck's investigation. In a case that unfolds in the past (the 1950s) and the present, it seems that a Russian spy infiltrated the nuclear testing site and now someone is looking for that long-ago, all-but forgotten person, who holds the key to what happened then and to the deadly goings on now. Giá sản phẩm trên Tiki đã bao gồm thuế theo luật hiện hành. Bên cạnh đó, tuỳ vào loại sản phẩm, hình thức và địa chỉ giao hàng mà có thể phát sinh thêm chi phí khác như phí vận chuyển, phụ phí hàng cồng kềnh, thuế nhập khẩu (đối với đơn hàng giao từ nước ngoài có giá trị trên 1 triệu đồng).....",0,0,https://salt.tikicdn.com/ts/product/3b/c0/b7/49965288919e4e4259b6a999603ab086.jpg,https://salt.tikicdn.com/cache/w1200/ts/product/3b/c0/b7/49965288919e4e4259b6a999603ab086.jpg,https://salt.tikicdn.com/cache/w300/ts/product/3b/c0/b7/49965288919e4e4259b6a999603ab086.jpg,https://salt.tikicdn.com/cache/200x280/ts/product/3b/c0/b7/49965288919e4e4259b6a999603ab086.jpg,https://salt.tikicdn.com/cache/200x280/ts/product/3b/c0/b7/49965288919e4e4259b6a999603ab086.jpg,1000,0
274287334,The Adventures of Amina al-Sirafi: A new fantasy series set a thousand years before The City of Brass,243000,"Shannon Chakraborty, the bestselling author of The City of Brass, spins a new trilogy of magic and mayhem on the high seas in this tale of pirates and sorcerers, forbidden artifacts and ancient myster...","Shannon Chakraborty, the bestselling author of The City of Brass , spins a new trilogy of magic and mayhem on the high seas in this tale of pirates and sorcerers, forbidden artifacts and ancient mysteries, in one woman’s determined quest to seize a final chance at glory—and write her own legend. Amina al-Sirafi should be content. After a storied and scandalous career as one of the Indian Ocean’s most notorious pirates, she’s survived backstabbing rogues, vengeful merchant princes, several husbands, and one actual demon to retire peacefully with her family to a life of piety, motherhood, and absolutely nothing that hints of the supernatural. But when she’s tracked down by the obscenely wealthy mother of a former crewman, she’s offered a job no bandit could refuse: retrieve her comrade’s kidnapped daughter for a kingly sum. The chance to have one last adventure with her crew, do right by an old friend, and win a fortune that will secure her family’s future forever? It seems like such an obvious choice that it must be God’s will. Yet the deeper Amina dives, the more it becomes alarmingly clear there’s more to this job, and the girl’s disappearance, than she was led to believe. For there’s always risk in wanting to become a legend, to seize one last chance at glory, to savor just a bit more power…and the price might be your very soul. Supplemental enhancement PDF accompanies the audiobook. PLEASE NOTE: When you purchase this title, the accompanying PDF will be available in your Audible Library along with the audio. Giá sản phẩm trên Tiki đã bao gồm thuế theo luật hiện hành. Bên cạnh đó, tuỳ vào loại sản phẩm, hình thức và địa chỉ giao hàng mà có thể phát sinh thêm chi phí khác như phí vận chuyển, phụ phí hàng cồng kềnh, thuế nhập khẩu (đối với đơn hàng giao từ nước ngoài có giá trị trên 1 triệu đồng).....",5,1,https://salt.tikicdn.com/ts/product/07/ff/d0/96531f659e415474d59619c58021f554.jpg,https://salt.tikicdn.com/cache/w1200/ts/product/07/ff/d0/96531f659e415474d59619c58021f554.jpg,https://salt.tikicdn.com/cache/w300/ts/product/07/ff/d0/96531f659e415474d59619c58021f554.jpg,https://salt.tikicdn.com/cache/200x280/ts/product/07/ff/d0/96531f659e415474d59619c58021f554.jpg,https://salt.tikicdn.com/cache/200x280/ts/product/07/ff/d0/96531f659e415474d59619c58021f554.jpg,1000,1
