id,name,price,short_description,description,rating_average,review_count,image_base_url,image_large_url,image_medium_url,image_small_url,image_thumbnail_url,stock,quantity_sold
274387492,The P. K. Pinkerton Mysteries: The Case Of The Bogus Detective,224000,The P. K. Pinkerton Mysteries: The Case Of The Bogus Detective...,"The P. K. Pinkerton Mysteries: The Case Of The Bogus Detective Giá sản phẩm trên Tiki đã bao gồm thuế theo luật hiện hành. Bên cạnh đó, tuỳ vào loại sản phẩm, hình thức và địa chỉ giao hàng mà có thể phát sinh thêm chi phí khác như phí vận chuyển, phụ phí hàng cồng kềnh, thuế nhập khẩu (đối với đơn hàng giao từ nước ngoài có giá trị trên 1 triệu đồng).....",0,0,https://salt.tikicdn.com/ts/product/e1/2b/f8/a0f583b9b9a4a6cb38199071cf1a67a9.jpg,https://salt.tikicdn.com/cache/w1200/ts/product/e1/2b/f8/a0f583b9b9a4a6cb38199071cf1a67a9.jpg,https://salt.tikicdn.com/cache/w300/ts/product/e1/2b/f8/a0f583b9b9a4a6cb38199071cf1a67a9.jpg,https://salt.tikicdn.com/cache/200x280/ts/product/e1/2b/f8/a0f583b9b9a4a6cb38199071cf1a67a9.jpg,https://salt.tikicdn.com/cache/200x280/ts/product/e1/2b/f8/a0f583b9b9a4a6cb38199071cf1a67a9.jpg,1000,0
274287322,The House of Eve,421000,Summary of content1950s Philadelphia: fifteen-year-old Ruby Pearsall is on track to becoming the first in her family to attend college. But a taboo love affair threatens to pull her back down into th...,"Summary of content 1950s Philadelphia: fifteen-year-old Ruby Pearsall is on track to becoming the first in her family to attend college. But a taboo love affair threatens to pull her back down into the poverty and desperation that has been passed on to her like a birthright. Eleanor Quarles arrives in Washington, DC, with ambition and secrets. When she meets the handsome William Pride at Howard University, they fall madly in love. But William hails from one of DC’s elite wealthy Black families, and his parents don’t let just anyone into their fold. Eleanor hopes that a baby will make her finally feel at home in William’s family and grant her the life she’s been searching for. But having a baby—and fitting in—is easier said than done. With their stories colliding in the most unexpected of ways, Ruby and Eleanor will both make decisions that shape the trajectory of their lives. Philadelphia thập niên 1950: cô bé Ruby Pearsall mười lăm tuổi đang trên con đường trở thành người đầu tiên trong gia đình mình vào đại học. Nhưng một mối tình bị cấm đoán đe dọa kéo cô trở lại cuộc sống nghèo khó và tuyệt vọng mà cô đã thừa hưởng như một di sản. Eleanor Quarles đến Washington, DC, với hoài bão và những bí mật. Khi cô gặp gỡ chàng trai đẹp William Pride tại Đại học Howard, họ lập tức yêu nhau say đắm. Nhưng William xuất thân từ một trong những gia đình người da đen giàu có và danh tiếng nhất DC, và cha mẹ anh không cho phép bất kỳ ai cũng được gia nhập vào gia đình họ. Eleanor hy vọng rằng một đứa trẻ sẽ giúp cô cuối cùng cảm thấy như ở nhà trong gia đình William và mang lại cho cô cuộc sống mà cô đã tìm kiếm. Nhưng việc có con – và hòa nhập – không hề dễ dàng. Khi những câu chuyện của họ va chạm theo những cách không ngờ nhất, Ruby và Eleanor sẽ đều đưa ra những quyết định định hình quỹ đạo cuộc sống của mình. Review “Amazing…I was completely surprised by the ending of this beautifully told and written book.”—Reese Witherspoon “Thật tuyệt vời… Tôi hoàn toàn bất ngờ với cái kết của cuốn sách được kể và viết tuyệt đẹp này.”—Reese Witherspoon “A triumph of historical fiction” ( The Washington Post ), an instant New York Times bestseller, and a Reese’s Book Club pick, set in 1950s Philadelphia and Washington, DC, that explores what it means to be a woman and a mother, and how much one is willing to sacrifice to achieve her greatest goal. “Một chiến thắng của tiểu thuyết lịch sử” (The Washington Post), một cuốn sách bán chạy nhất của New York Times và được Câu lạc bộ sách Reese lựa chọn, lấy bối cảnh Philadelphia và Washington, DC những năm 1950, khám phá ý nghĩa của việc trở thành một người phụ nữ và một người mẹ, và người ta sẵn sàng hy sinh bao nhiêu để đạt được mục tiêu lớn nhất của mình. Giá sản phẩm trên Tiki đã bao gồm thuế theo luật hiện hành. Bên cạnh đó, tuỳ vào loại sản phẩm, hình thức và địa chỉ giao hàng mà có thể phát sinh thêm chi phí khác như phí vận chuyển, phụ phí hàng cồng kềnh, thuế nhập khẩu (đối với đơn hàng giao từ nước ngoài có giá trị trên 1 triệu đồng).....",0,0,https://salt.tikicdn.com/ts/product/ee/af/1c/160922f4946f2260440aa003134d8236.jpg,https://salt.tikicdn.com/cache/w1200/ts/product/ee/af/1c/160922f4946f2260440aa003134d8236.jpg,https://salt.tikicdn.com/cache/w300/ts/product/ee/af/1c/160922f4946f2260440aa003134d8236.jpg,https://salt.tikicdn.com/cache/200x280/ts/product/ee/af/1c/160922f4946f2260440aa003134d8236.jpg,https://salt.tikicdn.com/cache/200x280/ts/product/ee/af/1c/160922f4946f2260440aa003134d8236.jpg,1000,0
271296054,Dog Man #1,249000,"From worldwide bestselling author and artist Dav Pilkey comes Dog Man, the canine cop who's part dog, part man, and ALL HERO! George and Harold have created a new breed of justice. With the head of ...","From worldwide bestselling author and artist Dav Pilkey comes Dog Man, the canine cop who's part dog, part man, and ALL HERO! George and Harold have created a new breed of justice. With the head of a dog and the body of a human, this heroic hound digs into deception, claws after crooks, rolls over robbers, and scampers after squirrels. Will he be able to resist the call of the wild to answer the call of duty? Dav Pilkey's wildly popular Dog Man series appeals to readers of all ages and explores universally positive themes, including empathy, kindness, persistence, and the importance of being true to one's self. Giá sản phẩm trên Tiki đã bao gồm thuế theo luật hiện hành. Bên cạnh đó, tuỳ vào loại sản phẩm, hình thức và địa chỉ giao hàng mà có thể phát sinh thêm chi phí khác như phí vận chuyển, phụ phí hàng cồng kềnh, thuế nhập khẩu (đối với đơn hàng giao từ nước ngoài có giá trị trên 1 triệu đồng).....",0,0,https://salt.tikicdn.com/ts/product/9b/f0/d8/b2f0aa22dbec17d4becc76b994604a9f.jpg,https://salt.tikicdn.com/cache/w1200/ts/product/9b/f0/d8/b2f0aa22dbec17d4becc76b994604a9f.jpg,https://salt.tikicdn.com/cache/w300/ts/product/9b/f0/d8/b2f0aa22dbec17d4becc76b994604a9f.jpg,https://salt.tikicdn.com/cache/200x280/ts/product/9b/f0/d8/b2f0aa22dbec17d4becc76b994604a9f.jpg,https://salt.tikicdn.com/cache/200x280/ts/product/9b/f0/d8/b2f0aa22dbec17d4becc76b994604a9f.jpg,1000,0
270994645,Captain Underpants #9: Captain Underpants And The Terrifying Return Of Tippy Tinkletrousers,239000,"Captain Underpants #9: Captain Underpants And The Terrifying Return Of Tippy Tinkletrousers Laugh out loud with the color editions of Captain Underpants, the #1 New York Times bestselling series fro...","Captain Underpants #9: Captain Underpants And The Terrifying Return Of Tippy Tinkletrousers Laugh out loud with the color editions of Captain Underpants, the #1 New York Times bestselling series from Dav Pilkey, the creator of Dog Man! George and Harold are behind bars for a crime they didn't commit! But just as they are settling into their new life, they are pulled from prison by a time-traveling tyrant named Tippy Tinkletrousers! Now the boys are taking a trip back in time to the carefree days of kindergarten, when the scariest thing they had to face was not evil mad scientists or alien cafeteria ladies but a sixth-grade bully named Kipper Krupp, the nephew of their clueless school principal. And because George and Harold don't invent Captain Underpants until they're in fourth grade, the clever kindergartners are on their own. Can they beat the bullies with brainpower instead of Wedgie Power? Giá sản phẩm trên Tiki đã bao gồm thuế theo luật hiện hành. Bên cạnh đó, tuỳ vào loại sản phẩm, hình thức và địa chỉ giao hàng mà có thể phát sinh thêm chi phí khác như phí vận chuyển, phụ phí hàng cồng kềnh, thuế nhập khẩu (đối với đơn hàng giao từ nước ngoài có giá trị trên 1 triệu đồng).....",0,0,https://salt.tikicdn.com/ts/product/2c/ae/46/f28f8baf26207528ec22d79b0779297e.jpg,https://salt.tikicdn.com/cache/w1200/ts/product/2c/ae/46/f28f8baf26207528ec22d79b0779297e.jpg,https://salt.tikicdn.com/cache/w300/ts/product/2c/ae/46/f28f8baf26207528ec22d79b0779297e.jpg,https://salt.tikicdn.com/cache/200x280/ts/product/2c/ae/46/f28f8baf26207528ec22d79b0779297e.jpg,https://salt.tikicdn.com/cache/200x280/ts/product/2c/ae/46/f28f8baf26207528ec22d79b0779297e.jpg,1000,0
267342620,Captain Underpants #8: Captain Underpants And The Preposterous Plight Of The Purple Potty People (Color Edition),239000,Captain Underpants #8: Captain Underpants And The Preposterous Plight Of The Purple Potty People (Color Edition)Now in full color!George and Harold's time-traveling Purple Potty has landed them in a...,"Captain Underpants #8: Captain Underpants And The Preposterous Plight Of The Purple Potty People (Color Edition) Now in full color! George and Harold's time-traveling Purple Potty has landed them in a crazy place! The teachers are nice, the cafeteria serves delicious food, and the school principal, Mr. Krupp, thinks they're hilarious. Something is very, very wrong -- and it gets even wronger when the boys' pet pterodactyl, Crackers, and Sulu the Bionic Hamster are captured by George and Harold's evil-twin look-alikes. Now George and Harold must face their greatest foes yet: THEMSELVES! Can they handle this mess on their own, or will they need Captain Underpants to swoop in and save the day? Giá sản phẩm trên Tiki đã bao gồm thuế theo luật hiện hành. Bên cạnh đó, tuỳ vào loại sản phẩm, hình thức và địa chỉ giao hàng mà có thể phát sinh thêm chi phí khác như phí vận chuyển, phụ phí hàng cồng kềnh, thuế nhập khẩu (đối với đơn hàng giao từ nước ngoài có giá trị trên 1 triệu đồng).....",0,0,"https://salt.tikicdn.com/ts/product/39/1e/d5/e5fc07e146dcb13aa65b59b3e96400ee.jpg, https://salt.tikicdn.com/ts/product/0f/fb/21/65f0e1e9eaeb6757093891a11a5e6878.jpg","https://salt.tikicdn.com/cache/w1200/ts/product/39/1e/d5/e5fc07e146dcb13aa65b59b3e96400ee.jpg, https://salt.tikicdn.com/cache/w1200/ts/product/0f/fb/21/65f0e1e9eaeb6757093891a11a5e6878.jpg","https://salt.tikicdn.com/cache/w300/ts/product/39/1e/d5/e5fc07e146dcb13aa65b59b3e96400ee.jpg, https://salt.tikicdn.com/cache/w300/ts/product/0f/fb/21/65f0e1e9eaeb6757093891a11a5e6878.jpg","https://salt.tikicdn.com/cache/200x280/ts/product/39/1e/d5/e5fc07e146dcb13aa65b59b3e96400ee.jpg, https://salt.tikicdn.com/cache/200x280/ts/product/0f/fb/21/65f0e1e9eaeb6757093891a11a5e6878.jpg","https://salt.tikicdn.com/cache/200x280/ts/product/39/1e/d5/e5fc07e146dcb13aa65b59b3e96400ee.jpg, https://salt.tikicdn.com/cache/200x280/ts/product/0f/fb/21/65f0e1e9eaeb6757093891a11a5e6878.jpg",1000,0
263099036,The Magic Faraway Tree Collection,392400,"    The Magic Faraway Tree Collection   When Joe, Beth and Frannie move to the countryside, they discover that their new house lies next to the Enchanted Wood! And in that wood stands the Magic Fa...","The Magic Faraway Tree Collection When Joe, Beth and Frannie move to the countryside, they discover that their new house lies next to the Enchanted Wood! And in that wood stands the Magic Faraway Tree. This is no ordinary tree - it is home to more magical lands full of elves, pixies, talking creatures and wonderful adventures than the children ever imagined possible! Join the children and their new friends Moon-Face, Saucepan Man and Silky the Fairy as they explore this most magical of all fairytale worlds in the three original Magic Faraway Tree novels by beloved author Enid Blyton. Giá sản phẩm trên Tiki đã bao gồm thuế theo luật hiện hành. Bên cạnh đó, tuỳ vào loại sản phẩm, hình thức và địa chỉ giao hàng mà có thể phát sinh thêm chi phí khác như phí vận chuyển, phụ phí hàng cồng kềnh, thuế nhập khẩu (đối với đơn hàng giao từ nước ngoài có giá trị trên 1 triệu đồng).....",0,0,"https://salt.tikicdn.com/ts/product/f9/53/a9/9a2370c30a390a73893bf9d367e74016.jpg, https://salt.tikicdn.com/ts/product/c6/fb/c2/64eb2241eed6c8bac7879e8b7e452654.jpg, https://salt.tikicdn.com/ts/product/40/e9/37/d44b8e0ec4283bdb997789e5a835e832.jpg, https://salt.tikicdn.com/ts/product/5e/c8/52/59aecaa57253fefab85b555db22cb0ad.jpg, https://salt.tikicdn.com/ts/product/82/14/56/d0cc0db620e3300bd16cf134be85a76d.jpg, https://salt.tikicdn.com/ts/product/cb/05/9f/ff69f15629fba3d20fcd09cbc3bb5b42.jpg, https://salt.tikicdn.com/ts/product/18/f0/4d/62cd39b6532a71d9a320c10f2df2656c.jpg","https://salt.tikicdn.com/cache/w1200/ts/product/f9/53/a9/9a2370c30a390a73893bf9d367e74016.jpg, https://salt.tikicdn.com/cache/w1200/ts/product/c6/fb/c2/64eb2241eed6c8bac7879e8b7e452654.jpg, https://salt.tikicdn.com/cache/w1200/ts/product/40/e9/37/d44b8e0ec4283bdb997789e5a835e832.jpg, https://salt.tikicdn.com/cache/w1200/ts/product/5e/c8/52/59aecaa57253fefab85b555db22cb0ad.jpg, https://salt.tikicdn.com/cache/w1200/ts/product/82/14/56/d0cc0db620e3300bd16cf134be85a76d.jpg, https://salt.tikicdn.com/cache/w1200/ts/product/cb/05/9f/ff69f15629fba3d20fcd09cbc3bb5b42.jpg, https://salt.tikicdn.com/cache/w1200/ts/product/18/f0/4d/62cd39b6532a71d9a320c10f2df2656c.jpg","https://salt.tikicdn.com/cache/w300/ts/product/f9/53/a9/9a2370c30a390a73893bf9d367e74016.jpg, https://salt.tikicdn.com/cache/w300/ts/product/c6/fb/c2/64eb2241eed6c8bac7879e8b7e452654.jpg, https://salt.tikicdn.com/cache/w300/ts/product/40/e9/37/d44b8e0ec4283bdb997789e5a835e832.jpg, https://salt.tikicdn.com/cache/w300/ts/product/5e/c8/52/59aecaa57253fefab85b555db22cb0ad.jpg, https://salt.tikicdn.com/cache/w300/ts/product/82/14/56/d0cc0db620e3300bd16cf134be85a76d.jpg, https://salt.tikicdn.com/cache/w300/ts/product/cb/05/9f/ff69f15629fba3d20fcd09cbc3bb5b42.jpg, https://salt.tikicdn.com/cache/w300/ts/product/18/f0/4d/62cd39b6532a71d9a320c10f2df2656c.jpg","https://salt.tikicdn.com/cache/200x280/ts/product/f9/53/a9/9a2370c30a390a73893bf9d367e74016.jpg, https://salt.tikicdn.com/cache/200x280/ts/product/c6/fb/c2/64eb2241eed6c8bac7879e8b7e452654.jpg, https://salt.tikicdn.com/cache/200x280/ts/product/40/e9/37/d44b8e0ec4283bdb997789e5a835e832.jpg, https://salt.tikicdn.com/cache/200x280/ts/product/5e/c8/52/59aecaa57253fefab85b555db22cb0ad.jpg, https://salt.tikicdn.com/cache/200x280/ts/product/82/14/56/d0cc0db620e3300bd16cf134be85a76d.jpg, https://salt.tikicdn.com/cache/200x280/ts/product/cb/05/9f/ff69f15629fba3d20fcd09cbc3bb5b42.jpg, https://salt.tikicdn.com/cache/200x280/ts/product/18/f0/4d/62cd39b6532a71d9a320c10f2df2656c.jpg","https://salt.tikicdn.com/cache/200x280/ts/product/f9/53/a9/9a2370c30a390a73893bf9d367e74016.jpg, https://salt.tikicdn.com/cache/200x280/ts/product/c6/fb/c2/64eb2241eed6c8bac7879e8b7e452654.jpg, https://salt.tikicdn.com/cache/200x280/ts/product/40/e9/37/d44b8e0ec4283bdb997789e5a835e832.jpg, https://salt.tikicdn.com/cache/200x280/ts/product/5e/c8/52/59aecaa57253fefab85b555db22cb0ad.jpg, https://salt.tikicdn.com/cache/200x280/ts/product/82/14/56/d0cc0db620e3300bd16cf134be85a76d.jpg, https://salt.tikicdn.com/cache/200x280/ts/product/cb/05/9f/ff69f15629fba3d20fcd09cbc3bb5b42.jpg, https://salt.tikicdn.com/cache/200x280/ts/product/18/f0/4d/62cd39b6532a71d9a320c10f2df2656c.jpg",1000,0
262852648,Captain Underpants #3: Captain Underpants and the Invasion of the Incredibly Naughty Cafeteria Ladies from Outer Space (Color Edition),189000,Captain Underpants #3: Captain Underpants and the Invasion of the Incredibly Naughty Cafeteria Ladies from Outer Space (Color Edition)The third Captain Underpants adventure like you've never seen it ...,"Captain Underpants #3: Captain Underpants and the Invasion of the Incredibly Naughty Cafeteria Ladies from Outer Space (Color Edition) The third Captain Underpants adventure like you've never seen it before - in FULL COLOR! George and Harold have played a trick or two on nearly everyone at Jerome Horwitz Elementary. When their latest prank causes the school's cranky cafeteria ladies to quit, Mr. Krupp hires a trio of unusual replacements - who happen to look an awful lot like aliens! Will that curtain-caped crusader, Captain Underpants, save the day once more? Or will those outer-space cafeteria ladies have him for lunch? Giá sản phẩm trên Tiki đã bao gồm thuế theo luật hiện hành. Bên cạnh đó, tuỳ vào loại sản phẩm, hình thức và địa chỉ giao hàng mà có thể phát sinh thêm chi phí khác như phí vận chuyển, phụ phí hàng cồng kềnh, thuế nhập khẩu (đối với đơn hàng giao từ nước ngoài có giá trị trên 1 triệu đồng).....",5,1,https://salt.tikicdn.com/ts/product/87/e5/6c/f453140863d8682501039cc7c0d84e43.jpg,https://salt.tikicdn.com/cache/w1200/ts/product/87/e5/6c/f453140863d8682501039cc7c0d84e43.jpg,https://salt.tikicdn.com/cache/w300/ts/product/87/e5/6c/f453140863d8682501039cc7c0d84e43.jpg,https://salt.tikicdn.com/cache/200x280/ts/product/87/e5/6c/f453140863d8682501039cc7c0d84e43.jpg,https://salt.tikicdn.com/cache/200x280/ts/product/87/e5/6c/f453140863d8682501039cc7c0d84e43.jpg,1000,1
