id,name,price,short_description,description,rating_average,review_count,image_base_url,image_large_url,image_medium_url,image_small_url,image_thumbnail_url,stock,quantity_sold
275020854,Rashid Johnson,1360000,‘Johnson is a leading voice of his generation.’ – New York TimesThe most comprehensive publication to date on widely celebrated artist Rashid JohnsonWorking with a variety of media that includes pai...,"‘Johnson is a leading voice of his generation.’ – New York Times The most comprehensive publication to date on widely celebrated artist Rashid Johnson Working with a variety of media that includes painting, sculpture, photography, video, and performance, Rashid Johnson has created a nuanced and iconographic body of work that connects literature, music, and art. Personal references and pervasive cultural narratives are interweaved with the legacy of modernist abstraction, producing what critics have labelled ‘conceptual post-black art’. A precocious talent (his work was included in the seminal ‘Freestyle’ exhibition in New York in 2001), Johnson received the High Museum of Art’s David C. Driskell Prize, which honours contributions in the field of African-American art. Giá sản phẩm trên Tiki đã bao gồm thuế theo luật hiện hành. Bên cạnh đó, tuỳ vào loại sản phẩm, hình thức và địa chỉ giao hàng mà có thể phát sinh thêm chi phí khác như phí vận chuyển, phụ phí hàng cồng kềnh, thuế nhập khẩu (đối với đơn hàng giao từ nước ngoài có giá trị trên 1 triệu đồng).....",0,0,"https://salt.tikicdn.com/ts/product/66/98/cf/61fc1c455bfd2bb1d5844dd7e86e7fde.jpg, https://salt.tikicdn.com/ts/product/3b/c2/19/b11e0c33f35159b9c09fa4284fd6395a.jpg, https://salt.tikicdn.com/ts/product/24/9f/49/01e028c80ff6126b8d0132e3f3fbd2ae.jpg, https://salt.tikicdn.com/ts/product/e4/84/bb/39052bb7aa09e3cd28b3418f44245a3c.jpg, https://salt.tikicdn.com/ts/product/9b/fd/b3/8a39f5b796cc39634d86eedf02bdd733.jpg, https://salt.tikicdn.com/ts/product/1d/8f/b3/580224c6922a3c9973d64d1c49dabcbc.jpg, https://salt.tikicdn.com/ts/product/da/7d/0b/8d7aec603fd925c5eaa47fdd681484b3.jpg","https://salt.tikicdn.com/cache/w1200/ts/product/66/98/cf/61fc1c455bfd2bb1d5844dd7e86e7fde.jpg, https://salt.tikicdn.com/cache/w1200/ts/product/3b/c2/19/b11e0c33f35159b9c09fa4284fd6395a.jpg, https://salt.tikicdn.com/cache/w1200/ts/product/24/9f/49/01e028c80ff6126b8d0132e3f3fbd2ae.jpg, https://salt.tikicdn.com/cache/w1200/ts/product/e4/84/bb/39052bb7aa09e3cd28b3418f44245a3c.jpg, https://salt.tikicdn.com/cache/w1200/ts/product/9b/fd/b3/8a39f5b796cc39634d86eedf02bdd733.jpg, https://salt.tikicdn.com/cache/w1200/ts/product/1d/8f/b3/580224c6922a3c9973d64d1c49dabcbc.jpg, https://salt.tikicdn.com/cache/w1200/ts/product/da/7d/0b/8d7aec603fd925c5eaa47fdd681484b3.jpg","https://salt.tikicdn.com/cache/w300/ts/product/66/98/cf/61fc1c455bfd2bb1d5844dd7e86e7fde.jpg, https://salt.tikicdn.com/cache/w300/ts/product/3b/c2/19/b11e0c33f35159b9c09fa4284fd6395a.jpg, https://salt.tikicdn.com/cache/w300/ts/product/24/9f/49/01e028c80ff6126b8d0132e3f3fbd2ae.jpg, https://salt.tikicdn.com/cache/w300/ts/product/e4/84/bb/39052bb7aa09e3cd28b3418f44245a3c.jpg, https://salt.tikicdn.com/cache/w300/ts/product/9b/fd/b3/8a39f5b796cc39634d86eedf02bdd733.jpg, https://salt.tikicdn.com/cache/w300/ts/product/1d/8f/b3/580224c6922a3c9973d64d1c49dabcbc.jpg, https://salt.tikicdn.com/cache/w300/ts/product/da/7d/0b/8d7aec603fd925c5eaa47fdd681484b3.jpg","https://salt.tikicdn.com/cache/200x280/ts/product/66/98/cf/61fc1c455bfd2bb1d5844dd7e86e7fde.jpg, https://salt.tikicdn.com/cache/200x280/ts/product/3b/c2/19/b11e0c33f35159b9c09fa4284fd6395a.jpg, https://salt.tikicdn.com/cache/200x280/ts/product/24/9f/49/01e028c80ff6126b8d0132e3f3fbd2ae.jpg, https://salt.tikicdn.com/cache/200x280/ts/product/e4/84/bb/39052bb7aa09e3cd28b3418f44245a3c.jpg, https://salt.tikicdn.com/cache/200x280/ts/product/9b/fd/b3/8a39f5b796cc39634d86eedf02bdd733.jpg, https://salt.tikicdn.com/cache/200x280/ts/product/1d/8f/b3/580224c6922a3c9973d64d1c49dabcbc.jpg, https://salt.tikicdn.com/cache/200x280/ts/product/da/7d/0b/8d7aec603fd925c5eaa47fdd681484b3.jpg","https://salt.tikicdn.com/cache/200x280/ts/product/66/98/cf/61fc1c455bfd2bb1d5844dd7e86e7fde.jpg, https://salt.tikicdn.com/cache/200x280/ts/product/3b/c2/19/b11e0c33f35159b9c09fa4284fd6395a.jpg, https://salt.tikicdn.com/cache/200x280/ts/product/24/9f/49/01e028c80ff6126b8d0132e3f3fbd2ae.jpg, https://salt.tikicdn.com/cache/200x280/ts/product/e4/84/bb/39052bb7aa09e3cd28b3418f44245a3c.jpg, https://salt.tikicdn.com/cache/200x280/ts/product/9b/fd/b3/8a39f5b796cc39634d86eedf02bdd733.jpg, https://salt.tikicdn.com/cache/200x280/ts/product/1d/8f/b3/580224c6922a3c9973d64d1c49dabcbc.jpg, https://salt.tikicdn.com/cache/200x280/ts/product/da/7d/0b/8d7aec603fd925c5eaa47fdd681484b3.jpg",1000,0
275010893,How to Collect Art,850000,"You must read this book before buying any artwork – written by the world’s leading art-market economistNavigating the world of collecting can be a tricky process, especially for one just starting out...","You must read this book before buying any artwork – written by the world’s leading art-market economist Navigating the world of collecting can be a tricky process, especially for one just starting out in the art market. The world’s leading art market expert Magnus Resch explains the core principles of the art market and reveals the secrets of how to build and grow an art collection. He answers questions such as: • What art should I invest in? • Where do I start? • Which gallery should I visit? • How do I get VIP tickets for Art Basel? • Where's the best place to sell my art? • Is this price fair? This book is a comprehensive guide for anyone interested in collecting art, novice or expert. Readers will learn: • How the art market really works; • How to navigate the art world; • How to start and develop a sustainable collection strategy, for every budget. Featured alongside Magnus’s advice for collecting are quotes and case studies from esteemed art world professionals, including mega collectors Shelley and Philip Aarons, Beth Rudin DeWoody, Jorge M. Pérez, Howard E. Rachofsky, and Komal Shah; museum directors Adam Weinberg and Heidi Zuckerman; art fair founder Touria El Glaoui; mega art dealers Marc Glimcher, Adam Lindemann, Jeffrey Deitch, and Simon de Pury; leading art curator Hans Ulrich Obrist; superstar art advisor Amy Cappellazzo; and artist Julian Schnabel. The book also features a foreword written by leading art collector Pamela Joyner. No-nonsense, clear prose makes this the perfect primer for anyone who is interested in collecting art. This book is for: • Art lovers who want to buy their first pieces; • Collectors who want to understand more about investing in art; • Advisors and gallerists who want to refresh their knowledge. This book, with words of advice from the most accomplished experts in the field, is like carrying an art advisor in your pocket. Giá sản phẩm trên Tiki đã bao gồm thuế theo luật hiện hành. Bên cạnh đó, tuỳ vào loại sản phẩm, hình thức và địa chỉ giao hàng mà có thể phát sinh thêm chi phí khác như phí vận chuyển, phụ phí hàng cồng kềnh, thuế nhập khẩu (đối với đơn hàng giao từ nước ngoài có giá trị trên 1 triệu đồng).....",0,0,"https://salt.tikicdn.com/ts/product/f8/a3/2a/a8c953c4306e64702c900189a3604f5d.jpg, https://salt.tikicdn.com/ts/product/1b/89/7c/343695a42536357abb890b68af46cbfe.jpg, https://salt.tikicdn.com/ts/product/99/0b/c1/3fcd9e7a85e54c7cd61885e4de86206a.jpg, https://salt.tikicdn.com/ts/product/88/ba/c6/829bffdebcb34e9fd6b4e1ea33f1fab9.jpg, https://salt.tikicdn.com/ts/product/13/47/aa/fef0b2f4e1e85485e341b0dfdd816315.jpg","https://salt.tikicdn.com/cache/w1200/ts/product/f8/a3/2a/a8c953c4306e64702c900189a3604f5d.jpg, https://salt.tikicdn.com/cache/w1200/ts/product/1b/89/7c/343695a42536357abb890b68af46cbfe.jpg, https://salt.tikicdn.com/cache/w1200/ts/product/99/0b/c1/3fcd9e7a85e54c7cd61885e4de86206a.jpg, https://salt.tikicdn.com/cache/w1200/ts/product/88/ba/c6/829bffdebcb34e9fd6b4e1ea33f1fab9.jpg, https://salt.tikicdn.com/cache/w1200/ts/product/13/47/aa/fef0b2f4e1e85485e341b0dfdd816315.jpg","https://salt.tikicdn.com/cache/w300/ts/product/f8/a3/2a/a8c953c4306e64702c900189a3604f5d.jpg, https://salt.tikicdn.com/cache/w300/ts/product/1b/89/7c/343695a42536357abb890b68af46cbfe.jpg, https://salt.tikicdn.com/cache/w300/ts/product/99/0b/c1/3fcd9e7a85e54c7cd61885e4de86206a.jpg, https://salt.tikicdn.com/cache/w300/ts/product/88/ba/c6/829bffdebcb34e9fd6b4e1ea33f1fab9.jpg, https://salt.tikicdn.com/cache/w300/ts/product/13/47/aa/fef0b2f4e1e85485e341b0dfdd816315.jpg","https://salt.tikicdn.com/cache/200x280/ts/product/f8/a3/2a/a8c953c4306e64702c900189a3604f5d.jpg, https://salt.tikicdn.com/cache/200x280/ts/product/1b/89/7c/343695a42536357abb890b68af46cbfe.jpg, https://salt.tikicdn.com/cache/200x280/ts/product/99/0b/c1/3fcd9e7a85e54c7cd61885e4de86206a.jpg, https://salt.tikicdn.com/cache/200x280/ts/product/88/ba/c6/829bffdebcb34e9fd6b4e1ea33f1fab9.jpg, https://salt.tikicdn.com/cache/200x280/ts/product/13/47/aa/fef0b2f4e1e85485e341b0dfdd816315.jpg","https://salt.tikicdn.com/cache/200x280/ts/product/f8/a3/2a/a8c953c4306e64702c900189a3604f5d.jpg, https://salt.tikicdn.com/cache/200x280/ts/product/1b/89/7c/343695a42536357abb890b68af46cbfe.jpg, https://salt.tikicdn.com/cache/200x280/ts/product/99/0b/c1/3fcd9e7a85e54c7cd61885e4de86206a.jpg, https://salt.tikicdn.com/cache/200x280/ts/product/88/ba/c6/829bffdebcb34e9fd6b4e1ea33f1fab9.jpg, https://salt.tikicdn.com/cache/200x280/ts/product/13/47/aa/fef0b2f4e1e85485e341b0dfdd816315.jpg",1000,0
274587536,Flower Pieces,1360000,"• A new old master: Bas Meeuws' pocket-sized digital flower still lifes• A completely revised edition of the first book, packed with new images and texts• This book takes you through beautiful flora...","• A new old master: Bas Meeuws' pocket-sized digital flower still lifes • A completely revised edition of the first book, packed with new images and texts • This book takes you through beautiful floral still lifes that reference old Dutch masters • Bas Meeuws' works are exhibited and acclaimed worldwide Bas Meeuws' photographs are of an old-fashioned beauty and at the same time radically contemporary. Flower by flower he composes his still lifes, but digitally: the basis for Meeuws' monumental works are digital photographs of individual flowers. They nod to the Dutch masters of the 17th-century with their love of luxury, but also their eye for the ephemeral. Meeuws struck a chord in the art world with his floral still lifes. He is represented by Dutch and Taiwanese galleries and exhibits from Amsterdam to New Delhi. Giá sản phẩm trên Tiki đã bao gồm thuế theo luật hiện hành. Bên cạnh đó, tuỳ vào loại sản phẩm, hình thức và địa chỉ giao hàng mà có thể phát sinh thêm chi phí khác như phí vận chuyển, phụ phí hàng cồng kềnh, thuế nhập khẩu (đối với đơn hàng giao từ nước ngoài có giá trị trên 1 triệu đồng).....",0,0,"https://salt.tikicdn.com/ts/product/b5/c5/b1/723b3c1e4a5b9845f19c751a30c99205.jpg, https://salt.tikicdn.com/ts/product/f7/7d/61/e8427e88944526263c27e6200aed7196.jpg, https://salt.tikicdn.com/ts/product/8a/f7/bc/60f5f770bfa3c4d340b58aa545d5b99b.jpg, https://salt.tikicdn.com/ts/product/b4/11/b6/a304a2b9785a079ed33bb5794bf30de8.jpg, https://salt.tikicdn.com/ts/product/84/b4/56/03a3294097708bf41da1d9e5414f38bd.jpg","https://salt.tikicdn.com/cache/w1200/ts/product/b5/c5/b1/723b3c1e4a5b9845f19c751a30c99205.jpg, https://salt.tikicdn.com/cache/w1200/ts/product/f7/7d/61/e8427e88944526263c27e6200aed7196.jpg, https://salt.tikicdn.com/cache/w1200/ts/product/8a/f7/bc/60f5f770bfa3c4d340b58aa545d5b99b.jpg, https://salt.tikicdn.com/cache/w1200/ts/product/b4/11/b6/a304a2b9785a079ed33bb5794bf30de8.jpg, https://salt.tikicdn.com/cache/w1200/ts/product/84/b4/56/03a3294097708bf41da1d9e5414f38bd.jpg","https://salt.tikicdn.com/cache/w300/ts/product/b5/c5/b1/723b3c1e4a5b9845f19c751a30c99205.jpg, https://salt.tikicdn.com/cache/w300/ts/product/f7/7d/61/e8427e88944526263c27e6200aed7196.jpg, https://salt.tikicdn.com/cache/w300/ts/product/8a/f7/bc/60f5f770bfa3c4d340b58aa545d5b99b.jpg, https://salt.tikicdn.com/cache/w300/ts/product/b4/11/b6/a304a2b9785a079ed33bb5794bf30de8.jpg, https://salt.tikicdn.com/cache/w300/ts/product/84/b4/56/03a3294097708bf41da1d9e5414f38bd.jpg","https://salt.tikicdn.com/cache/200x280/ts/product/b5/c5/b1/723b3c1e4a5b9845f19c751a30c99205.jpg, https://salt.tikicdn.com/cache/200x280/ts/product/f7/7d/61/e8427e88944526263c27e6200aed7196.jpg, https://salt.tikicdn.com/cache/200x280/ts/product/8a/f7/bc/60f5f770bfa3c4d340b58aa545d5b99b.jpg, https://salt.tikicdn.com/cache/200x280/ts/product/b4/11/b6/a304a2b9785a079ed33bb5794bf30de8.jpg, https://salt.tikicdn.com/cache/200x280/ts/product/84/b4/56/03a3294097708bf41da1d9e5414f38bd.jpg","https://salt.tikicdn.com/cache/200x280/ts/product/b5/c5/b1/723b3c1e4a5b9845f19c751a30c99205.jpg, https://salt.tikicdn.com/cache/200x280/ts/product/f7/7d/61/e8427e88944526263c27e6200aed7196.jpg, https://salt.tikicdn.com/cache/200x280/ts/product/8a/f7/bc/60f5f770bfa3c4d340b58aa545d5b99b.jpg, https://salt.tikicdn.com/cache/200x280/ts/product/b4/11/b6/a304a2b9785a079ed33bb5794bf30de8.jpg, https://salt.tikicdn.com/cache/200x280/ts/product/84/b4/56/03a3294097708bf41da1d9e5414f38bd.jpg",1000,0
274587374,Greenhouses-Cathedrals For Plants,3520000,Botanical gardens represent people's centuries-old fascination with exotic plants. Werner Pawlok has photographically explored special tropical greenhouses within Europe and shows us here his most bea...,"Botanical gardens represent people's centuries-old fascination with exotic plants. Werner Pawlok has photographically explored special tropical greenhouses within Europe and shows us here his most beautiful pictures in his usual colorfully expressive manner - from the Palm House in the Botanical Garden in Copenhagen, to Kew Gardens in London, and the Great Palm House at Schönbrunn. The scent of the warm earth and the breath of the plants can almost be felt when looking at the large-format and colorful pictures. Fascinating interplays of color allow the filigree architecture of famous master builders and the impressive plants to shine in a special light. Pawlok, self-taught and intuitive photographer, captures these magical places in a fascinating way. Each photo is a work of art in itself. Interesting texts about the cultural history of greenhouses, from the simple wooden construction to the efficient glass dome, accompany this extraordinary photo book. Let yourself be inspired by Pawlok's high-end photographs and embark on a nostalgic journey. As Pawlok himself puts it: ""Being allowed to enter these wonderful glass palaces and explore their green-scented, tropical interiors with my camera felt like an expedition into the heart of the 19th century."" Text in English and German. Giá sản phẩm trên Tiki đã bao gồm thuế theo luật hiện hành. Bên cạnh đó, tuỳ vào loại sản phẩm, hình thức và địa chỉ giao hàng mà có thể phát sinh thêm chi phí khác như phí vận chuyển, phụ phí hàng cồng kềnh, thuế nhập khẩu (đối với đơn hàng giao từ nước ngoài có giá trị trên 1 triệu đồng).....",0,0,"https://salt.tikicdn.com/ts/product/b9/0f/00/c97cc15446724a5bbb0d4e2c735b89a1.jpg, https://salt.tikicdn.com/ts/product/79/0b/a6/57f27fad648bf70177bffc66037d0be7.jpg, https://salt.tikicdn.com/ts/product/3e/aa/90/33857bd2ee5b627c62e3af10d69cbf6a.jpg, https://salt.tikicdn.com/ts/product/1a/c2/9e/efd92c61282bc0f7b8caedb09f304c56.jpg, https://salt.tikicdn.com/ts/product/76/99/ca/ca56e89189caf3a1057497df2203153a.jpg, https://salt.tikicdn.com/ts/product/51/8e/1d/5f7bcd8a3572521246de26df1ba5f777.jpg","https://salt.tikicdn.com/cache/w1200/ts/product/b9/0f/00/c97cc15446724a5bbb0d4e2c735b89a1.jpg, https://salt.tikicdn.com/cache/w1200/ts/product/79/0b/a6/57f27fad648bf70177bffc66037d0be7.jpg, https://salt.tikicdn.com/cache/w1200/ts/product/3e/aa/90/33857bd2ee5b627c62e3af10d69cbf6a.jpg, https://salt.tikicdn.com/cache/w1200/ts/product/1a/c2/9e/efd92c61282bc0f7b8caedb09f304c56.jpg, https://salt.tikicdn.com/cache/w1200/ts/product/76/99/ca/ca56e89189caf3a1057497df2203153a.jpg, https://salt.tikicdn.com/cache/w1200/ts/product/51/8e/1d/5f7bcd8a3572521246de26df1ba5f777.jpg","https://salt.tikicdn.com/cache/w300/ts/product/b9/0f/00/c97cc15446724a5bbb0d4e2c735b89a1.jpg, https://salt.tikicdn.com/cache/w300/ts/product/79/0b/a6/57f27fad648bf70177bffc66037d0be7.jpg, https://salt.tikicdn.com/cache/w300/ts/product/3e/aa/90/33857bd2ee5b627c62e3af10d69cbf6a.jpg, https://salt.tikicdn.com/cache/w300/ts/product/1a/c2/9e/efd92c61282bc0f7b8caedb09f304c56.jpg, https://salt.tikicdn.com/cache/w300/ts/product/76/99/ca/ca56e89189caf3a1057497df2203153a.jpg, https://salt.tikicdn.com/cache/w300/ts/product/51/8e/1d/5f7bcd8a3572521246de26df1ba5f777.jpg","https://salt.tikicdn.com/cache/200x280/ts/product/b9/0f/00/c97cc15446724a5bbb0d4e2c735b89a1.jpg, https://salt.tikicdn.com/cache/200x280/ts/product/79/0b/a6/57f27fad648bf70177bffc66037d0be7.jpg, https://salt.tikicdn.com/cache/200x280/ts/product/3e/aa/90/33857bd2ee5b627c62e3af10d69cbf6a.jpg, https://salt.tikicdn.com/cache/200x280/ts/product/1a/c2/9e/efd92c61282bc0f7b8caedb09f304c56.jpg, https://salt.tikicdn.com/cache/200x280/ts/product/76/99/ca/ca56e89189caf3a1057497df2203153a.jpg, https://salt.tikicdn.com/cache/200x280/ts/product/51/8e/1d/5f7bcd8a3572521246de26df1ba5f777.jpg","https://salt.tikicdn.com/cache/200x280/ts/product/b9/0f/00/c97cc15446724a5bbb0d4e2c735b89a1.jpg, https://salt.tikicdn.com/cache/200x280/ts/product/79/0b/a6/57f27fad648bf70177bffc66037d0be7.jpg, https://salt.tikicdn.com/cache/200x280/ts/product/3e/aa/90/33857bd2ee5b627c62e3af10d69cbf6a.jpg, https://salt.tikicdn.com/cache/200x280/ts/product/1a/c2/9e/efd92c61282bc0f7b8caedb09f304c56.jpg, https://salt.tikicdn.com/cache/200x280/ts/product/76/99/ca/ca56e89189caf3a1057497df2203153a.jpg, https://salt.tikicdn.com/cache/200x280/ts/product/51/8e/1d/5f7bcd8a3572521246de26df1ba5f777.jpg",1000,0
274583555,Mountains,1380000,"• Experience all mountain sports from the front line• Travel to the most beautiful mountain resorts• With spectacular images• For all die hard winter sports enthusiasts, for the quiet mountain hike...","• Experience all mountain sports from the front line • Travel to the most beautiful mountain resorts • With spectacular images • For all die hard winter sports enthusiasts, for the quiet mountain hiker, for anyone who likes a new challenge, in short, for anyone who has lost his/her heart to the mountains The mountains have always fascinated people. When you think of a mountain vacation you immediately think of hiking, skiing, cross-country skiing, climbing, etc., but there are plenty of other disciplines to discover that you can practice while overlooking magnificent mountain scenery! Jurgen Groenwals, editor-in-chief of 100%Snow and 100%Trails, guides you through the rich array of mountain sports, and in the meantime lets you discover the twenty most beautiful - known and less known - mountain villages and valleys in Europe. Giá sản phẩm trên Tiki đã bao gồm thuế theo luật hiện hành. Bên cạnh đó, tuỳ vào loại sản phẩm, hình thức và địa chỉ giao hàng mà có thể phát sinh thêm chi phí khác như phí vận chuyển, phụ phí hàng cồng kềnh, thuế nhập khẩu (đối với đơn hàng giao từ nước ngoài có giá trị trên 1 triệu đồng).....",0,0,"https://salt.tikicdn.com/ts/product/b0/6c/42/29ec5dd8dc6c6b487a442c0f54e898a1.jpg, https://salt.tikicdn.com/ts/product/65/93/62/2c333e5cb0cdb5c2b8b52936db50577b.jpg, https://salt.tikicdn.com/ts/product/ce/e7/bd/f7d4fcf2db369a4d8287a14239256c90.jpg, https://salt.tikicdn.com/ts/product/9b/af/5c/d7a7a49e248ed1191ae2feb3f14810f9.jpg, https://salt.tikicdn.com/ts/product/6b/23/88/04ad6bf62c8060104108c17558011ff5.jpg, https://salt.tikicdn.com/ts/product/e2/ef/2b/c94cc7d05b00909eef111412013adf15.jpg","https://salt.tikicdn.com/cache/w1200/ts/product/b0/6c/42/29ec5dd8dc6c6b487a442c0f54e898a1.jpg, https://salt.tikicdn.com/cache/w1200/ts/product/65/93/62/2c333e5cb0cdb5c2b8b52936db50577b.jpg, https://salt.tikicdn.com/cache/w1200/ts/product/ce/e7/bd/f7d4fcf2db369a4d8287a14239256c90.jpg, https://salt.tikicdn.com/cache/w1200/ts/product/9b/af/5c/d7a7a49e248ed1191ae2feb3f14810f9.jpg, https://salt.tikicdn.com/cache/w1200/ts/product/6b/23/88/04ad6bf62c8060104108c17558011ff5.jpg, https://salt.tikicdn.com/cache/w1200/ts/product/e2/ef/2b/c94cc7d05b00909eef111412013adf15.jpg","https://salt.tikicdn.com/cache/w300/ts/product/b0/6c/42/29ec5dd8dc6c6b487a442c0f54e898a1.jpg, https://salt.tikicdn.com/cache/w300/ts/product/65/93/62/2c333e5cb0cdb5c2b8b52936db50577b.jpg, https://salt.tikicdn.com/cache/w300/ts/product/ce/e7/bd/f7d4fcf2db369a4d8287a14239256c90.jpg, https://salt.tikicdn.com/cache/w300/ts/product/9b/af/5c/d7a7a49e248ed1191ae2feb3f14810f9.jpg, https://salt.tikicdn.com/cache/w300/ts/product/6b/23/88/04ad6bf62c8060104108c17558011ff5.jpg, https://salt.tikicdn.com/cache/w300/ts/product/e2/ef/2b/c94cc7d05b00909eef111412013adf15.jpg","https://salt.tikicdn.com/cache/200x280/ts/product/b0/6c/42/29ec5dd8dc6c6b487a442c0f54e898a1.jpg, https://salt.tikicdn.com/cache/200x280/ts/product/65/93/62/2c333e5cb0cdb5c2b8b52936db50577b.jpg, https://salt.tikicdn.com/cache/200x280/ts/product/ce/e7/bd/f7d4fcf2db369a4d8287a14239256c90.jpg, https://salt.tikicdn.com/cache/200x280/ts/product/9b/af/5c/d7a7a49e248ed1191ae2feb3f14810f9.jpg, https://salt.tikicdn.com/cache/200x280/ts/product/6b/23/88/04ad6bf62c8060104108c17558011ff5.jpg, https://salt.tikicdn.com/cache/200x280/ts/product/e2/ef/2b/c94cc7d05b00909eef111412013adf15.jpg","https://salt.tikicdn.com/cache/200x280/ts/product/b0/6c/42/29ec5dd8dc6c6b487a442c0f54e898a1.jpg, https://salt.tikicdn.com/cache/200x280/ts/product/65/93/62/2c333e5cb0cdb5c2b8b52936db50577b.jpg, https://salt.tikicdn.com/cache/200x280/ts/product/ce/e7/bd/f7d4fcf2db369a4d8287a14239256c90.jpg, https://salt.tikicdn.com/cache/200x280/ts/product/9b/af/5c/d7a7a49e248ed1191ae2feb3f14810f9.jpg, https://salt.tikicdn.com/cache/200x280/ts/product/6b/23/88/04ad6bf62c8060104108c17558011ff5.jpg, https://salt.tikicdn.com/cache/200x280/ts/product/e2/ef/2b/c94cc7d05b00909eef111412013adf15.jpg",1000,0
274544116,Treasures from the Patek Philippe Museum,2170000,"Innovation, exclusivity, and elegance define Patek Philippe, a family-owned company with a single and passionate calling: to perfect the watch. These lavishly illustrated books present some of the mos...","Innovation, exclusivity, and elegance define Patek Philippe, a family-owned company with a single and passionate calling: to perfect the watch. These lavishly illustrated books present some of the most important timepieces from the more than 3,000 watches exhibited at the Patek Philippe Museum in Geneva. These precious timepieces have been passionately assembled over more than 40 years by Philippe Stern, Honorary President of the company, and include some of the most valuable pieces in watchmaking history. The books allow you to take the Patek Philippe Museum’s exhibition home with you, or, alternatively, to get a preview of its treasures before you visit. From the collection of historic watches featuring the first portable timepieces dating back to the 16th century to innovative milestones in Patek Philippe’s portfolio since its founding in 1839, each watch is reproduced with such beauty and precision that you can almost hear it ticking. With expert curatorial insight and context from Peter Friess, Conservateur of the Patek Philippe Museum, these intricate mechanisms are not only presented for themselves; they also offer a unique perspective into the cultural history of the last 500 years. True to the trust and excellence of the Patek Philippe brand, the presentation, the extraordinary book design by Birgit Binner, and content of these sumptuous publications meet the highest professional standards. They are the perfect books for the “perfect watch.” Giá sản phẩm trên Tiki đã bao gồm thuế theo luật hiện hành. Bên cạnh đó, tuỳ vào loại sản phẩm, hình thức và địa chỉ giao hàng mà có thể phát sinh thêm chi phí khác như phí vận chuyển, phụ phí hàng cồng kềnh, thuế nhập khẩu (đối với đơn hàng giao từ nước ngoài có giá trị trên 1 triệu đồng).....",0,0,https://salt.tikicdn.com/ts/product/ec/a9/67/57b8a0d6dc22cfc03d75c9129236eb3d.jpg,https://salt.tikicdn.com/cache/w1200/ts/product/ec/a9/67/57b8a0d6dc22cfc03d75c9129236eb3d.jpg,https://salt.tikicdn.com/cache/w300/ts/product/ec/a9/67/57b8a0d6dc22cfc03d75c9129236eb3d.jpg,https://salt.tikicdn.com/cache/200x280/ts/product/ec/a9/67/57b8a0d6dc22cfc03d75c9129236eb3d.jpg,https://salt.tikicdn.com/cache/200x280/ts/product/ec/a9/67/57b8a0d6dc22cfc03d75c9129236eb3d.jpg,1000,0
