id,name,price,short_description,description,rating_average,review_count,image_base_url,image_large_url,image_medium_url,image_small_url,image_thumbnail_url,stock,quantity_sold
274779656,Iwantja,1280000,"Located on a small ridge at the edge of the Indulkana Ranges, approximately 575 kilometres south of Alice Springs, Iwantja Arts art centre is home to some of Australia's most exciting Indigenous art....","Located on a small ridge at the edge of the Indulkana Ranges, approximately 575 kilometres south of Alice Springs, Iwantja Arts art centre is home to some of Australia's most exciting Indigenous art. The art centre, a studio collective where the artists meet, socialise and make art, was founded in the 1980s when many Aboriginal communities were fighting for land rights. It was during this time that now senior artists campaigned to both establish an art centre in their community and for the 1981 APY Land Rights Act. As intended, the art centre is now a bustling intergenerational hub of the community where everyone shares stories, creates art and connects with their long-standing culture. Senior artists, such as original centre co-founder Alec Baker, paint alongside budding artists as well as award-winners like Vincent Namatjira, Betty Muffler and Kaylene Whiskey. Told through the artists' own words, this searing bilingual publication charts the history of Indulkana from being one of the first pastoral leases in the region to the culturally rich creative hub it is today. Iwantja is a showstopping monograph of the Anangu artists everyone needs to know. Giá sản phẩm trên Tiki đã bao gồm thuế theo luật hiện hành. Bên cạnh đó, tuỳ vào loại sản phẩm, hình thức và địa chỉ giao hàng mà có thể phát sinh thêm chi phí khác như phí vận chuyển, phụ phí hàng cồng kềnh, thuế nhập khẩu (đối với đơn hàng giao từ nước ngoài có giá trị trên 1 triệu đồng).....",0,0,"https://salt.tikicdn.com/ts/product/b6/7f/ab/8da231d5c4f2f48f928b9c534026c163.jpg, https://salt.tikicdn.com/ts/product/bc/f0/0a/c42d2f0a850d0e792f6528650b4b6d92.jpg, https://salt.tikicdn.com/ts/product/ec/38/10/0d33b0a40299ac520f141827c04dd400.jpg, https://salt.tikicdn.com/ts/product/5a/ae/89/e043eedf493cae8ea91d0f10c02727ca.jpg, https://salt.tikicdn.com/ts/product/b1/8b/bc/a858ac690d9d24606891d5758740bab5.jpg, https://salt.tikicdn.com/ts/product/2e/bd/07/dd941069a0c857bbe1e842819d43ac29.jpg, https://salt.tikicdn.com/ts/product/dd/1d/0b/b8ed5d0ca58e3306d0f39661d67c4557.jpg","https://salt.tikicdn.com/cache/w1200/ts/product/b6/7f/ab/8da231d5c4f2f48f928b9c534026c163.jpg, https://salt.tikicdn.com/cache/w1200/ts/product/bc/f0/0a/c42d2f0a850d0e792f6528650b4b6d92.jpg, https://salt.tikicdn.com/cache/w1200/ts/product/ec/38/10/0d33b0a40299ac520f141827c04dd400.jpg, https://salt.tikicdn.com/cache/w1200/ts/product/5a/ae/89/e043eedf493cae8ea91d0f10c02727ca.jpg, https://salt.tikicdn.com/cache/w1200/ts/product/b1/8b/bc/a858ac690d9d24606891d5758740bab5.jpg, https://salt.tikicdn.com/cache/w1200/ts/product/2e/bd/07/dd941069a0c857bbe1e842819d43ac29.jpg, https://salt.tikicdn.com/cache/w1200/ts/product/dd/1d/0b/b8ed5d0ca58e3306d0f39661d67c4557.jpg","https://salt.tikicdn.com/cache/w300/ts/product/b6/7f/ab/8da231d5c4f2f48f928b9c534026c163.jpg, https://salt.tikicdn.com/cache/w300/ts/product/bc/f0/0a/c42d2f0a850d0e792f6528650b4b6d92.jpg, https://salt.tikicdn.com/cache/w300/ts/product/ec/38/10/0d33b0a40299ac520f141827c04dd400.jpg, https://salt.tikicdn.com/cache/w300/ts/product/5a/ae/89/e043eedf493cae8ea91d0f10c02727ca.jpg, https://salt.tikicdn.com/cache/w300/ts/product/b1/8b/bc/a858ac690d9d24606891d5758740bab5.jpg, https://salt.tikicdn.com/cache/w300/ts/product/2e/bd/07/dd941069a0c857bbe1e842819d43ac29.jpg, https://salt.tikicdn.com/cache/w300/ts/product/dd/1d/0b/b8ed5d0ca58e3306d0f39661d67c4557.jpg","https://salt.tikicdn.com/cache/200x280/ts/product/b6/7f/ab/8da231d5c4f2f48f928b9c534026c163.jpg, https://salt.tikicdn.com/cache/200x280/ts/product/bc/f0/0a/c42d2f0a850d0e792f6528650b4b6d92.jpg, https://salt.tikicdn.com/cache/200x280/ts/product/ec/38/10/0d33b0a40299ac520f141827c04dd400.jpg, https://salt.tikicdn.com/cache/200x280/ts/product/5a/ae/89/e043eedf493cae8ea91d0f10c02727ca.jpg, https://salt.tikicdn.com/cache/200x280/ts/product/b1/8b/bc/a858ac690d9d24606891d5758740bab5.jpg, https://salt.tikicdn.com/cache/200x280/ts/product/2e/bd/07/dd941069a0c857bbe1e842819d43ac29.jpg, https://salt.tikicdn.com/cache/200x280/ts/product/dd/1d/0b/b8ed5d0ca58e3306d0f39661d67c4557.jpg","https://salt.tikicdn.com/cache/200x280/ts/product/b6/7f/ab/8da231d5c4f2f48f928b9c534026c163.jpg, https://salt.tikicdn.com/cache/200x280/ts/product/bc/f0/0a/c42d2f0a850d0e792f6528650b4b6d92.jpg, https://salt.tikicdn.com/cache/200x280/ts/product/ec/38/10/0d33b0a40299ac520f141827c04dd400.jpg, https://salt.tikicdn.com/cache/200x280/ts/product/5a/ae/89/e043eedf493cae8ea91d0f10c02727ca.jpg, https://salt.tikicdn.com/cache/200x280/ts/product/b1/8b/bc/a858ac690d9d24606891d5758740bab5.jpg, https://salt.tikicdn.com/cache/200x280/ts/product/2e/bd/07/dd941069a0c857bbe1e842819d43ac29.jpg, https://salt.tikicdn.com/cache/200x280/ts/product/dd/1d/0b/b8ed5d0ca58e3306d0f39661d67c4557.jpg",1000,0
274625459,The Art Of Munashichi,790000,"Illustrated with overwhelming fineness, this is a world you wish you could visit.Munashichi is an illustrator who became popular drawing steampunk-like fantasy worlds with an overwhelming fineness and...","Illustrated with overwhelming fineness, this is a world you wish you could visit. Munashichi is an illustrator who became popular drawing steampunk-like fantasy worlds with an overwhelming fineness and detail. Munashichi is well known in the anime and gaming industry for the concept design for the acclaimed video games Tales of Zestiriaand Tales of Berseria, the concept artwork for the anime television series Princess Principals, which was licensed by Sentai Filmworks in North America and MVM films in UK. Gigantic, sky-high buildings, deeply extended caverns, complexly crossed pipes, factory scenes, abandoned places and nostalgic townscapes are themes commonly seen in Munashichi’s illustrations. This book includes Munashichi’s past illustration works, concept images for games and anime series, original works and newly drawn illustrations just for this book. This is a type of a book which you will always find something new every time you look back. Each illustration will tell you a different story. You will never want to come back from the world of Munashichi. Giá sản phẩm trên Tiki đã bao gồm thuế theo luật hiện hành. Bên cạnh đó, tuỳ vào loại sản phẩm, hình thức và địa chỉ giao hàng mà có thể phát sinh thêm chi phí khác như phí vận chuyển, phụ phí hàng cồng kềnh, thuế nhập khẩu (đối với đơn hàng giao từ nước ngoài có giá trị trên 1 triệu đồng).....",0,0,"https://salt.tikicdn.com/ts/product/af/73/0a/45babe0690608ad82cb3ece47c27068c.jpg, https://salt.tikicdn.com/ts/product/93/f6/0b/6c6cec5e979e1e6413de4f346e80a456.jpg, https://salt.tikicdn.com/ts/product/1d/8f/36/2d8edfa6bc296b40b31ca0028b1a9940.jpg, https://salt.tikicdn.com/ts/product/24/50/3c/3c21bde31fcd21c6c4595e6ed87f6048.jpg, https://salt.tikicdn.com/ts/product/85/e9/7f/c2c2478d88f947af6b6a4ed079df3c3c.jpg, https://salt.tikicdn.com/ts/product/3d/b9/09/db16ba25b3deaad3464ec483ce4252c6.jpg, https://salt.tikicdn.com/ts/product/6b/23/87/28da43b270192456db2f19b33946dbf2.jpg, https://salt.tikicdn.com/ts/product/02/0a/c2/f0bf1b106ccf23ee98fb684beee8134c.jpg","https://salt.tikicdn.com/cache/w1200/ts/product/af/73/0a/45babe0690608ad82cb3ece47c27068c.jpg, https://salt.tikicdn.com/cache/w1200/ts/product/93/f6/0b/6c6cec5e979e1e6413de4f346e80a456.jpg, https://salt.tikicdn.com/cache/w1200/ts/product/1d/8f/36/2d8edfa6bc296b40b31ca0028b1a9940.jpg, https://salt.tikicdn.com/cache/w1200/ts/product/24/50/3c/3c21bde31fcd21c6c4595e6ed87f6048.jpg, https://salt.tikicdn.com/cache/w1200/ts/product/85/e9/7f/c2c2478d88f947af6b6a4ed079df3c3c.jpg, https://salt.tikicdn.com/cache/w1200/ts/product/3d/b9/09/db16ba25b3deaad3464ec483ce4252c6.jpg, https://salt.tikicdn.com/cache/w1200/ts/product/6b/23/87/28da43b270192456db2f19b33946dbf2.jpg, https://salt.tikicdn.com/cache/w1200/ts/product/02/0a/c2/f0bf1b106ccf23ee98fb684beee8134c.jpg","https://salt.tikicdn.com/cache/w300/ts/product/af/73/0a/45babe0690608ad82cb3ece47c27068c.jpg, https://salt.tikicdn.com/cache/w300/ts/product/93/f6/0b/6c6cec5e979e1e6413de4f346e80a456.jpg, https://salt.tikicdn.com/cache/w300/ts/product/1d/8f/36/2d8edfa6bc296b40b31ca0028b1a9940.jpg, https://salt.tikicdn.com/cache/w300/ts/product/24/50/3c/3c21bde31fcd21c6c4595e6ed87f6048.jpg, https://salt.tikicdn.com/cache/w300/ts/product/85/e9/7f/c2c2478d88f947af6b6a4ed079df3c3c.jpg, https://salt.tikicdn.com/cache/w300/ts/product/3d/b9/09/db16ba25b3deaad3464ec483ce4252c6.jpg, https://salt.tikicdn.com/cache/w300/ts/product/6b/23/87/28da43b270192456db2f19b33946dbf2.jpg, https://salt.tikicdn.com/cache/w300/ts/product/02/0a/c2/f0bf1b106ccf23ee98fb684beee8134c.jpg","https://salt.tikicdn.com/cache/200x280/ts/product/af/73/0a/45babe0690608ad82cb3ece47c27068c.jpg, https://salt.tikicdn.com/cache/200x280/ts/product/93/f6/0b/6c6cec5e979e1e6413de4f346e80a456.jpg, https://salt.tikicdn.com/cache/200x280/ts/product/1d/8f/36/2d8edfa6bc296b40b31ca0028b1a9940.jpg, https://salt.tikicdn.com/cache/200x280/ts/product/24/50/3c/3c21bde31fcd21c6c4595e6ed87f6048.jpg, https://salt.tikicdn.com/cache/200x280/ts/product/85/e9/7f/c2c2478d88f947af6b6a4ed079df3c3c.jpg, https://salt.tikicdn.com/cache/200x280/ts/product/3d/b9/09/db16ba25b3deaad3464ec483ce4252c6.jpg, https://salt.tikicdn.com/cache/200x280/ts/product/6b/23/87/28da43b270192456db2f19b33946dbf2.jpg, https://salt.tikicdn.com/cache/200x280/ts/product/02/0a/c2/f0bf1b106ccf23ee98fb684beee8134c.jpg","https://salt.tikicdn.com/cache/200x280/ts/product/af/73/0a/45babe0690608ad82cb3ece47c27068c.jpg, https://salt.tikicdn.com/cache/200x280/ts/product/93/f6/0b/6c6cec5e979e1e6413de4f346e80a456.jpg, https://salt.tikicdn.com/cache/200x280/ts/product/1d/8f/36/2d8edfa6bc296b40b31ca0028b1a9940.jpg, https://salt.tikicdn.com/cache/200x280/ts/product/24/50/3c/3c21bde31fcd21c6c4595e6ed87f6048.jpg, https://salt.tikicdn.com/cache/200x280/ts/product/85/e9/7f/c2c2478d88f947af6b6a4ed079df3c3c.jpg, https://salt.tikicdn.com/cache/200x280/ts/product/3d/b9/09/db16ba25b3deaad3464ec483ce4252c6.jpg, https://salt.tikicdn.com/cache/200x280/ts/product/6b/23/87/28da43b270192456db2f19b33946dbf2.jpg, https://salt.tikicdn.com/cache/200x280/ts/product/02/0a/c2/f0bf1b106ccf23ee98fb684beee8134c.jpg",1000,0
274552520,Roses,1140000,"In wise words, Christian Dior once proclaimed: ""Flowers are, apart from women, the most beautiful gift God has given the world."" The new teNeues series, Floramour, which henceforth honorably celebrate...","In wise words, Christian Dior once proclaimed: ""Flowers are, apart from women, the most beautiful gift God has given the world."" The new teNeues series, Floramour, which henceforth honorably celebrates the most exquisite natural beauties that adorn our gardens, proves just how right he was. Each series title is dedicated to a genus of flowers, viewed from an aesthetic perspective. In a noble presentation with impressive pictures and interesting texts, an exciting portrait of our favorite flowers is created. It begins with the rose. Whoever gives a rose as a gift will conquer all hearts in an instant, for like no other of its fellows it is regarded as a symbol of romantic passion. As a faithful helpmate, it has been accompanying declarations of love since time immemorial, making it a real Everybody's Darling. But authentic message transmission is not limited to the gift of the much-loved rose. Flowers have always acted as mouthpieces - and sometimes they can express more than the most beautiful words can. The illustrated book enables flower enthusiasts to get to know their favorites from a different perspective. With less pragmatism, but more cultural history, the reader is stylishly introduced to their geographical origin, their significance in the world of art, religion and history, as well as their most famous followers in pop culture. It becomes clear that these flowers have real character! Text in English and German Giá sản phẩm trên Tiki đã bao gồm thuế theo luật hiện hành. Bên cạnh đó, tuỳ vào loại sản phẩm, hình thức và địa chỉ giao hàng mà có thể phát sinh thêm chi phí khác như phí vận chuyển, phụ phí hàng cồng kềnh, thuế nhập khẩu (đối với đơn hàng giao từ nước ngoài có giá trị trên 1 triệu đồng).....",0,0,"https://salt.tikicdn.com/ts/product/ef/ee/e6/79e09db2a451f2302edcaa64eddcd5f0.jpg, https://salt.tikicdn.com/ts/product/ce/17/91/9844eebbe919ee1cce6a471edf407e56.jpg, https://salt.tikicdn.com/ts/product/07/bf/f1/e980ed38e631fd4ed9535db3a571b109.jpg, https://salt.tikicdn.com/ts/product/1c/6a/0b/79c92e45cf3d35d376143c8359ce880a.jpg, https://salt.tikicdn.com/ts/product/dc/31/20/ee4dfc8cf92aaad697bc49fa5b40be66.jpg, https://salt.tikicdn.com/ts/product/9b/fc/09/9e39d192e4580f9bb37f9382b3443152.jpg, https://salt.tikicdn.com/ts/product/f9/79/33/f33ea00fac0e596cf2ecd3d9477ba079.jpg, https://salt.tikicdn.com/ts/product/5b/df/71/53aefdc22e51de12d92a355c8c2a1d87.jpg","https://salt.tikicdn.com/cache/w1200/ts/product/ef/ee/e6/79e09db2a451f2302edcaa64eddcd5f0.jpg, https://salt.tikicdn.com/cache/w1200/ts/product/ce/17/91/9844eebbe919ee1cce6a471edf407e56.jpg, https://salt.tikicdn.com/cache/w1200/ts/product/07/bf/f1/e980ed38e631fd4ed9535db3a571b109.jpg, https://salt.tikicdn.com/cache/w1200/ts/product/1c/6a/0b/79c92e45cf3d35d376143c8359ce880a.jpg, https://salt.tikicdn.com/cache/w1200/ts/product/dc/31/20/ee4dfc8cf92aaad697bc49fa5b40be66.jpg, https://salt.tikicdn.com/cache/w1200/ts/product/9b/fc/09/9e39d192e4580f9bb37f9382b3443152.jpg, https://salt.tikicdn.com/cache/w1200/ts/product/f9/79/33/f33ea00fac0e596cf2ecd3d9477ba079.jpg, https://salt.tikicdn.com/cache/w1200/ts/product/5b/df/71/53aefdc22e51de12d92a355c8c2a1d87.jpg","https://salt.tikicdn.com/cache/w300/ts/product/ef/ee/e6/79e09db2a451f2302edcaa64eddcd5f0.jpg, https://salt.tikicdn.com/cache/w300/ts/product/ce/17/91/9844eebbe919ee1cce6a471edf407e56.jpg, https://salt.tikicdn.com/cache/w300/ts/product/07/bf/f1/e980ed38e631fd4ed9535db3a571b109.jpg, https://salt.tikicdn.com/cache/w300/ts/product/1c/6a/0b/79c92e45cf3d35d376143c8359ce880a.jpg, https://salt.tikicdn.com/cache/w300/ts/product/dc/31/20/ee4dfc8cf92aaad697bc49fa5b40be66.jpg, https://salt.tikicdn.com/cache/w300/ts/product/9b/fc/09/9e39d192e4580f9bb37f9382b3443152.jpg, https://salt.tikicdn.com/cache/w300/ts/product/f9/79/33/f33ea00fac0e596cf2ecd3d9477ba079.jpg, https://salt.tikicdn.com/cache/w300/ts/product/5b/df/71/53aefdc22e51de12d92a355c8c2a1d87.jpg","https://salt.tikicdn.com/cache/200x280/ts/product/ef/ee/e6/79e09db2a451f2302edcaa64eddcd5f0.jpg, https://salt.tikicdn.com/cache/200x280/ts/product/ce/17/91/9844eebbe919ee1cce6a471edf407e56.jpg, https://salt.tikicdn.com/cache/200x280/ts/product/07/bf/f1/e980ed38e631fd4ed9535db3a571b109.jpg, https://salt.tikicdn.com/cache/200x280/ts/product/1c/6a/0b/79c92e45cf3d35d376143c8359ce880a.jpg, https://salt.tikicdn.com/cache/200x280/ts/product/dc/31/20/ee4dfc8cf92aaad697bc49fa5b40be66.jpg, https://salt.tikicdn.com/cache/200x280/ts/product/9b/fc/09/9e39d192e4580f9bb37f9382b3443152.jpg, https://salt.tikicdn.com/cache/200x280/ts/product/f9/79/33/f33ea00fac0e596cf2ecd3d9477ba079.jpg, https://salt.tikicdn.com/cache/200x280/ts/product/5b/df/71/53aefdc22e51de12d92a355c8c2a1d87.jpg","https://salt.tikicdn.com/cache/200x280/ts/product/ef/ee/e6/79e09db2a451f2302edcaa64eddcd5f0.jpg, https://salt.tikicdn.com/cache/200x280/ts/product/ce/17/91/9844eebbe919ee1cce6a471edf407e56.jpg, https://salt.tikicdn.com/cache/200x280/ts/product/07/bf/f1/e980ed38e631fd4ed9535db3a571b109.jpg, https://salt.tikicdn.com/cache/200x280/ts/product/1c/6a/0b/79c92e45cf3d35d376143c8359ce880a.jpg, https://salt.tikicdn.com/cache/200x280/ts/product/dc/31/20/ee4dfc8cf92aaad697bc49fa5b40be66.jpg, https://salt.tikicdn.com/cache/200x280/ts/product/9b/fc/09/9e39d192e4580f9bb37f9382b3443152.jpg, https://salt.tikicdn.com/cache/200x280/ts/product/f9/79/33/f33ea00fac0e596cf2ecd3d9477ba079.jpg, https://salt.tikicdn.com/cache/200x280/ts/product/5b/df/71/53aefdc22e51de12d92a355c8c2a1d87.jpg",1000,0
274551275,Far Far East,1880000,""" new book conjures up an intoxicating itinerary for a tour of the Far East with the stunning photographs revealing the region's most alluring spots."" ―Ailbhe Macmahon, Mailonline. "" Travel envy is in...",""" new book conjures up an intoxicating itinerary for a tour of the Far East with the stunning photographs revealing the region's most alluring spots."" ―Ailbhe Macmahon, Mailonline. "" Travel envy is inevitable after reading this."" ―Jade Cuttle, The Times. ""Accompanying the stunning photography is insightful and inspiring stories of personal encounters. It's a homage and a love letter to the kind of travel we were able to do without restrictions."" ―John Gilbey, Amateur Photographer. Far Far East is an homage to distant Asia and a love letter to the wanderlust and freedom we miss in pandemic times. From writer and author duo Alexa Schels and Patrick Pichler, this large-format photo book takes readers on a transcontinental journey through eight Far East countries. Stilt fishermen in Sri Lanka, reindeer nomads in the Mongolian steppes, the pulsating metropolis of Tokyo, and the untamed wilderness of the Himalayas. On each stop of their journey, Schels and Pichler supplement stunning travel photography with inspiring stories of personal encounters. Armchair travel when we need it most ― and a reminder of all there is to discover once the world reopens for adventure. Text in English and German. Giá sản phẩm trên Tiki đã bao gồm thuế theo luật hiện hành. Bên cạnh đó, tuỳ vào loại sản phẩm, hình thức và địa chỉ giao hàng mà có thể phát sinh thêm chi phí khác như phí vận chuyển, phụ phí hàng cồng kềnh, thuế nhập khẩu (đối với đơn hàng giao từ nước ngoài có giá trị trên 1 triệu đồng).....",0,0,"https://salt.tikicdn.com/ts/product/83/16/f6/1658bd4c654b2c6988c12fb38f11fc52.jpg, https://salt.tikicdn.com/ts/product/ca/53/1c/56d18d4d1909960554db689ccf3b4fec.jpg","https://salt.tikicdn.com/cache/w1200/ts/product/83/16/f6/1658bd4c654b2c6988c12fb38f11fc52.jpg, https://salt.tikicdn.com/cache/w1200/ts/product/ca/53/1c/56d18d4d1909960554db689ccf3b4fec.jpg","https://salt.tikicdn.com/cache/w300/ts/product/83/16/f6/1658bd4c654b2c6988c12fb38f11fc52.jpg, https://salt.tikicdn.com/cache/w300/ts/product/ca/53/1c/56d18d4d1909960554db689ccf3b4fec.jpg","https://salt.tikicdn.com/cache/200x280/ts/product/83/16/f6/1658bd4c654b2c6988c12fb38f11fc52.jpg, https://salt.tikicdn.com/cache/200x280/ts/product/ca/53/1c/56d18d4d1909960554db689ccf3b4fec.jpg","https://salt.tikicdn.com/cache/200x280/ts/product/83/16/f6/1658bd4c654b2c6988c12fb38f11fc52.jpg, https://salt.tikicdn.com/cache/200x280/ts/product/ca/53/1c/56d18d4d1909960554db689ccf3b4fec.jpg",1000,0
274529574,Starting To Collect Antique Porcelain,520000,"Forming a collection of antique porcelain is surprisingly simple with the aid of this book, written by a foremost authority. John Sandon presents the essential information in a style which is both acc...","Forming a collection of antique porcelain is surprisingly simple with the aid of this book, written by a foremost authority. John Sandon presents the essential information in a style which is both accessible and readable, offering all manner of practical advice to the novice and beginner. Where should you buy, what should you look for and how do you avoid fakes? Should you get a damaged piece restored? How much should you spend? The answers to these questions and many more are clearly presented. Clear colour illustrations have been carefully chosen to show the unique attributes of each kind of porcelain. Each entry lists specialist books which offer more information. This guide concludes with a general bibliography, details of makers' marks and the dates of Chinese reigns. Altogether this is a very special kind of reference book; its readable and knowledgable yet compact presentation will be appreciated by committed collectors and enthusiasts whilst giving the novice the confidence to follow in Giá sản phẩm trên Tiki đã bao gồm thuế theo luật hiện hành. Bên cạnh đó, tuỳ vào loại sản phẩm, hình thức và địa chỉ giao hàng mà có thể phát sinh thêm chi phí khác như phí vận chuyển, phụ phí hàng cồng kềnh, thuế nhập khẩu (đối với đơn hàng giao từ nước ngoài có giá trị trên 1 triệu đồng).....",0,0,https://salt.tikicdn.com/ts/product/3c/51/e8/66b94f80b58b40fab44d78fc0057ca8f.jpg,https://salt.tikicdn.com/cache/w1200/ts/product/3c/51/e8/66b94f80b58b40fab44d78fc0057ca8f.jpg,https://salt.tikicdn.com/cache/w300/ts/product/3c/51/e8/66b94f80b58b40fab44d78fc0057ca8f.jpg,https://salt.tikicdn.com/cache/200x280/ts/product/3c/51/e8/66b94f80b58b40fab44d78fc0057ca8f.jpg,https://salt.tikicdn.com/cache/200x280/ts/product/3c/51/e8/66b94f80b58b40fab44d78fc0057ca8f.jpg,1000,0
274524795,Flowers & Design By Gary Kwok,1470000,"Gary Kwok is the founder of Gary K Limited. Within the competitive floral arena of Hong Kong her brand is synonymous with excellence, superior craftsmanship, attention to detail and exquisite tailor-m...","Gary Kwok is the founder of Gary K Limited. Within the competitive floral arena of Hong Kong her brand is synonymous with excellence, superior craftsmanship, attention to detail and exquisite tailor-made design. With her exceptional success in floral art Gary Kwok has made a quick ascent towards leadership and has become the most applauded company in event decoration and weddings of prestige and elegance in Hong Kong. Whatever the client's wishes or the occasion Gary Kwok and her team deliver bespoke floral creations from the ordinary to the extraordinary. Sublime beauty expressed in the language of flowers. Gary's floral design demonstrates a new use of form, color and texture, which complement and integrate both the flowers and the vase, creating a clean and modern look. A style that also caught the attention of Mr Giorgio Armani who invited Gary Kwok to form a partnership, which resulted in the Armani Fiori HK brand in 2002. This book is an anthology of Gary Kwok's most impressive accomplishments in floral design. Giá sản phẩm trên Tiki đã bao gồm thuế theo luật hiện hành. Bên cạnh đó, tuỳ vào loại sản phẩm, hình thức và địa chỉ giao hàng mà có thể phát sinh thêm chi phí khác như phí vận chuyển, phụ phí hàng cồng kềnh, thuế nhập khẩu (đối với đơn hàng giao từ nước ngoài có giá trị trên 1 triệu đồng).....",0,0,https://salt.tikicdn.com/ts/product/3c/30/8f/b16a80a0eb2dfc8879bcffd1dabda592.jpg,https://salt.tikicdn.com/cache/w1200/ts/product/3c/30/8f/b16a80a0eb2dfc8879bcffd1dabda592.jpg,https://salt.tikicdn.com/cache/w300/ts/product/3c/30/8f/b16a80a0eb2dfc8879bcffd1dabda592.jpg,https://salt.tikicdn.com/cache/200x280/ts/product/3c/30/8f/b16a80a0eb2dfc8879bcffd1dabda592.jpg,https://salt.tikicdn.com/cache/200x280/ts/product/3c/30/8f/b16a80a0eb2dfc8879bcffd1dabda592.jpg,1000,0
