id,name,price,short_description,description,rating_average,review_count,image_base_url,image_large_url,image_medium_url,image_small_url,image_thumbnail_url,stock,quantity_sold
114671480,Andrew Martin Interior Design Review,1670000,"Andrew Martin's trusted annual interiors review is here, celebrating the high art of interior design with the same expert and international eye as ever. From clean-line purity to the ultimate homely h...","Andrew Martin's trusted annual interiors review is here, celebrating the high art of interior design with the same expert and international eye as ever. From clean-line purity to the ultimate homely hygge, Volume 22 of the Interior Design Review book delivers the most renowned, innovative, and exceptional interior design of the last year. ""My home is my castle."" For each of us, home is a retreat, a comfort, and a space we delight in designing to our taste and needs. This year, as every year, teNeues delivers fresh interiors inspiration with the 500-page Interior Design Review from leading design house, Andrew Martin. As well as nominating Designer of the Year--the ""Oscar of the Design World""--this trusted interiors book presents leading interior designers around the world and their best work from the past year, spanning a thrilling range of interior aesthetics from opulent to minimalist, urban sophisticate to Scandinavian-inspired hygge. Whatever home style you're after, Interior Design Review promises a true bounty of interiors ideas. Founded in 1978 by Martin Waller, Andrew Martin International is the seal of interiors quality to help you make each space special. Giá sản phẩm trên Tiki đã bao gồm thuế theo luật hiện hành. Bên cạnh đó, tuỳ vào loại sản phẩm, hình thức và địa chỉ giao hàng mà có thể phát sinh thêm chi phí khác như phí vận chuyển, phụ phí hàng cồng kềnh, thuế nhập khẩu (đối với đơn hàng giao từ nước ngoài có giá trị trên 1 triệu đồng).....",5,1,https://salt.tikicdn.com/ts/product/cc/63/b4/ff1d44e6ab330a9625a7964585ad07b6.png,https://salt.tikicdn.com/cache/w1200/ts/product/cc/63/b4/ff1d44e6ab330a9625a7964585ad07b6.png,https://salt.tikicdn.com/cache/w300/ts/product/cc/63/b4/ff1d44e6ab330a9625a7964585ad07b6.png,https://salt.tikicdn.com/cache/200x280/ts/product/cc/63/b4/ff1d44e6ab330a9625a7964585ad07b6.png,https://salt.tikicdn.com/cache/200x280/ts/product/cc/63/b4/ff1d44e6ab330a9625a7964585ad07b6.png,1000,1
114671227,Sean Godsell,1700000,"A survey of residential projects by Australia’s leading minimalist architect, Sean Godsell.As many architects turn to Australia for inspiration, Sean Godsell―a pioneer of Australian minimalism―has es...","A survey of residential projects by Australia’s leading minimalist architect, Sean Godsell. As many architects turn to Australia for inspiration, Sean Godsell―a pioneer of Australian minimalism―has established himself as an important influencer on the global architecture scene. This survey of his residential architecture features twelve house projects across Australia, each illustrated with full-color photography, as well as a selection of the architect’s hand-drawn plans and exploratory sketches, which illuminate how each project relates to its surrounding landscape. Featuring an essay by Godsell about the influences of Australia’s landscape and culture in his work, this survey also includes an introduction by leading critic and commentator Philip Goad about the achievements of Godsell’s career to date and the importance of his visionary designs. With a complete illustrated chronology of Sean Godsell’s works, this overview will be an important resource for architecture lovers and design enthusiasts. 200 color illustrations Giá sản phẩm trên Tiki đã bao gồm thuế theo luật hiện hành. Bên cạnh đó, tuỳ vào loại sản phẩm, hình thức và địa chỉ giao hàng mà có thể phát sinh thêm chi phí khác như phí vận chuyển, phụ phí hàng cồng kềnh, thuế nhập khẩu (đối với đơn hàng giao từ nước ngoài có giá trị trên 1 triệu đồng).....",0,0,https://salt.tikicdn.com/ts/product/fb/2a/38/36bb87937fe3e4d532af7336bf7df749.png,https://salt.tikicdn.com/cache/w1200/ts/product/fb/2a/38/36bb87937fe3e4d532af7336bf7df749.png,https://salt.tikicdn.com/cache/w300/ts/product/fb/2a/38/36bb87937fe3e4d532af7336bf7df749.png,https://salt.tikicdn.com/cache/200x280/ts/product/fb/2a/38/36bb87937fe3e4d532af7336bf7df749.png,https://salt.tikicdn.com/cache/200x280/ts/product/fb/2a/38/36bb87937fe3e4d532af7336bf7df749.png,1000,0
101273314,Pret-a-Portea : High-Fashion Bakes & Biscuits,400000,"Pret-a-Portea is the ultimate mix of fashion and high tea, created by London's Berkeley hotel. Each season they serve exclusive biscuit and cake collections inspired by the latest catwalk designs. Thi...","Pret-a-Portea is the ultimate mix of fashion and high tea, created by London's Berkeley hotel. Each season they serve exclusive biscuit and cake collections inspired by the latest catwalk designs. This book celebrates Pret-a-Portea's tenth anniversary and shares the secrets behind their greatest hits, including baked versions of DVF, Dolce & Gabbana, Moschino and Manolo Blahnik. Each recipe is beautifully photographed and accompanied by the catwalk image that inspired the Berkeley's sugary creation. If you love fashion, baking or both, you will enjoy the challenge of making everything from Burberry Trench Biscuits to Anya Hindmarch Cake Bags. Giá sản phẩm trên Tiki đã bao gồm thuế theo luật hiện hành. Bên cạnh đó, tuỳ vào loại sản phẩm, hình thức và địa chỉ giao hàng mà có thể phát sinh thêm chi phí khác như phí vận chuyển, phụ phí hàng cồng kềnh, thuế nhập khẩu (đối với đơn hàng giao từ nước ngoài có giá trị trên 1 triệu đồng).....",0,0,https://salt.tikicdn.com/ts/product/8c/7d/43/ef5cd2d35ec845a455dad3dcff6477ca.jpg,https://salt.tikicdn.com/cache/w1200/ts/product/8c/7d/43/ef5cd2d35ec845a455dad3dcff6477ca.jpg,https://salt.tikicdn.com/cache/w300/ts/product/8c/7d/43/ef5cd2d35ec845a455dad3dcff6477ca.jpg,https://salt.tikicdn.com/cache/200x280/ts/product/8c/7d/43/ef5cd2d35ec845a455dad3dcff6477ca.jpg,https://salt.tikicdn.com/cache/200x280/ts/product/8c/7d/43/ef5cd2d35ec845a455dad3dcff6477ca.jpg,1000,0
85096490,In Love with Me - Wedding Stationery Design,770000,Wedding is the occasion where dream comes true and is definitely a most perfect day for the couple. Every couple is unique in their own way and deserves a tailored wedding to express their personalit...,"Wedding is the occasion where dream comes true and is definitely a most perfect day for the couple. Every couple is unique in their own way and deserves a tailored wedding to express their personality and share their love story. This book is a collection of over 100 graphic design projects for weddings across the world, each showcasing a specific theme. You can find reference for every aspect of wedding graphic design including logo, invitation, table cards, and gift wraps."" Giá sản phẩm trên Tiki đã bao gồm thuế theo luật hiện hành. Bên cạnh đó, tuỳ vào loại sản phẩm, hình thức và địa chỉ giao hàng mà có thể phát sinh thêm chi phí khác như phí vận chuyển, phụ phí hàng cồng kềnh, thuế nhập khẩu (đối với đơn hàng giao từ nước ngoài có giá trị trên 1 triệu đồng).....",0,0,https://salt.tikicdn.com/ts/product/00/2d/ea/78543a0af6549f6a7ff45d4a02ece49f.jpg,https://salt.tikicdn.com/cache/w1200/ts/product/00/2d/ea/78543a0af6549f6a7ff45d4a02ece49f.jpg,https://salt.tikicdn.com/cache/w300/ts/product/00/2d/ea/78543a0af6549f6a7ff45d4a02ece49f.jpg,https://salt.tikicdn.com/cache/200x280/ts/product/00/2d/ea/78543a0af6549f6a7ff45d4a02ece49f.jpg,https://salt.tikicdn.com/cache/200x280/ts/product/00/2d/ea/78543a0af6549f6a7ff45d4a02ece49f.jpg,1000,0
8357980,Swedish Design,644000,"Leading design historian Lasse Brunnström traces the move from artisanal crafts production to the mass production and consumption of designed objects, a process by which the role and profile of the de...","Leading design historian Lasse Brunnström traces the move from artisanal crafts production to the mass production and consumption of designed objects, a process by which the role and profile of the designer became increasingly important. His survey, richly illustrated with images of the designed objects discussed, takes in forms of design traditionally associated with Sweden, such as household objects and textiles, while also considering some less-written about genres such as industrial and graphic design. Brunnström questions many established ideas about design in Sweden, notably its aesthetics and its relationship to Sweden's national and political culture. He argues that the history of design in Sweden has been far more complex and less straightforwardly 'blond' than hitherto understood. Giá sản phẩm trên Tiki đã bao gồm thuế theo luật hiện hành. Bên cạnh đó, tuỳ vào loại sản phẩm, hình thức và địa chỉ giao hàng mà có thể phát sinh thêm chi phí khác như phí vận chuyển, phụ phí hàng cồng kềnh, thuế nhập khẩu (đối với đơn hàng giao từ nước ngoài có giá trị trên 1 triệu đồng).....",0,0,https://salt.tikicdn.com/ts/product/a2/2b/5a/67275a3a2e3402c7adae9038c1233353.jpg,https://salt.tikicdn.com/cache/w1200/ts/product/a2/2b/5a/67275a3a2e3402c7adae9038c1233353.jpg,https://salt.tikicdn.com/cache/w300/ts/product/a2/2b/5a/67275a3a2e3402c7adae9038c1233353.jpg,https://salt.tikicdn.com/cache/200x280/ts/product/a2/2b/5a/67275a3a2e3402c7adae9038c1233353.jpg,https://salt.tikicdn.com/cache/200x280/ts/product/a2/2b/5a/67275a3a2e3402c7adae9038c1233353.jpg,1000,0
277553676,Sách - The Joy of Living with Plants: Ideas and inspirations for indoor gardens by Isabelle Palmer - Sách tiếng anh,280000,Tác giả: Isabelle PalmerNhà xuất bản: Cico BooksNăm xuất bản: 2021Công ty phát hành: 66BooksLoại bìa: Bìa cứngSố trang: 144 TrangNgôn ngữ: Tiếng AnhISBN: 9781800650275Kích thước: 17.02 x 1.52 ...,"Tác giả: Isabelle Palmer Nhà xuất bản: Cico Books Năm xuất bản: 2021 Công ty phát hành: 66Books Loại bìa: Bìa cứng Số trang: 144 Trang Ngôn ngữ: Tiếng Anh ISBN: 9781800650275 Kích thước: 17.02 x 1.52 x 20.96 cm Biến đổi ngôi nhà của bạn một cách dễ dàng với hơn 60 ý tưởng sáng tạo và đầy phong cách để tạo ra những khu vườn trong nhà. Chuyên gia làm vườn trong không gian nhỏ Isabelle Palmer sẽ chỉ cho bạn cách tạo ra những hồ cạn và vườn treo tuyệt đẹp cũng như cách trồng dưới kính và trồng cây theo chiều dọc, cùng với những lời khuyên và kỹ thuật hữu ích cũng như những lời khuyên hữu ích để chăm sóc cây trồng trong nhà mới của bạn. Trồng và trưng bày những cây thủy sinh tuyệt vời trong một chiếc bình sâu, tạo ra một khu trưng bày rêu và dương xỉ tuyệt đẹp bên lò sưởi, nhóm nhiều loại hoa lan xinh đẹp với màu sắc tươi sáng trên kệ và trồng một số loài mọng nước nhỏ như viên ngọc để tạo khung cảnh cửa sổ nhà bếp dễ dàng và hợp xu hướng. . Isabelle xóa bỏ bí ẩn về việc chăm sóc cây trồng và mang đến cho mọi người cơ hội tận hưởng những lợi ích và vẻ đẹp của khu vườn trong nhà. Transform your home the easy way with more than 60 innovative and stylish ideas for creating indoor gardens. Small-space gardening expert Isabelle Palmer shows you how to create gorgeous terrariums and hanging gardens, and how to grow under glass and plant vertically, with helpful advice and techniques, as well as handy tips for taking care of your new house plants. Grow and display amazing aquatic plants in a deep vase, create a stunning fireside moss and fern display, group a variety of beautiful orchids in bright colours on a shelf and plant some tiny jewel-like succulents for an easy and on-trend kitchen window scene. Isabelle removes the mystery of taking care of plants and gives everyone a chance to enjoy the benefits and beauty of a garden indoors. Giá sản phẩm trên Tiki đã bao gồm thuế theo luật hiện hành. Bên cạnh đó, tuỳ vào loại sản phẩm, hình thức và địa chỉ giao hàng mà có thể phát sinh thêm chi phí khác như phí vận chuyển, phụ phí hàng cồng kềnh, thuế nhập khẩu (đối với đơn hàng giao từ nước ngoài có giá trị trên 1 triệu đồng).....",0,0,"https://salt.tikicdn.com/ts/product/62/47/44/337fc00eaffb3b354dba8a8e28faf94c.jpg, https://salt.tikicdn.com/ts/product/cb/43/b4/70663e58442356390927a8e7dfd7287b.jpg, https://salt.tikicdn.com/ts/product/ff/65/22/9b770e9f2a002246e586dab57622a6d1.jpg, https://salt.tikicdn.com/ts/product/cb/a7/90/f0cb17e6227f509c296c4431a32fdd07.jpg","https://salt.tikicdn.com/cache/w1200/ts/product/62/47/44/337fc00eaffb3b354dba8a8e28faf94c.jpg, https://salt.tikicdn.com/cache/w1200/ts/product/cb/43/b4/70663e58442356390927a8e7dfd7287b.jpg, https://salt.tikicdn.com/cache/w1200/ts/product/ff/65/22/9b770e9f2a002246e586dab57622a6d1.jpg, https://salt.tikicdn.com/cache/w1200/ts/product/cb/a7/90/f0cb17e6227f509c296c4431a32fdd07.jpg","https://salt.tikicdn.com/cache/w300/ts/product/62/47/44/337fc00eaffb3b354dba8a8e28faf94c.jpg, https://salt.tikicdn.com/cache/w300/ts/product/cb/43/b4/70663e58442356390927a8e7dfd7287b.jpg, https://salt.tikicdn.com/cache/w300/ts/product/ff/65/22/9b770e9f2a002246e586dab57622a6d1.jpg, https://salt.tikicdn.com/cache/w300/ts/product/cb/a7/90/f0cb17e6227f509c296c4431a32fdd07.jpg","https://salt.tikicdn.com/cache/200x280/ts/product/62/47/44/337fc00eaffb3b354dba8a8e28faf94c.jpg, https://salt.tikicdn.com/cache/200x280/ts/product/cb/43/b4/70663e58442356390927a8e7dfd7287b.jpg, https://salt.tikicdn.com/cache/200x280/ts/product/ff/65/22/9b770e9f2a002246e586dab57622a6d1.jpg, https://salt.tikicdn.com/cache/200x280/ts/product/cb/a7/90/f0cb17e6227f509c296c4431a32fdd07.jpg","https://salt.tikicdn.com/cache/200x280/ts/product/62/47/44/337fc00eaffb3b354dba8a8e28faf94c.jpg, https://salt.tikicdn.com/cache/200x280/ts/product/cb/43/b4/70663e58442356390927a8e7dfd7287b.jpg, https://salt.tikicdn.com/cache/200x280/ts/product/ff/65/22/9b770e9f2a002246e586dab57622a6d1.jpg, https://salt.tikicdn.com/cache/200x280/ts/product/cb/a7/90/f0cb17e6227f509c296c4431a32fdd07.jpg",1000,0
277353073,The Paper Menagerie,289000,"The Paper Menagerie Ken Liu is one of the most original, thought-provoking and award-winning short-story writers of his generation. This is the first collection of his work - sixteen stories that in...","The Paper Menagerie Ken Liu is one of the most original, thought-provoking and award-winning short-story writers of his generation. This is the first collection of his work - sixteen stories that invoke the magical within the mundane, by turns profound, beguiling and heartbreaking. Included here are: The Man Who Ended History: A Documentary (Finalist for Hugo, Nebula, and Sturgeon Awards), Mono No Aware (Hugo Award winner), The Waves (Nebula Award finalist), The Bookmaking Habits of Select Species (Nebula and Sturgeon award finalists), All the Flavors (Nebula Award finalist), The Litigation Master and the Monkey King (Nebula Award finalist) ,and the most awarded story in the genre's history, The Paper Menagerie (the only story ever to win the Hugo, Nebula, and World Fantasy awards). Giá sản phẩm trên Tiki đã bao gồm thuế theo luật hiện hành. Bên cạnh đó, tuỳ vào loại sản phẩm, hình thức và địa chỉ giao hàng mà có thể phát sinh thêm chi phí khác như phí vận chuyển, phụ phí hàng cồng kềnh, thuế nhập khẩu (đối với đơn hàng giao từ nước ngoài có giá trị trên 1 triệu đồng).....",0,0,https://salt.tikicdn.com/ts/product/2b/2f/71/1dd0dc421c4293cbfdd13a1f7bad9d95.jpg,https://salt.tikicdn.com/cache/w1200/ts/product/2b/2f/71/1dd0dc421c4293cbfdd13a1f7bad9d95.jpg,https://salt.tikicdn.com/cache/w300/ts/product/2b/2f/71/1dd0dc421c4293cbfdd13a1f7bad9d95.jpg,https://salt.tikicdn.com/cache/200x280/ts/product/2b/2f/71/1dd0dc421c4293cbfdd13a1f7bad9d95.jpg,https://salt.tikicdn.com/cache/200x280/ts/product/2b/2f/71/1dd0dc421c4293cbfdd13a1f7bad9d95.jpg,1000,0
276739412,Treasure Book Making: Crafting Handmade,1000000,"Divine Diary DIYs for the Innovative Crafter#1 Best Seller in Book Making & Binding and ScrapbookingWith journal making projects, book binding techniques, and journal prompts, this Treasure Book...","Divine Diary DIYs for the Innovative Crafter #1 Best Seller in Book Making & Binding and Scrapbooking With journal making projects, book binding techniques, and journal prompts, this Treasure Book Making guide has everything you need. Get ready to create personal journals by hand easily—without any extra book-binding tools! An affordable craft. Hobbies tend to require a big investment, but Author Natasa Marinkovic, creator of popular YouTube channel Treasure Books , focuses on upcycling the available materials around us. Learn how to make beautiful journals—without purchasing book-binding tools, use what you have! With the things you have at home, create projects that are both useful and beautiful. Fall into the world of book binding. This junk-journaling-how-to gives readers all of the details on how to make a book through step-by-step creative projects that will save you space and get rid of house clutter. This diary DIY is the ultimate space for your creativity to bloom and grow! Inside, you'll find: Illustrations and tips to jumpstart your creativity on DIY books Easy-to-follow instructions to structure and make a book for journaling and scrap keeping Lists of accessible materials to use—such as cereal boxes, scraps of paper, and everyday items like buttons and more Giá sản phẩm trên Tiki đã bao gồm thuế theo luật hiện hành. Bên cạnh đó, tuỳ vào loại sản phẩm, hình thức và địa chỉ giao hàng mà có thể phát sinh thêm chi phí khác như phí vận chuyển, phụ phí hàng cồng kềnh, thuế nhập khẩu (đối với đơn hàng giao từ nước ngoài có giá trị trên 1 triệu đồng).....",0,0,"https://salt.tikicdn.com/ts/product/a9/ec/87/97d0ed3a22c2b4b5370046be3b1840a1.jpg, https://salt.tikicdn.com/ts/product/4e/ab/07/476f0312f2ad513a345675d6148004ca.jpg, https://salt.tikicdn.com/ts/product/99/3f/5b/c6dfb2cd6114b6dae4ac319f890b7c4e.jpg, https://salt.tikicdn.com/ts/product/2e/2a/c7/730ac8f36b9cd4a8ee9ec322c66de837.jpg, https://salt.tikicdn.com/ts/product/39/cd/6c/b9782eea66c1e92725d1abff317ebccb.jpg","https://salt.tikicdn.com/cache/w1200/ts/product/a9/ec/87/97d0ed3a22c2b4b5370046be3b1840a1.jpg, https://salt.tikicdn.com/cache/w1200/ts/product/4e/ab/07/476f0312f2ad513a345675d6148004ca.jpg, https://salt.tikicdn.com/cache/w1200/ts/product/99/3f/5b/c6dfb2cd6114b6dae4ac319f890b7c4e.jpg, https://salt.tikicdn.com/cache/w1200/ts/product/2e/2a/c7/730ac8f36b9cd4a8ee9ec322c66de837.jpg, https://salt.tikicdn.com/cache/w1200/ts/product/39/cd/6c/b9782eea66c1e92725d1abff317ebccb.jpg","https://salt.tikicdn.com/cache/w300/ts/product/a9/ec/87/97d0ed3a22c2b4b5370046be3b1840a1.jpg, https://salt.tikicdn.com/cache/w300/ts/product/4e/ab/07/476f0312f2ad513a345675d6148004ca.jpg, https://salt.tikicdn.com/cache/w300/ts/product/99/3f/5b/c6dfb2cd6114b6dae4ac319f890b7c4e.jpg, https://salt.tikicdn.com/cache/w300/ts/product/2e/2a/c7/730ac8f36b9cd4a8ee9ec322c66de837.jpg, https://salt.tikicdn.com/cache/w300/ts/product/39/cd/6c/b9782eea66c1e92725d1abff317ebccb.jpg","https://salt.tikicdn.com/cache/200x280/ts/product/a9/ec/87/97d0ed3a22c2b4b5370046be3b1840a1.jpg, https://salt.tikicdn.com/cache/200x280/ts/product/4e/ab/07/476f0312f2ad513a345675d6148004ca.jpg, https://salt.tikicdn.com/cache/200x280/ts/product/99/3f/5b/c6dfb2cd6114b6dae4ac319f890b7c4e.jpg, https://salt.tikicdn.com/cache/200x280/ts/product/2e/2a/c7/730ac8f36b9cd4a8ee9ec322c66de837.jpg, https://salt.tikicdn.com/cache/200x280/ts/product/39/cd/6c/b9782eea66c1e92725d1abff317ebccb.jpg","https://salt.tikicdn.com/cache/200x280/ts/product/a9/ec/87/97d0ed3a22c2b4b5370046be3b1840a1.jpg, https://salt.tikicdn.com/cache/200x280/ts/product/4e/ab/07/476f0312f2ad513a345675d6148004ca.jpg, https://salt.tikicdn.com/cache/200x280/ts/product/99/3f/5b/c6dfb2cd6114b6dae4ac319f890b7c4e.jpg, https://salt.tikicdn.com/cache/200x280/ts/product/2e/2a/c7/730ac8f36b9cd4a8ee9ec322c66de837.jpg, https://salt.tikicdn.com/cache/200x280/ts/product/39/cd/6c/b9782eea66c1e92725d1abff317ebccb.jpg",1000,0
276717996,Toraji Works + Character Modeling Techniques,1050000,"From Kojima Productions, overwhelming painting and eyesight, the popular concept artist, 3D character artist Toraji, the long-awaited first work collection.In addition to drawing and original works, i...","From Kojima Productions, overwhelming painting and eyesight, the popular concept artist, 3D character artist Toraji, the long-awaited first work collection. In addition to drawing and original works, it also includes copyrighted works of various content you have participated, sketching, MAYA+ ZBrush + Marvelous Designer + Photoshop. INTRODUCTION Introduction GALLERY ORIGINAL WORKS LICENSED WORKS Copyright Artwork CHARACTER CREATION TECHNIQUE Character modeling techniques 01 Create Human Body Models with Daz Studio 02 Output human body model from Daz Studio 03 Maya pose to human body models 04 Maya layout and decide camera Create armor with 05 ZBrush 06 Create a Skirt with Marvelous Designer 07 Maya, Make Sword with ZBrush 08 Create a background model with Maya 09 Sets UV with Maya 10 sets the lights on Maya 11 Set materials in Maya 12 Settings for Rendering on Maya 13 Painting by Photoshop Giá sản phẩm trên Tiki đã bao gồm thuế theo luật hiện hành. Bên cạnh đó, tuỳ vào loại sản phẩm, hình thức và địa chỉ giao hàng mà có thể phát sinh thêm chi phí khác như phí vận chuyển, phụ phí hàng cồng kềnh, thuế nhập khẩu (đối với đơn hàng giao từ nước ngoài có giá trị trên 1 triệu đồng).....",0,0,"https://salt.tikicdn.com/ts/product/80/ac/e7/6409b5a430130d8777b575d9da730aba.jpg, https://salt.tikicdn.com/ts/product/40/ba/3b/944dd4b7a273d641347d9f072e3c94d8.jpg, https://salt.tikicdn.com/ts/product/11/93/4c/1ceb20511e3db48b8a9f02566aace969.jpg, https://salt.tikicdn.com/ts/product/b4/71/a4/171d5006b4f08a3731167b40a6a1dc2a.jpg, https://salt.tikicdn.com/ts/product/94/3b/ea/86027e5bd67fc90cf0333c16ac00acf9.jpg","https://salt.tikicdn.com/cache/w1200/ts/product/80/ac/e7/6409b5a430130d8777b575d9da730aba.jpg, https://salt.tikicdn.com/cache/w1200/ts/product/40/ba/3b/944dd4b7a273d641347d9f072e3c94d8.jpg, https://salt.tikicdn.com/cache/w1200/ts/product/11/93/4c/1ceb20511e3db48b8a9f02566aace969.jpg, https://salt.tikicdn.com/cache/w1200/ts/product/b4/71/a4/171d5006b4f08a3731167b40a6a1dc2a.jpg, https://salt.tikicdn.com/cache/w1200/ts/product/94/3b/ea/86027e5bd67fc90cf0333c16ac00acf9.jpg","https://salt.tikicdn.com/cache/w300/ts/product/80/ac/e7/6409b5a430130d8777b575d9da730aba.jpg, https://salt.tikicdn.com/cache/w300/ts/product/40/ba/3b/944dd4b7a273d641347d9f072e3c94d8.jpg, https://salt.tikicdn.com/cache/w300/ts/product/11/93/4c/1ceb20511e3db48b8a9f02566aace969.jpg, https://salt.tikicdn.com/cache/w300/ts/product/b4/71/a4/171d5006b4f08a3731167b40a6a1dc2a.jpg, https://salt.tikicdn.com/cache/w300/ts/product/94/3b/ea/86027e5bd67fc90cf0333c16ac00acf9.jpg","https://salt.tikicdn.com/cache/200x280/ts/product/80/ac/e7/6409b5a430130d8777b575d9da730aba.jpg, https://salt.tikicdn.com/cache/200x280/ts/product/40/ba/3b/944dd4b7a273d641347d9f072e3c94d8.jpg, https://salt.tikicdn.com/cache/200x280/ts/product/11/93/4c/1ceb20511e3db48b8a9f02566aace969.jpg, https://salt.tikicdn.com/cache/200x280/ts/product/b4/71/a4/171d5006b4f08a3731167b40a6a1dc2a.jpg, https://salt.tikicdn.com/cache/200x280/ts/product/94/3b/ea/86027e5bd67fc90cf0333c16ac00acf9.jpg","https://salt.tikicdn.com/cache/200x280/ts/product/80/ac/e7/6409b5a430130d8777b575d9da730aba.jpg, https://salt.tikicdn.com/cache/200x280/ts/product/40/ba/3b/944dd4b7a273d641347d9f072e3c94d8.jpg, https://salt.tikicdn.com/cache/200x280/ts/product/11/93/4c/1ceb20511e3db48b8a9f02566aace969.jpg, https://salt.tikicdn.com/cache/200x280/ts/product/b4/71/a4/171d5006b4f08a3731167b40a6a1dc2a.jpg, https://salt.tikicdn.com/cache/200x280/ts/product/94/3b/ea/86027e5bd67fc90cf0333c16ac00acf9.jpg",1000,0
