id,name,price,short_description,description,rating_average,review_count,image_base_url,image_large_url,image_medium_url,image_small_url,image_thumbnail_url,stock,quantity_sold
77223335,"Kẹp bướm, kẹp giấy đen Hồng Hà 41mm (hộp 12 chiếc) - 6636",24000,"Kẹp bướm, kẹp giấy đen Hồng Hà 41mm (hộp 12 chiếc) - 6636 được sản xuất trên dây chuyền hiện đại với chất liệu kim loại cao cấp đem lại sự bền, đẹp cho sản phẩm. Kẹp bướm Hồng Hà là sản phẩm không thể...","Kẹp bướm, kẹp giấy đen Hồng Hà 41mm (hộp 12 chiếc) - 6636 được sản xuất trên dây chuyền hiện đại với chất liệu kim loại cao cấp đem lại sự bền, đẹp cho sản phẩm. Kẹp bướm Hồng Hà là sản phẩm không thể thiếu trong mọi văn phòng, trường học giúp hỗ trợ công việc sắp xếp, lưu trữ các tài liệu rời khoa học hơn. 1. THÔNG SỐ SẢN PHẨM Kích thước: 41 mm Đóng gói: 12 cái/hộp; Thương hiệu: Hồng Hà Chất liệu: Kim loại chất lượng cao phủ Niken 2. ĐẶC ĐIỂM SẢN PHẨM Sản xuất từ chất liệu kim loại cao cấp, được phủ Niken chống gỉ giúp kẹp bướm luôn bền đẹp theo thời gian Phần lò xo của kẹp linh hoạt, nhẹ, dễ dùng, không bị lỏng hay bung rời sau nhiều lần sử dụng Tay cầm chắc chắn, vừa vặn tạo cảm giác thoải mái khi sử dụng Đa dạng đủ mọi kích cỡ từ 15 - 51 mm phù hợp với mọi nhu cầu Tính ứng dụng cao, dễ sử dụng giúp việc phân loại, bảo quản tài liệu nhẹ nhàng và hiệu quả hơn Giá sản phẩm trên Tiki đã bao gồm thuế theo luật hiện hành. Bên cạnh đó, tuỳ vào loại sản phẩm, hình thức và địa chỉ giao hàng mà có thể phát sinh thêm chi phí khác như phí vận chuyển, phụ phí hàng cồng kềnh, thuế nhập khẩu (đối với đơn hàng giao từ nước ngoài có giá trị trên 1 triệu đồng).....",5,3,"https://salt.tikicdn.com/ts/product/5f/e9/24/ce53bb8991ad1c26b75ce10a3291e416.jpg, https://salt.tikicdn.com/ts/product/99/68/19/237176d16ebe72a51fc3fda68e57b91b.jpg, https://salt.tikicdn.com/ts/product/31/fa/1b/8f2080e4aaab1dc3dcd33ad70454f31c.jpg, https://salt.tikicdn.com/ts/product/2a/2d/9a/ba9a28416d1498a9eadd7008dd8fcff5.jpg, https://salt.tikicdn.com/ts/product/e0/4e/04/c431fcaa53de656ca5806e9f4fb94ece.jpg","https://salt.tikicdn.com/cache/w1200/ts/product/5f/e9/24/ce53bb8991ad1c26b75ce10a3291e416.jpg, https://salt.tikicdn.com/cache/w1200/ts/product/99/68/19/237176d16ebe72a51fc3fda68e57b91b.jpg, https://salt.tikicdn.com/cache/w1200/ts/product/31/fa/1b/8f2080e4aaab1dc3dcd33ad70454f31c.jpg, https://salt.tikicdn.com/cache/w1200/ts/product/2a/2d/9a/ba9a28416d1498a9eadd7008dd8fcff5.jpg, https://salt.tikicdn.com/cache/w1200/ts/product/e0/4e/04/c431fcaa53de656ca5806e9f4fb94ece.jpg","https://salt.tikicdn.com/cache/w300/ts/product/5f/e9/24/ce53bb8991ad1c26b75ce10a3291e416.jpg, https://salt.tikicdn.com/cache/w300/ts/product/99/68/19/237176d16ebe72a51fc3fda68e57b91b.jpg, https://salt.tikicdn.com/cache/w300/ts/product/31/fa/1b/8f2080e4aaab1dc3dcd33ad70454f31c.jpg, https://salt.tikicdn.com/cache/w300/ts/product/2a/2d/9a/ba9a28416d1498a9eadd7008dd8fcff5.jpg, https://salt.tikicdn.com/cache/w300/ts/product/e0/4e/04/c431fcaa53de656ca5806e9f4fb94ece.jpg","https://salt.tikicdn.com/cache/200x280/ts/product/5f/e9/24/ce53bb8991ad1c26b75ce10a3291e416.jpg, https://salt.tikicdn.com/cache/200x280/ts/product/99/68/19/237176d16ebe72a51fc3fda68e57b91b.jpg, https://salt.tikicdn.com/cache/200x280/ts/product/31/fa/1b/8f2080e4aaab1dc3dcd33ad70454f31c.jpg, https://salt.tikicdn.com/cache/200x280/ts/product/2a/2d/9a/ba9a28416d1498a9eadd7008dd8fcff5.jpg, https://salt.tikicdn.com/cache/200x280/ts/product/e0/4e/04/c431fcaa53de656ca5806e9f4fb94ece.jpg","https://salt.tikicdn.com/cache/200x280/ts/product/5f/e9/24/ce53bb8991ad1c26b75ce10a3291e416.jpg, https://salt.tikicdn.com/cache/200x280/ts/product/99/68/19/237176d16ebe72a51fc3fda68e57b91b.jpg, https://salt.tikicdn.com/cache/200x280/ts/product/31/fa/1b/8f2080e4aaab1dc3dcd33ad70454f31c.jpg, https://salt.tikicdn.com/cache/200x280/ts/product/2a/2d/9a/ba9a28416d1498a9eadd7008dd8fcff5.jpg, https://salt.tikicdn.com/cache/200x280/ts/product/e0/4e/04/c431fcaa53de656ca5806e9f4fb94ece.jpg",1000,3
77223313,"Kẹp bướm, kẹp giấy đen Hồng Hà 19mm (hộp 12 chiếc) - 6633",7000,"Kẹp bướm, kẹp giấy đen Hồng Hà 19mm (hộp 12 chiếc) - 6633 được sản xuất trên dây chuyền hiện đại với chất liệu kim loại cao cấp đem lại sự bền, đẹp cho sản phẩm. Kẹp bướm Hồng Hà là sản phẩm không thể...","Kẹp bướm, kẹp giấy đen Hồng Hà 19mm (hộp 12 chiếc) - 6633 được sản xuất trên dây chuyền hiện đại với chất liệu kim loại cao cấp đem lại sự bền, đẹp cho sản phẩm. Kẹp bướm Hồng Hà là sản phẩm không thể thiếu trong mọi văn phòng, trường học giúp hỗ trợ công việc sắp xếp, lưu trữ các tài liệu rời khoa học hơn. 1. THÔNG SỐ SẢN PHẨM Kích thước: 19 mm Đóng gói: 12 cái/hộp; Thương hiệu: Hồng Hà Chất liệu: Kim loại chất lượng cao phủ Niken 2. ĐẶC ĐIỂM SẢN PHẨM Sản xuất từ chất liệu kim loại cao cấp, được phủ Niken chống gỉ giúp kẹp bướm luôn bền đẹp theo thời gian Phần lò xo của kẹp linh hoạt, nhẹ, dễ dùng, không bị lỏng hay bung rời sau nhiều lần sử dụng Tay cầm chắc chắn, vừa vặn tạo cảm giác thoải mái khi sử dụng Đa dạng đủ mọi kích cỡ từ 15 - 51 mm phù hợp với mọi nhu cầu Tính ứng dụng cao, dễ sử dụng giúp việc phân loại, bảo quản tài liệu nhẹ nhàng và hiệu quả hơn Giá sản phẩm trên Tiki đã bao gồm thuế theo luật hiện hành. Bên cạnh đó, tuỳ vào loại sản phẩm, hình thức và địa chỉ giao hàng mà có thể phát sinh thêm chi phí khác như phí vận chuyển, phụ phí hàng cồng kềnh, thuế nhập khẩu (đối với đơn hàng giao từ nước ngoài có giá trị trên 1 triệu đồng).....",5,1,"https://salt.tikicdn.com/ts/product/fa/d7/25/d94f5e775e5b8cc26f7849d6c5ded644.jpg, https://salt.tikicdn.com/ts/product/42/8a/b7/6c8887efc0a6578903d4ccbe0b920277.jpg, https://salt.tikicdn.com/ts/product/33/17/a6/fe8b35f7214bbeed977df2d49fa3b4e2.jpg, https://salt.tikicdn.com/ts/product/98/c3/f9/d25db0685ac8e31efe51c4b8d321f7c5.jpg, https://salt.tikicdn.com/ts/product/04/83/bb/053bff34440590abfdb287bad53d21cd.jpg","https://salt.tikicdn.com/cache/w1200/ts/product/fa/d7/25/d94f5e775e5b8cc26f7849d6c5ded644.jpg, https://salt.tikicdn.com/cache/w1200/ts/product/42/8a/b7/6c8887efc0a6578903d4ccbe0b920277.jpg, https://salt.tikicdn.com/cache/w1200/ts/product/33/17/a6/fe8b35f7214bbeed977df2d49fa3b4e2.jpg, https://salt.tikicdn.com/cache/w1200/ts/product/98/c3/f9/d25db0685ac8e31efe51c4b8d321f7c5.jpg, https://salt.tikicdn.com/cache/w1200/ts/product/04/83/bb/053bff34440590abfdb287bad53d21cd.jpg","https://salt.tikicdn.com/cache/w300/ts/product/fa/d7/25/d94f5e775e5b8cc26f7849d6c5ded644.jpg, https://salt.tikicdn.com/cache/w300/ts/product/42/8a/b7/6c8887efc0a6578903d4ccbe0b920277.jpg, https://salt.tikicdn.com/cache/w300/ts/product/33/17/a6/fe8b35f7214bbeed977df2d49fa3b4e2.jpg, https://salt.tikicdn.com/cache/w300/ts/product/98/c3/f9/d25db0685ac8e31efe51c4b8d321f7c5.jpg, https://salt.tikicdn.com/cache/w300/ts/product/04/83/bb/053bff34440590abfdb287bad53d21cd.jpg","https://salt.tikicdn.com/cache/200x280/ts/product/fa/d7/25/d94f5e775e5b8cc26f7849d6c5ded644.jpg, https://salt.tikicdn.com/cache/200x280/ts/product/42/8a/b7/6c8887efc0a6578903d4ccbe0b920277.jpg, https://salt.tikicdn.com/cache/200x280/ts/product/33/17/a6/fe8b35f7214bbeed977df2d49fa3b4e2.jpg, https://salt.tikicdn.com/cache/200x280/ts/product/98/c3/f9/d25db0685ac8e31efe51c4b8d321f7c5.jpg, https://salt.tikicdn.com/cache/200x280/ts/product/04/83/bb/053bff34440590abfdb287bad53d21cd.jpg","https://salt.tikicdn.com/cache/200x280/ts/product/fa/d7/25/d94f5e775e5b8cc26f7849d6c5ded644.jpg, https://salt.tikicdn.com/cache/200x280/ts/product/42/8a/b7/6c8887efc0a6578903d4ccbe0b920277.jpg, https://salt.tikicdn.com/cache/200x280/ts/product/33/17/a6/fe8b35f7214bbeed977df2d49fa3b4e2.jpg, https://salt.tikicdn.com/cache/200x280/ts/product/98/c3/f9/d25db0685ac8e31efe51c4b8d321f7c5.jpg, https://salt.tikicdn.com/cache/200x280/ts/product/04/83/bb/053bff34440590abfdb287bad53d21cd.jpg",1000,1
68124470,Kẹp Bướm Màu 51mm FO-DCC06,75600,"Kẹp Bướm Màu 51mm FO-DCC06   Sản phẩm là vật dụng cần thiết đối với học sinh, sinh viên và nhân viên văn phòng, kẹp hồ sơ và giấy tờ thành tập, giúp bạn dễ dàng phân loại, bảo quản và cất giữ. ...","Kẹp Bướm Màu 51mm FO-DCC06 Sản phẩm là vật dụng cần thiết đối với học sinh, sinh viên và nhân viên văn phòng, kẹp hồ sơ và giấy tờ thành tập, giúp bạn dễ dàng phân loại, bảo quản và cất giữ. Sản phẩm được làm từ nhựa và kim loại cứng cáp, không bị gỉ sét, độ bền cao. Bề mặt kẹp còn được phủ một lớp sơn gia nhiệt khó bong tróc, giúp chống gỉ, chống oxi hoá nhằm nâng cao tuổi thọ sản phẩm. Kẹp bướm có thể kẹp chặt lượng tài liệu ít. Sản phẩm thiết kế đơn giản, dễ sử dụng mà không bị đau tay Kẹp giấy có thiết kế cứng cáp, lực kẹp lớn, không bị gãy hoặc bung rời. Lò xo linh hoạt, đàn hồi tốt, dễ sử dụng. Giá sản phẩm trên Tiki đã bao gồm thuế theo luật hiện hành. Bên cạnh đó, tuỳ vào loại sản phẩm, hình thức và địa chỉ giao hàng mà có thể phát sinh thêm chi phí khác như phí vận chuyển, phụ phí hàng cồng kềnh, thuế nhập khẩu (đối với đơn hàng giao từ nước ngoài có giá trị trên 1 triệu đồng).....",5,1,"https://salt.tikicdn.com/ts/product/20/56/db/e3f89ef2b13ad48168e1326b81256c75.jpg, https://salt.tikicdn.com/ts/product/0b/60/a8/f9ce85b41216c3b4a3f107c73591ad28.jpg, https://salt.tikicdn.com/ts/product/e8/b2/6f/d10e88ee8ce8a29b9695797f86075f57.jpg, https://salt.tikicdn.com/ts/product/38/e8/8d/4f125981653ec79b6a198dabdca69803.jpg, https://salt.tikicdn.com/ts/product/fa/7f/1a/c707eaf88dacda153e21da83e733561a.jpg","https://salt.tikicdn.com/cache/w1200/ts/product/20/56/db/e3f89ef2b13ad48168e1326b81256c75.jpg, https://salt.tikicdn.com/cache/w1200/ts/product/0b/60/a8/f9ce85b41216c3b4a3f107c73591ad28.jpg, https://salt.tikicdn.com/cache/w1200/ts/product/e8/b2/6f/d10e88ee8ce8a29b9695797f86075f57.jpg, https://salt.tikicdn.com/cache/w1200/ts/product/38/e8/8d/4f125981653ec79b6a198dabdca69803.jpg, https://salt.tikicdn.com/cache/w1200/ts/product/fa/7f/1a/c707eaf88dacda153e21da83e733561a.jpg","https://salt.tikicdn.com/cache/w300/ts/product/20/56/db/e3f89ef2b13ad48168e1326b81256c75.jpg, https://salt.tikicdn.com/cache/w300/ts/product/0b/60/a8/f9ce85b41216c3b4a3f107c73591ad28.jpg, https://salt.tikicdn.com/cache/w300/ts/product/e8/b2/6f/d10e88ee8ce8a29b9695797f86075f57.jpg, https://salt.tikicdn.com/cache/w300/ts/product/38/e8/8d/4f125981653ec79b6a198dabdca69803.jpg, https://salt.tikicdn.com/cache/w300/ts/product/fa/7f/1a/c707eaf88dacda153e21da83e733561a.jpg","https://salt.tikicdn.com/cache/200x280/ts/product/20/56/db/e3f89ef2b13ad48168e1326b81256c75.jpg, https://salt.tikicdn.com/cache/200x280/ts/product/0b/60/a8/f9ce85b41216c3b4a3f107c73591ad28.jpg, https://salt.tikicdn.com/cache/200x280/ts/product/e8/b2/6f/d10e88ee8ce8a29b9695797f86075f57.jpg, https://salt.tikicdn.com/cache/200x280/ts/product/38/e8/8d/4f125981653ec79b6a198dabdca69803.jpg, https://salt.tikicdn.com/cache/200x280/ts/product/fa/7f/1a/c707eaf88dacda153e21da83e733561a.jpg","https://salt.tikicdn.com/cache/200x280/ts/product/20/56/db/e3f89ef2b13ad48168e1326b81256c75.jpg, https://salt.tikicdn.com/cache/200x280/ts/product/0b/60/a8/f9ce85b41216c3b4a3f107c73591ad28.jpg, https://salt.tikicdn.com/cache/200x280/ts/product/e8/b2/6f/d10e88ee8ce8a29b9695797f86075f57.jpg, https://salt.tikicdn.com/cache/200x280/ts/product/38/e8/8d/4f125981653ec79b6a198dabdca69803.jpg, https://salt.tikicdn.com/cache/200x280/ts/product/fa/7f/1a/c707eaf88dacda153e21da83e733561a.jpg",1000,1
25039762,"COMBO CÁC LOẠI KẸP BƯỚM ECHO 15mm, 19mm,25mm,  32mm, 41mm, 51mm ",95000,"Tiện lợi, dễ sử dụng...","Tiện lợi, dễ sử dụng Giá sản phẩm trên Tiki đã bao gồm thuế theo luật hiện hành. Bên cạnh đó, tuỳ vào loại sản phẩm, hình thức và địa chỉ giao hàng mà có thể phát sinh thêm chi phí khác như phí vận chuyển, phụ phí hàng cồng kềnh, thuế nhập khẩu (đối với đơn hàng giao từ nước ngoài có giá trị trên 1 triệu đồng).....",5,1,"https://salt.tikicdn.com/ts/product/58/d0/76/626ca1bc870985b96ac9ffcf5fa7ce68.png, https://salt.tikicdn.com/ts/product/be/c1/31/1921757dcba9359cb85ec2dac7233813.PNG","https://salt.tikicdn.com/cache/w1200/ts/product/58/d0/76/626ca1bc870985b96ac9ffcf5fa7ce68.png, https://salt.tikicdn.com/cache/w1200/ts/product/be/c1/31/1921757dcba9359cb85ec2dac7233813.PNG","https://salt.tikicdn.com/cache/w300/ts/product/58/d0/76/626ca1bc870985b96ac9ffcf5fa7ce68.png, https://salt.tikicdn.com/cache/w300/ts/product/be/c1/31/1921757dcba9359cb85ec2dac7233813.PNG","https://salt.tikicdn.com/cache/200x280/ts/product/58/d0/76/626ca1bc870985b96ac9ffcf5fa7ce68.png, https://salt.tikicdn.com/cache/200x280/ts/product/be/c1/31/1921757dcba9359cb85ec2dac7233813.PNG","https://salt.tikicdn.com/cache/200x280/ts/product/58/d0/76/626ca1bc870985b96ac9ffcf5fa7ce68.png, https://salt.tikicdn.com/cache/200x280/ts/product/be/c1/31/1921757dcba9359cb85ec2dac7233813.PNG",1000,1
10073893,Kẹp Bướm Double A,35000,"Kẹp Bướm Double A với thiết kế nhỏ, gọn tiện lợi.Giúp bạn cố định giấy tờ chắc chắn.Bề mặt phủ lớp xi mạ chống gỉ sét.Kẹp giấy có thiết kế cứng cáp, lực kẹp lớn, không bị gãy hoặc bung rời.Lò xo ...","Kẹp Bướm Double A với thiết kế nhỏ, gọn tiện lợi. Giúp bạn cố định giấy tờ chắc chắn. Bề mặt phủ lớp xi mạ chống gỉ sét. Kẹp giấy có thiết kế cứng cáp, lực kẹp lớn, không bị gãy hoặc bung rời. Lò xo linh hoạt, đàn hồi tốt, dễ sử dụng. Bạn có thể kẹp hồ sơ và giấy tờ thành tập, giúp bạn dễ dàng phân loại, bảo quản và cất giữ. Vật dụng cần thiết đối với học sinh, sinh viên và nhân viên văn phòng. Một hộp gồm 12 Kẹp bướm. Giá sản phẩm trên Tiki đã bao gồm thuế theo luật hiện hành. Bên cạnh đó, tuỳ vào loại sản phẩm, hình thức và địa chỉ giao hàng mà có thể phát sinh thêm chi phí khác như phí vận chuyển, phụ phí hàng cồng kềnh, thuế nhập khẩu (đối với đơn hàng giao từ nước ngoài có giá trị trên 1 triệu đồng).....",5,1,"https://salt.tikicdn.com/ts/product/d4/a1/5c/9a47b287ab8d8506e87129c3740be551.jpg, https://salt.tikicdn.com/ts/product/70/d2/52/bc62518ae626ff4365ae655676031253.jpg, https://salt.tikicdn.com/ts/product/1a/0c/9d/df9c999a3823bbf9082552552bf305d0.jpg","https://salt.tikicdn.com/cache/w1200/ts/product/d4/a1/5c/9a47b287ab8d8506e87129c3740be551.jpg, https://salt.tikicdn.com/cache/w1200/ts/product/70/d2/52/bc62518ae626ff4365ae655676031253.jpg, https://salt.tikicdn.com/cache/w1200/ts/product/1a/0c/9d/df9c999a3823bbf9082552552bf305d0.jpg","https://salt.tikicdn.com/cache/w300/ts/product/d4/a1/5c/9a47b287ab8d8506e87129c3740be551.jpg, https://salt.tikicdn.com/cache/w300/ts/product/70/d2/52/bc62518ae626ff4365ae655676031253.jpg, https://salt.tikicdn.com/cache/w300/ts/product/1a/0c/9d/df9c999a3823bbf9082552552bf305d0.jpg","https://salt.tikicdn.com/cache/200x280/ts/product/d4/a1/5c/9a47b287ab8d8506e87129c3740be551.jpg, https://salt.tikicdn.com/cache/200x280/ts/product/70/d2/52/bc62518ae626ff4365ae655676031253.jpg, https://salt.tikicdn.com/cache/200x280/ts/product/1a/0c/9d/df9c999a3823bbf9082552552bf305d0.jpg","https://salt.tikicdn.com/cache/200x280/ts/product/d4/a1/5c/9a47b287ab8d8506e87129c3740be551.jpg, https://salt.tikicdn.com/cache/200x280/ts/product/70/d2/52/bc62518ae626ff4365ae655676031253.jpg, https://salt.tikicdn.com/cache/200x280/ts/product/1a/0c/9d/df9c999a3823bbf9082552552bf305d0.jpg",1000,1
2028829,Combo 2 Hộp kẹp bướm SLEcho 19mm,24000,"Đặc điểm: là sản phẩm dùng để kẹp các tài liệu rời rạc thành 1 xấp nguyên, hỗ trợ bạn sắp xếp tài liệu ngăn nắp hơn trên bàn làm việc. Chất lượng: chất lượng ổn định. Quy cách: 12 cái/ 1 hộp, kẹp đ...","Đặc điểm: là sản phẩm dùng để kẹp các tài liệu rời rạc thành 1 xấp nguyên, hỗ trợ bạn sắp xếp tài liệu ngăn nắp hơn trên bàn làm việc. Chất lượng: chất lượng ổn định. Quy cách: 12 cái/ 1 hộp, kẹp được tài liệu dày khoảng 8 mm. Xuất xứ : Việt Nam. Bảo quản: Nhiệt độ: 10 ~ 55º C, Độ ẩm: 55 ~ 95% RH, Tránh xa nguồn nhiệt, dầu mỡ. Giá sản phẩm trên Tiki đã bao gồm thuế theo luật hiện hành. Bên cạnh đó, tuỳ vào loại sản phẩm, hình thức và địa chỉ giao hàng mà có thể phát sinh thêm chi phí khác như phí vận chuyển, phụ phí hàng cồng kềnh, thuế nhập khẩu (đối với đơn hàng giao từ nước ngoài có giá trị trên 1 triệu đồng).....",5,6,https://salt.tikicdn.com/ts/product/8f/03/21/f5950adf9f3ad7c52c4d277f1afc8beb.png,https://salt.tikicdn.com/cache/w1200/ts/product/8f/03/21/f5950adf9f3ad7c52c4d277f1afc8beb.png,https://salt.tikicdn.com/cache/w300/ts/product/8f/03/21/f5950adf9f3ad7c52c4d277f1afc8beb.png,https://salt.tikicdn.com/cache/200x280/ts/product/8f/03/21/f5950adf9f3ad7c52c4d277f1afc8beb.png,https://salt.tikicdn.com/cache/200x280/ts/product/8f/03/21/f5950adf9f3ad7c52c4d277f1afc8beb.png,1000,6
2028785,Combo 2 Hộp kẹp bướm 25mm,16500,"Đặc điểm: là sản phẩm dùng để kẹp các tài liệu rời rạc thành 1 xấp nguyên, hỗ trợ bạn sắp xếp tài liệu ngăn nắp hơn trên bàn làm việc. Chất lượng: chất lượng ổn định. Quy cách: 12 cái/ 1 hộp, kẹp đ...","Đặc điểm: là sản phẩm dùng để kẹp các tài liệu rời rạc thành 1 xấp nguyên, hỗ trợ bạn sắp xếp tài liệu ngăn nắp hơn trên bàn làm việc. Chất lượng: chất lượng ổn định. Quy cách: 12 cái/ 1 hộp, kẹp được tài liệu dày khoảng 12 mm. Xuất xứ : Việt Nam. Bảo quản: Nhiệt độ: 10 ~ 55º C, Độ ẩm: 55 ~ 95% RH, Tránh xa nguồn nhiệt, dầu mỡ. Giá sản phẩm trên Tiki đã bao gồm thuế theo luật hiện hành. Bên cạnh đó, tuỳ vào loại sản phẩm, hình thức và địa chỉ giao hàng mà có thể phát sinh thêm chi phí khác như phí vận chuyển, phụ phí hàng cồng kềnh, thuế nhập khẩu (đối với đơn hàng giao từ nước ngoài có giá trị trên 1 triệu đồng).....",4.8,10,https://salt.tikicdn.com/ts/product/f1/df/45/448e4ae2bf24699be224efa4a5e0a5a2.jpg,https://salt.tikicdn.com/cache/w1200/ts/product/f1/df/45/448e4ae2bf24699be224efa4a5e0a5a2.jpg,https://salt.tikicdn.com/cache/w300/ts/product/f1/df/45/448e4ae2bf24699be224efa4a5e0a5a2.jpg,https://salt.tikicdn.com/cache/200x280/ts/product/f1/df/45/448e4ae2bf24699be224efa4a5e0a5a2.jpg,https://salt.tikicdn.com/cache/200x280/ts/product/f1/df/45/448e4ae2bf24699be224efa4a5e0a5a2.jpg,1000,10
2028681,Kẹp bướm SLEcho 32mm,16500,"Đặc điểm: là sản phẩm dùng để kẹp các tài liệu rời rạc thành 1 xấp nguyên, hỗ trợ bạn sắp xếp tài liệu ngăn nắp hơn trên bàn làm việc. Chất lượng: chất lượng ổn định. Quy cách: 12 cái/ 1 hộp, kẹp đ...","Đặc điểm: là sản phẩm dùng để kẹp các tài liệu rời rạc thành 1 xấp nguyên, hỗ trợ bạn sắp xếp tài liệu ngăn nắp hơn trên bàn làm việc. Chất lượng: chất lượng ổn định. Quy cách: 12 cái/ 1 hộp, kẹp được tài liệu dày khoảng 14 mm. Xuất xứ : Việt Nam. Bảo quản: Nhiệt độ: 10 ~ 55º C, Độ ẩm: 55 ~ 95% RH, Tránh xa nguồn nhiệt, dầu mỡ. Giá sản phẩm trên Tiki đã bao gồm thuế theo luật hiện hành. Bên cạnh đó, tuỳ vào loại sản phẩm, hình thức và địa chỉ giao hàng mà có thể phát sinh thêm chi phí khác như phí vận chuyển, phụ phí hàng cồng kềnh, thuế nhập khẩu (đối với đơn hàng giao từ nước ngoài có giá trị trên 1 triệu đồng).....",5,10,https://salt.tikicdn.com/ts/product/24/3c/60/90564b08bea9e6070bc9e4d173ffada9.jpg,https://salt.tikicdn.com/cache/w1200/ts/product/24/3c/60/90564b08bea9e6070bc9e4d173ffada9.jpg,https://salt.tikicdn.com/cache/w300/ts/product/24/3c/60/90564b08bea9e6070bc9e4d173ffada9.jpg,https://salt.tikicdn.com/cache/200x280/ts/product/24/3c/60/90564b08bea9e6070bc9e4d173ffada9.jpg,https://salt.tikicdn.com/cache/200x280/ts/product/24/3c/60/90564b08bea9e6070bc9e4d173ffada9.jpg,1000,10
2028555,Kẹp bướm SLEcho 51mm,25900,"Đặc điểm: là sản phẩm dùng để kẹp các tài liệu rời rạc thành 1 xấp nguyên, hỗ trợ bạn sắp xếp tài liệu ngăn nắp hơn trên bàn làm việc. Chất lượng: chất lượng ổn định. Quy cách: 12 cái/ 1 hộp, kẹp đ...","Đặc điểm: là sản phẩm dùng để kẹp các tài liệu rời rạc thành 1 xấp nguyên, hỗ trợ bạn sắp xếp tài liệu ngăn nắp hơn trên bàn làm việc. Chất lượng: chất lượng ổn định. Quy cách: 12 cái/ 1 hộp, kẹp được tài liệu dày khoảng 25mm. Xuất xứ : Việt Nam. Bảo quản: Nhiệt độ: 10 ~ 55º C, Độ ẩm: 55 ~ 95% RH, Tránh xa nguồn nhiệt, dầu mỡ. Giá sản phẩm trên Tiki đã bao gồm thuế theo luật hiện hành. Bên cạnh đó, tuỳ vào loại sản phẩm, hình thức và địa chỉ giao hàng mà có thể phát sinh thêm chi phí khác như phí vận chuyển, phụ phí hàng cồng kềnh, thuế nhập khẩu (đối với đơn hàng giao từ nước ngoài có giá trị trên 1 triệu đồng).....",0,0,https://salt.tikicdn.com/ts/product/c7/50/6e/5b57f630481afeca29855d1f750d954d.jpg,https://salt.tikicdn.com/cache/w1200/ts/product/c7/50/6e/5b57f630481afeca29855d1f750d954d.jpg,https://salt.tikicdn.com/cache/w300/ts/product/c7/50/6e/5b57f630481afeca29855d1f750d954d.jpg,https://salt.tikicdn.com/cache/200x280/ts/product/c7/50/6e/5b57f630481afeca29855d1f750d954d.jpg,https://salt.tikicdn.com/cache/200x280/ts/product/c7/50/6e/5b57f630481afeca29855d1f750d954d.jpg,1000,0
