id,name,price,short_description,description,rating_average,review_count,image_base_url,image_large_url,image_medium_url,image_small_url,image_thumbnail_url,stock,quantity_sold
275432737,Bảng tên Enter BT061 86x54mm 1 mặt ngang,7500,Mô tả sản phẩmQuy cách:                    Kích thước lọt lòng 85 x 54mmĐơn vị tính:                 Cái/Hộp/Thùng Đóng gói:                    1/10/200Xuất xứ:                       Việt Nam Chấ...,"Mô tả sản phẩm Quy cách: Kích thước lọt lòng 85 x 54mm Đơn vị tính: Cái/Hộp/Thùng Đóng gói: 1/10/200 Xuất xứ: Việt Nam Chất liệu: Bảng tên Enter BT061 được làm từ nhựa có màu sắc tươi sáng, bắt mắt. Khung viền thẻ được bo tròn bề mặt trơn nhẵn, cứng cáp, bền đẹp. Công dụng: Dùng để đựng thẻ sinh viên, thẻ nhân viên...giúp bảo vệ thẻ nội dung bên trong luôn sạch, sẽ không bị nhàu nát, trầy xước. Bảng tên Enter BT061 với thiết kế đơn giản, dễ dàng sử dụng kết hợp cùng tone màu sắc hài hoà, đa dạng thích hợp với nhiều ngành nghề, mục đích và đối tượng sử dụng như học sinh, sinh viên, nhân viên văn phòng, hội nhóm và các tổ chức công ty. Ngoài ra, sản phẩm còn giúp bộ đồng phục của bạn thêm phần đẹp mắt, chỉnh chu, và chuyên nghiệp hơn. Giá sản phẩm trên Tiki đã bao gồm thuế theo luật hiện hành. Bên cạnh đó, tuỳ vào loại sản phẩm, hình thức và địa chỉ giao hàng mà có thể phát sinh thêm chi phí khác như phí vận chuyển, phụ phí hàng cồng kềnh, thuế nhập khẩu (đối với đơn hàng giao từ nước ngoài có giá trị trên 1 triệu đồng).....",0,0,"https://salt.tikicdn.com/ts/product/6a/12/25/fe8e886f14f7491fd8631181f326dfa2.jpg, https://salt.tikicdn.com/ts/product/4c/a6/6b/b4fda707e9b12592f38d0e3d61e71b27.jpg, https://salt.tikicdn.com/ts/product/86/e2/56/53c1b7dc54305775a2604878fc553eb4.png, https://salt.tikicdn.com/ts/product/04/06/88/5d05aac84094c3cfcad4adb570179d65.jpg, https://salt.tikicdn.com/ts/product/d1/15/4c/a435b4abaf65519cfe8d9396282eaff9.jpg","https://salt.tikicdn.com/cache/w1200/ts/product/6a/12/25/fe8e886f14f7491fd8631181f326dfa2.jpg, https://salt.tikicdn.com/cache/w1200/ts/product/4c/a6/6b/b4fda707e9b12592f38d0e3d61e71b27.jpg, https://salt.tikicdn.com/cache/w1200/ts/product/86/e2/56/53c1b7dc54305775a2604878fc553eb4.png, https://salt.tikicdn.com/cache/w1200/ts/product/04/06/88/5d05aac84094c3cfcad4adb570179d65.jpg, https://salt.tikicdn.com/cache/w1200/ts/product/d1/15/4c/a435b4abaf65519cfe8d9396282eaff9.jpg","https://salt.tikicdn.com/cache/w300/ts/product/6a/12/25/fe8e886f14f7491fd8631181f326dfa2.jpg, https://salt.tikicdn.com/cache/w300/ts/product/4c/a6/6b/b4fda707e9b12592f38d0e3d61e71b27.jpg, https://salt.tikicdn.com/cache/w300/ts/product/86/e2/56/53c1b7dc54305775a2604878fc553eb4.png, https://salt.tikicdn.com/cache/w300/ts/product/04/06/88/5d05aac84094c3cfcad4adb570179d65.jpg, https://salt.tikicdn.com/cache/w300/ts/product/d1/15/4c/a435b4abaf65519cfe8d9396282eaff9.jpg","https://salt.tikicdn.com/cache/200x280/ts/product/6a/12/25/fe8e886f14f7491fd8631181f326dfa2.jpg, https://salt.tikicdn.com/cache/200x280/ts/product/4c/a6/6b/b4fda707e9b12592f38d0e3d61e71b27.jpg, https://salt.tikicdn.com/cache/200x280/ts/product/86/e2/56/53c1b7dc54305775a2604878fc553eb4.png, https://salt.tikicdn.com/cache/200x280/ts/product/04/06/88/5d05aac84094c3cfcad4adb570179d65.jpg, https://salt.tikicdn.com/cache/200x280/ts/product/d1/15/4c/a435b4abaf65519cfe8d9396282eaff9.jpg","https://salt.tikicdn.com/cache/200x280/ts/product/6a/12/25/fe8e886f14f7491fd8631181f326dfa2.jpg, https://salt.tikicdn.com/cache/200x280/ts/product/4c/a6/6b/b4fda707e9b12592f38d0e3d61e71b27.jpg, https://salt.tikicdn.com/cache/200x280/ts/product/86/e2/56/53c1b7dc54305775a2604878fc553eb4.png, https://salt.tikicdn.com/cache/200x280/ts/product/04/06/88/5d05aac84094c3cfcad4adb570179d65.jpg, https://salt.tikicdn.com/cache/200x280/ts/product/d1/15/4c/a435b4abaf65519cfe8d9396282eaff9.jpg",1000,0
275431921,Bảng tên Enter BT060 54x86mm 1 mặt đứng,7500,Mô tả sản phẩmQuy cách:                    Kích thước lọt lòng 54 x 85mmĐơn vị tính:                 Cái/Hộp/Thùng Đóng gói:                    1/10/200Xuất xứ:                       Việt Nam Chấ...,"Mô tả sản phẩm Quy cách: Kích thước lọt lòng 54 x 85mm Đơn vị tính: Cái/Hộp/Thùng Đóng gói: 1/10/200 Xuất xứ: Việt Nam Chất liệu: Bảng tên Enter BT060 được làm từ nhựa có màu sắc tươi sáng, bắt mắt. Khung viền thẻ được bo tròn bề mặt trơn nhẵn, cứng cáp, bền đẹp. Công dụng: Dùng để đựng thẻ sinh viên, thẻ nhân viên...giúp bảo vệ thẻ nội dung bên trong luôn sạch, sẽ không bị nhàu nát, trầy xước. Bảng tên Enter BT060 với thiết kế đơn giản, dễ dàng sử dụng kết hợp cùng tone màu sắc hài hoà, đa dạng thích hợp với nhiều ngành nghề, mục đích và đối tượng sử dụng như học sinh, sinh viên, nhân viên văn phòng, hội nhóm và các tổ chức công ty. Ngoài ra, sản phẩm còn giúp bộ đồng phục của bạn thêm phần đẹp mắt, chỉnh chu, và chuyên nghiệp hơn. Giá sản phẩm trên Tiki đã bao gồm thuế theo luật hiện hành. Bên cạnh đó, tuỳ vào loại sản phẩm, hình thức và địa chỉ giao hàng mà có thể phát sinh thêm chi phí khác như phí vận chuyển, phụ phí hàng cồng kềnh, thuế nhập khẩu (đối với đơn hàng giao từ nước ngoài có giá trị trên 1 triệu đồng).....",0,0,"https://salt.tikicdn.com/ts/product/94/64/dd/d0cbe28202da4332bc49aed74cc4f4b5.jpg, https://salt.tikicdn.com/ts/product/b9/ea/05/b81759c32fc7c88fce0e1d9a4736da68.png, https://salt.tikicdn.com/ts/product/90/07/b4/3106ac2ea5eba902f55e17eb5c4eef10.jpg, https://salt.tikicdn.com/ts/product/0f/3f/bc/35e3325b785135e3147be594ce65ba1e.jpg, https://salt.tikicdn.com/ts/product/ff/52/58/45ccd78fb0f3a83cd0ef6976bd8aa4ce.jpg","https://salt.tikicdn.com/cache/w1200/ts/product/94/64/dd/d0cbe28202da4332bc49aed74cc4f4b5.jpg, https://salt.tikicdn.com/cache/w1200/ts/product/b9/ea/05/b81759c32fc7c88fce0e1d9a4736da68.png, https://salt.tikicdn.com/cache/w1200/ts/product/90/07/b4/3106ac2ea5eba902f55e17eb5c4eef10.jpg, https://salt.tikicdn.com/cache/w1200/ts/product/0f/3f/bc/35e3325b785135e3147be594ce65ba1e.jpg, https://salt.tikicdn.com/cache/w1200/ts/product/ff/52/58/45ccd78fb0f3a83cd0ef6976bd8aa4ce.jpg","https://salt.tikicdn.com/cache/w300/ts/product/94/64/dd/d0cbe28202da4332bc49aed74cc4f4b5.jpg, https://salt.tikicdn.com/cache/w300/ts/product/b9/ea/05/b81759c32fc7c88fce0e1d9a4736da68.png, https://salt.tikicdn.com/cache/w300/ts/product/90/07/b4/3106ac2ea5eba902f55e17eb5c4eef10.jpg, https://salt.tikicdn.com/cache/w300/ts/product/0f/3f/bc/35e3325b785135e3147be594ce65ba1e.jpg, https://salt.tikicdn.com/cache/w300/ts/product/ff/52/58/45ccd78fb0f3a83cd0ef6976bd8aa4ce.jpg","https://salt.tikicdn.com/cache/200x280/ts/product/94/64/dd/d0cbe28202da4332bc49aed74cc4f4b5.jpg, https://salt.tikicdn.com/cache/200x280/ts/product/b9/ea/05/b81759c32fc7c88fce0e1d9a4736da68.png, https://salt.tikicdn.com/cache/200x280/ts/product/90/07/b4/3106ac2ea5eba902f55e17eb5c4eef10.jpg, https://salt.tikicdn.com/cache/200x280/ts/product/0f/3f/bc/35e3325b785135e3147be594ce65ba1e.jpg, https://salt.tikicdn.com/cache/200x280/ts/product/ff/52/58/45ccd78fb0f3a83cd0ef6976bd8aa4ce.jpg","https://salt.tikicdn.com/cache/200x280/ts/product/94/64/dd/d0cbe28202da4332bc49aed74cc4f4b5.jpg, https://salt.tikicdn.com/cache/200x280/ts/product/b9/ea/05/b81759c32fc7c88fce0e1d9a4736da68.png, https://salt.tikicdn.com/cache/200x280/ts/product/90/07/b4/3106ac2ea5eba902f55e17eb5c4eef10.jpg, https://salt.tikicdn.com/cache/200x280/ts/product/0f/3f/bc/35e3325b785135e3147be594ce65ba1e.jpg, https://salt.tikicdn.com/cache/200x280/ts/product/ff/52/58/45ccd78fb0f3a83cd0ef6976bd8aa4ce.jpg",1000,0
271303370,Hộp 24 Kẹp Bướm Màu 41mm - Hồng Hà 6642,74700,    Hộp 24 Kẹp Bướm Màu 41mm - Hồng Hà 6642   Kẹp bướm được sản xuất trên dây chuyền hiện đại với chất liệu kim loại cao cấp đem lại sự bền đẹp cho sản phẩm. Kẹp bướm Hồng Hà là sản phẩm không thể...,"Hộp 24 Kẹp Bướm Màu 41mm - Hồng Hà 6642 Kẹp bướm được sản xuất trên dây chuyền hiện đại với chất liệu kim loại cao cấp đem lại sự bền đẹp cho sản phẩm. Kẹp bướm Hồng Hà là sản phẩm không thể thiếu trong mọi văn phòng, trường học giúp hỗ trợ công việc sắp xếp, lưu trữ các tài liệu rời khoa học hơn. Đặc điểm nổi bật: - Sản xuất từ chất liệu kim loại cao cấp, được phủ Niken chống gỉ giúp kẹp bướm luôn bền đẹp theo thời gian - Phần lò xo của kẹp linh hoạt, nhẹ, dễ dùng, không bị lỏng hay bung rời sau nhiều lần sử dụng - Tay cầm chắc chắn, vừa vặn tạo cảm giác thoải mái khi sử dụng - Đa dạng đủ mọi kích cỡ từ 15 - 51 mm phù hợp với mọi nhu cầu - Có 4 màu tươi sáng, hợp xu hướng giúp bàn làm việc nhiều màu sắc, khơi gợi cảm hứng và sáng tạo. - Tính ứng dụng cao, dễ sử dụng giúp việc phân loại, bảo quản tài liệu nhẹ nhàng và hiệu quả hơn. Giá sản phẩm trên Tiki đã bao gồm thuế theo luật hiện hành. Bên cạnh đó, tuỳ vào loại sản phẩm, hình thức và địa chỉ giao hàng mà có thể phát sinh thêm chi phí khác như phí vận chuyển, phụ phí hàng cồng kềnh, thuế nhập khẩu (đối với đơn hàng giao từ nước ngoài có giá trị trên 1 triệu đồng).....",0,0,"https://salt.tikicdn.com/ts/product/5e/c0/73/b2c76291719b672e0cb26e06c034ee4a.jpg, https://salt.tikicdn.com/ts/product/6e/f1/4d/98d01e3e50e84fc90fbfdcad1208b238.jpg, https://salt.tikicdn.com/ts/product/0b/cd/2a/a02cc5eef8e76d9797139b079dca1da8.jpg, https://salt.tikicdn.com/ts/product/7c/2b/c0/a797fe944db83badcf99c2deb73ec1a8.jpg, https://salt.tikicdn.com/ts/product/d9/df/01/1f700a1d90b71cbf4820476f79da9948.jpg","https://salt.tikicdn.com/cache/w1200/ts/product/5e/c0/73/b2c76291719b672e0cb26e06c034ee4a.jpg, https://salt.tikicdn.com/cache/w1200/ts/product/6e/f1/4d/98d01e3e50e84fc90fbfdcad1208b238.jpg, https://salt.tikicdn.com/cache/w1200/ts/product/0b/cd/2a/a02cc5eef8e76d9797139b079dca1da8.jpg, https://salt.tikicdn.com/cache/w1200/ts/product/7c/2b/c0/a797fe944db83badcf99c2deb73ec1a8.jpg, https://salt.tikicdn.com/cache/w1200/ts/product/d9/df/01/1f700a1d90b71cbf4820476f79da9948.jpg","https://salt.tikicdn.com/cache/w300/ts/product/5e/c0/73/b2c76291719b672e0cb26e06c034ee4a.jpg, https://salt.tikicdn.com/cache/w300/ts/product/6e/f1/4d/98d01e3e50e84fc90fbfdcad1208b238.jpg, https://salt.tikicdn.com/cache/w300/ts/product/0b/cd/2a/a02cc5eef8e76d9797139b079dca1da8.jpg, https://salt.tikicdn.com/cache/w300/ts/product/7c/2b/c0/a797fe944db83badcf99c2deb73ec1a8.jpg, https://salt.tikicdn.com/cache/w300/ts/product/d9/df/01/1f700a1d90b71cbf4820476f79da9948.jpg","https://salt.tikicdn.com/cache/200x280/ts/product/5e/c0/73/b2c76291719b672e0cb26e06c034ee4a.jpg, https://salt.tikicdn.com/cache/200x280/ts/product/6e/f1/4d/98d01e3e50e84fc90fbfdcad1208b238.jpg, https://salt.tikicdn.com/cache/200x280/ts/product/0b/cd/2a/a02cc5eef8e76d9797139b079dca1da8.jpg, https://salt.tikicdn.com/cache/200x280/ts/product/7c/2b/c0/a797fe944db83badcf99c2deb73ec1a8.jpg, https://salt.tikicdn.com/cache/200x280/ts/product/d9/df/01/1f700a1d90b71cbf4820476f79da9948.jpg","https://salt.tikicdn.com/cache/200x280/ts/product/5e/c0/73/b2c76291719b672e0cb26e06c034ee4a.jpg, https://salt.tikicdn.com/cache/200x280/ts/product/6e/f1/4d/98d01e3e50e84fc90fbfdcad1208b238.jpg, https://salt.tikicdn.com/cache/200x280/ts/product/0b/cd/2a/a02cc5eef8e76d9797139b079dca1da8.jpg, https://salt.tikicdn.com/cache/200x280/ts/product/7c/2b/c0/a797fe944db83badcf99c2deb73ec1a8.jpg, https://salt.tikicdn.com/cache/200x280/ts/product/d9/df/01/1f700a1d90b71cbf4820476f79da9948.jpg",1000,0
270542022,Hộp 12 Kẹp Giấy SDI 0222 (51mm),97200,"    Hộp 12 Kẹp Giấy SDI 0222 (51mm)   Kẹp Giấy SDI 0222 (51mm) là vật dụng cần thiết đối với học sinh, sinh viên và nhân viên văn phòng, kẹp hồ sơ và giấy tờ thành tập, giúp bạn dễ dàng phân loại,...","Hộp 12 Kẹp Giấy SDI 0222 (51mm) Kẹp Giấy SDI 0222 (51mm) là vật dụng cần thiết đối với học sinh, sinh viên và nhân viên văn phòng, kẹp hồ sơ và giấy tờ thành tập, giúp bạn dễ dàng phân loại, bảo quản và cất giữ. Kẹp giấy có thiết kế cứng cáp, lực kẹp lớn, không bị gãy hoặc bung rời khi sử dụng. Sản phẩm được làm từ nhựa và kim loại cứng cáp, không bị gỉ sét, độ bền cao. - Thiết kế: + Kẹp giấy có thiết kế cứng cáp, lực kẹp lớn, không bị gãy hoặc bung rời. + Lò xo linh hoạt, đàn hồi tốt, dễ sử dụng. + Vật dụng cần thiết đối với học sinh, sinh viên và nhân viên văn phòng, kẹp hồ sơ và giấy tờ thành tập, giúp bạn dễ dàng phân loại, bảo quản và cất giữ. - Quy cách: 12 cái/hộp. - Kích thước: 51mm. Giá sản phẩm trên Tiki đã bao gồm thuế theo luật hiện hành. Bên cạnh đó, tuỳ vào loại sản phẩm, hình thức và địa chỉ giao hàng mà có thể phát sinh thêm chi phí khác như phí vận chuyển, phụ phí hàng cồng kềnh, thuế nhập khẩu (đối với đơn hàng giao từ nước ngoài có giá trị trên 1 triệu đồng).....",0,0,"https://salt.tikicdn.com/ts/product/29/31/99/35b9b8bf026e46be131175de9dcac4d3.jpg, https://salt.tikicdn.com/ts/product/b1/16/7f/e184b113c21f4a601dcdf0cb7014607e.jpg, https://salt.tikicdn.com/ts/product/63/93/26/75df91da74690f9023f113f04d5ddce0.jpg, https://salt.tikicdn.com/ts/product/4b/05/b8/dbb0859b1f650db0e17a55dab423d3ca.jpg","https://salt.tikicdn.com/cache/w1200/ts/product/29/31/99/35b9b8bf026e46be131175de9dcac4d3.jpg, https://salt.tikicdn.com/cache/w1200/ts/product/b1/16/7f/e184b113c21f4a601dcdf0cb7014607e.jpg, https://salt.tikicdn.com/cache/w1200/ts/product/63/93/26/75df91da74690f9023f113f04d5ddce0.jpg, https://salt.tikicdn.com/cache/w1200/ts/product/4b/05/b8/dbb0859b1f650db0e17a55dab423d3ca.jpg","https://salt.tikicdn.com/cache/w300/ts/product/29/31/99/35b9b8bf026e46be131175de9dcac4d3.jpg, https://salt.tikicdn.com/cache/w300/ts/product/b1/16/7f/e184b113c21f4a601dcdf0cb7014607e.jpg, https://salt.tikicdn.com/cache/w300/ts/product/63/93/26/75df91da74690f9023f113f04d5ddce0.jpg, https://salt.tikicdn.com/cache/w300/ts/product/4b/05/b8/dbb0859b1f650db0e17a55dab423d3ca.jpg","https://salt.tikicdn.com/cache/200x280/ts/product/29/31/99/35b9b8bf026e46be131175de9dcac4d3.jpg, https://salt.tikicdn.com/cache/200x280/ts/product/b1/16/7f/e184b113c21f4a601dcdf0cb7014607e.jpg, https://salt.tikicdn.com/cache/200x280/ts/product/63/93/26/75df91da74690f9023f113f04d5ddce0.jpg, https://salt.tikicdn.com/cache/200x280/ts/product/4b/05/b8/dbb0859b1f650db0e17a55dab423d3ca.jpg","https://salt.tikicdn.com/cache/200x280/ts/product/29/31/99/35b9b8bf026e46be131175de9dcac4d3.jpg, https://salt.tikicdn.com/cache/200x280/ts/product/b1/16/7f/e184b113c21f4a601dcdf0cb7014607e.jpg, https://salt.tikicdn.com/cache/200x280/ts/product/63/93/26/75df91da74690f9023f113f04d5ddce0.jpg, https://salt.tikicdn.com/cache/200x280/ts/product/4b/05/b8/dbb0859b1f650db0e17a55dab423d3ca.jpg",1000,0
258861517,Thẻ đeo /I.D Holder - 30 Years Toile,369000,       - SKU: 1083866   - Kiểu dáng: Thẻ tên   - Thành phần chất liệu: 100% PVC Shiny Coated Cotton   - Kích thước: 11 x 7 cm    - Số ngăn: 2 ngăn lớn    - Màu sắc: Yellow   - Xuất xứ: China...,"- SKU: 1083866 - Kiểu dáng: Thẻ tên - Thành phần chất liệu: 100% PVC Shiny Coated Cotton - Kích thước: 11 x 7 cm - Số ngăn: 2 ngăn lớn - Màu sắc: Yellow - Xuất xứ: China Giá sản phẩm trên Tiki đã bao gồm thuế theo luật hiện hành. Bên cạnh đó, tuỳ vào loại sản phẩm, hình thức và địa chỉ giao hàng mà có thể phát sinh thêm chi phí khác như phí vận chuyển, phụ phí hàng cồng kềnh, thuế nhập khẩu (đối với đơn hàng giao từ nước ngoài có giá trị trên 1 triệu đồng).....",0,0,"https://salt.tikicdn.com/ts/product/e3/47/75/3238edfce0075c404ed8da8d047d41a4.jpg, https://salt.tikicdn.com/ts/product/17/02/73/39b811338631ed44d20006e4949a1bf1.jpg, https://salt.tikicdn.com/ts/product/b7/45/09/e8fe474be45648a50b6f05289a6d1579.jpg","https://salt.tikicdn.com/cache/w1200/ts/product/e3/47/75/3238edfce0075c404ed8da8d047d41a4.jpg, https://salt.tikicdn.com/cache/w1200/ts/product/17/02/73/39b811338631ed44d20006e4949a1bf1.jpg, https://salt.tikicdn.com/cache/w1200/ts/product/b7/45/09/e8fe474be45648a50b6f05289a6d1579.jpg","https://salt.tikicdn.com/cache/w300/ts/product/e3/47/75/3238edfce0075c404ed8da8d047d41a4.jpg, https://salt.tikicdn.com/cache/w300/ts/product/17/02/73/39b811338631ed44d20006e4949a1bf1.jpg, https://salt.tikicdn.com/cache/w300/ts/product/b7/45/09/e8fe474be45648a50b6f05289a6d1579.jpg","https://salt.tikicdn.com/cache/200x280/ts/product/e3/47/75/3238edfce0075c404ed8da8d047d41a4.jpg, https://salt.tikicdn.com/cache/200x280/ts/product/17/02/73/39b811338631ed44d20006e4949a1bf1.jpg, https://salt.tikicdn.com/cache/200x280/ts/product/b7/45/09/e8fe474be45648a50b6f05289a6d1579.jpg","https://salt.tikicdn.com/cache/200x280/ts/product/e3/47/75/3238edfce0075c404ed8da8d047d41a4.jpg, https://salt.tikicdn.com/cache/200x280/ts/product/17/02/73/39b811338631ed44d20006e4949a1bf1.jpg, https://salt.tikicdn.com/cache/200x280/ts/product/b7/45/09/e8fe474be45648a50b6f05289a6d1579.jpg",1000,0
258857908,Dây đeo/Lanyard - 30 Years Toile,249000,       - SKU: 1083897   - Kiểu dáng: Dây đeo thẻ   - Thành phần chất liệu:100% Polyester   - Kích thước: 44 x 1.5 cm    - Màu sắc: Yellow   - Xuất xứ: China   ...,"- SKU: 1083897 - Kiểu dáng: Dây đeo thẻ - Thành phần chất liệu:100% Polyester - Kích thước: 44 x 1.5 cm - Màu sắc: Yellow - Xuất xứ: China Giá sản phẩm trên Tiki đã bao gồm thuế theo luật hiện hành. Bên cạnh đó, tuỳ vào loại sản phẩm, hình thức và địa chỉ giao hàng mà có thể phát sinh thêm chi phí khác như phí vận chuyển, phụ phí hàng cồng kềnh, thuế nhập khẩu (đối với đơn hàng giao từ nước ngoài có giá trị trên 1 triệu đồng).....",0,0,"https://salt.tikicdn.com/ts/product/ed/9f/eb/4e56dc8e261dd884b86dcd4f86a5b75a.jpg, https://salt.tikicdn.com/ts/product/0b/69/d6/e4ef19aedcc089ecb0c1e53da534f6f4.jpg, https://salt.tikicdn.com/ts/product/b7/45/09/4ce37ccdf4eec3273b4112cf4b011033.jpg","https://salt.tikicdn.com/cache/w1200/ts/product/ed/9f/eb/4e56dc8e261dd884b86dcd4f86a5b75a.jpg, https://salt.tikicdn.com/cache/w1200/ts/product/0b/69/d6/e4ef19aedcc089ecb0c1e53da534f6f4.jpg, https://salt.tikicdn.com/cache/w1200/ts/product/b7/45/09/4ce37ccdf4eec3273b4112cf4b011033.jpg","https://salt.tikicdn.com/cache/w300/ts/product/ed/9f/eb/4e56dc8e261dd884b86dcd4f86a5b75a.jpg, https://salt.tikicdn.com/cache/w300/ts/product/0b/69/d6/e4ef19aedcc089ecb0c1e53da534f6f4.jpg, https://salt.tikicdn.com/cache/w300/ts/product/b7/45/09/4ce37ccdf4eec3273b4112cf4b011033.jpg","https://salt.tikicdn.com/cache/200x280/ts/product/ed/9f/eb/4e56dc8e261dd884b86dcd4f86a5b75a.jpg, https://salt.tikicdn.com/cache/200x280/ts/product/0b/69/d6/e4ef19aedcc089ecb0c1e53da534f6f4.jpg, https://salt.tikicdn.com/cache/200x280/ts/product/b7/45/09/4ce37ccdf4eec3273b4112cf4b011033.jpg","https://salt.tikicdn.com/cache/200x280/ts/product/ed/9f/eb/4e56dc8e261dd884b86dcd4f86a5b75a.jpg, https://salt.tikicdn.com/cache/200x280/ts/product/0b/69/d6/e4ef19aedcc089ecb0c1e53da534f6f4.jpg, https://salt.tikicdn.com/cache/200x280/ts/product/b7/45/09/4ce37ccdf4eec3273b4112cf4b011033.jpg",1000,0
258857843,Dây đeo/Spring Bunnies and Lambs Lanyard,249000,       - SKU: 1089400   - Kiểu dáng: Dây đeo thẻ   - Thành phần chất liệu:100% Polyester   - Kích thước: 44 x 1.5 cm    - Màu sắc: Blue   - Xuất xứ: China   ...,"- SKU: 1089400 - Kiểu dáng: Dây đeo thẻ - Thành phần chất liệu:100% Polyester - Kích thước: 44 x 1.5 cm - Màu sắc: Blue - Xuất xứ: China Giá sản phẩm trên Tiki đã bao gồm thuế theo luật hiện hành. Bên cạnh đó, tuỳ vào loại sản phẩm, hình thức và địa chỉ giao hàng mà có thể phát sinh thêm chi phí khác như phí vận chuyển, phụ phí hàng cồng kềnh, thuế nhập khẩu (đối với đơn hàng giao từ nước ngoài có giá trị trên 1 triệu đồng).....",0,0,"https://salt.tikicdn.com/ts/product/23/0e/82/fe851446fdd6901fdc685f97d7bcab35.jpg, https://salt.tikicdn.com/ts/product/b7/45/09/6829585f1d7661f352a396fa358b3898.jpg, https://salt.tikicdn.com/ts/product/0b/69/d6/7754cd4694771ba9632604b81486d0c8.jpg","https://salt.tikicdn.com/cache/w1200/ts/product/23/0e/82/fe851446fdd6901fdc685f97d7bcab35.jpg, https://salt.tikicdn.com/cache/w1200/ts/product/b7/45/09/6829585f1d7661f352a396fa358b3898.jpg, https://salt.tikicdn.com/cache/w1200/ts/product/0b/69/d6/7754cd4694771ba9632604b81486d0c8.jpg","https://salt.tikicdn.com/cache/w300/ts/product/23/0e/82/fe851446fdd6901fdc685f97d7bcab35.jpg, https://salt.tikicdn.com/cache/w300/ts/product/b7/45/09/6829585f1d7661f352a396fa358b3898.jpg, https://salt.tikicdn.com/cache/w300/ts/product/0b/69/d6/7754cd4694771ba9632604b81486d0c8.jpg","https://salt.tikicdn.com/cache/200x280/ts/product/23/0e/82/fe851446fdd6901fdc685f97d7bcab35.jpg, https://salt.tikicdn.com/cache/200x280/ts/product/b7/45/09/6829585f1d7661f352a396fa358b3898.jpg, https://salt.tikicdn.com/cache/200x280/ts/product/0b/69/d6/7754cd4694771ba9632604b81486d0c8.jpg","https://salt.tikicdn.com/cache/200x280/ts/product/23/0e/82/fe851446fdd6901fdc685f97d7bcab35.jpg, https://salt.tikicdn.com/cache/200x280/ts/product/b7/45/09/6829585f1d7661f352a396fa358b3898.jpg, https://salt.tikicdn.com/cache/200x280/ts/product/0b/69/d6/7754cd4694771ba9632604b81486d0c8.jpg",1000,0
