id,name,price,short_description,description,rating_average,review_count,image_base_url,image_large_url,image_medium_url,image_small_url,image_thumbnail_url,stock,quantity_sold
276291459,Kẹp Giấy Trong Suốt Nhựa Acrylic Cố Định Tài Liệu Tờ A4 Để Bàn Văn Phòng Cánh Bướm Tiện Lợi,5000,"️ Kẹp Giấy Trong Suốt Nhựa Acrylic Cố Định Tài Liệu Tờ A4 Để Bàn Văn Phòng Tiện Lợi - Kẹp tài liệu trong suốt nhiều kích cỡ, với thiếu kế nhỏ gọn giúp bạn kẹp chắc chắn những tài liệu, sắp xếp gọn gàn...","️ Kẹp Giấy Trong Suốt Nhựa Acrylic Cố Định Tài Liệu Tờ A4 Để Bàn Văn Phòng Tiện Lợi - Kẹp tài liệu trong suốt nhiều kích cỡ, với thiếu kế nhỏ gọn giúp bạn kẹp chắc chắn những tài liệu, sắp xếp gọn gàng dễ tìm kiếm. Sản phẩm phù hợp để kẹp giấy tờ, chứng từ hoặc sử dụng để treo tranh ảnh decor phòng hoặc bàn làm việc. MÔ TẢ SẢN PHẨM: - Chất liệu: Nhựa acrylic - Màu sắc: Trong suốt - Kích thước: 3.8 cm • 5 cm - Đóng gói: 1 kẹp nhựa trong suốt #kepgiayto #keptailieu #kepgiaya4 #keptrongsuot #kepnhua #hamart #vanphongpham Giá sản phẩm trên Tiki đã bao gồm thuế theo luật hiện hành. Bên cạnh đó, tuỳ vào loại sản phẩm, hình thức và địa chỉ giao hàng mà có thể phát sinh thêm chi phí khác như phí vận chuyển, phụ phí hàng cồng kềnh, thuế nhập khẩu (đối với đơn hàng giao từ nước ngoài có giá trị trên 1 triệu đồng).....",0,0,"https://salt.tikicdn.com/ts/product/c2/d6/2d/c993a282f00845d5432652080f415710.jpg, https://salt.tikicdn.com/ts/product/08/dd/c4/f9645c3df7f6cc896ec1cbde202ceba1.jpg, https://salt.tikicdn.com/ts/product/16/73/37/c1006dbbea190a198d4e64d429fcdff1.jpg, https://salt.tikicdn.com/ts/product/2f/70/fb/6caf19c94be467318967e39ce98b7163.jpg, https://salt.tikicdn.com/ts/product/58/b8/cb/2fa6dc483dd8fc23d71c37501c06c7de.jpg, https://salt.tikicdn.com/ts/product/6f/38/ca/91cb9cae0db7dbc2335c5428683eb2f3.jpg, https://salt.tikicdn.com/ts/product/35/92/58/89d170e5c671fcd5bb20df5cbe891b8a.jpg, https://salt.tikicdn.com/ts/product/71/24/a9/b02c32afe2683a8c679f27133c514c62.jpg, https://salt.tikicdn.com/ts/product/3e/cb/7a/28f1dc1448f6aea0c481f3a4a3093d7e.jpg, https://salt.tikicdn.com/ts/product/b6/80/2e/132ee096a6d364b9ca4e41bbce7ba7c9.jpg, https://salt.tikicdn.com/ts/product/6b/40/8d/31bdda17034f489e28e428beba33801c.jpg, https://salt.tikicdn.com/ts/product/f0/1f/d8/8b8d697c3a147b98edebf8a99bbd3974.jpg, https://salt.tikicdn.com/ts/product/13/cd/4f/2f1e3e66728a3fc28bc26a70bd917506.jpg","https://salt.tikicdn.com/cache/w1200/ts/product/c2/d6/2d/c993a282f00845d5432652080f415710.jpg, https://salt.tikicdn.com/cache/w1200/ts/product/08/dd/c4/f9645c3df7f6cc896ec1cbde202ceba1.jpg, https://salt.tikicdn.com/cache/w1200/ts/product/16/73/37/c1006dbbea190a198d4e64d429fcdff1.jpg, https://salt.tikicdn.com/cache/w1200/ts/product/2f/70/fb/6caf19c94be467318967e39ce98b7163.jpg, https://salt.tikicdn.com/cache/w1200/ts/product/58/b8/cb/2fa6dc483dd8fc23d71c37501c06c7de.jpg, https://salt.tikicdn.com/cache/w1200/ts/product/6f/38/ca/91cb9cae0db7dbc2335c5428683eb2f3.jpg, https://salt.tikicdn.com/cache/w1200/ts/product/35/92/58/89d170e5c671fcd5bb20df5cbe891b8a.jpg, https://salt.tikicdn.com/cache/w1200/ts/product/71/24/a9/b02c32afe2683a8c679f27133c514c62.jpg, https://salt.tikicdn.com/cache/w1200/ts/product/3e/cb/7a/28f1dc1448f6aea0c481f3a4a3093d7e.jpg, https://salt.tikicdn.com/cache/w1200/ts/product/b6/80/2e/132ee096a6d364b9ca4e41bbce7ba7c9.jpg, https://salt.tikicdn.com/cache/w1200/ts/product/6b/40/8d/31bdda17034f489e28e428beba33801c.jpg, https://salt.tikicdn.com/cache/w1200/ts/product/f0/1f/d8/8b8d697c3a147b98edebf8a99bbd3974.jpg, https://salt.tikicdn.com/cache/w1200/ts/product/13/cd/4f/2f1e3e66728a3fc28bc26a70bd917506.jpg","https://salt.tikicdn.com/cache/w300/ts/product/c2/d6/2d/c993a282f00845d5432652080f415710.jpg, https://salt.tikicdn.com/cache/w300/ts/product/08/dd/c4/f9645c3df7f6cc896ec1cbde202ceba1.jpg, https://salt.tikicdn.com/cache/w300/ts/product/16/73/37/c1006dbbea190a198d4e64d429fcdff1.jpg, https://salt.tikicdn.com/cache/w300/ts/product/2f/70/fb/6caf19c94be467318967e39ce98b7163.jpg, https://salt.tikicdn.com/cache/w300/ts/product/58/b8/cb/2fa6dc483dd8fc23d71c37501c06c7de.jpg, https://salt.tikicdn.com/cache/w300/ts/product/6f/38/ca/91cb9cae0db7dbc2335c5428683eb2f3.jpg, https://salt.tikicdn.com/cache/w300/ts/product/35/92/58/89d170e5c671fcd5bb20df5cbe891b8a.jpg, https://salt.tikicdn.com/cache/w300/ts/product/71/24/a9/b02c32afe2683a8c679f27133c514c62.jpg, https://salt.tikicdn.com/cache/w300/ts/product/3e/cb/7a/28f1dc1448f6aea0c481f3a4a3093d7e.jpg, https://salt.tikicdn.com/cache/w300/ts/product/b6/80/2e/132ee096a6d364b9ca4e41bbce7ba7c9.jpg, https://salt.tikicdn.com/cache/w300/ts/product/6b/40/8d/31bdda17034f489e28e428beba33801c.jpg, https://salt.tikicdn.com/cache/w300/ts/product/f0/1f/d8/8b8d697c3a147b98edebf8a99bbd3974.jpg, https://salt.tikicdn.com/cache/w300/ts/product/13/cd/4f/2f1e3e66728a3fc28bc26a70bd917506.jpg","https://salt.tikicdn.com/cache/200x280/ts/product/c2/d6/2d/c993a282f00845d5432652080f415710.jpg, https://salt.tikicdn.com/cache/200x280/ts/product/08/dd/c4/f9645c3df7f6cc896ec1cbde202ceba1.jpg, https://salt.tikicdn.com/cache/200x280/ts/product/16/73/37/c1006dbbea190a198d4e64d429fcdff1.jpg, https://salt.tikicdn.com/cache/200x280/ts/product/2f/70/fb/6caf19c94be467318967e39ce98b7163.jpg, https://salt.tikicdn.com/cache/200x280/ts/product/58/b8/cb/2fa6dc483dd8fc23d71c37501c06c7de.jpg, https://salt.tikicdn.com/cache/200x280/ts/product/6f/38/ca/91cb9cae0db7dbc2335c5428683eb2f3.jpg, https://salt.tikicdn.com/cache/200x280/ts/product/35/92/58/89d170e5c671fcd5bb20df5cbe891b8a.jpg, https://salt.tikicdn.com/cache/200x280/ts/product/71/24/a9/b02c32afe2683a8c679f27133c514c62.jpg, https://salt.tikicdn.com/cache/200x280/ts/product/3e/cb/7a/28f1dc1448f6aea0c481f3a4a3093d7e.jpg, https://salt.tikicdn.com/cache/200x280/ts/product/b6/80/2e/132ee096a6d364b9ca4e41bbce7ba7c9.jpg, https://salt.tikicdn.com/cache/200x280/ts/product/6b/40/8d/31bdda17034f489e28e428beba33801c.jpg, https://salt.tikicdn.com/cache/200x280/ts/product/f0/1f/d8/8b8d697c3a147b98edebf8a99bbd3974.jpg, https://salt.tikicdn.com/cache/200x280/ts/product/13/cd/4f/2f1e3e66728a3fc28bc26a70bd917506.jpg","https://salt.tikicdn.com/cache/200x280/ts/product/c2/d6/2d/c993a282f00845d5432652080f415710.jpg, https://salt.tikicdn.com/cache/200x280/ts/product/08/dd/c4/f9645c3df7f6cc896ec1cbde202ceba1.jpg, https://salt.tikicdn.com/cache/200x280/ts/product/16/73/37/c1006dbbea190a198d4e64d429fcdff1.jpg, https://salt.tikicdn.com/cache/200x280/ts/product/2f/70/fb/6caf19c94be467318967e39ce98b7163.jpg, https://salt.tikicdn.com/cache/200x280/ts/product/58/b8/cb/2fa6dc483dd8fc23d71c37501c06c7de.jpg, https://salt.tikicdn.com/cache/200x280/ts/product/6f/38/ca/91cb9cae0db7dbc2335c5428683eb2f3.jpg, https://salt.tikicdn.com/cache/200x280/ts/product/35/92/58/89d170e5c671fcd5bb20df5cbe891b8a.jpg, https://salt.tikicdn.com/cache/200x280/ts/product/71/24/a9/b02c32afe2683a8c679f27133c514c62.jpg, https://salt.tikicdn.com/cache/200x280/ts/product/3e/cb/7a/28f1dc1448f6aea0c481f3a4a3093d7e.jpg, https://salt.tikicdn.com/cache/200x280/ts/product/b6/80/2e/132ee096a6d364b9ca4e41bbce7ba7c9.jpg, https://salt.tikicdn.com/cache/200x280/ts/product/6b/40/8d/31bdda17034f489e28e428beba33801c.jpg, https://salt.tikicdn.com/cache/200x280/ts/product/f0/1f/d8/8b8d697c3a147b98edebf8a99bbd3974.jpg, https://salt.tikicdn.com/cache/200x280/ts/product/13/cd/4f/2f1e3e66728a3fc28bc26a70bd917506.jpg",1000,0
272962574,Hộp 12 Kẹp Bướm Deli Kẹp Tài Liêu Giấy Tờ Văn Phòng Phẩm Học Sinh Văn Phòng Nhiều Kích Thước Nhỏ Gọn Tiện Lợi Giá Rẻ,6000,"TÍNH NĂNG SẢN PHẨM: ✔️ Chất liệu hợp thép lò xo, bền và không gỉ✔️ Kẹp bướm kim loại✔️ Bề mặt sử dụng công nghệ mạ sơn, khó bị han gỉ✔️ Có thể sử dụng trong nhiều môi trường✔️ Thiết kế cong 2 mé...","TÍNH NĂNG SẢN PHẨM: ✔️ Chất liệu hợp thép lò xo, bền và không gỉ ✔️ Kẹp bướm kim loại ✔️ Bề mặt sử dụng công nghệ mạ sơn, khó bị han gỉ ✔️ Có thể sử dụng trong nhiều môi trường ✔️ Thiết kế cong 2 mép, không làm rách giấy THÔNG TIN SẢN PHẨM: 👉 Tên sản phẩm: Kẹp bướm Deli 👉 Màu sắc: Đen Mã SP: E38566 - 15mm Mã SP: E38565 - 19mm Mã SP: E38564 - 25mm Mã SP: E38563 - 32mm Mã SP: E38562 - 41mm Mã SP: E38561 - 51mm 👉 Quy cách: 12 chiếc/hộp 👉 Xuất xứ: Trung Quốc -------------------------------------------------------------------------------------------------------- Tự hào là một trong những nhãn hàng văn phòng phẩm lớn nhất tại Việt Nam, @Delivietnam không ngừng nỗ lực và phát triển trong lĩnh vực phân phối các sản phẩm cho các đơn vị văn phòng, trường học,... Với phương châm sản xuất những sản phẩm chất lượng tốt nhất và luôn đặt khách hàng làm trọng tâm, sứ mệnh của Deli là làm hài hòng người tiêu dùng toàn cầu với những sản phẩm chất lượng cao, độ tin cậy tuyệt đối và thân thiện với người dùng. Khách hàng lựa chọn các sản phẩm của @Delivietnam sẽ được cam kết: 🔻 Sản phẩm chính hãng từ nhà máy Deli, nguồn gốc rõ ràng và chất lượng đạt tiêu chuẩn. 🔻 Bảo hành theo quy định của nhà sản xuất. 🔻 Giá cả hợp lý, cạnh tranh, rẻ nhất thị trường. 🔻 Hỗ trợ đổi trả hàng cho những sản phẩm bị thiếu. Giá sản phẩm trên Tiki đã bao gồm thuế theo luật hiện hành. Bên cạnh đó, tuỳ vào loại sản phẩm, hình thức và địa chỉ giao hàng mà có thể phát sinh thêm chi phí khác như phí vận chuyển, phụ phí hàng cồng kềnh, thuế nhập khẩu (đối với đơn hàng giao từ nước ngoài có giá trị trên 1 triệu đồng).....",5,3,"https://salt.tikicdn.com/ts/product/b6/e0/85/89e09a204d8bed20bdd84dc97e7b2c0b.jpg, https://salt.tikicdn.com/ts/product/3d/e3/db/975cc81deaf3a089ea1de4b46390fc85.jpg, https://salt.tikicdn.com/ts/product/a0/28/78/cdc7c81c0e2a64b1c4c259abf773ca8c.jpg, https://salt.tikicdn.com/ts/product/1d/ea/30/f00f69afe4cb04e280e6076d06baa035.jpg, https://salt.tikicdn.com/ts/product/78/28/aa/d1ba0012101945e1099a88c5c401c9ac.jpg, https://salt.tikicdn.com/ts/product/4b/2c/48/fa100ce395978ef2803ad3b13d275145.jpg","https://salt.tikicdn.com/cache/w1200/ts/product/b6/e0/85/89e09a204d8bed20bdd84dc97e7b2c0b.jpg, https://salt.tikicdn.com/cache/w1200/ts/product/3d/e3/db/975cc81deaf3a089ea1de4b46390fc85.jpg, https://salt.tikicdn.com/cache/w1200/ts/product/a0/28/78/cdc7c81c0e2a64b1c4c259abf773ca8c.jpg, https://salt.tikicdn.com/cache/w1200/ts/product/1d/ea/30/f00f69afe4cb04e280e6076d06baa035.jpg, https://salt.tikicdn.com/cache/w1200/ts/product/78/28/aa/d1ba0012101945e1099a88c5c401c9ac.jpg, https://salt.tikicdn.com/cache/w1200/ts/product/4b/2c/48/fa100ce395978ef2803ad3b13d275145.jpg","https://salt.tikicdn.com/cache/w300/ts/product/b6/e0/85/89e09a204d8bed20bdd84dc97e7b2c0b.jpg, https://salt.tikicdn.com/cache/w300/ts/product/3d/e3/db/975cc81deaf3a089ea1de4b46390fc85.jpg, https://salt.tikicdn.com/cache/w300/ts/product/a0/28/78/cdc7c81c0e2a64b1c4c259abf773ca8c.jpg, https://salt.tikicdn.com/cache/w300/ts/product/1d/ea/30/f00f69afe4cb04e280e6076d06baa035.jpg, https://salt.tikicdn.com/cache/w300/ts/product/78/28/aa/d1ba0012101945e1099a88c5c401c9ac.jpg, https://salt.tikicdn.com/cache/w300/ts/product/4b/2c/48/fa100ce395978ef2803ad3b13d275145.jpg","https://salt.tikicdn.com/cache/200x280/ts/product/b6/e0/85/89e09a204d8bed20bdd84dc97e7b2c0b.jpg, https://salt.tikicdn.com/cache/200x280/ts/product/3d/e3/db/975cc81deaf3a089ea1de4b46390fc85.jpg, https://salt.tikicdn.com/cache/200x280/ts/product/a0/28/78/cdc7c81c0e2a64b1c4c259abf773ca8c.jpg, https://salt.tikicdn.com/cache/200x280/ts/product/1d/ea/30/f00f69afe4cb04e280e6076d06baa035.jpg, https://salt.tikicdn.com/cache/200x280/ts/product/78/28/aa/d1ba0012101945e1099a88c5c401c9ac.jpg, https://salt.tikicdn.com/cache/200x280/ts/product/4b/2c/48/fa100ce395978ef2803ad3b13d275145.jpg","https://salt.tikicdn.com/cache/200x280/ts/product/b6/e0/85/89e09a204d8bed20bdd84dc97e7b2c0b.jpg, https://salt.tikicdn.com/cache/200x280/ts/product/3d/e3/db/975cc81deaf3a089ea1de4b46390fc85.jpg, https://salt.tikicdn.com/cache/200x280/ts/product/a0/28/78/cdc7c81c0e2a64b1c4c259abf773ca8c.jpg, https://salt.tikicdn.com/cache/200x280/ts/product/1d/ea/30/f00f69afe4cb04e280e6076d06baa035.jpg, https://salt.tikicdn.com/cache/200x280/ts/product/78/28/aa/d1ba0012101945e1099a88c5c401c9ac.jpg, https://salt.tikicdn.com/cache/200x280/ts/product/4b/2c/48/fa100ce395978ef2803ad3b13d275145.jpg",1000,3
270111606,Hộp 12 Kẹp Bướm 51mm - Hồng Hà 6637,37800,"    Hộp 12 Kẹp Bướm Đen 51mm - Hồng Hà 6637   Kẹp bướm được sản xuất trên dây chuyền hiện đại với chất liệu kim loại cao cấp đem lại sự bền, đẹp cho sản phẩm. Kẹp bướm Hồng Hà là sản phẩm không th...","Hộp 12 Kẹp Bướm Đen 51mm - Hồng Hà 6637 Kẹp bướm được sản xuất trên dây chuyền hiện đại với chất liệu kim loại cao cấp đem lại sự bền, đẹp cho sản phẩm. Kẹp bướm Hồng Hà là sản phẩm không thể thiếu trong mọi văn phòng, trường học giúp hỗ trợ công việc sắp xếp, lưu trữ các tài liệu rời khoa học hơn. Đặc điểm nổi bật: - Sản xuất từ chất liệu kim loại cao cấp, được phủ Niken chống gỉ giúp kẹp bướm luôn bền đẹp theo thời gian - Phần lò xo của kẹp linh hoạt, nhẹ, dễ dùng, không bị lỏng hay bung rời sau nhiều lần sử dụng - Tay cầm chắc chắn, vừa vặn tạo cảm giác thoải mái khi sử dụng - Đa dạng đủ mọi kích cỡ từ 15 - 51 mm phù hợp với mọi nhu cầu - Tính ứng dụng cao, dễ sử dụng giúp việc phân loại, bảo quản tài liệu nhẹ nhàng và hiệu quả hơn 2. Giá sản phẩm trên Tiki đã bao gồm thuế theo luật hiện hành. Bên cạnh đó, tuỳ vào loại sản phẩm, hình thức và địa chỉ giao hàng mà có thể phát sinh thêm chi phí khác như phí vận chuyển, phụ phí hàng cồng kềnh, thuế nhập khẩu (đối với đơn hàng giao từ nước ngoài có giá trị trên 1 triệu đồng).....",0,0,"https://salt.tikicdn.com/ts/product/da/f2/c6/7a2f2556588d3b3aa7d0546e8ae4dc26.jpg, https://salt.tikicdn.com/ts/product/9d/7b/8e/9984a44672e98608dbcf9799060c770d.jpg, https://salt.tikicdn.com/ts/product/e4/9d/b6/02bbeb4101d70946b14a7f1afaf06a4d.jpg, https://salt.tikicdn.com/ts/product/95/1f/70/8dd223bd61407d368f2b704bc75a2930.jpg, https://salt.tikicdn.com/ts/product/32/13/ef/b7b4b0084b193d23ee31b4c882df03e7.jpg","https://salt.tikicdn.com/cache/w1200/ts/product/da/f2/c6/7a2f2556588d3b3aa7d0546e8ae4dc26.jpg, https://salt.tikicdn.com/cache/w1200/ts/product/9d/7b/8e/9984a44672e98608dbcf9799060c770d.jpg, https://salt.tikicdn.com/cache/w1200/ts/product/e4/9d/b6/02bbeb4101d70946b14a7f1afaf06a4d.jpg, https://salt.tikicdn.com/cache/w1200/ts/product/95/1f/70/8dd223bd61407d368f2b704bc75a2930.jpg, https://salt.tikicdn.com/cache/w1200/ts/product/32/13/ef/b7b4b0084b193d23ee31b4c882df03e7.jpg","https://salt.tikicdn.com/cache/w300/ts/product/da/f2/c6/7a2f2556588d3b3aa7d0546e8ae4dc26.jpg, https://salt.tikicdn.com/cache/w300/ts/product/9d/7b/8e/9984a44672e98608dbcf9799060c770d.jpg, https://salt.tikicdn.com/cache/w300/ts/product/e4/9d/b6/02bbeb4101d70946b14a7f1afaf06a4d.jpg, https://salt.tikicdn.com/cache/w300/ts/product/95/1f/70/8dd223bd61407d368f2b704bc75a2930.jpg, https://salt.tikicdn.com/cache/w300/ts/product/32/13/ef/b7b4b0084b193d23ee31b4c882df03e7.jpg","https://salt.tikicdn.com/cache/200x280/ts/product/da/f2/c6/7a2f2556588d3b3aa7d0546e8ae4dc26.jpg, https://salt.tikicdn.com/cache/200x280/ts/product/9d/7b/8e/9984a44672e98608dbcf9799060c770d.jpg, https://salt.tikicdn.com/cache/200x280/ts/product/e4/9d/b6/02bbeb4101d70946b14a7f1afaf06a4d.jpg, https://salt.tikicdn.com/cache/200x280/ts/product/95/1f/70/8dd223bd61407d368f2b704bc75a2930.jpg, https://salt.tikicdn.com/cache/200x280/ts/product/32/13/ef/b7b4b0084b193d23ee31b4c882df03e7.jpg","https://salt.tikicdn.com/cache/200x280/ts/product/da/f2/c6/7a2f2556588d3b3aa7d0546e8ae4dc26.jpg, https://salt.tikicdn.com/cache/200x280/ts/product/9d/7b/8e/9984a44672e98608dbcf9799060c770d.jpg, https://salt.tikicdn.com/cache/200x280/ts/product/e4/9d/b6/02bbeb4101d70946b14a7f1afaf06a4d.jpg, https://salt.tikicdn.com/cache/200x280/ts/product/95/1f/70/8dd223bd61407d368f2b704bc75a2930.jpg, https://salt.tikicdn.com/cache/200x280/ts/product/32/13/ef/b7b4b0084b193d23ee31b4c882df03e7.jpg",1000,0
262674571,Hộp 12 Kẹp Giấy Flexoffice 31mm FO-PAC02,6700,"    Hộp 12 Kẹp Giấy Flexoffice 31mm FO-PAC02   Là vật dụng không thể thiếu trong mọi văn phòng để hỗ trợ công việc sắp xếp giấy tờ, tài liệu rời.   Kẹp thiết kế dễ sử dụng, bền bỉ và không gỉ sét...","Hộp 12 Kẹp Giấy Flexoffice 31mm FO-PAC02 Là vật dụng không thể thiếu trong mọi văn phòng để hỗ trợ công việc sắp xếp giấy tờ, tài liệu rời. Kẹp thiết kế dễ sử dụng, bền bỉ và không gỉ sét mang đến hiệu quả lâu dài và an tâm cho người dùng. Kẹp giấy được làm bằng chất liệu kim loại cao cấp, bền chắc, phủ lớp Niken chống gỉ, bên ngoài bọc lớp nhựa dẻo màu đẹp mắt nhằm nâng cao tuổi thọ sản phẩm. Loại kẹp hình tam giác nhỏ gọn, không hại da tay và thân thiện với người dùng. Có thể kẹp chặt lượng tài liệu ít, mỏng tối đa 10 tờ A4 để không bị bung rời. Sản phẩm thiết kế đơn giản, dễ sử dụng mà không bị đau tay. Kẹp giấy đầu tròn hiệu quả trong việc bảo quản, phân loại và tránh thất lạc các liên giấy, tài liệu rời trong công việc, học tập. Nhờ đó mà công tác văn phòng sẽ trở nên đơn giản và nhẹ nhàng hơn. Giá sản phẩm trên Tiki đã bao gồm thuế theo luật hiện hành. Bên cạnh đó, tuỳ vào loại sản phẩm, hình thức và địa chỉ giao hàng mà có thể phát sinh thêm chi phí khác như phí vận chuyển, phụ phí hàng cồng kềnh, thuế nhập khẩu (đối với đơn hàng giao từ nước ngoài có giá trị trên 1 triệu đồng).....",0,0,"https://salt.tikicdn.com/ts/product/eb/9d/bb/baa8b0eb8f53d11a7a4c09742cef6fa0.jpg, https://salt.tikicdn.com/ts/product/d7/75/a7/335d17725f72015caae983ce5a4f0b21.jpg, https://salt.tikicdn.com/ts/product/0b/ed/ed/d103f11694f26e2e6dec99643ef8f54b.jpg, https://salt.tikicdn.com/ts/product/70/cc/64/837b931e51703a16ceb8599e166097df.jpg, https://salt.tikicdn.com/ts/product/82/08/06/4f484a4676319e5c3c039ac92e2105b0.jpg","https://salt.tikicdn.com/cache/w1200/ts/product/eb/9d/bb/baa8b0eb8f53d11a7a4c09742cef6fa0.jpg, https://salt.tikicdn.com/cache/w1200/ts/product/d7/75/a7/335d17725f72015caae983ce5a4f0b21.jpg, https://salt.tikicdn.com/cache/w1200/ts/product/0b/ed/ed/d103f11694f26e2e6dec99643ef8f54b.jpg, https://salt.tikicdn.com/cache/w1200/ts/product/70/cc/64/837b931e51703a16ceb8599e166097df.jpg, https://salt.tikicdn.com/cache/w1200/ts/product/82/08/06/4f484a4676319e5c3c039ac92e2105b0.jpg","https://salt.tikicdn.com/cache/w300/ts/product/eb/9d/bb/baa8b0eb8f53d11a7a4c09742cef6fa0.jpg, https://salt.tikicdn.com/cache/w300/ts/product/d7/75/a7/335d17725f72015caae983ce5a4f0b21.jpg, https://salt.tikicdn.com/cache/w300/ts/product/0b/ed/ed/d103f11694f26e2e6dec99643ef8f54b.jpg, https://salt.tikicdn.com/cache/w300/ts/product/70/cc/64/837b931e51703a16ceb8599e166097df.jpg, https://salt.tikicdn.com/cache/w300/ts/product/82/08/06/4f484a4676319e5c3c039ac92e2105b0.jpg","https://salt.tikicdn.com/cache/200x280/ts/product/eb/9d/bb/baa8b0eb8f53d11a7a4c09742cef6fa0.jpg, https://salt.tikicdn.com/cache/200x280/ts/product/d7/75/a7/335d17725f72015caae983ce5a4f0b21.jpg, https://salt.tikicdn.com/cache/200x280/ts/product/0b/ed/ed/d103f11694f26e2e6dec99643ef8f54b.jpg, https://salt.tikicdn.com/cache/200x280/ts/product/70/cc/64/837b931e51703a16ceb8599e166097df.jpg, https://salt.tikicdn.com/cache/200x280/ts/product/82/08/06/4f484a4676319e5c3c039ac92e2105b0.jpg","https://salt.tikicdn.com/cache/200x280/ts/product/eb/9d/bb/baa8b0eb8f53d11a7a4c09742cef6fa0.jpg, https://salt.tikicdn.com/cache/200x280/ts/product/d7/75/a7/335d17725f72015caae983ce5a4f0b21.jpg, https://salt.tikicdn.com/cache/200x280/ts/product/0b/ed/ed/d103f11694f26e2e6dec99643ef8f54b.jpg, https://salt.tikicdn.com/cache/200x280/ts/product/70/cc/64/837b931e51703a16ceb8599e166097df.jpg, https://salt.tikicdn.com/cache/200x280/ts/product/82/08/06/4f484a4676319e5c3c039ac92e2105b0.jpg",1000,0
253248158,Kẹp bướm Flexoffice 25mm FO-DC03,12900,"Thông số kĩ thuật :Thương hiệuFlexOfficeChất liệuKim loại chất lượng cao phủ NikenKích thước25 mmQuy cách12 hộp/inner, 240 hộp/thùngTính năng nổi bật:Phần cạnh được làm bằng kim loại chất lư...","Thông số kĩ thuật : Thương hiệu FlexOffice Chất liệu Kim loại chất lượng cao phủ Niken Kích thước 25 mm Quy cách 12 hộp/inner, 240 hộp/thùng Tính năng nổi bật: Phần cạnh được làm bằng kim loại chất lượng cao phủ Niken không gỉ giúp 2 ngón tay dễ cầm. Được dùng để kẹp giữ chặt giấy tờ và tài liệu Đặc điểm nổi bật: Kẹp bướm là vật dụng không thể thiếu trong mọi văn phòng để hỗ trợ công việc sắp xếp giấy tờ, tài liệu rời. Kẹp thiết kế dễ sử dụng, bền bỉ và không gỉ sét mang đến hiệu quả lâu dài và an tâm cho người dùng. Sản xuất từ chất liệu bền bỉ Kẹp bướm được làm bằng chất liệu kim loại cao cấp, bền chắc, đẹp mắt nhằm nâng cao tuổi thọ sản phẩm. Loại kẹp nhỏ gọn, không hại da tay và thân thiện với người dùng. Có tính ứng dụng rộng Kẹp bướm có thể kẹp chặt lượng tài liệu ít, mỏng tối đa 10 tờ A4 để không bị bung rời. Sản phẩm thiết kế đơn giản, dễ sử dụng mà không bị đau tay. Kẹp giấy đầu tròn hiệu quả trong việc bảo quản, phân loại và tránh thất lạc các liên giấy, tài liệu rời trong công việc, học tập. Nhờ đó mà công tác văn phòng sẽ trở nên đơn giản và nhẹ nhàng hơn. Giá sản phẩm trên Tiki đã bao gồm thuế theo luật hiện hành. Bên cạnh đó, tuỳ vào loại sản phẩm, hình thức và địa chỉ giao hàng mà có thể phát sinh thêm chi phí khác như phí vận chuyển, phụ phí hàng cồng kềnh, thuế nhập khẩu (đối với đơn hàng giao từ nước ngoài có giá trị trên 1 triệu đồng).....",5,5,https://salt.tikicdn.com/ts/product/99/d2/1a/f962afa79d7760960a697cbade009fbb.jpg,https://salt.tikicdn.com/cache/w1200/ts/product/99/d2/1a/f962afa79d7760960a697cbade009fbb.jpg,https://salt.tikicdn.com/cache/w300/ts/product/99/d2/1a/f962afa79d7760960a697cbade009fbb.jpg,https://salt.tikicdn.com/cache/200x280/ts/product/99/d2/1a/f962afa79d7760960a697cbade009fbb.jpg,https://salt.tikicdn.com/cache/200x280/ts/product/99/d2/1a/f962afa79d7760960a697cbade009fbb.jpg,1000,5
