id,name,price,short_description,description,rating_average,review_count,image_base_url,image_large_url,image_medium_url,image_small_url,image_thumbnail_url,stock,quantity_sold
262728743,"One True King: The School for Good and Evil, Book 6",199000,"In this sixth and final installment in Soman Chainani’s New York Times best-selling epic-fantasy fairy-tale series the School for Good and Evil, Camelot’s crown - and the fate of the Endless Woods - a...","In this sixth and final installment in Soman Chainani’s New York Times best-selling epic-fantasy fairy-tale series the School for Good and Evil, Camelot’s crown - and the fate of the Endless Woods - are up for grabs. Beyond Good and Evil. Beyond Ever Afters. The tale of Sophie and Agatha comes to a dramatic conclusion. Prepare yourself for the End of Ends. The first test was passed. Excalibur pulled from the stone. A new king named. But two claim the crown. The sword returns to the stone, for only one is the true king. Who? The future I have seen has many  So by my will, none shall be crowned until the Tournament is complete. The Tournament of Kings. Three trials. Three answers to find. A race to the finish. My last coronation test. Excalibur will crown the winner and take the loser's head. The first test is coming. P Giá sản phẩm trên Tiki đã bao gồm thuế theo luật hiện hành. Bên cạnh đó, tuỳ vào loại sản phẩm, hình thức và địa chỉ giao hàng mà có thể phát sinh thêm chi phí khác như phí vận chuyển, phụ phí hàng cồng kềnh, thuế nhập khẩu (đối với đơn hàng giao từ nước ngoài có giá trị trên 1 triệu đồng).....",5,1,https://salt.tikicdn.com/ts/product/ba/da/82/2edbe7010f5520a0cda48d272d00bff2.jpg,https://salt.tikicdn.com/cache/w1200/ts/product/ba/da/82/2edbe7010f5520a0cda48d272d00bff2.jpg,https://salt.tikicdn.com/cache/w300/ts/product/ba/da/82/2edbe7010f5520a0cda48d272d00bff2.jpg,https://salt.tikicdn.com/cache/200x280/ts/product/ba/da/82/2edbe7010f5520a0cda48d272d00bff2.jpg,https://salt.tikicdn.com/cache/200x280/ts/product/ba/da/82/2edbe7010f5520a0cda48d272d00bff2.jpg,1000,1
262707209,Twice We Make Magic book2,229000,"Sisters Spel and Egg grew up in Mistress Mouldheels’ School for Wicked Girls believing they were the daughters of criminals, until they discovered the truth:They are witches.And after always being i...","Sisters Spel and Egg grew up in Mistress Mouldheels’ School for Wicked Girls believing they were the daughters of criminals, until they discovered the truth: They are witches. And after always being in the shadow of her big sister, Spel discovered that she was a Shadowborn Witch – the only one who can step between portals to other worlds. Now in a coven with their schoolmates and part of the alliance against the Hunt, the sisters try to master their new powers. But the Hunt is rising, the witches are in danger and when a new portal opens the whole world is under threat . . . The second in the fantasy adventure series with a witchy twist from the author of The Huntress trilogy PRAISE FOR THE HUNTRESS Giá sản phẩm trên Tiki đã bao gồm thuế theo luật hiện hành. Bên cạnh đó, tuỳ vào loại sản phẩm, hình thức và địa chỉ giao hàng mà có thể phát sinh thêm chi phí khác như phí vận chuyển, phụ phí hàng cồng kềnh, thuế nhập khẩu (đối với đơn hàng giao từ nước ngoài có giá trị trên 1 triệu đồng).....",0,0,https://salt.tikicdn.com/ts/product/23/13/26/689ffa33a90eff7858a297813f401283.jpg,https://salt.tikicdn.com/cache/w1200/ts/product/23/13/26/689ffa33a90eff7858a297813f401283.jpg,https://salt.tikicdn.com/cache/w300/ts/product/23/13/26/689ffa33a90eff7858a297813f401283.jpg,https://salt.tikicdn.com/cache/200x280/ts/product/23/13/26/689ffa33a90eff7858a297813f401283.jpg,https://salt.tikicdn.com/cache/200x280/ts/product/23/13/26/689ffa33a90eff7858a297813f401283.jpg,1000,0
205048935,Truyện tiếng anh cho bé The Bad Guys - Episode 9: The Big Bad Wolf,144000,"When Mr. Wolf is blown up to Godzilla proportions, the Bad Guys find themselves in monster-sized trouble. They must figure out how to stop an alien invasion and get Wolfie back to his old self before ...","When Mr. Wolf is blown up to Godzilla proportions, the Bad Guys find themselves in monster-sized trouble. They must figure out how to stop an alien invasion and get Wolfie back to his old self before the world is totally destroyed. Good thing they have the International League of Heroes on their side, and some newly honed superpowers ready to put to the Giá sản phẩm trên Tiki đã bao gồm thuế theo luật hiện hành. Bên cạnh đó, tuỳ vào loại sản phẩm, hình thức và địa chỉ giao hàng mà có thể phát sinh thêm chi phí khác như phí vận chuyển, phụ phí hàng cồng kềnh, thuế nhập khẩu (đối với đơn hàng giao từ nước ngoài có giá trị trên 1 triệu đồng).....",0,0,"https://salt.tikicdn.com/ts/product/e6/f6/45/472fc6bbe3bfb017316959d92e4bc8ea.jpg, https://salt.tikicdn.com/ts/product/5c/02/39/545aff45a0b097661bbef2ece1c9cb07.jpg, https://salt.tikicdn.com/ts/product/1b/aa/3a/b5eafc544831f475382bba913d1d9ff6.jpg, https://salt.tikicdn.com/ts/product/3d/88/e0/ec3cb18720a29401bf70adfe47de29e2.jpg, https://salt.tikicdn.com/ts/product/77/e9/3c/20be41d6af33ea3210197d1056e62c39.jpg","https://salt.tikicdn.com/cache/w1200/ts/product/e6/f6/45/472fc6bbe3bfb017316959d92e4bc8ea.jpg, https://salt.tikicdn.com/cache/w1200/ts/product/5c/02/39/545aff45a0b097661bbef2ece1c9cb07.jpg, https://salt.tikicdn.com/cache/w1200/ts/product/1b/aa/3a/b5eafc544831f475382bba913d1d9ff6.jpg, https://salt.tikicdn.com/cache/w1200/ts/product/3d/88/e0/ec3cb18720a29401bf70adfe47de29e2.jpg, https://salt.tikicdn.com/cache/w1200/ts/product/77/e9/3c/20be41d6af33ea3210197d1056e62c39.jpg","https://salt.tikicdn.com/cache/w300/ts/product/e6/f6/45/472fc6bbe3bfb017316959d92e4bc8ea.jpg, https://salt.tikicdn.com/cache/w300/ts/product/5c/02/39/545aff45a0b097661bbef2ece1c9cb07.jpg, https://salt.tikicdn.com/cache/w300/ts/product/1b/aa/3a/b5eafc544831f475382bba913d1d9ff6.jpg, https://salt.tikicdn.com/cache/w300/ts/product/3d/88/e0/ec3cb18720a29401bf70adfe47de29e2.jpg, https://salt.tikicdn.com/cache/w300/ts/product/77/e9/3c/20be41d6af33ea3210197d1056e62c39.jpg","https://salt.tikicdn.com/cache/200x280/ts/product/e6/f6/45/472fc6bbe3bfb017316959d92e4bc8ea.jpg, https://salt.tikicdn.com/cache/200x280/ts/product/5c/02/39/545aff45a0b097661bbef2ece1c9cb07.jpg, https://salt.tikicdn.com/cache/200x280/ts/product/1b/aa/3a/b5eafc544831f475382bba913d1d9ff6.jpg, https://salt.tikicdn.com/cache/200x280/ts/product/3d/88/e0/ec3cb18720a29401bf70adfe47de29e2.jpg, https://salt.tikicdn.com/cache/200x280/ts/product/77/e9/3c/20be41d6af33ea3210197d1056e62c39.jpg","https://salt.tikicdn.com/cache/200x280/ts/product/e6/f6/45/472fc6bbe3bfb017316959d92e4bc8ea.jpg, https://salt.tikicdn.com/cache/200x280/ts/product/5c/02/39/545aff45a0b097661bbef2ece1c9cb07.jpg, https://salt.tikicdn.com/cache/200x280/ts/product/1b/aa/3a/b5eafc544831f475382bba913d1d9ff6.jpg, https://salt.tikicdn.com/cache/200x280/ts/product/3d/88/e0/ec3cb18720a29401bf70adfe47de29e2.jpg, https://salt.tikicdn.com/cache/200x280/ts/product/77/e9/3c/20be41d6af33ea3210197d1056e62c39.jpg",1000,0
204667086,Truyện tiếng anh The Bad Guys - Episode 8: Superbad,144000,"They may look like Bad Guys, but these wannabe heroes are doing good  you like it or not! This New York Times bestselling illustrated series is perfect for fans of Dog Man and Captain Underpants. ...","They may look like Bad Guys, but these wannabe heroes are doing good  you like it or not! This New York Times bestselling illustrated series is perfect for fans of Dog Man and Captain Underpants. Get ready to laugh up your lunch with the baddest bunch of do-gooders in town! Watch the fur fly in the first five hilarious installments in this bestselling series, now in one bad-to-the-bone boxed set: The Bad Guys, The Bad Guys in Mission Unpluckable, The Bad Guys in the Furball Strikes Back, The Bad Guys in Attack of the Zittens, and The Bad Guys in Interstellar Gas. Giá sản phẩm trên Tiki đã bao gồm thuế theo luật hiện hành. Bên cạnh đó, tuỳ vào loại sản phẩm, hình thức và địa chỉ giao hàng mà có thể phát sinh thêm chi phí khác như phí vận chuyển, phụ phí hàng cồng kềnh, thuế nhập khẩu (đối với đơn hàng giao từ nước ngoài có giá trị trên 1 triệu đồng).....",0,0,"https://salt.tikicdn.com/ts/product/c4/66/c9/0774e5bd53b39d60cb81a3a9e4d29343.jpg, https://salt.tikicdn.com/ts/product/03/c4/3a/cbb6ab52a30dd7995a52bea5f84304f1.jpg, https://salt.tikicdn.com/ts/product/97/16/4a/2573b5c446beb6c59aeb0a1b5503fe8f.jpg, https://salt.tikicdn.com/ts/product/61/da/76/50cc7bb5529a7509b294dd26a249ce08.jpg, https://salt.tikicdn.com/ts/product/99/10/b9/7718e12708e8071377fb2f24ae259bc6.jpg","https://salt.tikicdn.com/cache/w1200/ts/product/c4/66/c9/0774e5bd53b39d60cb81a3a9e4d29343.jpg, https://salt.tikicdn.com/cache/w1200/ts/product/03/c4/3a/cbb6ab52a30dd7995a52bea5f84304f1.jpg, https://salt.tikicdn.com/cache/w1200/ts/product/97/16/4a/2573b5c446beb6c59aeb0a1b5503fe8f.jpg, https://salt.tikicdn.com/cache/w1200/ts/product/61/da/76/50cc7bb5529a7509b294dd26a249ce08.jpg, https://salt.tikicdn.com/cache/w1200/ts/product/99/10/b9/7718e12708e8071377fb2f24ae259bc6.jpg","https://salt.tikicdn.com/cache/w300/ts/product/c4/66/c9/0774e5bd53b39d60cb81a3a9e4d29343.jpg, https://salt.tikicdn.com/cache/w300/ts/product/03/c4/3a/cbb6ab52a30dd7995a52bea5f84304f1.jpg, https://salt.tikicdn.com/cache/w300/ts/product/97/16/4a/2573b5c446beb6c59aeb0a1b5503fe8f.jpg, https://salt.tikicdn.com/cache/w300/ts/product/61/da/76/50cc7bb5529a7509b294dd26a249ce08.jpg, https://salt.tikicdn.com/cache/w300/ts/product/99/10/b9/7718e12708e8071377fb2f24ae259bc6.jpg","https://salt.tikicdn.com/cache/200x280/ts/product/c4/66/c9/0774e5bd53b39d60cb81a3a9e4d29343.jpg, https://salt.tikicdn.com/cache/200x280/ts/product/03/c4/3a/cbb6ab52a30dd7995a52bea5f84304f1.jpg, https://salt.tikicdn.com/cache/200x280/ts/product/97/16/4a/2573b5c446beb6c59aeb0a1b5503fe8f.jpg, https://salt.tikicdn.com/cache/200x280/ts/product/61/da/76/50cc7bb5529a7509b294dd26a249ce08.jpg, https://salt.tikicdn.com/cache/200x280/ts/product/99/10/b9/7718e12708e8071377fb2f24ae259bc6.jpg","https://salt.tikicdn.com/cache/200x280/ts/product/c4/66/c9/0774e5bd53b39d60cb81a3a9e4d29343.jpg, https://salt.tikicdn.com/cache/200x280/ts/product/03/c4/3a/cbb6ab52a30dd7995a52bea5f84304f1.jpg, https://salt.tikicdn.com/cache/200x280/ts/product/97/16/4a/2573b5c446beb6c59aeb0a1b5503fe8f.jpg, https://salt.tikicdn.com/cache/200x280/ts/product/61/da/76/50cc7bb5529a7509b294dd26a249ce08.jpg, https://salt.tikicdn.com/cache/200x280/ts/product/99/10/b9/7718e12708e8071377fb2f24ae259bc6.jpg",1000,0
204666238,Truyện tiếng anh The Bad Guys - Episode 13: Cut To The Chase,144000,"A MYSTERIOUS DOORWAY! (Sure, it’s in the grossest restaurant in the world, but that doesn’t make it any less mysterious. OK?) Behold! What lies beyond?! An evil centipede? An alternate universe? A few...","A MYSTERIOUS DOORWAY! (Sure, it’s in the grossest restaurant in the world, but that doesn’t make it any less mysterious. OK?) Behold! What lies beyond?! An evil centipede? An alternate universe? A few decent explanations? VRRRING! NING! NING! NING! Giá sản phẩm trên Tiki đã bao gồm thuế theo luật hiện hành. Bên cạnh đó, tuỳ vào loại sản phẩm, hình thức và địa chỉ giao hàng mà có thể phát sinh thêm chi phí khác như phí vận chuyển, phụ phí hàng cồng kềnh, thuế nhập khẩu (đối với đơn hàng giao từ nước ngoài có giá trị trên 1 triệu đồng).....",0,0,"https://salt.tikicdn.com/ts/product/3d/11/25/c9cf3c2c6e5c83ee1246e56501e50f59.jpg, https://salt.tikicdn.com/ts/product/4c/f0/08/01a552ae780d443080e204452e0b3888.jpg, https://salt.tikicdn.com/ts/product/88/15/3a/d90346f9a03dd08331e99f4b5a8fbea2.jpg, https://salt.tikicdn.com/ts/product/66/b1/0e/cb9bbcac12757190da9611174a0d5f46.jpg, https://salt.tikicdn.com/ts/product/aa/21/29/bdf0e315680e41cf30f04fa3f28a51f0.jpg","https://salt.tikicdn.com/cache/w1200/ts/product/3d/11/25/c9cf3c2c6e5c83ee1246e56501e50f59.jpg, https://salt.tikicdn.com/cache/w1200/ts/product/4c/f0/08/01a552ae780d443080e204452e0b3888.jpg, https://salt.tikicdn.com/cache/w1200/ts/product/88/15/3a/d90346f9a03dd08331e99f4b5a8fbea2.jpg, https://salt.tikicdn.com/cache/w1200/ts/product/66/b1/0e/cb9bbcac12757190da9611174a0d5f46.jpg, https://salt.tikicdn.com/cache/w1200/ts/product/aa/21/29/bdf0e315680e41cf30f04fa3f28a51f0.jpg","https://salt.tikicdn.com/cache/w300/ts/product/3d/11/25/c9cf3c2c6e5c83ee1246e56501e50f59.jpg, https://salt.tikicdn.com/cache/w300/ts/product/4c/f0/08/01a552ae780d443080e204452e0b3888.jpg, https://salt.tikicdn.com/cache/w300/ts/product/88/15/3a/d90346f9a03dd08331e99f4b5a8fbea2.jpg, https://salt.tikicdn.com/cache/w300/ts/product/66/b1/0e/cb9bbcac12757190da9611174a0d5f46.jpg, https://salt.tikicdn.com/cache/w300/ts/product/aa/21/29/bdf0e315680e41cf30f04fa3f28a51f0.jpg","https://salt.tikicdn.com/cache/200x280/ts/product/3d/11/25/c9cf3c2c6e5c83ee1246e56501e50f59.jpg, https://salt.tikicdn.com/cache/200x280/ts/product/4c/f0/08/01a552ae780d443080e204452e0b3888.jpg, https://salt.tikicdn.com/cache/200x280/ts/product/88/15/3a/d90346f9a03dd08331e99f4b5a8fbea2.jpg, https://salt.tikicdn.com/cache/200x280/ts/product/66/b1/0e/cb9bbcac12757190da9611174a0d5f46.jpg, https://salt.tikicdn.com/cache/200x280/ts/product/aa/21/29/bdf0e315680e41cf30f04fa3f28a51f0.jpg","https://salt.tikicdn.com/cache/200x280/ts/product/3d/11/25/c9cf3c2c6e5c83ee1246e56501e50f59.jpg, https://salt.tikicdn.com/cache/200x280/ts/product/4c/f0/08/01a552ae780d443080e204452e0b3888.jpg, https://salt.tikicdn.com/cache/200x280/ts/product/88/15/3a/d90346f9a03dd08331e99f4b5a8fbea2.jpg, https://salt.tikicdn.com/cache/200x280/ts/product/66/b1/0e/cb9bbcac12757190da9611174a0d5f46.jpg, https://salt.tikicdn.com/cache/200x280/ts/product/aa/21/29/bdf0e315680e41cf30f04fa3f28a51f0.jpg",1000,0
196203480,The Complete Misfits Collection,599000,"Discover all four books in the funny, heartfelt, and beloved Misfits series by Bunnicula author James Howe, together in a collectible paperback boxed set.Sticks and stones may break our bones, but nam...","Discover all four books in the funny, heartfelt, and beloved Misfits series by Bunnicula author James Howe, together in a collectible paperback boxed set. Sticks and stones may break our bones, but names will break our spirit. Seventh grade isn't easy, especially for the outcasts who get called names. But when misfits Bobby, Joe, Addie, and Skeezie find each other, they learn to fight for themselves and their friends. Bobby stands up and makes a difference. Joe finds the courage to be himself, no matter who's watching. Outspoken Addie wonders if there's a way to be true to who she is on the inside without becoming a target on the outside. And Skeezie's life-changing summer brims with tough choices, love in all directions, and enough sweet potato fries to go around. This honest and resonant must-have boxed set includes paperback editions of: The Misfits Totally Joe Addie on the Inside Also Known as Elvis Giá sản phẩm trên Tiki đã bao gồm thuế theo luật hiện hành. Bên cạnh đó, tuỳ vào loại sản phẩm, hình thức và địa chỉ giao hàng mà có thể phát sinh thêm chi phí khác như phí vận chuyển, phụ phí hàng cồng kềnh, thuế nhập khẩu (đối với đơn hàng giao từ nước ngoài có giá trị trên 1 triệu đồng).....",0,0,https://salt.tikicdn.com/ts/product/7b/a7/a1/ffa7739fb5081366c8a2b61d321222d4.jpg,https://salt.tikicdn.com/cache/w1200/ts/product/7b/a7/a1/ffa7739fb5081366c8a2b61d321222d4.jpg,https://salt.tikicdn.com/cache/w300/ts/product/7b/a7/a1/ffa7739fb5081366c8a2b61d321222d4.jpg,https://salt.tikicdn.com/cache/200x280/ts/product/7b/a7/a1/ffa7739fb5081366c8a2b61d321222d4.jpg,https://salt.tikicdn.com/cache/200x280/ts/product/7b/a7/a1/ffa7739fb5081366c8a2b61d321222d4.jpg,1000,0
185519594, Anatomy of a Single Girl,189000,"ngôn ngữ: TIẾNG ANHBÌA: MỀMIn Daria Snadowsky's daring sequel to Anatomy of a Boyfriend, eighteen-year-old Dominique explores the relationship between love and lust, and the friendships that see us ...","ngôn ngữ: TIẾNG ANH BÌA: MỀM In Daria Snadowsky's daring sequel to Anatomy of a Boyfriend, eighteen-year-old Dominique explores the relationship between love and lust, and the friendships that see us through. Giá sản phẩm trên Tiki đã bao gồm thuế theo luật hiện hành. Bên cạnh đó, tuỳ vào loại sản phẩm, hình thức và địa chỉ giao hàng mà có thể phát sinh thêm chi phí khác như phí vận chuyển, phụ phí hàng cồng kềnh, thuế nhập khẩu (đối với đơn hàng giao từ nước ngoài có giá trị trên 1 triệu đồng).....",0,0,https://salt.tikicdn.com/ts/product/aa/c1/93/0428f32a2468eba58dfaa271e48e6098.jpg,https://salt.tikicdn.com/cache/w1200/ts/product/aa/c1/93/0428f32a2468eba58dfaa271e48e6098.jpg,https://salt.tikicdn.com/cache/w300/ts/product/aa/c1/93/0428f32a2468eba58dfaa271e48e6098.jpg,https://salt.tikicdn.com/cache/200x280/ts/product/aa/c1/93/0428f32a2468eba58dfaa271e48e6098.jpg,https://salt.tikicdn.com/cache/200x280/ts/product/aa/c1/93/0428f32a2468eba58dfaa271e48e6098.jpg,1000,0
138255256,The Cartoon Guide to Biology,499000,kích thước:187 x 235 x 20mm | 498gngông ngữ: tiếng anhFrom New York Times  author Larry Gonick and Davidson College biology professor David Wessner comes this comprehensive and humorous cartoon guid...,"kích thước:187 x 235 x 20mm | 498g ngông ngữ: tiếng anh From New York Times  author Larry Gonick and Davidson College biology professor David Wessner comes this comprehensive and humorous cartoon guide to topics in biology Did you faint when your middle school science teacher asked you to dissect a frog? Do you think DNA stands for ""Don't Know the Answer""? Do you still cling to the belief that osmosis was the name of Ozzy Osbourne's last tour? If you said yes to any of these questions-or even if you didn't-then you need The Cartoon Guide to Biology. The latest from New York Times author Larry Gonick-writing with Davidson College biology professor David Wessner-is a hilarious and informative handbook to the science of life. From the inner workings of the cell, to the magic of gene expression, to the Krebs and Calvin cycles, to sexual and asexual reproduction, The Cartoon Guide to Biology uses simple, clear, humorous illustrations to make biology's complex concepts understandable and entertaining. Whether you're peering into the microscope for the first time or brushing up after decades of de-evolution, this book has you covered. Giá sản phẩm trên Tiki đã bao gồm thuế theo luật hiện hành. Bên cạnh đó, tuỳ vào loại sản phẩm, hình thức và địa chỉ giao hàng mà có thể phát sinh thêm chi phí khác như phí vận chuyển, phụ phí hàng cồng kềnh, thuế nhập khẩu (đối với đơn hàng giao từ nước ngoài có giá trị trên 1 triệu đồng).....",5,1,https://salt.tikicdn.com/ts/product/b8/02/e7/beae14afeddd8f60ebf7173a4c3a25d0.jpg,https://salt.tikicdn.com/cache/w1200/ts/product/b8/02/e7/beae14afeddd8f60ebf7173a4c3a25d0.jpg,https://salt.tikicdn.com/cache/w300/ts/product/b8/02/e7/beae14afeddd8f60ebf7173a4c3a25d0.jpg,https://salt.tikicdn.com/cache/200x280/ts/product/b8/02/e7/beae14afeddd8f60ebf7173a4c3a25d0.jpg,https://salt.tikicdn.com/cache/200x280/ts/product/b8/02/e7/beae14afeddd8f60ebf7173a4c3a25d0.jpg,1000,1
277539364,"The Giver Quartet — THE GIVER BOXED SET: THE GIVER, GATHERING BLUE, MESSENGER, SON",920000,"Quy cách: Bìa mềmNgôn ngữ: tiếng Anh####THE GIVER QUARTET is the complete four-novel collection.THE GIVER: It is the future. There is no war, no hunger, no pain. No one in the community wants for ...","Quy cách : Bìa mềm Ngôn ngữ : tiếng Anh #### THE GIVER QUARTET is the complete four-novel collection. THE GIVER: It is the future. There is no war, no hunger, no pain. No one in the community wants for anything. Everything needed is provided. And at twelve years old, each member of the community has their profession carefully chosen for them by the Committee of Elders. Jonas has never thought there was anything wrong with his world. But from the moment he is selected as the Receiver of Memory, Jonas discovers that their community is not as perfect as it seems… GATHERING BLUE is a return to the mysterious but plausible future world of THE GIVER. It tells the story of Kira, orphaned, physically flawed, and left with an uncertain future until she is summoned by the Council of Guardians. On her quest for truth that follows, Kira makes discoveries that will change her life and world forever. In MESSENGER, Matty has lived in Village and flourished under the guidance of Seer, a blind man known for his special sight. His community once welcomed newcomers, but something sinister has seeped into Village and the people have voted to close its borders to outsiders. Now Matty must risk everything to make one last journey through the treacherous forest… SON is the thrilling conclusion to THE GIVER QUARTET. When ‘Water Claire’ washed up on their shore, no one knew that she came from a society where emotions don’t exist. That she had become a Vessel. That she had carried a Product. That it had been stolen from her body. Claire’s son is out there, a young boy now. And she will stop at nothing to find her child, even if it means making an unimaginable sacrifice. Award-winning author Lois Lowry challenges readers to imagine what our world could become, how people could evolve and what could be considered valuable in this fascinating quartet of dystopian novels – now available as a four-book set. Giá sản phẩm trên Tiki đã bao gồm thuế theo luật hiện hành. Bên cạnh đó, tuỳ vào loại sản phẩm, hình thức và địa chỉ giao hàng mà có thể phát sinh thêm chi phí khác như phí vận chuyển, phụ phí hàng cồng kềnh, thuế nhập khẩu (đối với đơn hàng giao từ nước ngoài có giá trị trên 1 triệu đồng).....",0,0,https://salt.tikicdn.com/ts/product/4e/2a/4b/faf131d07095e069c7c422c1abd40e61.jpg,https://salt.tikicdn.com/cache/w1200/ts/product/4e/2a/4b/faf131d07095e069c7c422c1abd40e61.jpg,https://salt.tikicdn.com/cache/w300/ts/product/4e/2a/4b/faf131d07095e069c7c422c1abd40e61.jpg,https://salt.tikicdn.com/cache/200x280/ts/product/4e/2a/4b/faf131d07095e069c7c422c1abd40e61.jpg,https://salt.tikicdn.com/cache/200x280/ts/product/4e/2a/4b/faf131d07095e069c7c422c1abd40e61.jpg,1000,0
276957818,Zak Zoo 8 Copy Shrinkwrap,1450000,Quy cách: Bìa mềmNgôn ngữ: tiếng Anh####Title in this set:Zak Zoo and the School Hullabaloo: Book 1Zak Zoo and the Peculiar Parcel: Book 2Zak Zoo and the Seaside SOS: Book 3Zak Zoo and ...,"Quy cách : Bìa mềm Ngôn ngữ: tiếng Anh #### Title in this set: Zak Zoo and the School Hullabaloo: Book 1 Zak Zoo and the Peculiar Parcel: Book 2 Zak Zoo and the Seaside SOS: Book 3 Zak Zoo and the Unusual Yak: Book 4 Zak Zoo and the Hectic House: Book 5 Zak Zoo and the Baffled Burglar: Book 6 Zak Zoo and the TV Crew: Book 7 Zak Zoo and the Birthday Bang: Book 8 Giá sản phẩm trên Tiki đã bao gồm thuế theo luật hiện hành. Bên cạnh đó, tuỳ vào loại sản phẩm, hình thức và địa chỉ giao hàng mà có thể phát sinh thêm chi phí khác như phí vận chuyển, phụ phí hàng cồng kềnh, thuế nhập khẩu (đối với đơn hàng giao từ nước ngoài có giá trị trên 1 triệu đồng).....",0,0,https://salt.tikicdn.com/ts/product/fe/55/32/211cc66cf8b1dd1aef913372b607a68c.jpg,https://salt.tikicdn.com/cache/w1200/ts/product/fe/55/32/211cc66cf8b1dd1aef913372b607a68c.jpg,https://salt.tikicdn.com/cache/w300/ts/product/fe/55/32/211cc66cf8b1dd1aef913372b607a68c.jpg,https://salt.tikicdn.com/cache/200x280/ts/product/fe/55/32/211cc66cf8b1dd1aef913372b607a68c.jpg,https://salt.tikicdn.com/cache/200x280/ts/product/fe/55/32/211cc66cf8b1dd1aef913372b607a68c.jpg,1000,0
