id,name,price,short_description,description,rating_average,review_count,image_base_url,image_large_url,image_medium_url,image_small_url,image_thumbnail_url,stock,quantity_sold
274117519,Junior Explorers: A-Z Mindful Me Jigsaw Puzzle,339000,Start your day with a mindful mantra!Build alphabet knowledge and help your Explorer find their quiet place with this 26-piece jigsaw puzzle. Flip the puzzle pieces to discover mindful mantras and us...,"Start your day with a mindful mantra! Build alphabet knowledge and help your Explorer find their quiet place with this 26-piece jigsaw puzzle. Flip the puzzle pieces to discover mindful mantras and use the stickers to help set a mindful focus for the day. Designed with a mindful colour palette, this jigsaw puzzle, poster and sticker sheet will bring calm to little minds as they discover a world of gratitude and kindness. •  26-piece jigsaw puzzle •  Poster •  Sticker sheet •  Parent Guide •  Kids’ Tips •  Lunch box note Giá sản phẩm trên Tiki đã bao gồm thuế theo luật hiện hành. Bên cạnh đó, tuỳ vào loại sản phẩm, hình thức và địa chỉ giao hàng mà có thể phát sinh thêm chi phí khác như phí vận chuyển, phụ phí hàng cồng kềnh, thuế nhập khẩu (đối với đơn hàng giao từ nước ngoài có giá trị trên 1 triệu đồng).....",0,0,https://salt.tikicdn.com/ts/product/59/13/94/2684dbdabbfdcab91e08ae493fbf7da2.jpg,https://salt.tikicdn.com/cache/w1200/ts/product/59/13/94/2684dbdabbfdcab91e08ae493fbf7da2.jpg,https://salt.tikicdn.com/cache/w300/ts/product/59/13/94/2684dbdabbfdcab91e08ae493fbf7da2.jpg,https://salt.tikicdn.com/cache/200x280/ts/product/59/13/94/2684dbdabbfdcab91e08ae493fbf7da2.jpg,https://salt.tikicdn.com/cache/200x280/ts/product/59/13/94/2684dbdabbfdcab91e08ae493fbf7da2.jpg,1000,0
263352257,Wolf Brother boxset,1200000,Quy cách: Bìa mềmNXB: HachetteNgôn ngữ: tiếng Anh####A boy. A wolf. A legend for all time. The first book in the internationally bestselling WOLF BROTHER (Chronicles of Ancient Darkness) series by ...,"Quy cách : Bìa mềm NXB : Hachette Ngôn ngữ : tiếng Anh #### A boy. A wolf. A legend for all time. The first book in the internationally bestselling WOLF BROTHER (Chronicles of Ancient Darkness) series by renowned author Michelle Paver. Thousands of years ago, a powerful and malevolent force conjured a demon: a demon so evil that it could only be contained in the body of a ferocious bear, a demon determined to destroy the world. Only one boy can stop it … Twelve-year-old Torak sees his father murdered by the bear. With his dying breath, he asks his son to make him a promise. Alone, wounded, terrified and on the run, Torak must now lead the bear to the Mountain of the World Spirit – a mountain that no one has ever found before. But can Torak keep his promise? A terrifying quest commences in a world of wolves, tree spirits and Hidden People, a world in which trusting a friend means risking your life. Giá sản phẩm trên Tiki đã bao gồm thuế theo luật hiện hành. Bên cạnh đó, tuỳ vào loại sản phẩm, hình thức và địa chỉ giao hàng mà có thể phát sinh thêm chi phí khác như phí vận chuyển, phụ phí hàng cồng kềnh, thuế nhập khẩu (đối với đơn hàng giao từ nước ngoài có giá trị trên 1 triệu đồng).....",0,0,https://salt.tikicdn.com/ts/product/18/aa/66/3a0b24a9446f592c53e3dc58c2a77b65.jpg,https://salt.tikicdn.com/cache/w1200/ts/product/18/aa/66/3a0b24a9446f592c53e3dc58c2a77b65.jpg,https://salt.tikicdn.com/cache/w300/ts/product/18/aa/66/3a0b24a9446f592c53e3dc58c2a77b65.jpg,https://salt.tikicdn.com/cache/200x280/ts/product/18/aa/66/3a0b24a9446f592c53e3dc58c2a77b65.jpg,https://salt.tikicdn.com/cache/200x280/ts/product/18/aa/66/3a0b24a9446f592c53e3dc58c2a77b65.jpg,1000,0
263348620,The Naughtiest Girl - 10 Copy Collection,1500000,Quy cách: Bìa mềmNXB: HachetteNgôn ngữ: tiếng Anh####Enid Blyton's bestselling school series follows Elizabeth Allen as she is sent away to boarding school and makes up her mind to be the naughties...,"Quy cách : Bìa mềm NXB: Hachette Ngôn ngữ: tiếng Anh #### Enid Blyton's bestselling school series follows Elizabeth Allen as she is sent away to boarding school and makes up her mind to be the naughtiest pupil there's ever been. First published in 1940, Elizabeth and her friends have inspired children all over the world for over 70 years - it's clear the Naughtiest Girl is here to stay for a long time! 10 exciting adventures: The Naughtiest Girl in the School; The Naughtiest Girl Again; The Naughtiest Girl is a Monitor; Here's the Naughtiest Girl; The Naughtiest Girl Keeps a Secret; The Naughtiest Girl Helps a Friend; The Naughtiest Girl Saves the Day; Well Done, Naughtiest Girl; The Naughtiest Girl Want to Win; The Naughtiest Girl Marches On. Giá sản phẩm trên Tiki đã bao gồm thuế theo luật hiện hành. Bên cạnh đó, tuỳ vào loại sản phẩm, hình thức và địa chỉ giao hàng mà có thể phát sinh thêm chi phí khác như phí vận chuyển, phụ phí hàng cồng kềnh, thuế nhập khẩu (đối với đơn hàng giao từ nước ngoài có giá trị trên 1 triệu đồng).....",0,0,https://salt.tikicdn.com/ts/product/94/63/9d/0c0f21bd4f6b9d9349f220d65fef0f3d.jpg,https://salt.tikicdn.com/cache/w1200/ts/product/94/63/9d/0c0f21bd4f6b9d9349f220d65fef0f3d.jpg,https://salt.tikicdn.com/cache/w300/ts/product/94/63/9d/0c0f21bd4f6b9d9349f220d65fef0f3d.jpg,https://salt.tikicdn.com/cache/200x280/ts/product/94/63/9d/0c0f21bd4f6b9d9349f220d65fef0f3d.jpg,https://salt.tikicdn.com/cache/200x280/ts/product/94/63/9d/0c0f21bd4f6b9d9349f220d65fef0f3d.jpg,1000,0
263337841,Courtney The Clownfish Fairy,145000,"Quy cách: bìa mềmNgôn ngữ: tiếng Anh####Rachel and Kirsty are visiting Kirsty's grandmother when they are whisked away to Fairyland for the yearly Ocean Gala. Here, Shannon the Ocean Fairy plays he...","Quy cách : bìa mềm Ngôn ngữ : tiếng Anh #### Rachel and Kirsty are visiting Kirsty's grandmother when they are whisked away to Fairyland for the yearly Ocean Gala. Here, Shannon the Ocean Fairy plays her Magical Golden Conch Shell to that the seas and oceans remain peaceful and ordered for the year ahead. Everything is going well - until Jack Frost snatches the conch shell and breaks it into seven pieces. Rachel and Kirsty, along with the Ocean Fairies, must get the pieces back before chaos takes over the oceans! Giá sản phẩm trên Tiki đã bao gồm thuế theo luật hiện hành. Bên cạnh đó, tuỳ vào loại sản phẩm, hình thức và địa chỉ giao hàng mà có thể phát sinh thêm chi phí khác như phí vận chuyển, phụ phí hàng cồng kềnh, thuế nhập khẩu (đối với đơn hàng giao từ nước ngoài có giá trị trên 1 triệu đồng).....",0,0,https://salt.tikicdn.com/ts/product/82/a1/5b/e9798ff68fbdfcb0f184dd82532488e8.jpg,https://salt.tikicdn.com/cache/w1200/ts/product/82/a1/5b/e9798ff68fbdfcb0f184dd82532488e8.jpg,https://salt.tikicdn.com/cache/w300/ts/product/82/a1/5b/e9798ff68fbdfcb0f184dd82532488e8.jpg,https://salt.tikicdn.com/cache/200x280/ts/product/82/a1/5b/e9798ff68fbdfcb0f184dd82532488e8.jpg,https://salt.tikicdn.com/cache/200x280/ts/product/82/a1/5b/e9798ff68fbdfcb0f184dd82532488e8.jpg,1000,0
263337770,Whitney the Whale Fairy,145000,Quy cách: bìa mềmNgôn ngữ: tiếng Anh####The Ocean Fairies keep all the sea creatures safe and happy -- until their magic goes missing! This is our eleventh group of Rainbow Magic fairies.The Ocean...,"Quy cách : bìa mềm Ngôn ngữ : tiếng Anh #### The Ocean Fairies keep all the sea creatures safe and happy -- until their magic goes missing! This is our eleventh group of Rainbow Magic fairies. The Ocean Fairies keep all the sea creatures safe and happy! But when the goblins shatter their enchanted conch shell, seven magical sea creatures leave to search for the pieces Giá sản phẩm trên Tiki đã bao gồm thuế theo luật hiện hành. Bên cạnh đó, tuỳ vào loại sản phẩm, hình thức và địa chỉ giao hàng mà có thể phát sinh thêm chi phí khác như phí vận chuyển, phụ phí hàng cồng kềnh, thuế nhập khẩu (đối với đơn hàng giao từ nước ngoài có giá trị trên 1 triệu đồng).....",0,0,https://salt.tikicdn.com/ts/product/89/3c/02/2ea7382807406d9fa5248fd7ee6b822e.jpg,https://salt.tikicdn.com/cache/w1200/ts/product/89/3c/02/2ea7382807406d9fa5248fd7ee6b822e.jpg,https://salt.tikicdn.com/cache/w300/ts/product/89/3c/02/2ea7382807406d9fa5248fd7ee6b822e.jpg,https://salt.tikicdn.com/cache/200x280/ts/product/89/3c/02/2ea7382807406d9fa5248fd7ee6b822e.jpg,https://salt.tikicdn.com/cache/200x280/ts/product/89/3c/02/2ea7382807406d9fa5248fd7ee6b822e.jpg,1000,0
263337097,Stephanie the Starfish Fairy,145000,Quy cách: bìa mềmNgôn ngữ: tiếng Anh####With more than 6 million books in print Rainbow Magic is sparkling success! The Ocean Fairies keep all the sea creatures safe and happy-until their magic goe...,"Quy cách : bìa mềm Ngôn ngữ : tiếng Anh #### With more than 6 million books in print Rainbow Magic is sparkling success! The Ocean Fairies keep all the sea creatures safe and happy-until their magic goes missing! The enchanted conch shell has been split into seven pieces and scattered throughout the oceans. King Oberon and Queen Titania have sent seven magical sea creatures to guard the shells. Now it's up to the Ocean Fairies to find them, with Rachel and Kirsty's help! #5: Stephanie the Starfish Giá sản phẩm trên Tiki đã bao gồm thuế theo luật hiện hành. Bên cạnh đó, tuỳ vào loại sản phẩm, hình thức và địa chỉ giao hàng mà có thể phát sinh thêm chi phí khác như phí vận chuyển, phụ phí hàng cồng kềnh, thuế nhập khẩu (đối với đơn hàng giao từ nước ngoài có giá trị trên 1 triệu đồng).....",0,0,https://salt.tikicdn.com/ts/product/47/65/66/e8d102034a820b5b69d1f4a2389104db.jpg,https://salt.tikicdn.com/cache/w1200/ts/product/47/65/66/e8d102034a820b5b69d1f4a2389104db.jpg,https://salt.tikicdn.com/cache/w300/ts/product/47/65/66/e8d102034a820b5b69d1f4a2389104db.jpg,https://salt.tikicdn.com/cache/200x280/ts/product/47/65/66/e8d102034a820b5b69d1f4a2389104db.jpg,https://salt.tikicdn.com/cache/200x280/ts/product/47/65/66/e8d102034a820b5b69d1f4a2389104db.jpg,1000,0
263337024,Pia the Penguin Fairy,145000,Quy cách: bìa mềmNgôn ngữ: tiếng Anh####The Ocean Fairies keep all the sea creatures safe and happy -- until their magic goes missing! This is our eleventh group of Rainbow Magic fairies.The Ocean ...,"Quy cách : bìa mềm Ngôn ngữ : tiếng Anh #### The Ocean Fairies keep all the sea creatures safe and happy -- until their magic goes missing! This is our eleventh group of Rainbow Magic fairies.The Ocean Fairies keep all the sea creatures safe and happy! But when the goblins shatter their enchanted conch shell, seven magical sea creatures leave to search for the pieces. The Ocean Fairies must find the shells . . . and their animal friends!Rachel and Kirsty are off to the South Pole! Pia the Penguin Fairy's Giá sản phẩm trên Tiki đã bao gồm thuế theo luật hiện hành. Bên cạnh đó, tuỳ vào loại sản phẩm, hình thức và địa chỉ giao hàng mà có thể phát sinh thêm chi phí khác như phí vận chuyển, phụ phí hàng cồng kềnh, thuế nhập khẩu (đối với đơn hàng giao từ nước ngoài có giá trị trên 1 triệu đồng).....",0,0,https://salt.tikicdn.com/ts/product/fa/3a/fa/9704adcf944db722e54bf6833fba2227.jpg,https://salt.tikicdn.com/cache/w1200/ts/product/fa/3a/fa/9704adcf944db722e54bf6833fba2227.jpg,https://salt.tikicdn.com/cache/w300/ts/product/fa/3a/fa/9704adcf944db722e54bf6833fba2227.jpg,https://salt.tikicdn.com/cache/200x280/ts/product/fa/3a/fa/9704adcf944db722e54bf6833fba2227.jpg,https://salt.tikicdn.com/cache/200x280/ts/product/fa/3a/fa/9704adcf944db722e54bf6833fba2227.jpg,1000,0
263336856,Ally the Dolphin Fairy,145000,Quy cách: bìa mềmNgôn ngữ: tiếng Anh####The Ocean Fairies keep all the sea creatures safe and happy -- until their magic goes missing! This is our eleventh group of Rainbow Magic fairies.The Ocean...,"Quy cách : bìa mềm Ngôn ngữ : tiếng Anh #### The Ocean Fairies keep all the sea creatures safe and happy -- until their magic goes missing! This is our eleventh group of Rainbow Magic fairies. The Ocean Fairies keep all the sea creatures safe and happy! But when the goblins shatter their enchanted conch shell, seven magical sea creatures leave to search for Giá sản phẩm trên Tiki đã bao gồm thuế theo luật hiện hành. Bên cạnh đó, tuỳ vào loại sản phẩm, hình thức và địa chỉ giao hàng mà có thể phát sinh thêm chi phí khác như phí vận chuyển, phụ phí hàng cồng kềnh, thuế nhập khẩu (đối với đơn hàng giao từ nước ngoài có giá trị trên 1 triệu đồng).....",0,0,https://salt.tikicdn.com/ts/product/c4/ae/3a/4be117a5e832dd26f1df820a109929e7.jpg,https://salt.tikicdn.com/cache/w1200/ts/product/c4/ae/3a/4be117a5e832dd26f1df820a109929e7.jpg,https://salt.tikicdn.com/cache/w300/ts/product/c4/ae/3a/4be117a5e832dd26f1df820a109929e7.jpg,https://salt.tikicdn.com/cache/200x280/ts/product/c4/ae/3a/4be117a5e832dd26f1df820a109929e7.jpg,https://salt.tikicdn.com/cache/200x280/ts/product/c4/ae/3a/4be117a5e832dd26f1df820a109929e7.jpg,1000,0
263336535,Milly the River Fairy book 6,145000,Quy cách: bìa mềmNgôn ngữ: tiếng Anh####The fairies are going green! The fairy king and queen have just put together a new team of seven fairies for a very special mission. They are the Earth Fairi...,"Quy cách : bìa mềm Ngôn ngữ : tiếng Anh #### The fairies are going green! The fairy king and queen have just put together a new team of seven fairies for a very special mission. They are the Earth Fairies! Together, they're going to work their magic to clean up the environment. But they can't do it alone. Luckily, Rachel and Kirsty are ready to help! Rachel and Kirsty are helping Milly the River Fairy clean up a polluted river. But troublemaking goblins keep getting in the way. The girls need to get Milly's wand back to make the river a safe place again. Find the missing magic wand in each book and help save the environment Giá sản phẩm trên Tiki đã bao gồm thuế theo luật hiện hành. Bên cạnh đó, tuỳ vào loại sản phẩm, hình thức và địa chỉ giao hàng mà có thể phát sinh thêm chi phí khác như phí vận chuyển, phụ phí hàng cồng kềnh, thuế nhập khẩu (đối với đơn hàng giao từ nước ngoài có giá trị trên 1 triệu đồng).....",0,0,https://salt.tikicdn.com/ts/product/c3/fa/d9/0daf3efeabd1ea93b14aaaa1e2a7e92b.jpg,https://salt.tikicdn.com/cache/w1200/ts/product/c3/fa/d9/0daf3efeabd1ea93b14aaaa1e2a7e92b.jpg,https://salt.tikicdn.com/cache/w300/ts/product/c3/fa/d9/0daf3efeabd1ea93b14aaaa1e2a7e92b.jpg,https://salt.tikicdn.com/cache/200x280/ts/product/c3/fa/d9/0daf3efeabd1ea93b14aaaa1e2a7e92b.jpg,https://salt.tikicdn.com/cache/200x280/ts/product/c3/fa/d9/0daf3efeabd1ea93b14aaaa1e2a7e92b.jpg,1000,0
263336412,Lily the Rainforest Fairy,145000,Quy cách: bìa mềmNgôn ngữ: tiếng Anh####For use in schools and libraries only. The fairies are going green! The fairy king and queen have just put together a new team of seven fairies for a very sp...,"Quy cách : bìa mềm Ngôn ngữ : tiếng Anh #### For use in schools and libraries only. The fairies are going green! The fairy king and queen have just put together a new team of seven fairies for a very special mission. They are the Earth Fairies! Together, they're going to work their magic to clean up the environment. But they can't do it alone. Luckily, Rachel and Kirsty are ready to help! Lily the Rainforest Fairy whisks the girls away to a tropical forest to find her wand. Lily needs her wand to save the rainforest-and to get Rachel and Kirsty home safe again. Find the missing magic wand in each book and help save the environment Giá sản phẩm trên Tiki đã bao gồm thuế theo luật hiện hành. Bên cạnh đó, tuỳ vào loại sản phẩm, hình thức và địa chỉ giao hàng mà có thể phát sinh thêm chi phí khác như phí vận chuyển, phụ phí hàng cồng kềnh, thuế nhập khẩu (đối với đơn hàng giao từ nước ngoài có giá trị trên 1 triệu đồng).....",0,0,https://salt.tikicdn.com/ts/product/a8/02/63/d1138d3605f3e5c32b4ea27132bc41e4.jpg,https://salt.tikicdn.com/cache/w1200/ts/product/a8/02/63/d1138d3605f3e5c32b4ea27132bc41e4.jpg,https://salt.tikicdn.com/cache/w300/ts/product/a8/02/63/d1138d3605f3e5c32b4ea27132bc41e4.jpg,https://salt.tikicdn.com/cache/200x280/ts/product/a8/02/63/d1138d3605f3e5c32b4ea27132bc41e4.jpg,https://salt.tikicdn.com/cache/200x280/ts/product/a8/02/63/d1138d3605f3e5c32b4ea27132bc41e4.jpg,1000,0
263336321,Tess The Sea Turtle Fairy book 4,145000,Quy cách: bìa mềmNgôn ngữ: tiếng Anh####The Ocean Fairies keep all the sea creatures safe and happy -- until their magic goes missing! This is our eleventh group of Rainbow Magic fairies.The Ocean...,"Quy cách : bìa mềm Ngôn ngữ : tiếng Anh #### The Ocean Fairies keep all the sea creatures safe and happy -- until their magic goes missing! This is our eleventh group of Rainbow Magic fairies. The Ocean Fairies keep all the sea creatures safe and happy! But when the goblins shatter their enchanted conch shell, seven magical sea creatures leave to search for the pieces. Giá sản phẩm trên Tiki đã bao gồm thuế theo luật hiện hành. Bên cạnh đó, tuỳ vào loại sản phẩm, hình thức và địa chỉ giao hàng mà có thể phát sinh thêm chi phí khác như phí vận chuyển, phụ phí hàng cồng kềnh, thuế nhập khẩu (đối với đơn hàng giao từ nước ngoài có giá trị trên 1 triệu đồng).....",0,0,https://salt.tikicdn.com/ts/product/63/67/2f/85bfeb1edf80b0a3160fbbfeba4cb38e.jpg,https://salt.tikicdn.com/cache/w1200/ts/product/63/67/2f/85bfeb1edf80b0a3160fbbfeba4cb38e.jpg,https://salt.tikicdn.com/cache/w300/ts/product/63/67/2f/85bfeb1edf80b0a3160fbbfeba4cb38e.jpg,https://salt.tikicdn.com/cache/200x280/ts/product/63/67/2f/85bfeb1edf80b0a3160fbbfeba4cb38e.jpg,https://salt.tikicdn.com/cache/200x280/ts/product/63/67/2f/85bfeb1edf80b0a3160fbbfeba4cb38e.jpg,1000,0
263336255,Edie the Garden Fairy book3,145000,Jack Frost's goblins are trying to prevent the Green Fairies from doing their jobs properly...believing that they are the only green creatures in the world! But Rachel and Kirsty are determined to c...,"Jack Frost's goblins are trying to prevent the Green Fairies from doing their jobs properly...believing that they are the only green creatures in the world! But Rachel and Kirsty are determined to create a nature garden, with the help of Edie the Garden Fairy! Giá sản phẩm trên Tiki đã bao gồm thuế theo luật hiện hành. Bên cạnh đó, tuỳ vào loại sản phẩm, hình thức và địa chỉ giao hàng mà có thể phát sinh thêm chi phí khác như phí vận chuyển, phụ phí hàng cồng kềnh, thuế nhập khẩu (đối với đơn hàng giao từ nước ngoài có giá trị trên 1 triệu đồng).....",0,0,https://salt.tikicdn.com/ts/product/99/63/b1/abf575d6c9553469f4f622420c9fbc33.jpg,https://salt.tikicdn.com/cache/w1200/ts/product/99/63/b1/abf575d6c9553469f4f622420c9fbc33.jpg,https://salt.tikicdn.com/cache/w300/ts/product/99/63/b1/abf575d6c9553469f4f622420c9fbc33.jpg,https://salt.tikicdn.com/cache/200x280/ts/product/99/63/b1/abf575d6c9553469f4f622420c9fbc33.jpg,https://salt.tikicdn.com/cache/200x280/ts/product/99/63/b1/abf575d6c9553469f4f622420c9fbc33.jpg,1000,0
263336149,Rainbow Magic: Isabella the Air Fairy,145000,"Rachel and Kirsty are excited for their holiday - but their hearts sink when they see their favourite beach is covered in litter. They visit the King and Queen of Fairyland , who introduce them to sev...","Rachel and Kirsty are excited for their holiday - but their hearts sink when they see their favourite beach is covered in litter. They visit the King and Queen of Fairyland , who introduce them to seven trainee fairies, the Green Fairies. But then Jack Frost turns up to steal their new wands! Rachel and Kirsty will have to get them back if they want the world to be 'These stories are magic; they turn children into readers!' ReadingZ Read all seven fairy adventures in the Green Fairies set! Nicole the Beach Fairy; Isabella the Air Fairy; Edie the Garden Fairy; Coral the Reef Fairy; Lily the Rainforest Fairy; Milly the River Fairy; Carrie the Snow Cap Fairy. If you like Rainbow Magic, check out Daisy Meadows' other series: Magic Animal Friends and Unicorn Magic! Giá sản phẩm trên Tiki đã bao gồm thuế theo luật hiện hành. Bên cạnh đó, tuỳ vào loại sản phẩm, hình thức và địa chỉ giao hàng mà có thể phát sinh thêm chi phí khác như phí vận chuyển, phụ phí hàng cồng kềnh, thuế nhập khẩu (đối với đơn hàng giao từ nước ngoài có giá trị trên 1 triệu đồng).....",0,0,https://salt.tikicdn.com/ts/product/19/e4/c7/fd4a1df21fdff72c97f1fb147ac52f3d.jpg,https://salt.tikicdn.com/cache/w1200/ts/product/19/e4/c7/fd4a1df21fdff72c97f1fb147ac52f3d.jpg,https://salt.tikicdn.com/cache/w300/ts/product/19/e4/c7/fd4a1df21fdff72c97f1fb147ac52f3d.jpg,https://salt.tikicdn.com/cache/200x280/ts/product/19/e4/c7/fd4a1df21fdff72c97f1fb147ac52f3d.jpg,https://salt.tikicdn.com/cache/200x280/ts/product/19/e4/c7/fd4a1df21fdff72c97f1fb147ac52f3d.jpg,1000,0
263336103,Nicole the Beach Fairy,145000,FOR USE IN SCHOOLS AND LIBRARIES ONLY. The fairies are going green! The fairy king and queen have just put together a new team of seven fairies for a very special mission. They are the Earth Fairies...,"FOR USE IN SCHOOLS AND LIBRARIES ONLY. The fairies are going green! The fairy king and queen have just put together a new team of seven fairies for a very special mission. They are the Earth Fairies! Together, they're going to work their magic to clean up the environment. But they can't do it alone. Luckily, Rachel and Kirsty are ready to help! The beach on Rainspell Island is covered with garbage, and it's putting the sea creatures in danger. But Nicole the Beach Fairy can't do much without her missing magic wand. Can the girls help her track it down? Find the missing magic wand in each book and help save the environment! Giá sản phẩm trên Tiki đã bao gồm thuế theo luật hiện hành. Bên cạnh đó, tuỳ vào loại sản phẩm, hình thức và địa chỉ giao hàng mà có thể phát sinh thêm chi phí khác như phí vận chuyển, phụ phí hàng cồng kềnh, thuế nhập khẩu (đối với đơn hàng giao từ nước ngoài có giá trị trên 1 triệu đồng).....",0,0,https://salt.tikicdn.com/ts/product/42/8b/5c/92570393a65156007cb2a9e5fe2e0771.jpg,https://salt.tikicdn.com/cache/w1200/ts/product/42/8b/5c/92570393a65156007cb2a9e5fe2e0771.jpg,https://salt.tikicdn.com/cache/w300/ts/product/42/8b/5c/92570393a65156007cb2a9e5fe2e0771.jpg,https://salt.tikicdn.com/cache/200x280/ts/product/42/8b/5c/92570393a65156007cb2a9e5fe2e0771.jpg,https://salt.tikicdn.com/cache/200x280/ts/product/42/8b/5c/92570393a65156007cb2a9e5fe2e0771.jpg,1000,0
263336048,Rainbow Magic Nature Fairies Collection 14 copy slipcase,1500000,Quy cách: Bìa mềmNXB: HachetteNgôn ngữ: tiếng Anh####Get ready for an exciting fairy adventure with the no. 1 bestselling series for girls aged 5 and up.The collection includes:Nicole the Beach F...,"Quy cách : Bìa mềm NXB: Hachette Ngôn ngữ: tiếng Anh #### Get ready for an exciting fairy adventure with the no. 1 bestselling series for girls aged 5 and up. The collection includes: Nicole the Beach Fairy Isabella the Air Fairy Edie the Garden Fairy Coral the Reef Fairy Lily the Rainforest Fairy Milly the River Fairy Carrie the Snow Cap Fairy Ally the Dolphin Fairy Amelie the Seal Fairy Pia the Penguin Fairy Tess the Sea Turtle Fairy Stephanie the Starfish Fairy Whitney the Whale Fairy Courtney the Clownfish Fairy Giá sản phẩm trên Tiki đã bao gồm thuế theo luật hiện hành. Bên cạnh đó, tuỳ vào loại sản phẩm, hình thức và địa chỉ giao hàng mà có thể phát sinh thêm chi phí khác như phí vận chuyển, phụ phí hàng cồng kềnh, thuế nhập khẩu (đối với đơn hàng giao từ nước ngoài có giá trị trên 1 triệu đồng).....",0,0,https://salt.tikicdn.com/ts/product/d1/ba/61/e86e5c82530f1672560b099cd6666cf5.jpg,https://salt.tikicdn.com/cache/w1200/ts/product/d1/ba/61/e86e5c82530f1672560b099cd6666cf5.jpg,https://salt.tikicdn.com/cache/w300/ts/product/d1/ba/61/e86e5c82530f1672560b099cd6666cf5.jpg,https://salt.tikicdn.com/cache/200x280/ts/product/d1/ba/61/e86e5c82530f1672560b099cd6666cf5.jpg,https://salt.tikicdn.com/cache/200x280/ts/product/d1/ba/61/e86e5c82530f1672560b099cd6666cf5.jpg,1000,0
