id,name,price,short_description,description,rating_average,review_count,image_base_url,image_large_url,image_medium_url,image_small_url,image_thumbnail_url,stock,quantity_sold
263335987,Athena and The Olive Tree and Other Greek Myths,115000,"Quy cách: bìa mềmNgôn ngữ: tiếng Anh####Athena, goddess of war, and Poseidon, god of the sea, battle for ownership of a brand new city, while Zeus decides it's time to play games with the world's p...","Quy cách : bìa mềm Ngôn ngữ : tiếng Anh #### Athena, goddess of war, and Poseidon, god of the sea, battle for ownership of a brand new city, while Zeus decides it's time to play games with the world's population of mere mortals Giá sản phẩm trên Tiki đã bao gồm thuế theo luật hiện hành. Bên cạnh đó, tuỳ vào loại sản phẩm, hình thức và địa chỉ giao hàng mà có thể phát sinh thêm chi phí khác như phí vận chuyển, phụ phí hàng cồng kềnh, thuế nhập khẩu (đối với đơn hàng giao từ nước ngoài có giá trị trên 1 triệu đồng).....",0,0,https://salt.tikicdn.com/ts/product/44/0b/61/739d22cafea5beac87b85c0a21af2975.jpg,https://salt.tikicdn.com/cache/w1200/ts/product/44/0b/61/739d22cafea5beac87b85c0a21af2975.jpg,https://salt.tikicdn.com/cache/w300/ts/product/44/0b/61/739d22cafea5beac87b85c0a21af2975.jpg,https://salt.tikicdn.com/cache/200x280/ts/product/44/0b/61/739d22cafea5beac87b85c0a21af2975.jpg,https://salt.tikicdn.com/cache/200x280/ts/product/44/0b/61/739d22cafea5beac87b85c0a21af2975.jpg,1000,0
263335836,Jason and the Golden Fleece and Arachne the Spinner,115000,"Quy cách: bìa mềmNgôn ngữ: tiếng Anh####The Argonautica is the dramatic story of Jason's quest for the Golden Fleece and his relations with the dangerous Colchian princess, Medea. The only extant G...","Quy cách : bìa mềm Ngôn ngữ : tiếng Anh #### The Argonautica is the dramatic story of Jason's quest for the Golden Fleece and his relations with the dangerous Colchian princess, Medea. The only extant Greek epic poem to bridge the gap between Homer and late antiquity, it is a major product of the brilliant world of the Ptolemaic court at Alexandria, written by Apollonius of Rhodes in the 3rd century BC. Giá sản phẩm trên Tiki đã bao gồm thuế theo luật hiện hành. Bên cạnh đó, tuỳ vào loại sản phẩm, hình thức và địa chỉ giao hàng mà có thể phát sinh thêm chi phí khác như phí vận chuyển, phụ phí hàng cồng kềnh, thuế nhập khẩu (đối với đơn hàng giao từ nước ngoài có giá trị trên 1 triệu đồng).....",0,0,https://salt.tikicdn.com/ts/product/2c/bb/23/c29a0c02f4cfe3660e4b0c970c6b6177.jpg,https://salt.tikicdn.com/cache/w1200/ts/product/2c/bb/23/c29a0c02f4cfe3660e4b0c970c6b6177.jpg,https://salt.tikicdn.com/cache/w300/ts/product/2c/bb/23/c29a0c02f4cfe3660e4b0c970c6b6177.jpg,https://salt.tikicdn.com/cache/200x280/ts/product/2c/bb/23/c29a0c02f4cfe3660e4b0c970c6b6177.jpg,https://salt.tikicdn.com/cache/200x280/ts/product/2c/bb/23/c29a0c02f4cfe3660e4b0c970c6b6177.jpg,1000,0
263335811,Daedalus and Icarus and King Midas,115000,"Quy cách: bìa mềmNgôn ngữ: tiếng Anh####A retelling of the Greek myths in which Daedalus and Icarus escape from their imprisonment with wings, but boastful Icarus flies too close to the sun, and gr...","Quy cách : bìa mềm Ngôn ngữ : tiếng Anh #### A retelling of the Greek myths in which Daedalus and Icarus escape from their imprisonment with wings, but boastful Icarus flies too close to the sun, and greedy King Midas finds that his wish for gold leads to problems. Giá sản phẩm trên Tiki đã bao gồm thuế theo luật hiện hành. Bên cạnh đó, tuỳ vào loại sản phẩm, hình thức và địa chỉ giao hàng mà có thể phát sinh thêm chi phí khác như phí vận chuyển, phụ phí hàng cồng kềnh, thuế nhập khẩu (đối với đơn hàng giao từ nước ngoài có giá trị trên 1 triệu đồng).....",0,0,https://salt.tikicdn.com/ts/product/3a/b0/71/d8d45d99d23bae81d8181875b39e30b4.jpg,https://salt.tikicdn.com/cache/w1200/ts/product/3a/b0/71/d8d45d99d23bae81d8181875b39e30b4.jpg,https://salt.tikicdn.com/cache/w300/ts/product/3a/b0/71/d8d45d99d23bae81d8181875b39e30b4.jpg,https://salt.tikicdn.com/cache/200x280/ts/product/3a/b0/71/d8d45d99d23bae81d8181875b39e30b4.jpg,https://salt.tikicdn.com/cache/200x280/ts/product/3a/b0/71/d8d45d99d23bae81d8181875b39e30b4.jpg,1000,0
263335693,Persephone and the Pomegranate Seeds and Atalanta's Race,115000,"Quy cách: bìa mềmNgôn ngữ: tiếng Anh####From the bestselling author/illustrator team of Geraldine McCaughrean and Tony Ross, this book explains how Pluto''s love for Persephone caused the seasons t...","Quy cách : bìa mềm Ngôn ngữ : tiếng Anh #### From the bestselling author/illustrator team of Geraldine McCaughrean and Tony Ross, this book explains how Pluto''s love for Persephone caused the seasons to change , and how Atlanta''s hand in marriage is won. ' Từ nhóm tác giả/họa sĩ minh họa có sách bán chạy nhất gồm Geraldine McCaughrean và Tony Ross, cuốn sách này giải thích tình yêu của Sao Diêm Vương dành cho Persephone đã khiến các mùa thay đổi như thế nào và hôn nhân của Atlanta đã chiến thắng như thế nào. Giá sản phẩm trên Tiki đã bao gồm thuế theo luật hiện hành. Bên cạnh đó, tuỳ vào loại sản phẩm, hình thức và địa chỉ giao hàng mà có thể phát sinh thêm chi phí khác như phí vận chuyển, phụ phí hàng cồng kềnh, thuế nhập khẩu (đối với đơn hàng giao từ nước ngoài có giá trị trên 1 triệu đồng).....",0,0,https://salt.tikicdn.com/ts/product/a7/89/28/cd9a57fb8c2b6ce4c2ab33cf36246603.jpg,https://salt.tikicdn.com/cache/w1200/ts/product/a7/89/28/cd9a57fb8c2b6ce4c2ab33cf36246603.jpg,https://salt.tikicdn.com/cache/w300/ts/product/a7/89/28/cd9a57fb8c2b6ce4c2ab33cf36246603.jpg,https://salt.tikicdn.com/cache/200x280/ts/product/a7/89/28/cd9a57fb8c2b6ce4c2ab33cf36246603.jpg,https://salt.tikicdn.com/cache/200x280/ts/product/a7/89/28/cd9a57fb8c2b6ce4c2ab33cf36246603.jpg,1000,0
263335563,Perseus and The Gorgon Medusa,115000,"Quy cách: bìa mềmNgôn ngữ: tiếng Anh####A retelling of the Greek tale of how Perseus, a good and brave young man, is helped by the gods to cut off the head of the monster Gorgon Medusa. Kể lại câ...","Quy cách : bìa mềm Ngôn ngữ : tiếng Anh #### A retelling of the Greek tale of how Perseus, a good and brave young man, is helped by the gods to cut off the head of the monster Gorgon Medusa. Kể lại câu chuyện Hy Lạp về Perseus, một chàng trai tốt bụng và dũng cảm, được các vị thần giúp đỡ để chặt đầu quái vật Gorgon Medusa. Giá sản phẩm trên Tiki đã bao gồm thuế theo luật hiện hành. Bên cạnh đó, tuỳ vào loại sản phẩm, hình thức và địa chỉ giao hàng mà có thể phát sinh thêm chi phí khác như phí vận chuyển, phụ phí hàng cồng kềnh, thuế nhập khẩu (đối với đơn hàng giao từ nước ngoài có giá trị trên 1 triệu đồng).....",0,0,https://salt.tikicdn.com/ts/product/ca/89/c7/f072de0b18c8d7422933797f08cbaa0c.jpg,https://salt.tikicdn.com/cache/w1200/ts/product/ca/89/c7/f072de0b18c8d7422933797f08cbaa0c.jpg,https://salt.tikicdn.com/cache/w300/ts/product/ca/89/c7/f072de0b18c8d7422933797f08cbaa0c.jpg,https://salt.tikicdn.com/cache/200x280/ts/product/ca/89/c7/f072de0b18c8d7422933797f08cbaa0c.jpg,https://salt.tikicdn.com/cache/200x280/ts/product/ca/89/c7/f072de0b18c8d7422933797f08cbaa0c.jpg,1000,0
263335532,A Shot In The Dark and The Taming of Venus,115000,Quy cách: bìa mềmNgôn ngữ: tiếng Anh####Roman Myths is a series of books that retells stories from Roman mythology. Each volume is illustrated and all the stories are taken from the Orchard Book o...,"Quy cách : bìa mềm Ngôn ngữ : tiếng Anh #### Roman Myths is a series of books that retells stories from Roman mythology. Each volume is illustrated and all the stories are taken from the Orchard Book of Roman Myths. Thần thoại La Mã là một bộ sách kể lại những câu chuyện trong thần thoại La Mã. Mỗi tập đều được minh họa và tất cả các câu chuyện được lấy từ Sách Thần thoại La Mã của Orchard Giá sản phẩm trên Tiki đã bao gồm thuế theo luật hiện hành. Bên cạnh đó, tuỳ vào loại sản phẩm, hình thức và địa chỉ giao hàng mà có thể phát sinh thêm chi phí khác như phí vận chuyển, phụ phí hàng cồng kềnh, thuế nhập khẩu (đối với đơn hàng giao từ nước ngoài có giá trị trên 1 triệu đồng).....",0,0,https://salt.tikicdn.com/ts/product/f9/05/09/b77177e31b5fc59084bdec0057a69313.jpg,https://salt.tikicdn.com/cache/w1200/ts/product/f9/05/09/b77177e31b5fc59084bdec0057a69313.jpg,https://salt.tikicdn.com/cache/w300/ts/product/f9/05/09/b77177e31b5fc59084bdec0057a69313.jpg,https://salt.tikicdn.com/cache/200x280/ts/product/f9/05/09/b77177e31b5fc59084bdec0057a69313.jpg,https://salt.tikicdn.com/cache/200x280/ts/product/f9/05/09/b77177e31b5fc59084bdec0057a69313.jpg,1000,0
263255866,Phaeton and The Sun Chariot and Other Greek Myths,115000,"Richard Brassey is the author and illustrator of a host of colourful and original non-fiction books for children, among them the bestselling Nessie the Loch Ness Monster and The Story of Scotland, whi...","Richard Brassey is the author and illustrator of a host of colourful and original non-fiction books for children, among them the bestselling Nessie the Loch Ness Monster and The Story of Scotland, which won the TES/Saltire Society Award. He lives in Essex. Geraldine McCaughrean's novels and retellings for children have won her the Carnegie Medal, the Guardian Children's Fiction Award, the Whitbread Award and the Beefeater Award. A prolific author who writes for all ages, she lives in Berkshire with her husband and young daughter Ailsa. Richard Brassey is an extraordinarily versatile author-artist whose bestselling title is NESSIE THE LOCH NESS MONSTER. He lives in London with his American wife and his 10-year-old son George. Giá sản phẩm trên Tiki đã bao gồm thuế theo luật hiện hành. Bên cạnh đó, tuỳ vào loại sản phẩm, hình thức và địa chỉ giao hàng mà có thể phát sinh thêm chi phí khác như phí vận chuyển, phụ phí hàng cồng kềnh, thuế nhập khẩu (đối với đơn hàng giao từ nước ngoài có giá trị trên 1 triệu đồng).....",0,0,https://salt.tikicdn.com/ts/product/45/ea/30/3c5796ce9f1081377b391598b3084de0.jpg,https://salt.tikicdn.com/cache/w1200/ts/product/45/ea/30/3c5796ce9f1081377b391598b3084de0.jpg,https://salt.tikicdn.com/cache/w300/ts/product/45/ea/30/3c5796ce9f1081377b391598b3084de0.jpg,https://salt.tikicdn.com/cache/200x280/ts/product/45/ea/30/3c5796ce9f1081377b391598b3084de0.jpg,https://salt.tikicdn.com/cache/200x280/ts/product/45/ea/30/3c5796ce9f1081377b391598b3084de0.jpg,1000,0
263255714,Burning The Books and Other Roman Myths,115000,Quy cách: bìa mềmNgôn ngữ: tiếng Anh####Tells the story a foolish King is too proud to buy books from the ancient Sibyl.  Kể câu chuyện về một vị vua ngu ngốc quá tự hào khi mua sách từ Sibyl cổ...,"Quy cách : bìa mềm Ngôn ngữ : tiếng Anh #### Tells the story a foolish King is too proud to buy books from the ancient Sibyl. Kể câu chuyện về một vị vua ngu ngốc quá tự hào khi mua sách từ Sibyl cổ đại. Giá sản phẩm trên Tiki đã bao gồm thuế theo luật hiện hành. Bên cạnh đó, tuỳ vào loại sản phẩm, hình thức và địa chỉ giao hàng mà có thể phát sinh thêm chi phí khác như phí vận chuyển, phụ phí hàng cồng kềnh, thuế nhập khẩu (đối với đơn hàng giao từ nước ngoài có giá trị trên 1 triệu đồng).....",0,0,https://salt.tikicdn.com/ts/product/f0/2f/d8/573e41e5f6f652421fe05c9ccafdda98.jpg,https://salt.tikicdn.com/cache/w1200/ts/product/f0/2f/d8/573e41e5f6f652421fe05c9ccafdda98.jpg,https://salt.tikicdn.com/cache/w300/ts/product/f0/2f/d8/573e41e5f6f652421fe05c9ccafdda98.jpg,https://salt.tikicdn.com/cache/200x280/ts/product/f0/2f/d8/573e41e5f6f652421fe05c9ccafdda98.jpg,https://salt.tikicdn.com/cache/200x280/ts/product/f0/2f/d8/573e41e5f6f652421fe05c9ccafdda98.jpg,1000,0
263255647,The Adventures of Odysseus,115000,"Quy cách: bìa mềmNgôn ngữ: tiếng Anh####Odysseus makes the perilous journey homeward, facing the Cyclops and the angry sea god Poseidon along the way. 5-8 yrs. Odysseus thực hiện hành trình đầy n...","Quy cách : bìa mềm Ngôn ngữ : tiếng Anh #### Odysseus makes the perilous journey homeward, facing the Cyclops and the angry sea god Poseidon along the way. 5-8 yrs. Odysseus thực hiện hành trình đầy nguy hiểm trở về nhà, đối mặt với Cyclops và vị thần biển giận dữ Poseidon trên đường đi. Dành cho lứa tuổi 5-8 tuổi. Giá sản phẩm trên Tiki đã bao gồm thuế theo luật hiện hành. Bên cạnh đó, tuỳ vào loại sản phẩm, hình thức và địa chỉ giao hàng mà có thể phát sinh thêm chi phí khác như phí vận chuyển, phụ phí hàng cồng kềnh, thuế nhập khẩu (đối với đơn hàng giao từ nước ngoài có giá trị trên 1 triệu đồng).....",0,0,https://salt.tikicdn.com/ts/product/0d/54/31/fabdcbbf13e097e2462efc703ce01608.jpg,https://salt.tikicdn.com/cache/w1200/ts/product/0d/54/31/fabdcbbf13e097e2462efc703ce01608.jpg,https://salt.tikicdn.com/cache/w300/ts/product/0d/54/31/fabdcbbf13e097e2462efc703ce01608.jpg,https://salt.tikicdn.com/cache/200x280/ts/product/0d/54/31/fabdcbbf13e097e2462efc703ce01608.jpg,https://salt.tikicdn.com/cache/200x280/ts/product/0d/54/31/fabdcbbf13e097e2462efc703ce01608.jpg,1000,0
263253199,City of Dreams and Adventures in the Underworld,115000,Quy cách: bìa mềmNgôn ngữ: tiếng Anh####Read about Aeneas' epic journey from the fall of Troy to Italy.Đọc về cuộc hành trình sử thi của Aeneas từ sự sụp đổ của thành Troy đến Ý....,"Quy cách : bìa mềm Ngôn ngữ : tiếng Anh #### Read about Aeneas' epic journey from the fall of Troy to Italy. Đọc về cuộc hành trình sử thi của Aeneas từ sự sụp đổ của thành Troy đến Ý. Giá sản phẩm trên Tiki đã bao gồm thuế theo luật hiện hành. Bên cạnh đó, tuỳ vào loại sản phẩm, hình thức và địa chỉ giao hàng mà có thể phát sinh thêm chi phí khác như phí vận chuyển, phụ phí hàng cồng kềnh, thuế nhập khẩu (đối với đơn hàng giao từ nước ngoài có giá trị trên 1 triệu đồng).....",0,0,https://salt.tikicdn.com/ts/product/aa/f4/83/0d332f0443bce1e5d42a4557b90dd206.jpg,https://salt.tikicdn.com/cache/w1200/ts/product/aa/f4/83/0d332f0443bce1e5d42a4557b90dd206.jpg,https://salt.tikicdn.com/cache/w300/ts/product/aa/f4/83/0d332f0443bce1e5d42a4557b90dd206.jpg,https://salt.tikicdn.com/cache/200x280/ts/product/aa/f4/83/0d332f0443bce1e5d42a4557b90dd206.jpg,https://salt.tikicdn.com/cache/200x280/ts/product/aa/f4/83/0d332f0443bce1e5d42a4557b90dd206.jpg,1000,0
263247528,The Twelve Labours Of Heracles,115000,Quy cách: bìa mềmNgôn ngữ: tiếng Anh####Read about the great feats of Hercules. Includes the story of Echo and Narcissus.Đọc về những chiến công vĩ đại của Hercules. Bao gồm câu chuyện về Echo và ...,"Quy cách : bìa mềm Ngôn ngữ : tiếng Anh #### Read about the great feats of Hercules. Includes the story of Echo and Narcissus. Đọc về những chiến công vĩ đại của Hercules. Bao gồm câu chuyện về Echo và Narcissus. Giá sản phẩm trên Tiki đã bao gồm thuế theo luật hiện hành. Bên cạnh đó, tuỳ vào loại sản phẩm, hình thức và địa chỉ giao hàng mà có thể phát sinh thêm chi phí khác như phí vận chuyển, phụ phí hàng cồng kềnh, thuế nhập khẩu (đối với đơn hàng giao từ nước ngoài có giá trị trên 1 triệu đồng).....",0,0,https://salt.tikicdn.com/ts/product/6e/a9/f6/f1d1c1a006a92f453d7d0ff065beaf1e.jpg,https://salt.tikicdn.com/cache/w1200/ts/product/6e/a9/f6/f1d1c1a006a92f453d7d0ff065beaf1e.jpg,https://salt.tikicdn.com/cache/w300/ts/product/6e/a9/f6/f1d1c1a006a92f453d7d0ff065beaf1e.jpg,https://salt.tikicdn.com/cache/200x280/ts/product/6e/a9/f6/f1d1c1a006a92f453d7d0ff065beaf1e.jpg,https://salt.tikicdn.com/cache/200x280/ts/product/6e/a9/f6/f1d1c1a006a92f453d7d0ff065beaf1e.jpg,1000,0
263246860,Romulus and Remus and Stolen Wives,115000,"Quy cách: bìa mềmNgôn ngữ: tiếng Anh####Lively, entertaining and accessible, these retellings of stories from Roman mythology feature famous gods and goddesses, and familiar Italian locations. Vivi...","Quy cách : bìa mềm Ngôn ngữ : tiếng Anh #### Lively, entertaining and accessible, these retellings of stories from Roman mythology feature famous gods and goddesses, and familiar Italian locations. Vividly brought to life by Tony Ross's much-loved illustrations, all of these stories are taken from the successful Orchard Book of Roman Myths. Romulus and Remus/Stolen Famous story of the quarrelsome twin brothers, Romulus and Remus, who are raised by a she-wolf, and grow up to create the city of Rome. And read how Rome became peopled with women in Stolen Wives. Giá sản phẩm trên Tiki đã bao gồm thuế theo luật hiện hành. Bên cạnh đó, tuỳ vào loại sản phẩm, hình thức và địa chỉ giao hàng mà có thể phát sinh thêm chi phí khác như phí vận chuyển, phụ phí hàng cồng kềnh, thuế nhập khẩu (đối với đơn hàng giao từ nước ngoài có giá trị trên 1 triệu đồng).....",0,0,https://salt.tikicdn.com/ts/product/5b/92/c0/93fc56b6efd629aea3455688e1a80403.jpg,https://salt.tikicdn.com/cache/w1200/ts/product/5b/92/c0/93fc56b6efd629aea3455688e1a80403.jpg,https://salt.tikicdn.com/cache/w300/ts/product/5b/92/c0/93fc56b6efd629aea3455688e1a80403.jpg,https://salt.tikicdn.com/cache/200x280/ts/product/5b/92/c0/93fc56b6efd629aea3455688e1a80403.jpg,https://salt.tikicdn.com/cache/200x280/ts/product/5b/92/c0/93fc56b6efd629aea3455688e1a80403.jpg,1000,0
263246586,The Wooden Horse,115000,"McCaughrean has retold many classic stories, including The Canterbury Tales and The Arabian Nights. In t his volume, she retells the story of the ending of the Battl e of Troy. She also reveals how Pa...","McCaughrean has retold many classic stories, including The Canterbury Tales and The Arabian Nights. In t his volume, she retells the story of the ending of the Battl e of Troy. She also reveals how Pandora''s curiosity brought cruelty into the world. Giá sản phẩm trên Tiki đã bao gồm thuế theo luật hiện hành. Bên cạnh đó, tuỳ vào loại sản phẩm, hình thức và địa chỉ giao hàng mà có thể phát sinh thêm chi phí khác như phí vận chuyển, phụ phí hàng cồng kềnh, thuế nhập khẩu (đối với đơn hàng giao từ nước ngoài có giá trị trên 1 triệu đồng).....",0,0,https://salt.tikicdn.com/ts/product/df/18/7f/2528da29bb628546e8eea6dba8f2caf3.jpg,https://salt.tikicdn.com/cache/w1200/ts/product/df/18/7f/2528da29bb628546e8eea6dba8f2caf3.jpg,https://salt.tikicdn.com/cache/w300/ts/product/df/18/7f/2528da29bb628546e8eea6dba8f2caf3.jpg,https://salt.tikicdn.com/cache/200x280/ts/product/df/18/7f/2528da29bb628546e8eea6dba8f2caf3.jpg,https://salt.tikicdn.com/cache/200x280/ts/product/df/18/7f/2528da29bb628546e8eea6dba8f2caf3.jpg,1000,0
263075860,Gangsta Granny Strikes Again!,249000,"Quy cách: bìa mềmNgôn ngữ: tiếng Anh####'Walliams balances high comedy with an emotional message' Daily Mail'Walliams does comedy with profound, genuine heart' GuardianFrom No. 1 bestselling autho...","Quy cách : bìa mềm Ngôn ngữ : tiếng Anh #### 'Walliams balances high comedy with an emotional message' Daily Mail 'Walliams does comedy with profound, genuine heart' Guardian From No. 1 bestselling author David Walliams - an extraordinarily brilliant and rollicking mystery adventure illustrated by artistic genius, Tony Ross, and the sequel to the much-loved Gangsta Granny. Giá sản phẩm trên Tiki đã bao gồm thuế theo luật hiện hành. Bên cạnh đó, tuỳ vào loại sản phẩm, hình thức và địa chỉ giao hàng mà có thể phát sinh thêm chi phí khác như phí vận chuyển, phụ phí hàng cồng kềnh, thuế nhập khẩu (đối với đơn hàng giao từ nước ngoài có giá trị trên 1 triệu đồng).....",5,1,https://salt.tikicdn.com/ts/product/54/1a/3c/a8b79c7187d3769d2b5b2a734ffad2e1.jpg,https://salt.tikicdn.com/cache/w1200/ts/product/54/1a/3c/a8b79c7187d3769d2b5b2a734ffad2e1.jpg,https://salt.tikicdn.com/cache/w300/ts/product/54/1a/3c/a8b79c7187d3769d2b5b2a734ffad2e1.jpg,https://salt.tikicdn.com/cache/200x280/ts/product/54/1a/3c/a8b79c7187d3769d2b5b2a734ffad2e1.jpg,https://salt.tikicdn.com/cache/200x280/ts/product/54/1a/3c/a8b79c7187d3769d2b5b2a734ffad2e1.jpg,1000,1
263056323,Mr. Men Little Miss: Try Again,149000,An inspiring and engaging Mr Men Little Miss story about self-esteem and resilience.  Một câu chuyện Mr Men Little Miss đầy cảm hứng và hấp dẫn về lòng tự trọng và khả năng phục hồi....,"An inspiring and engaging Mr Men Little Miss story about self-esteem and resilience. Một câu chuyện Mr Men Little Miss đầy cảm hứng và hấp dẫn về lòng tự trọng và khả năng phục hồi. Giá sản phẩm trên Tiki đã bao gồm thuế theo luật hiện hành. Bên cạnh đó, tuỳ vào loại sản phẩm, hình thức và địa chỉ giao hàng mà có thể phát sinh thêm chi phí khác như phí vận chuyển, phụ phí hàng cồng kềnh, thuế nhập khẩu (đối với đơn hàng giao từ nước ngoài có giá trị trên 1 triệu đồng).....",0,0,https://salt.tikicdn.com/ts/product/eb/81/aa/2bbb1c62b7e5cd55e17e89556b5731d5.jpg,https://salt.tikicdn.com/cache/w1200/ts/product/eb/81/aa/2bbb1c62b7e5cd55e17e89556b5731d5.jpg,https://salt.tikicdn.com/cache/w300/ts/product/eb/81/aa/2bbb1c62b7e5cd55e17e89556b5731d5.jpg,https://salt.tikicdn.com/cache/200x280/ts/product/eb/81/aa/2bbb1c62b7e5cd55e17e89556b5731d5.jpg,https://salt.tikicdn.com/cache/200x280/ts/product/eb/81/aa/2bbb1c62b7e5cd55e17e89556b5731d5.jpg,1000,0
263056106,Mr. Men Little Miss: Be Kind,149000,A fun and engaging Mr Men Little Miss story about the power of kindness and the happiness it brings. Shipping may be from multiple locations in the US or from the UK...,"A fun and engaging Mr Men Little Miss story about the power of kindness and the happiness it brings. Shipping may be from multiple locations in the US or from the UK Giá sản phẩm trên Tiki đã bao gồm thuế theo luật hiện hành. Bên cạnh đó, tuỳ vào loại sản phẩm, hình thức và địa chỉ giao hàng mà có thể phát sinh thêm chi phí khác như phí vận chuyển, phụ phí hàng cồng kềnh, thuế nhập khẩu (đối với đơn hàng giao từ nước ngoài có giá trị trên 1 triệu đồng).....",0,0,https://salt.tikicdn.com/ts/product/2c/b1/9c/619c1ceb4c76cefd05daf62b14936286.jpg,https://salt.tikicdn.com/cache/w1200/ts/product/2c/b1/9c/619c1ceb4c76cefd05daf62b14936286.jpg,https://salt.tikicdn.com/cache/w300/ts/product/2c/b1/9c/619c1ceb4c76cefd05daf62b14936286.jpg,https://salt.tikicdn.com/cache/200x280/ts/product/2c/b1/9c/619c1ceb4c76cefd05daf62b14936286.jpg,https://salt.tikicdn.com/cache/200x280/ts/product/2c/b1/9c/619c1ceb4c76cefd05daf62b14936286.jpg,1000,0
262783321,Code Name Bananas,249000,"Go back in time with No. 1 bestselling author David Walliams for a whizz-bang epic adventure of action, laughter and secret plots – and the extraordinary friendship between a little boy and a huge gor...","Go back in time with No. 1 bestselling author David Walliams for a whizz-bang epic adventure of action, laughter and secret plots – and the extraordinary friendship between a little boy and a huge gorilla that just might save the day… 1940. Britain is at war with Germany. Eleven-year-old Eric spends his days at the place that makes him most happy: London Zoo. And there’s one animal in particular he loves: Gertrude the gorilla. With bombs falling all over London, Eric must rescue Gertrude. Together with his Uncle Sid, a keeper at the zoo, the three go on the run. But while hiding out at the seaside they uncover a top-secret plot… Giá sản phẩm trên Tiki đã bao gồm thuế theo luật hiện hành. Bên cạnh đó, tuỳ vào loại sản phẩm, hình thức và địa chỉ giao hàng mà có thể phát sinh thêm chi phí khác như phí vận chuyển, phụ phí hàng cồng kềnh, thuế nhập khẩu (đối với đơn hàng giao từ nước ngoài có giá trị trên 1 triệu đồng).....",0,0,https://salt.tikicdn.com/ts/product/73/c4/a8/a0bd80c4cf2414d0852a70059e5bf46e.jpg,https://salt.tikicdn.com/cache/w1200/ts/product/73/c4/a8/a0bd80c4cf2414d0852a70059e5bf46e.jpg,https://salt.tikicdn.com/cache/w300/ts/product/73/c4/a8/a0bd80c4cf2414d0852a70059e5bf46e.jpg,https://salt.tikicdn.com/cache/200x280/ts/product/73/c4/a8/a0bd80c4cf2414d0852a70059e5bf46e.jpg,https://salt.tikicdn.com/cache/200x280/ts/product/73/c4/a8/a0bd80c4cf2414d0852a70059e5bf46e.jpg,1000,0
