id,name,price,short_description,description,rating_average,review_count,image_base_url,image_large_url,image_medium_url,image_small_url,image_thumbnail_url,stock,quantity_sold
263337917,Coral The Reef Fairy,145000,"Quy cách: bìa mềmNgôn ngữ: tiếng Anh####The fairy king and queen have just put together a new team of seven fairies for a very special mission. They are the Earth Fairies! Together, they're going t...","Quy cách : bìa mềm Ngôn ngữ : tiếng Anh #### The fairy king and queen have just put together a new team of seven fairies for a very special mission. They are the Earth Fairies! Together, they're going to work their magic to clean up the environment. But they can't do it alone. Luckily, Rachel and Kirsty are ready to help!Coral the Reef Fairy's magic keeps the reef environment healthy. But Jack Frost's goblins have her wand and underwater environments everywhere are in trouble. Can Rachel and Kirsty find the wand and put an end to Jack Frost's plans? Find the missing magic wand in each book and help save the environment! Giá sản phẩm trên Tiki đã bao gồm thuế theo luật hiện hành. Bên cạnh đó, tuỳ vào loại sản phẩm, hình thức và địa chỉ giao hàng mà có thể phát sinh thêm chi phí khác như phí vận chuyển, phụ phí hàng cồng kềnh, thuế nhập khẩu (đối với đơn hàng giao từ nước ngoài có giá trị trên 1 triệu đồng).....",0,0,https://salt.tikicdn.com/ts/product/2f/17/10/b8f3d43c83dbc8b0c8a272765b61f713.jpg,https://salt.tikicdn.com/cache/w1200/ts/product/2f/17/10/b8f3d43c83dbc8b0c8a272765b61f713.jpg,https://salt.tikicdn.com/cache/w300/ts/product/2f/17/10/b8f3d43c83dbc8b0c8a272765b61f713.jpg,https://salt.tikicdn.com/cache/200x280/ts/product/2f/17/10/b8f3d43c83dbc8b0c8a272765b61f713.jpg,https://salt.tikicdn.com/cache/200x280/ts/product/2f/17/10/b8f3d43c83dbc8b0c8a272765b61f713.jpg,1000,0
263336942,Amelie the Seal Fairy,145000,Quy cách: bìa mềmNgôn ngữ: tiếng Anh####The Ocean Fairies keep all the sea creatures safe and happy -- until their magic goes missing! This is our eleventh group of Rainbow Magic fairies.The Ocean...,"Quy cách : bìa mềm Ngôn ngữ : tiếng Anh #### The Ocean Fairies keep all the sea creatures safe and happy -- until their magic goes missing! This is our eleventh group of Rainbow Magic fairies. The Ocean Fairies keep all the sea creatures safe and happy! But when the goblins shatter their enchanted conch shell, seven magical sea creatures leave to search for Giá sản phẩm trên Tiki đã bao gồm thuế theo luật hiện hành. Bên cạnh đó, tuỳ vào loại sản phẩm, hình thức và địa chỉ giao hàng mà có thể phát sinh thêm chi phí khác như phí vận chuyển, phụ phí hàng cồng kềnh, thuế nhập khẩu (đối với đơn hàng giao từ nước ngoài có giá trị trên 1 triệu đồng).....",0,0,https://salt.tikicdn.com/ts/product/c5/26/97/b1bdacc489e410bca388844985561e0b.jpg,https://salt.tikicdn.com/cache/w1200/ts/product/c5/26/97/b1bdacc489e410bca388844985561e0b.jpg,https://salt.tikicdn.com/cache/w300/ts/product/c5/26/97/b1bdacc489e410bca388844985561e0b.jpg,https://salt.tikicdn.com/cache/200x280/ts/product/c5/26/97/b1bdacc489e410bca388844985561e0b.jpg,https://salt.tikicdn.com/cache/200x280/ts/product/c5/26/97/b1bdacc489e410bca388844985561e0b.jpg,1000,0
263336599,Carrie the Snow Cap Fairy book 7,145000,Quy cách: bìa mềmNgôn ngữ: tiếng Anh####The fairies are going green!The fairy king and queen have just put together a new team of seven fairies for a very special mission. They are the Earth Fairi...,"Quy cách : bìa mềm Ngôn ngữ : tiếng Anh #### The fairies are going green! The fairy king and queen have just put together a new team of seven fairies for a very special mission. They are the Earth Fairies! Together, they're going to work their magic to clean up the environment. But they can't do it alone. Luckily, Rachel and Kirsty are ready to help Giá sản phẩm trên Tiki đã bao gồm thuế theo luật hiện hành. Bên cạnh đó, tuỳ vào loại sản phẩm, hình thức và địa chỉ giao hàng mà có thể phát sinh thêm chi phí khác như phí vận chuyển, phụ phí hàng cồng kềnh, thuế nhập khẩu (đối với đơn hàng giao từ nước ngoài có giá trị trên 1 triệu đồng).....",0,0,https://salt.tikicdn.com/ts/product/e1/03/05/f70a51b97ab3f81f4c95a711ba5c4830.jpg,https://salt.tikicdn.com/cache/w1200/ts/product/e1/03/05/f70a51b97ab3f81f4c95a711ba5c4830.jpg,https://salt.tikicdn.com/cache/w300/ts/product/e1/03/05/f70a51b97ab3f81f4c95a711ba5c4830.jpg,https://salt.tikicdn.com/cache/200x280/ts/product/e1/03/05/f70a51b97ab3f81f4c95a711ba5c4830.jpg,https://salt.tikicdn.com/cache/200x280/ts/product/e1/03/05/f70a51b97ab3f81f4c95a711ba5c4830.jpg,1000,0
263335760,Hermes Tricks The Gods and Other Greek Myths,115000,"Quy cách: bìa mềmNgôn ngữ: tiếng Anh####These powerful and drama-packed retellings feature a host of well-known Greek gods and goddesses, magically brought to life by Tony Ross's lively illustratio...","Quy cách : bìa mềm Ngôn ngữ : tiếng Anh #### These powerful and drama-packed retellings feature a host of well-known Greek gods and goddesses, magically brought to life by Tony Ross's lively illustrations. Hermes Tricks the Gods/Two Loves of Apollo/Halcyone Days: Jokey little Hermes brings a smile to everyone's face. But it's destined to all end in tears for Apollo. Giá sản phẩm trên Tiki đã bao gồm thuế theo luật hiện hành. Bên cạnh đó, tuỳ vào loại sản phẩm, hình thức và địa chỉ giao hàng mà có thể phát sinh thêm chi phí khác như phí vận chuyển, phụ phí hàng cồng kềnh, thuế nhập khẩu (đối với đơn hàng giao từ nước ngoài có giá trị trên 1 triệu đồng).....",0,0,https://salt.tikicdn.com/ts/product/79/ea/b5/4cc509f36f1e657703c1cb26eacad382.jpg,https://salt.tikicdn.com/cache/w1200/ts/product/79/ea/b5/4cc509f36f1e657703c1cb26eacad382.jpg,https://salt.tikicdn.com/cache/w300/ts/product/79/ea/b5/4cc509f36f1e657703c1cb26eacad382.jpg,https://salt.tikicdn.com/cache/200x280/ts/product/79/ea/b5/4cc509f36f1e657703c1cb26eacad382.jpg,https://salt.tikicdn.com/cache/200x280/ts/product/79/ea/b5/4cc509f36f1e657703c1cb26eacad382.jpg,1000,0
204439898, The to All the Boys I've Loved Before Paperback Collection,799000,Quy cách: Bìa mềmNXB: Simon SchusterNgôn ngữ: tiếng Anh####To All the Boys I’ve Loved Before is now a major motion picture streaming on Netflix!New York Times  author Jenny Han’s beloved novels are...,"Quy cách : Bìa mềm NXB: Simon Schuster Ngôn ngữ: tiếng Anh #### To All the Boys I’ve Loved Before is now a major motion picture streaming on Netflix! New York Times author Jenny Han’s beloved novels are now available together in this delightful paperback boxed set! What if all the crushes you ever had found out how you felt about them…all at once? Lara Jean Song keeps her love letters in a hatbox her mother gave her. They aren’t love letters that anyone else wrote for her; these are ones she’s written. One for every boy she’s ever loved—five in all. When she writes, she pours out her heart and soul and says all the things she would never say in real life, because her letters are for her eyes only. Until the day her secret letters are mailed, and suddenly, Lara Jean’s love life goes from imaginary to out of control. This enchanting collection includes paperback editions of To All the Boys I’ve Loved Before ; P.S. I Still Love You ; and Always and Forever, Lara Jean . Giá sản phẩm trên Tiki đã bao gồm thuế theo luật hiện hành. Bên cạnh đó, tuỳ vào loại sản phẩm, hình thức và địa chỉ giao hàng mà có thể phát sinh thêm chi phí khác như phí vận chuyển, phụ phí hàng cồng kềnh, thuế nhập khẩu (đối với đơn hàng giao từ nước ngoài có giá trị trên 1 triệu đồng).....",0,0,https://salt.tikicdn.com/ts/product/3b/da/b4/1964a498cbd534232b9078925cb4b5d1.jpg,https://salt.tikicdn.com/cache/w1200/ts/product/3b/da/b4/1964a498cbd534232b9078925cb4b5d1.jpg,https://salt.tikicdn.com/cache/w300/ts/product/3b/da/b4/1964a498cbd534232b9078925cb4b5d1.jpg,https://salt.tikicdn.com/cache/200x280/ts/product/3b/da/b4/1964a498cbd534232b9078925cb4b5d1.jpg,https://salt.tikicdn.com/cache/200x280/ts/product/3b/da/b4/1964a498cbd534232b9078925cb4b5d1.jpg,1000,0
190755198,Blackout,249000,"The irresistible blockbuster YA romance of summer 2021 by six of the voices in YA, as featured on ITV News.Soon to be a major film & TV franchise for Netflix and produced by Barack and Michelle O...","The irresistible blockbuster YA romance of summer 2021 by six of the voices in YA, as featured on ITV News. Soon to be a major film & TV franchise for Netflix and produced by Barack and Michelle Obama! Perfect for fans of Jenny Han, Netflix's Let it Snow and Bolu Babalola's Love in Colour 'Perfect summer reading' - The Stylist 'Six top authors, including Angie Thomas who wrote The Hate U Give, come together to write a moving story of black teenage love. Perfect for bringing a taste of romance and American city life to your staycation' - The Times 'BLACKOUT is our love letter to love, to New York City, and to Black teens. Our reminder to them that their stories, their joy, their love is valid and worthy of being spotlighted.' Dhonielle Clayton. When a heatwave plunges New York City into darkness, sparks fly for thirteen teenagers caught up in the blackout. A first meeting. Long-time friends. Bitter exes. And maybe the beginning of something When the lights go out, people reveal hidden truths, love blossoms, friendship transforms and new possibilities take flight. Six of today's biggest stars of the YA world, Dhonielle Clayton, Tiffany D. Jackson, Nic Stone, Angie Thomas, Ashley Woodfolk, and Nicola Yoon, bring all the electricity of love to a collection of charming, hilarious and heartbreaking tales that shine the light through the dark. Giá sản phẩm trên Tiki đã bao gồm thuế theo luật hiện hành. Bên cạnh đó, tuỳ vào loại sản phẩm, hình thức và địa chỉ giao hàng mà có thể phát sinh thêm chi phí khác như phí vận chuyển, phụ phí hàng cồng kềnh, thuế nhập khẩu (đối với đơn hàng giao từ nước ngoài có giá trị trên 1 triệu đồng).....",0,0,https://salt.tikicdn.com/ts/product/d2/f7/13/c9ae985cef89d1fc4ea0c0fb54fc0da8.jpg,https://salt.tikicdn.com/cache/w1200/ts/product/d2/f7/13/c9ae985cef89d1fc4ea0c0fb54fc0da8.jpg,https://salt.tikicdn.com/cache/w300/ts/product/d2/f7/13/c9ae985cef89d1fc4ea0c0fb54fc0da8.jpg,https://salt.tikicdn.com/cache/200x280/ts/product/d2/f7/13/c9ae985cef89d1fc4ea0c0fb54fc0da8.jpg,https://salt.tikicdn.com/cache/200x280/ts/product/d2/f7/13/c9ae985cef89d1fc4ea0c0fb54fc0da8.jpg,1000,0
