id,name,price,short_description,description,rating_average,review_count,image_base_url,image_large_url,image_medium_url,image_small_url,image_thumbnail_url,stock,quantity_sold
105665176,Bóp Viết Vải Polyester Stacom 2 Ngăn Hình Unicorn PB-2011A - Màu Xanh Da Trời,68400,"Bóp Viết Vải Polyester Stacom 2 Ngăn Hình Unicorn PB-2011A   Sản phẩm được làm bằng chất liệu vải Polyester chống thấm nước và dễ dàng tẩy rửa khi bị bẩn, bền đẹp dùng để sắp xếp các vật dụng, t...","Bóp Viết Vải Polyester Stacom 2 Ngăn Hình Unicorn PB-2011A Sản phẩm được làm bằng chất liệu vải Polyester chống thấm nước và dễ dàng tẩy rửa khi bị bẩn, bền đẹp dùng để sắp xếp các vật dụng, thuận tiện mang đi mọi lúc mọi nơi. Kích thước nhỏ gọn với hình dáng chữ nhật cùng họa tiết dễ thương. Thiết kế dây khóa kéo chắc chắn, trơn tru, đóng mở dễ dàng, thuận tiện khi sử dụng, độ bền cao. Sản phẩm có 2 ngăn, đủ để chứa tất cả những đồ dùng học tập cần thiết Đây là dòng sản phẩm hộp bút đa năng, thích hợp với đa dạng nhu cầu sử dụng cho mọi đối tượng học sinh - sinh viên, khối văn phòng và gia đình. Giá sản phẩm trên Tiki đã bao gồm thuế theo luật hiện hành. Bên cạnh đó, tuỳ vào loại sản phẩm, hình thức và địa chỉ giao hàng mà có thể phát sinh thêm chi phí khác như phí vận chuyển, phụ phí hàng cồng kềnh, thuế nhập khẩu (đối với đơn hàng giao từ nước ngoài có giá trị trên 1 triệu đồng).....",0,0,"https://salt.tikicdn.com/ts/product/e6/93/a4/035cc7019e5f42c42203b9b7d35109fd.jpg, https://salt.tikicdn.com/ts/product/87/00/ca/31f486e6fd750c2320add1e2d2a16300.jpg, https://salt.tikicdn.com/ts/product/39/f9/4e/282f1227d2a0e42804b503944a330d19.jpg, https://salt.tikicdn.com/ts/product/c9/85/bc/924b940eff99d750fdebd85666022207.jpg","https://salt.tikicdn.com/cache/w1200/ts/product/e6/93/a4/035cc7019e5f42c42203b9b7d35109fd.jpg, https://salt.tikicdn.com/cache/w1200/ts/product/87/00/ca/31f486e6fd750c2320add1e2d2a16300.jpg, https://salt.tikicdn.com/cache/w1200/ts/product/39/f9/4e/282f1227d2a0e42804b503944a330d19.jpg, https://salt.tikicdn.com/cache/w1200/ts/product/c9/85/bc/924b940eff99d750fdebd85666022207.jpg","https://salt.tikicdn.com/cache/w300/ts/product/e6/93/a4/035cc7019e5f42c42203b9b7d35109fd.jpg, https://salt.tikicdn.com/cache/w300/ts/product/87/00/ca/31f486e6fd750c2320add1e2d2a16300.jpg, https://salt.tikicdn.com/cache/w300/ts/product/39/f9/4e/282f1227d2a0e42804b503944a330d19.jpg, https://salt.tikicdn.com/cache/w300/ts/product/c9/85/bc/924b940eff99d750fdebd85666022207.jpg","https://salt.tikicdn.com/cache/200x280/ts/product/e6/93/a4/035cc7019e5f42c42203b9b7d35109fd.jpg, https://salt.tikicdn.com/cache/200x280/ts/product/87/00/ca/31f486e6fd750c2320add1e2d2a16300.jpg, https://salt.tikicdn.com/cache/200x280/ts/product/39/f9/4e/282f1227d2a0e42804b503944a330d19.jpg, https://salt.tikicdn.com/cache/200x280/ts/product/c9/85/bc/924b940eff99d750fdebd85666022207.jpg","https://salt.tikicdn.com/cache/200x280/ts/product/e6/93/a4/035cc7019e5f42c42203b9b7d35109fd.jpg, https://salt.tikicdn.com/cache/200x280/ts/product/87/00/ca/31f486e6fd750c2320add1e2d2a16300.jpg, https://salt.tikicdn.com/cache/200x280/ts/product/39/f9/4e/282f1227d2a0e42804b503944a330d19.jpg, https://salt.tikicdn.com/cache/200x280/ts/product/c9/85/bc/924b940eff99d750fdebd85666022207.jpg",1000,0
105665089,Bóp Viết Vải Polyester Stacom PB-1015 - Màu Cam,49400,"Bóp Viết Vải Polyester Stacom PB-1015   Sản phẩm được làm bằng chất liệu vải Polyester chống thấm nước và dễ dàng tẩy rửa khi bị bẩn, bền đẹp dùng để sắp xếp các vật dụng, thuận tiện mang đi mọi...","Bóp Viết Vải Polyester Stacom PB-1015 Sản phẩm được làm bằng chất liệu vải Polyester chống thấm nước và dễ dàng tẩy rửa khi bị bẩn, bền đẹp dùng để sắp xếp các vật dụng, thuận tiện mang đi mọi lúc mọi nơi. Kích thước nhỏ gọn với hình dáng vuông chữ nhật cùng họa tiết dễ thương. Thiết kế dây khóa kéo chắc chắn, trơn tru, đóng mở dễ dàng, thuận tiện khi sử dụng, độ bền cao. Đây là dòng sản phẩm hộp bút đa năng, thích hợp với đa dạng nhu cầu sử dụng cho mọi đối tượng học sinh - sinh viên, khối văn phòng và gia đình. Giá sản phẩm trên Tiki đã bao gồm thuế theo luật hiện hành. Bên cạnh đó, tuỳ vào loại sản phẩm, hình thức và địa chỉ giao hàng mà có thể phát sinh thêm chi phí khác như phí vận chuyển, phụ phí hàng cồng kềnh, thuế nhập khẩu (đối với đơn hàng giao từ nước ngoài có giá trị trên 1 triệu đồng).....",0,0,"https://salt.tikicdn.com/ts/product/0e/3e/2e/de9ef6a8f3982bfd3a3f28c4bd2a9fe7.jpg, https://salt.tikicdn.com/ts/product/51/de/97/8dd4fc8d43fd5b1abed7f95ae1ddc409.jpg, https://salt.tikicdn.com/ts/product/ea/6a/70/261891d51fbbe880bae2341dbee26215.jpg, https://salt.tikicdn.com/ts/product/18/87/e7/a383d85322ac9a89df89a1b0290d32f2.jpg","https://salt.tikicdn.com/cache/w1200/ts/product/0e/3e/2e/de9ef6a8f3982bfd3a3f28c4bd2a9fe7.jpg, https://salt.tikicdn.com/cache/w1200/ts/product/51/de/97/8dd4fc8d43fd5b1abed7f95ae1ddc409.jpg, https://salt.tikicdn.com/cache/w1200/ts/product/ea/6a/70/261891d51fbbe880bae2341dbee26215.jpg, https://salt.tikicdn.com/cache/w1200/ts/product/18/87/e7/a383d85322ac9a89df89a1b0290d32f2.jpg","https://salt.tikicdn.com/cache/w300/ts/product/0e/3e/2e/de9ef6a8f3982bfd3a3f28c4bd2a9fe7.jpg, https://salt.tikicdn.com/cache/w300/ts/product/51/de/97/8dd4fc8d43fd5b1abed7f95ae1ddc409.jpg, https://salt.tikicdn.com/cache/w300/ts/product/ea/6a/70/261891d51fbbe880bae2341dbee26215.jpg, https://salt.tikicdn.com/cache/w300/ts/product/18/87/e7/a383d85322ac9a89df89a1b0290d32f2.jpg","https://salt.tikicdn.com/cache/200x280/ts/product/0e/3e/2e/de9ef6a8f3982bfd3a3f28c4bd2a9fe7.jpg, https://salt.tikicdn.com/cache/200x280/ts/product/51/de/97/8dd4fc8d43fd5b1abed7f95ae1ddc409.jpg, https://salt.tikicdn.com/cache/200x280/ts/product/ea/6a/70/261891d51fbbe880bae2341dbee26215.jpg, https://salt.tikicdn.com/cache/200x280/ts/product/18/87/e7/a383d85322ac9a89df89a1b0290d32f2.jpg","https://salt.tikicdn.com/cache/200x280/ts/product/0e/3e/2e/de9ef6a8f3982bfd3a3f28c4bd2a9fe7.jpg, https://salt.tikicdn.com/cache/200x280/ts/product/51/de/97/8dd4fc8d43fd5b1abed7f95ae1ddc409.jpg, https://salt.tikicdn.com/cache/200x280/ts/product/ea/6a/70/261891d51fbbe880bae2341dbee26215.jpg, https://salt.tikicdn.com/cache/200x280/ts/product/18/87/e7/a383d85322ac9a89df89a1b0290d32f2.jpg",1000,0
105665087,Bóp Viết Vải Polyester Stacom PB-1015 - Màu Xanh Biển,49400,"Bóp Viết Vải Polyester Stacom PB-1015   Sản phẩm được làm bằng chất liệu vải Polyester chống thấm nước và dễ dàng tẩy rửa khi bị bẩn, bền đẹp dùng để sắp xếp các vật dụng, thuận tiện mang đi mọi...","Bóp Viết Vải Polyester Stacom PB-1015 Sản phẩm được làm bằng chất liệu vải Polyester chống thấm nước và dễ dàng tẩy rửa khi bị bẩn, bền đẹp dùng để sắp xếp các vật dụng, thuận tiện mang đi mọi lúc mọi nơi. Kích thước nhỏ gọn với hình dáng vuông chữ nhật cùng họa tiết dễ thương. Thiết kế dây khóa kéo chắc chắn, trơn tru, đóng mở dễ dàng, thuận tiện khi sử dụng, độ bền cao. Đây là dòng sản phẩm hộp bút đa năng, thích hợp với đa dạng nhu cầu sử dụng cho mọi đối tượng học sinh - sinh viên, khối văn phòng và gia đình. Giá sản phẩm trên Tiki đã bao gồm thuế theo luật hiện hành. Bên cạnh đó, tuỳ vào loại sản phẩm, hình thức và địa chỉ giao hàng mà có thể phát sinh thêm chi phí khác như phí vận chuyển, phụ phí hàng cồng kềnh, thuế nhập khẩu (đối với đơn hàng giao từ nước ngoài có giá trị trên 1 triệu đồng).....",0,0,"https://salt.tikicdn.com/ts/product/e8/73/b8/17af313918d4c140649a5090ec92e701.jpg, https://salt.tikicdn.com/ts/product/49/53/bb/933f696e7c2ba85d94a8e776599fb85d.jpg, https://salt.tikicdn.com/ts/product/a5/68/70/d93f637820252159327dfa24d641662c.jpg, https://salt.tikicdn.com/ts/product/99/13/5b/581c708f96b8eb5e83e59b0cb4bfb79a.jpg","https://salt.tikicdn.com/cache/w1200/ts/product/e8/73/b8/17af313918d4c140649a5090ec92e701.jpg, https://salt.tikicdn.com/cache/w1200/ts/product/49/53/bb/933f696e7c2ba85d94a8e776599fb85d.jpg, https://salt.tikicdn.com/cache/w1200/ts/product/a5/68/70/d93f637820252159327dfa24d641662c.jpg, https://salt.tikicdn.com/cache/w1200/ts/product/99/13/5b/581c708f96b8eb5e83e59b0cb4bfb79a.jpg","https://salt.tikicdn.com/cache/w300/ts/product/e8/73/b8/17af313918d4c140649a5090ec92e701.jpg, https://salt.tikicdn.com/cache/w300/ts/product/49/53/bb/933f696e7c2ba85d94a8e776599fb85d.jpg, https://salt.tikicdn.com/cache/w300/ts/product/a5/68/70/d93f637820252159327dfa24d641662c.jpg, https://salt.tikicdn.com/cache/w300/ts/product/99/13/5b/581c708f96b8eb5e83e59b0cb4bfb79a.jpg","https://salt.tikicdn.com/cache/200x280/ts/product/e8/73/b8/17af313918d4c140649a5090ec92e701.jpg, https://salt.tikicdn.com/cache/200x280/ts/product/49/53/bb/933f696e7c2ba85d94a8e776599fb85d.jpg, https://salt.tikicdn.com/cache/200x280/ts/product/a5/68/70/d93f637820252159327dfa24d641662c.jpg, https://salt.tikicdn.com/cache/200x280/ts/product/99/13/5b/581c708f96b8eb5e83e59b0cb4bfb79a.jpg","https://salt.tikicdn.com/cache/200x280/ts/product/e8/73/b8/17af313918d4c140649a5090ec92e701.jpg, https://salt.tikicdn.com/cache/200x280/ts/product/49/53/bb/933f696e7c2ba85d94a8e776599fb85d.jpg, https://salt.tikicdn.com/cache/200x280/ts/product/a5/68/70/d93f637820252159327dfa24d641662c.jpg, https://salt.tikicdn.com/cache/200x280/ts/product/99/13/5b/581c708f96b8eb5e83e59b0cb4bfb79a.jpg",1000,0
101265407,Bóp Viết Organizing King Morning Glory 84613 - Xám / Vàng,190900,"Bóp Viết Organizing King Morning Glory 84613 - Xám/ Vàng   Bóp viết được làm từ chất liệu vải cao cấp, mềm mại, dễ dàng vệ sinh.   Sản phẩm có màu sắc trung tính, nhẹ nhàng, thích hợp nhiề...","Bóp Viết Organizing King Morning Glory 84613 - Xám/ Vàng Bóp viết được làm từ chất liệu vải cao cấp, mềm mại, dễ dàng vệ sinh. Sản phẩm có màu sắc trung tính, nhẹ nhàng, thích hợp nhiều đối tượng sử dụng. Thiết kế dây khóa kéo chắc chắn, trơn tru, đóng mở dễ dàng. Bóp viết giúp người sử dụng sắp xếp vật dụng cá nhân của mình một cách gọn gàng, ngăn nắp và có thể mang theo bên người để sử dụng vào bất kỳ lúc nào. Giá sản phẩm trên Tiki đã bao gồm thuế theo luật hiện hành. Bên cạnh đó, tuỳ vào loại sản phẩm, hình thức và địa chỉ giao hàng mà có thể phát sinh thêm chi phí khác như phí vận chuyển, phụ phí hàng cồng kềnh, thuế nhập khẩu (đối với đơn hàng giao từ nước ngoài có giá trị trên 1 triệu đồng).....",0,0,"https://salt.tikicdn.com/ts/product/e0/c1/45/4146e0c5e9f3ed025150fc116dca5eb7.jpg, https://salt.tikicdn.com/ts/product/b4/40/e1/548fd5c8a70370824a278533a56bb3a0.jpg, https://salt.tikicdn.com/ts/product/9a/a2/6f/36797c45bccf7e316e8be8f5f20ce5ce.jpg","https://salt.tikicdn.com/cache/w1200/ts/product/e0/c1/45/4146e0c5e9f3ed025150fc116dca5eb7.jpg, https://salt.tikicdn.com/cache/w1200/ts/product/b4/40/e1/548fd5c8a70370824a278533a56bb3a0.jpg, https://salt.tikicdn.com/cache/w1200/ts/product/9a/a2/6f/36797c45bccf7e316e8be8f5f20ce5ce.jpg","https://salt.tikicdn.com/cache/w300/ts/product/e0/c1/45/4146e0c5e9f3ed025150fc116dca5eb7.jpg, https://salt.tikicdn.com/cache/w300/ts/product/b4/40/e1/548fd5c8a70370824a278533a56bb3a0.jpg, https://salt.tikicdn.com/cache/w300/ts/product/9a/a2/6f/36797c45bccf7e316e8be8f5f20ce5ce.jpg","https://salt.tikicdn.com/cache/200x280/ts/product/e0/c1/45/4146e0c5e9f3ed025150fc116dca5eb7.jpg, https://salt.tikicdn.com/cache/200x280/ts/product/b4/40/e1/548fd5c8a70370824a278533a56bb3a0.jpg, https://salt.tikicdn.com/cache/200x280/ts/product/9a/a2/6f/36797c45bccf7e316e8be8f5f20ce5ce.jpg","https://salt.tikicdn.com/cache/200x280/ts/product/e0/c1/45/4146e0c5e9f3ed025150fc116dca5eb7.jpg, https://salt.tikicdn.com/cache/200x280/ts/product/b4/40/e1/548fd5c8a70370824a278533a56bb3a0.jpg, https://salt.tikicdn.com/cache/200x280/ts/product/9a/a2/6f/36797c45bccf7e316e8be8f5f20ce5ce.jpg",1000,0
98133645,Bóp Vải Mùa Hè Ống Tròn G2 YT-2021,51000,"Bóp Vải Mùa Hè Ống Tròn G2 YT-2021   Bóp viết phiên bản đặc biệt dành cho mùa hè 2021 với các họa tiết tươi mát.   Chất liệu Polyester bền đẹp, họa tiết được in bằng kỹ thuật in cao cấp độ bền ...","Bóp Vải Mùa Hè Ống Tròn G2 YT-2021 Bóp viết phiên bản đặc biệt dành cho mùa hè 2021 với các họa tiết tươi mát. Chất liệu Polyester bền đẹp, họa tiết được in bằng kỹ thuật in cao cấp độ bền màu cao. Đầu kéo bằng kim loại nguyên khối đảm bảo độ bền chắc tuyệt đối. Khoang chứa rộng rãi có thể chứa toàn bộ đồ dùng thiết yếu của học sinh bao gồm cả mắt kiếng. Màu sắc tươi sáng, là món quà đầy ý nghĩa cho trẻ nhỏ. Giá sản phẩm trên Tiki đã bao gồm thuế theo luật hiện hành. Bên cạnh đó, tuỳ vào loại sản phẩm, hình thức và địa chỉ giao hàng mà có thể phát sinh thêm chi phí khác như phí vận chuyển, phụ phí hàng cồng kềnh, thuế nhập khẩu (đối với đơn hàng giao từ nước ngoài có giá trị trên 1 triệu đồng).....",0,0,"https://salt.tikicdn.com/ts/product/06/d1/56/bed15d967e7d8350fd2093a847b32716.jpg, https://salt.tikicdn.com/ts/product/1f/33/fe/10ada96f9e1f6f8b5908e69d29e0d31e.jpg, https://salt.tikicdn.com/ts/product/43/8e/f0/b58fa1eef81fd729ba0a23ca470f2dae.jpg, https://salt.tikicdn.com/ts/product/bd/87/8c/a1f0a5eacf4121b5b58da71bea2bbb9d.jpg","https://salt.tikicdn.com/cache/w1200/ts/product/06/d1/56/bed15d967e7d8350fd2093a847b32716.jpg, https://salt.tikicdn.com/cache/w1200/ts/product/1f/33/fe/10ada96f9e1f6f8b5908e69d29e0d31e.jpg, https://salt.tikicdn.com/cache/w1200/ts/product/43/8e/f0/b58fa1eef81fd729ba0a23ca470f2dae.jpg, https://salt.tikicdn.com/cache/w1200/ts/product/bd/87/8c/a1f0a5eacf4121b5b58da71bea2bbb9d.jpg","https://salt.tikicdn.com/cache/w300/ts/product/06/d1/56/bed15d967e7d8350fd2093a847b32716.jpg, https://salt.tikicdn.com/cache/w300/ts/product/1f/33/fe/10ada96f9e1f6f8b5908e69d29e0d31e.jpg, https://salt.tikicdn.com/cache/w300/ts/product/43/8e/f0/b58fa1eef81fd729ba0a23ca470f2dae.jpg, https://salt.tikicdn.com/cache/w300/ts/product/bd/87/8c/a1f0a5eacf4121b5b58da71bea2bbb9d.jpg","https://salt.tikicdn.com/cache/200x280/ts/product/06/d1/56/bed15d967e7d8350fd2093a847b32716.jpg, https://salt.tikicdn.com/cache/200x280/ts/product/1f/33/fe/10ada96f9e1f6f8b5908e69d29e0d31e.jpg, https://salt.tikicdn.com/cache/200x280/ts/product/43/8e/f0/b58fa1eef81fd729ba0a23ca470f2dae.jpg, https://salt.tikicdn.com/cache/200x280/ts/product/bd/87/8c/a1f0a5eacf4121b5b58da71bea2bbb9d.jpg","https://salt.tikicdn.com/cache/200x280/ts/product/06/d1/56/bed15d967e7d8350fd2093a847b32716.jpg, https://salt.tikicdn.com/cache/200x280/ts/product/1f/33/fe/10ada96f9e1f6f8b5908e69d29e0d31e.jpg, https://salt.tikicdn.com/cache/200x280/ts/product/43/8e/f0/b58fa1eef81fd729ba0a23ca470f2dae.jpg, https://salt.tikicdn.com/cache/200x280/ts/product/bd/87/8c/a1f0a5eacf4121b5b58da71bea2bbb9d.jpg",1000,0
98133640,Bóp Vải Mùa Hè Ống Tròn G1 YT-2021,51000,"Bóp Vải Mùa Hè Ống Tròn G1 YT-2021   Bóp viết phiên bản đặc biệt dành cho mùa hè 2021 với các họa tiết tươi mát.   Chất liệu Polyester bền đẹp, họa tiết được in bằng kỹ thuật in cao cấp độ bền ...","Bóp Vải Mùa Hè Ống Tròn G1 YT-2021 Bóp viết phiên bản đặc biệt dành cho mùa hè 2021 với các họa tiết tươi mát. Chất liệu Polyester bền đẹp, họa tiết được in bằng kỹ thuật in cao cấp độ bền màu cao. Đầu kéo bằng kim loại nguyên khối đảm bảo độ bền chắc tuyệt đối. Khoang chứa rộng rãi có thể chứa toàn bộ đồ dùng thiết yếu của học sinh bao gồm cả mắt kiếng. Màu sắc tươi sáng, là món quà đầy ý nghĩa cho trẻ nhỏ. Giá sản phẩm trên Tiki đã bao gồm thuế theo luật hiện hành. Bên cạnh đó, tuỳ vào loại sản phẩm, hình thức và địa chỉ giao hàng mà có thể phát sinh thêm chi phí khác như phí vận chuyển, phụ phí hàng cồng kềnh, thuế nhập khẩu (đối với đơn hàng giao từ nước ngoài có giá trị trên 1 triệu đồng).....",0,0,"https://salt.tikicdn.com/ts/product/d6/66/81/6386ad52b6215cddb50ddca0b059c1b6.jpg, https://salt.tikicdn.com/ts/product/77/be/9b/7893dfd4ef968916750dcd95bc45f5c7.jpg, https://salt.tikicdn.com/ts/product/76/39/6a/f4b5c4f012e22abd9033505e04e90e41.jpg","https://salt.tikicdn.com/cache/w1200/ts/product/d6/66/81/6386ad52b6215cddb50ddca0b059c1b6.jpg, https://salt.tikicdn.com/cache/w1200/ts/product/77/be/9b/7893dfd4ef968916750dcd95bc45f5c7.jpg, https://salt.tikicdn.com/cache/w1200/ts/product/76/39/6a/f4b5c4f012e22abd9033505e04e90e41.jpg","https://salt.tikicdn.com/cache/w300/ts/product/d6/66/81/6386ad52b6215cddb50ddca0b059c1b6.jpg, https://salt.tikicdn.com/cache/w300/ts/product/77/be/9b/7893dfd4ef968916750dcd95bc45f5c7.jpg, https://salt.tikicdn.com/cache/w300/ts/product/76/39/6a/f4b5c4f012e22abd9033505e04e90e41.jpg","https://salt.tikicdn.com/cache/200x280/ts/product/d6/66/81/6386ad52b6215cddb50ddca0b059c1b6.jpg, https://salt.tikicdn.com/cache/200x280/ts/product/77/be/9b/7893dfd4ef968916750dcd95bc45f5c7.jpg, https://salt.tikicdn.com/cache/200x280/ts/product/76/39/6a/f4b5c4f012e22abd9033505e04e90e41.jpg","https://salt.tikicdn.com/cache/200x280/ts/product/d6/66/81/6386ad52b6215cddb50ddca0b059c1b6.jpg, https://salt.tikicdn.com/cache/200x280/ts/product/77/be/9b/7893dfd4ef968916750dcd95bc45f5c7.jpg, https://salt.tikicdn.com/cache/200x280/ts/product/76/39/6a/f4b5c4f012e22abd9033505e04e90e41.jpg",1000,0
98132720,Bóp Vải Mùa Hè B1 YT-2021,33100,"Bóp Vải Mùa Hè B1 YT-2021   Bóp viết phiên bản đặc biệt dành cho mùa hè 2021 với các họa tiết tươi mát.   Chất liệu Polyester bền đẹp, họa tiết được in bằng kỹ thuật in cao cấp độ bền màu cao. ...","Bóp Vải Mùa Hè B1 YT-2021 Bóp viết phiên bản đặc biệt dành cho mùa hè 2021 với các họa tiết tươi mát. Chất liệu Polyester bền đẹp, họa tiết được in bằng kỹ thuật in cao cấp độ bền màu cao. Đầu kéo bằng kim loại nguyên khối đảm bảo độ bền chắc tuyệt đối. Khoang chứa rộng rãi có thể chứa toàn bộ đồ dùng thiết yếu của học sinh bao gồm cả mắt kiếng. Màu sắc tươi sáng, là món quà đầy ý nghĩa cho trẻ nhỏ. Giá sản phẩm trên Tiki đã bao gồm thuế theo luật hiện hành. Bên cạnh đó, tuỳ vào loại sản phẩm, hình thức và địa chỉ giao hàng mà có thể phát sinh thêm chi phí khác như phí vận chuyển, phụ phí hàng cồng kềnh, thuế nhập khẩu (đối với đơn hàng giao từ nước ngoài có giá trị trên 1 triệu đồng).....",0,0,"https://salt.tikicdn.com/ts/product/8b/3d/30/e92235e39746827509b7301ffd42fa9f.jpg, https://salt.tikicdn.com/ts/product/ca/14/25/5f2031f9b0b7de25a8faf4b1987b3dd2.jpg, https://salt.tikicdn.com/ts/product/eb/d6/fb/ec3706f58a3ee93de22471b69307e0a5.jpg, https://salt.tikicdn.com/ts/product/48/41/48/2752e1ec3606b320a65bfbab98ff634b.jpg","https://salt.tikicdn.com/cache/w1200/ts/product/8b/3d/30/e92235e39746827509b7301ffd42fa9f.jpg, https://salt.tikicdn.com/cache/w1200/ts/product/ca/14/25/5f2031f9b0b7de25a8faf4b1987b3dd2.jpg, https://salt.tikicdn.com/cache/w1200/ts/product/eb/d6/fb/ec3706f58a3ee93de22471b69307e0a5.jpg, https://salt.tikicdn.com/cache/w1200/ts/product/48/41/48/2752e1ec3606b320a65bfbab98ff634b.jpg","https://salt.tikicdn.com/cache/w300/ts/product/8b/3d/30/e92235e39746827509b7301ffd42fa9f.jpg, https://salt.tikicdn.com/cache/w300/ts/product/ca/14/25/5f2031f9b0b7de25a8faf4b1987b3dd2.jpg, https://salt.tikicdn.com/cache/w300/ts/product/eb/d6/fb/ec3706f58a3ee93de22471b69307e0a5.jpg, https://salt.tikicdn.com/cache/w300/ts/product/48/41/48/2752e1ec3606b320a65bfbab98ff634b.jpg","https://salt.tikicdn.com/cache/200x280/ts/product/8b/3d/30/e92235e39746827509b7301ffd42fa9f.jpg, https://salt.tikicdn.com/cache/200x280/ts/product/ca/14/25/5f2031f9b0b7de25a8faf4b1987b3dd2.jpg, https://salt.tikicdn.com/cache/200x280/ts/product/eb/d6/fb/ec3706f58a3ee93de22471b69307e0a5.jpg, https://salt.tikicdn.com/cache/200x280/ts/product/48/41/48/2752e1ec3606b320a65bfbab98ff634b.jpg","https://salt.tikicdn.com/cache/200x280/ts/product/8b/3d/30/e92235e39746827509b7301ffd42fa9f.jpg, https://salt.tikicdn.com/cache/200x280/ts/product/ca/14/25/5f2031f9b0b7de25a8faf4b1987b3dd2.jpg, https://salt.tikicdn.com/cache/200x280/ts/product/eb/d6/fb/ec3706f58a3ee93de22471b69307e0a5.jpg, https://salt.tikicdn.com/cache/200x280/ts/product/48/41/48/2752e1ec3606b320a65bfbab98ff634b.jpg",1000,0
98132703,Bóp Vải Mùa Hè BG3 YT-2021,33100,"Bóp Vải Mùa Hè BG3 YT-2021   Bóp viết phiên bản đặc biệt dành cho mùa hè 2021 với các họa tiết tươi mát.   Chất liệu Polyester bền đẹp, họa tiết được in bằng kỹ thuật in cao cấp độ bền màu cao....","Bóp Vải Mùa Hè BG3 YT-2021 Bóp viết phiên bản đặc biệt dành cho mùa hè 2021 với các họa tiết tươi mát. Chất liệu Polyester bền đẹp, họa tiết được in bằng kỹ thuật in cao cấp độ bền màu cao. Đầu kéo bằng kim loại nguyên khối đảm bảo độ bền chắc tuyệt đối. Khoang chứa rộng rãi có thể chứa toàn bộ đồ dùng thiết yếu của học sinh bao gồm cả mắt kiếng. Màu sắc tươi sáng, là món quà đầy ý nghĩa cho trẻ nhỏ. Giá sản phẩm trên Tiki đã bao gồm thuế theo luật hiện hành. Bên cạnh đó, tuỳ vào loại sản phẩm, hình thức và địa chỉ giao hàng mà có thể phát sinh thêm chi phí khác như phí vận chuyển, phụ phí hàng cồng kềnh, thuế nhập khẩu (đối với đơn hàng giao từ nước ngoài có giá trị trên 1 triệu đồng).....",0,0,"https://salt.tikicdn.com/ts/product/fe/67/e1/e9855351a2196328f17c0bf499e7f909.jpg, https://salt.tikicdn.com/ts/product/89/66/29/4ae8db3d76e8c75f42aa9448b22cf7a6.jpg, https://salt.tikicdn.com/ts/product/b8/1b/51/146600724c868534d7d11e4eff93525b.jpg, https://salt.tikicdn.com/ts/product/bc/00/b0/1cf33acdb02909cad665c58a4940e926.jpg","https://salt.tikicdn.com/cache/w1200/ts/product/fe/67/e1/e9855351a2196328f17c0bf499e7f909.jpg, https://salt.tikicdn.com/cache/w1200/ts/product/89/66/29/4ae8db3d76e8c75f42aa9448b22cf7a6.jpg, https://salt.tikicdn.com/cache/w1200/ts/product/b8/1b/51/146600724c868534d7d11e4eff93525b.jpg, https://salt.tikicdn.com/cache/w1200/ts/product/bc/00/b0/1cf33acdb02909cad665c58a4940e926.jpg","https://salt.tikicdn.com/cache/w300/ts/product/fe/67/e1/e9855351a2196328f17c0bf499e7f909.jpg, https://salt.tikicdn.com/cache/w300/ts/product/89/66/29/4ae8db3d76e8c75f42aa9448b22cf7a6.jpg, https://salt.tikicdn.com/cache/w300/ts/product/b8/1b/51/146600724c868534d7d11e4eff93525b.jpg, https://salt.tikicdn.com/cache/w300/ts/product/bc/00/b0/1cf33acdb02909cad665c58a4940e926.jpg","https://salt.tikicdn.com/cache/200x280/ts/product/fe/67/e1/e9855351a2196328f17c0bf499e7f909.jpg, https://salt.tikicdn.com/cache/200x280/ts/product/89/66/29/4ae8db3d76e8c75f42aa9448b22cf7a6.jpg, https://salt.tikicdn.com/cache/200x280/ts/product/b8/1b/51/146600724c868534d7d11e4eff93525b.jpg, https://salt.tikicdn.com/cache/200x280/ts/product/bc/00/b0/1cf33acdb02909cad665c58a4940e926.jpg","https://salt.tikicdn.com/cache/200x280/ts/product/fe/67/e1/e9855351a2196328f17c0bf499e7f909.jpg, https://salt.tikicdn.com/cache/200x280/ts/product/89/66/29/4ae8db3d76e8c75f42aa9448b22cf7a6.jpg, https://salt.tikicdn.com/cache/200x280/ts/product/b8/1b/51/146600724c868534d7d11e4eff93525b.jpg, https://salt.tikicdn.com/cache/200x280/ts/product/bc/00/b0/1cf33acdb02909cad665c58a4940e926.jpg",1000,0
