id,name,price,short_description,description,rating_average,review_count,image_base_url,image_large_url,image_medium_url,image_small_url,image_thumbnail_url,stock,quantity_sold
96868861,"Hộp Đựng Bút Bằng Vải Đẹp Cao Cấp Đa Năng Giá Rẻ Dành Cho Học Sinh, Văn Phòng",39000,"Hộp Đựng Bút Bằng Vải Đa Năng Chất Lượng Giá Rẻ Dành Cho Học Sinh, Văn Phòng. Dòng hộp bút, bóp viết, túi bút mẫu mới được yêu thích.Mẫu hộp đựng bút viết dành cho học sinh cấp 2, cấp 3, sinh viên, v...","Hộp Đựng Bút Bằng Vải Đa Năng Chất Lượng Giá Rẻ Dành Cho Học Sinh, Văn Phòng. Dòng hộp bút, bóp viết, túi bút mẫu mới được yêu thích. Mẫu hộp đựng bút viết dành cho học sinh cấp 2, cấp 3, sinh viên, văn phòng, Mẫu mới 2021. Hộp bút nhiều ngăn được làm từ chất liệu vải canvas cao cấp, bên trong suốt dọc túi có lớp lót chất lượng. Mẫu hộp bút vải nhiều ngăn, kích thước chuẩn, được làm từ chất liệu sang trọng, đầu khóa, khóa kéo đồng 100%, sang trọng. Túi bút nhiều ngăn, phối dây kéo da 100% thể hiện cá tính. Hộp bút vải rất thời trang, cá tính. Hộp bút to có nhiều không gian để sử dụng rất thoải mái. Hộp đựng bút học sinh đang ""trend"". Bóp viết nhiều ngăn phù hợp cho cả nam và nữ, đây là mẫu hộp vải đựng bút viết được các bạn trẻ săn lùng. Có thể làm hộp bút long, túi đựng viết vải có không gian rộng để đựng được nhiều đồ. Hôp bút đa năng nhiều ngăn phù hợp cho cả nam lẫn nữ (unisex) Hộp đựng bút văn phòng, bóp viết canvas thời trang cao cấp, thực sự hữu ích, cần thiết cho dân công sở. Hộp bút đa năng không chỉ đựng bút viết mà có thể dùng làm túi đựng các phụ kiện khác. Túi đựng bút đa năng bằng vải được nhiều chị em lựa chọn. Hộp đựng bút bằng vải đẹp cao cấp có nhiều công dụng. Không chỉ là túi đựng bút vải dành cho học sinh, sinh viên. Túi bút vải canvas còn là túi đựng đa năng cho chị em công sở. Một hộp đựng bút vải sẽ là túi đựng bút học sinh đem lại nhiều tiện dụng. Hộp đựng bút học sinh Hộp đựng bút văn phòng màu đen Hộp đựng bút cao cấp Hộp bút vải học sinh Túi vải đựng bút viết phối màu xám và xanh Hộp đựng bút viết có dây khóa 100% đồng chất lượng, tay kéo da thật Bên trong có lớp lót sang trọng, được may rất chu đáo Hộp đựng bút đẹp, màu cá tính Hộp đựng bút học sinh, sản phẩm được nhiều bạn trẻ lựa chọn. Dòng sản phẩm túi đựng bút cao cấp dành cho học sinh, sinh viên Hộp đựng bút văn phòng, dành cho dân công sở thích thời trang Hộp đựng bút đẹp là sản phẩm không thể thiếu đối với học sinh, dân văn phòng, sinh viên, giáo viên. Chọn mẫu hộp đựng bút cao cấp, sang trọng nâng cao giá trị cho bản thân và hiệu quả sử dụng Giá sản phẩm trên Tiki đã bao gồm thuế theo luật hiện hành. Bên cạnh đó, tuỳ vào loại sản phẩm, hình thức và địa chỉ giao hàng mà có thể phát sinh thêm chi phí khác như phí vận chuyển, phụ phí hàng cồng kềnh, thuế nhập khẩu (đối với đơn hàng giao từ nước ngoài có giá trị trên 1 triệu đồng)..... Sản phẩm này là tài sản cá nhân được bán bởi Nhà Bán Hàng Cá Nhân và không thuộc đối tượng phải chịu thuế GTGT. Do đó hoá đơn VAT không được cung cấp trong trường hợp này.",5,90,"https://salt.tikicdn.com/ts/product/58/0d/a7/7b65df9f804e5e598740e33c0cec512b.jpg, https://salt.tikicdn.com/ts/product/45/5f/a8/229d9594d1c6ad83fcced6f3c0327f99.jpg, https://salt.tikicdn.com/ts/product/0e/62/9e/2c77d62e5d65e6c12760adfced7675d6.jpg, https://salt.tikicdn.com/ts/product/6c/eb/ab/0290ee91ef8a9b5205a96c9b83c627e7.jpg, https://salt.tikicdn.com/ts/product/8d/0d/e6/357f131f8d867ec9f34ce239c32a0296.jpg, https://salt.tikicdn.com/ts/product/9d/e4/c4/f5ef3f850cef691b59b2ea26bc29f79f.jpg, https://salt.tikicdn.com/ts/product/b9/81/01/c3bc3474bb0a9d945e5adcec3f349693.jpg, https://salt.tikicdn.com/ts/product/d0/c7/0d/2cbc584f437a98c253249f350629b8fb.jpg","https://salt.tikicdn.com/cache/w1200/ts/product/58/0d/a7/7b65df9f804e5e598740e33c0cec512b.jpg, https://salt.tikicdn.com/cache/w1200/ts/product/45/5f/a8/229d9594d1c6ad83fcced6f3c0327f99.jpg, https://salt.tikicdn.com/cache/w1200/ts/product/0e/62/9e/2c77d62e5d65e6c12760adfced7675d6.jpg, https://salt.tikicdn.com/cache/w1200/ts/product/6c/eb/ab/0290ee91ef8a9b5205a96c9b83c627e7.jpg, https://salt.tikicdn.com/cache/w1200/ts/product/8d/0d/e6/357f131f8d867ec9f34ce239c32a0296.jpg, https://salt.tikicdn.com/cache/w1200/ts/product/9d/e4/c4/f5ef3f850cef691b59b2ea26bc29f79f.jpg, https://salt.tikicdn.com/cache/w1200/ts/product/b9/81/01/c3bc3474bb0a9d945e5adcec3f349693.jpg, https://salt.tikicdn.com/cache/w1200/ts/product/d0/c7/0d/2cbc584f437a98c253249f350629b8fb.jpg","https://salt.tikicdn.com/cache/w300/ts/product/58/0d/a7/7b65df9f804e5e598740e33c0cec512b.jpg, https://salt.tikicdn.com/cache/w300/ts/product/45/5f/a8/229d9594d1c6ad83fcced6f3c0327f99.jpg, https://salt.tikicdn.com/cache/w300/ts/product/0e/62/9e/2c77d62e5d65e6c12760adfced7675d6.jpg, https://salt.tikicdn.com/cache/w300/ts/product/6c/eb/ab/0290ee91ef8a9b5205a96c9b83c627e7.jpg, https://salt.tikicdn.com/cache/w300/ts/product/8d/0d/e6/357f131f8d867ec9f34ce239c32a0296.jpg, https://salt.tikicdn.com/cache/w300/ts/product/9d/e4/c4/f5ef3f850cef691b59b2ea26bc29f79f.jpg, https://salt.tikicdn.com/cache/w300/ts/product/b9/81/01/c3bc3474bb0a9d945e5adcec3f349693.jpg, https://salt.tikicdn.com/cache/w300/ts/product/d0/c7/0d/2cbc584f437a98c253249f350629b8fb.jpg","https://salt.tikicdn.com/cache/200x280/ts/product/58/0d/a7/7b65df9f804e5e598740e33c0cec512b.jpg, https://salt.tikicdn.com/cache/200x280/ts/product/45/5f/a8/229d9594d1c6ad83fcced6f3c0327f99.jpg, https://salt.tikicdn.com/cache/200x280/ts/product/0e/62/9e/2c77d62e5d65e6c12760adfced7675d6.jpg, https://salt.tikicdn.com/cache/200x280/ts/product/6c/eb/ab/0290ee91ef8a9b5205a96c9b83c627e7.jpg, https://salt.tikicdn.com/cache/200x280/ts/product/8d/0d/e6/357f131f8d867ec9f34ce239c32a0296.jpg, https://salt.tikicdn.com/cache/200x280/ts/product/9d/e4/c4/f5ef3f850cef691b59b2ea26bc29f79f.jpg, https://salt.tikicdn.com/cache/200x280/ts/product/b9/81/01/c3bc3474bb0a9d945e5adcec3f349693.jpg, https://salt.tikicdn.com/cache/200x280/ts/product/d0/c7/0d/2cbc584f437a98c253249f350629b8fb.jpg","https://salt.tikicdn.com/cache/200x280/ts/product/58/0d/a7/7b65df9f804e5e598740e33c0cec512b.jpg, https://salt.tikicdn.com/cache/200x280/ts/product/45/5f/a8/229d9594d1c6ad83fcced6f3c0327f99.jpg, https://salt.tikicdn.com/cache/200x280/ts/product/0e/62/9e/2c77d62e5d65e6c12760adfced7675d6.jpg, https://salt.tikicdn.com/cache/200x280/ts/product/6c/eb/ab/0290ee91ef8a9b5205a96c9b83c627e7.jpg, https://salt.tikicdn.com/cache/200x280/ts/product/8d/0d/e6/357f131f8d867ec9f34ce239c32a0296.jpg, https://salt.tikicdn.com/cache/200x280/ts/product/9d/e4/c4/f5ef3f850cef691b59b2ea26bc29f79f.jpg, https://salt.tikicdn.com/cache/200x280/ts/product/b9/81/01/c3bc3474bb0a9d945e5adcec3f349693.jpg, https://salt.tikicdn.com/cache/200x280/ts/product/d0/c7/0d/2cbc584f437a98c253249f350629b8fb.jpg",1000,90
96552060,Túi Lưới Stacom Có Khóa Kéo A5 ZC101A5 - Màu Vàng,21800,"Túi Lưới Stacom Có Khóa Kéo A5 ZC101A5   Sản phẩm được làm bằng chất liệu bền đẹp dùng để sắp xếp các vật dụng, thuận tiện mang đi mọi lúc mọi nơi.   Sản phẩm vô cùng sắc sảo, tinh tế, dây...","Túi Lưới Stacom Có Khóa Kéo A5 ZC101A5 Sản phẩm được làm bằng chất liệu bền đẹp dùng để sắp xếp các vật dụng, thuận tiện mang đi mọi lúc mọi nơi. Sản phẩm vô cùng sắc sảo, tinh tế, dây kéo mượt mà, đồ bền cao sử dụng lâu dài theo thời gian. Đây là dòng sản phẩm túi zip đa năng, thích hợp với đa dạng nhu cầu sử dụng cho mọi đối tượng học sinh - sinh viên, khối văn phòng và gia đình. Giá sản phẩm trên Tiki đã bao gồm thuế theo luật hiện hành. Bên cạnh đó, tuỳ vào loại sản phẩm, hình thức và địa chỉ giao hàng mà có thể phát sinh thêm chi phí khác như phí vận chuyển, phụ phí hàng cồng kềnh, thuế nhập khẩu (đối với đơn hàng giao từ nước ngoài có giá trị trên 1 triệu đồng).....",5,1,"https://salt.tikicdn.com/ts/product/db/c0/a5/671736a706b9ff2c2a61ff08d3d651aa.jpg, https://salt.tikicdn.com/ts/product/56/d5/79/5b7adfa349f0ac2f837783fb1195d4f8.jpg, https://salt.tikicdn.com/ts/product/b6/69/44/96f39855aa3139f0d9d0d75b16d93b8a.jpg","https://salt.tikicdn.com/cache/w1200/ts/product/db/c0/a5/671736a706b9ff2c2a61ff08d3d651aa.jpg, https://salt.tikicdn.com/cache/w1200/ts/product/56/d5/79/5b7adfa349f0ac2f837783fb1195d4f8.jpg, https://salt.tikicdn.com/cache/w1200/ts/product/b6/69/44/96f39855aa3139f0d9d0d75b16d93b8a.jpg","https://salt.tikicdn.com/cache/w300/ts/product/db/c0/a5/671736a706b9ff2c2a61ff08d3d651aa.jpg, https://salt.tikicdn.com/cache/w300/ts/product/56/d5/79/5b7adfa349f0ac2f837783fb1195d4f8.jpg, https://salt.tikicdn.com/cache/w300/ts/product/b6/69/44/96f39855aa3139f0d9d0d75b16d93b8a.jpg","https://salt.tikicdn.com/cache/200x280/ts/product/db/c0/a5/671736a706b9ff2c2a61ff08d3d651aa.jpg, https://salt.tikicdn.com/cache/200x280/ts/product/56/d5/79/5b7adfa349f0ac2f837783fb1195d4f8.jpg, https://salt.tikicdn.com/cache/200x280/ts/product/b6/69/44/96f39855aa3139f0d9d0d75b16d93b8a.jpg","https://salt.tikicdn.com/cache/200x280/ts/product/db/c0/a5/671736a706b9ff2c2a61ff08d3d651aa.jpg, https://salt.tikicdn.com/cache/200x280/ts/product/56/d5/79/5b7adfa349f0ac2f837783fb1195d4f8.jpg, https://salt.tikicdn.com/cache/200x280/ts/product/b6/69/44/96f39855aa3139f0d9d0d75b16d93b8a.jpg",1000,1
83021024,Túi zipper lưới hoạt hình Stacom có khóa kéo cỡ A4/A5/A6/B5/B6,29250,"       _Túi Zipper lưới hoạt hình Stacom có khóa kéo ZC101A4/A5/A6/B5/B6 được làm từ chất liệu nylon cao cấp, dễ dàng vệ sinh.   _Kích thước nhỏ gọn với hình dáng chữ nhật , thiết kế khóa kéo như...","_Túi Zipper lưới hoạt hình Stacom có khóa kéo ZC101A4/A5/A6/B5/B6 được làm từ chất liệu nylon cao cấp, dễ dàng vệ sinh. _Kích thước nhỏ gọn với hình dáng chữ nhật , thiết kế khóa kéo như túi zip chắc chắn, trơn tru giúp bạn đóng / mở dễ dàng, thuận tiện khi sử dụng. _Kiểu dáng độc đáo này, bạn có thể tùy ý sắp xếp vật dụng cá nhân của mình một cách gọn gàng, ngăn nắp và còn có thể mang theo bên người để sử dụng vào bất kỳ lúc nào. _Túi đựng bút sẽ giúp các bé yêu của bạn lưu trữ các dụng cụ học tập, bé có thể dễ dàng sử dụng hộp bút và sử dụng những dụng cụ mình cần. _Sản phẩm phù hợp với mọi đối tượng như: học sinh, sinh viên, văn phòng, _Kích thước: + ZP101A4: 33*25cm + ZP101A5: 24.3*19.5cm + ZP101A6: 23*11.2cm +ZP101B5: 29.1*22cm + ZP101B6: 19*14cm _Chất liệu: nylon. _ Màu sắc: giao ngẫu nhiên. Giá sản phẩm trên Tiki đã bao gồm thuế theo luật hiện hành. Bên cạnh đó, tuỳ vào loại sản phẩm, hình thức và địa chỉ giao hàng mà có thể phát sinh thêm chi phí khác như phí vận chuyển, phụ phí hàng cồng kềnh, thuế nhập khẩu (đối với đơn hàng giao từ nước ngoài có giá trị trên 1 triệu đồng).....",0,0,"https://salt.tikicdn.com/ts/product/90/68/c7/05aa0a152e26c77c25ec7356db39c7d3.jpg, https://salt.tikicdn.com/ts/product/72/63/e3/316d89ddcd78bfa5a4efc63c46db2cc1.jpg, https://salt.tikicdn.com/ts/product/13/e7/17/c3607cc971a7f84bb730346bb60ff54b.jpg, https://salt.tikicdn.com/ts/product/ba/aa/b9/fdbf8a9b90e210ad44c3402e52e34b3d.jpg, https://salt.tikicdn.com/ts/product/a2/e5/94/16cbcdc9b72da2abf0980752db96a457.jpg, https://salt.tikicdn.com/ts/product/f8/ec/ba/6c1dc28b1d268ed6f70fc9d84378338a.jpg, https://salt.tikicdn.com/ts/product/23/0c/b0/06261838dc18e832fb35924d70871d46.jpg, https://salt.tikicdn.com/ts/product/6f/99/a0/18b15d20a7039f1332749f21a92f24c9.jpg, https://salt.tikicdn.com/ts/product/4c/4b/48/8a98379a6d39dc949aef31a0272ac926.jpg","https://salt.tikicdn.com/cache/w1200/ts/product/90/68/c7/05aa0a152e26c77c25ec7356db39c7d3.jpg, https://salt.tikicdn.com/cache/w1200/ts/product/72/63/e3/316d89ddcd78bfa5a4efc63c46db2cc1.jpg, https://salt.tikicdn.com/cache/w1200/ts/product/13/e7/17/c3607cc971a7f84bb730346bb60ff54b.jpg, https://salt.tikicdn.com/cache/w1200/ts/product/ba/aa/b9/fdbf8a9b90e210ad44c3402e52e34b3d.jpg, https://salt.tikicdn.com/cache/w1200/ts/product/a2/e5/94/16cbcdc9b72da2abf0980752db96a457.jpg, https://salt.tikicdn.com/cache/w1200/ts/product/f8/ec/ba/6c1dc28b1d268ed6f70fc9d84378338a.jpg, https://salt.tikicdn.com/cache/w1200/ts/product/23/0c/b0/06261838dc18e832fb35924d70871d46.jpg, https://salt.tikicdn.com/cache/w1200/ts/product/6f/99/a0/18b15d20a7039f1332749f21a92f24c9.jpg, https://salt.tikicdn.com/cache/w1200/ts/product/4c/4b/48/8a98379a6d39dc949aef31a0272ac926.jpg","https://salt.tikicdn.com/cache/w300/ts/product/90/68/c7/05aa0a152e26c77c25ec7356db39c7d3.jpg, https://salt.tikicdn.com/cache/w300/ts/product/72/63/e3/316d89ddcd78bfa5a4efc63c46db2cc1.jpg, https://salt.tikicdn.com/cache/w300/ts/product/13/e7/17/c3607cc971a7f84bb730346bb60ff54b.jpg, https://salt.tikicdn.com/cache/w300/ts/product/ba/aa/b9/fdbf8a9b90e210ad44c3402e52e34b3d.jpg, https://salt.tikicdn.com/cache/w300/ts/product/a2/e5/94/16cbcdc9b72da2abf0980752db96a457.jpg, https://salt.tikicdn.com/cache/w300/ts/product/f8/ec/ba/6c1dc28b1d268ed6f70fc9d84378338a.jpg, https://salt.tikicdn.com/cache/w300/ts/product/23/0c/b0/06261838dc18e832fb35924d70871d46.jpg, https://salt.tikicdn.com/cache/w300/ts/product/6f/99/a0/18b15d20a7039f1332749f21a92f24c9.jpg, https://salt.tikicdn.com/cache/w300/ts/product/4c/4b/48/8a98379a6d39dc949aef31a0272ac926.jpg","https://salt.tikicdn.com/cache/200x280/ts/product/90/68/c7/05aa0a152e26c77c25ec7356db39c7d3.jpg, https://salt.tikicdn.com/cache/200x280/ts/product/72/63/e3/316d89ddcd78bfa5a4efc63c46db2cc1.jpg, https://salt.tikicdn.com/cache/200x280/ts/product/13/e7/17/c3607cc971a7f84bb730346bb60ff54b.jpg, https://salt.tikicdn.com/cache/200x280/ts/product/ba/aa/b9/fdbf8a9b90e210ad44c3402e52e34b3d.jpg, https://salt.tikicdn.com/cache/200x280/ts/product/a2/e5/94/16cbcdc9b72da2abf0980752db96a457.jpg, https://salt.tikicdn.com/cache/200x280/ts/product/f8/ec/ba/6c1dc28b1d268ed6f70fc9d84378338a.jpg, https://salt.tikicdn.com/cache/200x280/ts/product/23/0c/b0/06261838dc18e832fb35924d70871d46.jpg, https://salt.tikicdn.com/cache/200x280/ts/product/6f/99/a0/18b15d20a7039f1332749f21a92f24c9.jpg, https://salt.tikicdn.com/cache/200x280/ts/product/4c/4b/48/8a98379a6d39dc949aef31a0272ac926.jpg","https://salt.tikicdn.com/cache/200x280/ts/product/90/68/c7/05aa0a152e26c77c25ec7356db39c7d3.jpg, https://salt.tikicdn.com/cache/200x280/ts/product/72/63/e3/316d89ddcd78bfa5a4efc63c46db2cc1.jpg, https://salt.tikicdn.com/cache/200x280/ts/product/13/e7/17/c3607cc971a7f84bb730346bb60ff54b.jpg, https://salt.tikicdn.com/cache/200x280/ts/product/ba/aa/b9/fdbf8a9b90e210ad44c3402e52e34b3d.jpg, https://salt.tikicdn.com/cache/200x280/ts/product/a2/e5/94/16cbcdc9b72da2abf0980752db96a457.jpg, https://salt.tikicdn.com/cache/200x280/ts/product/f8/ec/ba/6c1dc28b1d268ed6f70fc9d84378338a.jpg, https://salt.tikicdn.com/cache/200x280/ts/product/23/0c/b0/06261838dc18e832fb35924d70871d46.jpg, https://salt.tikicdn.com/cache/200x280/ts/product/6f/99/a0/18b15d20a7039f1332749f21a92f24c9.jpg, https://salt.tikicdn.com/cache/200x280/ts/product/4c/4b/48/8a98379a6d39dc949aef31a0272ac926.jpg",1000,0
83020953,Túi đựng bút bằng vải 01 ngăn STACOM/PB1012,32000,       Ưu điểm sản phẩm:   - Túi được may từ vải bố cao cấp.   - Họa tiết sinh động với 01 ngăn mở rộng rất tiện cho việc chứa các đồ dùng học tập cần thiết.   - Sản phẩm thích hợp dùng cho các...,"Ưu điểm sản phẩm: - Túi được may từ vải bố cao cấp. - Họa tiết sinh động với 01 ngăn mở rộng rất tiện cho việc chứa các đồ dùng học tập cần thiết. - Sản phẩm thích hợp dùng cho các bạn học sinh - sinh viên - Kích thước: 195*55*40mm Giá sản phẩm trên Tiki đã bao gồm thuế theo luật hiện hành. Bên cạnh đó, tuỳ vào loại sản phẩm, hình thức và địa chỉ giao hàng mà có thể phát sinh thêm chi phí khác như phí vận chuyển, phụ phí hàng cồng kềnh, thuế nhập khẩu (đối với đơn hàng giao từ nước ngoài có giá trị trên 1 triệu đồng).....",0,0,"https://salt.tikicdn.com/ts/product/54/b1/e5/d279e2359dae4e6aec79772210e1b1f5.jpg, https://salt.tikicdn.com/ts/product/d8/05/b5/975189b21c18e58505845981466ee2ef.jpg, https://salt.tikicdn.com/ts/product/05/30/33/9f3a224f7059f3c8d20fb4fae65fe053.jpg, https://salt.tikicdn.com/ts/product/f6/bd/e3/a528b0d320707b2bbca0ca7b6be2b503.jpg, https://salt.tikicdn.com/ts/product/86/47/f8/4489c4d2363bb971cb3d5de65bf350ba.jpg","https://salt.tikicdn.com/cache/w1200/ts/product/54/b1/e5/d279e2359dae4e6aec79772210e1b1f5.jpg, https://salt.tikicdn.com/cache/w1200/ts/product/d8/05/b5/975189b21c18e58505845981466ee2ef.jpg, https://salt.tikicdn.com/cache/w1200/ts/product/05/30/33/9f3a224f7059f3c8d20fb4fae65fe053.jpg, https://salt.tikicdn.com/cache/w1200/ts/product/f6/bd/e3/a528b0d320707b2bbca0ca7b6be2b503.jpg, https://salt.tikicdn.com/cache/w1200/ts/product/86/47/f8/4489c4d2363bb971cb3d5de65bf350ba.jpg","https://salt.tikicdn.com/cache/w300/ts/product/54/b1/e5/d279e2359dae4e6aec79772210e1b1f5.jpg, https://salt.tikicdn.com/cache/w300/ts/product/d8/05/b5/975189b21c18e58505845981466ee2ef.jpg, https://salt.tikicdn.com/cache/w300/ts/product/05/30/33/9f3a224f7059f3c8d20fb4fae65fe053.jpg, https://salt.tikicdn.com/cache/w300/ts/product/f6/bd/e3/a528b0d320707b2bbca0ca7b6be2b503.jpg, https://salt.tikicdn.com/cache/w300/ts/product/86/47/f8/4489c4d2363bb971cb3d5de65bf350ba.jpg","https://salt.tikicdn.com/cache/200x280/ts/product/54/b1/e5/d279e2359dae4e6aec79772210e1b1f5.jpg, https://salt.tikicdn.com/cache/200x280/ts/product/d8/05/b5/975189b21c18e58505845981466ee2ef.jpg, https://salt.tikicdn.com/cache/200x280/ts/product/05/30/33/9f3a224f7059f3c8d20fb4fae65fe053.jpg, https://salt.tikicdn.com/cache/200x280/ts/product/f6/bd/e3/a528b0d320707b2bbca0ca7b6be2b503.jpg, https://salt.tikicdn.com/cache/200x280/ts/product/86/47/f8/4489c4d2363bb971cb3d5de65bf350ba.jpg","https://salt.tikicdn.com/cache/200x280/ts/product/54/b1/e5/d279e2359dae4e6aec79772210e1b1f5.jpg, https://salt.tikicdn.com/cache/200x280/ts/product/d8/05/b5/975189b21c18e58505845981466ee2ef.jpg, https://salt.tikicdn.com/cache/200x280/ts/product/05/30/33/9f3a224f7059f3c8d20fb4fae65fe053.jpg, https://salt.tikicdn.com/cache/200x280/ts/product/f6/bd/e3/a528b0d320707b2bbca0ca7b6be2b503.jpg, https://salt.tikicdn.com/cache/200x280/ts/product/86/47/f8/4489c4d2363bb971cb3d5de65bf350ba.jpg",1000,0
77965803,Bóp Viết Morning Glory Puppy 83547 - Màu Xanh,206100,"Bóp Viết Morning Glory Puppy 83547   Sản phẩm sở hữu kiểu dáng vô cùng trẻ trung và đẹp mắt.   Sản phẩm được làm bằng chất liệu bền chắc với dây kéo trơn, dễ sử dụng, không bị kẹt giữa chừ...","Bóp Viết Morning Glory Puppy 83547 Sản phẩm sở hữu kiểu dáng vô cùng trẻ trung và đẹp mắt. Sản phẩm được làm bằng chất liệu bền chắc với dây kéo trơn, dễ sử dụng, không bị kẹt giữa chừng. Kích thước nhỏ gọn, tính tiện dụng cao, sản phẩm có thể chứa đựng các vật dụng cá nhân gọn gàng, tiện lợi. Với kiểu dáng thời trang, đây sẽ là món quà ấn tượng mà bạn có thể dành tặng cho người thân, bạn bè vào những dịp đặc biệt. Giá sản phẩm trên Tiki đã bao gồm thuế theo luật hiện hành. Bên cạnh đó, tuỳ vào loại sản phẩm, hình thức và địa chỉ giao hàng mà có thể phát sinh thêm chi phí khác như phí vận chuyển, phụ phí hàng cồng kềnh, thuế nhập khẩu (đối với đơn hàng giao từ nước ngoài có giá trị trên 1 triệu đồng).....",0,0,"https://salt.tikicdn.com/ts/product/c3/db/e6/93f3f5b34855a247fdc8a41db05c051e.jpg, https://salt.tikicdn.com/ts/product/23/08/da/61efc723e29d7810cd5b0cc2e4b14a21.jpg, https://salt.tikicdn.com/ts/product/07/39/df/b9fcf43ea14080fc812d7c473f760a4f.jpg, https://salt.tikicdn.com/ts/product/e5/2b/1a/431fba64dfe4bbf151071fae1aa4c3e9.jpg","https://salt.tikicdn.com/cache/w1200/ts/product/c3/db/e6/93f3f5b34855a247fdc8a41db05c051e.jpg, https://salt.tikicdn.com/cache/w1200/ts/product/23/08/da/61efc723e29d7810cd5b0cc2e4b14a21.jpg, https://salt.tikicdn.com/cache/w1200/ts/product/07/39/df/b9fcf43ea14080fc812d7c473f760a4f.jpg, https://salt.tikicdn.com/cache/w1200/ts/product/e5/2b/1a/431fba64dfe4bbf151071fae1aa4c3e9.jpg","https://salt.tikicdn.com/cache/w300/ts/product/c3/db/e6/93f3f5b34855a247fdc8a41db05c051e.jpg, https://salt.tikicdn.com/cache/w300/ts/product/23/08/da/61efc723e29d7810cd5b0cc2e4b14a21.jpg, https://salt.tikicdn.com/cache/w300/ts/product/07/39/df/b9fcf43ea14080fc812d7c473f760a4f.jpg, https://salt.tikicdn.com/cache/w300/ts/product/e5/2b/1a/431fba64dfe4bbf151071fae1aa4c3e9.jpg","https://salt.tikicdn.com/cache/200x280/ts/product/c3/db/e6/93f3f5b34855a247fdc8a41db05c051e.jpg, https://salt.tikicdn.com/cache/200x280/ts/product/23/08/da/61efc723e29d7810cd5b0cc2e4b14a21.jpg, https://salt.tikicdn.com/cache/200x280/ts/product/07/39/df/b9fcf43ea14080fc812d7c473f760a4f.jpg, https://salt.tikicdn.com/cache/200x280/ts/product/e5/2b/1a/431fba64dfe4bbf151071fae1aa4c3e9.jpg","https://salt.tikicdn.com/cache/200x280/ts/product/c3/db/e6/93f3f5b34855a247fdc8a41db05c051e.jpg, https://salt.tikicdn.com/cache/200x280/ts/product/23/08/da/61efc723e29d7810cd5b0cc2e4b14a21.jpg, https://salt.tikicdn.com/cache/200x280/ts/product/07/39/df/b9fcf43ea14080fc812d7c473f760a4f.jpg, https://salt.tikicdn.com/cache/200x280/ts/product/e5/2b/1a/431fba64dfe4bbf151071fae1aa4c3e9.jpg",1000,0
