id,name,price,short_description,description,rating_average,review_count,image_base_url,image_large_url,image_medium_url,image_small_url,image_thumbnail_url,stock,quantity_sold
221032154,Bóp Viết 2 Ngăn - AWA HVA-RD - Màu Đỏ,83700,"    Bóp Viết 2 Ngăn - AWA HVA-RD - Màu Đỏ   Bóp viết 2 ngăn AWA bằng vải có nhiều màu cực xinh và tươi tắn, bặt kịp xu hướng thời trang của giới trẻ.   Bóp viết AWA sử dụng chất liệu vải tốt, chố...","Bóp Viết 2 Ngăn - AWA HVA-RD - Màu Đỏ Bóp viết 2 ngăn AWA bằng vải có nhiều màu cực xinh và tươi tắn, bặt kịp xu hướng thời trang của giới trẻ. Bóp viết AWA sử dụng chất liệu vải tốt, chống thấm nước. Giúp bạn bảo quản được vật dụng bên trong nếu lỡ bị dính nước. Cùng với đó là đường may chắc chắn, khóa kéo bền, sử dụng được dài lâu. Chất liệu vải thân thiện với môi trường và an toàn cho người sử dụng. Sản phẩm có kiểu dáng đơn giản, đẹp mắt. Là vật dụng cá nhân hữu ích cho học sinh, sinh viên và giới văn phòng công sở. Giá sản phẩm trên Tiki đã bao gồm thuế theo luật hiện hành. Bên cạnh đó, tuỳ vào loại sản phẩm, hình thức và địa chỉ giao hàng mà có thể phát sinh thêm chi phí khác như phí vận chuyển, phụ phí hàng cồng kềnh, thuế nhập khẩu (đối với đơn hàng giao từ nước ngoài có giá trị trên 1 triệu đồng).....",0,0,"https://salt.tikicdn.com/ts/product/f3/7d/35/b8fe172b1d3bca43d449f63d2ed6f1e3.jpg, https://salt.tikicdn.com/ts/product/ab/03/ed/b7ac3b2f118c7773ae07f75a571ead28.jpg, https://salt.tikicdn.com/ts/product/42/0d/9e/894bd5cf764895cf68e43f5d72b1519b.jpg, https://salt.tikicdn.com/ts/product/eb/d0/23/8024e9969229c4b2b448363217ded1eb.jpg, https://salt.tikicdn.com/ts/product/bb/0c/11/b950eee27bdbcd01c9beda958a4b1f3f.jpg, https://salt.tikicdn.com/ts/product/06/a6/8e/9f2e4bc374e98f45c3d9695e0040a4fd.jpg, https://salt.tikicdn.com/ts/product/08/40/40/c82decbda45b40f633d9098b48e7e224.jpg","https://salt.tikicdn.com/cache/w1200/ts/product/f3/7d/35/b8fe172b1d3bca43d449f63d2ed6f1e3.jpg, https://salt.tikicdn.com/cache/w1200/ts/product/ab/03/ed/b7ac3b2f118c7773ae07f75a571ead28.jpg, https://salt.tikicdn.com/cache/w1200/ts/product/42/0d/9e/894bd5cf764895cf68e43f5d72b1519b.jpg, https://salt.tikicdn.com/cache/w1200/ts/product/eb/d0/23/8024e9969229c4b2b448363217ded1eb.jpg, https://salt.tikicdn.com/cache/w1200/ts/product/bb/0c/11/b950eee27bdbcd01c9beda958a4b1f3f.jpg, https://salt.tikicdn.com/cache/w1200/ts/product/06/a6/8e/9f2e4bc374e98f45c3d9695e0040a4fd.jpg, https://salt.tikicdn.com/cache/w1200/ts/product/08/40/40/c82decbda45b40f633d9098b48e7e224.jpg","https://salt.tikicdn.com/cache/w300/ts/product/f3/7d/35/b8fe172b1d3bca43d449f63d2ed6f1e3.jpg, https://salt.tikicdn.com/cache/w300/ts/product/ab/03/ed/b7ac3b2f118c7773ae07f75a571ead28.jpg, https://salt.tikicdn.com/cache/w300/ts/product/42/0d/9e/894bd5cf764895cf68e43f5d72b1519b.jpg, https://salt.tikicdn.com/cache/w300/ts/product/eb/d0/23/8024e9969229c4b2b448363217ded1eb.jpg, https://salt.tikicdn.com/cache/w300/ts/product/bb/0c/11/b950eee27bdbcd01c9beda958a4b1f3f.jpg, https://salt.tikicdn.com/cache/w300/ts/product/06/a6/8e/9f2e4bc374e98f45c3d9695e0040a4fd.jpg, https://salt.tikicdn.com/cache/w300/ts/product/08/40/40/c82decbda45b40f633d9098b48e7e224.jpg","https://salt.tikicdn.com/cache/200x280/ts/product/f3/7d/35/b8fe172b1d3bca43d449f63d2ed6f1e3.jpg, https://salt.tikicdn.com/cache/200x280/ts/product/ab/03/ed/b7ac3b2f118c7773ae07f75a571ead28.jpg, https://salt.tikicdn.com/cache/200x280/ts/product/42/0d/9e/894bd5cf764895cf68e43f5d72b1519b.jpg, https://salt.tikicdn.com/cache/200x280/ts/product/eb/d0/23/8024e9969229c4b2b448363217ded1eb.jpg, https://salt.tikicdn.com/cache/200x280/ts/product/bb/0c/11/b950eee27bdbcd01c9beda958a4b1f3f.jpg, https://salt.tikicdn.com/cache/200x280/ts/product/06/a6/8e/9f2e4bc374e98f45c3d9695e0040a4fd.jpg, https://salt.tikicdn.com/cache/200x280/ts/product/08/40/40/c82decbda45b40f633d9098b48e7e224.jpg","https://salt.tikicdn.com/cache/200x280/ts/product/f3/7d/35/b8fe172b1d3bca43d449f63d2ed6f1e3.jpg, https://salt.tikicdn.com/cache/200x280/ts/product/ab/03/ed/b7ac3b2f118c7773ae07f75a571ead28.jpg, https://salt.tikicdn.com/cache/200x280/ts/product/42/0d/9e/894bd5cf764895cf68e43f5d72b1519b.jpg, https://salt.tikicdn.com/cache/200x280/ts/product/eb/d0/23/8024e9969229c4b2b448363217ded1eb.jpg, https://salt.tikicdn.com/cache/200x280/ts/product/bb/0c/11/b950eee27bdbcd01c9beda958a4b1f3f.jpg, https://salt.tikicdn.com/cache/200x280/ts/product/06/a6/8e/9f2e4bc374e98f45c3d9695e0040a4fd.jpg, https://salt.tikicdn.com/cache/200x280/ts/product/08/40/40/c82decbda45b40f633d9098b48e7e224.jpg",1000,0
221032148,Bóp Viết 2 Ngăn - AWA HVA-BL - Xanh Dương,83700,"    Bóp Viết 2 Ngăn - AWA HVA-BL - Xanh Dương   Bóp viết 2 ngăn AWA bằng vải có nhiều màu cực xinh và tươi tắn, bặt kịp xu hướng thời trang của giới trẻ.   Bóp viết AWA sử dụng chất liệu vải tốt,...","Bóp Viết 2 Ngăn - AWA HVA-BL - Xanh Dương Bóp viết 2 ngăn AWA bằng vải có nhiều màu cực xinh và tươi tắn, bặt kịp xu hướng thời trang của giới trẻ. Bóp viết AWA sử dụng chất liệu vải tốt, chống thấm nước. Giúp bạn bảo quản được vật dụng bên trong nếu lỡ bị dính nước. Cùng với đó là đường may chắc chắn, khóa kéo bền, sử dụng được dài lâu. Chất liệu vải thân thiện với môi trường và an toàn cho người sử dụng. Sản phẩm có kiểu dáng đơn giản, đẹp mắt. Là vật dụng cá nhân hữu ích cho học sinh, sinh viên và giới văn phòng công sở. Giá sản phẩm trên Tiki đã bao gồm thuế theo luật hiện hành. Bên cạnh đó, tuỳ vào loại sản phẩm, hình thức và địa chỉ giao hàng mà có thể phát sinh thêm chi phí khác như phí vận chuyển, phụ phí hàng cồng kềnh, thuế nhập khẩu (đối với đơn hàng giao từ nước ngoài có giá trị trên 1 triệu đồng).....",0,0,"https://salt.tikicdn.com/ts/product/f6/41/c3/3261ab7ff41a6501abdb38826158d327.jpg, https://salt.tikicdn.com/ts/product/92/c4/21/113c37d4f2f0e779e843563caf01e520.jpg, https://salt.tikicdn.com/ts/product/a8/39/10/9a2fdf04d01428f00fe0b2383b709a36.jpg, https://salt.tikicdn.com/ts/product/9a/bc/a8/8f5c1cc0f287fc4518003a7559cbb411.jpg, https://salt.tikicdn.com/ts/product/49/3f/a6/72c8cc7f130a24209eae3547e14783f7.jpg, https://salt.tikicdn.com/ts/product/62/83/5a/4c532de69c3dd11e25a6ee879dd7e0c0.jpg, https://salt.tikicdn.com/ts/product/fa/f4/3c/de7eb97e9829447e9426b6b9de49ca40.jpg","https://salt.tikicdn.com/cache/w1200/ts/product/f6/41/c3/3261ab7ff41a6501abdb38826158d327.jpg, https://salt.tikicdn.com/cache/w1200/ts/product/92/c4/21/113c37d4f2f0e779e843563caf01e520.jpg, https://salt.tikicdn.com/cache/w1200/ts/product/a8/39/10/9a2fdf04d01428f00fe0b2383b709a36.jpg, https://salt.tikicdn.com/cache/w1200/ts/product/9a/bc/a8/8f5c1cc0f287fc4518003a7559cbb411.jpg, https://salt.tikicdn.com/cache/w1200/ts/product/49/3f/a6/72c8cc7f130a24209eae3547e14783f7.jpg, https://salt.tikicdn.com/cache/w1200/ts/product/62/83/5a/4c532de69c3dd11e25a6ee879dd7e0c0.jpg, https://salt.tikicdn.com/cache/w1200/ts/product/fa/f4/3c/de7eb97e9829447e9426b6b9de49ca40.jpg","https://salt.tikicdn.com/cache/w300/ts/product/f6/41/c3/3261ab7ff41a6501abdb38826158d327.jpg, https://salt.tikicdn.com/cache/w300/ts/product/92/c4/21/113c37d4f2f0e779e843563caf01e520.jpg, https://salt.tikicdn.com/cache/w300/ts/product/a8/39/10/9a2fdf04d01428f00fe0b2383b709a36.jpg, https://salt.tikicdn.com/cache/w300/ts/product/9a/bc/a8/8f5c1cc0f287fc4518003a7559cbb411.jpg, https://salt.tikicdn.com/cache/w300/ts/product/49/3f/a6/72c8cc7f130a24209eae3547e14783f7.jpg, https://salt.tikicdn.com/cache/w300/ts/product/62/83/5a/4c532de69c3dd11e25a6ee879dd7e0c0.jpg, https://salt.tikicdn.com/cache/w300/ts/product/fa/f4/3c/de7eb97e9829447e9426b6b9de49ca40.jpg","https://salt.tikicdn.com/cache/200x280/ts/product/f6/41/c3/3261ab7ff41a6501abdb38826158d327.jpg, https://salt.tikicdn.com/cache/200x280/ts/product/92/c4/21/113c37d4f2f0e779e843563caf01e520.jpg, https://salt.tikicdn.com/cache/200x280/ts/product/a8/39/10/9a2fdf04d01428f00fe0b2383b709a36.jpg, https://salt.tikicdn.com/cache/200x280/ts/product/9a/bc/a8/8f5c1cc0f287fc4518003a7559cbb411.jpg, https://salt.tikicdn.com/cache/200x280/ts/product/49/3f/a6/72c8cc7f130a24209eae3547e14783f7.jpg, https://salt.tikicdn.com/cache/200x280/ts/product/62/83/5a/4c532de69c3dd11e25a6ee879dd7e0c0.jpg, https://salt.tikicdn.com/cache/200x280/ts/product/fa/f4/3c/de7eb97e9829447e9426b6b9de49ca40.jpg","https://salt.tikicdn.com/cache/200x280/ts/product/f6/41/c3/3261ab7ff41a6501abdb38826158d327.jpg, https://salt.tikicdn.com/cache/200x280/ts/product/92/c4/21/113c37d4f2f0e779e843563caf01e520.jpg, https://salt.tikicdn.com/cache/200x280/ts/product/a8/39/10/9a2fdf04d01428f00fe0b2383b709a36.jpg, https://salt.tikicdn.com/cache/200x280/ts/product/9a/bc/a8/8f5c1cc0f287fc4518003a7559cbb411.jpg, https://salt.tikicdn.com/cache/200x280/ts/product/49/3f/a6/72c8cc7f130a24209eae3547e14783f7.jpg, https://salt.tikicdn.com/cache/200x280/ts/product/62/83/5a/4c532de69c3dd11e25a6ee879dd7e0c0.jpg, https://salt.tikicdn.com/cache/200x280/ts/product/fa/f4/3c/de7eb97e9829447e9426b6b9de49ca40.jpg",1000,0
191298287,Bóp Viết CLEVER HIPPO Classic - Alpaca Tinh Nghịch Hồng HA0112/PINK,149000,Bóp Viết CLEVER HIPPO Classic - Alpaca Tinh Nghịch Hồng HA0112/PINKKÍCH THƯỚC: 8 X 22 X 7 cmTRỌNG LƯỢNG: 70gCHẤT LIỆU: Vải chính & vải lót 100% PolyesterTÍNH NĂNG: - Thiết kế nổi bật và đồng bộ b...,"Bóp Viết CLEVER HIPPO Classic - Alpaca Tinh Nghịch Hồng HA0112/PINK KÍCH THƯỚC: 8 X 22 X 7 cm TRỌNG LƯỢNG: 70g CHẤT LIỆU: Vải chính & vải lót 100% Polyester TÍNH NĂNG: - Thiết kế nổi bật và đồng bộ ba lô cùng dây kéo phao cá tính. - Các ngăn chứa rộng rãi, thoải mái. - Chất liệu nhẹ vải polyester trượt nước, dễ dàng vệ sinh. - Bộ tay – đầu kéo HKK chất lượng Giá sản phẩm trên Tiki đã bao gồm thuế theo luật hiện hành. Bên cạnh đó, tuỳ vào loại sản phẩm, hình thức và địa chỉ giao hàng mà có thể phát sinh thêm chi phí khác như phí vận chuyển, phụ phí hàng cồng kềnh, thuế nhập khẩu (đối với đơn hàng giao từ nước ngoài có giá trị trên 1 triệu đồng).....",0,0,"https://salt.tikicdn.com/ts/product/6c/80/ce/16331c474f7db47613c40f7049864b67.jpg, https://salt.tikicdn.com/ts/product/ec/3b/db/f34333d39c10209f3669634f5561bc0f.jpg, https://salt.tikicdn.com/ts/product/c4/83/72/e731b95e0c1dcc164e5fd9e0957f68b9.jpg, https://salt.tikicdn.com/ts/product/c6/df/75/1da0f625f5c285fa4767fe74283039df.jpg","https://salt.tikicdn.com/cache/w1200/ts/product/6c/80/ce/16331c474f7db47613c40f7049864b67.jpg, https://salt.tikicdn.com/cache/w1200/ts/product/ec/3b/db/f34333d39c10209f3669634f5561bc0f.jpg, https://salt.tikicdn.com/cache/w1200/ts/product/c4/83/72/e731b95e0c1dcc164e5fd9e0957f68b9.jpg, https://salt.tikicdn.com/cache/w1200/ts/product/c6/df/75/1da0f625f5c285fa4767fe74283039df.jpg","https://salt.tikicdn.com/cache/w300/ts/product/6c/80/ce/16331c474f7db47613c40f7049864b67.jpg, https://salt.tikicdn.com/cache/w300/ts/product/ec/3b/db/f34333d39c10209f3669634f5561bc0f.jpg, https://salt.tikicdn.com/cache/w300/ts/product/c4/83/72/e731b95e0c1dcc164e5fd9e0957f68b9.jpg, https://salt.tikicdn.com/cache/w300/ts/product/c6/df/75/1da0f625f5c285fa4767fe74283039df.jpg","https://salt.tikicdn.com/cache/200x280/ts/product/6c/80/ce/16331c474f7db47613c40f7049864b67.jpg, https://salt.tikicdn.com/cache/200x280/ts/product/ec/3b/db/f34333d39c10209f3669634f5561bc0f.jpg, https://salt.tikicdn.com/cache/200x280/ts/product/c4/83/72/e731b95e0c1dcc164e5fd9e0957f68b9.jpg, https://salt.tikicdn.com/cache/200x280/ts/product/c6/df/75/1da0f625f5c285fa4767fe74283039df.jpg","https://salt.tikicdn.com/cache/200x280/ts/product/6c/80/ce/16331c474f7db47613c40f7049864b67.jpg, https://salt.tikicdn.com/cache/200x280/ts/product/ec/3b/db/f34333d39c10209f3669634f5561bc0f.jpg, https://salt.tikicdn.com/cache/200x280/ts/product/c4/83/72/e731b95e0c1dcc164e5fd9e0957f68b9.jpg, https://salt.tikicdn.com/cache/200x280/ts/product/c6/df/75/1da0f625f5c285fa4767fe74283039df.jpg",1000,0
186553415,Hộp đựng bút thiếc hai tầng nhiều hình dáng đáng yêu,66500,"Hộp đựng bút thiếc hai tầng nhiều hình dáng đáng yêuKích thước: 16.5 x 8.3 x 5.6cmXuất Xứ: Trung QuốcHộp đựng bút làm bằng thiếc, kiểu dáng đáng yêu.Thiết kế hai tầng giúp đựng được nhiều bút viết hơ...","Hộp đựng bút thiếc hai tầng nhiều hình dáng đáng yêu Kích thước: 16.5 x 8.3 x 5.6cm Xuất Xứ: Trung Quốc Hộp đựng bút làm bằng thiếc, kiểu dáng đáng yêu. Thiết kế hai tầng giúp đựng được nhiều bút viết hơn. Giá sản phẩm trên Tiki đã bao gồm thuế theo luật hiện hành. Bên cạnh đó, tuỳ vào loại sản phẩm, hình thức và địa chỉ giao hàng mà có thể phát sinh thêm chi phí khác như phí vận chuyển, phụ phí hàng cồng kềnh, thuế nhập khẩu (đối với đơn hàng giao từ nước ngoài có giá trị trên 1 triệu đồng).....",0,0,https://salt.tikicdn.com/ts/product/a4/98/b7/a438373c1d7967cb6434af2477f43485.jpg,https://salt.tikicdn.com/cache/w1200/ts/product/a4/98/b7/a438373c1d7967cb6434af2477f43485.jpg,https://salt.tikicdn.com/cache/w300/ts/product/a4/98/b7/a438373c1d7967cb6434af2477f43485.jpg,https://salt.tikicdn.com/cache/200x280/ts/product/a4/98/b7/a438373c1d7967cb6434af2477f43485.jpg,https://salt.tikicdn.com/cache/200x280/ts/product/a4/98/b7/a438373c1d7967cb6434af2477f43485.jpg,1000,0
119720096,Túi Bút Học Sinh 2 Ngăn Stacom - PB2011C,58000,"Ưu điểm sản phẩm:- Hộp đựng bút làm bằng vải Polyester chống thấm nước và dễ dàng tẩy rửa khi bị bẩn.- Hộp có 02 ngăn n tiện dụng cho việc cất trữ các dụng cụ học sinh.- Thiết kế dễ thương, nhiều màu ...","Ưu điểm sản phẩm: - Hộp đựng bút làm bằng vải Polyester chống thấm nước và dễ dàng tẩy rửa khi bị bẩn. - Hộp có 02 ngăn n tiện dụng cho việc cất trữ các dụng cụ học sinh. - Thiết kế dễ thương, nhiều màu để lựa chọn. - Kích thước: 195*55*40mm - Thích hợp dùng với đối tượng học sinh - sinh viên Màu sắc: Xanh, hồng, tím đậm, tím nhạt Giá sản phẩm trên Tiki đã bao gồm thuế theo luật hiện hành. Bên cạnh đó, tuỳ vào loại sản phẩm, hình thức và địa chỉ giao hàng mà có thể phát sinh thêm chi phí khác như phí vận chuyển, phụ phí hàng cồng kềnh, thuế nhập khẩu (đối với đơn hàng giao từ nước ngoài có giá trị trên 1 triệu đồng).....",0,0,"https://salt.tikicdn.com/ts/product/82/ab/8b/239f2c8e89972607ae549ab6eefff9de.jpg, https://salt.tikicdn.com/ts/product/42/9f/db/91f368b589037d7bac80b2e6195e1488.jpg, https://salt.tikicdn.com/ts/product/9e/87/50/ca875b4b672a6095da25593e7fa5d3b3.jpg, https://salt.tikicdn.com/ts/product/e8/ff/3e/238192f4b352fc9513630c6771fc4831.jpg, https://salt.tikicdn.com/ts/product/c5/c2/5f/9d9510e63edf56f49c2e500b36d5b9f1.jpg, https://salt.tikicdn.com/ts/product/ac/52/a5/2db51664684e7f5ece225ffa4d547798.jpg, https://salt.tikicdn.com/ts/product/53/28/ae/057d6fdb2578e50b84fdc44acd1de17a.jpg","https://salt.tikicdn.com/cache/w1200/ts/product/82/ab/8b/239f2c8e89972607ae549ab6eefff9de.jpg, https://salt.tikicdn.com/cache/w1200/ts/product/42/9f/db/91f368b589037d7bac80b2e6195e1488.jpg, https://salt.tikicdn.com/cache/w1200/ts/product/9e/87/50/ca875b4b672a6095da25593e7fa5d3b3.jpg, https://salt.tikicdn.com/cache/w1200/ts/product/e8/ff/3e/238192f4b352fc9513630c6771fc4831.jpg, https://salt.tikicdn.com/cache/w1200/ts/product/c5/c2/5f/9d9510e63edf56f49c2e500b36d5b9f1.jpg, https://salt.tikicdn.com/cache/w1200/ts/product/ac/52/a5/2db51664684e7f5ece225ffa4d547798.jpg, https://salt.tikicdn.com/cache/w1200/ts/product/53/28/ae/057d6fdb2578e50b84fdc44acd1de17a.jpg","https://salt.tikicdn.com/cache/w300/ts/product/82/ab/8b/239f2c8e89972607ae549ab6eefff9de.jpg, https://salt.tikicdn.com/cache/w300/ts/product/42/9f/db/91f368b589037d7bac80b2e6195e1488.jpg, https://salt.tikicdn.com/cache/w300/ts/product/9e/87/50/ca875b4b672a6095da25593e7fa5d3b3.jpg, https://salt.tikicdn.com/cache/w300/ts/product/e8/ff/3e/238192f4b352fc9513630c6771fc4831.jpg, https://salt.tikicdn.com/cache/w300/ts/product/c5/c2/5f/9d9510e63edf56f49c2e500b36d5b9f1.jpg, https://salt.tikicdn.com/cache/w300/ts/product/ac/52/a5/2db51664684e7f5ece225ffa4d547798.jpg, https://salt.tikicdn.com/cache/w300/ts/product/53/28/ae/057d6fdb2578e50b84fdc44acd1de17a.jpg","https://salt.tikicdn.com/cache/200x280/ts/product/82/ab/8b/239f2c8e89972607ae549ab6eefff9de.jpg, https://salt.tikicdn.com/cache/200x280/ts/product/42/9f/db/91f368b589037d7bac80b2e6195e1488.jpg, https://salt.tikicdn.com/cache/200x280/ts/product/9e/87/50/ca875b4b672a6095da25593e7fa5d3b3.jpg, https://salt.tikicdn.com/cache/200x280/ts/product/e8/ff/3e/238192f4b352fc9513630c6771fc4831.jpg, https://salt.tikicdn.com/cache/200x280/ts/product/c5/c2/5f/9d9510e63edf56f49c2e500b36d5b9f1.jpg, https://salt.tikicdn.com/cache/200x280/ts/product/ac/52/a5/2db51664684e7f5ece225ffa4d547798.jpg, https://salt.tikicdn.com/cache/200x280/ts/product/53/28/ae/057d6fdb2578e50b84fdc44acd1de17a.jpg","https://salt.tikicdn.com/cache/200x280/ts/product/82/ab/8b/239f2c8e89972607ae549ab6eefff9de.jpg, https://salt.tikicdn.com/cache/200x280/ts/product/42/9f/db/91f368b589037d7bac80b2e6195e1488.jpg, https://salt.tikicdn.com/cache/200x280/ts/product/9e/87/50/ca875b4b672a6095da25593e7fa5d3b3.jpg, https://salt.tikicdn.com/cache/200x280/ts/product/e8/ff/3e/238192f4b352fc9513630c6771fc4831.jpg, https://salt.tikicdn.com/cache/200x280/ts/product/c5/c2/5f/9d9510e63edf56f49c2e500b36d5b9f1.jpg, https://salt.tikicdn.com/cache/200x280/ts/product/ac/52/a5/2db51664684e7f5ece225ffa4d547798.jpg, https://salt.tikicdn.com/cache/200x280/ts/product/53/28/ae/057d6fdb2578e50b84fdc44acd1de17a.jpg",1000,0
119719641,Túi Bút Học Sinh 2 Ngăn Stacom - PB2011B,59000,"Ưu điểm sản phẩm:- Hộp đựng bút làm bằng vải Polyester chống thấm nước và dễ dàng tẩy rửa khi bị bẩn.- Hộp có 02 ngăn n tiện dụng cho việc cất trữ các dụng cụ học sinh.- Thiết kế dễ thương, nhiều màu...","Ưu điểm sản phẩm: - Hộp đựng bút làm bằng vải Polyester chống thấm nước và dễ dàng tẩy rửa khi bị bẩn. - Hộp có 02 ngăn n tiện dụng cho việc cất trữ các dụng cụ học sinh. - Thiết kế dễ thương, nhiều màu để lựa chọn. - Kích thước: 195*55*40mm - Thích hợp dùng với đối tượng học sinh - sinh viên Màu sắc: Xanh, hồng, tím Giá sản phẩm trên Tiki đã bao gồm thuế theo luật hiện hành. Bên cạnh đó, tuỳ vào loại sản phẩm, hình thức và địa chỉ giao hàng mà có thể phát sinh thêm chi phí khác như phí vận chuyển, phụ phí hàng cồng kềnh, thuế nhập khẩu (đối với đơn hàng giao từ nước ngoài có giá trị trên 1 triệu đồng).....",0,0,"https://salt.tikicdn.com/ts/product/11/b9/69/dee810554b415e7041f4b30a06d646e4.jpg, https://salt.tikicdn.com/ts/product/35/64/d7/79aa3581beb4336c5c11ce3362375389.jpg, https://salt.tikicdn.com/ts/product/59/74/f4/a7b9b198a1fdc5d63a08cd6d9ff9849d.jpg, https://salt.tikicdn.com/ts/product/ba/da/84/e7387d4f91b13358af4293564adf72b2.jpg, https://salt.tikicdn.com/ts/product/de/4f/37/819ea2bfe8dba679c0d723b6b66d90c8.jpg, https://salt.tikicdn.com/ts/product/78/ef/b7/e37eb1cba680e9b1b93adc1b65eb08a2.jpg","https://salt.tikicdn.com/cache/w1200/ts/product/11/b9/69/dee810554b415e7041f4b30a06d646e4.jpg, https://salt.tikicdn.com/cache/w1200/ts/product/35/64/d7/79aa3581beb4336c5c11ce3362375389.jpg, https://salt.tikicdn.com/cache/w1200/ts/product/59/74/f4/a7b9b198a1fdc5d63a08cd6d9ff9849d.jpg, https://salt.tikicdn.com/cache/w1200/ts/product/ba/da/84/e7387d4f91b13358af4293564adf72b2.jpg, https://salt.tikicdn.com/cache/w1200/ts/product/de/4f/37/819ea2bfe8dba679c0d723b6b66d90c8.jpg, https://salt.tikicdn.com/cache/w1200/ts/product/78/ef/b7/e37eb1cba680e9b1b93adc1b65eb08a2.jpg","https://salt.tikicdn.com/cache/w300/ts/product/11/b9/69/dee810554b415e7041f4b30a06d646e4.jpg, https://salt.tikicdn.com/cache/w300/ts/product/35/64/d7/79aa3581beb4336c5c11ce3362375389.jpg, https://salt.tikicdn.com/cache/w300/ts/product/59/74/f4/a7b9b198a1fdc5d63a08cd6d9ff9849d.jpg, https://salt.tikicdn.com/cache/w300/ts/product/ba/da/84/e7387d4f91b13358af4293564adf72b2.jpg, https://salt.tikicdn.com/cache/w300/ts/product/de/4f/37/819ea2bfe8dba679c0d723b6b66d90c8.jpg, https://salt.tikicdn.com/cache/w300/ts/product/78/ef/b7/e37eb1cba680e9b1b93adc1b65eb08a2.jpg","https://salt.tikicdn.com/cache/200x280/ts/product/11/b9/69/dee810554b415e7041f4b30a06d646e4.jpg, https://salt.tikicdn.com/cache/200x280/ts/product/35/64/d7/79aa3581beb4336c5c11ce3362375389.jpg, https://salt.tikicdn.com/cache/200x280/ts/product/59/74/f4/a7b9b198a1fdc5d63a08cd6d9ff9849d.jpg, https://salt.tikicdn.com/cache/200x280/ts/product/ba/da/84/e7387d4f91b13358af4293564adf72b2.jpg, https://salt.tikicdn.com/cache/200x280/ts/product/de/4f/37/819ea2bfe8dba679c0d723b6b66d90c8.jpg, https://salt.tikicdn.com/cache/200x280/ts/product/78/ef/b7/e37eb1cba680e9b1b93adc1b65eb08a2.jpg","https://salt.tikicdn.com/cache/200x280/ts/product/11/b9/69/dee810554b415e7041f4b30a06d646e4.jpg, https://salt.tikicdn.com/cache/200x280/ts/product/35/64/d7/79aa3581beb4336c5c11ce3362375389.jpg, https://salt.tikicdn.com/cache/200x280/ts/product/59/74/f4/a7b9b198a1fdc5d63a08cd6d9ff9849d.jpg, https://salt.tikicdn.com/cache/200x280/ts/product/ba/da/84/e7387d4f91b13358af4293564adf72b2.jpg, https://salt.tikicdn.com/cache/200x280/ts/product/de/4f/37/819ea2bfe8dba679c0d723b6b66d90c8.jpg, https://salt.tikicdn.com/cache/200x280/ts/product/78/ef/b7/e37eb1cba680e9b1b93adc1b65eb08a2.jpg",1000,0
119719592,Túi Bút Học Sinh 01 ngăn STACOM_ PB1012A,38300,Ưu điểm sản phẩm:- Túi được may từ vải bố cao cấp.- Họa tiết sinh động với 01 ngăn mở rộng rất tiện cho việc chứa các đồ dùng học tập cần thiết.- Sản phẩm thích hợp dùng cho các bạn học sinh - sinh vi...,"Ưu điểm sản phẩm: - Túi được may từ vải bố cao cấp. - Họa tiết sinh động với 01 ngăn mở rộng rất tiện cho việc chứa các đồ dùng học tập cần thiết. - Sản phẩm thích hợp dùng cho các bạn học sinh - sinh viên - Kích thước: 195*55*40mm - Màu sắc ngẫu nhiên: Hồng, xanh, tím Giá sản phẩm trên Tiki đã bao gồm thuế theo luật hiện hành. Bên cạnh đó, tuỳ vào loại sản phẩm, hình thức và địa chỉ giao hàng mà có thể phát sinh thêm chi phí khác như phí vận chuyển, phụ phí hàng cồng kềnh, thuế nhập khẩu (đối với đơn hàng giao từ nước ngoài có giá trị trên 1 triệu đồng).....",0,0,"https://salt.tikicdn.com/ts/product/be/37/e7/7d5fd2dc50b339dddee7079af9dcca94.jpg, https://salt.tikicdn.com/ts/product/db/09/9e/48bd5de5331cd82771d1cedd2d8dd24b.jpg, https://salt.tikicdn.com/ts/product/b3/a7/42/71de0201d590517ce6445a14b38adbac.jpg, https://salt.tikicdn.com/ts/product/80/60/32/6d86b318187dbf4dd2c87d393b5bda55.jpg, https://salt.tikicdn.com/ts/product/e9/ef/97/bec3dc3ba0b6c9ae0192602eb48d366e.jpg","https://salt.tikicdn.com/cache/w1200/ts/product/be/37/e7/7d5fd2dc50b339dddee7079af9dcca94.jpg, https://salt.tikicdn.com/cache/w1200/ts/product/db/09/9e/48bd5de5331cd82771d1cedd2d8dd24b.jpg, https://salt.tikicdn.com/cache/w1200/ts/product/b3/a7/42/71de0201d590517ce6445a14b38adbac.jpg, https://salt.tikicdn.com/cache/w1200/ts/product/80/60/32/6d86b318187dbf4dd2c87d393b5bda55.jpg, https://salt.tikicdn.com/cache/w1200/ts/product/e9/ef/97/bec3dc3ba0b6c9ae0192602eb48d366e.jpg","https://salt.tikicdn.com/cache/w300/ts/product/be/37/e7/7d5fd2dc50b339dddee7079af9dcca94.jpg, https://salt.tikicdn.com/cache/w300/ts/product/db/09/9e/48bd5de5331cd82771d1cedd2d8dd24b.jpg, https://salt.tikicdn.com/cache/w300/ts/product/b3/a7/42/71de0201d590517ce6445a14b38adbac.jpg, https://salt.tikicdn.com/cache/w300/ts/product/80/60/32/6d86b318187dbf4dd2c87d393b5bda55.jpg, https://salt.tikicdn.com/cache/w300/ts/product/e9/ef/97/bec3dc3ba0b6c9ae0192602eb48d366e.jpg","https://salt.tikicdn.com/cache/200x280/ts/product/be/37/e7/7d5fd2dc50b339dddee7079af9dcca94.jpg, https://salt.tikicdn.com/cache/200x280/ts/product/db/09/9e/48bd5de5331cd82771d1cedd2d8dd24b.jpg, https://salt.tikicdn.com/cache/200x280/ts/product/b3/a7/42/71de0201d590517ce6445a14b38adbac.jpg, https://salt.tikicdn.com/cache/200x280/ts/product/80/60/32/6d86b318187dbf4dd2c87d393b5bda55.jpg, https://salt.tikicdn.com/cache/200x280/ts/product/e9/ef/97/bec3dc3ba0b6c9ae0192602eb48d366e.jpg","https://salt.tikicdn.com/cache/200x280/ts/product/be/37/e7/7d5fd2dc50b339dddee7079af9dcca94.jpg, https://salt.tikicdn.com/cache/200x280/ts/product/db/09/9e/48bd5de5331cd82771d1cedd2d8dd24b.jpg, https://salt.tikicdn.com/cache/200x280/ts/product/b3/a7/42/71de0201d590517ce6445a14b38adbac.jpg, https://salt.tikicdn.com/cache/200x280/ts/product/80/60/32/6d86b318187dbf4dd2c87d393b5bda55.jpg, https://salt.tikicdn.com/cache/200x280/ts/product/e9/ef/97/bec3dc3ba0b6c9ae0192602eb48d366e.jpg",1000,0
