id,name,price,short_description,description,rating_average,review_count,image_base_url,image_large_url,image_medium_url,image_small_url,image_thumbnail_url,stock,quantity_sold
276635059,"Bóp viết nhiều ngăn NATOLI, hộp bút cute chống nước đựng bút đa năng BST Simple Duo Pen Case T23",99000,"Bóp viết nhiều ngăn NATOLI, hộp bút cute chống nước đựng bút đa năng BST Simple Duo Pen Case T23 là một phụ kiện tiện dụng giúp bạn sắp xếp và bảo quản các loại bút, bút chì, thước kẻ và các vật dụng ...","Bóp viết nhiều ngăn NATOLI, hộp bút cute chống nước đựng bút đa năng BST Simple Duo Pen Case T23 là một phụ kiện tiện dụng giúp bạn sắp xếp và bảo quản các loại bút, bút chì, thước kẻ và các vật dụng học tập hay văn phòng phẩm khác một cách ngăn nắp. Hộp bút có màu sắc và kiểu dáng phù hợp với học sinh, sinh viên và cả dân văn phòng. Ngoài ra chất liệu chống nước tốt phù hợp với nhu cầu sử dụng của người dùng. THÔNG TIN CHI TIẾT HỘP BÚT NHIỀU NGĂN - Các điểm nổi bật của bóp viết + Chất liệu hộp bút to nhiều ngăn: Vải polyester kháng nước tốt + Kích thước hộp viết: 12 x 20 x 9 cm + Ngăn chính hộp bút xinh rộng rãi, đựng bút và vận dụng tiện lợi + Thiết kế bóp đựng viết tiện lợi: Dễ dàng để trong balo hoặc cặp sách + Bóp viết nam phù hợp với mọi lứa tuổi: Thiết kế basic màu sắc tối giản nên phù hợp với học sinh, sinh viên và nhân viên văn phòng - Lợi ích của hộp đựng bút + Bốp viết giúp sắp xếp đồ dùng: Hộp đựng bút để bàn giúp bạn sắp xếp các loại bút và dụng cụ học tập, tránh tình trạng làm mất hoặc không tìm thấy đồ dùng khi cần. + Bóp viết to tiện lợi: Nhỏ gọn, dễ dàng mang theo khi di chuyển, phù hợp với cả học sinh, sinh viên và người đi làm. + Bóp viết cute bảo vệ đồ dùng: Bảo vệ bút và các vật dụng khỏi bị gãy, mực bị đổ ra ngoài, giúp đồ dùng luôn sạch sẽ và bền lâu. CHẤT LIỆU HỘP BÚT TO - Chất liệu vải polyeter kháng nước tốt - Logo cải tiến - Không giặt tẩy hộp bút nam bằng các chất tẩy rửa mạnh - Không nên giặt hộp bút lông chung với các sản phẩm khác - Không nên sấy khô hộp bút vải trong máy giặt sẽ làm ảnh hướng đến các phần cầu kì như móc, khoá cứng - Dùng chất tẩy rửa nhẹ như xà bông, sửa tắm chà đánh bọt lên xong chà nhẹ lên vải. Sau đó giặt nhẹ lại bằng nước sạch - Phơi mát hộp bút đa năng tự nhiên tránh ánh nắng mặt trời làm ảnh hướng đến chất liệu và bạc màu vải - Đối với NATOLI, làm sao để trải nghiệm của khách hàng được tốt nhất, trọn vẹn nhất luôn là ưu tiên hàng đầu mà chúng mình hướng tới - Khi mua hàng của NATOLI, nếu sản phẩm chưa đáp ứng được yêu cầu bạn cần, đừng lo vì chúng mình luôn sẵn sàng Đồi/Trả hàng trong vòng 7 ngày - Bên cạnh đó, Chúng mình có dịch vụ Bảo hành miễn phí trọn đời tất cả nguyên phụ liệu, đường chỉ trên sản phẩm nên các bạn chỉ việc yên tâm, thoải mái sử dụng thôi - Và cuối cùng, tất cả các sản phẩm của NATOLI đều có giao hàng Hoả tốc, nên nếu bạn cần gấp - đừng lo, chúng mình sẽ giao ngay trong vòng 1-2h NATOLI CAM KẾT VỚI KHÁCH HÀNG - Hộp bút nhiều ngăn giá rẻ cam kết chất lượng và mẫu mã của sản phẩm giống với hình ảnh. - Bóp viết nhiều ngăn đổi trả phải còn mới và chưa qua sử dụng. Khách hàng nên kèm hình ảnh hoặc video lỗi của sản phẩm để NATOLI check và xác nhận sau đó sẽ thực hiện đổi trả sản phẩm theo chính sách bảo hành - đổi trả cho khách hàng - Hỗ trợ đối với các hộp bút cute bị lỗi do đơn vị vận chuyển, do nhà sản xuất và đặt nhầm size. - Bóp bút đổi trả trong vòng 5 ngày kể từ ngày nhận được hàng. THÔNG TIN THƯƠNG HIỆU - NATOLI được biết đến là hiện tại là đơn vị chuyên sản xuất gia công các mặt hàng balo đi học, đi chơi, laptop nam nữ… theo yêu cầu khách hàng trong & ngoài nước , phương châm “Uy tín nằm ở chất lượng”, NATOLI luôn nỗ lực từng ngày để phát triển kỹ thuật, công nghệ sản xuất hiện đại để từng sản phẩm khi đến tay khách hàng chỉnh chu nhất. - Nắm bắt được xu hướng thời trang và nhu cầu tiêu dùng của khách hàng, Công Ty Cổ Phần May NatolI cho ra mắt thương hiệu NATOLI và đón nhận được nhiều sự yêu thích của khách hàng khi NATOLI sử dụng các chất liệu có tính năng bảo vệ sức khỏe cho người sử dụng cùng các thiết kế được thực hiện theo tiêu chí: đẳng cấp tạo nên sự khác biệt #hopbut, #hopbutnhieungan, #bopviet, #hopdungbut, #hopdungbutdeban, #hopbutto, #hopbutnam, #hopbutlong, #hopbutvai, #hopbutdanang, #hopbutnhieungan, #bopvietnhieungan#hopbutcute#bopbut#hopbuttonhieungan#hopviet#hopbutxinh#bopdungviet#bopvietnam#bopviet#bopvietto#bopvietcute Giá sản phẩm trên Tiki đã bao gồm thuế theo luật hiện hành. Bên cạnh đó, tuỳ vào loại sản phẩm, hình thức và địa chỉ giao hàng mà có thể phát sinh thêm chi phí khác như phí vận chuyển, phụ phí hàng cồng kềnh, thuế nhập khẩu (đối với đơn hàng giao từ nước ngoài có giá trị trên 1 triệu đồng).....",5,2,"https://salt.tikicdn.com/ts/product/4a/57/a9/947fe64203dfd8cb6924dacac250ab76.jpg, https://salt.tikicdn.com/ts/product/6a/0c/7d/4231b392dc1c23d5d4c2f357151a23fc.jpg, https://salt.tikicdn.com/ts/product/32/56/9a/c97e53000c613391ae6d66d154e6f778.jpg, https://salt.tikicdn.com/ts/product/a5/6e/0e/391854e4802459d4243a5897393b222e.jpg, https://salt.tikicdn.com/ts/product/c7/70/c1/579185f8a41d89963ba8f572fcdb1bbc.jpg","https://salt.tikicdn.com/cache/w1200/ts/product/4a/57/a9/947fe64203dfd8cb6924dacac250ab76.jpg, https://salt.tikicdn.com/cache/w1200/ts/product/6a/0c/7d/4231b392dc1c23d5d4c2f357151a23fc.jpg, https://salt.tikicdn.com/cache/w1200/ts/product/32/56/9a/c97e53000c613391ae6d66d154e6f778.jpg, https://salt.tikicdn.com/cache/w1200/ts/product/a5/6e/0e/391854e4802459d4243a5897393b222e.jpg, https://salt.tikicdn.com/cache/w1200/ts/product/c7/70/c1/579185f8a41d89963ba8f572fcdb1bbc.jpg","https://salt.tikicdn.com/cache/w300/ts/product/4a/57/a9/947fe64203dfd8cb6924dacac250ab76.jpg, https://salt.tikicdn.com/cache/w300/ts/product/6a/0c/7d/4231b392dc1c23d5d4c2f357151a23fc.jpg, https://salt.tikicdn.com/cache/w300/ts/product/32/56/9a/c97e53000c613391ae6d66d154e6f778.jpg, https://salt.tikicdn.com/cache/w300/ts/product/a5/6e/0e/391854e4802459d4243a5897393b222e.jpg, https://salt.tikicdn.com/cache/w300/ts/product/c7/70/c1/579185f8a41d89963ba8f572fcdb1bbc.jpg","https://salt.tikicdn.com/cache/200x280/ts/product/4a/57/a9/947fe64203dfd8cb6924dacac250ab76.jpg, https://salt.tikicdn.com/cache/200x280/ts/product/6a/0c/7d/4231b392dc1c23d5d4c2f357151a23fc.jpg, https://salt.tikicdn.com/cache/200x280/ts/product/32/56/9a/c97e53000c613391ae6d66d154e6f778.jpg, https://salt.tikicdn.com/cache/200x280/ts/product/a5/6e/0e/391854e4802459d4243a5897393b222e.jpg, https://salt.tikicdn.com/cache/200x280/ts/product/c7/70/c1/579185f8a41d89963ba8f572fcdb1bbc.jpg","https://salt.tikicdn.com/cache/200x280/ts/product/4a/57/a9/947fe64203dfd8cb6924dacac250ab76.jpg, https://salt.tikicdn.com/cache/200x280/ts/product/6a/0c/7d/4231b392dc1c23d5d4c2f357151a23fc.jpg, https://salt.tikicdn.com/cache/200x280/ts/product/32/56/9a/c97e53000c613391ae6d66d154e6f778.jpg, https://salt.tikicdn.com/cache/200x280/ts/product/a5/6e/0e/391854e4802459d4243a5897393b222e.jpg, https://salt.tikicdn.com/cache/200x280/ts/product/c7/70/c1/579185f8a41d89963ba8f572fcdb1bbc.jpg",1000,2
276357200," Hộp đựng bút hình mèo dễ thương, ngăn chứa rộng rãi chất liệu da mềm",69000,Hộp đựng bút hình mèo cho bé là một trong những người bạn thân thiết của chúng ta trong suốt quá trình học tập.Nó đã giúp ích rất nhiều trong việc bảo quản những chiếc bút và đồ dùng nhỏ xinh khác.C...,"Hộp đựng bút hình mèo cho bé là một trong những người bạn thân thiết của chúng ta trong suốt quá trình học tập. Nó đã giúp ích rất nhiều trong việc bảo quản những chiếc bút và đồ dùng nhỏ xinh khác. Chất liệu da mềm, nhẹ, bền đẹp cùng với sắc bắt mắt thoải mái cho bạn lựa chọn. Chức năng: đựng bút/làm quà cho bạn bè, người thân. Kích thước :21.5*10.5*8cm Mẫu: đa dạng. Shop giao mẫu ngẫu nhiên. Nếu bạn muốn chọn mẫu hãy ib shop nhé Giá sản phẩm trên Tiki đã bao gồm thuế theo luật hiện hành. Bên cạnh đó, tuỳ vào loại sản phẩm, hình thức và địa chỉ giao hàng mà có thể phát sinh thêm chi phí khác như phí vận chuyển, phụ phí hàng cồng kềnh, thuế nhập khẩu (đối với đơn hàng giao từ nước ngoài có giá trị trên 1 triệu đồng).....",0,0,"https://salt.tikicdn.com/ts/product/cd/1b/7e/1dea3d3a02ec68b4416dc9efe9a72c87.png, https://salt.tikicdn.com/ts/product/c5/1b/82/44ff7632cbd281551975452f9b083996.jpg, https://salt.tikicdn.com/ts/product/50/b6/51/19023311dbbf30b5c16d23ef60555ae4.jpg, https://salt.tikicdn.com/ts/product/06/64/04/21e22d8c94ada3435175e2020ebfbef9.jpg, https://salt.tikicdn.com/ts/product/5c/af/8e/280364ef921352e6164ebf6a6c1eeba6.jpg, https://salt.tikicdn.com/ts/product/88/5f/e9/d5f351370dcfefdeb616915bf91be649.jpg, https://salt.tikicdn.com/ts/product/fb/f7/45/7f02a255d5fe611f609334e5b313c65e.jpg, https://salt.tikicdn.com/ts/product/5c/e9/36/7c0bee862740185cf1c9b9272027422f.jpg, https://salt.tikicdn.com/ts/product/7d/5a/d9/bb2d97b26c92af77a938d982f322d373.jpg, https://salt.tikicdn.com/ts/product/e6/78/93/8745496727dc32195293f1aded0093f7.jpg","https://salt.tikicdn.com/cache/w1200/ts/product/cd/1b/7e/1dea3d3a02ec68b4416dc9efe9a72c87.png, https://salt.tikicdn.com/cache/w1200/ts/product/c5/1b/82/44ff7632cbd281551975452f9b083996.jpg, https://salt.tikicdn.com/cache/w1200/ts/product/50/b6/51/19023311dbbf30b5c16d23ef60555ae4.jpg, https://salt.tikicdn.com/cache/w1200/ts/product/06/64/04/21e22d8c94ada3435175e2020ebfbef9.jpg, https://salt.tikicdn.com/cache/w1200/ts/product/5c/af/8e/280364ef921352e6164ebf6a6c1eeba6.jpg, https://salt.tikicdn.com/cache/w1200/ts/product/88/5f/e9/d5f351370dcfefdeb616915bf91be649.jpg, https://salt.tikicdn.com/cache/w1200/ts/product/fb/f7/45/7f02a255d5fe611f609334e5b313c65e.jpg, https://salt.tikicdn.com/cache/w1200/ts/product/5c/e9/36/7c0bee862740185cf1c9b9272027422f.jpg, https://salt.tikicdn.com/cache/w1200/ts/product/7d/5a/d9/bb2d97b26c92af77a938d982f322d373.jpg, https://salt.tikicdn.com/cache/w1200/ts/product/e6/78/93/8745496727dc32195293f1aded0093f7.jpg","https://salt.tikicdn.com/cache/w300/ts/product/cd/1b/7e/1dea3d3a02ec68b4416dc9efe9a72c87.png, https://salt.tikicdn.com/cache/w300/ts/product/c5/1b/82/44ff7632cbd281551975452f9b083996.jpg, https://salt.tikicdn.com/cache/w300/ts/product/50/b6/51/19023311dbbf30b5c16d23ef60555ae4.jpg, https://salt.tikicdn.com/cache/w300/ts/product/06/64/04/21e22d8c94ada3435175e2020ebfbef9.jpg, https://salt.tikicdn.com/cache/w300/ts/product/5c/af/8e/280364ef921352e6164ebf6a6c1eeba6.jpg, https://salt.tikicdn.com/cache/w300/ts/product/88/5f/e9/d5f351370dcfefdeb616915bf91be649.jpg, https://salt.tikicdn.com/cache/w300/ts/product/fb/f7/45/7f02a255d5fe611f609334e5b313c65e.jpg, https://salt.tikicdn.com/cache/w300/ts/product/5c/e9/36/7c0bee862740185cf1c9b9272027422f.jpg, https://salt.tikicdn.com/cache/w300/ts/product/7d/5a/d9/bb2d97b26c92af77a938d982f322d373.jpg, https://salt.tikicdn.com/cache/w300/ts/product/e6/78/93/8745496727dc32195293f1aded0093f7.jpg","https://salt.tikicdn.com/cache/200x280/ts/product/cd/1b/7e/1dea3d3a02ec68b4416dc9efe9a72c87.png, https://salt.tikicdn.com/cache/200x280/ts/product/c5/1b/82/44ff7632cbd281551975452f9b083996.jpg, https://salt.tikicdn.com/cache/200x280/ts/product/50/b6/51/19023311dbbf30b5c16d23ef60555ae4.jpg, https://salt.tikicdn.com/cache/200x280/ts/product/06/64/04/21e22d8c94ada3435175e2020ebfbef9.jpg, https://salt.tikicdn.com/cache/200x280/ts/product/5c/af/8e/280364ef921352e6164ebf6a6c1eeba6.jpg, https://salt.tikicdn.com/cache/200x280/ts/product/88/5f/e9/d5f351370dcfefdeb616915bf91be649.jpg, https://salt.tikicdn.com/cache/200x280/ts/product/fb/f7/45/7f02a255d5fe611f609334e5b313c65e.jpg, https://salt.tikicdn.com/cache/200x280/ts/product/5c/e9/36/7c0bee862740185cf1c9b9272027422f.jpg, https://salt.tikicdn.com/cache/200x280/ts/product/7d/5a/d9/bb2d97b26c92af77a938d982f322d373.jpg, https://salt.tikicdn.com/cache/200x280/ts/product/e6/78/93/8745496727dc32195293f1aded0093f7.jpg","https://salt.tikicdn.com/cache/200x280/ts/product/cd/1b/7e/1dea3d3a02ec68b4416dc9efe9a72c87.png, https://salt.tikicdn.com/cache/200x280/ts/product/c5/1b/82/44ff7632cbd281551975452f9b083996.jpg, https://salt.tikicdn.com/cache/200x280/ts/product/50/b6/51/19023311dbbf30b5c16d23ef60555ae4.jpg, https://salt.tikicdn.com/cache/200x280/ts/product/06/64/04/21e22d8c94ada3435175e2020ebfbef9.jpg, https://salt.tikicdn.com/cache/200x280/ts/product/5c/af/8e/280364ef921352e6164ebf6a6c1eeba6.jpg, https://salt.tikicdn.com/cache/200x280/ts/product/88/5f/e9/d5f351370dcfefdeb616915bf91be649.jpg, https://salt.tikicdn.com/cache/200x280/ts/product/fb/f7/45/7f02a255d5fe611f609334e5b313c65e.jpg, https://salt.tikicdn.com/cache/200x280/ts/product/5c/e9/36/7c0bee862740185cf1c9b9272027422f.jpg, https://salt.tikicdn.com/cache/200x280/ts/product/7d/5a/d9/bb2d97b26c92af77a938d982f322d373.jpg, https://salt.tikicdn.com/cache/200x280/ts/product/e6/78/93/8745496727dc32195293f1aded0093f7.jpg",1000,0
275685216,"Túi Đựng Bút, Bóp Viết Lưới Pastel Trong Suốt Deli - Kích Thước A5 - Hộp Bút Chống Thấm Nước, Sức Chứa Lớn Cho Học Sinh",12800,"TÚI ĐỰNG BÚT ĐỒ DÙNG CÁ NHÂN LƯỚI TRONG SUỐT DELI - Màu Ngẫu NhiênTÍNH NĂNG SẢN PHẨM:️Không thấm nước và chống mài mòn để bảo vệ các đồ dùng bên trong️Chất liệu PVC bền bỉ, dẻo dai️Sức chứa lớn, đ...","TÚI ĐỰNG BÚT ĐỒ DÙNG CÁ NHÂN LƯỚI TRONG SUỐT DELI - Màu Ngẫu Nhiên TÍNH NĂNG SẢN PHẨM: ️Không thấm nước và chống mài mòn để bảo vệ các đồ dùng bên trong ️Chất liệu PVC bền bỉ, dẻo dai ️Sức chứa lớn, đựng được cả sổ A5 và các đồ dùng học tập như máy tính, bút, tẩ ️Khóa kéo trơn tru, chắn chắn không để rời đồ bên trong ️Thiết kế 4 màu pastel xinh xắn, nhẹ nhàng, dễ sử dụng ️Phù hợp với mọi nhu cầu sử dụng trong văn phòng, trường học THÔNG TIN SẢN PHẨM: Tên sản phẩm: Túi Lưới Đựng Bút Đồ Dùng Cá Nhân Trong Suốt Deli Mã sản phẩm: 63480A Phân loại: 4 màu pastel giao ngẫu nhiên Xuất xứ: Trung Quốc Giá sản phẩm trên Tiki đã bao gồm thuế theo luật hiện hành. Bên cạnh đó, tuỳ vào loại sản phẩm, hình thức và địa chỉ giao hàng mà có thể phát sinh thêm chi phí khác như phí vận chuyển, phụ phí hàng cồng kềnh, thuế nhập khẩu (đối với đơn hàng giao từ nước ngoài có giá trị trên 1 triệu đồng).....",5,1,https://salt.tikicdn.com/ts/product/5a/c3/70/e52e6d351a6400123663816d43220dd5.png,https://salt.tikicdn.com/cache/w1200/ts/product/5a/c3/70/e52e6d351a6400123663816d43220dd5.png,https://salt.tikicdn.com/cache/w300/ts/product/5a/c3/70/e52e6d351a6400123663816d43220dd5.png,https://salt.tikicdn.com/cache/200x280/ts/product/5a/c3/70/e52e6d351a6400123663816d43220dd5.png,https://salt.tikicdn.com/cache/200x280/ts/product/5a/c3/70/e52e6d351a6400123663816d43220dd5.png,1000,1
275602299,Túi bút lưới trong suốt đơn giản kích thước A6 cho học sinh nam nữ - mã 1,21400," Sản phẩm đúng như hìnhBảo hành theo quy định của nhà sản xuất.Giá cả hợp lý, cạnh tranh, rẻ nhất thị trường.Hỗ trợ đổi trả hàng cho những sản phẩm bị thiếu...","Sản phẩm đúng như hình Bảo hành theo quy định của nhà sản xuất. Giá cả hợp lý, cạnh tranh, rẻ nhất thị trường. Hỗ trợ đổi trả hàng cho những sản phẩm bị thiếu Giá sản phẩm trên Tiki đã bao gồm thuế theo luật hiện hành. Bên cạnh đó, tuỳ vào loại sản phẩm, hình thức và địa chỉ giao hàng mà có thể phát sinh thêm chi phí khác như phí vận chuyển, phụ phí hàng cồng kềnh, thuế nhập khẩu (đối với đơn hàng giao từ nước ngoài có giá trị trên 1 triệu đồng).....",5,1,https://salt.tikicdn.com/ts/product/ff/08/c9/c749193f75c170d6aeb79f8833d02e39.png,https://salt.tikicdn.com/cache/w1200/ts/product/ff/08/c9/c749193f75c170d6aeb79f8833d02e39.png,https://salt.tikicdn.com/cache/w300/ts/product/ff/08/c9/c749193f75c170d6aeb79f8833d02e39.png,https://salt.tikicdn.com/cache/200x280/ts/product/ff/08/c9/c749193f75c170d6aeb79f8833d02e39.png,https://salt.tikicdn.com/cache/200x280/ts/product/ff/08/c9/c749193f75c170d6aeb79f8833d02e39.png,1000,1
274824506,Túi Đựng Bút Cho Bé Hình Bánh Mì Dễ Thương PaKaSa - Hàng Chính Hãng ,69000,️ Chất liệu: Vải mềm vẫn giữ được form và dễ dàng vệ sinh- Khóa kéo bằng kim loại bền bỉ và đầu dây kéo có móc cầm nắm giúp kéo dễ dàng.- Hộp bút size lớn hoặc túi đựng mỹ phẩm đủ hoạ tiết xinh xắn lu...,"️ Chất liệu: Vải mềm vẫn giữ được form và dễ dàng vệ sinh - Khóa kéo bằng kim loại bền bỉ và đầu dây kéo có móc cầm nắm giúp kéo dễ dàng. - Hộp bút size lớn hoặc túi đựng mỹ phẩm đủ hoạ tiết xinh xắn lung linh - Với kích thước lớn của túi thì các bạn nữ có thể tha hồ đựng mỹ phẩm, trang sức, đồ trang điểm…ô cùng tiện lợi và sành điệu nhé! - Họa tiết ngộ nghĩnh, đáng yêu và màu sắc bắt mắt ️ Màu sắc : Bánh mì ️ Kích thước : 23cm x 10cm ️ Style: Korea Giá sản phẩm trên Tiki đã bao gồm thuế theo luật hiện hành. Bên cạnh đó, tuỳ vào loại sản phẩm, hình thức và địa chỉ giao hàng mà có thể phát sinh thêm chi phí khác như phí vận chuyển, phụ phí hàng cồng kềnh, thuế nhập khẩu (đối với đơn hàng giao từ nước ngoài có giá trị trên 1 triệu đồng).....",0,0,"https://salt.tikicdn.com/ts/product/48/ec/41/0ef47476bf8c7424ec0d330ae5e0b82d.jpg, https://salt.tikicdn.com/ts/product/48/8b/5f/9c8de445f5a864eed4dba636556e381c.jpg, https://salt.tikicdn.com/ts/product/52/0a/0f/051f775d80ca07fac1c9779235b53ad9.jpg, https://salt.tikicdn.com/ts/product/21/88/86/5bd6308dbc9ffc042c0de5b89cf8aff8.jpg, https://salt.tikicdn.com/ts/product/f4/95/ea/2a033740cf48bc2756ac91cbb9c1e507.jpg, https://salt.tikicdn.com/ts/product/37/11/fe/2d4a076efe84d2913062e9d47a1a440f.jpg, https://salt.tikicdn.com/ts/product/71/e2/74/b1c82e07fbebc984669c86dcc854139c.jpg","https://salt.tikicdn.com/cache/w1200/ts/product/48/ec/41/0ef47476bf8c7424ec0d330ae5e0b82d.jpg, https://salt.tikicdn.com/cache/w1200/ts/product/48/8b/5f/9c8de445f5a864eed4dba636556e381c.jpg, https://salt.tikicdn.com/cache/w1200/ts/product/52/0a/0f/051f775d80ca07fac1c9779235b53ad9.jpg, https://salt.tikicdn.com/cache/w1200/ts/product/21/88/86/5bd6308dbc9ffc042c0de5b89cf8aff8.jpg, https://salt.tikicdn.com/cache/w1200/ts/product/f4/95/ea/2a033740cf48bc2756ac91cbb9c1e507.jpg, https://salt.tikicdn.com/cache/w1200/ts/product/37/11/fe/2d4a076efe84d2913062e9d47a1a440f.jpg, https://salt.tikicdn.com/cache/w1200/ts/product/71/e2/74/b1c82e07fbebc984669c86dcc854139c.jpg","https://salt.tikicdn.com/cache/w300/ts/product/48/ec/41/0ef47476bf8c7424ec0d330ae5e0b82d.jpg, https://salt.tikicdn.com/cache/w300/ts/product/48/8b/5f/9c8de445f5a864eed4dba636556e381c.jpg, https://salt.tikicdn.com/cache/w300/ts/product/52/0a/0f/051f775d80ca07fac1c9779235b53ad9.jpg, https://salt.tikicdn.com/cache/w300/ts/product/21/88/86/5bd6308dbc9ffc042c0de5b89cf8aff8.jpg, https://salt.tikicdn.com/cache/w300/ts/product/f4/95/ea/2a033740cf48bc2756ac91cbb9c1e507.jpg, https://salt.tikicdn.com/cache/w300/ts/product/37/11/fe/2d4a076efe84d2913062e9d47a1a440f.jpg, https://salt.tikicdn.com/cache/w300/ts/product/71/e2/74/b1c82e07fbebc984669c86dcc854139c.jpg","https://salt.tikicdn.com/cache/200x280/ts/product/48/ec/41/0ef47476bf8c7424ec0d330ae5e0b82d.jpg, https://salt.tikicdn.com/cache/200x280/ts/product/48/8b/5f/9c8de445f5a864eed4dba636556e381c.jpg, https://salt.tikicdn.com/cache/200x280/ts/product/52/0a/0f/051f775d80ca07fac1c9779235b53ad9.jpg, https://salt.tikicdn.com/cache/200x280/ts/product/21/88/86/5bd6308dbc9ffc042c0de5b89cf8aff8.jpg, https://salt.tikicdn.com/cache/200x280/ts/product/f4/95/ea/2a033740cf48bc2756ac91cbb9c1e507.jpg, https://salt.tikicdn.com/cache/200x280/ts/product/37/11/fe/2d4a076efe84d2913062e9d47a1a440f.jpg, https://salt.tikicdn.com/cache/200x280/ts/product/71/e2/74/b1c82e07fbebc984669c86dcc854139c.jpg","https://salt.tikicdn.com/cache/200x280/ts/product/48/ec/41/0ef47476bf8c7424ec0d330ae5e0b82d.jpg, https://salt.tikicdn.com/cache/200x280/ts/product/48/8b/5f/9c8de445f5a864eed4dba636556e381c.jpg, https://salt.tikicdn.com/cache/200x280/ts/product/52/0a/0f/051f775d80ca07fac1c9779235b53ad9.jpg, https://salt.tikicdn.com/cache/200x280/ts/product/21/88/86/5bd6308dbc9ffc042c0de5b89cf8aff8.jpg, https://salt.tikicdn.com/cache/200x280/ts/product/f4/95/ea/2a033740cf48bc2756ac91cbb9c1e507.jpg, https://salt.tikicdn.com/cache/200x280/ts/product/37/11/fe/2d4a076efe84d2913062e9d47a1a440f.jpg, https://salt.tikicdn.com/cache/200x280/ts/product/71/e2/74/b1c82e07fbebc984669c86dcc854139c.jpg",1000,0
