id,name,price,short_description,description,rating_average,review_count,image_base_url,image_large_url,image_medium_url,image_small_url,image_thumbnail_url,stock,quantity_sold
273927987,Bảng từ trắng viết bút lông treo tường Bavico KT 80x120cm,1341400,"Bảng từ trắng viết bút lông treo tường Bavico là dòng sản phẩm mới đáp ứng tối đa nhu cầu khách hàng trong việc lựa chọn sản phẩm bảng từ với đầy đủ chức năng nhưng giá thành rẻ , là lựa chọn của nhiề...","Bảng từ trắng viết bút lông treo tường Bavico là dòng sản phẩm mới đáp ứng tối đa nhu cầu khách hàng trong việc lựa chọn sản phẩm bảng từ với đầy đủ chức năng nhưng giá thành rẻ , là lựa chọn của nhiều khách hàng hiện nay Bảng từ trắng viết bút lông treo tường Bavico có mặt bảng từ trắng chất liệu bằng thép từ trắng được nhập khẩu từ Hàn Quốc, có ô ly vuông chìm 5cm, viết êm, lau dễ dàng dù viết để cả tháng mà lau vẫn không để lại dấu. Đặc biệt, đính nam châm được. Bảng từ trắng viết bút lông treo tường Bavico có cấu tạo như sau: 1. Mặt bảng: Mặt bảng từ trắng chất liệu bằng thép từ trắng sản xuất theo tiêu chuẩn Nhật Bản, có ô ly vuông chìm 5cm, viết êm, lau dễ dàng dù viết để cả tháng mà lau vẫn không để lại dấu. Đặc biệt, đính nam châm được. 2. Mặt sau: Bằng ván MDF dán vân gỗ đẹp, thẩm mỹ 3. Khung bo bảng: khung nhôm mới, dày 2cm, được thiết kế đảm bảo tính chịu lực cao. 4. Góc bảng: giữa hai góc nối lại với nhau bằng một co góc bảng làm bằng nhựa, góc bảng đẹp và hài hòa với khung bảng. Bảng từ trắng viết bút lông treo tường Bavico cho phép dùng nam châm đính hình ảnh minh họa. Đặc biệt, Bảng từ trắng viết bút lông của Bảng viết BAVICO không dính mực, không lem mực & lau dễ dàng Kích thước bảng : 80x120cm nhỏ gọn và thẩm mỹ cao Bảng có gắn sẵn 2 móc treo dùng để treo cố định lên tường Sản phẩm cam kết nhập khẩu chính hãng Korea quý khách hàng hoàn toàn yên tâm về chất lượng Giá sản phẩm trên Tiki đã bao gồm thuế theo luật hiện hành. Bên cạnh đó, tuỳ vào loại sản phẩm, hình thức và địa chỉ giao hàng mà có thể phát sinh thêm chi phí khác như phí vận chuyển, phụ phí hàng cồng kềnh, thuế nhập khẩu (đối với đơn hàng giao từ nước ngoài có giá trị trên 1 triệu đồng).....",3,2,"https://salt.tikicdn.com/ts/product/af/5d/3e/1d4bd4de68162333455e545d56872bca.jpg, https://salt.tikicdn.com/ts/product/3b/dc/81/951355aa437fa9b0cd84bd09f0cba09d.jpg, https://salt.tikicdn.com/ts/product/f0/d6/6d/1f70e0cba99b7ec5079d7b8505bcac65.png, https://salt.tikicdn.com/ts/product/34/06/0f/9e63a20d5df1f84b689d2c041c56799b.jpg","https://salt.tikicdn.com/cache/w1200/ts/product/af/5d/3e/1d4bd4de68162333455e545d56872bca.jpg, https://salt.tikicdn.com/cache/w1200/ts/product/3b/dc/81/951355aa437fa9b0cd84bd09f0cba09d.jpg, https://salt.tikicdn.com/cache/w1200/ts/product/f0/d6/6d/1f70e0cba99b7ec5079d7b8505bcac65.png, https://salt.tikicdn.com/cache/w1200/ts/product/34/06/0f/9e63a20d5df1f84b689d2c041c56799b.jpg","https://salt.tikicdn.com/cache/w300/ts/product/af/5d/3e/1d4bd4de68162333455e545d56872bca.jpg, https://salt.tikicdn.com/cache/w300/ts/product/3b/dc/81/951355aa437fa9b0cd84bd09f0cba09d.jpg, https://salt.tikicdn.com/cache/w300/ts/product/f0/d6/6d/1f70e0cba99b7ec5079d7b8505bcac65.png, https://salt.tikicdn.com/cache/w300/ts/product/34/06/0f/9e63a20d5df1f84b689d2c041c56799b.jpg","https://salt.tikicdn.com/cache/200x280/ts/product/af/5d/3e/1d4bd4de68162333455e545d56872bca.jpg, https://salt.tikicdn.com/cache/200x280/ts/product/3b/dc/81/951355aa437fa9b0cd84bd09f0cba09d.jpg, https://salt.tikicdn.com/cache/200x280/ts/product/f0/d6/6d/1f70e0cba99b7ec5079d7b8505bcac65.png, https://salt.tikicdn.com/cache/200x280/ts/product/34/06/0f/9e63a20d5df1f84b689d2c041c56799b.jpg","https://salt.tikicdn.com/cache/200x280/ts/product/af/5d/3e/1d4bd4de68162333455e545d56872bca.jpg, https://salt.tikicdn.com/cache/200x280/ts/product/3b/dc/81/951355aa437fa9b0cd84bd09f0cba09d.jpg, https://salt.tikicdn.com/cache/200x280/ts/product/f0/d6/6d/1f70e0cba99b7ec5079d7b8505bcac65.png, https://salt.tikicdn.com/cache/200x280/ts/product/34/06/0f/9e63a20d5df1f84b689d2c041c56799b.jpg",1000,2
273911134,Bảng từ trắng viết bút lông treo tường Bavico KT 40x60cm,279300,"Bảng từ trắng viết bút lông treo tường Bavico là dòng sản phẩm mới đáp ứng tối đa nhu cầu khách hàng trong việc lựa chọn sản phẩm bảng từ với đầy đủ chức năng nhưng giá thành rẻ , là lựa chọn của nhiề...","Bảng từ trắng viết bút lông treo tường Bavico là dòng sản phẩm mới đáp ứng tối đa nhu cầu khách hàng trong việc lựa chọn sản phẩm bảng từ với đầy đủ chức năng nhưng giá thành rẻ , là lựa chọn của nhiều khách hàng hiện nay Bảng từ trắng viết bút lông treo tường Bavico có mặt bảng từ trắng chất liệu bằng thép từ trắng sản xuất theo tiêu chuẩn Nhật Bản, có ô ly vuông chìm 5cm, viết êm, lau dễ dàng dù viết để cả tháng mà lau vẫn không để lại dấu. Đặc biệt, đính nam châm được. Bảng từ trắng viết bút lông treo tường Bavico có cấu tạo như sau: 1. Mặt bảng: Mặt bảng từ trắng chất liệu bằng thép từ trắng sản xuất theo tiêu chuẩn Nhật Bản, có ô ly vuông chìm 5cm, viết êm, lau dễ dàng dù viết để cả tháng mà lau vẫn không để lại dấu. Đặc biệt, đính nam châm được. 2. Mặt sau: Bằng tấm cốt nhựa chống rung dầy 9mm, chống ẩm. 3. Khung bo bảng: khung nhôm mới, dày 2cm, được thiết kế đảm bảo tính chịu lực cao. 4. Góc bảng: giữa hai góc nối lại với nhau bằng một co góc bảng làm bằng nhựa, góc bảng đẹp và hài hòa với khung bảng. Bảng từ trắng viết bút lông treo tường Bavico cho phép dùng nam châm đính hình ảnh minh họa. Đặc biệt, Bảng từ trắng viết bút lông của Bảng viết BAVICO không dính mực, không lem mực & lau dễ dàng Kích thước bảng : 40x60cm nhỏ gọn và thẩm mỹ cao Bảng có gắn sẵn 2 móc treo dùng để treo cố định lên tường Giá sản phẩm trên Tiki đã bao gồm thuế theo luật hiện hành. Bên cạnh đó, tuỳ vào loại sản phẩm, hình thức và địa chỉ giao hàng mà có thể phát sinh thêm chi phí khác như phí vận chuyển, phụ phí hàng cồng kềnh, thuế nhập khẩu (đối với đơn hàng giao từ nước ngoài có giá trị trên 1 triệu đồng).....",0,0,"https://salt.tikicdn.com/ts/product/3b/dc/81/4af962f975ec837706b976dd550f664b.jpg, https://salt.tikicdn.com/ts/product/97/1a/21/ed38dffaa03b0080d1d0ca614f5b288f.jpg, https://salt.tikicdn.com/ts/product/3a/16/a2/dc84c48489c6acf57e44335ece53815b.jpg, https://salt.tikicdn.com/ts/product/34/06/0f/015accc1833b62e3c58683714ed1c636.jpg","https://salt.tikicdn.com/cache/w1200/ts/product/3b/dc/81/4af962f975ec837706b976dd550f664b.jpg, https://salt.tikicdn.com/cache/w1200/ts/product/97/1a/21/ed38dffaa03b0080d1d0ca614f5b288f.jpg, https://salt.tikicdn.com/cache/w1200/ts/product/3a/16/a2/dc84c48489c6acf57e44335ece53815b.jpg, https://salt.tikicdn.com/cache/w1200/ts/product/34/06/0f/015accc1833b62e3c58683714ed1c636.jpg","https://salt.tikicdn.com/cache/w300/ts/product/3b/dc/81/4af962f975ec837706b976dd550f664b.jpg, https://salt.tikicdn.com/cache/w300/ts/product/97/1a/21/ed38dffaa03b0080d1d0ca614f5b288f.jpg, https://salt.tikicdn.com/cache/w300/ts/product/3a/16/a2/dc84c48489c6acf57e44335ece53815b.jpg, https://salt.tikicdn.com/cache/w300/ts/product/34/06/0f/015accc1833b62e3c58683714ed1c636.jpg","https://salt.tikicdn.com/cache/200x280/ts/product/3b/dc/81/4af962f975ec837706b976dd550f664b.jpg, https://salt.tikicdn.com/cache/200x280/ts/product/97/1a/21/ed38dffaa03b0080d1d0ca614f5b288f.jpg, https://salt.tikicdn.com/cache/200x280/ts/product/3a/16/a2/dc84c48489c6acf57e44335ece53815b.jpg, https://salt.tikicdn.com/cache/200x280/ts/product/34/06/0f/015accc1833b62e3c58683714ed1c636.jpg","https://salt.tikicdn.com/cache/200x280/ts/product/3b/dc/81/4af962f975ec837706b976dd550f664b.jpg, https://salt.tikicdn.com/cache/200x280/ts/product/97/1a/21/ed38dffaa03b0080d1d0ca614f5b288f.jpg, https://salt.tikicdn.com/cache/200x280/ts/product/3a/16/a2/dc84c48489c6acf57e44335ece53815b.jpg, https://salt.tikicdn.com/cache/200x280/ts/product/34/06/0f/015accc1833b62e3c58683714ed1c636.jpg",1000,0
273570121,Bảng xoay di động 2 mặt bút lông từ Hàn Quốc trắng Bavico nhiều kích thước tùy chọn,2050100,"Bảng xoay có chân di động viết bút lông 2 mặt  viết bút lông từ Hàn Quốc viết êm, lau chùi không để lại dấu. Sản phẩm được trang bị bánh xe giúp di chuyển dễ dàng và chốt hãm bánh xe để cố định khi sử...","Bảng xoay có chân di động viết bút lông 2 mặt viết bút lông từ Hàn Quốc viết êm, lau chùi không để lại dấu. Sản phẩm được trang bị bánh xe giúp di chuyển dễ dàng và chốt hãm bánh xe để cố định khi sử dụng. Bảng xoay có chân di động viết bút lông 2 mặt là sản phẩm hàng chính hãng với mặt bảng được nhập khẩu từ Hàn Quốc có chứng nhận CO-CQ đầy đủ, rõ ràng, trên mặt bảng có in chìm dòng chữ ”KOREA”giúp nhận diện sản phẩm thật 100% Bảng có cấu tạo như sau: Bảng có 2 mặt xoay lật được Mặt bảng: Mặt bảng từ tính Hàn quốc chống trơn trượt,chói lóa có sẵn ô ly chìm 5cm. Sản phẩm được nhập khẩu trực tiếp từ Union, Công ty sản xuất bảng viết bút lông nổi tiếng của xứ sở kim chi. Có thể sử dụng được nam châm viên hay nam châm lá để đính tài liệu,hình ảnh kèm theo. Khung bảng: được làm bằng khung nhôm hộp cao cấp,viền nhôm chạy dài ôm quanh bảng đảm bảo cho bảng chắc chắc và chịu lực tốt. Góc bảng: được làm bằng co nhựa nối với khung bảng rất hài hòa Máng đựng bút : được làm bằng nhôm chuyên dụng dùng để đựng bút và khăn lau bảng Khung chân: Làm từ sắt sơn tĩnh điện dày 1,2 ly. Chân được gắn 4 bánh xe cao cấp TAIWAN giúp di chuyển dễ dàng, có thêm chốt khóa giúp cố định bảng khi sử dụng. BAVICO LÀ NHÀ SẢN XUẤT BẢNG VIẾT HƠN 20 NĂM NÊN QUÝ KHÁCH HÀNG HOÀN TOÀN YÊN TÂM VỀ GIÁ CẢ VÀ CHẤT LƯỢNG, BAVICO CAM KẾT KHÔNG SỬ DỤNG HÀNG GIẢ, HÀNG NHÁI , HÀNG KÉM CHẤT LƯỢNG ĐỂ PHỤC VỤ QUÝ KHÁCH HÀNG Bảng được Bavico giao hàng trực tiếp tận nơi cho quý khách nên quý khách hàng yên tâm vì đảm bảo vận chuyển an toàn tuyệt đối, không bể, vỡ, trầy xước trong quá trình vận chuyển, có thể kiểm tra hàng kĩ trước khi nhận Giá sản phẩm trên Tiki đã bao gồm thuế theo luật hiện hành. Bên cạnh đó, tuỳ vào loại sản phẩm, hình thức và địa chỉ giao hàng mà có thể phát sinh thêm chi phí khác như phí vận chuyển, phụ phí hàng cồng kềnh, thuế nhập khẩu (đối với đơn hàng giao từ nước ngoài có giá trị trên 1 triệu đồng).....",0,0,"https://salt.tikicdn.com/ts/product/e2/47/26/d88f71b7a8bda7663300d370a6f7ba6b.jpg, https://salt.tikicdn.com/ts/product/9c/dd/53/17955c4c76666266c2b25b96926a174c.jpg, https://salt.tikicdn.com/ts/product/ee/d5/52/23f9f4f70e5f01d9df0d9e6268e97c32.jpg, https://salt.tikicdn.com/ts/product/df/e4/12/d44d378c8f508407f063590cb56b8cf0.jpg, https://salt.tikicdn.com/ts/product/10/90/d8/d85093eff5f129a937182392a3497015.jpg","https://salt.tikicdn.com/cache/w1200/ts/product/e2/47/26/d88f71b7a8bda7663300d370a6f7ba6b.jpg, https://salt.tikicdn.com/cache/w1200/ts/product/9c/dd/53/17955c4c76666266c2b25b96926a174c.jpg, https://salt.tikicdn.com/cache/w1200/ts/product/ee/d5/52/23f9f4f70e5f01d9df0d9e6268e97c32.jpg, https://salt.tikicdn.com/cache/w1200/ts/product/df/e4/12/d44d378c8f508407f063590cb56b8cf0.jpg, https://salt.tikicdn.com/cache/w1200/ts/product/10/90/d8/d85093eff5f129a937182392a3497015.jpg","https://salt.tikicdn.com/cache/w300/ts/product/e2/47/26/d88f71b7a8bda7663300d370a6f7ba6b.jpg, https://salt.tikicdn.com/cache/w300/ts/product/9c/dd/53/17955c4c76666266c2b25b96926a174c.jpg, https://salt.tikicdn.com/cache/w300/ts/product/ee/d5/52/23f9f4f70e5f01d9df0d9e6268e97c32.jpg, https://salt.tikicdn.com/cache/w300/ts/product/df/e4/12/d44d378c8f508407f063590cb56b8cf0.jpg, https://salt.tikicdn.com/cache/w300/ts/product/10/90/d8/d85093eff5f129a937182392a3497015.jpg","https://salt.tikicdn.com/cache/200x280/ts/product/e2/47/26/d88f71b7a8bda7663300d370a6f7ba6b.jpg, https://salt.tikicdn.com/cache/200x280/ts/product/9c/dd/53/17955c4c76666266c2b25b96926a174c.jpg, https://salt.tikicdn.com/cache/200x280/ts/product/ee/d5/52/23f9f4f70e5f01d9df0d9e6268e97c32.jpg, https://salt.tikicdn.com/cache/200x280/ts/product/df/e4/12/d44d378c8f508407f063590cb56b8cf0.jpg, https://salt.tikicdn.com/cache/200x280/ts/product/10/90/d8/d85093eff5f129a937182392a3497015.jpg","https://salt.tikicdn.com/cache/200x280/ts/product/e2/47/26/d88f71b7a8bda7663300d370a6f7ba6b.jpg, https://salt.tikicdn.com/cache/200x280/ts/product/9c/dd/53/17955c4c76666266c2b25b96926a174c.jpg, https://salt.tikicdn.com/cache/200x280/ts/product/ee/d5/52/23f9f4f70e5f01d9df0d9e6268e97c32.jpg, https://salt.tikicdn.com/cache/200x280/ts/product/df/e4/12/d44d378c8f508407f063590cb56b8cf0.jpg, https://salt.tikicdn.com/cache/200x280/ts/product/10/90/d8/d85093eff5f129a937182392a3497015.jpg",1000,0
273557699,Bảng di động 1 mặt bút lông từ Hàn Quốc trắng Bavico nhiều kích thước tùy chọn,1634000,"Bảng di động bút lông 1 mặt  viết bút lông từ Hàn Quốc viết êm, lau chùi không để lại dấu. Sản phẩm được trang bị bánh xe giúp di chuyển dễ dàng và chốt hãm bánh xe để cố định khi sử dụng.Bảng di độn...","Bảng di động bút lông 1 mặt viết bút lông từ Hàn Quốc viết êm, lau chùi không để lại dấu. Sản phẩm được trang bị bánh xe giúp di chuyển dễ dàng và chốt hãm bánh xe để cố định khi sử dụng. Bảng di động bút lông 1 mặt là sản phẩm hàng chính hãng với mặt bảng được nhập khẩu từ Hàn Quốc có chứng nhận CO-CQ đầy đủ, rõ ràng, trên mặt bảng có in chìm dòng chữ ”KOREA”giúp nhận diện sản phẩm thật 100% Bảng có cấu tạo như sau: Bảng 1 mặt Mặt bảng: Mặt bảng từ tính Hàn quốc chống trơn trượt,chói lóa có sẵn ô ly chìm 5cm. Sản phẩm được nhập khẩu trực tiếp từ Union, Công ty sản xuất bảng viết bút lông nổi tiếng của xứ sở kim chi. Có thể sử dụng được nam châm viên hay nam châm lá để đính tài liệu,hình ảnh kèm theo. Khung bảng: được làm bằng khung nhôm hộp cao cấp,viền nhôm chạy dài ôm quanh bảng đảm bảo cho bảng chắc chắc và chịu lực tốt. Góc bảng: được làm bằng co nhựa nối với khung bảng rất hài hòa Máng đựng bút : được làm bằng nhôm chuyên dụng dùng để đựng bút và khăn lau bảng Khung chân: Làm từ sắt sơn tĩnh điện dày 1,2 ly. Chân được gắn 4 bánh xe cao cấp TAIWAN giúp di chuyển dễ dàng, có thêm chốt khóa giúp cố định bảng khi sử dụng. BAVICO LÀ NHÀ SẢN XUẤT BẢNG VIẾT HƠN 20 NĂM NÊN QUÝ KHÁCH HÀNG HOÀN TOÀN YÊN TÂM VỀ GIÁ CẢ VÀ CHẤT LƯỢNG, BAVICO CAM KẾT KHÔNG SỬ DỤNG HÀNG GIẢ, HÀNG NHÁI , HÀNG KÉM CHẤT LƯỢNG ĐỂ PHỤC VỤ QUÝ KHÁCH HÀNG Bảng được Bavico giao hàng trực tiếp tận nơi cho quý khách nên quý khách hàng yên tâm vì đảm bảo vận chuyển an toàn tuyệt đối, không bể, vỡ, trầy xước trong quá trình vận chuyển, có thể kiểm tra hàng kĩ trước khi nhận Giá sản phẩm trên Tiki đã bao gồm thuế theo luật hiện hành. Bên cạnh đó, tuỳ vào loại sản phẩm, hình thức và địa chỉ giao hàng mà có thể phát sinh thêm chi phí khác như phí vận chuyển, phụ phí hàng cồng kềnh, thuế nhập khẩu (đối với đơn hàng giao từ nước ngoài có giá trị trên 1 triệu đồng).....",0,0,"https://salt.tikicdn.com/ts/product/ee/d5/52/8b8babad358b1201637b90ef9867542d.jpg, https://salt.tikicdn.com/ts/product/71/e9/dc/3749bb37ce44656e5d93a0c776ce88c3.jpg, https://salt.tikicdn.com/ts/product/71/54/e2/896ddf1278feaf2c787d5c5b9bc4a0fa.jpg","https://salt.tikicdn.com/cache/w1200/ts/product/ee/d5/52/8b8babad358b1201637b90ef9867542d.jpg, https://salt.tikicdn.com/cache/w1200/ts/product/71/e9/dc/3749bb37ce44656e5d93a0c776ce88c3.jpg, https://salt.tikicdn.com/cache/w1200/ts/product/71/54/e2/896ddf1278feaf2c787d5c5b9bc4a0fa.jpg","https://salt.tikicdn.com/cache/w300/ts/product/ee/d5/52/8b8babad358b1201637b90ef9867542d.jpg, https://salt.tikicdn.com/cache/w300/ts/product/71/e9/dc/3749bb37ce44656e5d93a0c776ce88c3.jpg, https://salt.tikicdn.com/cache/w300/ts/product/71/54/e2/896ddf1278feaf2c787d5c5b9bc4a0fa.jpg","https://salt.tikicdn.com/cache/200x280/ts/product/ee/d5/52/8b8babad358b1201637b90ef9867542d.jpg, https://salt.tikicdn.com/cache/200x280/ts/product/71/e9/dc/3749bb37ce44656e5d93a0c776ce88c3.jpg, https://salt.tikicdn.com/cache/200x280/ts/product/71/54/e2/896ddf1278feaf2c787d5c5b9bc4a0fa.jpg","https://salt.tikicdn.com/cache/200x280/ts/product/ee/d5/52/8b8babad358b1201637b90ef9867542d.jpg, https://salt.tikicdn.com/cache/200x280/ts/product/71/e9/dc/3749bb37ce44656e5d93a0c776ce88c3.jpg, https://salt.tikicdn.com/cache/200x280/ts/product/71/54/e2/896ddf1278feaf2c787d5c5b9bc4a0fa.jpg",1000,0
270734888,Bảng Từ Viết Phấn Hàn Quốc màu xanh Bavico PTHQ-01 - Có Ô Ly Chìm 5cm - Kích Thước 40X60cm,741000,"Bảng từ viết phấn thích hợp sử dụng viết phấn, dùng trong công tác giảng dạy ở nhà trường, dùng làm dụng cụ hỗ trợ học tập cho học sinh tại nhà, hoặc sử dụng cho bất kì nhu cầu viết nào của bạn.Bảng ...","Bảng từ viết phấn thích hợp sử dụng viết phấn, dùng trong công tác giảng dạy ở nhà trường, dùng làm dụng cụ hỗ trợ học tập cho học sinh tại nhà, hoặc sử dụng cho bất kì nhu cầu viết nào của bạn. Bảng được làm từ chất liệu cao cấp, có mặt bảng từ nhập khẩu từ Công ty DongBu – Hàn Quốc – nhà cung cấp mặt bảng từ hàng đầu trên thế giới. Mặt bảng màu xanh đậm không bị lóa khi sử dụng, kẻ ô ly vuông chìm 4 cm, viết chữ rõ ràng không bị lem phấn, dễ dàng lau sạch không để lại dấu. Đặc biệt, bảng cho phép dùng nam châm đính hình ảnh minh họa, hoặc đính giấy note lên bảng rất tiện dụng. Bảng từ viết phấn được lót bằng ván MDF có tính chịu lực tốt, độ bền tối ưu, giúp bảng không bị cong vênh, không bị rung khi viết. Mặt sau của bảng được ép giấy bóng vân gỗ chống ẩm, mang lại giá trị sử dụng lâu bền cho sản phẩm. Thiết kế tiện dụng, an toàn 4 cạnh của bảng viết được bọc khung nhôm hộp trắng, bóng, mang lại tính thẩm mỹ cao. Khung nhôm được thiết kế chắc chắn, có tác dụng chống oxy hóa, đảm bảo tính chịu lực cao. Ngoài ra, 4 góc của bảng còn có co nhựa màu trắng, hài hòa với khung nhôm, chống trầy xước và an toàn cho người sử dụng. Thông tin khác - Thương hiệu Bavico - Nguyên liệu được nhập khẩu từ Hàn Quốc - Lắp ráp tại Việt Nam - Kích thước: 40x60 - Trọng lượng: 5kg - Bảo hành 12 tháng Giá sản phẩm trên Tiki đã bao gồm thuế theo luật hiện hành. Bên cạnh đó, tuỳ vào loại sản phẩm, hình thức và địa chỉ giao hàng mà có thể phát sinh thêm chi phí khác như phí vận chuyển, phụ phí hàng cồng kềnh, thuế nhập khẩu (đối với đơn hàng giao từ nước ngoài có giá trị trên 1 triệu đồng)..... Sản phẩm này là tài sản cá nhân được bán bởi Nhà Bán Hàng Cá Nhân và không thuộc đối tượng phải chịu thuế GTGT. Do đó hoá đơn VAT không được cung cấp trong trường hợp này.",0,0,"https://salt.tikicdn.com/ts/product/db/17/94/a918a8052286fa69c7d74ee200e3a7b6.jpg, https://salt.tikicdn.com/ts/product/f4/26/13/ea53d4e2b6d2481aa08f5602e3e478a5.jpg, https://salt.tikicdn.com/ts/product/b4/6d/03/06f6c07507a9a2ec8bd64b941c2ff9e9.jpg","https://salt.tikicdn.com/cache/w1200/ts/product/db/17/94/a918a8052286fa69c7d74ee200e3a7b6.jpg, https://salt.tikicdn.com/cache/w1200/ts/product/f4/26/13/ea53d4e2b6d2481aa08f5602e3e478a5.jpg, https://salt.tikicdn.com/cache/w1200/ts/product/b4/6d/03/06f6c07507a9a2ec8bd64b941c2ff9e9.jpg","https://salt.tikicdn.com/cache/w300/ts/product/db/17/94/a918a8052286fa69c7d74ee200e3a7b6.jpg, https://salt.tikicdn.com/cache/w300/ts/product/f4/26/13/ea53d4e2b6d2481aa08f5602e3e478a5.jpg, https://salt.tikicdn.com/cache/w300/ts/product/b4/6d/03/06f6c07507a9a2ec8bd64b941c2ff9e9.jpg","https://salt.tikicdn.com/cache/200x280/ts/product/db/17/94/a918a8052286fa69c7d74ee200e3a7b6.jpg, https://salt.tikicdn.com/cache/200x280/ts/product/f4/26/13/ea53d4e2b6d2481aa08f5602e3e478a5.jpg, https://salt.tikicdn.com/cache/200x280/ts/product/b4/6d/03/06f6c07507a9a2ec8bd64b941c2ff9e9.jpg","https://salt.tikicdn.com/cache/200x280/ts/product/db/17/94/a918a8052286fa69c7d74ee200e3a7b6.jpg, https://salt.tikicdn.com/cache/200x280/ts/product/f4/26/13/ea53d4e2b6d2481aa08f5602e3e478a5.jpg, https://salt.tikicdn.com/cache/200x280/ts/product/b4/6d/03/06f6c07507a9a2ec8bd64b941c2ff9e9.jpg",1000,0
