id,name,price,short_description,description,rating_average,review_count,image_base_url,image_large_url,image_medium_url,image_small_url,image_thumbnail_url,stock,quantity_sold
273696761,Bảng Từ Viết Phấn Hàn Quốc Bavico PTHQ-13 Xanh 1.2x3.2m,3701200,"Chất liệu: Thép từ tính nhập khẩu từ Công ty thép DongBu-Hàn QuốcMặt bảng từ màu xanh chống lóa, chống mài mòn, trơn trượt, dễ xóa có in ô ly chìm 5cm.Mặt bảng viết rất êm, ăn phấn và độ nét tuyệt đố...","Chất liệu: Thép từ tính nhập khẩu từ Công ty thép DongBu-Hàn Quốc Mặt bảng từ màu xanh chống lóa, chống mài mòn, trơn trượt, dễ xóa có in ô ly chìm 5cm. Mặt bảng viết rất êm, ăn phấn và độ nét tuyệt đối Sản phẩm Bảng từ viết phấn Hàn Quốc của Bavico với hơn 20 năm sản xuất bảng viết, Bavico cam kết hàng chính hãng 100%, không sử dụng hàng giả, hàng nhái, hàng kém chất lượng, sản phẩm có chứng nhận CO-CQ đầy đủ, rõ ràng Bảng từ được viền khung nhôm hộp, 4 góc bảng có co nhựa màu sắc hài hòa với khung nhôm. Mặt sau bảng làm bằng ván MDF đảm bảo bảng viết khung bị rung và độ bền cao Mặt bảng cho phép sử dụng nam châm viên hoặc nam châm lá đính hình ảnh minh họa Độ bền sản phẩm trên 10 năm kích thước bảng: 1.2x3.2m Bavico giao hàng trực tiếp nên quý khách hàng yên tâm về chất lượng sản phẩm, không lo hàng hóa hư, hỏng vỡ trong quá trình vận chuyển - hỗ trợ lắp đặt nếu cần Giá sản phẩm trên Tiki đã bao gồm thuế theo luật hiện hành. Bên cạnh đó, tuỳ vào loại sản phẩm, hình thức và địa chỉ giao hàng mà có thể phát sinh thêm chi phí khác như phí vận chuyển, phụ phí hàng cồng kềnh, thuế nhập khẩu (đối với đơn hàng giao từ nước ngoài có giá trị trên 1 triệu đồng).....",0,0,"https://salt.tikicdn.com/ts/product/c2/1b/48/13c7bdc48dab0fe732fdcdbeae78f641.jpg, https://salt.tikicdn.com/ts/product/df/9c/07/9c301dc8bccaf14b9ac8d85a3e4a5b1d.jpg, https://salt.tikicdn.com/ts/product/09/31/31/d4799d2580a86dc6ba6b1c5df7026f62.jpg, https://salt.tikicdn.com/ts/product/22/40/97/b996231cb8e93ac8c9a39e5ee869ed64.jpg","https://salt.tikicdn.com/cache/w1200/ts/product/c2/1b/48/13c7bdc48dab0fe732fdcdbeae78f641.jpg, https://salt.tikicdn.com/cache/w1200/ts/product/df/9c/07/9c301dc8bccaf14b9ac8d85a3e4a5b1d.jpg, https://salt.tikicdn.com/cache/w1200/ts/product/09/31/31/d4799d2580a86dc6ba6b1c5df7026f62.jpg, https://salt.tikicdn.com/cache/w1200/ts/product/22/40/97/b996231cb8e93ac8c9a39e5ee869ed64.jpg","https://salt.tikicdn.com/cache/w300/ts/product/c2/1b/48/13c7bdc48dab0fe732fdcdbeae78f641.jpg, https://salt.tikicdn.com/cache/w300/ts/product/df/9c/07/9c301dc8bccaf14b9ac8d85a3e4a5b1d.jpg, https://salt.tikicdn.com/cache/w300/ts/product/09/31/31/d4799d2580a86dc6ba6b1c5df7026f62.jpg, https://salt.tikicdn.com/cache/w300/ts/product/22/40/97/b996231cb8e93ac8c9a39e5ee869ed64.jpg","https://salt.tikicdn.com/cache/200x280/ts/product/c2/1b/48/13c7bdc48dab0fe732fdcdbeae78f641.jpg, https://salt.tikicdn.com/cache/200x280/ts/product/df/9c/07/9c301dc8bccaf14b9ac8d85a3e4a5b1d.jpg, https://salt.tikicdn.com/cache/200x280/ts/product/09/31/31/d4799d2580a86dc6ba6b1c5df7026f62.jpg, https://salt.tikicdn.com/cache/200x280/ts/product/22/40/97/b996231cb8e93ac8c9a39e5ee869ed64.jpg","https://salt.tikicdn.com/cache/200x280/ts/product/c2/1b/48/13c7bdc48dab0fe732fdcdbeae78f641.jpg, https://salt.tikicdn.com/cache/200x280/ts/product/df/9c/07/9c301dc8bccaf14b9ac8d85a3e4a5b1d.jpg, https://salt.tikicdn.com/cache/200x280/ts/product/09/31/31/d4799d2580a86dc6ba6b1c5df7026f62.jpg, https://salt.tikicdn.com/cache/200x280/ts/product/22/40/97/b996231cb8e93ac8c9a39e5ee869ed64.jpg",1000,0
273555341,"Bảng Di Động 02 Mặt Bút Lông Cao Cấp Bavico Trắng - KT 1,2x2,4m",4908650,"Bảng Di Động 02 Mặt Viết Bút Lông Cao Cấp Bavico Trắng – Kích thước 120x240cmBảng Di Động 02 Mặt Viết Bút Lông Bavico với kích thước bảng lớn tùy chọn theo nhu cầu, viết được nhiều nội dung cùng lúc,...","Bảng Di Động 02 Mặt Viết Bút Lông Cao Cấp Bavico Trắng – Kích thước 120x240cm Bảng Di Động 02 Mặt Viết Bút Lông Bavico với kích thước bảng lớn tùy chọn theo nhu cầu, viết được nhiều nội dung cùng lúc, giúp cho công việc của bạn được liên tục không bị gián đoạn. Điều đặc biệt nhất mà bảng đi động mang lại là bạn có thể viết ở cả 2 mặt bảng rất tiện lợi, giúp bạn tiết kiệm được rất nhiều thời gian và không gian sử dụng. Bảng được làm từ những chất liệu cao cấp, nhập khẩu từ Ấn Độ, giúp viết chữ êm, không bị lem mực, dễ lau sạch mà không để lại dấu. Chân bảng được làm bằng sắt chắc chắn, trang bị thêm 4 bánh xe giúp di chuyển dễ dàng. Đặc biệt, bảng 2 mặt, mặt bảng có thể bảng xoay lật được 360 độ Thông tin sản phẩm Loại bút thích hợp Bảng di động Bavico BDH02 thích hợp sử dụng bút lông bảng. Chất liệu cao cấp - Bảng được làm từ chất liệu cao cấp, có mặt bảng viết bút lông cao cấp với chất liệu Greenlam nhập khẩu từ Ấn Độ, viết êm, không bị lem mực. Bảng di động có màu trắng, không kẻ ô ly hoặc kẻ ô ly, dễ dàng lau sạch không để lại dấu. - Bảng được lót bằng ván MDF có tính chịu lực tốt, độ bền tối ưu, giúp bảng không bị cong vênh, đảm bảo không bị rung khi viết. Mặt sau của bảng được ép giấy bóng vân gỗ chống ẩm, mang lại giá trị sử dụng lâu bền cho sản phẩm. Thiết kế tiện dụng, an toàn - Bốn cạnh của bảng được viền khung nhôm chuyên dụng, sáng bóng, mang lại tính thẩm mỹ cao. Khung nhôm được thiết kế chắc chắn, có tác dụng chống oxy hóa, đảm bảo tính chịu lực cao. - Bốn góc của bảng còn có co nhựa plastic, màu sắc hài hòa với khung nhôm, chống trầy xước và an toàn cho người sử dụng. - Bảng được trang bị thêm 4 bánh xe, bạn có thể dễ dàng di chuyển đến mọi vị trí thích hợp để sử dụng. - Điều đặc biệt nhất mà bảng đi động BDH02 mang lại là bạn có thể viết ở cả 2 mặt bảng rất tiện lợi, giúp bạn tiết kiệm được rất nhiều thời gian và không gian sử dụng. Chân bảng - Chân bảng được làm bằng chất liệu sắt chắc chắn, được sơn tĩnh điện chống oxy hóa, và các tác hại từ môi trường bên ngoài. - Chân bảng được thiết kế dày, được trang bị thêm khóa bánh xe, đảm bảo cho bảng được cố định vững chắc. Thông tin khác - Thương hiệu Bavico - Nguyên liệu nhập khẩu - Lắp ráp tại Việt Nam - Màu sắc: Trắng - Bảo hành 12 tháng BAVICO LÀ NHÀ SẢN XUẤT BẢNG VIẾT HƠN 20 NĂM NÊN QUÝ KHÁCH HÀNG HOÀN TOÀN YÊN TÂM VỀ GIÁ CẢ VÀ CHẤT LƯỢNG, BAVICO CAM KẾT KHÔNG SỬ DỤNG HÀNG GIẢ, HÀNG NHÁI , HÀNG KÉM CHẤT LƯỢNG ĐỂ PHỤC VỤ QUÝ KHÁCH HÀNG Bảng được Bavico giao hàng trực tiếp tận nơi cho quý khách nên quý khách hàng yên tâm vì đảm bảo vận chuyển an toàn tuyệt đối, không bể, vỡ, trầy xước trong quá trình vận chuyển, có thể kiểm tra hàng kĩ trước khi nhận Giá sản phẩm trên Tiki đã bao gồm thuế theo luật hiện hành. Bên cạnh đó, tuỳ vào loại sản phẩm, hình thức và địa chỉ giao hàng mà có thể phát sinh thêm chi phí khác như phí vận chuyển, phụ phí hàng cồng kềnh, thuế nhập khẩu (đối với đơn hàng giao từ nước ngoài có giá trị trên 1 triệu đồng).....",0,0,"https://salt.tikicdn.com/ts/product/df/e4/12/1c4ce25bb38817edb6fd0810b1eeae63.jpg, https://salt.tikicdn.com/ts/product/f4/ec/3b/0a91a827534ed4ef7cef206201007388.jpg, https://salt.tikicdn.com/ts/product/e2/47/26/f7815542916cdcf69fc224329754da26.jpg, https://salt.tikicdn.com/ts/product/e0/2a/67/72711845a530c9a744e3620b8e37712a.jpg, https://salt.tikicdn.com/ts/product/e0/b3/01/3c627e7371dea1667669c867578ad459.jpg","https://salt.tikicdn.com/cache/w1200/ts/product/df/e4/12/1c4ce25bb38817edb6fd0810b1eeae63.jpg, https://salt.tikicdn.com/cache/w1200/ts/product/f4/ec/3b/0a91a827534ed4ef7cef206201007388.jpg, https://salt.tikicdn.com/cache/w1200/ts/product/e2/47/26/f7815542916cdcf69fc224329754da26.jpg, https://salt.tikicdn.com/cache/w1200/ts/product/e0/2a/67/72711845a530c9a744e3620b8e37712a.jpg, https://salt.tikicdn.com/cache/w1200/ts/product/e0/b3/01/3c627e7371dea1667669c867578ad459.jpg","https://salt.tikicdn.com/cache/w300/ts/product/df/e4/12/1c4ce25bb38817edb6fd0810b1eeae63.jpg, https://salt.tikicdn.com/cache/w300/ts/product/f4/ec/3b/0a91a827534ed4ef7cef206201007388.jpg, https://salt.tikicdn.com/cache/w300/ts/product/e2/47/26/f7815542916cdcf69fc224329754da26.jpg, https://salt.tikicdn.com/cache/w300/ts/product/e0/2a/67/72711845a530c9a744e3620b8e37712a.jpg, https://salt.tikicdn.com/cache/w300/ts/product/e0/b3/01/3c627e7371dea1667669c867578ad459.jpg","https://salt.tikicdn.com/cache/200x280/ts/product/df/e4/12/1c4ce25bb38817edb6fd0810b1eeae63.jpg, https://salt.tikicdn.com/cache/200x280/ts/product/f4/ec/3b/0a91a827534ed4ef7cef206201007388.jpg, https://salt.tikicdn.com/cache/200x280/ts/product/e2/47/26/f7815542916cdcf69fc224329754da26.jpg, https://salt.tikicdn.com/cache/200x280/ts/product/e0/2a/67/72711845a530c9a744e3620b8e37712a.jpg, https://salt.tikicdn.com/cache/200x280/ts/product/e0/b3/01/3c627e7371dea1667669c867578ad459.jpg","https://salt.tikicdn.com/cache/200x280/ts/product/df/e4/12/1c4ce25bb38817edb6fd0810b1eeae63.jpg, https://salt.tikicdn.com/cache/200x280/ts/product/f4/ec/3b/0a91a827534ed4ef7cef206201007388.jpg, https://salt.tikicdn.com/cache/200x280/ts/product/e2/47/26/f7815542916cdcf69fc224329754da26.jpg, https://salt.tikicdn.com/cache/200x280/ts/product/e0/2a/67/72711845a530c9a744e3620b8e37712a.jpg, https://salt.tikicdn.com/cache/200x280/ts/product/e0/b3/01/3c627e7371dea1667669c867578ad459.jpg",1000,0
273493752,Bảng Từ Viết Phấn Hàn Quốc Bavico PTHQ-15 Xanh 1.2x3.6m,3993800,"Chất liệu: Thép từ tính nhập khẩu từ Công ty thép DongBu-Hàn QuốcMặt bảng từ màu xanh chống lóa, chống mài mòn, trơn trượt, dễ xóa có in ô ly chìm 5cm.Mặt bảng viết rất êm, ăn phấn và độ nét tuyệt đố...","Chất liệu: Thép từ tính nhập khẩu từ Công ty thép DongBu-Hàn Quốc Mặt bảng từ màu xanh chống lóa, chống mài mòn, trơn trượt, dễ xóa có in ô ly chìm 5cm. Mặt bảng viết rất êm, ăn phấn và độ nét tuyệt đối Sản phẩm Bảng từ viết phấn Hàn Quốc của Bavico với hơn 20 năm sản xuất bảng viết, Bavico cam kết hàng chính hãng 100%, không sử dụng hàng giả, hàng nhái, hàng kém chất lượng, sản phẩm có chứng nhận CO-CQ đầy đủ, rõ ràng Bảng từ được viền khung nhôm hộp, 4 góc bảng có co nhựa màu sắc hài hòa với khung nhôm. Mặt sau bảng làm bằng ván MDF đảm bảo bảng viết khung bị rung và độ bền cao Mặt bảng cho phép sử dụng nam châm viên hoặc nam châm lá đính hình ảnh minh họa Độ bền sản phẩm trên 10 năm kích thước bảng: 1.2x3.6m Bavico giao hàng trực tiếp nên quý khách hàng yên tâm về chất lượng sản phẩm, không lo hàng hóa hư, hỏng vỡ trong quá trình vận chuyển - hỗ trợ lắp đặt nếu cần Giá sản phẩm trên Tiki đã bao gồm thuế theo luật hiện hành. Bên cạnh đó, tuỳ vào loại sản phẩm, hình thức và địa chỉ giao hàng mà có thể phát sinh thêm chi phí khác như phí vận chuyển, phụ phí hàng cồng kềnh, thuế nhập khẩu (đối với đơn hàng giao từ nước ngoài có giá trị trên 1 triệu đồng).....",0,0,"https://salt.tikicdn.com/ts/product/df/9c/07/de4fa5060c740d6935c11ffd535cf477.jpg, https://salt.tikicdn.com/ts/product/09/31/31/2bb81d171598255048a45cfb551702c4.jpg, https://salt.tikicdn.com/ts/product/75/2f/f3/4cbf546adbd4eeda1c57c7c13bd20cc5.jpg, https://salt.tikicdn.com/ts/product/c2/1b/48/b6bf4f2af452730da1e664e01900f0fa.jpg","https://salt.tikicdn.com/cache/w1200/ts/product/df/9c/07/de4fa5060c740d6935c11ffd535cf477.jpg, https://salt.tikicdn.com/cache/w1200/ts/product/09/31/31/2bb81d171598255048a45cfb551702c4.jpg, https://salt.tikicdn.com/cache/w1200/ts/product/75/2f/f3/4cbf546adbd4eeda1c57c7c13bd20cc5.jpg, https://salt.tikicdn.com/cache/w1200/ts/product/c2/1b/48/b6bf4f2af452730da1e664e01900f0fa.jpg","https://salt.tikicdn.com/cache/w300/ts/product/df/9c/07/de4fa5060c740d6935c11ffd535cf477.jpg, https://salt.tikicdn.com/cache/w300/ts/product/09/31/31/2bb81d171598255048a45cfb551702c4.jpg, https://salt.tikicdn.com/cache/w300/ts/product/75/2f/f3/4cbf546adbd4eeda1c57c7c13bd20cc5.jpg, https://salt.tikicdn.com/cache/w300/ts/product/c2/1b/48/b6bf4f2af452730da1e664e01900f0fa.jpg","https://salt.tikicdn.com/cache/200x280/ts/product/df/9c/07/de4fa5060c740d6935c11ffd535cf477.jpg, https://salt.tikicdn.com/cache/200x280/ts/product/09/31/31/2bb81d171598255048a45cfb551702c4.jpg, https://salt.tikicdn.com/cache/200x280/ts/product/75/2f/f3/4cbf546adbd4eeda1c57c7c13bd20cc5.jpg, https://salt.tikicdn.com/cache/200x280/ts/product/c2/1b/48/b6bf4f2af452730da1e664e01900f0fa.jpg","https://salt.tikicdn.com/cache/200x280/ts/product/df/9c/07/de4fa5060c740d6935c11ffd535cf477.jpg, https://salt.tikicdn.com/cache/200x280/ts/product/09/31/31/2bb81d171598255048a45cfb551702c4.jpg, https://salt.tikicdn.com/cache/200x280/ts/product/75/2f/f3/4cbf546adbd4eeda1c57c7c13bd20cc5.jpg, https://salt.tikicdn.com/cache/200x280/ts/product/c2/1b/48/b6bf4f2af452730da1e664e01900f0fa.jpg",1000,0
273367033,"Bảng di động 2 mặt trắng viết bút lông Poly có kẻ ô ly Bavico-1,2x1,8m",2804400,"Bảng có 2 mặt, kích thước mặt bảng là 1.2x1.8mCấu tạo sản phẩm:BẢNG:– Mặt bảng: Màu trắng dùng để viết bút lông, được nhập khẩu từ Đài Loan, viết lau dễ dàng, không để lại vết hằn trên mặt bảng. Kẻ ...","Bảng có 2 mặt, kích thước mặt bảng là 1.2x1.8m Cấu tạo sản phẩm: BẢNG: – Mặt bảng: Màu trắng dùng để viết bút lông, được nhập khẩu từ Đài Loan, viết lau dễ dàng, không để lại vết hằn trên mặt bảng. Kẻ ô ly hoặc để trơn theo yêu cầu. – Tấm lót bảng: bằng ván MDF ép giấy bóng vân gỗ chống ẩm, chống cong mo và đảm bảo bảng viết không bị rung hoặc bằng tấm nhựa dầy 10ly chống nước, chống cong mo. – Khung/bo bảng: bằng nhôm Việt Nhật chuyên dụng chống oxy hóa. – Co góc: Bốn góc bảng có co nhựa màu sắc hài hòa, chống bị trầy xước. – Máng phấn/ đựng bút: dài 50cm, bằng nhôm chuyên dụng, hai đầu có co nhựa. CHÂN BẢNG: – Bằng sắt 2x4cm dầy 1,2ly, sơn tĩnh điện màu trắng sữa, lắp ráp được. – Bánh xe: bảng có gắn 4 bánh xe của Taiwan màu trắng cao cấp, có thể cài cố định được. Sản phẩm được giao hàng trực tiếp không thông qua nhà vận chuyển nên quý khách hàng hoàn toàn yên tâm về chất lượng, và đảm bảo an toàn trong quá trình vận chuyển, không sợ hư hỏng, trầy xước, được kiểm tra hàng hóa trước khi nhận Giá sản phẩm trên Tiki đã bao gồm thuế theo luật hiện hành. Bên cạnh đó, tuỳ vào loại sản phẩm, hình thức và địa chỉ giao hàng mà có thể phát sinh thêm chi phí khác như phí vận chuyển, phụ phí hàng cồng kềnh, thuế nhập khẩu (đối với đơn hàng giao từ nước ngoài có giá trị trên 1 triệu đồng).....",0,0,"https://salt.tikicdn.com/ts/product/df/e4/12/838cca693903c2649473a00ead6a5bec.jpg, https://salt.tikicdn.com/ts/product/3d/45/30/359963671084204ab8f2edeef4d6d824.jpg, https://salt.tikicdn.com/ts/product/d4/bf/c7/eca2588547a2d11f3f15fddac8c8d779.jpg","https://salt.tikicdn.com/cache/w1200/ts/product/df/e4/12/838cca693903c2649473a00ead6a5bec.jpg, https://salt.tikicdn.com/cache/w1200/ts/product/3d/45/30/359963671084204ab8f2edeef4d6d824.jpg, https://salt.tikicdn.com/cache/w1200/ts/product/d4/bf/c7/eca2588547a2d11f3f15fddac8c8d779.jpg","https://salt.tikicdn.com/cache/w300/ts/product/df/e4/12/838cca693903c2649473a00ead6a5bec.jpg, https://salt.tikicdn.com/cache/w300/ts/product/3d/45/30/359963671084204ab8f2edeef4d6d824.jpg, https://salt.tikicdn.com/cache/w300/ts/product/d4/bf/c7/eca2588547a2d11f3f15fddac8c8d779.jpg","https://salt.tikicdn.com/cache/200x280/ts/product/df/e4/12/838cca693903c2649473a00ead6a5bec.jpg, https://salt.tikicdn.com/cache/200x280/ts/product/3d/45/30/359963671084204ab8f2edeef4d6d824.jpg, https://salt.tikicdn.com/cache/200x280/ts/product/d4/bf/c7/eca2588547a2d11f3f15fddac8c8d779.jpg","https://salt.tikicdn.com/cache/200x280/ts/product/df/e4/12/838cca693903c2649473a00ead6a5bec.jpg, https://salt.tikicdn.com/cache/200x280/ts/product/3d/45/30/359963671084204ab8f2edeef4d6d824.jpg, https://salt.tikicdn.com/cache/200x280/ts/product/d4/bf/c7/eca2588547a2d11f3f15fddac8c8d779.jpg",1000,0
273359272,"Bảng di động 2 mặt trắng viết bút lông Poly có kẻ ô ly Bavico-1,2x1,4m",2587800,"Bảng có 2 mặt, kích thước mặt bảng là 1.2x1.4mCấu tạo sản phẩm:BẢNG:– Mặt bảng: Màu trắng dùng để viết bút lông, được nhập khẩu từ Đài Loan, viết lau dễ dàng, không để lại vết hằn trên mặt bảng. Kẻ ...","Bảng có 2 mặt, kích thước mặt bảng là 1.2x1.4m Cấu tạo sản phẩm: BẢNG: – Mặt bảng: Màu trắng dùng để viết bút lông, được nhập khẩu từ Đài Loan, viết lau dễ dàng, không để lại vết hằn trên mặt bảng. Kẻ ô ly hoặc để trơn theo yêu cầu. – Tấm lót bảng: bằng ván MDF ép giấy bóng vân gỗ chống ẩm, chống cong mo và đảm bảo bảng viết không bị rung hoặc bằng tấm nhựa dầy 10ly chống nước, chống cong mo. – Khung/bo bảng: bằng nhôm Việt Nhật chuyên dụng chống oxy hóa. – Co góc: Bốn góc bảng có co nhựa màu sắc hài hòa, chống bị trầy xước. – Máng phấn/ đựng bút: dài 50cm, bằng nhôm chuyên dụng, hai đầu có co nhựa. CHÂN BẢNG: – Bằng sắt 2x4cm dầy 1,2ly, sơn tĩnh điện màu trắng sữa, lắp ráp được. – Bánh xe: bảng có gắn 4 bánh xe của Taiwan màu trắng cao cấp, có thể cài cố định được. Sản phẩm được giao hàng trực tiếp không thông qua nhà vận chuyển nên quý khách hàng hoàn toàn yên tâm về chất lượng, và đảm bảo an toàn trong quá trình vận chuyển, không sợ hư hỏng, trầy xước, được kiểm tra hàng hóa trước khi nhận Giá sản phẩm trên Tiki đã bao gồm thuế theo luật hiện hành. Bên cạnh đó, tuỳ vào loại sản phẩm, hình thức và địa chỉ giao hàng mà có thể phát sinh thêm chi phí khác như phí vận chuyển, phụ phí hàng cồng kềnh, thuế nhập khẩu (đối với đơn hàng giao từ nước ngoài có giá trị trên 1 triệu đồng).....",0,0,"https://salt.tikicdn.com/ts/product/b3/df/ed/b1c57beb1407f4ebd8e6ad71c62eaf09.jpg, https://salt.tikicdn.com/ts/product/52/f5/09/869637a90a91e34492e18a5fac7b24c1.jpg, https://salt.tikicdn.com/ts/product/4e/f9/3c/088b0a9201d03259402908e8fb9de48b.jpg, https://salt.tikicdn.com/ts/product/bd/f1/df/ac1255c93ca3418ae21483bf87d709ed.png","https://salt.tikicdn.com/cache/w1200/ts/product/b3/df/ed/b1c57beb1407f4ebd8e6ad71c62eaf09.jpg, https://salt.tikicdn.com/cache/w1200/ts/product/52/f5/09/869637a90a91e34492e18a5fac7b24c1.jpg, https://salt.tikicdn.com/cache/w1200/ts/product/4e/f9/3c/088b0a9201d03259402908e8fb9de48b.jpg, https://salt.tikicdn.com/cache/w1200/ts/product/bd/f1/df/ac1255c93ca3418ae21483bf87d709ed.png","https://salt.tikicdn.com/cache/w300/ts/product/b3/df/ed/b1c57beb1407f4ebd8e6ad71c62eaf09.jpg, https://salt.tikicdn.com/cache/w300/ts/product/52/f5/09/869637a90a91e34492e18a5fac7b24c1.jpg, https://salt.tikicdn.com/cache/w300/ts/product/4e/f9/3c/088b0a9201d03259402908e8fb9de48b.jpg, https://salt.tikicdn.com/cache/w300/ts/product/bd/f1/df/ac1255c93ca3418ae21483bf87d709ed.png","https://salt.tikicdn.com/cache/200x280/ts/product/b3/df/ed/b1c57beb1407f4ebd8e6ad71c62eaf09.jpg, https://salt.tikicdn.com/cache/200x280/ts/product/52/f5/09/869637a90a91e34492e18a5fac7b24c1.jpg, https://salt.tikicdn.com/cache/200x280/ts/product/4e/f9/3c/088b0a9201d03259402908e8fb9de48b.jpg, https://salt.tikicdn.com/cache/200x280/ts/product/bd/f1/df/ac1255c93ca3418ae21483bf87d709ed.png","https://salt.tikicdn.com/cache/200x280/ts/product/b3/df/ed/b1c57beb1407f4ebd8e6ad71c62eaf09.jpg, https://salt.tikicdn.com/cache/200x280/ts/product/52/f5/09/869637a90a91e34492e18a5fac7b24c1.jpg, https://salt.tikicdn.com/cache/200x280/ts/product/4e/f9/3c/088b0a9201d03259402908e8fb9de48b.jpg, https://salt.tikicdn.com/cache/200x280/ts/product/bd/f1/df/ac1255c93ca3418ae21483bf87d709ed.png",1000,0
273350376,"Bảng di động 1 mặt viết bút lông Poly - trắng kẻ ô ly Bavico 1,2x2,4m",3536850,Kích thước mặt bảng : 1.2x2.4mBảng có chân 1 mặt vớiBẢNG:– Mặt bảng: chất liệu là Poly được nhập khẩu từ Đài Loan. Bảng viết bút lông màu trắng. Kẻ ô ly vuông 5cm (hoặc để trắng trơn theo nhu cầu).M...,"Kích thước mặt bảng : 1.2x2.4m Bảng có chân 1 mặt với BẢNG: – Mặt bảng: chất liệu là Poly được nhập khẩu từ Đài Loan. Bảng viết bút lông màu trắng. Kẻ ô ly vuông 5cm (hoặc để trắng trơn theo nhu cầu). Mặt bảng viết bút lông Poly Taiwan viết lau dễ dàng, không để lại dấu – Tấm lót bảng: bằng ván MDF ép giấy bóng vân gỗ chống ẩm, chống cong mo và đảm bảo bảng viết không bị rung hoặc bằng tấm nhựa dầy 10ly chống nước, chống cong mo. – Khung/bo bảng: bằng nhôm Việt Nhật chuyên dụng chống oxy hóa. – Co góc: Bốn góc bảng có co nhựa màu sắc hài hòa, chống bị trầy xước. – Máng phấn/ đựng bút: dài 50cm, bằng nhôm chuyên dụng, hai đầu có co nhựa. CHÂN BẢNG: – Bằng sắt 2x4cm dầy 1,2ly, sơn tĩnh điện màu trắng sữa chống rỉ – Bánh xe: bảng có gắn 4 bánh xe của Taiwan màu trắng cao cấp, có thể cài cố định được, và di chuyển dễ dàng Sản phẩm được giao hàng trực tiếp không thông qua nhà vận chuyển nên quý khách hàng hoàn toàn yên tâm về chất lượng, và đảm bảo an toàn trong quá trình vận chuyển, không sợ hư hỏng, trầy xước, được kiểm tra hàng hóa trước khi nhận Giá sản phẩm trên Tiki đã bao gồm thuế theo luật hiện hành. Bên cạnh đó, tuỳ vào loại sản phẩm, hình thức và địa chỉ giao hàng mà có thể phát sinh thêm chi phí khác như phí vận chuyển, phụ phí hàng cồng kềnh, thuế nhập khẩu (đối với đơn hàng giao từ nước ngoài có giá trị trên 1 triệu đồng).....",0,0,"https://salt.tikicdn.com/ts/product/1f/c0/77/8a40486dc605880be2f32f42b3307fce.jpg, https://salt.tikicdn.com/ts/product/28/72/c2/91b3aa81b334d2e774be8e6fca0b9593.jpg, https://salt.tikicdn.com/ts/product/8a/c2/ba/6bfcea00fde6cf57aed2a6e2bdde50bf.jpg, https://salt.tikicdn.com/ts/product/e0/b3/01/06e39885da2a10e481f055bb993e1ce2.jpg","https://salt.tikicdn.com/cache/w1200/ts/product/1f/c0/77/8a40486dc605880be2f32f42b3307fce.jpg, https://salt.tikicdn.com/cache/w1200/ts/product/28/72/c2/91b3aa81b334d2e774be8e6fca0b9593.jpg, https://salt.tikicdn.com/cache/w1200/ts/product/8a/c2/ba/6bfcea00fde6cf57aed2a6e2bdde50bf.jpg, https://salt.tikicdn.com/cache/w1200/ts/product/e0/b3/01/06e39885da2a10e481f055bb993e1ce2.jpg","https://salt.tikicdn.com/cache/w300/ts/product/1f/c0/77/8a40486dc605880be2f32f42b3307fce.jpg, https://salt.tikicdn.com/cache/w300/ts/product/28/72/c2/91b3aa81b334d2e774be8e6fca0b9593.jpg, https://salt.tikicdn.com/cache/w300/ts/product/8a/c2/ba/6bfcea00fde6cf57aed2a6e2bdde50bf.jpg, https://salt.tikicdn.com/cache/w300/ts/product/e0/b3/01/06e39885da2a10e481f055bb993e1ce2.jpg","https://salt.tikicdn.com/cache/200x280/ts/product/1f/c0/77/8a40486dc605880be2f32f42b3307fce.jpg, https://salt.tikicdn.com/cache/200x280/ts/product/28/72/c2/91b3aa81b334d2e774be8e6fca0b9593.jpg, https://salt.tikicdn.com/cache/200x280/ts/product/8a/c2/ba/6bfcea00fde6cf57aed2a6e2bdde50bf.jpg, https://salt.tikicdn.com/cache/200x280/ts/product/e0/b3/01/06e39885da2a10e481f055bb993e1ce2.jpg","https://salt.tikicdn.com/cache/200x280/ts/product/1f/c0/77/8a40486dc605880be2f32f42b3307fce.jpg, https://salt.tikicdn.com/cache/200x280/ts/product/28/72/c2/91b3aa81b334d2e774be8e6fca0b9593.jpg, https://salt.tikicdn.com/cache/200x280/ts/product/8a/c2/ba/6bfcea00fde6cf57aed2a6e2bdde50bf.jpg, https://salt.tikicdn.com/cache/200x280/ts/product/e0/b3/01/06e39885da2a10e481f055bb993e1ce2.jpg",1000,0
