id,name,price,short_description,description,rating_average,review_count,image_base_url,image_large_url,image_medium_url,image_small_url,image_thumbnail_url,stock,quantity_sold
95295653,Bảng Trắng Từ Tính Cao Cấp PLUS,960000, Tên Nhà Cung Cấp: Công ty TNHH Công Nghiệp PLUS Việt NamThương Hiệu: PlusXuất Xứ Thương Hiệu: Thương Hiệu NhậtNơi Gia Công & Sản Xuất: Trung Quốc/Việt Nam Bảng từ tính xách tay thích hợp...,"Tên Nhà Cung Cấp: Công ty TNHH Công Nghiệp PLUS Việt Nam Thương Hiệu: Plus Xuất Xứ Thương Hiệu: Thương Hiệu Nhật Nơi Gia Công & Sản Xuất: Trung Quốc/Việt Nam Bảng từ tính xách tay thích hợp để ghi chú hoặc phác hoạ bản thảo một cách thuận tiện nhất. Phù hợp cho học sinh sinh viên lẫn nhân viên văn phòng. Đặc biệt có thể phác hoạ các bản vẽ dễ dàng với 2 đầu bút. An toàn sử dụng và bảo vệ môi trường với cách thức hoạt động dựa trên từ tính của nam châm Không tạo ra bụi ảnh hưởng sức khoẻ người dùng Có 2 đầu bút (đầu nhọn và đầu lớn) dễ dàng phác hoạ thông tin Có 2 loại xoá: xoá lớn và xoá chi tiết Sử dụng nhiều lần, không cần sạc điện, không hao tốn năng lượng. Có 2 size: B5 và A4 Bề mặt trơn láng, hạn chế bụi bẩn. Bảng vẽ từ tính PLUS không sử dụng mực và chì, giúp giảm thiểu bụi bẩn khi sử dụng. Tiết kiệm và Thân thiện với môi trường. Sản phẩm sử dụng công nghệ độc quyền, hạn chế tối đa việc sử dụng thêm giấy, mực, pin,... gây tốn kém và gia tăng lượng rác thải đến môi trường Dễ dàng bôi xóa. Bảng vẽ đi kèm 2 dụng cụ tẩy chuyên dụng, giúp tẩy xóa dễ dàng trong quá trình sử dụng. Cảm giác viết chân thật. Sử dụng công nghệ nam châm tiên tiến, ngòi bút viết đi kèm mang đến cảm giác viết mượt mà và sắc nét như bút chì thật. Tiện lợi khi di chuyển. Với bề mặt phẳng, độ dày 3mm cùng thiết kế ngăn đựng tẩy và bút chuyên biệt, bảng vẽ từ tính PLUS có thể dễ dàng mang đi và sử dụng mọi lúc mọi nơi. 1. Điều kiện áp dụng (trong vòng 07 ngày kể từ khi nhận sản phẩm). - Hàng hoá vẫn còn mới, chưa qua sử dụng. - Hàng hoá hư hỏng do vận chuyển hoặc do nhà sản xuất. - Chỉ nhận lại hàng khi Qúy khách có video quay từ lúc mở hàng đến lúc kiểm tra hàng. 2. Trường hợp không đủ điều kiện áp dụng chính sách: - Quá 07 ngày kể từ khi Quý khách nhận hàng. - Gửi lại hàng không đúng mẫu mã, không phải sản phẩm của PLUS. Quý khách lưu ý: Do màn hình và điều kiện ánh sáng khác nhau, màu sắc thực tế của sản phẩm có thể chênh lệch khoảng 3-5%. #bảngviết #bảngchobé #PLUS #vpp #vănphòngphẩm Giá sản phẩm trên Tiki đã bao gồm thuế theo luật hiện hành. Bên cạnh đó, tuỳ vào loại sản phẩm, hình thức và địa chỉ giao hàng mà có thể phát sinh thêm chi phí khác như phí vận chuyển, phụ phí hàng cồng kềnh, thuế nhập khẩu (đối với đơn hàng giao từ nước ngoài có giá trị trên 1 triệu đồng).....",5,1,"https://salt.tikicdn.com/ts/product/0d/37/14/e3fbc3f4c79ff22fd77039a5eca111ca.jpg, https://salt.tikicdn.com/ts/product/ff/17/e6/8b19d53bf1556a571110815ddd14e1ed.jpg, https://salt.tikicdn.com/ts/product/dc/de/7b/a01adb4b8e385583591ffe15ad66bdfd.jpg","https://salt.tikicdn.com/cache/w1200/ts/product/0d/37/14/e3fbc3f4c79ff22fd77039a5eca111ca.jpg, https://salt.tikicdn.com/cache/w1200/ts/product/ff/17/e6/8b19d53bf1556a571110815ddd14e1ed.jpg, https://salt.tikicdn.com/cache/w1200/ts/product/dc/de/7b/a01adb4b8e385583591ffe15ad66bdfd.jpg","https://salt.tikicdn.com/cache/w300/ts/product/0d/37/14/e3fbc3f4c79ff22fd77039a5eca111ca.jpg, https://salt.tikicdn.com/cache/w300/ts/product/ff/17/e6/8b19d53bf1556a571110815ddd14e1ed.jpg, https://salt.tikicdn.com/cache/w300/ts/product/dc/de/7b/a01adb4b8e385583591ffe15ad66bdfd.jpg","https://salt.tikicdn.com/cache/200x280/ts/product/0d/37/14/e3fbc3f4c79ff22fd77039a5eca111ca.jpg, https://salt.tikicdn.com/cache/200x280/ts/product/ff/17/e6/8b19d53bf1556a571110815ddd14e1ed.jpg, https://salt.tikicdn.com/cache/200x280/ts/product/dc/de/7b/a01adb4b8e385583591ffe15ad66bdfd.jpg","https://salt.tikicdn.com/cache/200x280/ts/product/0d/37/14/e3fbc3f4c79ff22fd77039a5eca111ca.jpg, https://salt.tikicdn.com/cache/200x280/ts/product/ff/17/e6/8b19d53bf1556a571110815ddd14e1ed.jpg, https://salt.tikicdn.com/cache/200x280/ts/product/dc/de/7b/a01adb4b8e385583591ffe15ad66bdfd.jpg",1000,1
76834825,Cuộn Bảng Từ Trắng Hít Nam Châm MAGROLL - KT 60x90cm - Tân Hà - Tặng Phụ Kiện,449000,"CUỘN BẢNG TỪ TRẮNG HÍT NAM CHÂM - MAGROLL - KÍCH THƯỚC 60x90cm Ưu điểm vượt trội của cuộn bảng trắng hít nam châm MAGROLL> Không khoan tường, đóng đinhSản phẩm được thiết kế để đơn giản việc l...","CUỘN BẢNG TỪ TRẮNG HÍT NAM CHÂM - MAGROLL - KÍCH THƯỚC 60x90cm Ưu điểm vượt trội của cuộn bảng trắng hít nam châm MAGROLL > Không khoan tường, đóng đinh Sản phẩm được thiết kế để đơn giản việc lắp đặt trên mọi bề mặt: > Dễ dàng cho việc lắp đặt Chỉ với 3 bước đơn giản: MỞ CUỘN BẢNG – ĐO ĐỊNH VỊ – DÁN, bạn đã có ngay 1 chiếc bảng từ trắng hít nam châm trên mọi bề mặt > Viết đẹp – Xóa sạch – Hít nam châm Cuộn bảng trắng hít nam châm TGB là sản phẩm duy nhất trên thị trường có độ dày 0.6mm, sản xuất c ông nghệ phủ PPna no nên viết êm, xóa sạch và đặc biệt hít nam châm trên bề mặt. > Sáng tạo với mọi hình dáng Đơn giản với chiếc kéo, bạn có thể sáng tạo với nhiều hình dáng khác nhau: đám mây, bóng đèn, ngôi sao để làm sinh động thêm cho mảng tường/ góc học tập. > Bảo hành 12 tháng Sản phẩm đáp ứng tiêu chuẩn xuất khẩu đi Mỹ, an toàn cho trẻ nhỏ. Phụ kiện tặng kèm khi mua Cuộn bảng từ trắng hít nam châm Thế Giới Bảng: Bút dạ, Khay đựng, Khăn Lau, Nam châm Phụ Kiện Tặng Kèm : 03 nam châm lá, 1 khăn lau nam châm, 1 túi đựng phụ kiện nam châm + 1 bút dạ hít nam châm Công năng: DÙNG TRONG GIA ĐÌNH: Có thể biến mọi mặt phẳng trong nhà của bạn thành tấm bảng từ trắng, làm bảng phân công việc nhà, bảng ghi nhớ, nhắc nhở cho các bà nội trợ. Dùng làm bảng cho trẻ viết/ vẽ vô cùng an toàn và tiện dụng, cho các con thỏa sức học tập, sáng tạo. Dùng làm bảng trang trí, che đi khuyết điểm của những mặt tường xấu. DÙNG TRONG VĂN PHÒNG: Dùng làm bảng viết trong văn phòng đặc biệt phù hợp dán lên vách kính / mặt bàn gỗ tăng tiện ích mà vẫn hiện đại. Dùng làm bảng thông báo dán ở khu vực ngoài hành lang, phòng chờ, lối vào chung…. Dùng làm bảng trang trí tại những không gian đặc biệt. Là công cụ sáng tạo cho nhân viên thoải mái cùng nhau trao đổi ý tưởng, sáng kiến. CÔNG CỤ ĐỂ SÁNG TẠO: Thay bảng menu treo tường trong quán ăn. Làm một bảng báo tường, trang trí phòng học. Làm poster, bảng thông tin, bảng trang trí tại các gian hàng trong hội chợ. Hướng dẫn lắp đặt cuộn bảng trắng hít nam châm MagRoll B1: Trước khi dán, bạn nên lau sạch bề mặt định dán bảng bằng khăn khô để lớp keo được dính chắc hơn. B2: Tháo cuộn bảng trắng hít nam châm ra khỏi hộp. Sau đó, bạn bóc tấm bảng ra rồi nhẹ nhàng dán từng góc bảng lên tường theo hướng từ trái sang phải; từ trên xuống dưới, dùng dụng cụ dán (đã được cung cấp sẵn kèm bảng) hoặc miếng vải mềm miết cho phẳng, miết đến đâu gỡ màng dính ra đến đó để tránh bị nhăn Giá sản phẩm trên Tiki đã bao gồm thuế theo luật hiện hành. Bên cạnh đó, tuỳ vào loại sản phẩm, hình thức và địa chỉ giao hàng mà có thể phát sinh thêm chi phí khác như phí vận chuyển, phụ phí hàng cồng kềnh, thuế nhập khẩu (đối với đơn hàng giao từ nước ngoài có giá trị trên 1 triệu đồng).....",4.8,12,"https://salt.tikicdn.com/ts/product/98/1e/ea/4ca943d6d96babfbc2dbdd8bca063a45.png, https://salt.tikicdn.com/ts/product/4c/36/00/cd27cae1937a3a80450dc6d108146cf0.png, https://salt.tikicdn.com/ts/product/98/19/b9/477fe3fa72d625d20b57cbd12697a554.png, https://salt.tikicdn.com/ts/product/cb/1b/37/62a5dc3201a3dd239b699be21750cc58.png, https://salt.tikicdn.com/ts/product/5e/65/e5/94ff948f8b232d2ce4ab390064ceb4be.jpg, https://salt.tikicdn.com/ts/product/27/de/cb/350d9ee054300bc53fe088017322499d.jpg, https://salt.tikicdn.com/ts/product/25/a8/c4/d0b42398a0850eb1623a14f2456960db.jpg, https://salt.tikicdn.com/ts/product/6b/2b/41/579e4b89120e93c833c3e8f7bea52b04.jpg, https://salt.tikicdn.com/ts/product/94/61/b0/c64d4e5012bbdd6ab89e54452627c3a2.png","https://salt.tikicdn.com/cache/w1200/ts/product/98/1e/ea/4ca943d6d96babfbc2dbdd8bca063a45.png, https://salt.tikicdn.com/cache/w1200/ts/product/4c/36/00/cd27cae1937a3a80450dc6d108146cf0.png, https://salt.tikicdn.com/cache/w1200/ts/product/98/19/b9/477fe3fa72d625d20b57cbd12697a554.png, https://salt.tikicdn.com/cache/w1200/ts/product/cb/1b/37/62a5dc3201a3dd239b699be21750cc58.png, https://salt.tikicdn.com/cache/w1200/ts/product/5e/65/e5/94ff948f8b232d2ce4ab390064ceb4be.jpg, https://salt.tikicdn.com/cache/w1200/ts/product/27/de/cb/350d9ee054300bc53fe088017322499d.jpg, https://salt.tikicdn.com/cache/w1200/ts/product/25/a8/c4/d0b42398a0850eb1623a14f2456960db.jpg, https://salt.tikicdn.com/cache/w1200/ts/product/6b/2b/41/579e4b89120e93c833c3e8f7bea52b04.jpg, https://salt.tikicdn.com/cache/w1200/ts/product/94/61/b0/c64d4e5012bbdd6ab89e54452627c3a2.png","https://salt.tikicdn.com/cache/w300/ts/product/98/1e/ea/4ca943d6d96babfbc2dbdd8bca063a45.png, https://salt.tikicdn.com/cache/w300/ts/product/4c/36/00/cd27cae1937a3a80450dc6d108146cf0.png, https://salt.tikicdn.com/cache/w300/ts/product/98/19/b9/477fe3fa72d625d20b57cbd12697a554.png, https://salt.tikicdn.com/cache/w300/ts/product/cb/1b/37/62a5dc3201a3dd239b699be21750cc58.png, https://salt.tikicdn.com/cache/w300/ts/product/5e/65/e5/94ff948f8b232d2ce4ab390064ceb4be.jpg, https://salt.tikicdn.com/cache/w300/ts/product/27/de/cb/350d9ee054300bc53fe088017322499d.jpg, https://salt.tikicdn.com/cache/w300/ts/product/25/a8/c4/d0b42398a0850eb1623a14f2456960db.jpg, https://salt.tikicdn.com/cache/w300/ts/product/6b/2b/41/579e4b89120e93c833c3e8f7bea52b04.jpg, https://salt.tikicdn.com/cache/w300/ts/product/94/61/b0/c64d4e5012bbdd6ab89e54452627c3a2.png","https://salt.tikicdn.com/cache/200x280/ts/product/98/1e/ea/4ca943d6d96babfbc2dbdd8bca063a45.png, https://salt.tikicdn.com/cache/200x280/ts/product/4c/36/00/cd27cae1937a3a80450dc6d108146cf0.png, https://salt.tikicdn.com/cache/200x280/ts/product/98/19/b9/477fe3fa72d625d20b57cbd12697a554.png, https://salt.tikicdn.com/cache/200x280/ts/product/cb/1b/37/62a5dc3201a3dd239b699be21750cc58.png, https://salt.tikicdn.com/cache/200x280/ts/product/5e/65/e5/94ff948f8b232d2ce4ab390064ceb4be.jpg, https://salt.tikicdn.com/cache/200x280/ts/product/27/de/cb/350d9ee054300bc53fe088017322499d.jpg, https://salt.tikicdn.com/cache/200x280/ts/product/25/a8/c4/d0b42398a0850eb1623a14f2456960db.jpg, https://salt.tikicdn.com/cache/200x280/ts/product/6b/2b/41/579e4b89120e93c833c3e8f7bea52b04.jpg, https://salt.tikicdn.com/cache/200x280/ts/product/94/61/b0/c64d4e5012bbdd6ab89e54452627c3a2.png","https://salt.tikicdn.com/cache/200x280/ts/product/98/1e/ea/4ca943d6d96babfbc2dbdd8bca063a45.png, https://salt.tikicdn.com/cache/200x280/ts/product/4c/36/00/cd27cae1937a3a80450dc6d108146cf0.png, https://salt.tikicdn.com/cache/200x280/ts/product/98/19/b9/477fe3fa72d625d20b57cbd12697a554.png, https://salt.tikicdn.com/cache/200x280/ts/product/cb/1b/37/62a5dc3201a3dd239b699be21750cc58.png, https://salt.tikicdn.com/cache/200x280/ts/product/5e/65/e5/94ff948f8b232d2ce4ab390064ceb4be.jpg, https://salt.tikicdn.com/cache/200x280/ts/product/27/de/cb/350d9ee054300bc53fe088017322499d.jpg, https://salt.tikicdn.com/cache/200x280/ts/product/25/a8/c4/d0b42398a0850eb1623a14f2456960db.jpg, https://salt.tikicdn.com/cache/200x280/ts/product/6b/2b/41/579e4b89120e93c833c3e8f7bea52b04.jpg, https://salt.tikicdn.com/cache/200x280/ts/product/94/61/b0/c64d4e5012bbdd6ab89e54452627c3a2.png",1000,12
75632377,Bảng Từ Trắng Easyboard - Bảng Trắng Viết Bút Lông 60x100cm - Tặng Combo Phụ Kiện,499000,Bảng từ trắng nhỏ là gì?Bảng từ trắng giá rẻ Easy Board là dòng sản phẩm với kích thước nhỏ gọn (600 x 800 và 600 x 1000mm). Dòng bảng từ trắng này có thể sử dụng khung nhôm hoặc khung nhựa. Tính nă...,"Bảng từ trắng nhỏ là gì? Bảng từ trắng giá rẻ Easy Board là dòng sản phẩm với kích thước nhỏ gọn (600 x 800 và 600 x 1000mm). Dòng bảng từ trắng này có thể sử dụng khung nhôm hoặc khung nhựa. Tính năng sản phẩm bảng từ trắng nhỏ Với kích thước nhỏ, sử dụng khung nhôm nhỏ hoặc khung nhựa nên rất phù hợp với: Ghi chú chung tại phòng khách, bếp tại gia đình Làm bảng học tập tại góc học tập cá nhân Ghi chú thông tin tại góc làm việc cá nhân tại nhà, văn phòng Làm bảng tập vẽ, viết chữ cho các bé đang học chữ hoặc lớp 1 Và nhiều công dụng khá Lợi ích của bảng từ trắng nhỏ Với sản phẩm bảng từ trắng giá rẻ Easy Board bạn sẽ thật dễ dàng ghi chú thông tin, học tập Bé sẽ thích thú hơn khi tập vẽ và viết Bạn sẽ học tiếng anh nhanh hơn bằng cách ghi nhớ các từ mới mỗi ngày trên bảng Bạn sẽ không quên những việc quan trọng, ngày kỷ niệm quan trọng khi ghi nhớ trên bảng Và rất nhiều lợi ích khác từ bảng từ giá rẻ Easyboard mà bạn sẽ tự khám phá Ưu điểm của bảng từ trắng nhỏ Thiết kế nhỏ gọn Thiết kế thanh mảnh phù hợp không gian gia đình ( góc học tập/ ghi chú) Kích thước từ 600 x 800 (mm) đến 800 x 1200 (mm) và Ngoài ra khách hàng có thể lựa chọn kích thước theo nhu cầu riêng của mình. Bề mặt thép từ tính từ Dongkuk Hàn Quốc chất lượng cao Bề mặt bảng từ trắng giá rẻ Easy Board được sử dụng loại  bằng thép phủ sơn trắng nhập khẩu từ hãng sản xuất thép cuộn lớn nhất Hàn Quốc – Dongkuk. Bề mặt  giá rẻ Easy Board được sử dụng loại vật liệu cao cấp từ Dongkuk Hàn Quốc. Tuy là một chiếc bảng nhỏ với giá rẻ nhưng vẫn được sử dụng loại vật liệu cao cấp đảm bảo chất lượng tốt nhất cho sản phẩm. Kết cấu chống cong vênh, bền với thời gian Một chiếc bảng viết thì bề mặt là quan trọng nhất, tuy nhiên kết cấu bảng với khung nhôm, hậu nhựa phía sau bảng sẽ giúp bảng cứng cáp, chắc chắn chống cong vênh và mối mọt trong cả điều kiện thời tiết nồm ẩm và bất lợi. Bảng từ trắng treo tường dễ dàng với móc treo Bảng từ trắng giá rẻ Easyboard lắp đặt dễ dàng trên tường với móc treo bảng.  Bảng sử dụng treo tường cố định hoặc sử dụng móc treo có thể hạ xuống, treo lên dễ dàng. Các câu hỏi th ư ờng gặp : Bảng hít giấy bằng gì? -Mặt bảng bằng thép nên hít bằng nam châm. Xóa không sạch thì phải làm như thế nào? -Mặt bảng xóa sạch với bút và khăn lau đúng loại. Khăn dùng loại microfiber , bút dùng các loại tốt có mực nhập khẩu : TGB/ Pentel. -Viết xong sau 8 tiếng nên xóa bảng, nếu để lâu khó xóa có thể dùng với nước xịt kính, sau đó lau lại bằng khăn khô. Trót dùng nhầm bút dạ dầu viết lên, làm sao lau? -Không sử dụng cồn để xóa -Dùng bút dạ bảng trắng tô đè và phủ lên các nét dùng bút lông dầu. -Lau lai bằng khăn microfiber với nước lau kính và lau lại bằng khăn khô Treo lên tường thạch cao được không? - Được. Khi treo cần 1 cục nam châm để dò xương vách của tường thạch cao, cần khoan vào xương khi lắp đặt. Trung bình khẩu độ xương vách thạch cao là 40 cm. Giá sản phẩm trên Tiki đã bao gồm thuế theo luật hiện hành. Bên cạnh đó, tuỳ vào loại sản phẩm, hình thức và địa chỉ giao hàng mà có thể phát sinh thêm chi phí khác như phí vận chuyển, phụ phí hàng cồng kềnh, thuế nhập khẩu (đối với đơn hàng giao từ nước ngoài có giá trị trên 1 triệu đồng).....",4.7,55,"https://salt.tikicdn.com/ts/product/34/e4/a0/898a08f11cc4e2700353b5cc4ac9c8e8.png, https://salt.tikicdn.com/ts/product/4a/03/63/428a2a37fd39a24c305de89e80990cd8.png, https://salt.tikicdn.com/ts/product/4c/6c/e4/35c8d710331b5a1bc50dda41291980a9.png, https://salt.tikicdn.com/ts/product/ed/a4/d3/2b9d01ee6d6a35609fb0c53c95925043.png, https://salt.tikicdn.com/ts/product/e0/68/a4/5c14c7feae0cf120a26a9413eef7c87d.png, https://salt.tikicdn.com/media/catalog/producttmp/97/91/e5/237359bd69f8c0c5df78c8167e9d01f9.png, https://salt.tikicdn.com/ts/product/10/14/be/cc01087dd131a711e07e2e8b18e35ee6.png, https://salt.tikicdn.com/ts/product/52/b8/f7/9a3e73d85c4dda2064db2ec3bb06476f.png, https://salt.tikicdn.com/ts/product/d3/11/4d/9bf818f28178bf66ca5fea981671fb59.png, https://salt.tikicdn.com/ts/product/23/64/9d/48b31de3e5db63809be5c86035874d3a.png","https://salt.tikicdn.com/cache/w1200/ts/product/34/e4/a0/898a08f11cc4e2700353b5cc4ac9c8e8.png, https://salt.tikicdn.com/cache/w1200/ts/product/4a/03/63/428a2a37fd39a24c305de89e80990cd8.png, https://salt.tikicdn.com/cache/w1200/ts/product/4c/6c/e4/35c8d710331b5a1bc50dda41291980a9.png, https://salt.tikicdn.com/cache/w1200/ts/product/ed/a4/d3/2b9d01ee6d6a35609fb0c53c95925043.png, https://salt.tikicdn.com/cache/w1200/ts/product/e0/68/a4/5c14c7feae0cf120a26a9413eef7c87d.png, https://salt.tikicdn.com/cache/w1200/media/catalog/producttmp/97/91/e5/237359bd69f8c0c5df78c8167e9d01f9.png, https://salt.tikicdn.com/cache/w1200/ts/product/10/14/be/cc01087dd131a711e07e2e8b18e35ee6.png, https://salt.tikicdn.com/cache/w1200/ts/product/52/b8/f7/9a3e73d85c4dda2064db2ec3bb06476f.png, https://salt.tikicdn.com/cache/w1200/ts/product/d3/11/4d/9bf818f28178bf66ca5fea981671fb59.png, https://salt.tikicdn.com/cache/w1200/ts/product/23/64/9d/48b31de3e5db63809be5c86035874d3a.png","https://salt.tikicdn.com/cache/w300/ts/product/34/e4/a0/898a08f11cc4e2700353b5cc4ac9c8e8.png, https://salt.tikicdn.com/cache/w300/ts/product/4a/03/63/428a2a37fd39a24c305de89e80990cd8.png, https://salt.tikicdn.com/cache/w300/ts/product/4c/6c/e4/35c8d710331b5a1bc50dda41291980a9.png, https://salt.tikicdn.com/cache/w300/ts/product/ed/a4/d3/2b9d01ee6d6a35609fb0c53c95925043.png, https://salt.tikicdn.com/cache/w300/ts/product/e0/68/a4/5c14c7feae0cf120a26a9413eef7c87d.png, https://salt.tikicdn.com/cache/w300/media/catalog/producttmp/97/91/e5/237359bd69f8c0c5df78c8167e9d01f9.png, https://salt.tikicdn.com/cache/w300/ts/product/10/14/be/cc01087dd131a711e07e2e8b18e35ee6.png, https://salt.tikicdn.com/cache/w300/ts/product/52/b8/f7/9a3e73d85c4dda2064db2ec3bb06476f.png, https://salt.tikicdn.com/cache/w300/ts/product/d3/11/4d/9bf818f28178bf66ca5fea981671fb59.png, https://salt.tikicdn.com/cache/w300/ts/product/23/64/9d/48b31de3e5db63809be5c86035874d3a.png","https://salt.tikicdn.com/cache/200x280/ts/product/34/e4/a0/898a08f11cc4e2700353b5cc4ac9c8e8.png, https://salt.tikicdn.com/cache/200x280/ts/product/4a/03/63/428a2a37fd39a24c305de89e80990cd8.png, https://salt.tikicdn.com/cache/200x280/ts/product/4c/6c/e4/35c8d710331b5a1bc50dda41291980a9.png, https://salt.tikicdn.com/cache/200x280/ts/product/ed/a4/d3/2b9d01ee6d6a35609fb0c53c95925043.png, https://salt.tikicdn.com/cache/200x280/ts/product/e0/68/a4/5c14c7feae0cf120a26a9413eef7c87d.png, https://salt.tikicdn.com/cache/200x280/media/catalog/producttmp/97/91/e5/237359bd69f8c0c5df78c8167e9d01f9.png, https://salt.tikicdn.com/cache/200x280/ts/product/10/14/be/cc01087dd131a711e07e2e8b18e35ee6.png, https://salt.tikicdn.com/cache/200x280/ts/product/52/b8/f7/9a3e73d85c4dda2064db2ec3bb06476f.png, https://salt.tikicdn.com/cache/200x280/ts/product/d3/11/4d/9bf818f28178bf66ca5fea981671fb59.png, https://salt.tikicdn.com/cache/200x280/ts/product/23/64/9d/48b31de3e5db63809be5c86035874d3a.png","https://salt.tikicdn.com/cache/200x280/ts/product/34/e4/a0/898a08f11cc4e2700353b5cc4ac9c8e8.png, https://salt.tikicdn.com/cache/200x280/ts/product/4a/03/63/428a2a37fd39a24c305de89e80990cd8.png, https://salt.tikicdn.com/cache/200x280/ts/product/4c/6c/e4/35c8d710331b5a1bc50dda41291980a9.png, https://salt.tikicdn.com/cache/200x280/ts/product/ed/a4/d3/2b9d01ee6d6a35609fb0c53c95925043.png, https://salt.tikicdn.com/cache/200x280/ts/product/e0/68/a4/5c14c7feae0cf120a26a9413eef7c87d.png, https://salt.tikicdn.com/cache/200x280/media/catalog/producttmp/97/91/e5/237359bd69f8c0c5df78c8167e9d01f9.png, https://salt.tikicdn.com/cache/200x280/ts/product/10/14/be/cc01087dd131a711e07e2e8b18e35ee6.png, https://salt.tikicdn.com/cache/200x280/ts/product/52/b8/f7/9a3e73d85c4dda2064db2ec3bb06476f.png, https://salt.tikicdn.com/cache/200x280/ts/product/d3/11/4d/9bf818f28178bf66ca5fea981671fb59.png, https://salt.tikicdn.com/cache/200x280/ts/product/23/64/9d/48b31de3e5db63809be5c86035874d3a.png",1000,55
14514489,Bảng Từ Viết Bút Lông Ceramic Bavico BLCE-01 Trắng 0.4x0.6m,980400,"Mặt bảng: bảng viết bút lông từ màu trắng của Bỉ , không có ô lyĐược sản xuất theo tiêu chuẩn Châu Âu BS EN10209 & đã được kiểm định bởi QUATEST3, với nhiều đặc tính nổi bật như : Mặt bảng chốn...","Mặt bảng: bảng viết bút lông từ màu trắng của Bỉ , không có ô ly Được sản xuất theo tiêu chuẩn Châu Âu BS EN10209 & đã được kiểm định bởi QUATEST3, với nhiều đặc tính nổi bật như : Mặt bảng chống trầy, Chống cháy Đặc biệt dễ xóa và không để lại dấu Chống chói, lóa, trơn trượt Chống hư hại bởi hóa chất Có từ tính Kháng khuẩn và bảo vệ môi trường Độ bền trên 40 năm Tấm lót bảng: bằng ván MDF ép giấy bóng vân gỗ chống ẩm, chống cong mo và đảm bảo bảng viết không bị rung Khung/bo bảng: bằng nhôm Việt Nhật chuyên dụng Co góc: Bốn góc bảng có co nhựa màu sắc hài hòa, chống bị trầy xước Giá sản phẩm trên Tiki đã bao gồm thuế theo luật hiện hành. Bên cạnh đó, tuỳ vào loại sản phẩm, hình thức và địa chỉ giao hàng mà có thể phát sinh thêm chi phí khác như phí vận chuyển, phụ phí hàng cồng kềnh, thuế nhập khẩu (đối với đơn hàng giao từ nước ngoài có giá trị trên 1 triệu đồng).....",5,2,https://salt.tikicdn.com/ts/product/87/28/82/34c26b9106b96edc7ec0404a3f56eb24.jpg,https://salt.tikicdn.com/cache/w1200/ts/product/87/28/82/34c26b9106b96edc7ec0404a3f56eb24.jpg,https://salt.tikicdn.com/cache/w300/ts/product/87/28/82/34c26b9106b96edc7ec0404a3f56eb24.jpg,https://salt.tikicdn.com/cache/200x280/ts/product/87/28/82/34c26b9106b96edc7ec0404a3f56eb24.jpg,https://salt.tikicdn.com/cache/200x280/ts/product/87/28/82/34c26b9106b96edc7ec0404a3f56eb24.jpg,1000,2
