id,name,price,short_description,description,rating_average,review_count,image_base_url,image_large_url,image_medium_url,image_small_url,image_thumbnail_url,stock,quantity_sold
277341803,Máy Tính Văn Phòng JV-40VN Máy Tính Để Bàn Hàng Chính Hãng - Bảo Hành 2 Năm,410000,THÔNG TIN CHI TIẾTTên sản phẩm: Máy tính JV-40VNThương hiệu: VINAPLUSModel: JV-40VNBảo hành: 2 nămKích thước (dài x rộng x dày): 176 x 109 X 21 mmHiển thị: 14 sốGIỚI THIỆU SẢN PHẨM- Được thiết...,"THÔNG TIN CHI TIẾT Tên sản phẩm: Máy tính JV-40VN Thương hiệu: VINAPLUS Model: JV-40VN Bảo hành: 2 năm Kích thước (dài x rộng x dày): 176 x 109 X 21 mm Hiển thị: 14 số GIỚI THIỆU SẢN PHẨM - Được thiết kế và chế tạo để mang lại hiệu suất cao. - Loại để bàn gọn nhẹ 21(C) × 109(R) × 176(D) mm - Màn hình cực lớn: màn hình lớn hơn giúp đọc nhiều dữ liệu dễ dàng hơn. - Nguồn hai chiều (Mặt trời + Pin): chế độ sử dụng năng lượng mặt trời được bật khi đủ sáng, chế độ pin được bật khi không đủ sáng. - Nhấn đồng thời phím: các thao tác phím được lưu trữ trong bộ nhớ đệm, nhờ vậy sẽ không bị mất dữ liệu ngay cả khi nhập với tốc độ cao. - Các phím dẻo: được thiết kế và chế tạo để dễ dàng thao tác. - Bề mặt kim loại bền: vỏ bền chịu được va đập mạnh. - Chức năng tính thuế & hối đoái - Các chức năng tính thuế và quy đổi tiền tệ. - Phần trăm tỷ lệ lợi nhuận Phím ” % ” cho phép truy cập nhanh vào giá và lợi nhuận đồng thời cung cấp các bổ trợ, chiết khấu, tỷ lệ và các giá trị tăng/giảm. - Các biểu tượng lệnh hàm - Ký hiệu (+, -, ×, ÷) trên màn hình cho biết trạng thái của thao tác bạn hiện đang thực hiện. - Các phím có độ bền cao - Các phím được tạo bằng cách phun nhựa có hai màu khác nhau. - Các ký hiệu trên phím được ghi bằng chất dẻo, điều đó có nghĩa là chúng không bị mòn hoặc mờ trong quá trình sử dụng. CAM KẾT VÀ CHÍNH SÁCH - Hàng có sẵn tại kho, giao hàng ngay khi nhận được đơn - Khuyến khích khách hàng quay video khi khui hàng để làm căn cứ đổi trả đối với những sản phẩm bị lỗi do quá trình vận chuyển hoặc do nhà sản xuất - Chế độ bảo hành và chính sách sau bán hàng tốt nhất CHẾ ĐỘ BẢO HÀNH - Bảo hành 2 năm từ nhà sản xuất LƯU Ý - Bảo quản ở nơi khô ráo. - Vui lòng liên hệ để được hỗ trợ tư vấn sản phẩm trước khi bấm mua hàng. - Nếu có bất kỳ vấn đề gì với sản phẩm hay đơn hàng, chớ vội đánh giá sao/ xác nhận đã nhận hàng bạn nhé. Bạn vui lòng liên hệ với hãng, hãng sẽ giải quyết vấn đề kịp thời để bạn hài lòng. Nếu bạn cảm thấy hài lòng, xin vui lòng để lại đánh giá 5 sao, sự ủng hộ của bạn sẽ là nguồn động viên tốt nhất cho Vinaplus *** RẤT CẢM ƠN QUÝ KHÁCH ĐÃ TIN TƯỞNG VÀ LỰA CHỌN SẢN PHẨM CỦA VINAPLUS ! Giá sản phẩm trên Tiki đã bao gồm thuế theo luật hiện hành. Bên cạnh đó, tuỳ vào loại sản phẩm, hình thức và địa chỉ giao hàng mà có thể phát sinh thêm chi phí khác như phí vận chuyển, phụ phí hàng cồng kềnh, thuế nhập khẩu (đối với đơn hàng giao từ nước ngoài có giá trị trên 1 triệu đồng).....",0,0,"https://salt.tikicdn.com/ts/product/62/5c/10/e34b529e15dfd52809987ceab0fefc90.png, https://salt.tikicdn.com/ts/product/84/07/79/b620769ef3b4bee6709ef94fea7a622b.png, https://salt.tikicdn.com/ts/product/38/62/c2/e1550dd82e2920370bdeb9c2a08cc9ee.jpg, https://salt.tikicdn.com/ts/product/f9/29/ec/61b45307dd037a27014e6743acafcff7.png","https://salt.tikicdn.com/cache/w1200/ts/product/62/5c/10/e34b529e15dfd52809987ceab0fefc90.png, https://salt.tikicdn.com/cache/w1200/ts/product/84/07/79/b620769ef3b4bee6709ef94fea7a622b.png, https://salt.tikicdn.com/cache/w1200/ts/product/38/62/c2/e1550dd82e2920370bdeb9c2a08cc9ee.jpg, https://salt.tikicdn.com/cache/w1200/ts/product/f9/29/ec/61b45307dd037a27014e6743acafcff7.png","https://salt.tikicdn.com/cache/w300/ts/product/62/5c/10/e34b529e15dfd52809987ceab0fefc90.png, https://salt.tikicdn.com/cache/w300/ts/product/84/07/79/b620769ef3b4bee6709ef94fea7a622b.png, https://salt.tikicdn.com/cache/w300/ts/product/38/62/c2/e1550dd82e2920370bdeb9c2a08cc9ee.jpg, https://salt.tikicdn.com/cache/w300/ts/product/f9/29/ec/61b45307dd037a27014e6743acafcff7.png","https://salt.tikicdn.com/cache/200x280/ts/product/62/5c/10/e34b529e15dfd52809987ceab0fefc90.png, https://salt.tikicdn.com/cache/200x280/ts/product/84/07/79/b620769ef3b4bee6709ef94fea7a622b.png, https://salt.tikicdn.com/cache/200x280/ts/product/38/62/c2/e1550dd82e2920370bdeb9c2a08cc9ee.jpg, https://salt.tikicdn.com/cache/200x280/ts/product/f9/29/ec/61b45307dd037a27014e6743acafcff7.png","https://salt.tikicdn.com/cache/200x280/ts/product/62/5c/10/e34b529e15dfd52809987ceab0fefc90.png, https://salt.tikicdn.com/cache/200x280/ts/product/84/07/79/b620769ef3b4bee6709ef94fea7a622b.png, https://salt.tikicdn.com/cache/200x280/ts/product/38/62/c2/e1550dd82e2920370bdeb9c2a08cc9ee.jpg, https://salt.tikicdn.com/cache/200x280/ts/product/f9/29/ec/61b45307dd037a27014e6743acafcff7.png",1000,0
276899136,Máy Tính Để Bàn 12 Số Thiết Kế Mới Deli - Máy Tính Cầm Tay Màn Hình LCD Chất Lượng Cao Dùng Cho Văn Phòng,159000,TÍNH NĂNG SẢN PHẨM:️Chất liệu kim loại siêu bền️Màn hình LCD lớn tráng mica️Đạt chứng nhận CE về chất lượng cao THÔNG TIN SẢN PHẨM:Tên sản phẩm: Máy tính để bàn 12 số DeliMã sản phẩm: EM36Màu ...,"TÍNH NĂNG SẢN PHẨM: ️Chất liệu kim loại siêu bền ️Màn hình LCD lớn tráng mica ️Đạt chứng nhận CE về chất lượng cao THÔNG TIN SẢN PHẨM: Tên sản phẩm: Máy tính để bàn 12 số Deli Mã sản phẩm: EM36 Màu sắc: Hồng/ Kem/ Xanh Lá Sử dụng pin: AAA*1 Xuất xứ: Trung Quốc -------------------------------------------------------------------------------------------------------- Tự hào là một trong những nhãn hàng văn phòng phẩm lớn nhất tại Việt Nam, @Delivietnam không ngừng nỗ lực và phát triển trong lĩnh vực phân phối các sản phẩm cho các đơn vị văn phòng, trường học,... Với phương châm sản xuất những sản phẩm chất lượng tốt nhất và luôn đặt khách hàng làm trọng tâm, sứ mệnh của Deli là làm hài hòng người tiêu dùng toàn cầu với những sản phẩm chất lượng cao, độ tin cậy tuyệt đối và thân thiện với người dùng. Khách hàng lựa chọn các sản phẩm của @Delivietnam sẽ được cam kết: Sản phẩm chính hãng từ nhà máy Deli, nguồn gốc rõ ràng và chất lượng đạt tiêu chuẩn. Bảo hành theo quy định của nhà sản xuất. Giá cả hợp lý, cạnh tranh, rẻ nhất thị trường. Hỗ trợ đổi trả hàng cho những sản phẩm bị thiếu. Giá sản phẩm trên Tiki đã bao gồm thuế theo luật hiện hành. Bên cạnh đó, tuỳ vào loại sản phẩm, hình thức và địa chỉ giao hàng mà có thể phát sinh thêm chi phí khác như phí vận chuyển, phụ phí hàng cồng kềnh, thuế nhập khẩu (đối với đơn hàng giao từ nước ngoài có giá trị trên 1 triệu đồng).....",0,0,"https://salt.tikicdn.com/ts/product/02/65/a9/a4f9d93e9b129ec2f6e3b12eb0450428.jpg, https://salt.tikicdn.com/ts/product/1b/43/75/33c5367f934a660b419e1a336dde74d7.jpg, https://salt.tikicdn.com/ts/product/c1/4e/43/5ca899476aa1a5f52a2efbf8043c1196.jpg, https://salt.tikicdn.com/ts/product/ab/5e/64/192dc4f54046c05dd8097b92be0463e3.jpg, https://salt.tikicdn.com/ts/product/b5/82/d2/84dce51ad05a2ecb2452493c75bb1d5a.jpg","https://salt.tikicdn.com/cache/w1200/ts/product/02/65/a9/a4f9d93e9b129ec2f6e3b12eb0450428.jpg, https://salt.tikicdn.com/cache/w1200/ts/product/1b/43/75/33c5367f934a660b419e1a336dde74d7.jpg, https://salt.tikicdn.com/cache/w1200/ts/product/c1/4e/43/5ca899476aa1a5f52a2efbf8043c1196.jpg, https://salt.tikicdn.com/cache/w1200/ts/product/ab/5e/64/192dc4f54046c05dd8097b92be0463e3.jpg, https://salt.tikicdn.com/cache/w1200/ts/product/b5/82/d2/84dce51ad05a2ecb2452493c75bb1d5a.jpg","https://salt.tikicdn.com/cache/w300/ts/product/02/65/a9/a4f9d93e9b129ec2f6e3b12eb0450428.jpg, https://salt.tikicdn.com/cache/w300/ts/product/1b/43/75/33c5367f934a660b419e1a336dde74d7.jpg, https://salt.tikicdn.com/cache/w300/ts/product/c1/4e/43/5ca899476aa1a5f52a2efbf8043c1196.jpg, https://salt.tikicdn.com/cache/w300/ts/product/ab/5e/64/192dc4f54046c05dd8097b92be0463e3.jpg, https://salt.tikicdn.com/cache/w300/ts/product/b5/82/d2/84dce51ad05a2ecb2452493c75bb1d5a.jpg","https://salt.tikicdn.com/cache/200x280/ts/product/02/65/a9/a4f9d93e9b129ec2f6e3b12eb0450428.jpg, https://salt.tikicdn.com/cache/200x280/ts/product/1b/43/75/33c5367f934a660b419e1a336dde74d7.jpg, https://salt.tikicdn.com/cache/200x280/ts/product/c1/4e/43/5ca899476aa1a5f52a2efbf8043c1196.jpg, https://salt.tikicdn.com/cache/200x280/ts/product/ab/5e/64/192dc4f54046c05dd8097b92be0463e3.jpg, https://salt.tikicdn.com/cache/200x280/ts/product/b5/82/d2/84dce51ad05a2ecb2452493c75bb1d5a.jpg","https://salt.tikicdn.com/cache/200x280/ts/product/02/65/a9/a4f9d93e9b129ec2f6e3b12eb0450428.jpg, https://salt.tikicdn.com/cache/200x280/ts/product/1b/43/75/33c5367f934a660b419e1a336dde74d7.jpg, https://salt.tikicdn.com/cache/200x280/ts/product/c1/4e/43/5ca899476aa1a5f52a2efbf8043c1196.jpg, https://salt.tikicdn.com/cache/200x280/ts/product/ab/5e/64/192dc4f54046c05dd8097b92be0463e3.jpg, https://salt.tikicdn.com/cache/200x280/ts/product/b5/82/d2/84dce51ad05a2ecb2452493c75bb1d5a.jpg",1000,0
275961147,Máy tính để bàn 12 số Deli - 1 chiếc - E837-Chọn Màu,90000,@   - Ử À ĐỘ Ề Ả Ẩ   Ấ Ạ Ệ TÍNH NĂNG SẢN PHẨM:️Chất liệu kim loại siêu bền️Màn hình LCD lớn tráng mica️Đạt chứng nhận CE về chất lượng cao️Bảo hành 2 nămTHÔNG TIN SẢN PHẨM:Tên sản phẩm: Máy tính...,"@   - Ử À ĐỘ Ề Ả Ẩ   Ấ Ạ Ệ TÍNH NĂNG SẢN PHẨM: ️Chất liệu kim loại siêu bền ️Màn hình LCD lớn tráng mica ️Đạt chứng nhận CE về chất lượng cao ️Bảo hành 2 năm THÔNG TIN SẢN PHẨM: Tên sản phẩm: Máy tính để bàn 12 số Deli Mã sản phẩm: E837 Màu sắc: Đen -------------------------------------------------------------------------------------------------------- Tự hào là một trong những nhãn hàng văn phòng phẩm lớn nhất tại Việt Nam, @Delivietnam không ngừng nỗ lực và phát triển trong lĩnh vực phân phối các sản phẩm cho các đơn vị văn phòng, trường học,... Với phương châm sản xuất những sản phẩm chất lượng tốt nhất và luôn đặt khách hàng làm trọng tâm, sứ mệnh của Deli là làm hài hòng người tiêu dùng toàn cầu với những sản phẩm chất lượng cao, độ tin cậy tuyệt đối và thân thiện với người dùng. Khách hàng lựa chọn các sản phẩm của @Delivietnam sẽ được cam kết: Sản phẩm chính hãng từ nhà máy Deli, nguồn gốc rõ ràng và chất lượng đạt tiêu chuẩn. Bảo hành theo quy định của nhà sản xuất. Giá cả hợp lý, cạnh tranh, rẻ nhất thị trường. Hỗ trợ đổi trả hàng cho những sản phẩm bị thiếu. Giá sản phẩm trên Tiki đã bao gồm thuế theo luật hiện hành. Bên cạnh đó, tuỳ vào loại sản phẩm, hình thức và địa chỉ giao hàng mà có thể phát sinh thêm chi phí khác như phí vận chuyển, phụ phí hàng cồng kềnh, thuế nhập khẩu (đối với đơn hàng giao từ nước ngoài có giá trị trên 1 triệu đồng)..... Sản phẩm này là tài sản cá nhân được bán bởi Nhà Bán Hàng Cá Nhân và không thuộc đối tượng phải chịu thuế GTGT. Do đó hoá đơn VAT không được cung cấp trong trường hợp này.",5,3,"https://salt.tikicdn.com/ts/product/df/1f/c2/295820a17f94eca1753f7ff2079e1b57.jpg, https://salt.tikicdn.com/ts/product/10/3d/6f/9d8bcf193b9853d5a963dd57cda99a41.jpg, https://salt.tikicdn.com/ts/product/1f/f3/5a/bb22ff99616aae7caf2a1ced87d8f946.jpg, https://salt.tikicdn.com/ts/product/2b/5d/43/0aee654a381e96598e96f865961db5b2.jpg, https://salt.tikicdn.com/ts/product/41/f6/de/168fa349bfbde00c22b36f2a4ceb6d40.jpg, https://salt.tikicdn.com/ts/product/49/32/c8/53d9891ec01b46cc999ae10e696a6032.jpg, https://salt.tikicdn.com/ts/product/6f/2a/f9/31cea5b73a227f6f5d538b5ff829c4c5.jpg, https://salt.tikicdn.com/ts/product/99/ec/90/a87de12bc24c6e0d621200e85a60f878.jpg, https://salt.tikicdn.com/ts/product/d5/15/ed/9a528dd618b4aeea24579b85c15982a1.jpg, https://salt.tikicdn.com/ts/product/df/f5/5a/7f64dcff08c4693f48aac0feb58ad216.jpg","https://salt.tikicdn.com/cache/w1200/ts/product/df/1f/c2/295820a17f94eca1753f7ff2079e1b57.jpg, https://salt.tikicdn.com/cache/w1200/ts/product/10/3d/6f/9d8bcf193b9853d5a963dd57cda99a41.jpg, https://salt.tikicdn.com/cache/w1200/ts/product/1f/f3/5a/bb22ff99616aae7caf2a1ced87d8f946.jpg, https://salt.tikicdn.com/cache/w1200/ts/product/2b/5d/43/0aee654a381e96598e96f865961db5b2.jpg, https://salt.tikicdn.com/cache/w1200/ts/product/41/f6/de/168fa349bfbde00c22b36f2a4ceb6d40.jpg, https://salt.tikicdn.com/cache/w1200/ts/product/49/32/c8/53d9891ec01b46cc999ae10e696a6032.jpg, https://salt.tikicdn.com/cache/w1200/ts/product/6f/2a/f9/31cea5b73a227f6f5d538b5ff829c4c5.jpg, https://salt.tikicdn.com/cache/w1200/ts/product/99/ec/90/a87de12bc24c6e0d621200e85a60f878.jpg, https://salt.tikicdn.com/cache/w1200/ts/product/d5/15/ed/9a528dd618b4aeea24579b85c15982a1.jpg, https://salt.tikicdn.com/cache/w1200/ts/product/df/f5/5a/7f64dcff08c4693f48aac0feb58ad216.jpg","https://salt.tikicdn.com/cache/w300/ts/product/df/1f/c2/295820a17f94eca1753f7ff2079e1b57.jpg, https://salt.tikicdn.com/cache/w300/ts/product/10/3d/6f/9d8bcf193b9853d5a963dd57cda99a41.jpg, https://salt.tikicdn.com/cache/w300/ts/product/1f/f3/5a/bb22ff99616aae7caf2a1ced87d8f946.jpg, https://salt.tikicdn.com/cache/w300/ts/product/2b/5d/43/0aee654a381e96598e96f865961db5b2.jpg, https://salt.tikicdn.com/cache/w300/ts/product/41/f6/de/168fa349bfbde00c22b36f2a4ceb6d40.jpg, https://salt.tikicdn.com/cache/w300/ts/product/49/32/c8/53d9891ec01b46cc999ae10e696a6032.jpg, https://salt.tikicdn.com/cache/w300/ts/product/6f/2a/f9/31cea5b73a227f6f5d538b5ff829c4c5.jpg, https://salt.tikicdn.com/cache/w300/ts/product/99/ec/90/a87de12bc24c6e0d621200e85a60f878.jpg, https://salt.tikicdn.com/cache/w300/ts/product/d5/15/ed/9a528dd618b4aeea24579b85c15982a1.jpg, https://salt.tikicdn.com/cache/w300/ts/product/df/f5/5a/7f64dcff08c4693f48aac0feb58ad216.jpg","https://salt.tikicdn.com/cache/200x280/ts/product/df/1f/c2/295820a17f94eca1753f7ff2079e1b57.jpg, https://salt.tikicdn.com/cache/200x280/ts/product/10/3d/6f/9d8bcf193b9853d5a963dd57cda99a41.jpg, https://salt.tikicdn.com/cache/200x280/ts/product/1f/f3/5a/bb22ff99616aae7caf2a1ced87d8f946.jpg, https://salt.tikicdn.com/cache/200x280/ts/product/2b/5d/43/0aee654a381e96598e96f865961db5b2.jpg, https://salt.tikicdn.com/cache/200x280/ts/product/41/f6/de/168fa349bfbde00c22b36f2a4ceb6d40.jpg, https://salt.tikicdn.com/cache/200x280/ts/product/49/32/c8/53d9891ec01b46cc999ae10e696a6032.jpg, https://salt.tikicdn.com/cache/200x280/ts/product/6f/2a/f9/31cea5b73a227f6f5d538b5ff829c4c5.jpg, https://salt.tikicdn.com/cache/200x280/ts/product/99/ec/90/a87de12bc24c6e0d621200e85a60f878.jpg, https://salt.tikicdn.com/cache/200x280/ts/product/d5/15/ed/9a528dd618b4aeea24579b85c15982a1.jpg, https://salt.tikicdn.com/cache/200x280/ts/product/df/f5/5a/7f64dcff08c4693f48aac0feb58ad216.jpg","https://salt.tikicdn.com/cache/200x280/ts/product/df/1f/c2/295820a17f94eca1753f7ff2079e1b57.jpg, https://salt.tikicdn.com/cache/200x280/ts/product/10/3d/6f/9d8bcf193b9853d5a963dd57cda99a41.jpg, https://salt.tikicdn.com/cache/200x280/ts/product/1f/f3/5a/bb22ff99616aae7caf2a1ced87d8f946.jpg, https://salt.tikicdn.com/cache/200x280/ts/product/2b/5d/43/0aee654a381e96598e96f865961db5b2.jpg, https://salt.tikicdn.com/cache/200x280/ts/product/41/f6/de/168fa349bfbde00c22b36f2a4ceb6d40.jpg, https://salt.tikicdn.com/cache/200x280/ts/product/49/32/c8/53d9891ec01b46cc999ae10e696a6032.jpg, https://salt.tikicdn.com/cache/200x280/ts/product/6f/2a/f9/31cea5b73a227f6f5d538b5ff829c4c5.jpg, https://salt.tikicdn.com/cache/200x280/ts/product/99/ec/90/a87de12bc24c6e0d621200e85a60f878.jpg, https://salt.tikicdn.com/cache/200x280/ts/product/d5/15/ed/9a528dd618b4aeea24579b85c15982a1.jpg, https://salt.tikicdn.com/cache/200x280/ts/product/df/f5/5a/7f64dcff08c4693f48aac0feb58ad216.jpg",1000,3
208374393,Máy Tính Để Bàn 12 Số Deli - Phù Hợp Kinh Doanh Văn Phòng Tính Chính Xác Cao Tiện Lợi - E837 TE837C,79000,Máy tính để bàn 12 số DeliTÍNH NĂNG SẢN PHẨM:Chất liệu kim loại siêu bền️Màn hình LCD lớn tráng mica️Đạt chứng nhận CE về chất lượng caoBảo hành 2 năm------------------------------------------...,"Máy tính để bàn 12 số Deli TÍNH NĂNG SẢN PHẨM: Chất liệu kim loại siêu bền ️Màn hình LCD lớn tráng mica ️Đạt chứng nhận CE về chất lượng cao Bảo hành 2 năm -------------------------------------------------------------------------------------------------------- Tự hào là một trong những nhãn hàng văn phòng phẩm lớn nhất tại Việt Nam, @Delivietnam không ngừng nỗ lực và phát triển trong lĩnh vực phân phối các sản phẩm cho các đơn vị văn phòng, trường học,... Với phương châm sản xuất những sản phẩm chất lượng tốt nhất và luôn đặt khách hàng làm trọng tâm, sứ mệnh của Deli là làm hài hòng người tiêu dùng toàn cầu với những sản phẩm chất lượng cao, độ tin cậy tuyệt đối và thân thiện với người dùng. Khách hàng lựa chọn các sản phẩm của @Delivietnam sẽ được cam kết: Sản phẩm chính hãng từ nhà máy Deli, nguồn gốc rõ ràng và chất lượng đạt tiêu chuẩn Bảo hành theo quy định của nhà sản xuất Giá cả hợp lý, cạnh tranh, rẻ nhất thị trường Hỗ trợ đổi trả hàng cho những sản phẩm bị thiếu Giá sản phẩm trên Tiki đã bao gồm thuế theo luật hiện hành. Bên cạnh đó, tuỳ vào loại sản phẩm, hình thức và địa chỉ giao hàng mà có thể phát sinh thêm chi phí khác như phí vận chuyển, phụ phí hàng cồng kềnh, thuế nhập khẩu (đối với đơn hàng giao từ nước ngoài có giá trị trên 1 triệu đồng).....",4.8,88,"https://salt.tikicdn.com/ts/product/63/2d/97/2e739c3cdebccc6488411ded1a57be16.png, https://salt.tikicdn.com/ts/product/21/f6/49/b1569d204a90f7568b080d98d166e523.png, https://salt.tikicdn.com/ts/product/02/a6/93/807f28c5680e8d31903fff572171d38f.png, https://salt.tikicdn.com/ts/product/f5/d7/b4/0a38a799131d5d233ad2feb43abc7d93.png, https://salt.tikicdn.com/ts/product/50/36/b9/38900a32db6a56b76c6c96ae3bec34d5.png, https://salt.tikicdn.com/ts/product/c2/b3/96/cc1eb1a9ebee681a312998155f61937b.png, https://salt.tikicdn.com/ts/product/98/e8/2e/0926c9ba6096e3613213bd9ae4ab37b9.png, https://salt.tikicdn.com/ts/product/b8/26/b5/9ab70938e5603f9b9748624e43195489.png, https://salt.tikicdn.com/ts/product/99/f7/25/c0fb734349e520f65852e250c5726408.png, https://salt.tikicdn.com/ts/product/88/d8/e3/57a320d0cdb51668c73a630e622af9a2.png, https://salt.tikicdn.com/ts/product/cd/76/eb/09498e0d5e07247c1e38e7b6b1fdea9b.png, https://salt.tikicdn.com/ts/product/51/4e/81/23803f80712bc7cdea3d999c998fefa4.png, https://salt.tikicdn.com/ts/product/d1/7e/aa/dcc07c8700f1e0a04db289198a09de73.png, https://salt.tikicdn.com/ts/product/4a/cf/05/26f4d60bee97cab32e9865277d162bbf.png","https://salt.tikicdn.com/cache/w1200/ts/product/63/2d/97/2e739c3cdebccc6488411ded1a57be16.png, https://salt.tikicdn.com/cache/w1200/ts/product/21/f6/49/b1569d204a90f7568b080d98d166e523.png, https://salt.tikicdn.com/cache/w1200/ts/product/02/a6/93/807f28c5680e8d31903fff572171d38f.png, https://salt.tikicdn.com/cache/w1200/ts/product/f5/d7/b4/0a38a799131d5d233ad2feb43abc7d93.png, https://salt.tikicdn.com/cache/w1200/ts/product/50/36/b9/38900a32db6a56b76c6c96ae3bec34d5.png, https://salt.tikicdn.com/cache/w1200/ts/product/c2/b3/96/cc1eb1a9ebee681a312998155f61937b.png, https://salt.tikicdn.com/cache/w1200/ts/product/98/e8/2e/0926c9ba6096e3613213bd9ae4ab37b9.png, https://salt.tikicdn.com/cache/w1200/ts/product/b8/26/b5/9ab70938e5603f9b9748624e43195489.png, https://salt.tikicdn.com/cache/w1200/ts/product/99/f7/25/c0fb734349e520f65852e250c5726408.png, https://salt.tikicdn.com/cache/w1200/ts/product/88/d8/e3/57a320d0cdb51668c73a630e622af9a2.png, https://salt.tikicdn.com/cache/w1200/ts/product/cd/76/eb/09498e0d5e07247c1e38e7b6b1fdea9b.png, https://salt.tikicdn.com/cache/w1200/ts/product/51/4e/81/23803f80712bc7cdea3d999c998fefa4.png, https://salt.tikicdn.com/cache/w1200/ts/product/d1/7e/aa/dcc07c8700f1e0a04db289198a09de73.png, https://salt.tikicdn.com/cache/w1200/ts/product/4a/cf/05/26f4d60bee97cab32e9865277d162bbf.png","https://salt.tikicdn.com/cache/w300/ts/product/63/2d/97/2e739c3cdebccc6488411ded1a57be16.png, https://salt.tikicdn.com/cache/w300/ts/product/21/f6/49/b1569d204a90f7568b080d98d166e523.png, https://salt.tikicdn.com/cache/w300/ts/product/02/a6/93/807f28c5680e8d31903fff572171d38f.png, https://salt.tikicdn.com/cache/w300/ts/product/f5/d7/b4/0a38a799131d5d233ad2feb43abc7d93.png, https://salt.tikicdn.com/cache/w300/ts/product/50/36/b9/38900a32db6a56b76c6c96ae3bec34d5.png, https://salt.tikicdn.com/cache/w300/ts/product/c2/b3/96/cc1eb1a9ebee681a312998155f61937b.png, https://salt.tikicdn.com/cache/w300/ts/product/98/e8/2e/0926c9ba6096e3613213bd9ae4ab37b9.png, https://salt.tikicdn.com/cache/w300/ts/product/b8/26/b5/9ab70938e5603f9b9748624e43195489.png, https://salt.tikicdn.com/cache/w300/ts/product/99/f7/25/c0fb734349e520f65852e250c5726408.png, https://salt.tikicdn.com/cache/w300/ts/product/88/d8/e3/57a320d0cdb51668c73a630e622af9a2.png, https://salt.tikicdn.com/cache/w300/ts/product/cd/76/eb/09498e0d5e07247c1e38e7b6b1fdea9b.png, https://salt.tikicdn.com/cache/w300/ts/product/51/4e/81/23803f80712bc7cdea3d999c998fefa4.png, https://salt.tikicdn.com/cache/w300/ts/product/d1/7e/aa/dcc07c8700f1e0a04db289198a09de73.png, https://salt.tikicdn.com/cache/w300/ts/product/4a/cf/05/26f4d60bee97cab32e9865277d162bbf.png","https://salt.tikicdn.com/cache/200x280/ts/product/63/2d/97/2e739c3cdebccc6488411ded1a57be16.png, https://salt.tikicdn.com/cache/200x280/ts/product/21/f6/49/b1569d204a90f7568b080d98d166e523.png, https://salt.tikicdn.com/cache/200x280/ts/product/02/a6/93/807f28c5680e8d31903fff572171d38f.png, https://salt.tikicdn.com/cache/200x280/ts/product/f5/d7/b4/0a38a799131d5d233ad2feb43abc7d93.png, https://salt.tikicdn.com/cache/200x280/ts/product/50/36/b9/38900a32db6a56b76c6c96ae3bec34d5.png, https://salt.tikicdn.com/cache/200x280/ts/product/c2/b3/96/cc1eb1a9ebee681a312998155f61937b.png, https://salt.tikicdn.com/cache/200x280/ts/product/98/e8/2e/0926c9ba6096e3613213bd9ae4ab37b9.png, https://salt.tikicdn.com/cache/200x280/ts/product/b8/26/b5/9ab70938e5603f9b9748624e43195489.png, https://salt.tikicdn.com/cache/200x280/ts/product/99/f7/25/c0fb734349e520f65852e250c5726408.png, https://salt.tikicdn.com/cache/200x280/ts/product/88/d8/e3/57a320d0cdb51668c73a630e622af9a2.png, https://salt.tikicdn.com/cache/200x280/ts/product/cd/76/eb/09498e0d5e07247c1e38e7b6b1fdea9b.png, https://salt.tikicdn.com/cache/200x280/ts/product/51/4e/81/23803f80712bc7cdea3d999c998fefa4.png, https://salt.tikicdn.com/cache/200x280/ts/product/d1/7e/aa/dcc07c8700f1e0a04db289198a09de73.png, https://salt.tikicdn.com/cache/200x280/ts/product/4a/cf/05/26f4d60bee97cab32e9865277d162bbf.png","https://salt.tikicdn.com/cache/200x280/ts/product/63/2d/97/2e739c3cdebccc6488411ded1a57be16.png, https://salt.tikicdn.com/cache/200x280/ts/product/21/f6/49/b1569d204a90f7568b080d98d166e523.png, https://salt.tikicdn.com/cache/200x280/ts/product/02/a6/93/807f28c5680e8d31903fff572171d38f.png, https://salt.tikicdn.com/cache/200x280/ts/product/f5/d7/b4/0a38a799131d5d233ad2feb43abc7d93.png, https://salt.tikicdn.com/cache/200x280/ts/product/50/36/b9/38900a32db6a56b76c6c96ae3bec34d5.png, https://salt.tikicdn.com/cache/200x280/ts/product/c2/b3/96/cc1eb1a9ebee681a312998155f61937b.png, https://salt.tikicdn.com/cache/200x280/ts/product/98/e8/2e/0926c9ba6096e3613213bd9ae4ab37b9.png, https://salt.tikicdn.com/cache/200x280/ts/product/b8/26/b5/9ab70938e5603f9b9748624e43195489.png, https://salt.tikicdn.com/cache/200x280/ts/product/99/f7/25/c0fb734349e520f65852e250c5726408.png, https://salt.tikicdn.com/cache/200x280/ts/product/88/d8/e3/57a320d0cdb51668c73a630e622af9a2.png, https://salt.tikicdn.com/cache/200x280/ts/product/cd/76/eb/09498e0d5e07247c1e38e7b6b1fdea9b.png, https://salt.tikicdn.com/cache/200x280/ts/product/51/4e/81/23803f80712bc7cdea3d999c998fefa4.png, https://salt.tikicdn.com/cache/200x280/ts/product/d1/7e/aa/dcc07c8700f1e0a04db289198a09de73.png, https://salt.tikicdn.com/cache/200x280/ts/product/4a/cf/05/26f4d60bee97cab32e9865277d162bbf.png",1000,88
