id,name,price,short_description,description,rating_average,review_count,image_base_url,image_large_url,image_medium_url,image_small_url,image_thumbnail_url,stock,quantity_sold
13379390,Máy Tính Để Bàn Casio WD-320MT,769000,"Máy tính để bàn Casio WD-320MT​ là loại máy để bàn với thiết kế hiện đại, phục vụ nhiều nhu cầu tính toán khác nhau. Máy sử dụng nguồn pin thường và năng lượng mặt trời giúp bạn chủ động hơn trong cô...","Máy tính để bàn Casio WD-320MT​ là loại máy để bàn với thiết kế hiện đại, phục vụ nhiều nhu cầu tính toán khác nhau. Máy sử dụng nguồn pin thường và năng lượng mặt trời giúp bạn chủ động hơn trong công việc. Hệ thống phím được thiết kế dạng phím cuốn đảm bảo không mất dữ liệu khi làm việc với tốc độ cao. Chức năng nổi bật như tính tỷ lệ phần trăm, tính thuế, đổi tỷ giá..., giúp bạn hoàn thành nhanh chóng các công việc cần tới sự tính toán với các bước tính ngắn và chuẩn xác nhất. Đặc biệt, bàn phím được làm từ chất liệu đặc biệt, có khả năng chống thấm nước và chống bụi, đảm bảo độ bền và tính chính xác lâu dài cho sản phẩm. Màn hình lớn Màn hình lớn hơn giúp đọc nhiều dữ liệu dễ dàng hơn. Nguồn hai chiều (Mặt trời + Pin) Chế độ sử dụng năng lượng mặt trời được bật khi đủ sáng, chế độ pin được bật khi không đủ sáng. Nhấn đồng thời phím Các thao tác phím được lưu trữ trong bộ nhớ đệm, nhờ vậy sẽ không bị mất dữ liệu ngay cả khi nhập với tốc độ cao. Các phím dẻo Được thiết kế và chế tạo để dễ dàng thao tác. Bàn phím có thể tháo rời để chùi rửa. Bề mặt kim loại bền Vỏ bền chịu được va đập mạnh. Chi phí/giá bán/lợi nhuận Tính chi phí, giá bán và lợi nhuận của mặt hàng với hai giá trị còn lại đã cho. Tính thuế Tự động tính toán giá cộng thuế, giá trừ thuế, khoản chiết khấu, giá bán, số tiền thuế, số tiền giảm giá và số tiền lãi. Phần trăm tỷ lệ lợi nhuận Phím "" % "" cho phép truy cập nhanh vào giá và lợi nhuận đồng thời cung cấp các bổ trợ, chiết khấu, tỷ lệ và các giá trị tăng/giảm. Các biểu tượng lệnh hàm Ký hiệu (+, -, ×, ÷) trên màn hình cho biết trạng thái của thao tác bạn hiện đang thực hiện. Thông số kỹ thuật: Loại máy tính Máy tính khoa học phổ thông Kích thước (D x R x C cm) 19,45 x 14,45 x 3,56 (cm) Trọng lượng (g) 200g Số hiển thị 12 Pin Pin Năng lượng mặt trời Bộ nhớ độc lập Có Chức năng khác Tính tỷ lệ phần trăm Tính thuế Đổi tỷ giá Giá sản phẩm trên Tiki đã bao gồm thuế theo luật hiện hành. Bên cạnh đó, tuỳ vào loại sản phẩm, hình thức và địa chỉ giao hàng mà có thể phát sinh thêm chi phí khác như phí vận chuyển, phụ phí hàng cồng kềnh, thuế nhập khẩu (đối với đơn hàng giao từ nước ngoài có giá trị trên 1 triệu đồng)..... Sản phẩm này là tài sản cá nhân được bán bởi Nhà Bán Hàng Cá Nhân và không thuộc đối tượng phải chịu thuế GTGT. Do đó hoá đơn VAT không được cung cấp trong trường hợp này.",4.3,3,"https://salt.tikicdn.com/ts/product/f3/02/b3/6a3e1b7d4cf6daca69942317ec1a1a32.jpg, https://salt.tikicdn.com/ts/product/94/8a/e7/782c1a749a3e40fbc2c5702f45b8ba50.jpg, https://salt.tikicdn.com/ts/product/f8/92/c9/839bd07b4e42ae799c7d828e74b0eeb2.png, https://salt.tikicdn.com/ts/product/77/32/e0/971813a501ccc770f57bbb2e1a2a6e23.jpg","https://salt.tikicdn.com/cache/w1200/ts/product/f3/02/b3/6a3e1b7d4cf6daca69942317ec1a1a32.jpg, https://salt.tikicdn.com/cache/w1200/ts/product/94/8a/e7/782c1a749a3e40fbc2c5702f45b8ba50.jpg, https://salt.tikicdn.com/cache/w1200/ts/product/f8/92/c9/839bd07b4e42ae799c7d828e74b0eeb2.png, https://salt.tikicdn.com/cache/w1200/ts/product/77/32/e0/971813a501ccc770f57bbb2e1a2a6e23.jpg","https://salt.tikicdn.com/cache/w300/ts/product/f3/02/b3/6a3e1b7d4cf6daca69942317ec1a1a32.jpg, https://salt.tikicdn.com/cache/w300/ts/product/94/8a/e7/782c1a749a3e40fbc2c5702f45b8ba50.jpg, https://salt.tikicdn.com/cache/w300/ts/product/f8/92/c9/839bd07b4e42ae799c7d828e74b0eeb2.png, https://salt.tikicdn.com/cache/w300/ts/product/77/32/e0/971813a501ccc770f57bbb2e1a2a6e23.jpg","https://salt.tikicdn.com/cache/200x280/ts/product/f3/02/b3/6a3e1b7d4cf6daca69942317ec1a1a32.jpg, https://salt.tikicdn.com/cache/200x280/ts/product/94/8a/e7/782c1a749a3e40fbc2c5702f45b8ba50.jpg, https://salt.tikicdn.com/cache/200x280/ts/product/f8/92/c9/839bd07b4e42ae799c7d828e74b0eeb2.png, https://salt.tikicdn.com/cache/200x280/ts/product/77/32/e0/971813a501ccc770f57bbb2e1a2a6e23.jpg","https://salt.tikicdn.com/cache/200x280/ts/product/f3/02/b3/6a3e1b7d4cf6daca69942317ec1a1a32.jpg, https://salt.tikicdn.com/cache/200x280/ts/product/94/8a/e7/782c1a749a3e40fbc2c5702f45b8ba50.jpg, https://salt.tikicdn.com/cache/200x280/ts/product/f8/92/c9/839bd07b4e42ae799c7d828e74b0eeb2.png, https://salt.tikicdn.com/cache/200x280/ts/product/77/32/e0/971813a501ccc770f57bbb2e1a2a6e23.jpg",1000,3
13379348,Máy Tính Để Bàn Casio MS20UC,313000,"Kích thước (Dài × Rộng × Dày) : 149,5 × 105 × 22,8 mmTrọng lượng : 110gLoại để bàn mini12 chữ sốTính thuếTự động tính toán giá cộng thuế, giá trừ thuế, khoản chiết khấu, giá bán, số tiền thu...","Kích thước (Dài × Rộng × Dày) : 149,5 × 105 × 22,8 mm Trọng lượng : 110g Loại để bàn mini 12 chữ số Tính thuế Tự động tính toán giá cộng thuế, giá trừ thuế, khoản chiết khấu, giá bán, số tiền thuế, số tiền giảm giá và số tiền lãi. Tính thời gian Phép tính thời gian cho phép dễ dàng nhập dữ liệu và tính các giá trị giờ, phút và giây. Nguồn hai chiều (Mặt trời + Pin) Chế độ sử dụng năng lượng mặt trời được bật khi đủ sáng, chế độ pin được bật khi không đủ sáng. Các biểu tượng lệnh hàm Ký hiệu (+, -, ×, ÷) trên màn hình cho biết trạng thái của thao tác bạn hiện đang thực hiện. Nhấn đồng thời phím Các thao tác phím được lưu trữ trong bộ nhớ đệm, nhờ vậy sẽ không bị mất dữ liệu ngay cả khi nhập với tốc độ cao. Màn hình cực lớn Màn hình lớn hơn giúp đọc nhiều dữ liệu dễ dàng hơn. Các phím dẻo Được thiết kế và chế tạo để dễ dàng thao tác. Phần trăm tỷ lệ lợi nhuận Phím "" % "" cho phép truy cập nhanh vào giá và lợi nhuận đồng thời cung cấp các bổ trợ, chiết khấu, tỷ lệ và các giá trị tăng/giảm. Giá sản phẩm trên Tiki đã bao gồm thuế theo luật hiện hành. Bên cạnh đó, tuỳ vào loại sản phẩm, hình thức và địa chỉ giao hàng mà có thể phát sinh thêm chi phí khác như phí vận chuyển, phụ phí hàng cồng kềnh, thuế nhập khẩu (đối với đơn hàng giao từ nước ngoài có giá trị trên 1 triệu đồng)..... Sản phẩm này là tài sản cá nhân được bán bởi Nhà Bán Hàng Cá Nhân và không thuộc đối tượng phải chịu thuế GTGT. Do đó hoá đơn VAT không được cung cấp trong trường hợp này.",3,2,https://salt.tikicdn.com/ts/product/92/8d/70/187645ad61439b6450706db5396c9fa8.jpg,https://salt.tikicdn.com/cache/w1200/ts/product/92/8d/70/187645ad61439b6450706db5396c9fa8.jpg,https://salt.tikicdn.com/cache/w300/ts/product/92/8d/70/187645ad61439b6450706db5396c9fa8.jpg,https://salt.tikicdn.com/cache/200x280/ts/product/92/8d/70/187645ad61439b6450706db5396c9fa8.jpg,https://salt.tikicdn.com/cache/200x280/ts/product/92/8d/70/187645ad61439b6450706db5396c9fa8.jpg,1000,2
13379346,Máy Tính Để Bàn Casio MP12R,313000,"CÁCH PHÂN BIỆT CASIO THẬT GIẢ QUA CON TEM BITEXMáy Tính Để Bàn Casio MP12R là loại để bàn mini, 12 chữ số giúp cho việc tính toán tiện dụng hơn.Tính số dưTính nhanh thương số và số dư.Tính thuếT...","CÁCH PHÂN BIỆT CASIO THẬT GIẢ QUA CON TEM BITEX Máy Tính Để Bàn Casio MP12R là loại để bàn mini, 12 chữ số giúp cho việc tính toán tiện dụng hơn. Tính số dư Tính nhanh thương số và số dư. Tính thuế Tự động tính toán giá cộng thuế, giá trừ thuế, khoản chiết khấu, giá bán, số tiền thuế, số tiền giảm giá và số tiền lãi. Tính thời gian Phép tính thời gian cho phép dễ dàng nhập dữ liệu và tính các giá trị giờ, phút và giây. Tính ngày/kỳ hạn Các phép tính ngày/kỳ hạn cho phép dễ dàng nhập dữ liệu và tính toán thời hạn hoặc ngày tháng. Nguồn hai chiều (Mặt trời + Pin) Chế độ sử dụng năng lượng mặt trời được bật khi đủ sáng, chế độ pin được bật khi không đủ sáng. Các biểu tượng lệnh hàm Ký hiệu (+, -, ×, ÷) trên màn hình cho biết trạng thái của thao tác bạn hiện đang thực hiện. Nhấn đồng thời phím Các thao tác phím được lưu trữ trong bộ nhớ đệm, nhờ vậy sẽ không bị mất dữ liệu ngay cả khi nhập với tốc độ cao. Màn hình cực lớn Màn hình lớn hơn giúp đọc nhiều dữ liệu dễ dàng hơn. Các phím dẻo Được thiết kế và chế tạo để dễ dàng thao tác. Phần trăm tỷ lệ lợi nhuận Phím "" % "" cho phép truy cập nhanh vào giá và lợi nhuận đồng thời cung cấp các bổ trợ, chiết khấu, tỷ lệ và các giá trị tăng/giảm. Giá sản phẩm trên Tiki đã bao gồm thuế theo luật hiện hành. Bên cạnh đó, tuỳ vào loại sản phẩm, hình thức và địa chỉ giao hàng mà có thể phát sinh thêm chi phí khác như phí vận chuyển, phụ phí hàng cồng kềnh, thuế nhập khẩu (đối với đơn hàng giao từ nước ngoài có giá trị trên 1 triệu đồng)..... Sản phẩm này là tài sản cá nhân được bán bởi Nhà Bán Hàng Cá Nhân và không thuộc đối tượng phải chịu thuế GTGT. Do đó hoá đơn VAT không được cung cấp trong trường hợp này.",0,0,https://salt.tikicdn.com/ts/product/9b/5c/94/7a8cef6bf5d39ccd91f11edfb95bb423.jpg,https://salt.tikicdn.com/cache/w1200/ts/product/9b/5c/94/7a8cef6bf5d39ccd91f11edfb95bb423.jpg,https://salt.tikicdn.com/cache/w300/ts/product/9b/5c/94/7a8cef6bf5d39ccd91f11edfb95bb423.jpg,https://salt.tikicdn.com/cache/200x280/ts/product/9b/5c/94/7a8cef6bf5d39ccd91f11edfb95bb423.jpg,https://salt.tikicdn.com/cache/200x280/ts/product/9b/5c/94/7a8cef6bf5d39ccd91f11edfb95bb423.jpg,1000,0
13379335,Máy Tính Để Bàn Casio MJ-12VCB,327000,Phần trăm thông thườngMáy Tính Để Bàn Casio MJ-12VCB đặc biệt hơn với tính năng chuyên dùng cho kế toán.Các tính toán phần trăm thông thường.Nguồn hai chiều (Mặt trời + Pin)Chế độ sử dụng năng lượ...,"Phần trăm thông thường Máy Tính Để Bàn Casio MJ-12VCB đặc biệt hơn với tính năng chuyên dùng cho kế toán. Các tính toán phần trăm thông thường. Nguồn hai chiều (Mặt trời + Pin) Chế độ sử dụng năng lượng mặt trời được bật khi đủ sáng, chế độ pin được bật khi không đủ sáng. Các biểu tượng lệnh hàm Ký hiệu (+, -, ×, ÷) trên màn hình cho biết trạng thái của thao tác bạn hiện đang thực hiện. Nhấn đồng thời phím Các thao tác phím được lưu trữ trong bộ nhớ đệm, nhờ vậy sẽ không bị mất dữ liệu ngay cả khi nhập với tốc độ cao. Màn hình cực lớn Màn hình lớn hơn giúp đọc nhiều dữ liệu dễ dàng hơn. Các phím dẻo Được thiết kế và chế tạo để dễ dàng thao tác. 300 bước kiểm tra Hiển thị tối đa 300 bước tính trước đó. Màn hình hiển thị số được bản địa hóa Hiển thị số theo định dạng dấu phân tách bốn chữ số (Kiểu A, Kiểu B, Kiểu C và kiểu Ấn Độ). Giá sản phẩm trên Tiki đã bao gồm thuế theo luật hiện hành. Bên cạnh đó, tuỳ vào loại sản phẩm, hình thức và địa chỉ giao hàng mà có thể phát sinh thêm chi phí khác như phí vận chuyển, phụ phí hàng cồng kềnh, thuế nhập khẩu (đối với đơn hàng giao từ nước ngoài có giá trị trên 1 triệu đồng)..... Sản phẩm này là tài sản cá nhân được bán bởi Nhà Bán Hàng Cá Nhân và không thuộc đối tượng phải chịu thuế GTGT. Do đó hoá đơn VAT không được cung cấp trong trường hợp này.",5,5,https://salt.tikicdn.com/ts/product/26/e5/84/3a5975850e10bf311c9f4765750aebfd.jpg,https://salt.tikicdn.com/cache/w1200/ts/product/26/e5/84/3a5975850e10bf311c9f4765750aebfd.jpg,https://salt.tikicdn.com/cache/w300/ts/product/26/e5/84/3a5975850e10bf311c9f4765750aebfd.jpg,https://salt.tikicdn.com/cache/200x280/ts/product/26/e5/84/3a5975850e10bf311c9f4765750aebfd.jpg,https://salt.tikicdn.com/cache/200x280/ts/product/26/e5/84/3a5975850e10bf311c9f4765750aebfd.jpg,1000,5
13379290,Máy Tính Để Bàn Casio JW200SC,695000,"CÁCH PHÂN BIỆT CASIO THẬT GIẢ QUA CON TEM BITEXNguồn hai chiều (Mặt trời + Pin)Máy Tính Để Bàn Casio JW200SC sử dụng chế độ sử dụng năng lượng mặt trời được bật khi đủ sáng, chế độ pin được bật khi...","CÁCH PHÂN BIỆT CASIO THẬT GIẢ QUA CON TEM BITEX Nguồn hai chiều (Mặt trời + Pin) Máy Tính Để Bàn Casio JW200SC sử dụng chế độ sử dụng năng lượng mặt trời được bật khi đủ sáng, chế độ pin được bật khi không đủ sáng. Các biểu tượng lệnh hàm Ký hiệu (+, -, ×, ÷) trên màn hình cho biết trạng thái của thao tác bạn hiện đang thực hiện. Nhấn đồng thời phím Các thao tác phím được lưu trữ trong bộ nhớ đệm, nhờ vậy sẽ không bị mất dữ liệu ngay cả khi nhập với tốc độ cao. Màn hình cực lớn Màn hình lớn hơn giúp đọc nhiều dữ liệu dễ dàng hơn. Các phím dẻo Được thiết kế và chế tạo để dễ dàng thao tác. Chức năng tính thuế & hối đoái Các chức năng tính thuế và quy đổi tiền tệ. Phần trăm tỷ lệ lợi nhuận Phím "" % "" cho phép truy cập nhanh vào giá và lợi nhuận đồng thời cung cấp các bổ trợ, chiết khấu, tỷ lệ và các giá trị tăng/giảm. Bề mặt kim loại bền Vỏ bền chịu được va đập mạnh. Giá sản phẩm trên Tiki đã bao gồm thuế theo luật hiện hành. Bên cạnh đó, tuỳ vào loại sản phẩm, hình thức và địa chỉ giao hàng mà có thể phát sinh thêm chi phí khác như phí vận chuyển, phụ phí hàng cồng kềnh, thuế nhập khẩu (đối với đơn hàng giao từ nước ngoài có giá trị trên 1 triệu đồng)..... Sản phẩm này là tài sản cá nhân được bán bởi Nhà Bán Hàng Cá Nhân và không thuộc đối tượng phải chịu thuế GTGT. Do đó hoá đơn VAT không được cung cấp trong trường hợp này.",0,0,"https://salt.tikicdn.com/ts/product/93/86/8d/bddbc0d947529869445f3f18e172215b.jpg, https://salt.tikicdn.com/ts/product/9a/ae/6b/db6fd665da7e0fb2a8dae9352af1eab8.jpg, https://salt.tikicdn.com/ts/product/b1/12/1b/39c83ec84b13968f5e190536ccd7f6a4.jpg, https://salt.tikicdn.com/ts/product/e3/70/85/fb8b71138075db05e196abda11e79c2a.jpg, https://salt.tikicdn.com/ts/product/2e/a7/32/8d8475c4e2a0235d76819472f09416ff.jpg","https://salt.tikicdn.com/cache/w1200/ts/product/93/86/8d/bddbc0d947529869445f3f18e172215b.jpg, https://salt.tikicdn.com/cache/w1200/ts/product/9a/ae/6b/db6fd665da7e0fb2a8dae9352af1eab8.jpg, https://salt.tikicdn.com/cache/w1200/ts/product/b1/12/1b/39c83ec84b13968f5e190536ccd7f6a4.jpg, https://salt.tikicdn.com/cache/w1200/ts/product/e3/70/85/fb8b71138075db05e196abda11e79c2a.jpg, https://salt.tikicdn.com/cache/w1200/ts/product/2e/a7/32/8d8475c4e2a0235d76819472f09416ff.jpg","https://salt.tikicdn.com/cache/w300/ts/product/93/86/8d/bddbc0d947529869445f3f18e172215b.jpg, https://salt.tikicdn.com/cache/w300/ts/product/9a/ae/6b/db6fd665da7e0fb2a8dae9352af1eab8.jpg, https://salt.tikicdn.com/cache/w300/ts/product/b1/12/1b/39c83ec84b13968f5e190536ccd7f6a4.jpg, https://salt.tikicdn.com/cache/w300/ts/product/e3/70/85/fb8b71138075db05e196abda11e79c2a.jpg, https://salt.tikicdn.com/cache/w300/ts/product/2e/a7/32/8d8475c4e2a0235d76819472f09416ff.jpg","https://salt.tikicdn.com/cache/200x280/ts/product/93/86/8d/bddbc0d947529869445f3f18e172215b.jpg, https://salt.tikicdn.com/cache/200x280/ts/product/9a/ae/6b/db6fd665da7e0fb2a8dae9352af1eab8.jpg, https://salt.tikicdn.com/cache/200x280/ts/product/b1/12/1b/39c83ec84b13968f5e190536ccd7f6a4.jpg, https://salt.tikicdn.com/cache/200x280/ts/product/e3/70/85/fb8b71138075db05e196abda11e79c2a.jpg, https://salt.tikicdn.com/cache/200x280/ts/product/2e/a7/32/8d8475c4e2a0235d76819472f09416ff.jpg","https://salt.tikicdn.com/cache/200x280/ts/product/93/86/8d/bddbc0d947529869445f3f18e172215b.jpg, https://salt.tikicdn.com/cache/200x280/ts/product/9a/ae/6b/db6fd665da7e0fb2a8dae9352af1eab8.jpg, https://salt.tikicdn.com/cache/200x280/ts/product/b1/12/1b/39c83ec84b13968f5e190536ccd7f6a4.jpg, https://salt.tikicdn.com/cache/200x280/ts/product/e3/70/85/fb8b71138075db05e196abda11e79c2a.jpg, https://salt.tikicdn.com/cache/200x280/ts/product/2e/a7/32/8d8475c4e2a0235d76819472f09416ff.jpg",1000,0
13379253,Máy Tính Để Bàn Casio GX-14B,500000,"Máy tính để bàn Casio GX-14B là model mới của Casio để thay thế cho model cũ là GX-14S, sở hữu thiết kế gọn nhẹ và tiện lợi, phục vụ nhiều nhu cầu tính toán khác nhau. Chức năng nổi bật như tính tỷ l...","Máy tính để bàn Casio GX-14B là model mới của Casio để thay thế cho model cũ là GX-14S, sở hữu thiết kế gọn nhẹ và tiện lợi, phục vụ nhiều nhu cầu tính toán khác nhau. Chức năng nổi bật như tính tỷ lệ phần trăm, tăng giá... giúp bạn hoàn thành nhanh chóng các công việc cần tới sự tính toán với các bước tính ngắn và chuẩn xác nhất. Màn hình cực lớn Màn hình lớn hơn giúp đọc nhiều dữ liệu dễ dàng hơn. Màn hình hiển thị 14 chữ số sắc nét, rõ ràng. Nguồn hai chiều (Mặt trời + Pin) Chế độ sử dụng năng lượng mặt trời được bật khi đủ sáng, chế độ pin được bật khi không đủ sáng. Nhấn đồng thời phím Các thao tác phím được lưu trữ trong bộ nhớ đệm, nhờ vậy sẽ không bị mất dữ liệu ngay cả khi nhập với tốc độ cao. Các phím dẻo Các phím cao su dẻo bền bỉ để bạn thao tác nhanh chóng và linh hoạt hơn. Phần trăm thông thường Có thể thực hiện các tính toán phần trăm thông thường. Tăng giá Tất cả các tính năng tính tăng giá của máy cộng dành cho các tính toán chi phí và lợi nhuận được đơn giản hóa. Giá sản phẩm trên Tiki đã bao gồm thuế theo luật hiện hành. Bên cạnh đó, tuỳ vào loại sản phẩm, hình thức và địa chỉ giao hàng mà có thể phát sinh thêm chi phí khác như phí vận chuyển, phụ phí hàng cồng kềnh, thuế nhập khẩu (đối với đơn hàng giao từ nước ngoài có giá trị trên 1 triệu đồng)..... Sản phẩm này là tài sản cá nhân được bán bởi Nhà Bán Hàng Cá Nhân và không thuộc đối tượng phải chịu thuế GTGT. Do đó hoá đơn VAT không được cung cấp trong trường hợp này.",5,1,"https://salt.tikicdn.com/ts/product/27/07/ae/d6d6ab8bed301b0dc79b2d126c67ee15.jpg, https://salt.tikicdn.com/ts/product/b5/bd/ca/60a1e57b58559966142546a8e9cfc0ec.png, https://salt.tikicdn.com/ts/product/49/96/4f/b386e226851716b4e250f961ee74c6f5.jpg, https://salt.tikicdn.com/ts/product/57/62/29/dd23f3bbd8f2b00ab5e2909cc0d992cc.JPG, https://salt.tikicdn.com/ts/product/f1/1f/06/5b87ff32d3a91f1c9737111a058193ac.jpg","https://salt.tikicdn.com/cache/w1200/ts/product/27/07/ae/d6d6ab8bed301b0dc79b2d126c67ee15.jpg, https://salt.tikicdn.com/cache/w1200/ts/product/b5/bd/ca/60a1e57b58559966142546a8e9cfc0ec.png, https://salt.tikicdn.com/cache/w1200/ts/product/49/96/4f/b386e226851716b4e250f961ee74c6f5.jpg, https://salt.tikicdn.com/cache/w1200/ts/product/57/62/29/dd23f3bbd8f2b00ab5e2909cc0d992cc.JPG, https://salt.tikicdn.com/cache/w1200/ts/product/f1/1f/06/5b87ff32d3a91f1c9737111a058193ac.jpg","https://salt.tikicdn.com/cache/w300/ts/product/27/07/ae/d6d6ab8bed301b0dc79b2d126c67ee15.jpg, https://salt.tikicdn.com/cache/w300/ts/product/b5/bd/ca/60a1e57b58559966142546a8e9cfc0ec.png, https://salt.tikicdn.com/cache/w300/ts/product/49/96/4f/b386e226851716b4e250f961ee74c6f5.jpg, https://salt.tikicdn.com/cache/w300/ts/product/57/62/29/dd23f3bbd8f2b00ab5e2909cc0d992cc.JPG, https://salt.tikicdn.com/cache/w300/ts/product/f1/1f/06/5b87ff32d3a91f1c9737111a058193ac.jpg","https://salt.tikicdn.com/cache/200x280/ts/product/27/07/ae/d6d6ab8bed301b0dc79b2d126c67ee15.jpg, https://salt.tikicdn.com/cache/200x280/ts/product/b5/bd/ca/60a1e57b58559966142546a8e9cfc0ec.png, https://salt.tikicdn.com/cache/200x280/ts/product/49/96/4f/b386e226851716b4e250f961ee74c6f5.jpg, https://salt.tikicdn.com/cache/200x280/ts/product/57/62/29/dd23f3bbd8f2b00ab5e2909cc0d992cc.JPG, https://salt.tikicdn.com/cache/200x280/ts/product/f1/1f/06/5b87ff32d3a91f1c9737111a058193ac.jpg","https://salt.tikicdn.com/cache/200x280/ts/product/27/07/ae/d6d6ab8bed301b0dc79b2d126c67ee15.jpg, https://salt.tikicdn.com/cache/200x280/ts/product/b5/bd/ca/60a1e57b58559966142546a8e9cfc0ec.png, https://salt.tikicdn.com/cache/200x280/ts/product/49/96/4f/b386e226851716b4e250f961ee74c6f5.jpg, https://salt.tikicdn.com/cache/200x280/ts/product/57/62/29/dd23f3bbd8f2b00ab5e2909cc0d992cc.JPG, https://salt.tikicdn.com/cache/200x280/ts/product/f1/1f/06/5b87ff32d3a91f1c9737111a058193ac.jpg",1000,1
