id,name,price,short_description,description,rating_average,review_count,image_base_url,image_large_url,image_medium_url,image_small_url,image_thumbnail_url,stock,quantity_sold
566374,Máy Tính Để Bàn Casio DX-12B,312900,"Cách phân biệt Casio thật giả qua con tem BitexMáy Tính Để Bàn Casio DX-12BMáy Tính Để Bàn Casio DX-12B là sản phẩm tiện ích, không thể thiếu trong việc tính toán hàng ngày. Máy tính có màn hình to...","Cách phân biệt Casio thật giả qua con tem Bitex Máy Tính Để Bàn Casio DX-12B Máy Tính Để Bàn Casio DX-12B là sản phẩm tiện ích, không thể thiếu trong việc tính toán hàng ngày. Máy tính có màn hình to rõ, hiển thị tới 12 số, các chữ số đã được bản đại hóa phân tách 4 chữ số thuận tiện. Máy tính có nhiều chức năng tính toán cơ bản cùng chức năng tính tỷ lệ phần trăm, tăng giá, đổi tỷ giá. Thông tin sản phẩm - Loại sản phẩm: Máy tính để bàn. - Thương hiệu: Casio. - Xuất xứ: Nhật Bản. - Chất liệu : Vỏ máy được làm bằng chất liệu nhựa cao cấp, kháng vỡ, có độ bền cao. - Thiết kế : + Máy tính có thiết kế dạng để bàn tiện lợi, kích thước nhỏ gọn, tiện lợi. + Màn hình lớn hiển thị tới 12 chữ số được bản địa hóa the định dạng dấu phân tách bốn chữ số. + Vỏ máy làm bằng chất liệu nhựa cao cấp kháng vỡ. Bàn phím bằng nhựa dẻo in chữ số rõ ràng. + Sử dụng nguồn 2 chiều: mặt trời và pin, chế độ pin được bật khi không đủ sáng. + Các chức năng tính toán cơ bản: cộng, trừ, nhân, chia, tính tỷ lệ phần trăm, tăng giá, đổi tỷ giá. + Có trang bị bộ nhớ đệm. Nhờ vậy sẽ không bị mất dữ liệu ngay cả khi nhập với tốc độ cao. - Kích thước : 17.55 x 12.9 x 3.32 cm. Giá sản phẩm trên Tiki đã bao gồm thuế theo luật hiện hành. Bên cạnh đó, tuỳ vào loại sản phẩm, hình thức và địa chỉ giao hàng mà có thể phát sinh thêm chi phí khác như phí vận chuyển, phụ phí hàng cồng kềnh, thuế nhập khẩu (đối với đơn hàng giao từ nước ngoài có giá trị trên 1 triệu đồng)..... Sản phẩm này là tài sản cá nhân được bán bởi Nhà Bán Hàng Cá Nhân và không thuộc đối tượng phải chịu thuế GTGT. Do đó hoá đơn VAT không được cung cấp trong trường hợp này.",5,8,"https://salt.tikicdn.com/media/catalog/product/2/2/2264264239141-001.u4083.d20161229.t155153.533780.jpg, https://salt.tikicdn.com/media/catalog/product/2/2/2264264239141-002.u4083.d20161229.t155153.580222.jpg, https://salt.tikicdn.com/media/catalog/product/2/2/2264264239141-003.u4083.d20161229.t155153.616052.jpg, https://salt.tikicdn.com/media/catalog/product/2/2/2264264239141-004.u4083.d20161229.t155153.662074.jpg","https://salt.tikicdn.com/cache/w1200/media/catalog/product/2/2/2264264239141-001.u4083.d20161229.t155153.533780.jpg, https://salt.tikicdn.com/cache/w1200/media/catalog/product/2/2/2264264239141-002.u4083.d20161229.t155153.580222.jpg, https://salt.tikicdn.com/cache/w1200/media/catalog/product/2/2/2264264239141-003.u4083.d20161229.t155153.616052.jpg, https://salt.tikicdn.com/cache/w1200/media/catalog/product/2/2/2264264239141-004.u4083.d20161229.t155153.662074.jpg","https://salt.tikicdn.com/cache/w300/media/catalog/product/2/2/2264264239141-001.u4083.d20161229.t155153.533780.jpg, https://salt.tikicdn.com/cache/w300/media/catalog/product/2/2/2264264239141-002.u4083.d20161229.t155153.580222.jpg, https://salt.tikicdn.com/cache/w300/media/catalog/product/2/2/2264264239141-003.u4083.d20161229.t155153.616052.jpg, https://salt.tikicdn.com/cache/w300/media/catalog/product/2/2/2264264239141-004.u4083.d20161229.t155153.662074.jpg","https://salt.tikicdn.com/cache/200x280/media/catalog/product/2/2/2264264239141-001.u4083.d20161229.t155153.533780.jpg, https://salt.tikicdn.com/cache/200x280/media/catalog/product/2/2/2264264239141-002.u4083.d20161229.t155153.580222.jpg, https://salt.tikicdn.com/cache/200x280/media/catalog/product/2/2/2264264239141-003.u4083.d20161229.t155153.616052.jpg, https://salt.tikicdn.com/cache/200x280/media/catalog/product/2/2/2264264239141-004.u4083.d20161229.t155153.662074.jpg","https://salt.tikicdn.com/cache/200x280/media/catalog/product/2/2/2264264239141-001.u4083.d20161229.t155153.533780.jpg, https://salt.tikicdn.com/cache/200x280/media/catalog/product/2/2/2264264239141-002.u4083.d20161229.t155153.580222.jpg, https://salt.tikicdn.com/cache/200x280/media/catalog/product/2/2/2264264239141-003.u4083.d20161229.t155153.616052.jpg, https://salt.tikicdn.com/cache/200x280/media/catalog/product/2/2/2264264239141-004.u4083.d20161229.t155153.662074.jpg",1000,8
566359,Máy Tính Để Bàn Casio DX-120B,360000,"Cách phân biệt Casio thật giả qua con tem BitexMáy Tính Để Bàn Casio DX-120BMáy Tính Để Bàn Casio DX-120B là sản phẩm tiện ích, không thể thiếu trong việc tính toán hàng ngày. Máy tính có màn hình ...","Cách phân biệt Casio thật giả qua con tem Bitex Máy Tính Để Bàn Casio DX-120B Máy Tính Để Bàn Casio DX-120B là sản phẩm tiện ích, không thể thiếu trong việc tính toán hàng ngày. Máy tính có màn hình to rõ, hiển thị tới 12 số, các chữ số đã được bản đại hóa phân tách 4 chữ số thuận tiện. Máy tính có nhiều chức năng tính toán cơ bản cùng chức năng kiểm tra lại phép tính thông minh. Thông tin sản phẩm - Loại sản phẩm: Máy tính để bàn. - Thương hiệu: Casio. - Xuất xứ: Nhật Bản. - Chất liệu : Vỏ máy được làm bằng chất liệu nhựa cao cấp, kháng vỡ, có độ bền cao. - Thiết kế : + Máy tính có thiết kế dạng để bàn tiện lợi, kích thước nhỏ gọn, tiện lợi. + Màn hình lớn hiển thị tới 12 chữ số được bản địa hóa the định dạng dấu phân tách bốn chữ số. + Vỏ máy làm bằng chất liệu nhựa cao cấp kháng vỡ. Bàn phím bằng nhựa dẻo in chữ số rõ ràng. + Sử dụng nguồn 2 chiều: mặt trời và pin, chế độ pin được bật khi không đủ sáng. + Các chức năng tính toán cơ bản: cộng, trừ, nhân, chia, tính tỷ lệ phần tram, tang giá, đổi tỷ giá. + Có trang bị bộ nhớ đệm. Nhờ vậy sẽ không bị mất dữ liệu ngay cả khi nhập với tốc độ cao. - Kích thước : 17,5 x 12,9 x 3,32 cm. Giá sản phẩm trên Tiki đã bao gồm thuế theo luật hiện hành. Bên cạnh đó, tuỳ vào loại sản phẩm, hình thức và địa chỉ giao hàng mà có thể phát sinh thêm chi phí khác như phí vận chuyển, phụ phí hàng cồng kềnh, thuế nhập khẩu (đối với đơn hàng giao từ nước ngoài có giá trị trên 1 triệu đồng)..... Sản phẩm này là tài sản cá nhân được bán bởi Nhà Bán Hàng Cá Nhân và không thuộc đối tượng phải chịu thuế GTGT. Do đó hoá đơn VAT không được cung cấp trong trường hợp này.",5,24,"https://salt.tikicdn.com/media/catalog/product/2/2/2265207714299-001.u4083.d20161229.t155054.995055.jpg, https://salt.tikicdn.com/media/catalog/product/2/2/2265207714299-002.u4083.d20161229.t155055.46250.jpg, https://salt.tikicdn.com/media/catalog/product/2/2/2265207714299-003.u4083.d20161229.t155055.97544.jpg, https://salt.tikicdn.com/media/catalog/product/2/2/2265207714299-004.u4083.d20161229.t155055.144004.jpg","https://salt.tikicdn.com/cache/w1200/media/catalog/product/2/2/2265207714299-001.u4083.d20161229.t155054.995055.jpg, https://salt.tikicdn.com/cache/w1200/media/catalog/product/2/2/2265207714299-002.u4083.d20161229.t155055.46250.jpg, https://salt.tikicdn.com/cache/w1200/media/catalog/product/2/2/2265207714299-003.u4083.d20161229.t155055.97544.jpg, https://salt.tikicdn.com/cache/w1200/media/catalog/product/2/2/2265207714299-004.u4083.d20161229.t155055.144004.jpg","https://salt.tikicdn.com/cache/w300/media/catalog/product/2/2/2265207714299-001.u4083.d20161229.t155054.995055.jpg, https://salt.tikicdn.com/cache/w300/media/catalog/product/2/2/2265207714299-002.u4083.d20161229.t155055.46250.jpg, https://salt.tikicdn.com/cache/w300/media/catalog/product/2/2/2265207714299-003.u4083.d20161229.t155055.97544.jpg, https://salt.tikicdn.com/cache/w300/media/catalog/product/2/2/2265207714299-004.u4083.d20161229.t155055.144004.jpg","https://salt.tikicdn.com/cache/200x280/media/catalog/product/2/2/2265207714299-001.u4083.d20161229.t155054.995055.jpg, https://salt.tikicdn.com/cache/200x280/media/catalog/product/2/2/2265207714299-002.u4083.d20161229.t155055.46250.jpg, https://salt.tikicdn.com/cache/200x280/media/catalog/product/2/2/2265207714299-003.u4083.d20161229.t155055.97544.jpg, https://salt.tikicdn.com/cache/200x280/media/catalog/product/2/2/2265207714299-004.u4083.d20161229.t155055.144004.jpg","https://salt.tikicdn.com/cache/200x280/media/catalog/product/2/2/2265207714299-001.u4083.d20161229.t155054.995055.jpg, https://salt.tikicdn.com/cache/200x280/media/catalog/product/2/2/2265207714299-002.u4083.d20161229.t155055.46250.jpg, https://salt.tikicdn.com/cache/200x280/media/catalog/product/2/2/2265207714299-003.u4083.d20161229.t155055.97544.jpg, https://salt.tikicdn.com/cache/200x280/media/catalog/product/2/2/2265207714299-004.u4083.d20161229.t155055.144004.jpg",1000,24
566338,Máy Tính Để Bàn Casio DJ-120D Plus,450000,"Cách phân biệt Casio thật giả qua con tem BitexMáy Tính Để Bàn Casio DJ-120D PlusMáy Tính Để Bàn Casio DJ-120D Plus là sản phẩm tiện ích, không thể thiếu trong việc tính toán hàng ngày. Máy tính có...","Cách phân biệt Casio thật giả qua con tem Bitex Máy Tính Để Bàn Casio DJ-120D Plus Máy Tính Để Bàn Casio DJ-120D Plus là sản phẩm tiện ích, không thể thiếu trong việc tính toán hàng ngày. Máy tính có màn hình to rõ, hiển thị tới 12 số, các chữ số đã được bản đại hóa phân tách 4 chữ số thuận tiện. Máy tính có nhiều chức năng tính toán cơ bản cùng chức năng kiểm tra lại phép tính thông minh. Thông tin sản phẩm - Loại sản phẩm: Máy tính để bàn. - Thương hiệu: Casio. - Xuất xứ: Nhật Bản. - Chất liệu : Vỏ máy được làm bằng chất liệu nhựa cao cấp, kháng vỡ, có độ bền cao. - Thiết kế : + Máy tính có thiết kế dạng để bàn tiện lợi, kích thước nhỏ gọn, tiện lợi. + Màn hình lớn hiển thị tới 12 chữ số được bản địa hóa the định dạng dấu phân tách bốn chữ số. + Vỏ máy làm bằng chất liệu nhựa cao cấp kháng vỡ. Bàn phím bằng nhựa dẻo in chữ số rõ ràng. + Sử dụng nguồn 2 chiều: mặt trời và pin, chế độ pin được bật khi không đủ sáng. + Các chức năng tính toán cơ bản: cộng, trừ, nhân, chia và chức năng kiểm tra lại cho phép xác nhận lỗi bằng âm thanh. + Có trang bị bộ nhớ đệm hiển thị tối đa 300 bước tính trước đó. Nhờ vậy sẽ không bị mất dữ liệu ngay cả khi nhập với tốc độ cao. - Kích thước : 19,2 x 14,4 x 3,46 cm. Giá sản phẩm trên Tiki đã bao gồm thuế theo luật hiện hành. Bên cạnh đó, tuỳ vào loại sản phẩm, hình thức và địa chỉ giao hàng mà có thể phát sinh thêm chi phí khác như phí vận chuyển, phụ phí hàng cồng kềnh, thuế nhập khẩu (đối với đơn hàng giao từ nước ngoài có giá trị trên 1 triệu đồng)..... Sản phẩm này là tài sản cá nhân được bán bởi Nhà Bán Hàng Cá Nhân và không thuộc đối tượng phải chịu thuế GTGT. Do đó hoá đơn VAT không được cung cấp trong trường hợp này.",4.3,3,"https://salt.tikicdn.com/media/catalog/product/2/2/2267762859620-001.u4083.d20161229.t154954.706450.jpg, https://salt.tikicdn.com/media/catalog/product/2/2/2267762859620-002.u4083.d20161229.t154954.753185.jpg, https://salt.tikicdn.com/media/catalog/product/2/2/2267762859620-003.u4083.d20161229.t154954.794925.jpg, https://salt.tikicdn.com/media/catalog/product/2/2/2267762859620-004.u4083.d20161229.t154954.839728.jpg","https://salt.tikicdn.com/cache/w1200/media/catalog/product/2/2/2267762859620-001.u4083.d20161229.t154954.706450.jpg, https://salt.tikicdn.com/cache/w1200/media/catalog/product/2/2/2267762859620-002.u4083.d20161229.t154954.753185.jpg, https://salt.tikicdn.com/cache/w1200/media/catalog/product/2/2/2267762859620-003.u4083.d20161229.t154954.794925.jpg, https://salt.tikicdn.com/cache/w1200/media/catalog/product/2/2/2267762859620-004.u4083.d20161229.t154954.839728.jpg","https://salt.tikicdn.com/cache/w300/media/catalog/product/2/2/2267762859620-001.u4083.d20161229.t154954.706450.jpg, https://salt.tikicdn.com/cache/w300/media/catalog/product/2/2/2267762859620-002.u4083.d20161229.t154954.753185.jpg, https://salt.tikicdn.com/cache/w300/media/catalog/product/2/2/2267762859620-003.u4083.d20161229.t154954.794925.jpg, https://salt.tikicdn.com/cache/w300/media/catalog/product/2/2/2267762859620-004.u4083.d20161229.t154954.839728.jpg","https://salt.tikicdn.com/cache/200x280/media/catalog/product/2/2/2267762859620-001.u4083.d20161229.t154954.706450.jpg, https://salt.tikicdn.com/cache/200x280/media/catalog/product/2/2/2267762859620-002.u4083.d20161229.t154954.753185.jpg, https://salt.tikicdn.com/cache/200x280/media/catalog/product/2/2/2267762859620-003.u4083.d20161229.t154954.794925.jpg, https://salt.tikicdn.com/cache/200x280/media/catalog/product/2/2/2267762859620-004.u4083.d20161229.t154954.839728.jpg","https://salt.tikicdn.com/cache/200x280/media/catalog/product/2/2/2267762859620-001.u4083.d20161229.t154954.706450.jpg, https://salt.tikicdn.com/cache/200x280/media/catalog/product/2/2/2267762859620-002.u4083.d20161229.t154954.753185.jpg, https://salt.tikicdn.com/cache/200x280/media/catalog/product/2/2/2267762859620-003.u4083.d20161229.t154954.794925.jpg, https://salt.tikicdn.com/cache/200x280/media/catalog/product/2/2/2267762859620-004.u4083.d20161229.t154954.839728.jpg",1000,3
566322,Máy Tính Để Bàn Casio MX-12B,183000,Máy Tính Để Bàn Casio MX-12B Cách phân biệt Casio thật giả qua con tem BitexMáy Tính Để Bàn Casio MX-12B sẽ là công cụ tính toán hoàn hảo trong công việc hằng ngày của bạn. Máy được thiết kế cứng ...,"Máy Tính Để Bàn Casio MX-12B Cách phân biệt Casio thật giả qua con tem Bitex Máy Tính Để Bàn Casio MX-12B sẽ là công cụ tính toán hoàn hảo trong công việc hằng ngày của bạn. Máy được thiết kế cứng cáp, bền đẹp bằng chất liệu nhựa cao cấp. Máy được tích hợp nhiều chức năng hiện đại. giúp bạn hoàn thành công việc một cách nhanh chóng. Màn hình máy rộng, hiển thị rõ nét, giúp bạn xem kết quả và dữ liệu một cách dễ dàng. Thông tin sản phẩm - Màn hình lớn dễ dàng đọc dữ liệu - Có 2 nguồn năng lượng: mặt trời & pin - Phím cuốn đảm bảo không mất dữ liệu khi làm việc với tốc độ cao - Chức năng nổi trội: tính tỷ lệ phần trăm. GIÁ SẢN PHẨM ĐÃ BAO GỒM VAT, BẢO HÀNH ĐIỆN TỬ 7 NĂM Giá sản phẩm trên Tiki đã bao gồm thuế theo luật hiện hành. Bên cạnh đó, tuỳ vào loại sản phẩm, hình thức và địa chỉ giao hàng mà có thể phát sinh thêm chi phí khác như phí vận chuyển, phụ phí hàng cồng kềnh, thuế nhập khẩu (đối với đơn hàng giao từ nước ngoài có giá trị trên 1 triệu đồng)..... Sản phẩm này là tài sản cá nhân được bán bởi Nhà Bán Hàng Cá Nhân và không thuộc đối tượng phải chịu thuế GTGT. Do đó hoá đơn VAT không được cung cấp trong trường hợp này.",5,33,"https://salt.tikicdn.com/media/catalog/product/m/x/mx-12b_1.jpg, https://salt.tikicdn.com/ts/product/bb/6a/82/f7fa631113717b388f1df91c6d9f046c.jpg, https://salt.tikicdn.com/ts/product/7d/85/d0/af9658cd277cd8fbdd8b02d72adedec7.jpg, https://salt.tikicdn.com/ts/product/d6/a2/9c/c23f743ee56fcc97f1139da63a5f47ee.jpg, https://salt.tikicdn.com/ts/product/5b/51/e6/073aa1a9010429cfef2a45e91c419cb1.png, https://salt.tikicdn.com/ts/product/f1/1f/06/90062dde046fdfde6f7bb0ab8188c756.jpg","https://salt.tikicdn.com/cache/w1200/media/catalog/product/m/x/mx-12b_1.jpg, https://salt.tikicdn.com/cache/w1200/ts/product/bb/6a/82/f7fa631113717b388f1df91c6d9f046c.jpg, https://salt.tikicdn.com/cache/w1200/ts/product/7d/85/d0/af9658cd277cd8fbdd8b02d72adedec7.jpg, https://salt.tikicdn.com/cache/w1200/ts/product/d6/a2/9c/c23f743ee56fcc97f1139da63a5f47ee.jpg, https://salt.tikicdn.com/cache/w1200/ts/product/5b/51/e6/073aa1a9010429cfef2a45e91c419cb1.png, https://salt.tikicdn.com/cache/w1200/ts/product/f1/1f/06/90062dde046fdfde6f7bb0ab8188c756.jpg","https://salt.tikicdn.com/cache/w300/media/catalog/product/m/x/mx-12b_1.jpg, https://salt.tikicdn.com/cache/w300/ts/product/bb/6a/82/f7fa631113717b388f1df91c6d9f046c.jpg, https://salt.tikicdn.com/cache/w300/ts/product/7d/85/d0/af9658cd277cd8fbdd8b02d72adedec7.jpg, https://salt.tikicdn.com/cache/w300/ts/product/d6/a2/9c/c23f743ee56fcc97f1139da63a5f47ee.jpg, https://salt.tikicdn.com/cache/w300/ts/product/5b/51/e6/073aa1a9010429cfef2a45e91c419cb1.png, https://salt.tikicdn.com/cache/w300/ts/product/f1/1f/06/90062dde046fdfde6f7bb0ab8188c756.jpg","https://salt.tikicdn.com/cache/200x280/media/catalog/product/m/x/mx-12b_1.jpg, https://salt.tikicdn.com/cache/200x280/ts/product/bb/6a/82/f7fa631113717b388f1df91c6d9f046c.jpg, https://salt.tikicdn.com/cache/200x280/ts/product/7d/85/d0/af9658cd277cd8fbdd8b02d72adedec7.jpg, https://salt.tikicdn.com/cache/200x280/ts/product/d6/a2/9c/c23f743ee56fcc97f1139da63a5f47ee.jpg, https://salt.tikicdn.com/cache/200x280/ts/product/5b/51/e6/073aa1a9010429cfef2a45e91c419cb1.png, https://salt.tikicdn.com/cache/200x280/ts/product/f1/1f/06/90062dde046fdfde6f7bb0ab8188c756.jpg","https://salt.tikicdn.com/cache/200x280/media/catalog/product/m/x/mx-12b_1.jpg, https://salt.tikicdn.com/cache/200x280/ts/product/bb/6a/82/f7fa631113717b388f1df91c6d9f046c.jpg, https://salt.tikicdn.com/cache/200x280/ts/product/7d/85/d0/af9658cd277cd8fbdd8b02d72adedec7.jpg, https://salt.tikicdn.com/cache/200x280/ts/product/d6/a2/9c/c23f743ee56fcc97f1139da63a5f47ee.jpg, https://salt.tikicdn.com/cache/200x280/ts/product/5b/51/e6/073aa1a9010429cfef2a45e91c419cb1.png, https://salt.tikicdn.com/cache/200x280/ts/product/f1/1f/06/90062dde046fdfde6f7bb0ab8188c756.jpg",1000,33
566320,Máy Tính Để Bàn Casio MJ-120D PLus,333000,"Cách phân biệt Casio thật giả qua con tem BitexMáy Tính Để Bàn Casio MJ-120DMáy Tính Để Bàn Casio MJ-120D hiển thị 12 số, tiện dụng khi dùng cho văn phòng hay các cửa hàng kinh doanh. Sản phẩm có t...","Cách phân biệt Casio thật giả qua con tem Bitex Máy Tính Để Bàn Casio MJ-120D Máy Tính Để Bàn Casio MJ-120D hiển thị 12 số, tiện dụng khi dùng cho văn phòng hay các cửa hàng kinh doanh. Sản phẩm có thiết kế nhỏ gọn cùng phím bấm bằng nhựa mềm, rất thân thiện khi sử dụng. Lớp vỏ được làm từ chất liệu cao cấp, giúp bảo vệ an toàn cho máy. Hãy đơn giản những con số và phép tính với Máy Tính Để Bàn Casio MJ-120D. Thông tin sản phẩm - Loại sản phẩm: Máy tính. - Thương hiệu: Casio. - Xuất xứ: Nhật Bản/Trung Quốc. - Chất liệu: Vỏ máy được làm từ chất liệu nhựa và kim loại cao cấp, bảo vệ tốt máy khi rơi rớt, va đập. - Thiết kế: + Màn hình lớn hiển thị 12 số giúp đọc dữ liệu dễ dàng hơn, chế độ pin được bật khi không đủ sáng. + Sử dụng 2 nguồn năng lượng: pin và mặt trời. + Có đến 100 bước kiểm tra. + Các phím được tạo bằng cách phun nhựa có hai màu khác nhau. + Các ký hiệu trên phím bằng chất dẻo nên không bị mòn hoặc mờ trong quá trình sử dụng. + Vỏ ngoài của máy bền, chịu được va đập mạnh, thuận tiện cho việc bỏ trong túi hay ba lô của học sinh. + Phím cuốn đảm bảo không mất dữ liệu khi làm việc với tốc độ cao. + Chức năng nổi bật: tính tỷ lệ phần trăm, cho phép thêm bớt lợi nhuận và chi phí đã định. - Kích thước : 30.1 x 123 x 140 mm. - Thời hạn bảo hành : 24 tháng. - Điều Kiện Bảo Hành Miễn Phí Máy Tính Casio : a. Đối với những model máy tính trong hộp: + Sản phẩm phải có phiếu bảo hành 2 năm. Trên thân máy và phiếu bảo hành có in số serial trùng nhau. + Máy phải có tem chống hàng giả CASIO và máy do Công ty BITEX phân phối, tem dán phải còn nguyên vẹn, không bị tháo gỡ hoặc rách, tẩy xoá. + Máy còn trong thời hạn bảo hành: Trường hợp máy còn tem chống hàng giả CASIO và còn phiếu bảo hành : Thời gian bảo hành 24 tháng kể từ ngày mua nhưng không quá 30 tháng kể từ tháng được in trong số serial trên thân máy. Trường hợp máy còn tem chống hàng giả CASIO nhưng không còn phiếu bảo hành : Thời gian bảo hành 20 tháng kể từ tháng được in trong số serial trên thân máy. Lưu ý: Không bảo hành các bộ phận như vỏ máy hoặc phụ kiện kèm theo máy như pin, dây cáp. b. Đối với những model máy tính trong vỉ nhựa: + Sản phẩm phải có phiếu bảo hành 2 năm. Trên phiếu bảo hành có thông tin đầy đủ (tên đại lý, ngày xuất bán …). + Máy phải có tem chống hàng giả CASIO và máy do Công ty BITEX phân phối, tem dán phải còn nguyên vẹn, không bị tháo gỡ hoặc rách, tẩy xoá. + Thời hạn bảo hành: Bảo hành từ ngày xuất bán được ghi trong phiếu bảo hành. Giá sản phẩm trên Tiki đã bao gồm thuế theo luật hiện hành. Bên cạnh đó, tuỳ vào loại sản phẩm, hình thức và địa chỉ giao hàng mà có thể phát sinh thêm chi phí khác như phí vận chuyển, phụ phí hàng cồng kềnh, thuế nhập khẩu (đối với đơn hàng giao từ nước ngoài có giá trị trên 1 triệu đồng).....",5,44,"https://salt.tikicdn.com/ts/product/c2/c5/dc/e7e4d2f6098a1cffeaba18b01309f854.jpg, https://salt.tikicdn.com/ts/product/df/68/81/c5b52dc933caee993dd46ccd4a7bb9a4.jpg, https://salt.tikicdn.com/ts/product/3a/52/c4/dd0ca860d17b097f60e2bf2061f2e4b7.jpg, https://salt.tikicdn.com/ts/product/d3/7e/8b/f79f7fa13eaba05d4c578d7d630e4761.jpg","https://salt.tikicdn.com/cache/w1200/ts/product/c2/c5/dc/e7e4d2f6098a1cffeaba18b01309f854.jpg, https://salt.tikicdn.com/cache/w1200/ts/product/df/68/81/c5b52dc933caee993dd46ccd4a7bb9a4.jpg, https://salt.tikicdn.com/cache/w1200/ts/product/3a/52/c4/dd0ca860d17b097f60e2bf2061f2e4b7.jpg, https://salt.tikicdn.com/cache/w1200/ts/product/d3/7e/8b/f79f7fa13eaba05d4c578d7d630e4761.jpg","https://salt.tikicdn.com/cache/w300/ts/product/c2/c5/dc/e7e4d2f6098a1cffeaba18b01309f854.jpg, https://salt.tikicdn.com/cache/w300/ts/product/df/68/81/c5b52dc933caee993dd46ccd4a7bb9a4.jpg, https://salt.tikicdn.com/cache/w300/ts/product/3a/52/c4/dd0ca860d17b097f60e2bf2061f2e4b7.jpg, https://salt.tikicdn.com/cache/w300/ts/product/d3/7e/8b/f79f7fa13eaba05d4c578d7d630e4761.jpg","https://salt.tikicdn.com/cache/200x280/ts/product/c2/c5/dc/e7e4d2f6098a1cffeaba18b01309f854.jpg, https://salt.tikicdn.com/cache/200x280/ts/product/df/68/81/c5b52dc933caee993dd46ccd4a7bb9a4.jpg, https://salt.tikicdn.com/cache/200x280/ts/product/3a/52/c4/dd0ca860d17b097f60e2bf2061f2e4b7.jpg, https://salt.tikicdn.com/cache/200x280/ts/product/d3/7e/8b/f79f7fa13eaba05d4c578d7d630e4761.jpg","https://salt.tikicdn.com/cache/200x280/ts/product/c2/c5/dc/e7e4d2f6098a1cffeaba18b01309f854.jpg, https://salt.tikicdn.com/cache/200x280/ts/product/df/68/81/c5b52dc933caee993dd46ccd4a7bb9a4.jpg, https://salt.tikicdn.com/cache/200x280/ts/product/3a/52/c4/dd0ca860d17b097f60e2bf2061f2e4b7.jpg, https://salt.tikicdn.com/cache/200x280/ts/product/d3/7e/8b/f79f7fa13eaba05d4c578d7d630e4761.jpg",1000,44
