id,name,price,short_description,description,rating_average,review_count,image_base_url,image_large_url,image_medium_url,image_small_url,image_thumbnail_url,stock,quantity_sold
276031381,Máy Tính Văn Phòng Flexio - Thiên Long CAL-008 - Màu Trắng,104900,"    Máy Tính Văn Phòng Flexio - Thiên Long CAL-008 - Màu Trắng   - Máy tính văn phòng CAL-008 đa năng này phù hợp sử dụng tại nhà, trường học, văn phòng hoặc cửa hàng. Sự kết hợp chíp xử lý và mạc...","Máy Tính Văn Phòng Flexio - Thiên Long CAL-008 - Màu Trắng - Máy tính văn phòng CAL-008 đa năng này phù hợp sử dụng tại nhà, trường học, văn phòng hoặc cửa hàng. Sự kết hợp chíp xử lý và mạch điều khiển công nghệ hiện đại đưa ra những kết quả phép tính đáng tin cậy, nhanh chóng đáp ứng tốt cho mục đích cá nhân hoặc chuyên nghiệp. - Nhỏ gọn và di động, bạn có thể dễ dàng mang theo bất cứ mọi nơi. - Bộ vỏ nguyên liệu ABS cao cấp, bền và sử dụng thiết kế thân thiện, máy tính văn phòng CAL-008 cung cấp sự tiện lợi và hiệu quả trong tất cả các nhu cầu tính toán. - Tính năng tự động : Không sử dụng tự tắt nguồn (8~13 phút) - Màn hình : LCD - Kích thước máy tính : 155.8 x 99.5 mm - Độ bền phím : ~1.000.000 lần bấm (F<85g) - Loại pin : AAAx01 (1.5V) - Bảo hành : 60 tháng (1 đổi 1 trong 12 tháng đầu tiên) Giá sản phẩm trên Tiki đã bao gồm thuế theo luật hiện hành. Bên cạnh đó, tuỳ vào loại sản phẩm, hình thức và địa chỉ giao hàng mà có thể phát sinh thêm chi phí khác như phí vận chuyển, phụ phí hàng cồng kềnh, thuế nhập khẩu (đối với đơn hàng giao từ nước ngoài có giá trị trên 1 triệu đồng).....",0,0,"https://salt.tikicdn.com/ts/product/4e/b9/41/73d86926f258ff42e8376db157fb086c.jpg, https://salt.tikicdn.com/ts/product/aa/56/ed/0b55b83b5a8b1f6963c3c5c3a3c759de.jpg, https://salt.tikicdn.com/ts/product/cd/e3/98/a4f6ab80c6228ddb958c74177b928261.jpg, https://salt.tikicdn.com/ts/product/86/e7/a6/7ccf281ae70a501f43ebe6deca942876.jpg","https://salt.tikicdn.com/cache/w1200/ts/product/4e/b9/41/73d86926f258ff42e8376db157fb086c.jpg, https://salt.tikicdn.com/cache/w1200/ts/product/aa/56/ed/0b55b83b5a8b1f6963c3c5c3a3c759de.jpg, https://salt.tikicdn.com/cache/w1200/ts/product/cd/e3/98/a4f6ab80c6228ddb958c74177b928261.jpg, https://salt.tikicdn.com/cache/w1200/ts/product/86/e7/a6/7ccf281ae70a501f43ebe6deca942876.jpg","https://salt.tikicdn.com/cache/w300/ts/product/4e/b9/41/73d86926f258ff42e8376db157fb086c.jpg, https://salt.tikicdn.com/cache/w300/ts/product/aa/56/ed/0b55b83b5a8b1f6963c3c5c3a3c759de.jpg, https://salt.tikicdn.com/cache/w300/ts/product/cd/e3/98/a4f6ab80c6228ddb958c74177b928261.jpg, https://salt.tikicdn.com/cache/w300/ts/product/86/e7/a6/7ccf281ae70a501f43ebe6deca942876.jpg","https://salt.tikicdn.com/cache/200x280/ts/product/4e/b9/41/73d86926f258ff42e8376db157fb086c.jpg, https://salt.tikicdn.com/cache/200x280/ts/product/aa/56/ed/0b55b83b5a8b1f6963c3c5c3a3c759de.jpg, https://salt.tikicdn.com/cache/200x280/ts/product/cd/e3/98/a4f6ab80c6228ddb958c74177b928261.jpg, https://salt.tikicdn.com/cache/200x280/ts/product/86/e7/a6/7ccf281ae70a501f43ebe6deca942876.jpg","https://salt.tikicdn.com/cache/200x280/ts/product/4e/b9/41/73d86926f258ff42e8376db157fb086c.jpg, https://salt.tikicdn.com/cache/200x280/ts/product/aa/56/ed/0b55b83b5a8b1f6963c3c5c3a3c759de.jpg, https://salt.tikicdn.com/cache/200x280/ts/product/cd/e3/98/a4f6ab80c6228ddb958c74177b928261.jpg, https://salt.tikicdn.com/cache/200x280/ts/product/86/e7/a6/7ccf281ae70a501f43ebe6deca942876.jpg",1000,0
276031377,Máy Tính Vinacal DA-12TW - Màu Đen,389500,"    Máy Tính Vinacal DA-12TW   - Màn hình cực lớn giúp đọc nhiều dữ liệu dễ dàng hơn.   - Nguồn năng lượng hai chiều (Mặt trời + Pin) Chế độ sử dụng năng lượng mặt trời được bật khi đủ sáng, chế ...","Máy Tính Vinacal DA-12TW - Màn hình cực lớn giúp đọc nhiều dữ liệu dễ dàng hơn. - Nguồn năng lượng hai chiều (Mặt trời + Pin) Chế độ sử dụng năng lượng mặt trời được bật khi đủ sáng, chế độ pin được bật khi không đủ sáng. - Kích thước (Dài × Rộng × Dày) : 6 × 65 × 111 mm - Tuổi thọ PIN: Khoảng 10.000 giờ. - Đặc biệt có chức năng chống nước - Màn hình lớn dễ dàng đọc dữ liệu - Chức năng nổi trội: Tính tỷ lệ phần trăm, thiết lập tính thuế, gọi lại bộ nhớ, cộng bộ nhớ, trừ bộ nhớ, Các thao tác phím được lưu trữ trong bộ nhớ đệm, nhờ vậy sẽ không bị mất dữ liệu ngay cả khi nhập với tốc độ cao Giá sản phẩm trên Tiki đã bao gồm thuế theo luật hiện hành. Bên cạnh đó, tuỳ vào loại sản phẩm, hình thức và địa chỉ giao hàng mà có thể phát sinh thêm chi phí khác như phí vận chuyển, phụ phí hàng cồng kềnh, thuế nhập khẩu (đối với đơn hàng giao từ nước ngoài có giá trị trên 1 triệu đồng).....",0,0,"https://salt.tikicdn.com/ts/product/74/99/a0/5a691b80496f672a29aac2eb0fb83ec1.jpg, https://salt.tikicdn.com/ts/product/cf/55/ab/b2f35fdc248e313693e0985ae8924954.jpg","https://salt.tikicdn.com/cache/w1200/ts/product/74/99/a0/5a691b80496f672a29aac2eb0fb83ec1.jpg, https://salt.tikicdn.com/cache/w1200/ts/product/cf/55/ab/b2f35fdc248e313693e0985ae8924954.jpg","https://salt.tikicdn.com/cache/w300/ts/product/74/99/a0/5a691b80496f672a29aac2eb0fb83ec1.jpg, https://salt.tikicdn.com/cache/w300/ts/product/cf/55/ab/b2f35fdc248e313693e0985ae8924954.jpg","https://salt.tikicdn.com/cache/200x280/ts/product/74/99/a0/5a691b80496f672a29aac2eb0fb83ec1.jpg, https://salt.tikicdn.com/cache/200x280/ts/product/cf/55/ab/b2f35fdc248e313693e0985ae8924954.jpg","https://salt.tikicdn.com/cache/200x280/ts/product/74/99/a0/5a691b80496f672a29aac2eb0fb83ec1.jpg, https://salt.tikicdn.com/cache/200x280/ts/product/cf/55/ab/b2f35fdc248e313693e0985ae8924954.jpg",1000,0
276031373,Máy Tính Vinacal DC-12 - Màu Trắng,356200,"    Máy Tính Vinacal DC-12   - Màn hình cực lớn giúp đọc nhiều dữ liệu dễ dàng hơn.   - Nguồn năng lượng hai chiều (Mặt trời + Pin) Chế độ sử dụng năng lượng mặt trời được bật khi đủ sáng, chế độ...","Máy Tính Vinacal DC-12 - Màn hình cực lớn giúp đọc nhiều dữ liệu dễ dàng hơn. - Nguồn năng lượng hai chiều (Mặt trời + Pin) Chế độ sử dụng năng lượng mặt trời được bật khi đủ sáng, chế độ pin được bật khi không đủ sáng. - Kích thước (Dài × Rộng × Dày) : 23 × 110 × 175 mm - Tuổi thọ PIN: Khoảng 10.000 giờ. - Màn hình lớn dễ dàng đọc dữ liệu - Chức năng nổi trội: Tính tỷ lệ phần trăm, thiết lập tính thuế, gọi lại bộ nhớ, cộng bộ nhớ, trừ bộ nhớ, Các thao tác phím được lưu trữ trong bộ nhớ đệm, nhờ vậy sẽ không bị mất dữ liệu ngay cả khi nhập với tốc độ cao Giá sản phẩm trên Tiki đã bao gồm thuế theo luật hiện hành. Bên cạnh đó, tuỳ vào loại sản phẩm, hình thức và địa chỉ giao hàng mà có thể phát sinh thêm chi phí khác như phí vận chuyển, phụ phí hàng cồng kềnh, thuế nhập khẩu (đối với đơn hàng giao từ nước ngoài có giá trị trên 1 triệu đồng).....",0,0,"https://salt.tikicdn.com/ts/product/4f/e1/15/d4a2b6606cb867cc14caa0e4cc6057c3.jpg, https://salt.tikicdn.com/ts/product/fe/79/34/d4137d39215a1ab57b5815e717f7793a.jpg","https://salt.tikicdn.com/cache/w1200/ts/product/4f/e1/15/d4a2b6606cb867cc14caa0e4cc6057c3.jpg, https://salt.tikicdn.com/cache/w1200/ts/product/fe/79/34/d4137d39215a1ab57b5815e717f7793a.jpg","https://salt.tikicdn.com/cache/w300/ts/product/4f/e1/15/d4a2b6606cb867cc14caa0e4cc6057c3.jpg, https://salt.tikicdn.com/cache/w300/ts/product/fe/79/34/d4137d39215a1ab57b5815e717f7793a.jpg","https://salt.tikicdn.com/cache/200x280/ts/product/4f/e1/15/d4a2b6606cb867cc14caa0e4cc6057c3.jpg, https://salt.tikicdn.com/cache/200x280/ts/product/fe/79/34/d4137d39215a1ab57b5815e717f7793a.jpg","https://salt.tikicdn.com/cache/200x280/ts/product/4f/e1/15/d4a2b6606cb867cc14caa0e4cc6057c3.jpg, https://salt.tikicdn.com/cache/200x280/ts/product/fe/79/34/d4137d39215a1ab57b5815e717f7793a.jpg",1000,0
275927242,"Máy tính cầm tay DS480 - Máy tính bỏ túi DS-480 - Máy tính tiền nhỏ gọn, tiện lợi - Hàng chính hãng",205000,"Máy tính cầm tay DS480 - Máy tính bỏ túi DS-480 - Máy tính tiền nhỏ gọn, tiện lợi - Hàng chính hãng- Thiết kế nhỏ gọn,hiệu suất cao, nhiều tính năng,dùng trong công việc tính toán hàng ngày & họ...","Máy tính cầm tay DS480 - Máy tính bỏ túi DS-480 - Máy tính tiền nhỏ gọn, tiện lợi - Hàng chính hãng - Thiết kế nhỏ gọn,hiệu suất cao, nhiều tính năng,dùng trong công việc tính toán hàng ngày & học tập - Xuất xứ Trung Quốc - THÔNG TIN SẢN PHẨM - Loại để bàn, 12 số - Màn hình cực lớn - Nguồn hai chiều: có thể dùng 1 Pin AAA hoặc pin năng lượng mặt trời tự sạc - Các phím dẻo: Được thiết kế và chế tạo để dễ dàng thao tác. - Kích thước sản phẩm: 18.5cm x 14cm x 3cm - Tình trạng sản phẩm: Hàng mới 100%, full box - Bảo hành tại shop: 3 tháng, 1 đổi 1 Lưu ý: Sản phẩm ko kèm pin, quý khách mua về sử dụng nhớ bỏ pin tiểu vào AAA vào để sử dụng nha, vì pin năng lượng mặt trời tích hợp của máy tính phụ thuộc vào ánh sáng, ánh nắng nên sẽ không ổn định bằng dùng pin, nên quý khách nhớ bỏ 1 pin tiểu AAA vào rồi mới sử dụng nha. Giá sản phẩm trên Tiki đã bao gồm thuế theo luật hiện hành. Bên cạnh đó, tuỳ vào loại sản phẩm, hình thức và địa chỉ giao hàng mà có thể phát sinh thêm chi phí khác như phí vận chuyển, phụ phí hàng cồng kềnh, thuế nhập khẩu (đối với đơn hàng giao từ nước ngoài có giá trị trên 1 triệu đồng).....",0,0,"https://salt.tikicdn.com/ts/product/34/6f/86/dc9c5f2ad01c587fbf2c09c921bbfb2c.jpg, https://salt.tikicdn.com/ts/product/2f/08/2c/de1f9fadc3da842db959fe92939e9daf.jpg, https://salt.tikicdn.com/ts/product/0a/48/fb/2f1d246d0974b636cd21b5b1cb92203e.jpg, https://salt.tikicdn.com/ts/product/1c/65/8a/9ab51dd657dfcf5a068fad31429327a7.jpg, https://salt.tikicdn.com/ts/product/17/af/02/a00fdf6e13ed2d77230b346015c495b7.jpg, https://salt.tikicdn.com/ts/product/1c/45/8c/5741ec83e869d5ed555c364643837050.jpg, https://salt.tikicdn.com/ts/product/84/72/30/0be20a2e8fc2c3d65f2b5e6b58a1ad57.jpg, https://salt.tikicdn.com/ts/product/76/25/28/aa17b9fd76882e9bc0bf99d3d16f18be.jpg","https://salt.tikicdn.com/cache/w1200/ts/product/34/6f/86/dc9c5f2ad01c587fbf2c09c921bbfb2c.jpg, https://salt.tikicdn.com/cache/w1200/ts/product/2f/08/2c/de1f9fadc3da842db959fe92939e9daf.jpg, https://salt.tikicdn.com/cache/w1200/ts/product/0a/48/fb/2f1d246d0974b636cd21b5b1cb92203e.jpg, https://salt.tikicdn.com/cache/w1200/ts/product/1c/65/8a/9ab51dd657dfcf5a068fad31429327a7.jpg, https://salt.tikicdn.com/cache/w1200/ts/product/17/af/02/a00fdf6e13ed2d77230b346015c495b7.jpg, https://salt.tikicdn.com/cache/w1200/ts/product/1c/45/8c/5741ec83e869d5ed555c364643837050.jpg, https://salt.tikicdn.com/cache/w1200/ts/product/84/72/30/0be20a2e8fc2c3d65f2b5e6b58a1ad57.jpg, https://salt.tikicdn.com/cache/w1200/ts/product/76/25/28/aa17b9fd76882e9bc0bf99d3d16f18be.jpg","https://salt.tikicdn.com/cache/w300/ts/product/34/6f/86/dc9c5f2ad01c587fbf2c09c921bbfb2c.jpg, https://salt.tikicdn.com/cache/w300/ts/product/2f/08/2c/de1f9fadc3da842db959fe92939e9daf.jpg, https://salt.tikicdn.com/cache/w300/ts/product/0a/48/fb/2f1d246d0974b636cd21b5b1cb92203e.jpg, https://salt.tikicdn.com/cache/w300/ts/product/1c/65/8a/9ab51dd657dfcf5a068fad31429327a7.jpg, https://salt.tikicdn.com/cache/w300/ts/product/17/af/02/a00fdf6e13ed2d77230b346015c495b7.jpg, https://salt.tikicdn.com/cache/w300/ts/product/1c/45/8c/5741ec83e869d5ed555c364643837050.jpg, https://salt.tikicdn.com/cache/w300/ts/product/84/72/30/0be20a2e8fc2c3d65f2b5e6b58a1ad57.jpg, https://salt.tikicdn.com/cache/w300/ts/product/76/25/28/aa17b9fd76882e9bc0bf99d3d16f18be.jpg","https://salt.tikicdn.com/cache/200x280/ts/product/34/6f/86/dc9c5f2ad01c587fbf2c09c921bbfb2c.jpg, https://salt.tikicdn.com/cache/200x280/ts/product/2f/08/2c/de1f9fadc3da842db959fe92939e9daf.jpg, https://salt.tikicdn.com/cache/200x280/ts/product/0a/48/fb/2f1d246d0974b636cd21b5b1cb92203e.jpg, https://salt.tikicdn.com/cache/200x280/ts/product/1c/65/8a/9ab51dd657dfcf5a068fad31429327a7.jpg, https://salt.tikicdn.com/cache/200x280/ts/product/17/af/02/a00fdf6e13ed2d77230b346015c495b7.jpg, https://salt.tikicdn.com/cache/200x280/ts/product/1c/45/8c/5741ec83e869d5ed555c364643837050.jpg, https://salt.tikicdn.com/cache/200x280/ts/product/84/72/30/0be20a2e8fc2c3d65f2b5e6b58a1ad57.jpg, https://salt.tikicdn.com/cache/200x280/ts/product/76/25/28/aa17b9fd76882e9bc0bf99d3d16f18be.jpg","https://salt.tikicdn.com/cache/200x280/ts/product/34/6f/86/dc9c5f2ad01c587fbf2c09c921bbfb2c.jpg, https://salt.tikicdn.com/cache/200x280/ts/product/2f/08/2c/de1f9fadc3da842db959fe92939e9daf.jpg, https://salt.tikicdn.com/cache/200x280/ts/product/0a/48/fb/2f1d246d0974b636cd21b5b1cb92203e.jpg, https://salt.tikicdn.com/cache/200x280/ts/product/1c/65/8a/9ab51dd657dfcf5a068fad31429327a7.jpg, https://salt.tikicdn.com/cache/200x280/ts/product/17/af/02/a00fdf6e13ed2d77230b346015c495b7.jpg, https://salt.tikicdn.com/cache/200x280/ts/product/1c/45/8c/5741ec83e869d5ed555c364643837050.jpg, https://salt.tikicdn.com/cache/200x280/ts/product/84/72/30/0be20a2e8fc2c3d65f2b5e6b58a1ad57.jpg, https://salt.tikicdn.com/cache/200x280/ts/product/76/25/28/aa17b9fd76882e9bc0bf99d3d16f18be.jpg",1000,0
275825607,Máy tính văn phòng Thiên Long Flexio CAL-009,103000, Thông số kĩ thuật :Thương hiệu FlexioTính năng tự động Không sử dụng tự tắt nguồn (8~13 phút)Màn hình LCDChất liệu ABSKích thước máy tính 140.5 x 86.5 mmĐộ bền phím ~500.000 lần bấ...,"Thông số kĩ thuật : Thương hiệu Flexio Tính năng tự động Không sử dụng tự tắt nguồn (8~13 phút) Màn hình LCD Chất liệu ABS Kích thước máy tính 140.5 x 86.5 mm Độ bền phím ~500.000 lần bấm (F<70g) Loại pin AAAx01 (1.55V) Xuất xứ Việt Nam Sản xuất Trung Quốc Bảo hành 12 tháng (1 đổi 1 trong 02 tháng đầu tiên) Khuyến cáo Tránh nguồn nhiệt, hóa chất. Không thích hợp cho trẻ dưới 3 tuổi. Đặc tính sản phẩm: - Máy tính văn phòng CAL-009 đa năng này phù hợp sử dụng tại nhà, trường học, văn phòng hoặc cửa hàng. Sự kết hợp chip xử lý và mạch điều khiển công nghệ hiện đại đưa ra những kết quả phép tính đáng tin cậy, nhanh chóng đáp ứng tốt cho mục đích cá nhân hoặc chuyên nghiệp. - Thiết kế nhỏ gọn và di động, bạn có thể dễ dàng mang theo bất cứ mọi nơi. - Bộ vỏ nguyên liệu ABS cao cấp, bền và sử dụng thiết kế thân thiện, máy tính văn phòng CAL-009 cung cấp sự tiện lợi và hiệu quả trong tất cả các nhu cầu tính toán. Giá sản phẩm trên Tiki đã bao gồm thuế theo luật hiện hành. Bên cạnh đó, tuỳ vào loại sản phẩm, hình thức và địa chỉ giao hàng mà có thể phát sinh thêm chi phí khác như phí vận chuyển, phụ phí hàng cồng kềnh, thuế nhập khẩu (đối với đơn hàng giao từ nước ngoài có giá trị trên 1 triệu đồng).....",0,0,"https://salt.tikicdn.com/ts/product/75/99/d0/d6382eb1b2fac7d364e71bcf887b8955.jpg, https://salt.tikicdn.com/ts/product/67/8e/08/c460f34c93ffd8d5bf6776b721b71dda.jpg","https://salt.tikicdn.com/cache/w1200/ts/product/75/99/d0/d6382eb1b2fac7d364e71bcf887b8955.jpg, https://salt.tikicdn.com/cache/w1200/ts/product/67/8e/08/c460f34c93ffd8d5bf6776b721b71dda.jpg","https://salt.tikicdn.com/cache/w300/ts/product/75/99/d0/d6382eb1b2fac7d364e71bcf887b8955.jpg, https://salt.tikicdn.com/cache/w300/ts/product/67/8e/08/c460f34c93ffd8d5bf6776b721b71dda.jpg","https://salt.tikicdn.com/cache/200x280/ts/product/75/99/d0/d6382eb1b2fac7d364e71bcf887b8955.jpg, https://salt.tikicdn.com/cache/200x280/ts/product/67/8e/08/c460f34c93ffd8d5bf6776b721b71dda.jpg","https://salt.tikicdn.com/cache/200x280/ts/product/75/99/d0/d6382eb1b2fac7d364e71bcf887b8955.jpg, https://salt.tikicdn.com/cache/200x280/ts/product/67/8e/08/c460f34c93ffd8d5bf6776b721b71dda.jpg",1000,0
274990790,Máy Tính CASIO FX-880BTG - Màu Xanh Biển + 2 Bút Bi Pilot BP-1RT - Mực Xanh,737200,    Máy Tính CASIO FX-880BTG   Máy tính Casio fx-880BTG thuộc dòng máy tính khoa học ClassWiz của hãng máy tính CASIO. Máy tính Casio fx-880BTG đã ra đời với nhiều cải tiến về: thiết kế - giao diệ...,"Máy Tính CASIO FX-880BTG Máy tính Casio fx-880BTG thuộc dòng máy tính khoa học ClassWiz của hãng máy tính CASIO. Máy tính Casio fx-880BTG đã ra đời với nhiều cải tiến về: thiết kế - giao diện, tính năng nổi trội và độ chính xác cao… để đáp ứng thực tiễn dạy và học tại Việt Nam, đồng thời thay đổi tư duy học tập lâu nay của học sinh. Tính năng nổi bật: - QR Code hỗ trợ dạy và học - Bảng tính spreadsheet - Hộp toán học Math Box - Bảng tuần hoàn - Kiểm chứng - Gian diện mới với thao tác đơn giản hơn - Kết quả tính toán chính xác lên đến 23 chữ số Tính năng cơ bản: - Kiểm tra số nguyên tố có 4 chữ số - Lưu phần thương và phần dư trong phép chia - Tính năng kiểm tra đúng/sai - Thông báo vô nghiệm khi giải phương trình bậc hai - Cực trị của hàm số bậc ba - Giải phương trình 4 ẩn - Giải phương trình bậc 4 - Giải bất phương trình bậc 4 Lưu ý: Được phép mang vào phòng thi từ thời gian tháng 8 năm 2022 Giá sản phẩm trên Tiki đã bao gồm thuế theo luật hiện hành. Bên cạnh đó, tuỳ vào loại sản phẩm, hình thức và địa chỉ giao hàng mà có thể phát sinh thêm chi phí khác như phí vận chuyển, phụ phí hàng cồng kềnh, thuế nhập khẩu (đối với đơn hàng giao từ nước ngoài có giá trị trên 1 triệu đồng).....",0,0,"https://salt.tikicdn.com/ts/product/c0/ed/4d/371cbf6414a6027e335526c054332302.jpg, https://salt.tikicdn.com/ts/product/5e/54/17/77a4021b36da7a6b269c9c85b3a081fe.png, https://salt.tikicdn.com/ts/product/86/50/19/83f65111d987dd3f962e3eee3299c1a4.png, https://salt.tikicdn.com/ts/product/b0/36/42/4c0c646318bb6a461c19a366dff1b878.jpg, https://salt.tikicdn.com/ts/product/b2/01/cb/db1228f88a8e67f7d17676f99d1fc6e0.jpg, https://salt.tikicdn.com/ts/product/2a/a3/25/79d1f75395942bc96db78d3bec3d5657.jpg, https://salt.tikicdn.com/ts/product/2a/93/8d/681202ad6384da53c136c84a8ce7bffe.jpg","https://salt.tikicdn.com/cache/w1200/ts/product/c0/ed/4d/371cbf6414a6027e335526c054332302.jpg, https://salt.tikicdn.com/cache/w1200/ts/product/5e/54/17/77a4021b36da7a6b269c9c85b3a081fe.png, https://salt.tikicdn.com/cache/w1200/ts/product/86/50/19/83f65111d987dd3f962e3eee3299c1a4.png, https://salt.tikicdn.com/cache/w1200/ts/product/b0/36/42/4c0c646318bb6a461c19a366dff1b878.jpg, https://salt.tikicdn.com/cache/w1200/ts/product/b2/01/cb/db1228f88a8e67f7d17676f99d1fc6e0.jpg, https://salt.tikicdn.com/cache/w1200/ts/product/2a/a3/25/79d1f75395942bc96db78d3bec3d5657.jpg, https://salt.tikicdn.com/cache/w1200/ts/product/2a/93/8d/681202ad6384da53c136c84a8ce7bffe.jpg","https://salt.tikicdn.com/cache/w300/ts/product/c0/ed/4d/371cbf6414a6027e335526c054332302.jpg, https://salt.tikicdn.com/cache/w300/ts/product/5e/54/17/77a4021b36da7a6b269c9c85b3a081fe.png, https://salt.tikicdn.com/cache/w300/ts/product/86/50/19/83f65111d987dd3f962e3eee3299c1a4.png, https://salt.tikicdn.com/cache/w300/ts/product/b0/36/42/4c0c646318bb6a461c19a366dff1b878.jpg, https://salt.tikicdn.com/cache/w300/ts/product/b2/01/cb/db1228f88a8e67f7d17676f99d1fc6e0.jpg, https://salt.tikicdn.com/cache/w300/ts/product/2a/a3/25/79d1f75395942bc96db78d3bec3d5657.jpg, https://salt.tikicdn.com/cache/w300/ts/product/2a/93/8d/681202ad6384da53c136c84a8ce7bffe.jpg","https://salt.tikicdn.com/cache/200x280/ts/product/c0/ed/4d/371cbf6414a6027e335526c054332302.jpg, https://salt.tikicdn.com/cache/200x280/ts/product/5e/54/17/77a4021b36da7a6b269c9c85b3a081fe.png, https://salt.tikicdn.com/cache/200x280/ts/product/86/50/19/83f65111d987dd3f962e3eee3299c1a4.png, https://salt.tikicdn.com/cache/200x280/ts/product/b0/36/42/4c0c646318bb6a461c19a366dff1b878.jpg, https://salt.tikicdn.com/cache/200x280/ts/product/b2/01/cb/db1228f88a8e67f7d17676f99d1fc6e0.jpg, https://salt.tikicdn.com/cache/200x280/ts/product/2a/a3/25/79d1f75395942bc96db78d3bec3d5657.jpg, https://salt.tikicdn.com/cache/200x280/ts/product/2a/93/8d/681202ad6384da53c136c84a8ce7bffe.jpg","https://salt.tikicdn.com/cache/200x280/ts/product/c0/ed/4d/371cbf6414a6027e335526c054332302.jpg, https://salt.tikicdn.com/cache/200x280/ts/product/5e/54/17/77a4021b36da7a6b269c9c85b3a081fe.png, https://salt.tikicdn.com/cache/200x280/ts/product/86/50/19/83f65111d987dd3f962e3eee3299c1a4.png, https://salt.tikicdn.com/cache/200x280/ts/product/b0/36/42/4c0c646318bb6a461c19a366dff1b878.jpg, https://salt.tikicdn.com/cache/200x280/ts/product/b2/01/cb/db1228f88a8e67f7d17676f99d1fc6e0.jpg, https://salt.tikicdn.com/cache/200x280/ts/product/2a/a3/25/79d1f75395942bc96db78d3bec3d5657.jpg, https://salt.tikicdn.com/cache/200x280/ts/product/2a/93/8d/681202ad6384da53c136c84a8ce7bffe.jpg",1000,0
274744596,Máy Tính Casio MW-8V-BK,281000,"Máy Tính Casio MW-8V-BK- Sản phẩm chính hãng do Bitex phân phối độc quyền- Kích thước (Dài × Rộng × Dày) : 145 × 103 × 28,8 mm- Màn hình lớn dễ dàng đọc dữ liệu- Phím cấu tạo bằng nhựa dễ dàng tha...","Máy Tính Casio MW-8V-BK - Sản phẩm chính hãng do Bitex phân phối độc quyền - Kích thước (Dài × Rộng × Dày) : 145 × 103 × 28,8 mm - Màn hình lớn dễ dàng đọc dữ liệu - Phím cấu tạo bằng nhựa dễ dàng thao tác - Chức năng nổi trội: tính tỷ lệ phần trăm - Có bán rộng rãi tại các nhà sách lớn Giá sản phẩm trên Tiki đã bao gồm thuế theo luật hiện hành. Bên cạnh đó, tuỳ vào loại sản phẩm, hình thức và địa chỉ giao hàng mà có thể phát sinh thêm chi phí khác như phí vận chuyển, phụ phí hàng cồng kềnh, thuế nhập khẩu (đối với đơn hàng giao từ nước ngoài có giá trị trên 1 triệu đồng).....",0,0,https://salt.tikicdn.com/ts/product/ae/04/3a/4887156b9ec64e9113edeed19c9f793e.png,https://salt.tikicdn.com/cache/w1200/ts/product/ae/04/3a/4887156b9ec64e9113edeed19c9f793e.png,https://salt.tikicdn.com/cache/w300/ts/product/ae/04/3a/4887156b9ec64e9113edeed19c9f793e.png,https://salt.tikicdn.com/cache/200x280/ts/product/ae/04/3a/4887156b9ec64e9113edeed19c9f793e.png,https://salt.tikicdn.com/cache/200x280/ts/product/ae/04/3a/4887156b9ec64e9113edeed19c9f793e.png,1000,0
