id,name,price,short_description,description,rating_average,review_count,image_base_url,image_large_url,image_medium_url,image_small_url,image_thumbnail_url,stock,quantity_sold
276898957,Máy Tính Học Sinh Chuyên Dụng Deli Mới Nhất 417 Chức Năng Dành Cho Học Sinh Cấp 2 3 Thi THPT Quốc Gia Sinh Viên,346000,"TÍNH NĂNG SẢN PHẨM:️ Màn hình kích thước lớn, mặt mica trong giúp dễ bảo vệ và đọc số dễ dàng hơn️ Tự động tắt nguồn và 417 chức năng tính toán giúp sử dụng thuận tiện dễ dàng️ Đảm bảo thời gian sử...","TÍNH NĂNG SẢN PHẨM: ️ Màn hình kích thước lớn, mặt mica trong giúp dễ bảo vệ và đọc số dễ dàng hơn ️ Tự động tắt nguồn và 417 chức năng tính toán giúp sử dụng thuận tiện dễ dàng ️ Đảm bảo thời gian sử dụng lâu hơn với cả 2 nguồn điện từ pin và năng lượng mặt trời ️ Nút bấm tráng nhựa và đế cao su chống trượt sau lưng mang đến sản phẩm có thời gian sử dụng lâu dài ️ Bảo hành 3 năm ️ Máy tính đã được công nhận và cho phép mang vào phòng thi THÔNG TIN SẢN PHẨM: Tên sản phẩm: Máy tính học sinh Deli Mã sản phẩm: ED991ES Màu sắc: Xám, Xanh Lá Sử dụng pin: LR44*2 Xuất xứ: Trung Quốc ------------------------------------------------------------------------------------------------ Tự hào là một trong những nhãn hàng văn phòng phẩm lớn nhất tại Việt Nam, @Delivietnam không ngừng nỗ lực và phát triển trong lĩnh vực phân phối các sản phẩm cho các đơn vị văn phòng, trường học,... Với phương châm sản xuất những sản phẩm chất lượng tốt nhất và luôn đặt khách hàng làm trọng tâm, sứ mệnh của Deli là làm hài hòng người tiêu dùng toàn cầu với những sản phẩm chất lượng cao, độ tin cậy tuyệt đối và thân thiện với người dùng. Khách hàng lựa chọn các sản phẩm của @Delivietnam sẽ được cam kết: Sản phẩm chính hãng từ nhà máy Deli, nguồn gốc rõ ràng và chất lượng đạt tiêu chuẩn. Bảo hành theo quy định của nhà sản xuất. Giá cả hợp lý, cạnh tranh, rẻ nhất thị trường. Hỗ trợ đổi trả hàng cho những sản phẩm bị thiếu. Giá sản phẩm trên Tiki đã bao gồm thuế theo luật hiện hành. Bên cạnh đó, tuỳ vào loại sản phẩm, hình thức và địa chỉ giao hàng mà có thể phát sinh thêm chi phí khác như phí vận chuyển, phụ phí hàng cồng kềnh, thuế nhập khẩu (đối với đơn hàng giao từ nước ngoài có giá trị trên 1 triệu đồng).....",0,0,"https://salt.tikicdn.com/ts/product/6e/f7/d4/14b798358de2f799aac078b4c6d5a149.jpg, https://salt.tikicdn.com/ts/product/d0/f5/9d/6518703e00ac124bdaa7e61243ab3fc7.jpg, https://salt.tikicdn.com/ts/product/fd/94/0d/d3c05712afa56cc45dedb29d754e196a.jpg, https://salt.tikicdn.com/ts/product/ce/8c/17/1995aa00897ab25eac2a25272fa0f6b3.jpg, https://salt.tikicdn.com/ts/product/c5/b8/84/a853365cc4dc38539b8fffa987e71ffa.jpg, https://salt.tikicdn.com/ts/product/53/87/57/15803688bd682b4f990036b78a60acaa.jpg","https://salt.tikicdn.com/cache/w1200/ts/product/6e/f7/d4/14b798358de2f799aac078b4c6d5a149.jpg, https://salt.tikicdn.com/cache/w1200/ts/product/d0/f5/9d/6518703e00ac124bdaa7e61243ab3fc7.jpg, https://salt.tikicdn.com/cache/w1200/ts/product/fd/94/0d/d3c05712afa56cc45dedb29d754e196a.jpg, https://salt.tikicdn.com/cache/w1200/ts/product/ce/8c/17/1995aa00897ab25eac2a25272fa0f6b3.jpg, https://salt.tikicdn.com/cache/w1200/ts/product/c5/b8/84/a853365cc4dc38539b8fffa987e71ffa.jpg, https://salt.tikicdn.com/cache/w1200/ts/product/53/87/57/15803688bd682b4f990036b78a60acaa.jpg","https://salt.tikicdn.com/cache/w300/ts/product/6e/f7/d4/14b798358de2f799aac078b4c6d5a149.jpg, https://salt.tikicdn.com/cache/w300/ts/product/d0/f5/9d/6518703e00ac124bdaa7e61243ab3fc7.jpg, https://salt.tikicdn.com/cache/w300/ts/product/fd/94/0d/d3c05712afa56cc45dedb29d754e196a.jpg, https://salt.tikicdn.com/cache/w300/ts/product/ce/8c/17/1995aa00897ab25eac2a25272fa0f6b3.jpg, https://salt.tikicdn.com/cache/w300/ts/product/c5/b8/84/a853365cc4dc38539b8fffa987e71ffa.jpg, https://salt.tikicdn.com/cache/w300/ts/product/53/87/57/15803688bd682b4f990036b78a60acaa.jpg","https://salt.tikicdn.com/cache/200x280/ts/product/6e/f7/d4/14b798358de2f799aac078b4c6d5a149.jpg, https://salt.tikicdn.com/cache/200x280/ts/product/d0/f5/9d/6518703e00ac124bdaa7e61243ab3fc7.jpg, https://salt.tikicdn.com/cache/200x280/ts/product/fd/94/0d/d3c05712afa56cc45dedb29d754e196a.jpg, https://salt.tikicdn.com/cache/200x280/ts/product/ce/8c/17/1995aa00897ab25eac2a25272fa0f6b3.jpg, https://salt.tikicdn.com/cache/200x280/ts/product/c5/b8/84/a853365cc4dc38539b8fffa987e71ffa.jpg, https://salt.tikicdn.com/cache/200x280/ts/product/53/87/57/15803688bd682b4f990036b78a60acaa.jpg","https://salt.tikicdn.com/cache/200x280/ts/product/6e/f7/d4/14b798358de2f799aac078b4c6d5a149.jpg, https://salt.tikicdn.com/cache/200x280/ts/product/d0/f5/9d/6518703e00ac124bdaa7e61243ab3fc7.jpg, https://salt.tikicdn.com/cache/200x280/ts/product/fd/94/0d/d3c05712afa56cc45dedb29d754e196a.jpg, https://salt.tikicdn.com/cache/200x280/ts/product/ce/8c/17/1995aa00897ab25eac2a25272fa0f6b3.jpg, https://salt.tikicdn.com/cache/200x280/ts/product/c5/b8/84/a853365cc4dc38539b8fffa987e71ffa.jpg, https://salt.tikicdn.com/cache/200x280/ts/product/53/87/57/15803688bd682b4f990036b78a60acaa.jpg",1000,0
276847515,Máy Tính Bỏ Túi - Deli EM10 - Màu Vàng,93000,    Máy Tính Bỏ Túi - Deli EM10 - Màu Vàng   Công dụng: Hỗ trợ việc tính toán nhanh gọn và chính xác   Hướng dẫn sử dụng: Tính toán trực tiếp trên máy   Hướng dẫn bảo quản: Để ở môi trường khô r...,"Máy Tính Bỏ Túi - Deli EM10 - Màu Vàng Công dụng: Hỗ trợ việc tính toán nhanh gọn và chính xác Hướng dẫn sử dụng: Tính toán trực tiếp trên máy Hướng dẫn bảo quản: Để ở môi trường khô ráo, tự nhiên, tránh ánh nắng trực tiếp bên ngoài. Máy tính được thiết kế trẻ trung, màu sắc sinh động, kích thước nhỏ gọn rất tiện lợi. Có thể bỏ vào cặp, túi xách, Là công cụ hỗ trợ tốt nhất cho học sinh, sinh viên hoặc những người làm các công việc cần tính toán. Máy tính bỏ túi sở hữu màn hình rộng và sáng, hiển thị rõ nét đến 12 chữ số cho phép bạn thực hiện được nhiều phép tính với kết quả chính xác hơn. Giá sản phẩm trên Tiki đã bao gồm thuế theo luật hiện hành. Bên cạnh đó, tuỳ vào loại sản phẩm, hình thức và địa chỉ giao hàng mà có thể phát sinh thêm chi phí khác như phí vận chuyển, phụ phí hàng cồng kềnh, thuế nhập khẩu (đối với đơn hàng giao từ nước ngoài có giá trị trên 1 triệu đồng).....",0,0,"https://salt.tikicdn.com/ts/product/74/c1/7f/cb90cb3262d8a1193f00cdf124fcc019.jpg, https://salt.tikicdn.com/ts/product/7c/63/a9/838cbd2a85a3625ff22d88d45b24de59.jpg","https://salt.tikicdn.com/cache/w1200/ts/product/74/c1/7f/cb90cb3262d8a1193f00cdf124fcc019.jpg, https://salt.tikicdn.com/cache/w1200/ts/product/7c/63/a9/838cbd2a85a3625ff22d88d45b24de59.jpg","https://salt.tikicdn.com/cache/w300/ts/product/74/c1/7f/cb90cb3262d8a1193f00cdf124fcc019.jpg, https://salt.tikicdn.com/cache/w300/ts/product/7c/63/a9/838cbd2a85a3625ff22d88d45b24de59.jpg","https://salt.tikicdn.com/cache/200x280/ts/product/74/c1/7f/cb90cb3262d8a1193f00cdf124fcc019.jpg, https://salt.tikicdn.com/cache/200x280/ts/product/7c/63/a9/838cbd2a85a3625ff22d88d45b24de59.jpg","https://salt.tikicdn.com/cache/200x280/ts/product/74/c1/7f/cb90cb3262d8a1193f00cdf124fcc019.jpg, https://salt.tikicdn.com/cache/200x280/ts/product/7c/63/a9/838cbd2a85a3625ff22d88d45b24de59.jpg",1000,0
276144014,"Máy tính Học Sinh Cấp 1 Deli E1710 , Được phép mang phòng thi, 12 số, 240 chức năng",200000,"TÍNH NĂNG SẢN PHẨM:️ Màn hình chất lượng cao có khả năng chống xước️ 240 chức năng tính toán kỹ thuật, tính độ lệch chuẩn, chuyển đổi tọa độ, chỉnh sửa dữ liệu, tính toán liên tục️ Bộ nhớ đa dụng 1...","TÍNH NĂNG SẢN PHẨM: ️ Màn hình chất lượng cao có khả năng chống xước ️ 240 chức năng tính toán kỹ thuật, tính độ lệch chuẩn, chuyển đổi tọa độ, chỉnh sửa dữ liệu, tính toán liên tục ️ Bộ nhớ đa dụng 10 bước ️ Chức năng thống kê ️ Nút bấm đạt trên 1 triệu lần bấm ️ Thiết kế chân chống trượt chống vỡ THÔNG TIN SẢN PHẨM: Tên sản phẩm: Máy kỹ thuật 12 số Deli Mã sản phẩm: E1710 Màu sản phẩm: Đen ------------------------------------------------------------------------------------------------------ Tự hào là một trong những nhãn hàng văn phòng phẩm lớn nhất tại Việt Nam, không ngừng nỗ lực và phát triển trong lĩnh vực phân phối các sản phẩm cho các đơn vị văn phòng, trường học,... Với phương châm sản xuất những sản phẩm chất lượng tốt nhất và luôn đặt khách hàng làm trọng tâm, sứ mệnh của Deli là làm hài hòng người tiêu dùng toàn cầu với những sản phẩm chất lượng cao, độ tin cậy tuyệt đối và thân thiện với người dùng. Khách hàng lựa chọn các sản phẩm của sẽ được cam kết: Sản phẩm chính hãng từ nhà máy Deli, nguồn gốc rõ ràng và chất lượng đạt tiêu chuẩn. Bảo hành theo quy định của nhà sản xuất. Giá cả hợp lý, cạnh tranh, rẻ nhất thị trường. Hỗ trợ đổi trả hàng cho những sản phẩm bị thiếu. Giá sản phẩm trên Tiki đã bao gồm thuế theo luật hiện hành. Bên cạnh đó, tuỳ vào loại sản phẩm, hình thức và địa chỉ giao hàng mà có thể phát sinh thêm chi phí khác như phí vận chuyển, phụ phí hàng cồng kềnh, thuế nhập khẩu (đối với đơn hàng giao từ nước ngoài có giá trị trên 1 triệu đồng)..... Sản phẩm này là tài sản cá nhân được bán bởi Nhà Bán Hàng Cá Nhân và không thuộc đối tượng phải chịu thuế GTGT. Do đó hoá đơn VAT không được cung cấp trong trường hợp này.",5,2,"https://salt.tikicdn.com/ts/product/f9/de/7c/9662733a9ce28bdad015fdbd954a3cc2.jpg, https://salt.tikicdn.com/ts/product/39/7f/51/bd9457f99f43127829481fe62450bf84.jpg, https://salt.tikicdn.com/ts/product/3f/7b/e7/40b3f21b1e4eb130a41eb586c8082331.jpg, https://salt.tikicdn.com/ts/product/fc/f5/3f/02e987e9b776506ccf8eba4f09332b72.jpg, https://salt.tikicdn.com/ts/product/64/1c/b2/3b74fc4de23b5ad957670a97a3ed94a8.jpg, https://salt.tikicdn.com/ts/product/5c/3a/6c/3b2fdb23ea8575a64cdc8264924fa0d6.jpg, https://salt.tikicdn.com/ts/product/b3/f9/33/3226c87085b017f36cf60a585da39535.jpg","https://salt.tikicdn.com/cache/w1200/ts/product/f9/de/7c/9662733a9ce28bdad015fdbd954a3cc2.jpg, https://salt.tikicdn.com/cache/w1200/ts/product/39/7f/51/bd9457f99f43127829481fe62450bf84.jpg, https://salt.tikicdn.com/cache/w1200/ts/product/3f/7b/e7/40b3f21b1e4eb130a41eb586c8082331.jpg, https://salt.tikicdn.com/cache/w1200/ts/product/fc/f5/3f/02e987e9b776506ccf8eba4f09332b72.jpg, https://salt.tikicdn.com/cache/w1200/ts/product/64/1c/b2/3b74fc4de23b5ad957670a97a3ed94a8.jpg, https://salt.tikicdn.com/cache/w1200/ts/product/5c/3a/6c/3b2fdb23ea8575a64cdc8264924fa0d6.jpg, https://salt.tikicdn.com/cache/w1200/ts/product/b3/f9/33/3226c87085b017f36cf60a585da39535.jpg","https://salt.tikicdn.com/cache/w300/ts/product/f9/de/7c/9662733a9ce28bdad015fdbd954a3cc2.jpg, https://salt.tikicdn.com/cache/w300/ts/product/39/7f/51/bd9457f99f43127829481fe62450bf84.jpg, https://salt.tikicdn.com/cache/w300/ts/product/3f/7b/e7/40b3f21b1e4eb130a41eb586c8082331.jpg, https://salt.tikicdn.com/cache/w300/ts/product/fc/f5/3f/02e987e9b776506ccf8eba4f09332b72.jpg, https://salt.tikicdn.com/cache/w300/ts/product/64/1c/b2/3b74fc4de23b5ad957670a97a3ed94a8.jpg, https://salt.tikicdn.com/cache/w300/ts/product/5c/3a/6c/3b2fdb23ea8575a64cdc8264924fa0d6.jpg, https://salt.tikicdn.com/cache/w300/ts/product/b3/f9/33/3226c87085b017f36cf60a585da39535.jpg","https://salt.tikicdn.com/cache/200x280/ts/product/f9/de/7c/9662733a9ce28bdad015fdbd954a3cc2.jpg, https://salt.tikicdn.com/cache/200x280/ts/product/39/7f/51/bd9457f99f43127829481fe62450bf84.jpg, https://salt.tikicdn.com/cache/200x280/ts/product/3f/7b/e7/40b3f21b1e4eb130a41eb586c8082331.jpg, https://salt.tikicdn.com/cache/200x280/ts/product/fc/f5/3f/02e987e9b776506ccf8eba4f09332b72.jpg, https://salt.tikicdn.com/cache/200x280/ts/product/64/1c/b2/3b74fc4de23b5ad957670a97a3ed94a8.jpg, https://salt.tikicdn.com/cache/200x280/ts/product/5c/3a/6c/3b2fdb23ea8575a64cdc8264924fa0d6.jpg, https://salt.tikicdn.com/cache/200x280/ts/product/b3/f9/33/3226c87085b017f36cf60a585da39535.jpg","https://salt.tikicdn.com/cache/200x280/ts/product/f9/de/7c/9662733a9ce28bdad015fdbd954a3cc2.jpg, https://salt.tikicdn.com/cache/200x280/ts/product/39/7f/51/bd9457f99f43127829481fe62450bf84.jpg, https://salt.tikicdn.com/cache/200x280/ts/product/3f/7b/e7/40b3f21b1e4eb130a41eb586c8082331.jpg, https://salt.tikicdn.com/cache/200x280/ts/product/fc/f5/3f/02e987e9b776506ccf8eba4f09332b72.jpg, https://salt.tikicdn.com/cache/200x280/ts/product/64/1c/b2/3b74fc4de23b5ad957670a97a3ed94a8.jpg, https://salt.tikicdn.com/cache/200x280/ts/product/5c/3a/6c/3b2fdb23ea8575a64cdc8264924fa0d6.jpg, https://salt.tikicdn.com/cache/200x280/ts/product/b3/f9/33/3226c87085b017f36cf60a585da39535.jpg",1000,2
276031379,Máy Tính Vinacal 680EX Plus - Màu Hồng,613700,    Máy Tính Vinacal 680EX Plus - Màu Hồng   - Thông số Kỹ Thuật:   + Nguồn cung cấp: Pin AAA x 1 viên. DC 1.5V.   + Kích thước máy: ngang x dày x cao (80mm x 20mm x 163mm)   + Trọng lượng máy:...,"Máy Tính Vinacal 680EX Plus - Màu Hồng - Thông số Kỹ Thuật: + Nguồn cung cấp: Pin AAA x 1 viên. DC 1.5V. + Kích thước máy: ngang x dày x cao (80mm x 20mm x 163mm) + Trọng lượng máy: 145 gr + Kiểu nắp: Trượt trên máy + Màn hình: Màn hình LCD; độ phân giải 192 x 63 điểm, được tăng gấp 4 lần, hỗ trợ tăng lượng thông tin hiển thị cũng như cải thiện tính tiện dụng của sản phẩm. - Tích hợp những chức năng ưu việt như: Giải phương trình, bất phương trình bậc 4; Chức năng phân phối (DISTRIBUTION), Tìm giới hạn Lim; Tìm ước chung lớn nhất, Bội chung nhỏ nhất, Giải MINMAX của Hàm số Bậc 3, …. Giá sản phẩm trên Tiki đã bao gồm thuế theo luật hiện hành. Bên cạnh đó, tuỳ vào loại sản phẩm, hình thức và địa chỉ giao hàng mà có thể phát sinh thêm chi phí khác như phí vận chuyển, phụ phí hàng cồng kềnh, thuế nhập khẩu (đối với đơn hàng giao từ nước ngoài có giá trị trên 1 triệu đồng).....",5,2,"https://salt.tikicdn.com/ts/product/e7/37/e6/b1b4eef927b79c8a436a8b64fb354d05.jpg, https://salt.tikicdn.com/ts/product/50/69/85/81ca5906b839b9f62cc6a1f4607e9ce8.jpg","https://salt.tikicdn.com/cache/w1200/ts/product/e7/37/e6/b1b4eef927b79c8a436a8b64fb354d05.jpg, https://salt.tikicdn.com/cache/w1200/ts/product/50/69/85/81ca5906b839b9f62cc6a1f4607e9ce8.jpg","https://salt.tikicdn.com/cache/w300/ts/product/e7/37/e6/b1b4eef927b79c8a436a8b64fb354d05.jpg, https://salt.tikicdn.com/cache/w300/ts/product/50/69/85/81ca5906b839b9f62cc6a1f4607e9ce8.jpg","https://salt.tikicdn.com/cache/200x280/ts/product/e7/37/e6/b1b4eef927b79c8a436a8b64fb354d05.jpg, https://salt.tikicdn.com/cache/200x280/ts/product/50/69/85/81ca5906b839b9f62cc6a1f4607e9ce8.jpg","https://salt.tikicdn.com/cache/200x280/ts/product/e7/37/e6/b1b4eef927b79c8a436a8b64fb354d05.jpg, https://salt.tikicdn.com/cache/200x280/ts/product/50/69/85/81ca5906b839b9f62cc6a1f4607e9ce8.jpg",1000,2
276031365,Máy Tính Vinacal 570ES Plus II - Màu Xanh Dương,437000,    Máy Tính Vinacal 570ES Plus II - Màu Xanh Dương   - Chuyên dùng cho học sinh cấp 2 và 3.   - Tính Năng Chi Tiết:   + Số tính năng: 452 Tính năng   + Màn hình: thể hiện 15 số và hiển thị như...,"Máy Tính Vinacal 570ES Plus II - Màu Xanh Dương - Chuyên dùng cho học sinh cấp 2 và 3. - Tính Năng Chi Tiết: + Số tính năng: 452 Tính năng + Màn hình: thể hiện 15 số và hiển thị như sách giáo khoa + Tính năng đặc biệt: Tìm giới hạn; Lưu nghiệm phương trình & hệ phương trình; tính tích của dãy số; Hiển thị khi hệ phương trình vô nghiệm/vô số nghiệm; tìm cực trị hàm số parabol; Tính và hiển thị dưới dạng số thập phân vô hạn tuần hoàn; giải phương trình Bậc 4; Kiểm chứng tín năng đúng sai. + Tính năng khác: Phép chia có dư, Bộ nhớ trước PreAns, Int,Ingt, lưu nghiệm khi giải phương trình, tính lũy thừa bậc 4 trở lên cho số phức, Hiển thị kết quả thể hiện dạng phân số, căn thức, Có thể xem lại các bước trước đó để chỉnh sửa và thực hiện lại… - Thông số Kỹ Thuật: + Nguồn cung cấp: LR44 x 1 viên. + Kích thước máy: Dày x ngang x dài (14 x 80 x 153) + Trọng lượng máy (kể cả pin) 95g + Kiểu nắp: Trượt trên máy + Hiển thị ma trận điểm: 31 x 96 - Những tiện ích: Chức năng phím cuộn; chức năng hiển thị lại; chức năng copy lại; phím lùi; tính năng CALC; Tính năng SOLVE; Tính năng ANS; số nhớ;…. - Bán kèm theo máy: Hộp, thẻ bảo hành, sách hướng dẫn sử dụng. - Bảo hành 2 năm với linh kiện chính hãng. Giá sản phẩm trên Tiki đã bao gồm thuế theo luật hiện hành. Bên cạnh đó, tuỳ vào loại sản phẩm, hình thức và địa chỉ giao hàng mà có thể phát sinh thêm chi phí khác như phí vận chuyển, phụ phí hàng cồng kềnh, thuế nhập khẩu (đối với đơn hàng giao từ nước ngoài có giá trị trên 1 triệu đồng).....",5,1,"https://salt.tikicdn.com/ts/product/aa/6e/b6/b90461b7dfd34557f10c0bb53725bde8.jpg, https://salt.tikicdn.com/ts/product/62/f9/8a/5fc0d5b7924863aaf473dd0ebc0654a9.jpg","https://salt.tikicdn.com/cache/w1200/ts/product/aa/6e/b6/b90461b7dfd34557f10c0bb53725bde8.jpg, https://salt.tikicdn.com/cache/w1200/ts/product/62/f9/8a/5fc0d5b7924863aaf473dd0ebc0654a9.jpg","https://salt.tikicdn.com/cache/w300/ts/product/aa/6e/b6/b90461b7dfd34557f10c0bb53725bde8.jpg, https://salt.tikicdn.com/cache/w300/ts/product/62/f9/8a/5fc0d5b7924863aaf473dd0ebc0654a9.jpg","https://salt.tikicdn.com/cache/200x280/ts/product/aa/6e/b6/b90461b7dfd34557f10c0bb53725bde8.jpg, https://salt.tikicdn.com/cache/200x280/ts/product/62/f9/8a/5fc0d5b7924863aaf473dd0ebc0654a9.jpg","https://salt.tikicdn.com/cache/200x280/ts/product/aa/6e/b6/b90461b7dfd34557f10c0bb53725bde8.jpg, https://salt.tikicdn.com/cache/200x280/ts/product/62/f9/8a/5fc0d5b7924863aaf473dd0ebc0654a9.jpg",1000,1
275971025,Máy Tính Văn Phòng Flexio - Thiên Long CAL-008 - Màu Hồng,104900,"    Máy Tính Văn Phòng Flexio - Thiên Long CAL-008 - Màu Hồng   - Máy tính văn phòng CAL-008 đa năng này phù hợp sử dụng tại nhà, trường học, văn phòng hoặc cửa hàng. Sự kết hợp chíp xử lý và mạch...","Máy Tính Văn Phòng Flexio - Thiên Long CAL-008 - Màu Hồng - Máy tính văn phòng CAL-008 đa năng này phù hợp sử dụng tại nhà, trường học, văn phòng hoặc cửa hàng. Sự kết hợp chíp xử lý và mạch điều khiển công nghệ hiện đại đưa ra những kết quả phép tính đáng tin cậy, nhanh chóng đáp ứng tốt cho mục đích cá nhân hoặc chuyên nghiệp. - Nhỏ gọn và di động, bạn có thể dễ dàng mang theo bất cứ mọi nơi. - Bộ vỏ nguyên liệu ABS cao cấp, bền và sử dụng thiết kế thân thiện, máy tính văn phòng CAL-008 cung cấp sự tiện lợi và hiệu quả trong tất cả các nhu cầu tính toán. - Tính năng tự động : Không sử dụng tự tắt nguồn (8~13 phút) - Màn hình : LCD - Kích thước máy tính : 155.8 x 99.5 mm - Độ bền phím : ~1.000.000 lần bấm (F<85g) - Loại pin : AAAx01 (1.5V) - Bảo hành : 60 tháng (1 đổi 1 trong 12 tháng đầu tiên) Giá sản phẩm trên Tiki đã bao gồm thuế theo luật hiện hành. Bên cạnh đó, tuỳ vào loại sản phẩm, hình thức và địa chỉ giao hàng mà có thể phát sinh thêm chi phí khác như phí vận chuyển, phụ phí hàng cồng kềnh, thuế nhập khẩu (đối với đơn hàng giao từ nước ngoài có giá trị trên 1 triệu đồng).....",0,0,"https://salt.tikicdn.com/ts/product/d6/40/44/1c57291dd4d93096956a11badbb76d59.jpg, https://salt.tikicdn.com/ts/product/04/89/da/57b02f444d119cd04ce02e57f6053d8c.jpg","https://salt.tikicdn.com/cache/w1200/ts/product/d6/40/44/1c57291dd4d93096956a11badbb76d59.jpg, https://salt.tikicdn.com/cache/w1200/ts/product/04/89/da/57b02f444d119cd04ce02e57f6053d8c.jpg","https://salt.tikicdn.com/cache/w300/ts/product/d6/40/44/1c57291dd4d93096956a11badbb76d59.jpg, https://salt.tikicdn.com/cache/w300/ts/product/04/89/da/57b02f444d119cd04ce02e57f6053d8c.jpg","https://salt.tikicdn.com/cache/200x280/ts/product/d6/40/44/1c57291dd4d93096956a11badbb76d59.jpg, https://salt.tikicdn.com/cache/200x280/ts/product/04/89/da/57b02f444d119cd04ce02e57f6053d8c.jpg","https://salt.tikicdn.com/cache/200x280/ts/product/d6/40/44/1c57291dd4d93096956a11badbb76d59.jpg, https://salt.tikicdn.com/cache/200x280/ts/product/04/89/da/57b02f444d119cd04ce02e57f6053d8c.jpg",1000,0
275825599,Máy tính văn phòng Thiên Long Flexio CAL-011,189000, Thông số kĩ thuật :Thương hiệu FlexioTính năng tự động Không sử dụng tự tắt nguồn (8~13 phút)Màn hình LCDChất liệu ABSKích thước máy tính 152 x 131 mmĐộ bền phím ~500.000 lần bấm (...,"Thông số kĩ thuật : Thương hiệu Flexio Tính năng tự động Không sử dụng tự tắt nguồn (8~13 phút) Màn hình LCD Chất liệu ABS Kích thước máy tính 152 x 131 mm Độ bền phím ~500.000 lần bấm (F<70g) Loại pin AAA (1.55V) Xuất xứ Việt Nam Sản xuất Trung Quốc Bảo hành 60 tháng (1 đổi 1 trong 12 tháng đầu tiên) Khuyến cáo Tránh nguồn nhiệt, hóa chất. Không thích hợp cho trẻ dưới 3 tuổi. Đặc tính sản phẩm: - Máy tính văn phòng CAL-011 đa năng này phù hợp sử dụng tại nhà, trường học, văn phòng hoặc cửa hàng. Sự kết hợp chip xử lý và mạch điều khiển công nghệ hiện đại đưa ra những kết quả phép tính đáng tin cậy, nhanh chóng đáp ứng tốt cho mục đích cá nhân hoặc chuyên nghiệp. - Thiết kế nhỏ gọn và di động, bạn có thể dễ dàng mang theo bất cứ mọi nơi. - Bộ vỏ nguyên liệu ABS cao cấp, bền và sử dụng thiết kế thân thiện, máy tính văn phòng CAL-011 cung cấp sự tiện lợi và hiệu quả trong tất cả các nhu cầu tính toán. Giá sản phẩm trên Tiki đã bao gồm thuế theo luật hiện hành. Bên cạnh đó, tuỳ vào loại sản phẩm, hình thức và địa chỉ giao hàng mà có thể phát sinh thêm chi phí khác như phí vận chuyển, phụ phí hàng cồng kềnh, thuế nhập khẩu (đối với đơn hàng giao từ nước ngoài có giá trị trên 1 triệu đồng).....",0,0,"https://salt.tikicdn.com/ts/product/48/82/b0/bb026bd1398827a5e938b22e692705bc.jpg, https://salt.tikicdn.com/ts/product/26/bd/a6/ea7e083b5dba96c9c3d42ef1ecc0b902.jpg","https://salt.tikicdn.com/cache/w1200/ts/product/48/82/b0/bb026bd1398827a5e938b22e692705bc.jpg, https://salt.tikicdn.com/cache/w1200/ts/product/26/bd/a6/ea7e083b5dba96c9c3d42ef1ecc0b902.jpg","https://salt.tikicdn.com/cache/w300/ts/product/48/82/b0/bb026bd1398827a5e938b22e692705bc.jpg, https://salt.tikicdn.com/cache/w300/ts/product/26/bd/a6/ea7e083b5dba96c9c3d42ef1ecc0b902.jpg","https://salt.tikicdn.com/cache/200x280/ts/product/48/82/b0/bb026bd1398827a5e938b22e692705bc.jpg, https://salt.tikicdn.com/cache/200x280/ts/product/26/bd/a6/ea7e083b5dba96c9c3d42ef1ecc0b902.jpg","https://salt.tikicdn.com/cache/200x280/ts/product/48/82/b0/bb026bd1398827a5e938b22e692705bc.jpg, https://salt.tikicdn.com/cache/200x280/ts/product/26/bd/a6/ea7e083b5dba96c9c3d42ef1ecc0b902.jpg",1000,0
