id,name,price,short_description,description,rating_average,review_count,image_base_url,image_large_url,image_medium_url,image_small_url,image_thumbnail_url,stock,quantity_sold
276408312,"Gấu Bông Stitch Xanh Ôm Vịt, Thú Nhồi Bông Stitch Nhồi Bông Mềm Mịn Gấu Bông Nadu 35cm - Hàng Chính Hãng MINIIN",151050,"Gấu Bông Stitch Xanh Ôm Vịt, Thú Nhồi Bông Stitch Nhồi Bông Mềm Mịn Gấu Bông Nadu 35cm - Hàng Chính Hãng MINIINGấu Bông Stitch Xanh Ôm Vịt, Thú Nhồi Bông Stitch Nhồi Bông Mềm Mịn Gấu Bông NaduĐẶC Đ...","Gấu Bông Stitch Xanh Ôm Vịt, Thú Nhồi Bông Stitch Nhồi Bông Mềm Mịn Gấu Bông Nadu 35cm - Hàng Chính Hãng MINIIN Gấu Bông Stitch Xanh Ôm Vịt, Thú Nhồi Bông Stitch Nhồi Bông Mềm Mịn Gấu Bông Nadu ĐẶC ĐIỂM NỔI BẬT CỦA SẢN PHẨM - Gấu Bông Stitch Xanh Ôm Vịt là sản phẩm đang được bán chạy đây cũng là mẫu sản phẩm được nhiều khách hàng lựa chọn làm quà tặng cho các bé hoặc tặng cho người yêu những ngày lễ sắp tới . - Gấu Bông Stitch Xanh Ôm Vịt có vẻ bề ngoài cute dễ thương. - Gấu Bông Stitch Xanh Ôm Vịt được làm từ lông tuyết mềm mịn chống nhăn và khả năng phục hồi cực tốt. Ngoài ra chất liệu vải đảm bảo an toàn thân thiện với làn da cho mọi lứa tuổi . THÔNG TIN SẢN PHẨM - Tên sản phẩm: Gấu Bông Stitch Xanh Ôm Vịt, Thú Nhồi Bông Stitch Nhồi Bông Mềm Mịn Gấu Bông Nadu - Chất vải: Lông tuyết mềm mại - Chất liệu bông: bông gòn 7D PP cao cấp, loại bông này có độ bền tốt mềm và khả năng đàn hồi cao. - Kích thước: 60cm - Màu sắc: Màu hồng, màu xanh - Dành cho các dịp: Ngày lễ Kỷ niệm, quà tặng, quà lưu niệm Giá sản phẩm trên Tiki đã bao gồm thuế theo luật hiện hành. Bên cạnh đó, tuỳ vào loại sản phẩm, hình thức và địa chỉ giao hàng mà có thể phát sinh thêm chi phí khác như phí vận chuyển, phụ phí hàng cồng kềnh, thuế nhập khẩu (đối với đơn hàng giao từ nước ngoài có giá trị trên 1 triệu đồng).....",0,0,"https://salt.tikicdn.com/ts/product/1b/9e/5d/23e3063d5740d68c88282a19025ba062.jpg, https://salt.tikicdn.com/ts/product/d0/6b/41/54460cb23432e1193e6161e9a0ac938c.jpg, https://salt.tikicdn.com/ts/product/27/a9/17/d16d99a14cb00a05312331afb5f76633.jpg, https://salt.tikicdn.com/ts/product/df/33/bf/eabaf032071ed650dfe9f4893e6695cc.jpg, https://salt.tikicdn.com/ts/product/54/8b/02/99ecaa404b773892590eabccf9badab6.jpg, https://salt.tikicdn.com/ts/product/43/27/df/81b890a23be4f457d8927621b4815714.jpg, https://salt.tikicdn.com/ts/product/7d/91/66/e16c27a1b47e0618b120f9047a416474.jpg","https://salt.tikicdn.com/cache/w1200/ts/product/1b/9e/5d/23e3063d5740d68c88282a19025ba062.jpg, https://salt.tikicdn.com/cache/w1200/ts/product/d0/6b/41/54460cb23432e1193e6161e9a0ac938c.jpg, https://salt.tikicdn.com/cache/w1200/ts/product/27/a9/17/d16d99a14cb00a05312331afb5f76633.jpg, https://salt.tikicdn.com/cache/w1200/ts/product/df/33/bf/eabaf032071ed650dfe9f4893e6695cc.jpg, https://salt.tikicdn.com/cache/w1200/ts/product/54/8b/02/99ecaa404b773892590eabccf9badab6.jpg, https://salt.tikicdn.com/cache/w1200/ts/product/43/27/df/81b890a23be4f457d8927621b4815714.jpg, https://salt.tikicdn.com/cache/w1200/ts/product/7d/91/66/e16c27a1b47e0618b120f9047a416474.jpg","https://salt.tikicdn.com/cache/w300/ts/product/1b/9e/5d/23e3063d5740d68c88282a19025ba062.jpg, https://salt.tikicdn.com/cache/w300/ts/product/d0/6b/41/54460cb23432e1193e6161e9a0ac938c.jpg, https://salt.tikicdn.com/cache/w300/ts/product/27/a9/17/d16d99a14cb00a05312331afb5f76633.jpg, https://salt.tikicdn.com/cache/w300/ts/product/df/33/bf/eabaf032071ed650dfe9f4893e6695cc.jpg, https://salt.tikicdn.com/cache/w300/ts/product/54/8b/02/99ecaa404b773892590eabccf9badab6.jpg, https://salt.tikicdn.com/cache/w300/ts/product/43/27/df/81b890a23be4f457d8927621b4815714.jpg, https://salt.tikicdn.com/cache/w300/ts/product/7d/91/66/e16c27a1b47e0618b120f9047a416474.jpg","https://salt.tikicdn.com/cache/200x280/ts/product/1b/9e/5d/23e3063d5740d68c88282a19025ba062.jpg, https://salt.tikicdn.com/cache/200x280/ts/product/d0/6b/41/54460cb23432e1193e6161e9a0ac938c.jpg, https://salt.tikicdn.com/cache/200x280/ts/product/27/a9/17/d16d99a14cb00a05312331afb5f76633.jpg, https://salt.tikicdn.com/cache/200x280/ts/product/df/33/bf/eabaf032071ed650dfe9f4893e6695cc.jpg, https://salt.tikicdn.com/cache/200x280/ts/product/54/8b/02/99ecaa404b773892590eabccf9badab6.jpg, https://salt.tikicdn.com/cache/200x280/ts/product/43/27/df/81b890a23be4f457d8927621b4815714.jpg, https://salt.tikicdn.com/cache/200x280/ts/product/7d/91/66/e16c27a1b47e0618b120f9047a416474.jpg","https://salt.tikicdn.com/cache/200x280/ts/product/1b/9e/5d/23e3063d5740d68c88282a19025ba062.jpg, https://salt.tikicdn.com/cache/200x280/ts/product/d0/6b/41/54460cb23432e1193e6161e9a0ac938c.jpg, https://salt.tikicdn.com/cache/200x280/ts/product/27/a9/17/d16d99a14cb00a05312331afb5f76633.jpg, https://salt.tikicdn.com/cache/200x280/ts/product/df/33/bf/eabaf032071ed650dfe9f4893e6695cc.jpg, https://salt.tikicdn.com/cache/200x280/ts/product/54/8b/02/99ecaa404b773892590eabccf9badab6.jpg, https://salt.tikicdn.com/cache/200x280/ts/product/43/27/df/81b890a23be4f457d8927621b4815714.jpg, https://salt.tikicdn.com/cache/200x280/ts/product/7d/91/66/e16c27a1b47e0618b120f9047a416474.jpg",1000,0
276160694,Thú nhồi bông ngựa kỳ lân - Size 30cm - Quà tặng gấu bông kỳ lân sừng siêu dễ thương - Gối ôm mềm mịn cho bé Ngủ Ngon Đáng Yêu Thú Bông,200000,"ƯU ĐIỂM SẢN PHẨM :Thú bông lông mịn, cực kì mềm, ấm áp, để ôm mỗi tối thì khỏi chê.Chất liệu: nhung mềm mịn bền màu.Bông gòn nhồi bên trong 100% là bông gòn pp 3d trắng tinh khiết loại 1, độ ...","ƯU ĐIỂM SẢN PHẨM : Thú bông lông mịn, cực kì mềm, ấm áp, để ôm mỗi tối thì khỏi chê. Chất liệu: nhung mềm mịn bền màu. Bông gòn nhồi bên trong 100% là bông gòn pp 3d trắng tinh khiết loại 1, độ đàn hồi tốt. Thú bông an toàn cho người sử dụng. Thú bông để ôm, làm đồ chơi cho bé, trang trí xe nhà cửa, làm quà tặng, THÔNG TIN SẢN PHẨM : Màu sắc: hồng nude. Chất vải: nhung. Lớp vỏ ngoài sản phẩm được làm bằng vải cao cấp chuyên may gấu bông mang lại sự mềm mại và mượt mà. Đường may tỉ mỉ, hoạ tiết đắp thêu sắc sảo. Giá sản phẩm trên Tiki đã bao gồm thuế theo luật hiện hành. Bên cạnh đó, tuỳ vào loại sản phẩm, hình thức và địa chỉ giao hàng mà có thể phát sinh thêm chi phí khác như phí vận chuyển, phụ phí hàng cồng kềnh, thuế nhập khẩu (đối với đơn hàng giao từ nước ngoài có giá trị trên 1 triệu đồng).....",5,1,"https://salt.tikicdn.com/ts/product/30/22/6b/a9de38ae9ca672afda1f216a6269b6e1.jpg, https://salt.tikicdn.com/ts/product/f7/47/9e/f33d67688fe03439e60d4f9fad42f055.jpg, https://salt.tikicdn.com/ts/product/fc/a2/a8/ef1ed9932933ba7d8a829ee33df96c65.jpg","https://salt.tikicdn.com/cache/w1200/ts/product/30/22/6b/a9de38ae9ca672afda1f216a6269b6e1.jpg, https://salt.tikicdn.com/cache/w1200/ts/product/f7/47/9e/f33d67688fe03439e60d4f9fad42f055.jpg, https://salt.tikicdn.com/cache/w1200/ts/product/fc/a2/a8/ef1ed9932933ba7d8a829ee33df96c65.jpg","https://salt.tikicdn.com/cache/w300/ts/product/30/22/6b/a9de38ae9ca672afda1f216a6269b6e1.jpg, https://salt.tikicdn.com/cache/w300/ts/product/f7/47/9e/f33d67688fe03439e60d4f9fad42f055.jpg, https://salt.tikicdn.com/cache/w300/ts/product/fc/a2/a8/ef1ed9932933ba7d8a829ee33df96c65.jpg","https://salt.tikicdn.com/cache/200x280/ts/product/30/22/6b/a9de38ae9ca672afda1f216a6269b6e1.jpg, https://salt.tikicdn.com/cache/200x280/ts/product/f7/47/9e/f33d67688fe03439e60d4f9fad42f055.jpg, https://salt.tikicdn.com/cache/200x280/ts/product/fc/a2/a8/ef1ed9932933ba7d8a829ee33df96c65.jpg","https://salt.tikicdn.com/cache/200x280/ts/product/30/22/6b/a9de38ae9ca672afda1f216a6269b6e1.jpg, https://salt.tikicdn.com/cache/200x280/ts/product/f7/47/9e/f33d67688fe03439e60d4f9fad42f055.jpg, https://salt.tikicdn.com/cache/200x280/ts/product/fc/a2/a8/ef1ed9932933ba7d8a829ee33df96c65.jpg",1000,1
276088983,Đồ chơi thú bông hình thỏ 45cm VALUE TOYS M1-26,269000,THÔNG TIN SẢN PHẨM1. Tên sản phẩm: Đồ chơi thú bông hình thỏ 45cm2. Thương hiệu: Value Toys3. Mã sản phẩm: M1-264. Chất liệu: Vải Polyester và Cotton5. Kích thước: cao 45 cm6. Độ tuổi sử dụng: Dành ch...,"THÔNG TIN SẢN PHẨM 1. Tên sản phẩm: Đồ chơi thú bông hình thỏ 45cm 2. Thương hiệu: Value Toys 3. Mã sản phẩm: M1-26 4. Chất liệu: Vải Polyester và Cotton 5. Kích thước: cao 45 cm 6. Độ tuổi sử dụng: Dành cho trẻ trên 3 tuổi 7. Xuất xứ: Trung Quốc Giá sản phẩm trên Tiki đã bao gồm thuế theo luật hiện hành. Bên cạnh đó, tuỳ vào loại sản phẩm, hình thức và địa chỉ giao hàng mà có thể phát sinh thêm chi phí khác như phí vận chuyển, phụ phí hàng cồng kềnh, thuế nhập khẩu (đối với đơn hàng giao từ nước ngoài có giá trị trên 1 triệu đồng).....",0,0,"https://salt.tikicdn.com/ts/product/63/a5/c7/6502e7421d392e659bb0d3ba1267b323.jpg, https://salt.tikicdn.com/ts/product/76/45/76/50bbb05909a1bad944571579eeaba1d2.jpg, https://salt.tikicdn.com/ts/product/8e/0c/23/a1ae8574ffa040ca7c15f119c6462f0b.jpg, https://salt.tikicdn.com/ts/product/7b/47/fd/4de1d4b1d20854b6c479304e5a37616f.jpg","https://salt.tikicdn.com/cache/w1200/ts/product/63/a5/c7/6502e7421d392e659bb0d3ba1267b323.jpg, https://salt.tikicdn.com/cache/w1200/ts/product/76/45/76/50bbb05909a1bad944571579eeaba1d2.jpg, https://salt.tikicdn.com/cache/w1200/ts/product/8e/0c/23/a1ae8574ffa040ca7c15f119c6462f0b.jpg, https://salt.tikicdn.com/cache/w1200/ts/product/7b/47/fd/4de1d4b1d20854b6c479304e5a37616f.jpg","https://salt.tikicdn.com/cache/w300/ts/product/63/a5/c7/6502e7421d392e659bb0d3ba1267b323.jpg, https://salt.tikicdn.com/cache/w300/ts/product/76/45/76/50bbb05909a1bad944571579eeaba1d2.jpg, https://salt.tikicdn.com/cache/w300/ts/product/8e/0c/23/a1ae8574ffa040ca7c15f119c6462f0b.jpg, https://salt.tikicdn.com/cache/w300/ts/product/7b/47/fd/4de1d4b1d20854b6c479304e5a37616f.jpg","https://salt.tikicdn.com/cache/200x280/ts/product/63/a5/c7/6502e7421d392e659bb0d3ba1267b323.jpg, https://salt.tikicdn.com/cache/200x280/ts/product/76/45/76/50bbb05909a1bad944571579eeaba1d2.jpg, https://salt.tikicdn.com/cache/200x280/ts/product/8e/0c/23/a1ae8574ffa040ca7c15f119c6462f0b.jpg, https://salt.tikicdn.com/cache/200x280/ts/product/7b/47/fd/4de1d4b1d20854b6c479304e5a37616f.jpg","https://salt.tikicdn.com/cache/200x280/ts/product/63/a5/c7/6502e7421d392e659bb0d3ba1267b323.jpg, https://salt.tikicdn.com/cache/200x280/ts/product/76/45/76/50bbb05909a1bad944571579eeaba1d2.jpg, https://salt.tikicdn.com/cache/200x280/ts/product/8e/0c/23/a1ae8574ffa040ca7c15f119c6462f0b.jpg, https://salt.tikicdn.com/cache/200x280/ts/product/7b/47/fd/4de1d4b1d20854b6c479304e5a37616f.jpg",1000,0
276088937,Đồ chơi thú bông hình chú heo đội nón 45cm VALUE TOYS M1-23,229000,THÔNG TIN SẢN PHẨM1. Tên sản phẩm: Đồ chơi thú bông hình chú heo đội nón 45cm2. Thương hiệu: Value Toys3. Mã sản phẩm: M1-234. Chất liệu: Vải Polyester và Cotton5. Kích thước: cao 45 cm6. Độ tuổi sử d...,"THÔNG TIN SẢN PHẨM 1. Tên sản phẩm: Đồ chơi thú bông hình chú heo đội nón 45cm 2. Thương hiệu: Value Toys 3. Mã sản phẩm: M1-23 4. Chất liệu: Vải Polyester và Cotton 5. Kích thước: cao 45 cm 6. Độ tuổi sử dụng: Dành cho trẻ trên 3 tuổi 7. Xuất xứ: Trung Quốc Giá sản phẩm trên Tiki đã bao gồm thuế theo luật hiện hành. Bên cạnh đó, tuỳ vào loại sản phẩm, hình thức và địa chỉ giao hàng mà có thể phát sinh thêm chi phí khác như phí vận chuyển, phụ phí hàng cồng kềnh, thuế nhập khẩu (đối với đơn hàng giao từ nước ngoài có giá trị trên 1 triệu đồng).....",0,0,"https://salt.tikicdn.com/ts/product/cd/dc/6f/6c324afee29e59fc29ff2c95eb62e791.jpg, https://salt.tikicdn.com/ts/product/7a/0a/34/546d49976fc33c3b0ff863b096113d6a.jpg, https://salt.tikicdn.com/ts/product/ea/6f/35/a673de33ffa32a49ca885c35b6ea5de1.jpg","https://salt.tikicdn.com/cache/w1200/ts/product/cd/dc/6f/6c324afee29e59fc29ff2c95eb62e791.jpg, https://salt.tikicdn.com/cache/w1200/ts/product/7a/0a/34/546d49976fc33c3b0ff863b096113d6a.jpg, https://salt.tikicdn.com/cache/w1200/ts/product/ea/6f/35/a673de33ffa32a49ca885c35b6ea5de1.jpg","https://salt.tikicdn.com/cache/w300/ts/product/cd/dc/6f/6c324afee29e59fc29ff2c95eb62e791.jpg, https://salt.tikicdn.com/cache/w300/ts/product/7a/0a/34/546d49976fc33c3b0ff863b096113d6a.jpg, https://salt.tikicdn.com/cache/w300/ts/product/ea/6f/35/a673de33ffa32a49ca885c35b6ea5de1.jpg","https://salt.tikicdn.com/cache/200x280/ts/product/cd/dc/6f/6c324afee29e59fc29ff2c95eb62e791.jpg, https://salt.tikicdn.com/cache/200x280/ts/product/7a/0a/34/546d49976fc33c3b0ff863b096113d6a.jpg, https://salt.tikicdn.com/cache/200x280/ts/product/ea/6f/35/a673de33ffa32a49ca885c35b6ea5de1.jpg","https://salt.tikicdn.com/cache/200x280/ts/product/cd/dc/6f/6c324afee29e59fc29ff2c95eb62e791.jpg, https://salt.tikicdn.com/cache/200x280/ts/product/7a/0a/34/546d49976fc33c3b0ff863b096113d6a.jpg, https://salt.tikicdn.com/cache/200x280/ts/product/ea/6f/35/a673de33ffa32a49ca885c35b6ea5de1.jpg",1000,0
276088524,Đồ chơi thú bông hình sóc đội nón 45cm VALUE TOYS M1-24,269000,THÔNG TIN SẢN PHẨM1. Tên sản phẩm: Đồ chơi thú bông hình sóc đội nón 45cm2. Thương hiệu: Value Toys3. Mã sản phẩm: M1-244. Chất liệu: Vải Polyester và Cotton5. Kích thước: cao 45 cm6. Độ tuổi sử dụng:...,"THÔNG TIN SẢN PHẨM 1. Tên sản phẩm: Đồ chơi thú bông hình sóc đội nón 45cm 2. Thương hiệu: Value Toys 3. Mã sản phẩm: M1-24 4. Chất liệu: Vải Polyester và Cotton 5. Kích thước: cao 45 cm 6. Độ tuổi sử dụng: Dành cho trẻ trên 3 tuổi 7. Xuất xứ: Trung Quốc Giá sản phẩm trên Tiki đã bao gồm thuế theo luật hiện hành. Bên cạnh đó, tuỳ vào loại sản phẩm, hình thức và địa chỉ giao hàng mà có thể phát sinh thêm chi phí khác như phí vận chuyển, phụ phí hàng cồng kềnh, thuế nhập khẩu (đối với đơn hàng giao từ nước ngoài có giá trị trên 1 triệu đồng).....",0,0,"https://salt.tikicdn.com/ts/product/5a/4e/2f/c5c38cadbffdd089dce46226a9d26256.jpg, https://salt.tikicdn.com/ts/product/0e/62/15/d2ae02c6534ee1012db4cf087b60a034.jpg, https://salt.tikicdn.com/ts/product/de/26/30/3bc322cc3c09b61e124b6c9ddc56eb7f.jpg, https://salt.tikicdn.com/ts/product/e0/7d/10/63ff225876787e94565d092c58dbe2cc.jpg, https://salt.tikicdn.com/ts/product/06/94/01/70e6fda1d1d538280a09f859fd67d2f9.jpg","https://salt.tikicdn.com/cache/w1200/ts/product/5a/4e/2f/c5c38cadbffdd089dce46226a9d26256.jpg, https://salt.tikicdn.com/cache/w1200/ts/product/0e/62/15/d2ae02c6534ee1012db4cf087b60a034.jpg, https://salt.tikicdn.com/cache/w1200/ts/product/de/26/30/3bc322cc3c09b61e124b6c9ddc56eb7f.jpg, https://salt.tikicdn.com/cache/w1200/ts/product/e0/7d/10/63ff225876787e94565d092c58dbe2cc.jpg, https://salt.tikicdn.com/cache/w1200/ts/product/06/94/01/70e6fda1d1d538280a09f859fd67d2f9.jpg","https://salt.tikicdn.com/cache/w300/ts/product/5a/4e/2f/c5c38cadbffdd089dce46226a9d26256.jpg, https://salt.tikicdn.com/cache/w300/ts/product/0e/62/15/d2ae02c6534ee1012db4cf087b60a034.jpg, https://salt.tikicdn.com/cache/w300/ts/product/de/26/30/3bc322cc3c09b61e124b6c9ddc56eb7f.jpg, https://salt.tikicdn.com/cache/w300/ts/product/e0/7d/10/63ff225876787e94565d092c58dbe2cc.jpg, https://salt.tikicdn.com/cache/w300/ts/product/06/94/01/70e6fda1d1d538280a09f859fd67d2f9.jpg","https://salt.tikicdn.com/cache/200x280/ts/product/5a/4e/2f/c5c38cadbffdd089dce46226a9d26256.jpg, https://salt.tikicdn.com/cache/200x280/ts/product/0e/62/15/d2ae02c6534ee1012db4cf087b60a034.jpg, https://salt.tikicdn.com/cache/200x280/ts/product/de/26/30/3bc322cc3c09b61e124b6c9ddc56eb7f.jpg, https://salt.tikicdn.com/cache/200x280/ts/product/e0/7d/10/63ff225876787e94565d092c58dbe2cc.jpg, https://salt.tikicdn.com/cache/200x280/ts/product/06/94/01/70e6fda1d1d538280a09f859fd67d2f9.jpg","https://salt.tikicdn.com/cache/200x280/ts/product/5a/4e/2f/c5c38cadbffdd089dce46226a9d26256.jpg, https://salt.tikicdn.com/cache/200x280/ts/product/0e/62/15/d2ae02c6534ee1012db4cf087b60a034.jpg, https://salt.tikicdn.com/cache/200x280/ts/product/de/26/30/3bc322cc3c09b61e124b6c9ddc56eb7f.jpg, https://salt.tikicdn.com/cache/200x280/ts/product/e0/7d/10/63ff225876787e94565d092c58dbe2cc.jpg, https://salt.tikicdn.com/cache/200x280/ts/product/06/94/01/70e6fda1d1d538280a09f859fd67d2f9.jpg",1000,0
276002972,Gấu nhồi bông TOKDODO gối ôm hình thú .,89000,"Gối ôm gấu bông hình thú nhồi bông ngộ nghĩnh đáng yêu chất lượng mềm mịnTHÔNG TIN SẢN PHẨM- Tên sản phẩm: Gối ôm gấu bông hình thú nhồi bông- Chất liệu: Nhung mịn cao cấp, co dãn đa chiều, không b...","Gối ôm gấu bông hình thú nhồi bông ngộ nghĩnh đáng yêu chất lượng mềm mịn THÔNG TIN SẢN PHẨM - Tên sản phẩm: Gối ôm gấu bông hình thú nhồi bông - Chất liệu: Nhung mịn cao cấp, co dãn đa chiều, không bị rụng lông, cực kỳ an toàn cho bé - Màu sắc: nhiều loại màu sắc khác nhau - Kích thước: 55cm - Tính năng: Để ôm ngủ, để tặng bạn gái, để tặng quà sinh nhật. Đặc biệt các bé rất thích ôm những chú gấu bông. - Sản phẩm được sản xuất với qui trình nghiêm ngặt. Gối ôm gấu bông hình thú nhồi bông,cam kết đúng phân loại, chất lượng. - Xuất xứ: Việt Nam Gối ôm gấu bông hình thú nhồi bông được sản xuất từ chất liệu nhung mịn cao cấp, mềm mại mang lại trải nghiệm thư giãn thông qua việc chơi cùng bé hoặc bạn bè. - Gối ôm gấu bông hình thú nhồi bông dáng nhỏ nhắn, dễ dàng ôm, mang theo bất kỳ đâu. - Chất liệu nhung mịn mềm mại , không rụng lông, an toàn cho người sử dụng. - Phù hợp với mọi lứa tuổi. - Phù hợp làm quà tặng hoặc để sử dụng. QUY TRÌNH ĐÓNG GÓI GẤU BÔNG: - Gối ôm gấu bông hình thú nhồi bông được đựng trong hộp hoặc túi đóng gói cẩn thận. - Nếu sản phẩm cỡ to, sẽ được hút chân không nhỏ gọn để đảm bảo vận chuyển dễ dàng. - Sau khi nhận hàng bạn vỗ đều sản phẩm để bông gòn được căng phồng như ban đầu. HƯỚNG DẪN BẢO QUẢN: - Phân loại và giặt riêng các sản phẩm khác màu. - Không ngâm sản phẩm với nước xả vải quá 20 phút. - Không sử dụng nước nóng để giặt đồ. Giá sản phẩm trên Tiki đã bao gồm thuế theo luật hiện hành. Bên cạnh đó, tuỳ vào loại sản phẩm, hình thức và địa chỉ giao hàng mà có thể phát sinh thêm chi phí khác như phí vận chuyển, phụ phí hàng cồng kềnh, thuế nhập khẩu (đối với đơn hàng giao từ nước ngoài có giá trị trên 1 triệu đồng).....",0,0,"https://salt.tikicdn.com/ts/product/91/7e/99/c4a31889b41b776ee2fb43d867e831e5.jpg, https://salt.tikicdn.com/ts/product/01/a1/e9/5726dff88cf3e6f3fd6487ea0fb3e5a7.jpg, https://salt.tikicdn.com/ts/product/10/af/2d/46b8eec40eb9d3b34b49a0fecaebf2c7.jpg, https://salt.tikicdn.com/ts/product/26/6f/c2/cc45e78598d74bd5486ad9a597ffcbb0.jpg","https://salt.tikicdn.com/cache/w1200/ts/product/91/7e/99/c4a31889b41b776ee2fb43d867e831e5.jpg, https://salt.tikicdn.com/cache/w1200/ts/product/01/a1/e9/5726dff88cf3e6f3fd6487ea0fb3e5a7.jpg, https://salt.tikicdn.com/cache/w1200/ts/product/10/af/2d/46b8eec40eb9d3b34b49a0fecaebf2c7.jpg, https://salt.tikicdn.com/cache/w1200/ts/product/26/6f/c2/cc45e78598d74bd5486ad9a597ffcbb0.jpg","https://salt.tikicdn.com/cache/w300/ts/product/91/7e/99/c4a31889b41b776ee2fb43d867e831e5.jpg, https://salt.tikicdn.com/cache/w300/ts/product/01/a1/e9/5726dff88cf3e6f3fd6487ea0fb3e5a7.jpg, https://salt.tikicdn.com/cache/w300/ts/product/10/af/2d/46b8eec40eb9d3b34b49a0fecaebf2c7.jpg, https://salt.tikicdn.com/cache/w300/ts/product/26/6f/c2/cc45e78598d74bd5486ad9a597ffcbb0.jpg","https://salt.tikicdn.com/cache/200x280/ts/product/91/7e/99/c4a31889b41b776ee2fb43d867e831e5.jpg, https://salt.tikicdn.com/cache/200x280/ts/product/01/a1/e9/5726dff88cf3e6f3fd6487ea0fb3e5a7.jpg, https://salt.tikicdn.com/cache/200x280/ts/product/10/af/2d/46b8eec40eb9d3b34b49a0fecaebf2c7.jpg, https://salt.tikicdn.com/cache/200x280/ts/product/26/6f/c2/cc45e78598d74bd5486ad9a597ffcbb0.jpg","https://salt.tikicdn.com/cache/200x280/ts/product/91/7e/99/c4a31889b41b776ee2fb43d867e831e5.jpg, https://salt.tikicdn.com/cache/200x280/ts/product/01/a1/e9/5726dff88cf3e6f3fd6487ea0fb3e5a7.jpg, https://salt.tikicdn.com/cache/200x280/ts/product/10/af/2d/46b8eec40eb9d3b34b49a0fecaebf2c7.jpg, https://salt.tikicdn.com/cache/200x280/ts/product/26/6f/c2/cc45e78598d74bd5486ad9a597ffcbb0.jpg",1000,0
