id,name,price,short_description,description,rating_average,review_count,image_base_url,image_large_url,image_medium_url,image_small_url,image_thumbnail_url,stock,quantity_sold
275230772,Gấu Bông Heo Mắt Tròn Niềm Vui Ngơ Ngác Love u - Màu Hồng 40cm DRU - Hàng Chính Hãng,201000,"Gấu Bông Heo Mắt Tròn Niềm Vui Ngơ Ngác Love u - Màu Hồng 40cmĐược làm từ chất liệu vải vải menbo lông ngắn, gòn PP, mịn đẹp, không bị xơ cứng và rụng lông, bảo đảm an toàn cho trẻ nhỏ.Thiết kế xinh...","Gấu Bông Heo Mắt Tròn Niềm Vui Ngơ Ngác Love u - Màu Hồng 40cm Được làm từ chất liệu vải vải menbo lông ngắn, gòn PP, mịn đẹp, không bị xơ cứng và rụng lông, bảo đảm an toàn cho trẻ nhỏ. Thiết kế xinh xắn với hình ảnh chú voi xanh đáng yêu, ngộ nghĩnh. Sản phẩm không chứa các thành phần độc hại, đảm bảo an toàn cho sức khỏe người sử dụng. Bên trong thú được nhồi lớp bông gòn nhân tạo có độ phồng và đàn hồi cao, khi ôm tạo cảm giác thoải mái, dễ chịu. Đường may chắc chắn, tỉ mỉ, vừa mang tính thẩm mỹ cao vừa hạn chế tối đa tình trạng bung rách, đứt chỉ. Sản phẩm không chỉ là món vật dụng trang trí cho không gian sống thêm sinh động mà còn là món quà dễ thương dành tặng người thân, bạn bè. 1. Cam kết hàng hóa với khách hàng : - Hình ảnh được chụp từ sản phẩm thực tế tại shop. - Hàng mới 100%, đã kiểm tra kỹ trước khi giao cho khách hàng. 2. Chế độ đổi trả và bảo hành : - Đổi mới hàng hoá bị lỗi hoặc hư hỏng do vận chuyển hoặc do nhà sản xuất. - Hàng không đúng chủng loại, mẫu mã như quý khách đặt hàng. - Không đủ số lượng, không đủ bộ như trong đơn hàng. - Không đạt chất lượng trong phạm vi bảo hành của nhà sản xuấ - Thoả thuận giữa shop và Khách hàng. 3. Trường hợp không đủ điều kiện áp dụng chính sách: - Quá 3 ngày kể từ khi Quý khách nhận hàng. - Gửi lại hàng không đúng mẫu mã, không phải hàng của shop 4. Thời Gian Vận Chuyển !!! - Sau khi đặt hàng 12 - 24h, Shop sẽ giao cho đơn vị vận chuyển. - Hồ Chí Minh, Các Thành Phố Lớn vận chuyển thêm khoảng 1 – 2 ngày. - Các Tỉnh Thành, Huyện, Xã, Ấp vận chuyển thêm khoảng 2 – 4 ngày. Hãy bấm theo dõi shop để nhận được nhiều ưu đãi. TRONG CUỘC SỐNG CÓ RẤT NHIỀU SỰ LỰA CHỌN. CẢM ƠN BẠN ĐÃ CHỌN CHÚNG TÔI. #gau #bong #heo #gaubong #gaunhoibong #heoombinhsua #heocondethuong #thubong #thunhoibong #gaubongcaocap #gaubongdangyeu #quatangnguoiyeu #quatang #dochoi #dochoichobe #dochoitreem Giá sản phẩm trên Tiki đã bao gồm thuế theo luật hiện hành. Bên cạnh đó, tuỳ vào loại sản phẩm, hình thức và địa chỉ giao hàng mà có thể phát sinh thêm chi phí khác như phí vận chuyển, phụ phí hàng cồng kềnh, thuế nhập khẩu (đối với đơn hàng giao từ nước ngoài có giá trị trên 1 triệu đồng).....",5,1,"https://salt.tikicdn.com/ts/product/f7/61/4c/5086141d6c2ef128394a267c14121ac3.jpg, https://salt.tikicdn.com/ts/product/14/34/13/7311e7f3aa723d27db302d79f52a2a1a.jpg, https://salt.tikicdn.com/ts/product/b0/bb/e7/ef4682606b5cc032bc92ada087d71e9c.jpg, https://salt.tikicdn.com/ts/product/28/1d/c1/9ef7d16090b08c486570b7524421535b.jpg","https://salt.tikicdn.com/cache/w1200/ts/product/f7/61/4c/5086141d6c2ef128394a267c14121ac3.jpg, https://salt.tikicdn.com/cache/w1200/ts/product/14/34/13/7311e7f3aa723d27db302d79f52a2a1a.jpg, https://salt.tikicdn.com/cache/w1200/ts/product/b0/bb/e7/ef4682606b5cc032bc92ada087d71e9c.jpg, https://salt.tikicdn.com/cache/w1200/ts/product/28/1d/c1/9ef7d16090b08c486570b7524421535b.jpg","https://salt.tikicdn.com/cache/w300/ts/product/f7/61/4c/5086141d6c2ef128394a267c14121ac3.jpg, https://salt.tikicdn.com/cache/w300/ts/product/14/34/13/7311e7f3aa723d27db302d79f52a2a1a.jpg, https://salt.tikicdn.com/cache/w300/ts/product/b0/bb/e7/ef4682606b5cc032bc92ada087d71e9c.jpg, https://salt.tikicdn.com/cache/w300/ts/product/28/1d/c1/9ef7d16090b08c486570b7524421535b.jpg","https://salt.tikicdn.com/cache/200x280/ts/product/f7/61/4c/5086141d6c2ef128394a267c14121ac3.jpg, https://salt.tikicdn.com/cache/200x280/ts/product/14/34/13/7311e7f3aa723d27db302d79f52a2a1a.jpg, https://salt.tikicdn.com/cache/200x280/ts/product/b0/bb/e7/ef4682606b5cc032bc92ada087d71e9c.jpg, https://salt.tikicdn.com/cache/200x280/ts/product/28/1d/c1/9ef7d16090b08c486570b7524421535b.jpg","https://salt.tikicdn.com/cache/200x280/ts/product/f7/61/4c/5086141d6c2ef128394a267c14121ac3.jpg, https://salt.tikicdn.com/cache/200x280/ts/product/14/34/13/7311e7f3aa723d27db302d79f52a2a1a.jpg, https://salt.tikicdn.com/cache/200x280/ts/product/b0/bb/e7/ef4682606b5cc032bc92ada087d71e9c.jpg, https://salt.tikicdn.com/cache/200x280/ts/product/28/1d/c1/9ef7d16090b08c486570b7524421535b.jpg",1000,1
274544554,Bộ Thẻ Sưu Tập Nhân Vật Haikyu - Thẻ Snapmide Vol.2 - Ensky HK-SC02 (3 Cards Ngẫu Nhiên/Túi),105600,"    Bộ Thẻ Sưu Tập Nhân Vật Haikyu - Thẻ Snapmide Vol.2 - Ensky HK-SC02   Sản phẩm sưu tập mới nhất Snapmide Haikyu!! vol.2, một bộ sưu tập thẻ sưu tập độc đáo được lấy cảm hứng từ series anime/ma...","Bộ Thẻ Sưu Tập Nhân Vật Haikyu - Thẻ Snapmide Vol.2 - Ensky HK-SC02 Sản phẩm sưu tập mới nhất Snapmide Haikyu!! vol.2, một bộ sưu tập thẻ sưu tập độc đáo được lấy cảm hứng từ series anime/manga nổi tiếng Haikyu!!. Bộ sưu tập này bao gồm các thẻ có in hình ảnh chất lượng cao của các nhân vật yêu thích trong series, bao gồm các cảnh quan trọng, biểu cảm đặc trưng và những khoảnh khắc sôi động trên sân đấu. Với chất lượng in ấn tốt và thiết kế độc đáo, bộ sưu tập này là một món quà tuyệt vời cho các fan của ""Haikyu!!"" Mỗi thẻ được thiết kế cẩn thận để tái hiện lại đặc điểm nổi bật của từng nhân vật và sự kiện trong câu chuyện, từ sự quyết tâm của Hinata đến sự lãng mạn của Kageyama, bộ sưu tập này mang lại cho người hâm mộ sự sáng tạo và tiện ích đa dạng, từ việc trang trí đến trò chơi và thu thập. Mỗi thẻ trong bộ sưu tập đều được chọn lọc kỹ lưỡng và thiết kế đặc biệt để tái hiện chân thực nhân vật và tình huống trong “Haikyu!!”. Từ các cảnh quan trọng trên sân đấu đến những biểu cảm sâu sắc của các nhân vật chính, mỗi thẻ đều chứa đựng một phần của thế giới đầy sức sống của “Haikyu!!”. Chất lượng in ấn cao cấp giúp tái hiện màu sắc sắc nét và chi tiết tinh tế, mang lại trải nghiệm hấp dẫn cho người sưu tập. Giá sản phẩm trên Tiki đã bao gồm thuế theo luật hiện hành. Bên cạnh đó, tuỳ vào loại sản phẩm, hình thức và địa chỉ giao hàng mà có thể phát sinh thêm chi phí khác như phí vận chuyển, phụ phí hàng cồng kềnh, thuế nhập khẩu (đối với đơn hàng giao từ nước ngoài có giá trị trên 1 triệu đồng).....",0,0,"https://salt.tikicdn.com/ts/product/96/40/74/52e870095d64b6244b15be5cfb94cd5e.jpg, https://salt.tikicdn.com/ts/product/92/a2/dc/4dc60df81cc41c90b5361a6af168ad71.jpg, https://salt.tikicdn.com/ts/product/f4/d3/7a/c6771b5a80c8f167ddea2ff67d35952f.jpg, https://salt.tikicdn.com/ts/product/ca/89/24/c9fe2cbf98d2c7d4550b1f53b557e522.jpg, https://salt.tikicdn.com/ts/product/40/2f/e1/21272261931b21369790cd9d54c36842.jpg, https://salt.tikicdn.com/ts/product/b4/f2/f3/94b7c23d2ffef07702fbb86ffac4711f.jpg, https://salt.tikicdn.com/ts/product/ca/e6/4f/43b8b9ddc6edfe78bd08e9980e1eaacf.jpg, https://salt.tikicdn.com/ts/product/3f/36/46/e6860a70697e88e9ccfa7c35595ffd1d.jpg, https://salt.tikicdn.com/ts/product/96/df/78/3ab83f104bc7d94764c4d116216c70ab.jpg","https://salt.tikicdn.com/cache/w1200/ts/product/96/40/74/52e870095d64b6244b15be5cfb94cd5e.jpg, https://salt.tikicdn.com/cache/w1200/ts/product/92/a2/dc/4dc60df81cc41c90b5361a6af168ad71.jpg, https://salt.tikicdn.com/cache/w1200/ts/product/f4/d3/7a/c6771b5a80c8f167ddea2ff67d35952f.jpg, https://salt.tikicdn.com/cache/w1200/ts/product/ca/89/24/c9fe2cbf98d2c7d4550b1f53b557e522.jpg, https://salt.tikicdn.com/cache/w1200/ts/product/40/2f/e1/21272261931b21369790cd9d54c36842.jpg, https://salt.tikicdn.com/cache/w1200/ts/product/b4/f2/f3/94b7c23d2ffef07702fbb86ffac4711f.jpg, https://salt.tikicdn.com/cache/w1200/ts/product/ca/e6/4f/43b8b9ddc6edfe78bd08e9980e1eaacf.jpg, https://salt.tikicdn.com/cache/w1200/ts/product/3f/36/46/e6860a70697e88e9ccfa7c35595ffd1d.jpg, https://salt.tikicdn.com/cache/w1200/ts/product/96/df/78/3ab83f104bc7d94764c4d116216c70ab.jpg","https://salt.tikicdn.com/cache/w300/ts/product/96/40/74/52e870095d64b6244b15be5cfb94cd5e.jpg, https://salt.tikicdn.com/cache/w300/ts/product/92/a2/dc/4dc60df81cc41c90b5361a6af168ad71.jpg, https://salt.tikicdn.com/cache/w300/ts/product/f4/d3/7a/c6771b5a80c8f167ddea2ff67d35952f.jpg, https://salt.tikicdn.com/cache/w300/ts/product/ca/89/24/c9fe2cbf98d2c7d4550b1f53b557e522.jpg, https://salt.tikicdn.com/cache/w300/ts/product/40/2f/e1/21272261931b21369790cd9d54c36842.jpg, https://salt.tikicdn.com/cache/w300/ts/product/b4/f2/f3/94b7c23d2ffef07702fbb86ffac4711f.jpg, https://salt.tikicdn.com/cache/w300/ts/product/ca/e6/4f/43b8b9ddc6edfe78bd08e9980e1eaacf.jpg, https://salt.tikicdn.com/cache/w300/ts/product/3f/36/46/e6860a70697e88e9ccfa7c35595ffd1d.jpg, https://salt.tikicdn.com/cache/w300/ts/product/96/df/78/3ab83f104bc7d94764c4d116216c70ab.jpg","https://salt.tikicdn.com/cache/200x280/ts/product/96/40/74/52e870095d64b6244b15be5cfb94cd5e.jpg, https://salt.tikicdn.com/cache/200x280/ts/product/92/a2/dc/4dc60df81cc41c90b5361a6af168ad71.jpg, https://salt.tikicdn.com/cache/200x280/ts/product/f4/d3/7a/c6771b5a80c8f167ddea2ff67d35952f.jpg, https://salt.tikicdn.com/cache/200x280/ts/product/ca/89/24/c9fe2cbf98d2c7d4550b1f53b557e522.jpg, https://salt.tikicdn.com/cache/200x280/ts/product/40/2f/e1/21272261931b21369790cd9d54c36842.jpg, https://salt.tikicdn.com/cache/200x280/ts/product/b4/f2/f3/94b7c23d2ffef07702fbb86ffac4711f.jpg, https://salt.tikicdn.com/cache/200x280/ts/product/ca/e6/4f/43b8b9ddc6edfe78bd08e9980e1eaacf.jpg, https://salt.tikicdn.com/cache/200x280/ts/product/3f/36/46/e6860a70697e88e9ccfa7c35595ffd1d.jpg, https://salt.tikicdn.com/cache/200x280/ts/product/96/df/78/3ab83f104bc7d94764c4d116216c70ab.jpg","https://salt.tikicdn.com/cache/200x280/ts/product/96/40/74/52e870095d64b6244b15be5cfb94cd5e.jpg, https://salt.tikicdn.com/cache/200x280/ts/product/92/a2/dc/4dc60df81cc41c90b5361a6af168ad71.jpg, https://salt.tikicdn.com/cache/200x280/ts/product/f4/d3/7a/c6771b5a80c8f167ddea2ff67d35952f.jpg, https://salt.tikicdn.com/cache/200x280/ts/product/ca/89/24/c9fe2cbf98d2c7d4550b1f53b557e522.jpg, https://salt.tikicdn.com/cache/200x280/ts/product/40/2f/e1/21272261931b21369790cd9d54c36842.jpg, https://salt.tikicdn.com/cache/200x280/ts/product/b4/f2/f3/94b7c23d2ffef07702fbb86ffac4711f.jpg, https://salt.tikicdn.com/cache/200x280/ts/product/ca/e6/4f/43b8b9ddc6edfe78bd08e9980e1eaacf.jpg, https://salt.tikicdn.com/cache/200x280/ts/product/3f/36/46/e6860a70697e88e9ccfa7c35595ffd1d.jpg, https://salt.tikicdn.com/cache/200x280/ts/product/96/df/78/3ab83f104bc7d94764c4d116216c70ab.jpg",1000,0
274389636,"ĐÈN GÙ II (dùng khám bệnh thông thường, dùng sông ấm) Công suất 220V 60W - 250W ",1570000,Đèn gù xông ấm và khám bệnh có công tắc với nhiều ưu thế nổi trội luôn là sản phẩm được các bác sĩ ưa chuộng trong khám bệnh và xông ấm. Điện thế: Tùy thuộc vào bóng đèn Sử dụng công tắc Dây nguồn: 3m...,"Đèn gù xông ấm và khám bệnh có công tắc với nhiều ưu thế nổi trội luôn là sản phẩm được các bác sĩ ưa chuộng trong khám bệnh và xông ấm. Điện thế: Tùy thuộc vào bóng đèn Sử dụng công tắc Dây nguồn: 3m6 Điều chỉnh chiều cao từ 1m-1,7m Cố định vị xoay linh động đến gần 360o, khoảng rộng 30cm + 30cm Xuất xứ : Việt Nam Không có thoát nhiệt dùng để xông ấm. Sử dụng bóng đèn công suất. Đèn gù xông ấm và khám bệnh có công tắc với nhiều ưu thế nổi trội luôn là sản phẩm được các bác sĩ ưa chuộng trong khám bệnh và xông ấm. Điện thế: Tùy thuộc vào bóng đèn Sử dụng công tắc Dây nguồn: 3m6 Điều chỉnh chiều cao từ 1m-1,7m Cố định vị xoay linh động đến gần 360o, khoảng rộng 30cm + 30cm Xuất xứ : Việt Nam Không có thoát nhiệt dùng để xông ấm. Sử dụng bóng đèn công suất. Đèn gù xông ấm và khám bệnh có công tắc với nhiều ưu thế nổi trội luôn là sản phẩm được các bác sĩ ưa chuộng trong khám bệnh và xông ấm. Điện thế: Tùy thuộc vào bóng đèn Sử dụng công tắc Dây nguồn: 3m6 Điều chỉnh chiều cao từ 1m-1,7m Cố định vị xoay linh động đến gần 360o, khoảng rộng 30cm + 30cm Xuất xứ : Việt Nam Không có thoát nhiệt dùng để xông ấm. Sử dụng bóng đèn công suất. Giá sản phẩm trên Tiki đã bao gồm thuế theo luật hiện hành. Bên cạnh đó, tuỳ vào loại sản phẩm, hình thức và địa chỉ giao hàng mà có thể phát sinh thêm chi phí khác như phí vận chuyển, phụ phí hàng cồng kềnh, thuế nhập khẩu (đối với đơn hàng giao từ nước ngoài có giá trị trên 1 triệu đồng).....",0,0,"https://salt.tikicdn.com/ts/product/86/e2/39/4c5acd37ed8dc5297bebcc281027cb6e.png, https://salt.tikicdn.com/ts/product/0a/ec/c1/0ff3126cc91e1fa9de4fcc5fc7601a6f.png, https://salt.tikicdn.com/ts/product/19/aa/85/0b68b7a45a14f41f56130d9b4ea67831.png, https://salt.tikicdn.com/ts/product/4a/80/96/d13ea6cf7beb52feeb0345dbe4032104.png","https://salt.tikicdn.com/cache/w1200/ts/product/86/e2/39/4c5acd37ed8dc5297bebcc281027cb6e.png, https://salt.tikicdn.com/cache/w1200/ts/product/0a/ec/c1/0ff3126cc91e1fa9de4fcc5fc7601a6f.png, https://salt.tikicdn.com/cache/w1200/ts/product/19/aa/85/0b68b7a45a14f41f56130d9b4ea67831.png, https://salt.tikicdn.com/cache/w1200/ts/product/4a/80/96/d13ea6cf7beb52feeb0345dbe4032104.png","https://salt.tikicdn.com/cache/w300/ts/product/86/e2/39/4c5acd37ed8dc5297bebcc281027cb6e.png, https://salt.tikicdn.com/cache/w300/ts/product/0a/ec/c1/0ff3126cc91e1fa9de4fcc5fc7601a6f.png, https://salt.tikicdn.com/cache/w300/ts/product/19/aa/85/0b68b7a45a14f41f56130d9b4ea67831.png, https://salt.tikicdn.com/cache/w300/ts/product/4a/80/96/d13ea6cf7beb52feeb0345dbe4032104.png","https://salt.tikicdn.com/cache/200x280/ts/product/86/e2/39/4c5acd37ed8dc5297bebcc281027cb6e.png, https://salt.tikicdn.com/cache/200x280/ts/product/0a/ec/c1/0ff3126cc91e1fa9de4fcc5fc7601a6f.png, https://salt.tikicdn.com/cache/200x280/ts/product/19/aa/85/0b68b7a45a14f41f56130d9b4ea67831.png, https://salt.tikicdn.com/cache/200x280/ts/product/4a/80/96/d13ea6cf7beb52feeb0345dbe4032104.png","https://salt.tikicdn.com/cache/200x280/ts/product/86/e2/39/4c5acd37ed8dc5297bebcc281027cb6e.png, https://salt.tikicdn.com/cache/200x280/ts/product/0a/ec/c1/0ff3126cc91e1fa9de4fcc5fc7601a6f.png, https://salt.tikicdn.com/cache/200x280/ts/product/19/aa/85/0b68b7a45a14f41f56130d9b4ea67831.png, https://salt.tikicdn.com/cache/200x280/ts/product/4a/80/96/d13ea6cf7beb52feeb0345dbe4032104.png",1000,0
274170647,Thẻ Sưu Tập Nhân Vật Naruto - Kayou CN08 (5 Cards Ngẫu Nhiên/Túi),91100,"    Thẻ Sưu Tập Nhân Vật Naruto - Kayou CN08    Chất liệu thẻ cứng, độ bền cao, dành cho những bạn đam mê anime Naruto   Mức độ thẻ hiếm tham khảo ( 1>2>3>4>5>6>7)   1 Pack thư...","Thẻ Sưu Tập Nhân Vật Naruto - Kayou CN08 Chất liệu thẻ cứng, độ bền cao, dành cho những bạn đam mê anime Naruto Mức độ thẻ hiếm tham khảo ( 1>2>3>4>5>6>7) 1 Pack thường gồm 5 thẻ, 1 pack đặc biệt gồm 1 thẻ - Thứ tự thẻ hiếm: N, R, SR, SSR, UR, LR Sản phẩm dùng để sưu tầm hoặc làm quà tặng, đồ lưu niệm, trang trí phòng góc học tập cổ vũ tinh thần của các fan bộ truyện này. Giá sản phẩm trên Tiki đã bao gồm thuế theo luật hiện hành. Bên cạnh đó, tuỳ vào loại sản phẩm, hình thức và địa chỉ giao hàng mà có thể phát sinh thêm chi phí khác như phí vận chuyển, phụ phí hàng cồng kềnh, thuế nhập khẩu (đối với đơn hàng giao từ nước ngoài có giá trị trên 1 triệu đồng).....",0,0,"https://salt.tikicdn.com/ts/product/6f/27/3c/75aae7cd42f89496ccb6ef853bd8e1b5.jpg, https://salt.tikicdn.com/ts/product/7c/c4/9c/1485a3b4784d7865f3f51735ea2aba0b.jpg, https://salt.tikicdn.com/ts/product/55/04/60/255d9851ca840514a2d76bbf761ca25d.jpg, https://salt.tikicdn.com/ts/product/b4/49/14/fbcb3446279dabd036e4de3ecf2d0eee.jpg, https://salt.tikicdn.com/ts/product/59/76/39/a3b3572d3f09dd2a5a8b5cfabbc82824.jpg","https://salt.tikicdn.com/cache/w1200/ts/product/6f/27/3c/75aae7cd42f89496ccb6ef853bd8e1b5.jpg, https://salt.tikicdn.com/cache/w1200/ts/product/7c/c4/9c/1485a3b4784d7865f3f51735ea2aba0b.jpg, https://salt.tikicdn.com/cache/w1200/ts/product/55/04/60/255d9851ca840514a2d76bbf761ca25d.jpg, https://salt.tikicdn.com/cache/w1200/ts/product/b4/49/14/fbcb3446279dabd036e4de3ecf2d0eee.jpg, https://salt.tikicdn.com/cache/w1200/ts/product/59/76/39/a3b3572d3f09dd2a5a8b5cfabbc82824.jpg","https://salt.tikicdn.com/cache/w300/ts/product/6f/27/3c/75aae7cd42f89496ccb6ef853bd8e1b5.jpg, https://salt.tikicdn.com/cache/w300/ts/product/7c/c4/9c/1485a3b4784d7865f3f51735ea2aba0b.jpg, https://salt.tikicdn.com/cache/w300/ts/product/55/04/60/255d9851ca840514a2d76bbf761ca25d.jpg, https://salt.tikicdn.com/cache/w300/ts/product/b4/49/14/fbcb3446279dabd036e4de3ecf2d0eee.jpg, https://salt.tikicdn.com/cache/w300/ts/product/59/76/39/a3b3572d3f09dd2a5a8b5cfabbc82824.jpg","https://salt.tikicdn.com/cache/200x280/ts/product/6f/27/3c/75aae7cd42f89496ccb6ef853bd8e1b5.jpg, https://salt.tikicdn.com/cache/200x280/ts/product/7c/c4/9c/1485a3b4784d7865f3f51735ea2aba0b.jpg, https://salt.tikicdn.com/cache/200x280/ts/product/55/04/60/255d9851ca840514a2d76bbf761ca25d.jpg, https://salt.tikicdn.com/cache/200x280/ts/product/b4/49/14/fbcb3446279dabd036e4de3ecf2d0eee.jpg, https://salt.tikicdn.com/cache/200x280/ts/product/59/76/39/a3b3572d3f09dd2a5a8b5cfabbc82824.jpg","https://salt.tikicdn.com/cache/200x280/ts/product/6f/27/3c/75aae7cd42f89496ccb6ef853bd8e1b5.jpg, https://salt.tikicdn.com/cache/200x280/ts/product/7c/c4/9c/1485a3b4784d7865f3f51735ea2aba0b.jpg, https://salt.tikicdn.com/cache/200x280/ts/product/55/04/60/255d9851ca840514a2d76bbf761ca25d.jpg, https://salt.tikicdn.com/cache/200x280/ts/product/b4/49/14/fbcb3446279dabd036e4de3ecf2d0eee.jpg, https://salt.tikicdn.com/cache/200x280/ts/product/59/76/39/a3b3572d3f09dd2a5a8b5cfabbc82824.jpg",1000,0
217147712,"Cây xương rồng nhảy múa vui nhộn, uốn lượn, nhại tiếng, phát sáng - Xương rồng biết nói FUNU cao cấp - Hàng chính hãng",121500,"Cây xương rồng phát nhạc biết nhại lại tiếng vui nhộn - Tặng kèm 3 viên pin AA- Cây xương rồng có thể nhảy múa, hát, di chuyển, quay xung quanh.- Nhấn nút cây xương rồng sẽ lắc lư, lắc đầu và hát một...","Cây xương rồng phát nhạc biết nhại lại tiếng vui nhộn - Tặng kèm 3 viên pin AA - Cây xương rồng có thể nhảy múa, hát, di chuyển, quay xung quanh. - Nhấn nút cây xương rồng sẽ lắc lư, lắc đầu và hát một vui vẻ bài hát. - Thân mềm mại sang trọng chậu và vải xương rồng, đó là thoải mái khi chạm vào. - Cây xương rồng sẽ nhảy, nhót, nhại tiếng trong một vài giờ, cho trẻ em một thời gian hạnh phúc trong cuộc sống. - Xương rồng búp bê không chỉ là một đồ chơi trẻ em, nhưng cũng có thể được sử dụng để trang trí cho căn phòng của bạn. Xương rồng có thể nhại tiếng, hát và nhảy múa theo nhạc, phát sáng lung linh Quy cách: Chất liệu: Lông và Vải Chiều cao: 32cm/12.60inch Có 2 loai: -Loai1: 120 bài hát biết nhại lời lắc lư theo nhạc -Loại2: 3 bài hát lắc lư theo nhạc Chân thành cảm ơn quý khách!!! Giá sản phẩm trên Tiki đã bao gồm thuế theo luật hiện hành. Bên cạnh đó, tuỳ vào loại sản phẩm, hình thức và địa chỉ giao hàng mà có thể phát sinh thêm chi phí khác như phí vận chuyển, phụ phí hàng cồng kềnh, thuế nhập khẩu (đối với đơn hàng giao từ nước ngoài có giá trị trên 1 triệu đồng).....",4.6,94,"https://salt.tikicdn.com/ts/product/d8/4e/e8/55657b744254c56ebb83c56228551468.jpg, https://salt.tikicdn.com/ts/product/c8/0f/6b/dae1a320fbef8a5256f7b5e91a4a4385.png","https://salt.tikicdn.com/cache/w1200/ts/product/d8/4e/e8/55657b744254c56ebb83c56228551468.jpg, https://salt.tikicdn.com/cache/w1200/ts/product/c8/0f/6b/dae1a320fbef8a5256f7b5e91a4a4385.png","https://salt.tikicdn.com/cache/w300/ts/product/d8/4e/e8/55657b744254c56ebb83c56228551468.jpg, https://salt.tikicdn.com/cache/w300/ts/product/c8/0f/6b/dae1a320fbef8a5256f7b5e91a4a4385.png","https://salt.tikicdn.com/cache/200x280/ts/product/d8/4e/e8/55657b744254c56ebb83c56228551468.jpg, https://salt.tikicdn.com/cache/200x280/ts/product/c8/0f/6b/dae1a320fbef8a5256f7b5e91a4a4385.png","https://salt.tikicdn.com/cache/200x280/ts/product/d8/4e/e8/55657b744254c56ebb83c56228551468.jpg, https://salt.tikicdn.com/cache/200x280/ts/product/c8/0f/6b/dae1a320fbef8a5256f7b5e91a4a4385.png",1000,94
111572999,Thú nhồi bông Chuyện tào lao của Vàng Vàng - nhân vật Vàng Vàng,180000,"Vàng Vàng là nhân vật truyện tranh Việt Nam nổi tiếng, trong tác phẩm ""Chuyện tào lao của Vàng Vàng"", tác giả Phan Kim Thanh.Thông tin sản phẩmChất liệu: Bông và vải.Kích thước:Gấu bông Vàng Vàn...","Vàng Vàng là nhân vật truyện tranh Việt Nam nổi tiếng, trong tác phẩm ""Chuyện tào lao của Vàng Vàng"", tác giả Phan Kim Thanh. Thông tin sản phẩm Chất liệu: Bông và vải. Kích thước: Gấu bông Vàng Vàng – 30 cm. Gấu bông Misha – 35 cm. Sản xuất: Việt Nam. Phía bên ngoài gấu bông được làm từ vải mềm mại, tạo cảm giác cực đã khi ôm. Đặc biệt kích thước của gấu đã được tính toán sao cho phù hợp nhất với vòng tay của mọi người. Đường may chắc chắn, tỉ mỉ, đẹp mắt giúp gấu bông định hình rất tốt. Dù bạn ôm, gối đầu hay gác chân, nằm lên, hay thậm chí là khi giặt thì cũng không hề phải lo lắng chuyện mất form ban đầu. Phía bên trong được sử dụng các sợi bông siêu nhẹ nên dù kích cỡ có to cũng không lo các bé quá nặng, đồng thời vẫn tạo cảm giác êm ái khi ôm. Cách bảo quản Để làm sạch gấu bông bằng máy giặt, đừng quên cho gấu bông vào túi giặt nhé! Khi giặt bằng tay, đừng dùng bàn chải, vì lông của gấu bông sẽ bị xù lên. Nên hong khô bằng ánh nắng mặt trời tự nhiên để bảo quản gấu bông được lâu nhất. Giá sản phẩm trên Tiki đã bao gồm thuế theo luật hiện hành. Bên cạnh đó, tuỳ vào loại sản phẩm, hình thức và địa chỉ giao hàng mà có thể phát sinh thêm chi phí khác như phí vận chuyển, phụ phí hàng cồng kềnh, thuế nhập khẩu (đối với đơn hàng giao từ nước ngoài có giá trị trên 1 triệu đồng).....",4.5,7,"https://salt.tikicdn.com/ts/product/ac/98/ca/64a2ae860ef17887ff329817c48a92f5.jpeg, https://salt.tikicdn.com/ts/product/3f/02/77/15b2b0d151fc581c7cc89102e6acc419.jpg, https://salt.tikicdn.com/ts/product/df/8c/0e/688e42e9bdde0a759e3ec751796374df.jpg","https://salt.tikicdn.com/cache/w1200/ts/product/ac/98/ca/64a2ae860ef17887ff329817c48a92f5.jpeg, https://salt.tikicdn.com/cache/w1200/ts/product/3f/02/77/15b2b0d151fc581c7cc89102e6acc419.jpg, https://salt.tikicdn.com/cache/w1200/ts/product/df/8c/0e/688e42e9bdde0a759e3ec751796374df.jpg","https://salt.tikicdn.com/cache/w300/ts/product/ac/98/ca/64a2ae860ef17887ff329817c48a92f5.jpeg, https://salt.tikicdn.com/cache/w300/ts/product/3f/02/77/15b2b0d151fc581c7cc89102e6acc419.jpg, https://salt.tikicdn.com/cache/w300/ts/product/df/8c/0e/688e42e9bdde0a759e3ec751796374df.jpg","https://salt.tikicdn.com/cache/200x280/ts/product/ac/98/ca/64a2ae860ef17887ff329817c48a92f5.jpeg, https://salt.tikicdn.com/cache/200x280/ts/product/3f/02/77/15b2b0d151fc581c7cc89102e6acc419.jpg, https://salt.tikicdn.com/cache/200x280/ts/product/df/8c/0e/688e42e9bdde0a759e3ec751796374df.jpg","https://salt.tikicdn.com/cache/200x280/ts/product/ac/98/ca/64a2ae860ef17887ff329817c48a92f5.jpeg, https://salt.tikicdn.com/cache/200x280/ts/product/3f/02/77/15b2b0d151fc581c7cc89102e6acc419.jpg, https://salt.tikicdn.com/cache/200x280/ts/product/df/8c/0e/688e42e9bdde0a759e3ec751796374df.jpg",1000,7
