id,name,price,short_description,description,rating_average,review_count,image_base_url,image_large_url,image_medium_url,image_small_url,image_thumbnail_url,stock,quantity_sold
275761268,Bộ Thẻ Sưu Tập Thám Tử Lừng Danh Conan Movie 27 - Character in Photo : Ngôi Sao 5 Cánh 1 Triệu Đô - Phiên Bản Giới Hạn (5 Cards Ngẫu Nhiên/Túi),60000,"    Bộ Thẻ Sưu Tập Thám Tử Lừng Danh Conan Movie 27 - Character in Photo : Ngôi Sao 5 Cánh 1 Triệu Đô - Phiên Bản Giới Hạn (5 Cards Ngẫu Nhiên/Túi)   Những ngày vừa qua, các fans của Thám tử lừng ...","Bộ Thẻ Sưu Tập Thám Tử Lừng Danh Conan Movie 27 - Character in Photo : Ngôi Sao 5 Cánh 1 Triệu Đô - Phiên Bản Giới Hạn (5 Cards Ngẫu Nhiên/Túi) Những ngày vừa qua, các fans của Thám tử lừng danh Conan Việt Nam đứng ngồi không yên chờ đợi sự kiện ra mắt phim điện ảnh Thám tử lừng danh Conan: Ngôi Sao 5 Cánh 1 Triệu Đô , bộ phim làm mưa làm gió ngay từ khi được công chiếu tại Nhật Bản: vượt mốc doanh thu 960 triệu yên, 630.000 người xem trong ngày công chiếu đầu tiên. Trong 25 ngày công chiếu, Thám tử lừng danh Conan: Ngôi Sao 5 Cánh 1 Triệu Đô kiếm được tổng cộng 74 triệu đô, vượt doanh thu Thám tử lừng danh Conan:Tàu ngầm sắt màu đen tới 112%. Và một TIN CHẤN ĐỘNG bạn không thể bỏ lỡ, Ducky Card chính thức trình làng phiên bản đặc biệt giới hạn CARD COLLECTION: Thám tử lừng danh Conan: Ngôi Sao 5 Cánh 1 Triệu Đô Sau thành công của Card Collection Thám tử lừng danh Conan: Tàu ngầm sắt màu đen, Ducky Card cho ra mắt bộ sưu tập card collection official mới mà bất cứ fan chân chính nào của Thám tử lừng danh Conan cũng không thể bỏ qua. Bộ sưu tập gồm 2 phiên bản: Đây là bộ sưu tập CHÍNH THỨC phiên bản GIỚI HẠN được Ducky Card phát hành CHỈ DUY NHẤT trong năm nay. Bộ sưu tập gồm 2 loại: Characters Photo và Characters In Action. - Character in Photo (Màu xanh): Bộ sưu tập bao gồm hình ảnh các nhân vật Conan trong CARD COLLECTION: Thám tử lừng danh Conan: Ngôi Sao 5 Cánh 1 Triệu Đô với những tạo hình đặc biệt ngầu bá cháy. Bộ sưu tập có tổng cộng 31 thẻ bao gồm: 13 thẻ thường [N], 9 thẻ hiếm [R], 6 thẻ Siêu hiếm [SR], 3 thẻ cực hiếm [UR]. - Character In Action (Màu vàng) : Bộ sưu tập bao gồm những phân cảnh mang dấu ấn đặc biệt trong phim mà Ducky Card được chính thức phát hành. Bộ sưu tập có tổng cộng 43 hình: 18 thẻ thường [N], 10 thẻ hiếm [R], 9 thẻ siêu hiếm [SR], 6 thẻ cực hiếm [UR] Vì sao bạn cần săn ngay bây giờ? - Bộ sưu tập CHÍNH HÃNG của Thám tử lừng danh Conan tại Việt Nam - Chỉ được phát hành duy nhất 1 lần trong năm nay. Giá sản phẩm trên Tiki đã bao gồm thuế theo luật hiện hành. Bên cạnh đó, tuỳ vào loại sản phẩm, hình thức và địa chỉ giao hàng mà có thể phát sinh thêm chi phí khác như phí vận chuyển, phụ phí hàng cồng kềnh, thuế nhập khẩu (đối với đơn hàng giao từ nước ngoài có giá trị trên 1 triệu đồng).....",5,1,"https://salt.tikicdn.com/ts/product/ce/f1/ea/f509f20bad955ea0384cfa133aaa8d69.jpg, https://salt.tikicdn.com/ts/product/9c/08/bc/cde1027b092ded66a48c2abf4b17ab2c.jpg, https://salt.tikicdn.com/ts/product/13/e9/54/3d56686f8207521e1c6724fe79053a32.jpg, https://salt.tikicdn.com/ts/product/b9/b6/9c/1102675f6ae657da530d9374cfe99257.jpg, https://salt.tikicdn.com/ts/product/36/e8/ec/90b434cdf1ee030c7b558c1ca7d6f945.jpg, https://salt.tikicdn.com/ts/product/a0/71/b1/c71e51d888973b86645a2c01994ec993.jpg, https://salt.tikicdn.com/ts/product/f7/cb/c0/ebe570bb58dd6f9fe042733fe176da86.jpg, https://salt.tikicdn.com/ts/product/73/19/fa/5a0eb000ca356caf8da2c56e1f7ebca1.jpg, https://salt.tikicdn.com/ts/product/4a/0f/73/34529ea904086b285e1fef7b27badb45.jpg, https://salt.tikicdn.com/ts/product/e6/79/03/e3c0c95c3e9f02d4cd6f77e56f488ccc.jpg, https://salt.tikicdn.com/ts/product/b1/de/8b/d74dbbd62f4275e514089ab7204b48df.jpg","https://salt.tikicdn.com/cache/w1200/ts/product/ce/f1/ea/f509f20bad955ea0384cfa133aaa8d69.jpg, https://salt.tikicdn.com/cache/w1200/ts/product/9c/08/bc/cde1027b092ded66a48c2abf4b17ab2c.jpg, https://salt.tikicdn.com/cache/w1200/ts/product/13/e9/54/3d56686f8207521e1c6724fe79053a32.jpg, https://salt.tikicdn.com/cache/w1200/ts/product/b9/b6/9c/1102675f6ae657da530d9374cfe99257.jpg, https://salt.tikicdn.com/cache/w1200/ts/product/36/e8/ec/90b434cdf1ee030c7b558c1ca7d6f945.jpg, https://salt.tikicdn.com/cache/w1200/ts/product/a0/71/b1/c71e51d888973b86645a2c01994ec993.jpg, https://salt.tikicdn.com/cache/w1200/ts/product/f7/cb/c0/ebe570bb58dd6f9fe042733fe176da86.jpg, https://salt.tikicdn.com/cache/w1200/ts/product/73/19/fa/5a0eb000ca356caf8da2c56e1f7ebca1.jpg, https://salt.tikicdn.com/cache/w1200/ts/product/4a/0f/73/34529ea904086b285e1fef7b27badb45.jpg, https://salt.tikicdn.com/cache/w1200/ts/product/e6/79/03/e3c0c95c3e9f02d4cd6f77e56f488ccc.jpg, https://salt.tikicdn.com/cache/w1200/ts/product/b1/de/8b/d74dbbd62f4275e514089ab7204b48df.jpg","https://salt.tikicdn.com/cache/w300/ts/product/ce/f1/ea/f509f20bad955ea0384cfa133aaa8d69.jpg, https://salt.tikicdn.com/cache/w300/ts/product/9c/08/bc/cde1027b092ded66a48c2abf4b17ab2c.jpg, https://salt.tikicdn.com/cache/w300/ts/product/13/e9/54/3d56686f8207521e1c6724fe79053a32.jpg, https://salt.tikicdn.com/cache/w300/ts/product/b9/b6/9c/1102675f6ae657da530d9374cfe99257.jpg, https://salt.tikicdn.com/cache/w300/ts/product/36/e8/ec/90b434cdf1ee030c7b558c1ca7d6f945.jpg, https://salt.tikicdn.com/cache/w300/ts/product/a0/71/b1/c71e51d888973b86645a2c01994ec993.jpg, https://salt.tikicdn.com/cache/w300/ts/product/f7/cb/c0/ebe570bb58dd6f9fe042733fe176da86.jpg, https://salt.tikicdn.com/cache/w300/ts/product/73/19/fa/5a0eb000ca356caf8da2c56e1f7ebca1.jpg, https://salt.tikicdn.com/cache/w300/ts/product/4a/0f/73/34529ea904086b285e1fef7b27badb45.jpg, https://salt.tikicdn.com/cache/w300/ts/product/e6/79/03/e3c0c95c3e9f02d4cd6f77e56f488ccc.jpg, https://salt.tikicdn.com/cache/w300/ts/product/b1/de/8b/d74dbbd62f4275e514089ab7204b48df.jpg","https://salt.tikicdn.com/cache/200x280/ts/product/ce/f1/ea/f509f20bad955ea0384cfa133aaa8d69.jpg, https://salt.tikicdn.com/cache/200x280/ts/product/9c/08/bc/cde1027b092ded66a48c2abf4b17ab2c.jpg, https://salt.tikicdn.com/cache/200x280/ts/product/13/e9/54/3d56686f8207521e1c6724fe79053a32.jpg, https://salt.tikicdn.com/cache/200x280/ts/product/b9/b6/9c/1102675f6ae657da530d9374cfe99257.jpg, https://salt.tikicdn.com/cache/200x280/ts/product/36/e8/ec/90b434cdf1ee030c7b558c1ca7d6f945.jpg, https://salt.tikicdn.com/cache/200x280/ts/product/a0/71/b1/c71e51d888973b86645a2c01994ec993.jpg, https://salt.tikicdn.com/cache/200x280/ts/product/f7/cb/c0/ebe570bb58dd6f9fe042733fe176da86.jpg, https://salt.tikicdn.com/cache/200x280/ts/product/73/19/fa/5a0eb000ca356caf8da2c56e1f7ebca1.jpg, https://salt.tikicdn.com/cache/200x280/ts/product/4a/0f/73/34529ea904086b285e1fef7b27badb45.jpg, https://salt.tikicdn.com/cache/200x280/ts/product/e6/79/03/e3c0c95c3e9f02d4cd6f77e56f488ccc.jpg, https://salt.tikicdn.com/cache/200x280/ts/product/b1/de/8b/d74dbbd62f4275e514089ab7204b48df.jpg","https://salt.tikicdn.com/cache/200x280/ts/product/ce/f1/ea/f509f20bad955ea0384cfa133aaa8d69.jpg, https://salt.tikicdn.com/cache/200x280/ts/product/9c/08/bc/cde1027b092ded66a48c2abf4b17ab2c.jpg, https://salt.tikicdn.com/cache/200x280/ts/product/13/e9/54/3d56686f8207521e1c6724fe79053a32.jpg, https://salt.tikicdn.com/cache/200x280/ts/product/b9/b6/9c/1102675f6ae657da530d9374cfe99257.jpg, https://salt.tikicdn.com/cache/200x280/ts/product/36/e8/ec/90b434cdf1ee030c7b558c1ca7d6f945.jpg, https://salt.tikicdn.com/cache/200x280/ts/product/a0/71/b1/c71e51d888973b86645a2c01994ec993.jpg, https://salt.tikicdn.com/cache/200x280/ts/product/f7/cb/c0/ebe570bb58dd6f9fe042733fe176da86.jpg, https://salt.tikicdn.com/cache/200x280/ts/product/73/19/fa/5a0eb000ca356caf8da2c56e1f7ebca1.jpg, https://salt.tikicdn.com/cache/200x280/ts/product/4a/0f/73/34529ea904086b285e1fef7b27badb45.jpg, https://salt.tikicdn.com/cache/200x280/ts/product/e6/79/03/e3c0c95c3e9f02d4cd6f77e56f488ccc.jpg, https://salt.tikicdn.com/cache/200x280/ts/product/b1/de/8b/d74dbbd62f4275e514089ab7204b48df.jpg",1000,1
275761266,Bộ Thẻ Sưu Tập Thám Tử Lừng Danh Conan Movie 27 - Character in Action : Ngôi Sao 5 Cánh 1 Triệu Đô - Phiên Bản Giới Hạn (5 Cards Ngẫu Nhiên/Túi),58200,"    Bộ Thẻ Sưu Tập Thám Tử Lừng Danh Conan Movie 27 - Character in Action : Ngôi Sao 5 Cánh 1 Triệu Đô - Phiên Bản Giới Hạn (5 Cards Ngẫu Nhiên/Túi)   Những ngày vừa qua, các fans của Thám tử lừng...","Bộ Thẻ Sưu Tập Thám Tử Lừng Danh Conan Movie 27 - Character in Action : Ngôi Sao 5 Cánh 1 Triệu Đô - Phiên Bản Giới Hạn (5 Cards Ngẫu Nhiên/Túi) Những ngày vừa qua, các fans của Thám tử lừng danh Conan Việt Nam đứng ngồi không yên chờ đợi sự kiện ra mắt phim điện ảnh Thám tử lừng danh Conan: Ngôi Sao 5 Cánh 1 Triệu Đô , bộ phim làm mưa làm gió ngay từ khi được công chiếu tại Nhật Bản: vượt mốc doanh thu 960 triệu yên, 630.000 người xem trong ngày công chiếu đầu tiên. Trong 25 ngày công chiếu, Thám tử lừng danh Conan: Ngôi Sao 5 Cánh 1 Triệu Đô kiếm được tổng cộng 74 triệu đô, vượt doanh thu Thám tử lừng danh Conan:Tàu ngầm sắt màu đen tới 112%. Và một TIN CHẤN ĐỘNG bạn không thể bỏ lỡ, Ducky Card chính thức trình làng phiên bản đặc biệt giới hạn CARD COLLECTION: Thám tử lừng danh Conan: Ngôi Sao 5 Cánh 1 Triệu Đô Sau thành công của Card Collection Thám tử lừng danh Conan: Tàu ngầm sắt màu đen, Ducky Card cho ra mắt bộ sưu tập card collection official mới mà bất cứ fan chân chính nào của Thám tử lừng danh Conan cũng không thể bỏ qua. Bộ sưu tập gồm 2 phiên bản: Đây là bộ sưu tập CHÍNH THỨC phiên bản GIỚI HẠN được Ducky Card phát hành CHỈ DUY NHẤT trong năm nay. Bộ sưu tập gồm 2 loại: Characters Photo và Characters In Action. - Character in Photo (Màu xanh): Bộ sưu tập bao gồm hình ảnh các nhân vật Conan trong CARD COLLECTION: Thám tử lừng danh Conan: Ngôi Sao 5 Cánh 1 Triệu Đô với những tạo hình đặc biệt ngầu bá cháy. Bộ sưu tập có tổng cộng 31 thẻ bao gồm: 13 thẻ thường [N], 9 thẻ hiếm [R], 6 thẻ Siêu hiếm [SR], 3 thẻ cực hiếm [UR]. - Character In Action (Màu vàng) : Bộ sưu tập bao gồm những phân cảnh mang dấu ấn đặc biệt trong phim mà Ducky Card được chính thức phát hành. Bộ sưu tập có tổng cộng 43 hình: 18 thẻ thường [N], 10 thẻ hiếm [R], 9 thẻ siêu hiếm [SR], 6 thẻ cực hiếm [UR] Vì sao bạn cần săn ngay bây giờ? - Bộ sưu tập CHÍNH HÃNG của Thám tử lừng danh Conan tại Việt Nam - Chỉ được phát hành duy nhất 1 lần trong năm nay. Giá sản phẩm trên Tiki đã bao gồm thuế theo luật hiện hành. Bên cạnh đó, tuỳ vào loại sản phẩm, hình thức và địa chỉ giao hàng mà có thể phát sinh thêm chi phí khác như phí vận chuyển, phụ phí hàng cồng kềnh, thuế nhập khẩu (đối với đơn hàng giao từ nước ngoài có giá trị trên 1 triệu đồng).....",0,0,"https://salt.tikicdn.com/ts/product/48/f1/9e/6f8bc4c86824b4720a12fb9615f57cdd.jpg, https://salt.tikicdn.com/ts/product/b5/31/ce/6583920c2a1a6235f9d5bf16b4c17f57.jpg, https://salt.tikicdn.com/ts/product/10/8c/20/8b9cfa329f48fd9cc33c7d527a709c94.jpg, https://salt.tikicdn.com/ts/product/f5/c3/2a/95876af1313e1a0303bda1a91685423e.jpg, https://salt.tikicdn.com/ts/product/36/e8/ec/d5ff81b6e0559a7ff82529cb9a21d50b.jpg, https://salt.tikicdn.com/ts/product/a1/b5/d6/57f86cd5d8721a4b768c558bd14b2e61.jpg, https://salt.tikicdn.com/ts/product/1e/7e/84/6de4160ee776de728d357f459e134ddf.jpg, https://salt.tikicdn.com/ts/product/b3/3a/5c/4177d78e1bb62b26db13a851cb6f1c15.jpg, https://salt.tikicdn.com/ts/product/75/72/9b/ee19a522829fd5fbe5bffd3b8488a539.jpg, https://salt.tikicdn.com/ts/product/b1/de/8b/91c3dcf66b793f3f8ab527fee9b812bd.jpg","https://salt.tikicdn.com/cache/w1200/ts/product/48/f1/9e/6f8bc4c86824b4720a12fb9615f57cdd.jpg, https://salt.tikicdn.com/cache/w1200/ts/product/b5/31/ce/6583920c2a1a6235f9d5bf16b4c17f57.jpg, https://salt.tikicdn.com/cache/w1200/ts/product/10/8c/20/8b9cfa329f48fd9cc33c7d527a709c94.jpg, https://salt.tikicdn.com/cache/w1200/ts/product/f5/c3/2a/95876af1313e1a0303bda1a91685423e.jpg, https://salt.tikicdn.com/cache/w1200/ts/product/36/e8/ec/d5ff81b6e0559a7ff82529cb9a21d50b.jpg, https://salt.tikicdn.com/cache/w1200/ts/product/a1/b5/d6/57f86cd5d8721a4b768c558bd14b2e61.jpg, https://salt.tikicdn.com/cache/w1200/ts/product/1e/7e/84/6de4160ee776de728d357f459e134ddf.jpg, https://salt.tikicdn.com/cache/w1200/ts/product/b3/3a/5c/4177d78e1bb62b26db13a851cb6f1c15.jpg, https://salt.tikicdn.com/cache/w1200/ts/product/75/72/9b/ee19a522829fd5fbe5bffd3b8488a539.jpg, https://salt.tikicdn.com/cache/w1200/ts/product/b1/de/8b/91c3dcf66b793f3f8ab527fee9b812bd.jpg","https://salt.tikicdn.com/cache/w300/ts/product/48/f1/9e/6f8bc4c86824b4720a12fb9615f57cdd.jpg, https://salt.tikicdn.com/cache/w300/ts/product/b5/31/ce/6583920c2a1a6235f9d5bf16b4c17f57.jpg, https://salt.tikicdn.com/cache/w300/ts/product/10/8c/20/8b9cfa329f48fd9cc33c7d527a709c94.jpg, https://salt.tikicdn.com/cache/w300/ts/product/f5/c3/2a/95876af1313e1a0303bda1a91685423e.jpg, https://salt.tikicdn.com/cache/w300/ts/product/36/e8/ec/d5ff81b6e0559a7ff82529cb9a21d50b.jpg, https://salt.tikicdn.com/cache/w300/ts/product/a1/b5/d6/57f86cd5d8721a4b768c558bd14b2e61.jpg, https://salt.tikicdn.com/cache/w300/ts/product/1e/7e/84/6de4160ee776de728d357f459e134ddf.jpg, https://salt.tikicdn.com/cache/w300/ts/product/b3/3a/5c/4177d78e1bb62b26db13a851cb6f1c15.jpg, https://salt.tikicdn.com/cache/w300/ts/product/75/72/9b/ee19a522829fd5fbe5bffd3b8488a539.jpg, https://salt.tikicdn.com/cache/w300/ts/product/b1/de/8b/91c3dcf66b793f3f8ab527fee9b812bd.jpg","https://salt.tikicdn.com/cache/200x280/ts/product/48/f1/9e/6f8bc4c86824b4720a12fb9615f57cdd.jpg, https://salt.tikicdn.com/cache/200x280/ts/product/b5/31/ce/6583920c2a1a6235f9d5bf16b4c17f57.jpg, https://salt.tikicdn.com/cache/200x280/ts/product/10/8c/20/8b9cfa329f48fd9cc33c7d527a709c94.jpg, https://salt.tikicdn.com/cache/200x280/ts/product/f5/c3/2a/95876af1313e1a0303bda1a91685423e.jpg, https://salt.tikicdn.com/cache/200x280/ts/product/36/e8/ec/d5ff81b6e0559a7ff82529cb9a21d50b.jpg, https://salt.tikicdn.com/cache/200x280/ts/product/a1/b5/d6/57f86cd5d8721a4b768c558bd14b2e61.jpg, https://salt.tikicdn.com/cache/200x280/ts/product/1e/7e/84/6de4160ee776de728d357f459e134ddf.jpg, https://salt.tikicdn.com/cache/200x280/ts/product/b3/3a/5c/4177d78e1bb62b26db13a851cb6f1c15.jpg, https://salt.tikicdn.com/cache/200x280/ts/product/75/72/9b/ee19a522829fd5fbe5bffd3b8488a539.jpg, https://salt.tikicdn.com/cache/200x280/ts/product/b1/de/8b/91c3dcf66b793f3f8ab527fee9b812bd.jpg","https://salt.tikicdn.com/cache/200x280/ts/product/48/f1/9e/6f8bc4c86824b4720a12fb9615f57cdd.jpg, https://salt.tikicdn.com/cache/200x280/ts/product/b5/31/ce/6583920c2a1a6235f9d5bf16b4c17f57.jpg, https://salt.tikicdn.com/cache/200x280/ts/product/10/8c/20/8b9cfa329f48fd9cc33c7d527a709c94.jpg, https://salt.tikicdn.com/cache/200x280/ts/product/f5/c3/2a/95876af1313e1a0303bda1a91685423e.jpg, https://salt.tikicdn.com/cache/200x280/ts/product/36/e8/ec/d5ff81b6e0559a7ff82529cb9a21d50b.jpg, https://salt.tikicdn.com/cache/200x280/ts/product/a1/b5/d6/57f86cd5d8721a4b768c558bd14b2e61.jpg, https://salt.tikicdn.com/cache/200x280/ts/product/1e/7e/84/6de4160ee776de728d357f459e134ddf.jpg, https://salt.tikicdn.com/cache/200x280/ts/product/b3/3a/5c/4177d78e1bb62b26db13a851cb6f1c15.jpg, https://salt.tikicdn.com/cache/200x280/ts/product/75/72/9b/ee19a522829fd5fbe5bffd3b8488a539.jpg, https://salt.tikicdn.com/cache/200x280/ts/product/b1/de/8b/91c3dcf66b793f3f8ab527fee9b812bd.jpg",1000,0
275697313,Thẻ Sưu Tập Nhân Vật Dược Sư Tự Sự Vol.1 - Thẻ Trong Suốt - Bushiroad AD-CC01 (1 Cards Ngẫu Nhiên/Túi),51000,"    Thẻ Sưu Tập Nhân Vật Dược Sư Tự Sự Vol.1 - Thẻ Trong Suốt - Bushiroad AD-CC01 (1 Cards Ngẫu Nhiên/Túi)   Sản phầm được làm từ nhựa dẻo, mỗi túi gồm 1 card ngẫu nhiên trong suốt.   Sản phẩm dù...","Thẻ Sưu Tập Nhân Vật Dược Sư Tự Sự Vol.1 - Thẻ Trong Suốt - Bushiroad AD-CC01 (1 Cards Ngẫu Nhiên/Túi) Sản phầm được làm từ nhựa dẻo, mỗi túi gồm 1 card ngẫu nhiên trong suốt. Sản phẩm dùng để sưu tầm hoặc làm quà tặng, đồ lưu niệm, trang trí phòng góc học tập cổ vũ tinh thần của các fan bộ truyện này. Giá sản phẩm trên Tiki đã bao gồm thuế theo luật hiện hành. Bên cạnh đó, tuỳ vào loại sản phẩm, hình thức và địa chỉ giao hàng mà có thể phát sinh thêm chi phí khác như phí vận chuyển, phụ phí hàng cồng kềnh, thuế nhập khẩu (đối với đơn hàng giao từ nước ngoài có giá trị trên 1 triệu đồng).....",0,0,https://salt.tikicdn.com/ts/product/77/99/fe/a16daeaf1926d2c0c6a23526fba29f8a.jpg,https://salt.tikicdn.com/cache/w1200/ts/product/77/99/fe/a16daeaf1926d2c0c6a23526fba29f8a.jpg,https://salt.tikicdn.com/cache/w300/ts/product/77/99/fe/a16daeaf1926d2c0c6a23526fba29f8a.jpg,https://salt.tikicdn.com/cache/200x280/ts/product/77/99/fe/a16daeaf1926d2c0c6a23526fba29f8a.jpg,https://salt.tikicdn.com/cache/200x280/ts/product/77/99/fe/a16daeaf1926d2c0c6a23526fba29f8a.jpg,1000,0
275230805,Gấu Bông Gối Ôm Hình Hải Cẩu Dễ Thương Vải 3D Siêu Mịn 50cm Quà Tặng Độc Lạ DRU - Hàng Chính Hãng,175100,"Gấu Bông Gối Ôm Hình Hải Cẩu Dễ Thương Vải 3D Siêu Mịn 50cm Quà Tặng Độc Lạ- Màu sắc: trắng- Kích thước: 50cm- Chất liệu vải cao cấp mền mịn không bay màu, bông xoắn 3 chiều không bị xẹp, lông nhung m...","Gấu Bông Gối Ôm Hình Hải Cẩu Dễ Thương Vải 3D Siêu Mịn 50cm Quà Tặng Độc Lạ - Màu sắc: trắng - Kích thước: 50cm - Chất liệu vải cao cấp mền mịn không bay màu, bông xoắn 3 chiều không bị xẹp, lông nhung mềm mịn êm ái, không rụng lông và an toàn cho người dùng. - Thiết kế chú hải cẩu tròn tròn xinh xắn, đáng yêu và ngộ nghĩnh. Kiểu dáng nhỏ nhắn không quá to, dễ dàng ôm, hay mang theo bất kỳ đâu. - Đường may chắc chắn, tỉ mỉ, hạn chế tối đa tình trạng bung rách, đứt chỉ. - Với màu sắc đơn giản, sản phẩm này còn rất dễ kết hợp với ghế sopha trong phòng khách hay trên giường, trên xe ô tô. - Quà tặng thay cho những tình cảm quan tâm chân thành mà bạn muốn gửi đến những người thân yêu, bạn bè của mình mang lại cho họ cảm giác ấm áp, có giấc ngủ ngon hơn. Giá sản phẩm trên Tiki đã bao gồm thuế theo luật hiện hành. Bên cạnh đó, tuỳ vào loại sản phẩm, hình thức và địa chỉ giao hàng mà có thể phát sinh thêm chi phí khác như phí vận chuyển, phụ phí hàng cồng kềnh, thuế nhập khẩu (đối với đơn hàng giao từ nước ngoài có giá trị trên 1 triệu đồng).....",0,0,"https://salt.tikicdn.com/ts/product/fe/ff/7a/d35b540e7a30d40c449f2e5b8ce400ca.jpg, https://salt.tikicdn.com/ts/product/02/9b/8c/c72e3c3fc6045e265e0ad8fe786c08b4.jpg, https://salt.tikicdn.com/ts/product/4d/f6/a8/5f41a6f4f7c28f4fab197e451343f407.jpg, https://salt.tikicdn.com/ts/product/9c/5b/1e/b4c830b0377dcc8a7ba07cdacb2bd52e.jpg, https://salt.tikicdn.com/ts/product/fd/7d/14/7b9a0652510c00ec9e88c7bfefff1544.jpg, https://salt.tikicdn.com/ts/product/02/4b/f6/3bd29ea52b5fc01826ce607f1e7e28e3.jpg, https://salt.tikicdn.com/ts/product/c6/51/ec/d117d5e66ac47df89958c6933d395c72.jpg","https://salt.tikicdn.com/cache/w1200/ts/product/fe/ff/7a/d35b540e7a30d40c449f2e5b8ce400ca.jpg, https://salt.tikicdn.com/cache/w1200/ts/product/02/9b/8c/c72e3c3fc6045e265e0ad8fe786c08b4.jpg, https://salt.tikicdn.com/cache/w1200/ts/product/4d/f6/a8/5f41a6f4f7c28f4fab197e451343f407.jpg, https://salt.tikicdn.com/cache/w1200/ts/product/9c/5b/1e/b4c830b0377dcc8a7ba07cdacb2bd52e.jpg, https://salt.tikicdn.com/cache/w1200/ts/product/fd/7d/14/7b9a0652510c00ec9e88c7bfefff1544.jpg, https://salt.tikicdn.com/cache/w1200/ts/product/02/4b/f6/3bd29ea52b5fc01826ce607f1e7e28e3.jpg, https://salt.tikicdn.com/cache/w1200/ts/product/c6/51/ec/d117d5e66ac47df89958c6933d395c72.jpg","https://salt.tikicdn.com/cache/w300/ts/product/fe/ff/7a/d35b540e7a30d40c449f2e5b8ce400ca.jpg, https://salt.tikicdn.com/cache/w300/ts/product/02/9b/8c/c72e3c3fc6045e265e0ad8fe786c08b4.jpg, https://salt.tikicdn.com/cache/w300/ts/product/4d/f6/a8/5f41a6f4f7c28f4fab197e451343f407.jpg, https://salt.tikicdn.com/cache/w300/ts/product/9c/5b/1e/b4c830b0377dcc8a7ba07cdacb2bd52e.jpg, https://salt.tikicdn.com/cache/w300/ts/product/fd/7d/14/7b9a0652510c00ec9e88c7bfefff1544.jpg, https://salt.tikicdn.com/cache/w300/ts/product/02/4b/f6/3bd29ea52b5fc01826ce607f1e7e28e3.jpg, https://salt.tikicdn.com/cache/w300/ts/product/c6/51/ec/d117d5e66ac47df89958c6933d395c72.jpg","https://salt.tikicdn.com/cache/200x280/ts/product/fe/ff/7a/d35b540e7a30d40c449f2e5b8ce400ca.jpg, https://salt.tikicdn.com/cache/200x280/ts/product/02/9b/8c/c72e3c3fc6045e265e0ad8fe786c08b4.jpg, https://salt.tikicdn.com/cache/200x280/ts/product/4d/f6/a8/5f41a6f4f7c28f4fab197e451343f407.jpg, https://salt.tikicdn.com/cache/200x280/ts/product/9c/5b/1e/b4c830b0377dcc8a7ba07cdacb2bd52e.jpg, https://salt.tikicdn.com/cache/200x280/ts/product/fd/7d/14/7b9a0652510c00ec9e88c7bfefff1544.jpg, https://salt.tikicdn.com/cache/200x280/ts/product/02/4b/f6/3bd29ea52b5fc01826ce607f1e7e28e3.jpg, https://salt.tikicdn.com/cache/200x280/ts/product/c6/51/ec/d117d5e66ac47df89958c6933d395c72.jpg","https://salt.tikicdn.com/cache/200x280/ts/product/fe/ff/7a/d35b540e7a30d40c449f2e5b8ce400ca.jpg, https://salt.tikicdn.com/cache/200x280/ts/product/02/9b/8c/c72e3c3fc6045e265e0ad8fe786c08b4.jpg, https://salt.tikicdn.com/cache/200x280/ts/product/4d/f6/a8/5f41a6f4f7c28f4fab197e451343f407.jpg, https://salt.tikicdn.com/cache/200x280/ts/product/9c/5b/1e/b4c830b0377dcc8a7ba07cdacb2bd52e.jpg, https://salt.tikicdn.com/cache/200x280/ts/product/fd/7d/14/7b9a0652510c00ec9e88c7bfefff1544.jpg, https://salt.tikicdn.com/cache/200x280/ts/product/02/4b/f6/3bd29ea52b5fc01826ce607f1e7e28e3.jpg, https://salt.tikicdn.com/cache/200x280/ts/product/c6/51/ec/d117d5e66ac47df89958c6933d395c72.jpg",1000,0
