id,name,price,short_description,description,rating_average,review_count,image_base_url,image_large_url,image_medium_url,image_small_url,image_thumbnail_url,stock,quantity_sold
277417744,Bộ Thẻ Sưu Tầm One Piece 2025 - Tagger (6 Cards Ngẫu Nhiên/Túi),33900,    Bộ Thẻ Sưu Tầm One Piece 2025 - Tagger (6 Cards Ngẫu Nhiên/Túi)   One Piece diễn ra chủ yếu ở biển và đảo nơi các hải tặc ghé qua các thị trấn và lực lượng hải quân cố duy trì trật tự. Giống n...,"Bộ Thẻ Sưu Tầm One Piece 2025 - Tagger (6 Cards Ngẫu Nhiên/Túi) One Piece diễn ra chủ yếu ở biển và đảo nơi các hải tặc ghé qua các thị trấn và lực lượng hải quân cố duy trì trật tự. Giống như các hải tặc khác, Luffy đã lên đường tìm kiếm kho báu bí ẩn tên là One Piece và cố gắng đạt được ước mơ của m.ình là trở thành Vua Hải Tặc. Luffy có sức mạnh kỳ lạ. Khi còn trẻ, Luffy tình cờ ăn phải quả ác quỷ cao su khiến cho cơ thể Luffy có thể co giãn như cao su. Trong suốt câu chuyện, Luffy từ từ kết nạp được các thành viên và cùng ra khơi với các mục tiêu nhất định. Thông qua các chuyến phiêu lưu, Luffy trở thành người ngoài vòng pháp luật và bị hải quân truy đuổi. Trong quá trình phiêu lưu, Luffy gặp được rất nhiều nhân vật khác nhau, nhiều người trong số họ mang trong m.ình sức mạnh từ trái ác quỷ giống Luffy. Giá sản phẩm trên Tiki đã bao gồm thuế theo luật hiện hành. Bên cạnh đó, tuỳ vào loại sản phẩm, hình thức và địa chỉ giao hàng mà có thể phát sinh thêm chi phí khác như phí vận chuyển, phụ phí hàng cồng kềnh, thuế nhập khẩu (đối với đơn hàng giao từ nước ngoài có giá trị trên 1 triệu đồng).....",0,0,"https://salt.tikicdn.com/ts/product/93/c4/3d/ddf1d4f830932fdfd301a4562a319b63.jpg, https://salt.tikicdn.com/ts/product/5a/32/5b/cb284cf7373c050ea7e64e063b7bda96.jpg, https://salt.tikicdn.com/ts/product/d7/a9/29/96d9f8d32f8b0604c84efebfb6fcbb60.jpg, https://salt.tikicdn.com/ts/product/74/b8/12/f7077777d745567b81656d0359a9fa62.jpg, https://salt.tikicdn.com/ts/product/bd/e8/da/69fca5993771e3260ebe6fa7d95adafc.jpg, https://salt.tikicdn.com/ts/product/0b/c7/fd/438d50160cf785f57f3a85b044f5f6cc.jpg","https://salt.tikicdn.com/cache/w1200/ts/product/93/c4/3d/ddf1d4f830932fdfd301a4562a319b63.jpg, https://salt.tikicdn.com/cache/w1200/ts/product/5a/32/5b/cb284cf7373c050ea7e64e063b7bda96.jpg, https://salt.tikicdn.com/cache/w1200/ts/product/d7/a9/29/96d9f8d32f8b0604c84efebfb6fcbb60.jpg, https://salt.tikicdn.com/cache/w1200/ts/product/74/b8/12/f7077777d745567b81656d0359a9fa62.jpg, https://salt.tikicdn.com/cache/w1200/ts/product/bd/e8/da/69fca5993771e3260ebe6fa7d95adafc.jpg, https://salt.tikicdn.com/cache/w1200/ts/product/0b/c7/fd/438d50160cf785f57f3a85b044f5f6cc.jpg","https://salt.tikicdn.com/cache/w300/ts/product/93/c4/3d/ddf1d4f830932fdfd301a4562a319b63.jpg, https://salt.tikicdn.com/cache/w300/ts/product/5a/32/5b/cb284cf7373c050ea7e64e063b7bda96.jpg, https://salt.tikicdn.com/cache/w300/ts/product/d7/a9/29/96d9f8d32f8b0604c84efebfb6fcbb60.jpg, https://salt.tikicdn.com/cache/w300/ts/product/74/b8/12/f7077777d745567b81656d0359a9fa62.jpg, https://salt.tikicdn.com/cache/w300/ts/product/bd/e8/da/69fca5993771e3260ebe6fa7d95adafc.jpg, https://salt.tikicdn.com/cache/w300/ts/product/0b/c7/fd/438d50160cf785f57f3a85b044f5f6cc.jpg","https://salt.tikicdn.com/cache/200x280/ts/product/93/c4/3d/ddf1d4f830932fdfd301a4562a319b63.jpg, https://salt.tikicdn.com/cache/200x280/ts/product/5a/32/5b/cb284cf7373c050ea7e64e063b7bda96.jpg, https://salt.tikicdn.com/cache/200x280/ts/product/d7/a9/29/96d9f8d32f8b0604c84efebfb6fcbb60.jpg, https://salt.tikicdn.com/cache/200x280/ts/product/74/b8/12/f7077777d745567b81656d0359a9fa62.jpg, https://salt.tikicdn.com/cache/200x280/ts/product/bd/e8/da/69fca5993771e3260ebe6fa7d95adafc.jpg, https://salt.tikicdn.com/cache/200x280/ts/product/0b/c7/fd/438d50160cf785f57f3a85b044f5f6cc.jpg","https://salt.tikicdn.com/cache/200x280/ts/product/93/c4/3d/ddf1d4f830932fdfd301a4562a319b63.jpg, https://salt.tikicdn.com/cache/200x280/ts/product/5a/32/5b/cb284cf7373c050ea7e64e063b7bda96.jpg, https://salt.tikicdn.com/cache/200x280/ts/product/d7/a9/29/96d9f8d32f8b0604c84efebfb6fcbb60.jpg, https://salt.tikicdn.com/cache/200x280/ts/product/74/b8/12/f7077777d745567b81656d0359a9fa62.jpg, https://salt.tikicdn.com/cache/200x280/ts/product/bd/e8/da/69fca5993771e3260ebe6fa7d95adafc.jpg, https://salt.tikicdn.com/cache/200x280/ts/product/0b/c7/fd/438d50160cf785f57f3a85b044f5f6cc.jpg",1000,0
277411900,Bộ Thẻ Sưu Tập - Card Collection Èn En Én (5 Cards/Túi),64100,"    Bộ Thẻ Sưu Tập - Card Collection Èn En É   Én là một trong những cái tên quen thuộc trong cộng đồng comic Việt, từng gây bão mạng xã hội với màn “tranh đấu” cùng Thỏ Bảy Màu vào 9/2020. Thành ...","Bộ Thẻ Sưu Tập - Card Collection Èn En É Én là một trong những cái tên quen thuộc trong cộng đồng comic Việt, từng gây bão mạng xã hội với màn “tranh đấu” cùng Thỏ Bảy Màu vào 9/2020. Thành lập từ năm 2018, đến nay Én được nhiều bạn trẻ yêu thích bởi những câu chuyện hài hước xoay quanh sự “mất não” của nhân vật. Bộ card Bo góc dành cho những Fan chân chính của Én. Thử ngay vận may để sưu tầm cho m.ình đủ 43 card bo góc siêu yêu từ Én “mất não"" Thành Phần 5 Card Bo góc Về Bộ Sưu Tập Bộ sưu tập gồm 43 thẻ: - Normal: 27 thẻ - Super Rare: 13 thẻ - Ultra Rare: 3 thẻ Với những hình ảnh mang đậm chất Én mất não, liệu bạn có phải là kẻ may mắn nhất rước về những thẻ bài 5 sao quyền năng. Thử thách nhân phẩm ngay, Nhảy vào thế giới 'vô-tri-cảm-xúc' cùng Én. Giá sản phẩm trên Tiki đã bao gồm thuế theo luật hiện hành. Bên cạnh đó, tuỳ vào loại sản phẩm, hình thức và địa chỉ giao hàng mà có thể phát sinh thêm chi phí khác như phí vận chuyển, phụ phí hàng cồng kềnh, thuế nhập khẩu (đối với đơn hàng giao từ nước ngoài có giá trị trên 1 triệu đồng).....",0,0,"https://salt.tikicdn.com/ts/product/57/c8/e4/1e2af54d8f0eddfb2d0d47aca352f3f1.jpg, https://salt.tikicdn.com/ts/product/87/e3/65/9353db171f6818f465eba8cdaa97c1d3.jpg, https://salt.tikicdn.com/ts/product/d6/d3/87/2f54eea613ad926e5b8de3aa862692f5.jpg, https://salt.tikicdn.com/ts/product/f4/6a/87/1854bb76e8da69140173218ddadc4400.jpg, https://salt.tikicdn.com/ts/product/b0/d5/16/b46a04c4f6aca765dcce3a08fd33bf32.jpg, https://salt.tikicdn.com/ts/product/9c/8a/42/8361caff72bb42319d336fbd0fb09aa7.jpg","https://salt.tikicdn.com/cache/w1200/ts/product/57/c8/e4/1e2af54d8f0eddfb2d0d47aca352f3f1.jpg, https://salt.tikicdn.com/cache/w1200/ts/product/87/e3/65/9353db171f6818f465eba8cdaa97c1d3.jpg, https://salt.tikicdn.com/cache/w1200/ts/product/d6/d3/87/2f54eea613ad926e5b8de3aa862692f5.jpg, https://salt.tikicdn.com/cache/w1200/ts/product/f4/6a/87/1854bb76e8da69140173218ddadc4400.jpg, https://salt.tikicdn.com/cache/w1200/ts/product/b0/d5/16/b46a04c4f6aca765dcce3a08fd33bf32.jpg, https://salt.tikicdn.com/cache/w1200/ts/product/9c/8a/42/8361caff72bb42319d336fbd0fb09aa7.jpg","https://salt.tikicdn.com/cache/w300/ts/product/57/c8/e4/1e2af54d8f0eddfb2d0d47aca352f3f1.jpg, https://salt.tikicdn.com/cache/w300/ts/product/87/e3/65/9353db171f6818f465eba8cdaa97c1d3.jpg, https://salt.tikicdn.com/cache/w300/ts/product/d6/d3/87/2f54eea613ad926e5b8de3aa862692f5.jpg, https://salt.tikicdn.com/cache/w300/ts/product/f4/6a/87/1854bb76e8da69140173218ddadc4400.jpg, https://salt.tikicdn.com/cache/w300/ts/product/b0/d5/16/b46a04c4f6aca765dcce3a08fd33bf32.jpg, https://salt.tikicdn.com/cache/w300/ts/product/9c/8a/42/8361caff72bb42319d336fbd0fb09aa7.jpg","https://salt.tikicdn.com/cache/200x280/ts/product/57/c8/e4/1e2af54d8f0eddfb2d0d47aca352f3f1.jpg, https://salt.tikicdn.com/cache/200x280/ts/product/87/e3/65/9353db171f6818f465eba8cdaa97c1d3.jpg, https://salt.tikicdn.com/cache/200x280/ts/product/d6/d3/87/2f54eea613ad926e5b8de3aa862692f5.jpg, https://salt.tikicdn.com/cache/200x280/ts/product/f4/6a/87/1854bb76e8da69140173218ddadc4400.jpg, https://salt.tikicdn.com/cache/200x280/ts/product/b0/d5/16/b46a04c4f6aca765dcce3a08fd33bf32.jpg, https://salt.tikicdn.com/cache/200x280/ts/product/9c/8a/42/8361caff72bb42319d336fbd0fb09aa7.jpg","https://salt.tikicdn.com/cache/200x280/ts/product/57/c8/e4/1e2af54d8f0eddfb2d0d47aca352f3f1.jpg, https://salt.tikicdn.com/cache/200x280/ts/product/87/e3/65/9353db171f6818f465eba8cdaa97c1d3.jpg, https://salt.tikicdn.com/cache/200x280/ts/product/d6/d3/87/2f54eea613ad926e5b8de3aa862692f5.jpg, https://salt.tikicdn.com/cache/200x280/ts/product/f4/6a/87/1854bb76e8da69140173218ddadc4400.jpg, https://salt.tikicdn.com/cache/200x280/ts/product/b0/d5/16/b46a04c4f6aca765dcce3a08fd33bf32.jpg, https://salt.tikicdn.com/cache/200x280/ts/product/9c/8a/42/8361caff72bb42319d336fbd0fb09aa7.jpg",1000,0
277411898,Bộ Thẻ Sưu Tập - Card Colletion Lớp Học Mật Ngữ Follow Me Vol 2 (5 Cards/Túi),64100,    Bộ Thẻ Sưu Tập - Card Colletion Lớp Học Mật Ngữ Follow Me Vol 2 (5 Cards/Túi)   Bạn là 1 cạ cứng của Lớp học mật ngữ?   Bạn có muốn ngắm nhìn những “BIAS” khi trở thành người nổi tiếng trên m...,"Bộ Thẻ Sưu Tập - Card Colletion Lớp Học Mật Ngữ Follow Me Vol 2 (5 Cards/Túi) Bạn là 1 cạ cứng của Lớp học mật ngữ? Bạn có muốn ngắm nhìn những “BIAS” khi trở thành người nổi tiếng trên mạng xã hội NGÂN HÀ? Bạn có muốn biết thêm về “bí mật nho nhỏ” của các nhân vật không? Nếu câu trả lời là “YES! YES! YES!” thì bạn sẽ không thể bỏ qua sản phẩm mới nhất của Lớp Học Mật Ngữ: FOLLOWME - bộ sưu tập “thẻ bo góc” MỚI TOANH, SIÊU ĐỘC QUYỀN, CHƯA TỪNG CÓ trên thị trường. 1 pack (5 thẻ) - 70% pack sẽ gồm 5 thẻ cung hoàng đạo ngẫu nhiên không trùng nhau. - 30% pack sẽ gồm 4 thẻ cung hoàng đạo ngẫu nhiên không trùng nhau và 1 thẻ bí mật bất kì. Giá sản phẩm trên Tiki đã bao gồm thuế theo luật hiện hành. Bên cạnh đó, tuỳ vào loại sản phẩm, hình thức và địa chỉ giao hàng mà có thể phát sinh thêm chi phí khác như phí vận chuyển, phụ phí hàng cồng kềnh, thuế nhập khẩu (đối với đơn hàng giao từ nước ngoài có giá trị trên 1 triệu đồng).....",0,0,"https://salt.tikicdn.com/ts/product/5f/2b/2f/7162a0ec7391c0652dab4f8a850e7ab7.jpg, https://salt.tikicdn.com/ts/product/ea/c7/e1/bc2f39841b7fef8b2afa1bad9da8af24.jpg, https://salt.tikicdn.com/ts/product/f1/f6/19/24325bbca8b34da4b2489b56e9830012.jpg, https://salt.tikicdn.com/ts/product/14/f9/63/385d468aa50f6b95a6976152f1b8eb49.jpg, https://salt.tikicdn.com/ts/product/6b/f1/65/76d498f7e943d5b3b5770c8dfc313b0c.jpg, https://salt.tikicdn.com/ts/product/27/7a/86/ca70acde7b484165750ba0669e417326.jpg","https://salt.tikicdn.com/cache/w1200/ts/product/5f/2b/2f/7162a0ec7391c0652dab4f8a850e7ab7.jpg, https://salt.tikicdn.com/cache/w1200/ts/product/ea/c7/e1/bc2f39841b7fef8b2afa1bad9da8af24.jpg, https://salt.tikicdn.com/cache/w1200/ts/product/f1/f6/19/24325bbca8b34da4b2489b56e9830012.jpg, https://salt.tikicdn.com/cache/w1200/ts/product/14/f9/63/385d468aa50f6b95a6976152f1b8eb49.jpg, https://salt.tikicdn.com/cache/w1200/ts/product/6b/f1/65/76d498f7e943d5b3b5770c8dfc313b0c.jpg, https://salt.tikicdn.com/cache/w1200/ts/product/27/7a/86/ca70acde7b484165750ba0669e417326.jpg","https://salt.tikicdn.com/cache/w300/ts/product/5f/2b/2f/7162a0ec7391c0652dab4f8a850e7ab7.jpg, https://salt.tikicdn.com/cache/w300/ts/product/ea/c7/e1/bc2f39841b7fef8b2afa1bad9da8af24.jpg, https://salt.tikicdn.com/cache/w300/ts/product/f1/f6/19/24325bbca8b34da4b2489b56e9830012.jpg, https://salt.tikicdn.com/cache/w300/ts/product/14/f9/63/385d468aa50f6b95a6976152f1b8eb49.jpg, https://salt.tikicdn.com/cache/w300/ts/product/6b/f1/65/76d498f7e943d5b3b5770c8dfc313b0c.jpg, https://salt.tikicdn.com/cache/w300/ts/product/27/7a/86/ca70acde7b484165750ba0669e417326.jpg","https://salt.tikicdn.com/cache/200x280/ts/product/5f/2b/2f/7162a0ec7391c0652dab4f8a850e7ab7.jpg, https://salt.tikicdn.com/cache/200x280/ts/product/ea/c7/e1/bc2f39841b7fef8b2afa1bad9da8af24.jpg, https://salt.tikicdn.com/cache/200x280/ts/product/f1/f6/19/24325bbca8b34da4b2489b56e9830012.jpg, https://salt.tikicdn.com/cache/200x280/ts/product/14/f9/63/385d468aa50f6b95a6976152f1b8eb49.jpg, https://salt.tikicdn.com/cache/200x280/ts/product/6b/f1/65/76d498f7e943d5b3b5770c8dfc313b0c.jpg, https://salt.tikicdn.com/cache/200x280/ts/product/27/7a/86/ca70acde7b484165750ba0669e417326.jpg","https://salt.tikicdn.com/cache/200x280/ts/product/5f/2b/2f/7162a0ec7391c0652dab4f8a850e7ab7.jpg, https://salt.tikicdn.com/cache/200x280/ts/product/ea/c7/e1/bc2f39841b7fef8b2afa1bad9da8af24.jpg, https://salt.tikicdn.com/cache/200x280/ts/product/f1/f6/19/24325bbca8b34da4b2489b56e9830012.jpg, https://salt.tikicdn.com/cache/200x280/ts/product/14/f9/63/385d468aa50f6b95a6976152f1b8eb49.jpg, https://salt.tikicdn.com/cache/200x280/ts/product/6b/f1/65/76d498f7e943d5b3b5770c8dfc313b0c.jpg, https://salt.tikicdn.com/cache/200x280/ts/product/27/7a/86/ca70acde7b484165750ba0669e417326.jpg",1000,0
277348980,Gấu Bông Baby Three LIILA Size 600%,620000,"Baby Three 600% – HottrendShop giao box ngẫu nhiên, khách tự khám phá...","Baby Three 600% – Hottrend Shop giao box ngẫu nhiên, khách tự khám phá Giá sản phẩm trên Tiki đã bao gồm thuế theo luật hiện hành. Bên cạnh đó, tuỳ vào loại sản phẩm, hình thức và địa chỉ giao hàng mà có thể phát sinh thêm chi phí khác như phí vận chuyển, phụ phí hàng cồng kềnh, thuế nhập khẩu (đối với đơn hàng giao từ nước ngoài có giá trị trên 1 triệu đồng).....",0,0,"https://salt.tikicdn.com/ts/product/a4/55/21/6472e65bce7ff277c06bd486f62a0c57.jpg, https://salt.tikicdn.com/ts/product/e5/41/0e/c91929a10da539d306ad9615cd966a7b.jpg, https://salt.tikicdn.com/ts/product/e7/c2/06/0d8dcc82ca16a9af05a71061cd92819a.jpg, https://salt.tikicdn.com/ts/product/02/b6/ef/a185a8ecee668bd5074077c3bea16e57.jpg, https://salt.tikicdn.com/ts/product/6e/c1/7b/7412d3cb37c5554cf033dfef3b5c29e3.jpg, https://salt.tikicdn.com/ts/product/4b/47/2f/19036e86620c5e00e7cf227cde299bf4.jpg, https://salt.tikicdn.com/ts/product/3b/96/6d/1658f3b1ae7765b6cae4c13542ed311c.jpg, https://salt.tikicdn.com/ts/product/d3/b5/16/a23bf3f8a5ef6071e8d140b79d3cd1bc.jpg, https://salt.tikicdn.com/ts/product/c9/c4/7f/ae6738352c28443f3171a800d4e21d92.jpg, https://salt.tikicdn.com/ts/product/2d/01/bb/30f9d2f90340e918bd58373f3c24b9e1.jpg","https://salt.tikicdn.com/cache/w1200/ts/product/a4/55/21/6472e65bce7ff277c06bd486f62a0c57.jpg, https://salt.tikicdn.com/cache/w1200/ts/product/e5/41/0e/c91929a10da539d306ad9615cd966a7b.jpg, https://salt.tikicdn.com/cache/w1200/ts/product/e7/c2/06/0d8dcc82ca16a9af05a71061cd92819a.jpg, https://salt.tikicdn.com/cache/w1200/ts/product/02/b6/ef/a185a8ecee668bd5074077c3bea16e57.jpg, https://salt.tikicdn.com/cache/w1200/ts/product/6e/c1/7b/7412d3cb37c5554cf033dfef3b5c29e3.jpg, https://salt.tikicdn.com/cache/w1200/ts/product/4b/47/2f/19036e86620c5e00e7cf227cde299bf4.jpg, https://salt.tikicdn.com/cache/w1200/ts/product/3b/96/6d/1658f3b1ae7765b6cae4c13542ed311c.jpg, https://salt.tikicdn.com/cache/w1200/ts/product/d3/b5/16/a23bf3f8a5ef6071e8d140b79d3cd1bc.jpg, https://salt.tikicdn.com/cache/w1200/ts/product/c9/c4/7f/ae6738352c28443f3171a800d4e21d92.jpg, https://salt.tikicdn.com/cache/w1200/ts/product/2d/01/bb/30f9d2f90340e918bd58373f3c24b9e1.jpg","https://salt.tikicdn.com/cache/w300/ts/product/a4/55/21/6472e65bce7ff277c06bd486f62a0c57.jpg, https://salt.tikicdn.com/cache/w300/ts/product/e5/41/0e/c91929a10da539d306ad9615cd966a7b.jpg, https://salt.tikicdn.com/cache/w300/ts/product/e7/c2/06/0d8dcc82ca16a9af05a71061cd92819a.jpg, https://salt.tikicdn.com/cache/w300/ts/product/02/b6/ef/a185a8ecee668bd5074077c3bea16e57.jpg, https://salt.tikicdn.com/cache/w300/ts/product/6e/c1/7b/7412d3cb37c5554cf033dfef3b5c29e3.jpg, https://salt.tikicdn.com/cache/w300/ts/product/4b/47/2f/19036e86620c5e00e7cf227cde299bf4.jpg, https://salt.tikicdn.com/cache/w300/ts/product/3b/96/6d/1658f3b1ae7765b6cae4c13542ed311c.jpg, https://salt.tikicdn.com/cache/w300/ts/product/d3/b5/16/a23bf3f8a5ef6071e8d140b79d3cd1bc.jpg, https://salt.tikicdn.com/cache/w300/ts/product/c9/c4/7f/ae6738352c28443f3171a800d4e21d92.jpg, https://salt.tikicdn.com/cache/w300/ts/product/2d/01/bb/30f9d2f90340e918bd58373f3c24b9e1.jpg","https://salt.tikicdn.com/cache/200x280/ts/product/a4/55/21/6472e65bce7ff277c06bd486f62a0c57.jpg, https://salt.tikicdn.com/cache/200x280/ts/product/e5/41/0e/c91929a10da539d306ad9615cd966a7b.jpg, https://salt.tikicdn.com/cache/200x280/ts/product/e7/c2/06/0d8dcc82ca16a9af05a71061cd92819a.jpg, https://salt.tikicdn.com/cache/200x280/ts/product/02/b6/ef/a185a8ecee668bd5074077c3bea16e57.jpg, https://salt.tikicdn.com/cache/200x280/ts/product/6e/c1/7b/7412d3cb37c5554cf033dfef3b5c29e3.jpg, https://salt.tikicdn.com/cache/200x280/ts/product/4b/47/2f/19036e86620c5e00e7cf227cde299bf4.jpg, https://salt.tikicdn.com/cache/200x280/ts/product/3b/96/6d/1658f3b1ae7765b6cae4c13542ed311c.jpg, https://salt.tikicdn.com/cache/200x280/ts/product/d3/b5/16/a23bf3f8a5ef6071e8d140b79d3cd1bc.jpg, https://salt.tikicdn.com/cache/200x280/ts/product/c9/c4/7f/ae6738352c28443f3171a800d4e21d92.jpg, https://salt.tikicdn.com/cache/200x280/ts/product/2d/01/bb/30f9d2f90340e918bd58373f3c24b9e1.jpg","https://salt.tikicdn.com/cache/200x280/ts/product/a4/55/21/6472e65bce7ff277c06bd486f62a0c57.jpg, https://salt.tikicdn.com/cache/200x280/ts/product/e5/41/0e/c91929a10da539d306ad9615cd966a7b.jpg, https://salt.tikicdn.com/cache/200x280/ts/product/e7/c2/06/0d8dcc82ca16a9af05a71061cd92819a.jpg, https://salt.tikicdn.com/cache/200x280/ts/product/02/b6/ef/a185a8ecee668bd5074077c3bea16e57.jpg, https://salt.tikicdn.com/cache/200x280/ts/product/6e/c1/7b/7412d3cb37c5554cf033dfef3b5c29e3.jpg, https://salt.tikicdn.com/cache/200x280/ts/product/4b/47/2f/19036e86620c5e00e7cf227cde299bf4.jpg, https://salt.tikicdn.com/cache/200x280/ts/product/3b/96/6d/1658f3b1ae7765b6cae4c13542ed311c.jpg, https://salt.tikicdn.com/cache/200x280/ts/product/d3/b5/16/a23bf3f8a5ef6071e8d140b79d3cd1bc.jpg, https://salt.tikicdn.com/cache/200x280/ts/product/c9/c4/7f/ae6738352c28443f3171a800d4e21d92.jpg, https://salt.tikicdn.com/cache/200x280/ts/product/2d/01/bb/30f9d2f90340e918bd58373f3c24b9e1.jpg",1000,0
276423009,Thẻ Nhân Phẩm Pack Card Pola Detective Conan Movie 27: Ngôi Sao 5 Cánh 1 Triệu Đô - Movic 21145339 (3 Cards Ngẫu Nhiên/Túi),65500,    Thẻ Nhân Phẩm Pack Card Pola Detective Conan Movie 27: Ngôi Sao 5 Cánh 1 Triệu Đô - Movic 21145339 (3 Cards Ngẫu Nhiên/Túi)   - Pack card chính hãng Conan   - Giá bao gồm 1 pack lẻ   - Pack ...,"Thẻ Nhân Phẩm Pack Card Pola Detective Conan Movie 27: Ngôi Sao 5 Cánh 1 Triệu Đô - Movic 21145339 (3 Cards Ngẫu Nhiên/Túi) - Pack card chính hãng Conan - Giá bao gồm 1 pack lẻ - Pack lẻ gồm: 3 thẻ random (full box 10 pack) - Kích thước: 6.3 x 8.9cm - Chất liệu: Pola - Xuất xứ: Nhật Bản Giá sản phẩm trên Tiki đã bao gồm thuế theo luật hiện hành. Bên cạnh đó, tuỳ vào loại sản phẩm, hình thức và địa chỉ giao hàng mà có thể phát sinh thêm chi phí khác như phí vận chuyển, phụ phí hàng cồng kềnh, thuế nhập khẩu (đối với đơn hàng giao từ nước ngoài có giá trị trên 1 triệu đồng).....",0,0,"https://salt.tikicdn.com/ts/product/23/f5/da/2ba8f114553dc8874f63612f973a41dc.jpg, https://salt.tikicdn.com/ts/product/f5/7e/02/2e9d3dd08496df79649f06b0b56e6a77.jpg, https://salt.tikicdn.com/ts/product/5c/3d/fe/6d2011cb7e2d33e2378d48f65feefa9e.jpg, https://salt.tikicdn.com/ts/product/5d/12/21/23e4c59a43ad9b1a02eee8ed6a39bb17.jpg, https://salt.tikicdn.com/ts/product/e8/fe/e5/53c72903324994fed06af4fdcc664ab6.jpg, https://salt.tikicdn.com/ts/product/86/fe/dc/50ecf7cbcd1cfcac07330c0f86932837.jpg, https://salt.tikicdn.com/ts/product/dd/e3/64/76c41f37528965ec506c42dc8f47ca6b.jpg","https://salt.tikicdn.com/cache/w1200/ts/product/23/f5/da/2ba8f114553dc8874f63612f973a41dc.jpg, https://salt.tikicdn.com/cache/w1200/ts/product/f5/7e/02/2e9d3dd08496df79649f06b0b56e6a77.jpg, https://salt.tikicdn.com/cache/w1200/ts/product/5c/3d/fe/6d2011cb7e2d33e2378d48f65feefa9e.jpg, https://salt.tikicdn.com/cache/w1200/ts/product/5d/12/21/23e4c59a43ad9b1a02eee8ed6a39bb17.jpg, https://salt.tikicdn.com/cache/w1200/ts/product/e8/fe/e5/53c72903324994fed06af4fdcc664ab6.jpg, https://salt.tikicdn.com/cache/w1200/ts/product/86/fe/dc/50ecf7cbcd1cfcac07330c0f86932837.jpg, https://salt.tikicdn.com/cache/w1200/ts/product/dd/e3/64/76c41f37528965ec506c42dc8f47ca6b.jpg","https://salt.tikicdn.com/cache/w300/ts/product/23/f5/da/2ba8f114553dc8874f63612f973a41dc.jpg, https://salt.tikicdn.com/cache/w300/ts/product/f5/7e/02/2e9d3dd08496df79649f06b0b56e6a77.jpg, https://salt.tikicdn.com/cache/w300/ts/product/5c/3d/fe/6d2011cb7e2d33e2378d48f65feefa9e.jpg, https://salt.tikicdn.com/cache/w300/ts/product/5d/12/21/23e4c59a43ad9b1a02eee8ed6a39bb17.jpg, https://salt.tikicdn.com/cache/w300/ts/product/e8/fe/e5/53c72903324994fed06af4fdcc664ab6.jpg, https://salt.tikicdn.com/cache/w300/ts/product/86/fe/dc/50ecf7cbcd1cfcac07330c0f86932837.jpg, https://salt.tikicdn.com/cache/w300/ts/product/dd/e3/64/76c41f37528965ec506c42dc8f47ca6b.jpg","https://salt.tikicdn.com/cache/200x280/ts/product/23/f5/da/2ba8f114553dc8874f63612f973a41dc.jpg, https://salt.tikicdn.com/cache/200x280/ts/product/f5/7e/02/2e9d3dd08496df79649f06b0b56e6a77.jpg, https://salt.tikicdn.com/cache/200x280/ts/product/5c/3d/fe/6d2011cb7e2d33e2378d48f65feefa9e.jpg, https://salt.tikicdn.com/cache/200x280/ts/product/5d/12/21/23e4c59a43ad9b1a02eee8ed6a39bb17.jpg, https://salt.tikicdn.com/cache/200x280/ts/product/e8/fe/e5/53c72903324994fed06af4fdcc664ab6.jpg, https://salt.tikicdn.com/cache/200x280/ts/product/86/fe/dc/50ecf7cbcd1cfcac07330c0f86932837.jpg, https://salt.tikicdn.com/cache/200x280/ts/product/dd/e3/64/76c41f37528965ec506c42dc8f47ca6b.jpg","https://salt.tikicdn.com/cache/200x280/ts/product/23/f5/da/2ba8f114553dc8874f63612f973a41dc.jpg, https://salt.tikicdn.com/cache/200x280/ts/product/f5/7e/02/2e9d3dd08496df79649f06b0b56e6a77.jpg, https://salt.tikicdn.com/cache/200x280/ts/product/5c/3d/fe/6d2011cb7e2d33e2378d48f65feefa9e.jpg, https://salt.tikicdn.com/cache/200x280/ts/product/5d/12/21/23e4c59a43ad9b1a02eee8ed6a39bb17.jpg, https://salt.tikicdn.com/cache/200x280/ts/product/e8/fe/e5/53c72903324994fed06af4fdcc664ab6.jpg, https://salt.tikicdn.com/cache/200x280/ts/product/86/fe/dc/50ecf7cbcd1cfcac07330c0f86932837.jpg, https://salt.tikicdn.com/cache/200x280/ts/product/dd/e3/64/76c41f37528965ec506c42dc8f47ca6b.jpg",1000,0
