id,name,price,short_description,description,rating_average,review_count,image_base_url,image_large_url,image_medium_url,image_small_url,image_thumbnail_url,stock,quantity_sold
160308503,"Sách  - Combo 3 cuốn Thành ngữ, tục ngữ và ca dao Việt Nam - ndbooks",119000,"* Mô tả:1. Thành ngữThành ngữ được sử dụng rộng rãi trong lời ăn tiếng nói cũng như sáng tác thơ ca văn học tiếng Việt. Thành ngữ ngắn gọn, hàm súc, có tính hình tượng, tính biểu cảm cao 2. Ca Dao...","* Mô tả: 1. Thành ngữ Thành ngữ được sử dụng rộng rãi trong lời ăn tiếng nói cũng như sáng tác thơ ca văn học tiếng Việt. Thành ngữ ngắn gọn, hàm súc, có tính hình tượng, tính biểu cảm cao 2. Ca Dao Ca dao là phần phong phú nhất trong văn học dân gian của dân tộc ta 3. Tục Ngữ Cuốn sách Tục ngữ ca dao Việt Nam tuyển chọn và giới thiệu các tục ngữ, ca dao của người Kinh, từ những câu tục ngữ đúc kết những kinh nghiệm sống, kinh nghiệm sản xuất, kinh nghiệm xã hội lịch sử của nhân dân lao động xưa truyền lại cho đến những câu ca dạo ca ngợi về đất nước, lịch sử, ca ngợi những danh lam thắng cảnh, những đặc sản của các địa phương truyền thống, truyền thống chống giặc ngoại xâm, chống ách áp bức phong kiến của nhân dân, ca dao về tình yêu đôi lứa. Công ty phát hành: ndbooks Nhà xuất bản: NXB Thanh Niên Tác giả: Nguyệt Giang Số trang: 144 Năm xuất bản: 2024 #cadaotucnguvietnam #ndbooks #sachvanhoc #thanhngutucngu #cadaovietnam #ndbooks #sachnhandan #cadao #tucngu Giá sản phẩm trên Tiki đã bao gồm thuế theo luật hiện hành. Bên cạnh đó, tuỳ vào loại sản phẩm, hình thức và địa chỉ giao hàng mà có thể phát sinh thêm chi phí khác như phí vận chuyển, phụ phí hàng cồng kềnh, thuế nhập khẩu (đối với đơn hàng giao từ nước ngoài có giá trị trên 1 triệu đồng).....",0,0,"https://salt.tikicdn.com/ts/product/a3/d2/fd/993f683e29d76f9c96ab522973d74fa1.jpg, https://salt.tikicdn.com/ts/product/26/f2/d3/906643d132ac7564d336a7f19a6ca13f.jpg, https://salt.tikicdn.com/ts/product/6a/d0/52/2c86b78e5f07b7a1110fada1971d9a2c.jpg, https://salt.tikicdn.com/ts/product/44/66/45/01c3163b4d6ad7333436d4280ae02a3d.jpg, https://salt.tikicdn.com/ts/product/bd/f6/27/bfd0de7e29eb28e723505d00c0a340ea.jpg, https://salt.tikicdn.com/ts/product/5a/7c/d4/4dec83154a56825d562a5ca8dd23fdea.jpg, https://salt.tikicdn.com/ts/product/9d/5c/be/f404d0587724cf0da1534bc268ef6141.jpg","https://salt.tikicdn.com/cache/w1200/ts/product/a3/d2/fd/993f683e29d76f9c96ab522973d74fa1.jpg, https://salt.tikicdn.com/cache/w1200/ts/product/26/f2/d3/906643d132ac7564d336a7f19a6ca13f.jpg, https://salt.tikicdn.com/cache/w1200/ts/product/6a/d0/52/2c86b78e5f07b7a1110fada1971d9a2c.jpg, https://salt.tikicdn.com/cache/w1200/ts/product/44/66/45/01c3163b4d6ad7333436d4280ae02a3d.jpg, https://salt.tikicdn.com/cache/w1200/ts/product/bd/f6/27/bfd0de7e29eb28e723505d00c0a340ea.jpg, https://salt.tikicdn.com/cache/w1200/ts/product/5a/7c/d4/4dec83154a56825d562a5ca8dd23fdea.jpg, https://salt.tikicdn.com/cache/w1200/ts/product/9d/5c/be/f404d0587724cf0da1534bc268ef6141.jpg","https://salt.tikicdn.com/cache/w300/ts/product/a3/d2/fd/993f683e29d76f9c96ab522973d74fa1.jpg, https://salt.tikicdn.com/cache/w300/ts/product/26/f2/d3/906643d132ac7564d336a7f19a6ca13f.jpg, https://salt.tikicdn.com/cache/w300/ts/product/6a/d0/52/2c86b78e5f07b7a1110fada1971d9a2c.jpg, https://salt.tikicdn.com/cache/w300/ts/product/44/66/45/01c3163b4d6ad7333436d4280ae02a3d.jpg, https://salt.tikicdn.com/cache/w300/ts/product/bd/f6/27/bfd0de7e29eb28e723505d00c0a340ea.jpg, https://salt.tikicdn.com/cache/w300/ts/product/5a/7c/d4/4dec83154a56825d562a5ca8dd23fdea.jpg, https://salt.tikicdn.com/cache/w300/ts/product/9d/5c/be/f404d0587724cf0da1534bc268ef6141.jpg","https://salt.tikicdn.com/cache/200x280/ts/product/a3/d2/fd/993f683e29d76f9c96ab522973d74fa1.jpg, https://salt.tikicdn.com/cache/200x280/ts/product/26/f2/d3/906643d132ac7564d336a7f19a6ca13f.jpg, https://salt.tikicdn.com/cache/200x280/ts/product/6a/d0/52/2c86b78e5f07b7a1110fada1971d9a2c.jpg, https://salt.tikicdn.com/cache/200x280/ts/product/44/66/45/01c3163b4d6ad7333436d4280ae02a3d.jpg, https://salt.tikicdn.com/cache/200x280/ts/product/bd/f6/27/bfd0de7e29eb28e723505d00c0a340ea.jpg, https://salt.tikicdn.com/cache/200x280/ts/product/5a/7c/d4/4dec83154a56825d562a5ca8dd23fdea.jpg, https://salt.tikicdn.com/cache/200x280/ts/product/9d/5c/be/f404d0587724cf0da1534bc268ef6141.jpg","https://salt.tikicdn.com/cache/200x280/ts/product/a3/d2/fd/993f683e29d76f9c96ab522973d74fa1.jpg, https://salt.tikicdn.com/cache/200x280/ts/product/26/f2/d3/906643d132ac7564d336a7f19a6ca13f.jpg, https://salt.tikicdn.com/cache/200x280/ts/product/6a/d0/52/2c86b78e5f07b7a1110fada1971d9a2c.jpg, https://salt.tikicdn.com/cache/200x280/ts/product/44/66/45/01c3163b4d6ad7333436d4280ae02a3d.jpg, https://salt.tikicdn.com/cache/200x280/ts/product/bd/f6/27/bfd0de7e29eb28e723505d00c0a340ea.jpg, https://salt.tikicdn.com/cache/200x280/ts/product/5a/7c/d4/4dec83154a56825d562a5ca8dd23fdea.jpg, https://salt.tikicdn.com/cache/200x280/ts/product/9d/5c/be/f404d0587724cf0da1534bc268ef6141.jpg",1000,0
77222504,Sách - Thành ngữ và tục ngữ Việt Nam (tặng kèm bookmark thiết kế),57800,       Tác giả: Trần Quang Đức - Nguyễn Giang Linh - Đặng Hồng Quân   Nhà xuất bản: Hội nhà văn   Số trang: 87   Kích thước: 20 x 20 cm   Ngày phát hành: 29-12-2019   ...,"Tác giả: Trần Quang Đức - Nguyễn Giang Linh - Đặng Hồng Quân Nhà xuất bản: Hội nhà văn Số trang: 87 Kích thước: 20 x 20 cm Ngày phát hành: 29-12-2019 Giá sản phẩm trên Tiki đã bao gồm thuế theo luật hiện hành. Bên cạnh đó, tuỳ vào loại sản phẩm, hình thức và địa chỉ giao hàng mà có thể phát sinh thêm chi phí khác như phí vận chuyển, phụ phí hàng cồng kềnh, thuế nhập khẩu (đối với đơn hàng giao từ nước ngoài có giá trị trên 1 triệu đồng).....",0,0,https://salt.tikicdn.com/ts/product/70/b1/a2/20bb55fed828a885536b8f1b4c410552.jpg,https://salt.tikicdn.com/cache/w1200/ts/product/70/b1/a2/20bb55fed828a885536b8f1b4c410552.jpg,https://salt.tikicdn.com/cache/w300/ts/product/70/b1/a2/20bb55fed828a885536b8f1b4c410552.jpg,https://salt.tikicdn.com/cache/200x280/ts/product/70/b1/a2/20bb55fed828a885536b8f1b4c410552.jpg,https://salt.tikicdn.com/cache/200x280/ts/product/70/b1/a2/20bb55fed828a885536b8f1b4c410552.jpg,1000,0
76781380,Sách - Thành Ngữ Tục Ngữ Việt Nam (Nguyệt Giang) - Ndbooks,39600,"Mỗi người có một miền quê thương mến, rộng ra cho cả cộng đồng thì đó chính là cội nguồn dân tộc. Trân trọng nguồn cội dấu yêu là nền tảng căn bản để từng người con lớn lên lành mạnh. Để hiểu về dân t...","Mỗi người có một miền quê thương mến, rộng ra cho cả cộng đồng thì đó chính là cội nguồn dân tộc. Trân trọng nguồn cội dấu yêu là nền tảng căn bản để từng người con lớn lên lành mạnh. Để hiểu về dân tộc mình thì bước đầu tiên là học rành rẽ ngôn ngữ, câu chữ từ xưa truyền lại. Ông cha ta để lại rất nhiều cụm từ, câu nói, bài thơ ngắn gọn, giản dị, giàu nhịp điệu và hình ảnh... Thuộc những cụm từ ấy, ta giàu thêm vốn từ, ta biết thêm kinh nghiệm, và tâm hồn ta cũng “giàu có” rất nhiều. Đó là những câu thành ngữ, tục ngữ, ca dao, dân ca... Cuốn sách này lựa ra những thành ngữ và tục ngữ thường gặp và dễ hiểu với bạn đọc trên 3 tuổi, thêm chú dẫn những khái niệm cổ và khó, thêm các cụm từ gần gặn... giúp các bạn đọc ít mà hiểu nhiều. Thông tin chi tiết: Công ty phát hành: NDBooks Nhà xuất bản: NXB Thanh Niên Kích thước: 13.5 x 20.5 cm Tác giả: Nguyệt Giang Số trang: 156 Năm xuất bản: 2023 #sachnhandan #ndbooks #thanhngutucnguvietnam #thanhngu #tucngu #thohay #sachhay #sachthieunhi Giá sản phẩm trên Tiki đã bao gồm thuế theo luật hiện hành. Bên cạnh đó, tuỳ vào loại sản phẩm, hình thức và địa chỉ giao hàng mà có thể phát sinh thêm chi phí khác như phí vận chuyển, phụ phí hàng cồng kềnh, thuế nhập khẩu (đối với đơn hàng giao từ nước ngoài có giá trị trên 1 triệu đồng).....",5,3,"https://salt.tikicdn.com/ts/product/01/dc/01/58100f8e2ba21be742969b5b88a26e00.jpg, https://salt.tikicdn.com/ts/product/77/ff/c3/5191d9919ad939d03ca22d5e61569164.jpg, https://salt.tikicdn.com/ts/product/65/1d/ae/ffaee8bc6b35e0937a4f8c078bba033e.jpg, https://salt.tikicdn.com/ts/product/ab/34/52/a4ec22ab852733b371d70182e2d39e00.jpg, https://salt.tikicdn.com/ts/product/48/df/34/8066ab206cb8068f5307dc4a569bbf4e.jpg, https://salt.tikicdn.com/ts/product/b2/6c/01/300b56d1540fa4176ed09a168c131727.jpg, https://salt.tikicdn.com/ts/product/5a/2a/1a/883e5f423619c7db8f7d75f8bd77e4e4.jpg, https://salt.tikicdn.com/ts/product/0e/d0/cf/ac395bca51a72393b7a268cfae437442.jpg, https://salt.tikicdn.com/ts/product/11/c4/de/fd38d09cf4ffc6a1568ae4aeca65f421.jpg","https://salt.tikicdn.com/cache/w1200/ts/product/01/dc/01/58100f8e2ba21be742969b5b88a26e00.jpg, https://salt.tikicdn.com/cache/w1200/ts/product/77/ff/c3/5191d9919ad939d03ca22d5e61569164.jpg, https://salt.tikicdn.com/cache/w1200/ts/product/65/1d/ae/ffaee8bc6b35e0937a4f8c078bba033e.jpg, https://salt.tikicdn.com/cache/w1200/ts/product/ab/34/52/a4ec22ab852733b371d70182e2d39e00.jpg, https://salt.tikicdn.com/cache/w1200/ts/product/48/df/34/8066ab206cb8068f5307dc4a569bbf4e.jpg, https://salt.tikicdn.com/cache/w1200/ts/product/b2/6c/01/300b56d1540fa4176ed09a168c131727.jpg, https://salt.tikicdn.com/cache/w1200/ts/product/5a/2a/1a/883e5f423619c7db8f7d75f8bd77e4e4.jpg, https://salt.tikicdn.com/cache/w1200/ts/product/0e/d0/cf/ac395bca51a72393b7a268cfae437442.jpg, https://salt.tikicdn.com/cache/w1200/ts/product/11/c4/de/fd38d09cf4ffc6a1568ae4aeca65f421.jpg","https://salt.tikicdn.com/cache/w300/ts/product/01/dc/01/58100f8e2ba21be742969b5b88a26e00.jpg, https://salt.tikicdn.com/cache/w300/ts/product/77/ff/c3/5191d9919ad939d03ca22d5e61569164.jpg, https://salt.tikicdn.com/cache/w300/ts/product/65/1d/ae/ffaee8bc6b35e0937a4f8c078bba033e.jpg, https://salt.tikicdn.com/cache/w300/ts/product/ab/34/52/a4ec22ab852733b371d70182e2d39e00.jpg, https://salt.tikicdn.com/cache/w300/ts/product/48/df/34/8066ab206cb8068f5307dc4a569bbf4e.jpg, https://salt.tikicdn.com/cache/w300/ts/product/b2/6c/01/300b56d1540fa4176ed09a168c131727.jpg, https://salt.tikicdn.com/cache/w300/ts/product/5a/2a/1a/883e5f423619c7db8f7d75f8bd77e4e4.jpg, https://salt.tikicdn.com/cache/w300/ts/product/0e/d0/cf/ac395bca51a72393b7a268cfae437442.jpg, https://salt.tikicdn.com/cache/w300/ts/product/11/c4/de/fd38d09cf4ffc6a1568ae4aeca65f421.jpg","https://salt.tikicdn.com/cache/200x280/ts/product/01/dc/01/58100f8e2ba21be742969b5b88a26e00.jpg, https://salt.tikicdn.com/cache/200x280/ts/product/77/ff/c3/5191d9919ad939d03ca22d5e61569164.jpg, https://salt.tikicdn.com/cache/200x280/ts/product/65/1d/ae/ffaee8bc6b35e0937a4f8c078bba033e.jpg, https://salt.tikicdn.com/cache/200x280/ts/product/ab/34/52/a4ec22ab852733b371d70182e2d39e00.jpg, https://salt.tikicdn.com/cache/200x280/ts/product/48/df/34/8066ab206cb8068f5307dc4a569bbf4e.jpg, https://salt.tikicdn.com/cache/200x280/ts/product/b2/6c/01/300b56d1540fa4176ed09a168c131727.jpg, https://salt.tikicdn.com/cache/200x280/ts/product/5a/2a/1a/883e5f423619c7db8f7d75f8bd77e4e4.jpg, https://salt.tikicdn.com/cache/200x280/ts/product/0e/d0/cf/ac395bca51a72393b7a268cfae437442.jpg, https://salt.tikicdn.com/cache/200x280/ts/product/11/c4/de/fd38d09cf4ffc6a1568ae4aeca65f421.jpg","https://salt.tikicdn.com/cache/200x280/ts/product/01/dc/01/58100f8e2ba21be742969b5b88a26e00.jpg, https://salt.tikicdn.com/cache/200x280/ts/product/77/ff/c3/5191d9919ad939d03ca22d5e61569164.jpg, https://salt.tikicdn.com/cache/200x280/ts/product/65/1d/ae/ffaee8bc6b35e0937a4f8c078bba033e.jpg, https://salt.tikicdn.com/cache/200x280/ts/product/ab/34/52/a4ec22ab852733b371d70182e2d39e00.jpg, https://salt.tikicdn.com/cache/200x280/ts/product/48/df/34/8066ab206cb8068f5307dc4a569bbf4e.jpg, https://salt.tikicdn.com/cache/200x280/ts/product/b2/6c/01/300b56d1540fa4176ed09a168c131727.jpg, https://salt.tikicdn.com/cache/200x280/ts/product/5a/2a/1a/883e5f423619c7db8f7d75f8bd77e4e4.jpg, https://salt.tikicdn.com/cache/200x280/ts/product/0e/d0/cf/ac395bca51a72393b7a268cfae437442.jpg, https://salt.tikicdn.com/cache/200x280/ts/product/11/c4/de/fd38d09cf4ffc6a1568ae4aeca65f421.jpg",1000,3
73667928,Combo Ca Dao Tục Ngữ Việt Nam (Tái Bản)+Từ Điển Thành Ngữ Và Tục Ngữ Việt Nam,174794,"Từ Điển Thành Ngữ Và Tục Ngữ Việt NamHiểu và vận dụng linh hoạt thành ngữ, tục ngữ và các tình huống cụ thể sẽ giúp chúng ta biết nói đúng và viết đúng, để có thể tiến tới nói hay và viết hay. Sự ra ...","Từ Điển Thành Ngữ Và Tục Ngữ Việt Nam Hiểu và vận dụng linh hoạt thành ngữ, tục ngữ và các tình huống cụ thể sẽ giúp chúng ta biết nói đúng và viết đúng, để có thể tiến tới nói hay và viết hay. Sự ra đời của cuốn từ điển này không nằm ngoài mục đích đó. Cuốn sách này sẽ giúp các bạn học sinh, sinh viên nắm vững hơn nội dung cụ thể của từng thành ngữ, tục ngữ; để trên cơ sở đó, vừa bổ sung kiến thức, vừa vận dụng vào cách nói, cách viết của mình được trong sáng hơn, hiệu quả hơn. Hợp tuyển những câu tục ngữ, ca dao hay, đặc sắc và có ý nghĩa, phản ánh phong phú về thiên nhiên, con người, tình yêu, tình cảm gia đình cũng như thực trạng xã hội Việt Nam qua các thời kỳ lịch sử. Về hình thức, tục ngữ và ca dao Việt Nam có những đặc tính như thế, còn về nội dung, so với toàn thể văn học của nước ta, những câu ca dao tục ngữ đã phản ánh nhiều hơn về tình hình sản xuất, sinh hoạt mang đặc tính dân tộc, như chịu đựng gian khổ, bền bỉ và dũng cảm trong chiến đấu, yêu lao động, yêu tự do, những mối tình nồng thắm, lành mạnh giữa nam nữ, tình yêu quê hương, đất nước của nhân dân Việt Nam. Giá sản phẩm trên Tiki đã bao gồm thuế theo luật hiện hành. Bên cạnh đó, tuỳ vào loại sản phẩm, hình thức và địa chỉ giao hàng mà có thể phát sinh thêm chi phí khác như phí vận chuyển, phụ phí hàng cồng kềnh, thuế nhập khẩu (đối với đơn hàng giao từ nước ngoài có giá trị trên 1 triệu đồng).....",3.7,7,https://salt.tikicdn.com/ts/product/c3/8b/dc/4b7c8d08297360587ea89cb45b6304cd.png,https://salt.tikicdn.com/cache/w1200/ts/product/c3/8b/dc/4b7c8d08297360587ea89cb45b6304cd.png,https://salt.tikicdn.com/cache/w300/ts/product/c3/8b/dc/4b7c8d08297360587ea89cb45b6304cd.png,https://salt.tikicdn.com/cache/200x280/ts/product/c3/8b/dc/4b7c8d08297360587ea89cb45b6304cd.png,https://salt.tikicdn.com/cache/200x280/ts/product/c3/8b/dc/4b7c8d08297360587ea89cb45b6304cd.png,1000,7
46789747,Thành Ngữ Và Tục Ngữ Việt Nam (Tái Bản),55760,"Mỗi người có một miền quê thương mến, rộng ra cho cả cộng đồng thì đó chính là cội nguồn dân tộc. Trân trọng nguồn cội dấu yêu là nền tảng căn bản để từng người con lớn lên lành mạnh. Để hiểu về dân t...","Mỗi người có một miền quê thương mến, rộng ra cho cả cộng đồng thì đó chính là cội nguồn dân tộc. Trân trọng nguồn cội dấu yêu là nền tảng căn bản để từng người con lớn lên lành mạnh. Để hiểu về dân tộc mình thì bước đầu tiên là học rành rẽ ngôn ngữ, câu chữ từ xưa truyền lại. Ông cha ta để lại rất nhiều cụm từ, câu nói, bài thơ ngắn gọn, giản dị, giàu nhịp điệu và hình ả Thuộc những cụm từ ấy, ta giàu thêm vốn từ, ta biết thêm kinh nghiệm, và tâm hồn ta cũng “giàu có” rất nhiều. Đó là những câu thành ngữ, tục ngữ, ca dao, dân Cuốn sách này lựa ra những thành ngữ và tục ngữ thường gặp và dễ hiểu với bạn đọc trên 3 tuổi, thêm chú dẫn những khái niệm cổ và khó, thêm các cụm từ gần gặ giúp các bạn đọc ít mà hiểu nhiều. Giá sản phẩm trên Tiki đã bao gồm thuế theo luật hiện hành. Bên cạnh đó, tuỳ vào loại sản phẩm, hình thức và địa chỉ giao hàng mà có thể phát sinh thêm chi phí khác như phí vận chuyển, phụ phí hàng cồng kềnh, thuế nhập khẩu (đối với đơn hàng giao từ nước ngoài có giá trị trên 1 triệu đồng).....",0,0,https://salt.tikicdn.com/ts/product/36/4c/7e/0fa39eecb43fb03d50464ed415387b65.jpg,https://salt.tikicdn.com/cache/w1200/ts/product/36/4c/7e/0fa39eecb43fb03d50464ed415387b65.jpg,https://salt.tikicdn.com/cache/w300/ts/product/36/4c/7e/0fa39eecb43fb03d50464ed415387b65.jpg,https://salt.tikicdn.com/cache/200x280/ts/product/36/4c/7e/0fa39eecb43fb03d50464ed415387b65.jpg,https://salt.tikicdn.com/cache/200x280/ts/product/36/4c/7e/0fa39eecb43fb03d50464ed415387b65.jpg,1000,0
