id,name,price,short_description,description,rating_average,review_count,image_base_url,image_large_url,image_medium_url,image_small_url,image_thumbnail_url,stock,quantity_sold
208097064,Thành Ngữ Tục Ngữ Việt Nam,59800,"    Mỗi người có một miền quê thương mến, rộng ra cho cả cộng đồng thì đó chính là cội nguồn dân tộc. Trân trọng nguồn cội dấu yêu là nền tảng căn bản để từng người con lớn lên lành mạnh. Để hiểu v...","Mỗi người có một miền quê thương mến, rộng ra cho cả cộng đồng thì đó chính là cội nguồn dân tộc. Trân trọng nguồn cội dấu yêu là nền tảng căn bản để từng người con lớn lên lành mạnh. Để hiểu về dân tộc mình thì bước đầu tiên là học rành rẽ ngôn ngữ, câu chữ từ xưa truyền lại. Ông cha ta để lại rất nhiều cụm từ, câu nói, bài thơ ngắn gọn, giản dị, giàu nhịp điệu và hình ả Thuộc những cụm từ ấy, ta giàu thêm vốn từ, ta biết thêm kinh nghiệm, và tâm hồn ta cũng “giàu có” rất nhiều. Đó là những câu thành ngữ, tục ngữ, ca dao, dân  Cuốn sách này lựa ra những thành ngữ và tục ngữ thường gặp và dễ hiểu với bạn đọc trên 3 tuổi, thêm chú dẫn những khái niệm cổ và khó, thêm các cụm từ gần gặ giúp các bạn đọc ít mà hiểu nhiều. Giá sản phẩm trên Tiki đã bao gồm thuế theo luật hiện hành. Bên cạnh đó, tuỳ vào loại sản phẩm, hình thức và địa chỉ giao hàng mà có thể phát sinh thêm chi phí khác như phí vận chuyển, phụ phí hàng cồng kềnh, thuế nhập khẩu (đối với đơn hàng giao từ nước ngoài có giá trị trên 1 triệu đồng).....",5,1,"https://salt.tikicdn.com/ts/product/32/b8/ac/12b65f7098617579e6fe60383322b376.jpg, https://salt.tikicdn.com/ts/product/cd/a1/b1/74465b24d0202a52e6cf86666f01dcda.jpg, https://salt.tikicdn.com/ts/product/38/c9/1e/d070a9b9456ffbbef2dc0b8d785e2ed5.jpg, https://salt.tikicdn.com/ts/product/5c/b3/58/e50495b951739e673acc7ed6288d1930.jpg, https://salt.tikicdn.com/ts/product/3c/5f/3b/221f4d58a771bb3acea754bce7180c5f.jpg, https://salt.tikicdn.com/ts/product/7e/5f/e5/89b21207aa8588e875b065eaa18094a7.jpg, https://salt.tikicdn.com/ts/product/78/78/23/36c9805cd977235fce8ad27e43db40cf.jpg, https://salt.tikicdn.com/ts/product/81/16/42/2e0d7f6bd9889dbd71f4e4c2b192dba4.jpg","https://salt.tikicdn.com/cache/w1200/ts/product/32/b8/ac/12b65f7098617579e6fe60383322b376.jpg, https://salt.tikicdn.com/cache/w1200/ts/product/cd/a1/b1/74465b24d0202a52e6cf86666f01dcda.jpg, https://salt.tikicdn.com/cache/w1200/ts/product/38/c9/1e/d070a9b9456ffbbef2dc0b8d785e2ed5.jpg, https://salt.tikicdn.com/cache/w1200/ts/product/5c/b3/58/e50495b951739e673acc7ed6288d1930.jpg, https://salt.tikicdn.com/cache/w1200/ts/product/3c/5f/3b/221f4d58a771bb3acea754bce7180c5f.jpg, https://salt.tikicdn.com/cache/w1200/ts/product/7e/5f/e5/89b21207aa8588e875b065eaa18094a7.jpg, https://salt.tikicdn.com/cache/w1200/ts/product/78/78/23/36c9805cd977235fce8ad27e43db40cf.jpg, https://salt.tikicdn.com/cache/w1200/ts/product/81/16/42/2e0d7f6bd9889dbd71f4e4c2b192dba4.jpg","https://salt.tikicdn.com/cache/w300/ts/product/32/b8/ac/12b65f7098617579e6fe60383322b376.jpg, https://salt.tikicdn.com/cache/w300/ts/product/cd/a1/b1/74465b24d0202a52e6cf86666f01dcda.jpg, https://salt.tikicdn.com/cache/w300/ts/product/38/c9/1e/d070a9b9456ffbbef2dc0b8d785e2ed5.jpg, https://salt.tikicdn.com/cache/w300/ts/product/5c/b3/58/e50495b951739e673acc7ed6288d1930.jpg, https://salt.tikicdn.com/cache/w300/ts/product/3c/5f/3b/221f4d58a771bb3acea754bce7180c5f.jpg, https://salt.tikicdn.com/cache/w300/ts/product/7e/5f/e5/89b21207aa8588e875b065eaa18094a7.jpg, https://salt.tikicdn.com/cache/w300/ts/product/78/78/23/36c9805cd977235fce8ad27e43db40cf.jpg, https://salt.tikicdn.com/cache/w300/ts/product/81/16/42/2e0d7f6bd9889dbd71f4e4c2b192dba4.jpg","https://salt.tikicdn.com/cache/200x280/ts/product/32/b8/ac/12b65f7098617579e6fe60383322b376.jpg, https://salt.tikicdn.com/cache/200x280/ts/product/cd/a1/b1/74465b24d0202a52e6cf86666f01dcda.jpg, https://salt.tikicdn.com/cache/200x280/ts/product/38/c9/1e/d070a9b9456ffbbef2dc0b8d785e2ed5.jpg, https://salt.tikicdn.com/cache/200x280/ts/product/5c/b3/58/e50495b951739e673acc7ed6288d1930.jpg, https://salt.tikicdn.com/cache/200x280/ts/product/3c/5f/3b/221f4d58a771bb3acea754bce7180c5f.jpg, https://salt.tikicdn.com/cache/200x280/ts/product/7e/5f/e5/89b21207aa8588e875b065eaa18094a7.jpg, https://salt.tikicdn.com/cache/200x280/ts/product/78/78/23/36c9805cd977235fce8ad27e43db40cf.jpg, https://salt.tikicdn.com/cache/200x280/ts/product/81/16/42/2e0d7f6bd9889dbd71f4e4c2b192dba4.jpg","https://salt.tikicdn.com/cache/200x280/ts/product/32/b8/ac/12b65f7098617579e6fe60383322b376.jpg, https://salt.tikicdn.com/cache/200x280/ts/product/cd/a1/b1/74465b24d0202a52e6cf86666f01dcda.jpg, https://salt.tikicdn.com/cache/200x280/ts/product/38/c9/1e/d070a9b9456ffbbef2dc0b8d785e2ed5.jpg, https://salt.tikicdn.com/cache/200x280/ts/product/5c/b3/58/e50495b951739e673acc7ed6288d1930.jpg, https://salt.tikicdn.com/cache/200x280/ts/product/3c/5f/3b/221f4d58a771bb3acea754bce7180c5f.jpg, https://salt.tikicdn.com/cache/200x280/ts/product/7e/5f/e5/89b21207aa8588e875b065eaa18094a7.jpg, https://salt.tikicdn.com/cache/200x280/ts/product/78/78/23/36c9805cd977235fce8ad27e43db40cf.jpg, https://salt.tikicdn.com/cache/200x280/ts/product/81/16/42/2e0d7f6bd9889dbd71f4e4c2b192dba4.jpg",1000,1
207503082,Thành Ngữ Và Tục Ngữ Việt Nam,61000,"Thành Ngữ Và Tục Ngữ Việt NamMỗi người có một miền quê thương mến, rộng ra cho cả cộng đồng thì đó chính là cội nguồn dân tộc. Trân trọng nguồn cội dấu yêu là nền tảng căn bản để từng người con lớn ...","Thành Ngữ Và Tục Ngữ Việt Nam Mỗi người có một miền quê thương mến, rộng ra cho cả cộng đồng thì đó chính là cội nguồn dân tộc. Trân trọng nguồn cội dấu yêu là nền tảng căn bản để từng người con lớn lên lành mạnh. Để hiểu về dân tộc mình thì bước đầu tiên là học rành rẽ ngôn ngữ, câu chữ từ xưa truyền lại. Ông cha ta để lại rất nhiều cụm từ, câu nói, bài thơ ngắn gọn, giản dị, giàu nhịp điệu và hình ả Thuộc những cụm từ ấy, ta giàu thêm vốn từ, ta biết thêm kinh nghiệm, và tâm hồn ta cũng “giàu có” rất nhiều. Đó là những câu thành ngữ, tục ngữ, ca dao, dân Cuốn sách này lựa ra những thành ngữ và tục ngữ thường gặp và dễ hiểu với bạn đọc trên 3 tuổi, thêm chú dẫn những khái niệm cổ và khó, thêm các cụm từ gần gặ giúp các bạn đọc ít mà hiểu nhiều. Giá sản phẩm trên Tiki đã bao gồm thuế theo luật hiện hành. Bên cạnh đó, tuỳ vào loại sản phẩm, hình thức và địa chỉ giao hàng mà có thể phát sinh thêm chi phí khác như phí vận chuyển, phụ phí hàng cồng kềnh, thuế nhập khẩu (đối với đơn hàng giao từ nước ngoài có giá trị trên 1 triệu đồng).....",0,0,https://salt.tikicdn.com/ts/product/70/b1/a2/fd1d88c94e8ec34acf3dbed8c491d94d.jpg,https://salt.tikicdn.com/cache/w1200/ts/product/70/b1/a2/fd1d88c94e8ec34acf3dbed8c491d94d.jpg,https://salt.tikicdn.com/cache/w300/ts/product/70/b1/a2/fd1d88c94e8ec34acf3dbed8c491d94d.jpg,https://salt.tikicdn.com/cache/200x280/ts/product/70/b1/a2/fd1d88c94e8ec34acf3dbed8c491d94d.jpg,https://salt.tikicdn.com/cache/200x280/ts/product/70/b1/a2/fd1d88c94e8ec34acf3dbed8c491d94d.jpg,1000,0
206820926,Thành Ngữ Tục Ngữ Việt Nam (Sách Nhã Nam),61000,"Mỗi người có một miền quê thương mến, rộng ra cho cả cộng đồng thì đó chính là cội nguồn dân tộc. Trân trọng nguồn cội dấu yêu là nền tảng căn bản để từng người con lớn lên lành mạnh. Để hiểu về dân t...","Mỗi người có một miền quê thương mến, rộng ra cho cả cộng đồng thì đó chính là cội nguồn dân tộc. Trân trọng nguồn cội dấu yêu là nền tảng căn bản để từng người con lớn lên lành mạnh. Để hiểu về dân tộc mình thì bước đầu tiên là học rành rẽ ngôn ngữ, câu chữ từ xưa truyền lại. Ông cha ta để lại rất nhiều cụm từ, câu nói, bài thơ ngắn gọn, giản dị, giàu nhịp điệu và hình ả Thuộc những cụm từ ấy, ta giàu thêm vốn từ, ta biết thêm kinh nghiệm, và tâm hồn ta cũng “giàu có” rất nhiều. Đó là những câu thành ngữ, tục ngữ, ca dao, dân  Cuốn sách này lựa ra những thành ngữ và tục ngữ thường gặp và dễ hiểu với bạn đọc trên 3 tuổi, thêm chú dẫn những khái niệm cổ và khó, thêm các cụm từ gần gặ giúp các bạn đọc ít mà hiểu nhiều. Giá sản phẩm trên Tiki đã bao gồm thuế theo luật hiện hành. Bên cạnh đó, tuỳ vào loại sản phẩm, hình thức và địa chỉ giao hàng mà có thể phát sinh thêm chi phí khác như phí vận chuyển, phụ phí hàng cồng kềnh, thuế nhập khẩu (đối với đơn hàng giao từ nước ngoài có giá trị trên 1 triệu đồng).....",0,0,https://salt.tikicdn.com/ts/product/8f/45/45/09052de49cd2ae1ff2a8516a12614cce.png,https://salt.tikicdn.com/cache/w1200/ts/product/8f/45/45/09052de49cd2ae1ff2a8516a12614cce.png,https://salt.tikicdn.com/cache/w300/ts/product/8f/45/45/09052de49cd2ae1ff2a8516a12614cce.png,https://salt.tikicdn.com/cache/200x280/ts/product/8f/45/45/09052de49cd2ae1ff2a8516a12614cce.png,https://salt.tikicdn.com/cache/200x280/ts/product/8f/45/45/09052de49cd2ae1ff2a8516a12614cce.png,1000,0
206652943,Thành Ngữ Tục Ngữ Việt Nam,59840,"Thành Ngữ Tục Ngữ Việt NamMỗi người có một miền quê thương mến, rộng ra cho cả cộng đồng thì đó chính là cội nguồn dân tộc. Trân trọng nguồn cội dấu yêu là nền tảng căn bản để từng người con lớn lên ...","Thành Ngữ Tục Ngữ Việt Nam Mỗi người có một miền quê thương mến, rộng ra cho cả cộng đồng thì đó chính là cội nguồn dân tộc. Trân trọng nguồn cội dấu yêu là nền tảng căn bản để từng người con lớn lên lành mạnh. Để hiểu về dân tộc mình thì bước đầu tiên là học rành rẽ ngôn ngữ, câu chữ từ xưa truyền lại. Ông cha ta để lại rất nhiều cụm từ, câu nói, bài thơ ngắn gọn, giản dị, giàu nhịp điệu và hình ả Thuộc những cụm từ ấy, ta giàu thêm vốn từ, ta biết thêm kinh nghiệm, và tâm hồn ta cũng “giàu có” rất nhiều. Đó là những câu thành ngữ, tục ngữ, ca dao, dân  Cuốn sách ""Thành Ngữ Tục Ngữ Việt Nam"" lựa ra những thành ngữ và tục ngữ thường gặp và dễ hiểu với bạn đọc trên Giá sản phẩm trên Tiki đã bao gồm thuế theo luật hiện hành. Bên cạnh đó, tuỳ vào loại sản phẩm, hình thức và địa chỉ giao hàng mà có thể phát sinh thêm chi phí khác như phí vận chuyển, phụ phí hàng cồng kềnh, thuế nhập khẩu (đối với đơn hàng giao từ nước ngoài có giá trị trên 1 triệu đồng).....",0,0,https://salt.tikicdn.com/ts/product/80/60/3d/1958da2a68681aa4d25b955d618619ad.jpg,https://salt.tikicdn.com/cache/w1200/ts/product/80/60/3d/1958da2a68681aa4d25b955d618619ad.jpg,https://salt.tikicdn.com/cache/w300/ts/product/80/60/3d/1958da2a68681aa4d25b955d618619ad.jpg,https://salt.tikicdn.com/cache/200x280/ts/product/80/60/3d/1958da2a68681aa4d25b955d618619ad.jpg,https://salt.tikicdn.com/cache/200x280/ts/product/80/60/3d/1958da2a68681aa4d25b955d618619ad.jpg,1000,0
205942276,Thành Ngữ Tục Ngữ Việt Nam,47600,"Mỗi người có một miền quê thương mến, rộng ra cho cả cộng đồng thì đó chính là cội nguồn dân tộc. Trân trọng nguồn cội dấu yêu là nền tảng căn bản để từng người con lớn lên lành mạnh. Để hiểu về dân t...","Mỗi người có một miền quê thương mến, rộng ra cho cả cộng đồng thì đó chính là cội nguồn dân tộc. Trân trọng nguồn cội dấu yêu là nền tảng căn bản để từng người con lớn lên lành mạnh. Để hiểu về dân tộc mình thì bước đầu tiên là học rành rẽ ngôn ngữ, câu chữ từ xưa truyền lại. Ông cha ta để lại rất nhiều cụm từ, câu nói, bài thơ ngắn gọn, giản dị, giàu nhịp điệu và hình ảnh thuộc những cụm từ ấy, ta giàu thêm vốn từ, ta biết thêm kinh nghiệm, và tâm hồn ta cũng “giàu có” rất nhiều. Đó là những câu thành ngữ, tục ngữ, ca dao, dân ca. Cuốn sách này lựa ra những thành ngữ và tục ngữ thường gặp và dễ hiểu với bạn đọc trên 3 tuổi, thêm chú dẫn những khái niệm cổ và khó, thêm các cụm từ gần gặp giúp các bạn đọc ít mà hiểu nhiều. Giá sản phẩm trên Tiki đã bao gồm thuế theo luật hiện hành. Bên cạnh đó, tuỳ vào loại sản phẩm, hình thức và địa chỉ giao hàng mà có thể phát sinh thêm chi phí khác như phí vận chuyển, phụ phí hàng cồng kềnh, thuế nhập khẩu (đối với đơn hàng giao từ nước ngoài có giá trị trên 1 triệu đồng).....",4.7,20,https://salt.tikicdn.com/ts/product/2a/b9/6f/52ed96f6d6a033860f3027b5e337dac4.jpg,https://salt.tikicdn.com/cache/w1200/ts/product/2a/b9/6f/52ed96f6d6a033860f3027b5e337dac4.jpg,https://salt.tikicdn.com/cache/w300/ts/product/2a/b9/6f/52ed96f6d6a033860f3027b5e337dac4.jpg,https://salt.tikicdn.com/cache/200x280/ts/product/2a/b9/6f/52ed96f6d6a033860f3027b5e337dac4.jpg,https://salt.tikicdn.com/cache/200x280/ts/product/2a/b9/6f/52ed96f6d6a033860f3027b5e337dac4.jpg,1000,20
203543529,Sách - Chuyện kể thành ngữ Anh - Việt,50000,Chuyện kể thành ngữ Anh – Việt“Raining cats and dogs” nghĩa là “mưa như trút nước”. Nhưng vậy thì liên quan gì đến mèo và chó?“Bite the bullet” nghĩa là “ngậm đắng nuốt cay”. Vì sao “cắn viên đạn” l...,"Chuyện kể thành ngữ Anh – Việt “Raining cats and dogs” nghĩa là “mưa như trút nước”. Nhưng vậy thì liên quan gì đến mèo và chó? “Bite the bullet” nghĩa là “ngậm đắng nuốt cay”. Vì sao “cắn viên đạn” lại mang ý đó? “Hanging by a thread” nghĩa là “ngàn cân treo sợi tóc”. Thứ gì được treo ở đây? Chuyện kể thành ngữ Anh – Việt sẽ mang đến cho bạn những lí giải thú vị và bất ngờ. Nắm được sự tương quan giữa thành ngữ tiếng Anh và tiếng Việt sẽ giúp quá trình học tiếng Anh của bạn thú vị và hiệu quả hơn. Đồng thời, bạn sẽ càng thêm hiểu, thêm yêu sự giàu đẹp của tiếng Việt. Giá sản phẩm trên Tiki đã bao gồm thuế theo luật hiện hành. Bên cạnh đó, tuỳ vào loại sản phẩm, hình thức và địa chỉ giao hàng mà có thể phát sinh thêm chi phí khác như phí vận chuyển, phụ phí hàng cồng kềnh, thuế nhập khẩu (đối với đơn hàng giao từ nước ngoài có giá trị trên 1 triệu đồng).....",0,0,https://salt.tikicdn.com/ts/product/8c/f6/7d/4fec578b94b19d5d66a394baff738bb2.jpg,https://salt.tikicdn.com/cache/w1200/ts/product/8c/f6/7d/4fec578b94b19d5d66a394baff738bb2.jpg,https://salt.tikicdn.com/cache/w300/ts/product/8c/f6/7d/4fec578b94b19d5d66a394baff738bb2.jpg,https://salt.tikicdn.com/cache/200x280/ts/product/8c/f6/7d/4fec578b94b19d5d66a394baff738bb2.jpg,https://salt.tikicdn.com/cache/200x280/ts/product/8c/f6/7d/4fec578b94b19d5d66a394baff738bb2.jpg,1000,0
203540093,Sách - Chuyện kể thành ngữ,88000,"Truyện kể thành ngữĐánh trống, bỏ dùi liệu có phải là đánh trống rồi vứt dùi đi?“Voi” và “tiên” trong “Được voi đòi tiên” có phải là con voi và cô tiên?“Nắc nẻ” trong “Cười như nắc nẻ” là gì?Các l...","Truyện kể thành ngữ Đánh trống, bỏ dùi liệu có phải là đánh trống rồi vứt dùi đi? “Voi” và “tiên” trong “Được voi đòi tiên” có phải là con voi và cô tiên? “Nắc nẻ” trong “Cười như nắc nẻ” là gì? Các lí giải trong “Chuyện kể thành ngữ” sẽ khiến bạn ngạc nhiên và vô cùng thích thú. Giá sản phẩm trên Tiki đã bao gồm thuế theo luật hiện hành. Bên cạnh đó, tuỳ vào loại sản phẩm, hình thức và địa chỉ giao hàng mà có thể phát sinh thêm chi phí khác như phí vận chuyển, phụ phí hàng cồng kềnh, thuế nhập khẩu (đối với đơn hàng giao từ nước ngoài có giá trị trên 1 triệu đồng).....",0,0,https://salt.tikicdn.com/ts/product/e6/7b/9f/c6761be16f7b0f7dd0983f4cf7b597fc.jpg,https://salt.tikicdn.com/cache/w1200/ts/product/e6/7b/9f/c6761be16f7b0f7dd0983f4cf7b597fc.jpg,https://salt.tikicdn.com/cache/w300/ts/product/e6/7b/9f/c6761be16f7b0f7dd0983f4cf7b597fc.jpg,https://salt.tikicdn.com/cache/200x280/ts/product/e6/7b/9f/c6761be16f7b0f7dd0983f4cf7b597fc.jpg,https://salt.tikicdn.com/cache/200x280/ts/product/e6/7b/9f/c6761be16f7b0f7dd0983f4cf7b597fc.jpg,1000,0
163037115,Hán Việt Thành Ngữ Cố Sự,202500,"Cuốn Từ Điển Hán-Việt Thành Ngữ Cố Sự này sẽ giúp cho mọi người, dù thuộc nhiều trình độ hiểu biết khác nhau, đều tìm thấy sự ích lợi và hứng thú khi lật giở từng trang sách. Đối với những người có sở...","Cuốn Từ Điển Hán-Việt Thành Ngữ Cố Sự này sẽ giúp cho mọi người, dù thuộc nhiều trình độ hiểu biết khác nhau, đều tìm thấy sự ích lợi và hứng thú khi lật giở từng trang sách. Đối với những người có sở học uyên thâm về chữ Hán, họ sẽ thích thú khi thấy các câu, các chữ được phân tích đều luôn đi kèm với Hán-tự (do công của tác giả đã cố gắng học thêm nhu liệu điện toán Twinbridge để có thể gõ được tiếng Hoa). Điều này sẽ giúp cho phần tra cứu được rõ ràng hơn, tránh cảnh suy đoán hoặc hiểu lầm vì nhiều chữ Hán tuy có cùng phát âm nhưng nhiều khi lại mang ý nghĩa khác nhau, và chỉ có cách nhìn mặt chữ thì mới biết rõ ý nghĩa của nó. Thí dụ đơn giản và dễ hiểu nhất là chữ ""Tử"" có thể là ""Chết"", nhưng cũng có thể là ""Con"", và còn có thể có nhiều nghĩa khác nữa, tuỳ theo cách viết của nó bằng chữ Hán. Chúng tôi tin rằng nhiều người, nhất là những ai làm việc trong ngành truyền thông, hoặc có dính líu ít nhiều trong việc sử dụng chữ nghĩa, đều sẽ thấy nhiều điều ích lợi khi có thêm được một cuốn sách dùng làm tài liệu để tra cứu như cuốn Từ Điển Hán-Việt Thành Ngữ Cố Sự này. Nhưng có lẽ tất cả những ai còn quan tâm hoặc yêu mến tiếng Việt chắc chắn cũng sẽ lấy làm thích thú khi lần giở những trang trong cuốn sách này. Với lối trình bày trong sáng, dẫn giải rõ ràng, và thu lượm công phu rất nhiều những thành ngữ phong phú dễ lôi cuốn người đọc, dù là người không có vốn liếng về tiếng Hán-Việt, cuốn sách có thể được đọc như là một cuốn truyện để tiêu khiển trong những lúc trà dư tửu hậu, nhưng đồng thời lại giúp mở mang kiến thức cho người đọc. Xem thế thì quả là Bác sĩ Hoàng Xuân Chỉnh đã để lại một món quà quý giá cho gia tài văn hoá nước Việt. Tuy là một ông cụ cao niên sắp bước vào tuổi 90, thay vì ngồi an hưởng tuổi già hoặc lao mình vào những lạc thú vô bổ khác vào lúc cuối đời, ông vẫn tiếp tục làm việc một cách nghiêm túc, tự mình đặt ra khuôn phép để siêng năng làm việc hàng ngày mà không cần phải chờ đợi sự tài trợ nào từ các trường đại học hoặc các sáng hội từ thiện. Việc làm của ông đúng là đã thực hiện được cái hoài bão hết sức cao đẹp là ""Sinh vô ích y thời, tử vô hậu y địa, thị tự tư dã"" (có nghĩa là ""Sống mà không làm điều gì ích lợi cho đời thì lúc chết đi cũng chẳng lưu lại điều gì trên thế gian""). Giá sản phẩm trên Tiki đã bao gồm thuế theo luật hiện hành. Bên cạnh đó, tuỳ vào loại sản phẩm, hình thức và địa chỉ giao hàng mà có thể phát sinh thêm chi phí khác như phí vận chuyển, phụ phí hàng cồng kềnh, thuế nhập khẩu (đối với đơn hàng giao từ nước ngoài có giá trị trên 1 triệu đồng).....",0,0,https://salt.tikicdn.com/ts/product/b8/55/e6/97614bcd1c67aa807d94421984aefc63.jpg,https://salt.tikicdn.com/cache/w1200/ts/product/b8/55/e6/97614bcd1c67aa807d94421984aefc63.jpg,https://salt.tikicdn.com/cache/w300/ts/product/b8/55/e6/97614bcd1c67aa807d94421984aefc63.jpg,https://salt.tikicdn.com/cache/200x280/ts/product/b8/55/e6/97614bcd1c67aa807d94421984aefc63.jpg,https://salt.tikicdn.com/cache/200x280/ts/product/b8/55/e6/97614bcd1c67aa807d94421984aefc63.jpg,1000,0
