id,name,price,short_description,description,rating_average,review_count,image_base_url,image_large_url,image_medium_url,image_small_url,image_thumbnail_url,stock,quantity_sold
274843722,Sách Tiếng Việt Giàu Đẹp - Triết Lý Tiếng Việt,90000,"Sách Tiếng Việt Giàu Đẹp - Triết Lý Tiếng ViệtĐây là tựa sách mới nhất của tiến sĩ Nguyễn Đúc Dân viết cho bộ Tiếng Việt Giàu Đẹp. Sách phân tích điểm nhìn, tầm quan trọng của tư duy trong đọc hiểu v...","Sách Tiếng Việt Giàu Đẹp - Triết Lý Tiếng Việt Đây là tựa sách mới nhất của tiến sĩ Nguyễn Đúc Dân viết cho bộ Tiếng Việt Giàu Đẹp. Sách phân tích điểm nhìn, tầm quan trọng của tư duy trong đọc hiểu và ứng dụng ngôn ngữ vào đời sống, đồng thời giải thích những điều tưởng như là ""nghịch lý"" trong ca dao, tục ngữ một cách thuyết phục và hợp lý. Càng hiểu về tiếng Việt, chúng ta càng yêu quý và ý thức được tầm quan trọng của việc giữ gìn ngôn ngữ mẹ đẻ của mình hơn. Vận dụng tốt tiếng Việt sẽ dễ dàng đạt hiệu quả cao trong giao tiếp và công việc viết lách. Cũng như các tựa khác trong bộ Tiếng Việt Giàu Đẹp, sách sẽ giúp ích rất nhiều cho học sinh - sinh viên, nhà báo, người làm việc trong những ngành nghề cần vận dụng ngôn ngữ một cách linh hoạt, ứng biến. Giá sản phẩm trên Tiki đã bao gồm thuế theo luật hiện hành. Bên cạnh đó, tuỳ vào loại sản phẩm, hình thức và địa chỉ giao hàng mà có thể phát sinh thêm chi phí khác như phí vận chuyển, phụ phí hàng cồng kềnh, thuế nhập khẩu (đối với đơn hàng giao từ nước ngoài có giá trị trên 1 triệu đồng).....",0,0,https://salt.tikicdn.com/ts/product/1e/92/85/2584bfe8950f027bc0e465e845301cc8.jpg,https://salt.tikicdn.com/cache/w1200/ts/product/1e/92/85/2584bfe8950f027bc0e465e845301cc8.jpg,https://salt.tikicdn.com/cache/w300/ts/product/1e/92/85/2584bfe8950f027bc0e465e845301cc8.jpg,https://salt.tikicdn.com/cache/200x280/ts/product/1e/92/85/2584bfe8950f027bc0e465e845301cc8.jpg,https://salt.tikicdn.com/cache/200x280/ts/product/1e/92/85/2584bfe8950f027bc0e465e845301cc8.jpg,1000,0
273714549,"Thờ Ơ - Thơ Ca, Tục Ngữ, Ca Dao, Thành Ngữ  - Bản Quyền",108300,    Công ty phát hành: Alpha Books   Nhà xuất bản: NXB Hội Nhà Văn   Tác giả: Nhóm Gió Hoan   Loại bìa: Bìa Mềm   Số trang: 148   Năm xuất bản: 2022         Thờ Ơ Văn chương thứ thiệt chỉ c...,"Công ty phát hành: Alpha Books Nhà xuất bản: NXB Hội Nhà Văn Tác giả: Nhóm Gió Hoan Loại bìa: Bìa Mềm Số trang: 148 Năm xuất bản: 2022 Thờ Ơ Văn chương thứ thiệt chỉ có thể hiện hữu khi nó được tạo ra không phải bởi những viên chức đáng cậy và mẫn cán mà bổi những người điên, ẩn sĩ, nhà dị giáo, người mơ mộng, tay nổi loạn và kẻ hoài nghi. - Yevgeny Zamyatin - “ Hãy nghe… Và bây giờ những vần thơ lại bắt đầu mọc từ trong tim tôi Những vần thơ tỏa sáng và chảy máu” - Thiện Sigmundtaro - Gooda tin rằng cuốn sách sẽ mang lại kiến thức thật bổ ích cùng những trải nghiệm thật tuyệt vời, hy vọng đây sẽ là 1 cuốn sách quý trên kệ sách của bạn! QUYỀN LỢI KHÁCH HÀNG KHI MUA SÁCH TẠI SHOP GOODA THƯ VIỆN SÁCH QUÝ: 1. Đảm bảo 100% sách gốc bản quyền từ NXB 2. Quy cách đóng gói cẩn thận, trận trọng từng quyển sách 3. Xử lí đơn đặt hàng nhanh 4. Chính sách hỗ trợ đổi sách cho khách hàng thuận tiện khi gặp sự cố Giá sản phẩm trên Tiki đã bao gồm thuế theo luật hiện hành. Bên cạnh đó, tuỳ vào loại sản phẩm, hình thức và địa chỉ giao hàng mà có thể phát sinh thêm chi phí khác như phí vận chuyển, phụ phí hàng cồng kềnh, thuế nhập khẩu (đối với đơn hàng giao từ nước ngoài có giá trị trên 1 triệu đồng).....",0,0,"https://salt.tikicdn.com/ts/product/dd/5e/4e/5b04db405f6a5535cd44b03954876dad.jpg, https://salt.tikicdn.com/ts/product/ae/6d/bc/534108069be58fb451e817f8fb368cb3.jpg","https://salt.tikicdn.com/cache/w1200/ts/product/dd/5e/4e/5b04db405f6a5535cd44b03954876dad.jpg, https://salt.tikicdn.com/cache/w1200/ts/product/ae/6d/bc/534108069be58fb451e817f8fb368cb3.jpg","https://salt.tikicdn.com/cache/w300/ts/product/dd/5e/4e/5b04db405f6a5535cd44b03954876dad.jpg, https://salt.tikicdn.com/cache/w300/ts/product/ae/6d/bc/534108069be58fb451e817f8fb368cb3.jpg","https://salt.tikicdn.com/cache/200x280/ts/product/dd/5e/4e/5b04db405f6a5535cd44b03954876dad.jpg, https://salt.tikicdn.com/cache/200x280/ts/product/ae/6d/bc/534108069be58fb451e817f8fb368cb3.jpg","https://salt.tikicdn.com/cache/200x280/ts/product/dd/5e/4e/5b04db405f6a5535cd44b03954876dad.jpg, https://salt.tikicdn.com/cache/200x280/ts/product/ae/6d/bc/534108069be58fb451e817f8fb368cb3.jpg",1000,0
273707030,Trạm Đọc Official | Tủ Sách Đời Người: Truyện Cổ Nước Nam (Tập 2) - Quyển Hạ : Muông Chim,92880,"Một công trình lớn của Nguyễn Văn Ngọc là Truyện cổ nước Nam (1934), sưu tầm và phóng tác theo những truyện cổ tích, truyện ngụ ngôn dân gian và truyện cười dân gian. Bộ sách gồm 2 tập, trong đó 1 quy...","Một công trình lớn của Nguyễn Văn Ngọc là Truyện cổ nước Nam (1934), sưu tầm và phóng tác theo những truyện cổ tích, truyện ngụ ngôn dân gian và truyện cười dân gian. Bộ sách gồm 2 tập, trong đó 1 quyển kể về con người, và 1 quyển kể về các loài chim muông. Truyện cổ nước Nam được nhà văn kể theo cốt truyện mà ông sưu tầm được với quan điểm nhân văn trong sáng, được nhiều tầng lớp độc giả yêu thích. Truyện cổ nước Nam tập hợp hơn 200 truyện cổ, sự tích về con người và muôn loài nước Việt đã lưu truyền trong đời sống dân gian từ xa xưa cho đến tận ngày nay, được học giả Ôn Như Nguyễn Văn Ngọc dày công lưu giữ, tuyển chọn và biên soạn. Đó là những truyện cổ làm cho “nước Nam mới thật là nước Nam vậy”, “một kho vàng vô giá của ông cha để lại làm cái vốn rất quý cho con cháu”, bởi “làm người Nam nên biết truyện cổ nước Nam. Tinh thần người Nam hiện ra ở đấy, tinh hoa nước Nam muốn lưu lại cũng ở đấy”. ĐÁNH GIÁ/NHẬN XÉT CHUYÊN GIA “Truyện cổ nước Nam” gồm hai quyển “Người ta” và “Chim muông”. “Người ta” kể những chuyện liên quan đến con người. Ảnh hưởng của văn hóa Hán rất ít thấy bởi chúng được dẫn giải bằng tục ngữ, ca dao, lối ăn nói của người nông dân. “Chim muông”, với nhân vật là các loài vật, lại càng hồn nhiên dân dã, dễ đọc với bạn nhỏ, nhưng nhiều chuyện càng nghĩ càng thấy thâm thúy. - Nhà văn Trần Chiến TRÍCH ĐOẠN HAY “Đồ cổ, xưa nay thiên hạ trân trọng, bất cứ là đồ sành, đồ sứ, đồ đồng, đồ thiếc, đồ gỗ, đồ son, đồ ngọc ngà, hay bức tranh, nét chữ hầu hết là đồ của người Tàu, từ các đời xưa nào bên Tàu để lại cả. Còn những truyện cổ chúng tôi sưu tập đây chúng tôi dám quyết rằng thật là của riêng của nước Nam, tự người Nam sáng tác, sản xuất ra, chứ không phải đi vay, đi mượn, nhờ vả vào ai mà được. Một chứng cớ rõ ràng: hơn 120 truyện trong sách, không có mấy truyện là không hàm một đôi câu thành ngữ hay sáo ngữ, ca hát hay phong dao bằng tiếng Nam, nghĩa là một thứ tiếng riêng nó làm cho nước Nam mới thật là nước Nam vậy. Gián hoặc có một đôi truyện, phảng phất tương tự giống như truyện Tàu thì chẳng qua cũng chỉ là bất kỳ ngẫu nhiên mà thôi. Còn bảo có nhiều truyện tất đã chịu một cái ảnh hưởng xa xôi tự ngoài đem vào, thì cái ảnh hưởng đó chắc là do từ đạo Phật bên Ấn Độ tràn sang, hơn là của đạo Khổng bên Trung Quốc đưa lại. Vả chăng đã là người, dù ở phương đông hay phương tây, dù phân da trắng hay da vàng, cũng là thuộc về một nhân loại, cũng cùng chung một tư tưởng như nhau được. Vậy người nước Nam cũng là người có một cái óc, cái tâm tính như người, thì há lại không tự nghĩ ngợi, phát minh nên được một cái gì giống như người hay sao!” “Giữa lúc cổ, kim xung đột, kim có thế mạnh, như muốn nuốt cổ, mà ta cố lựa lọc giữ một vài phần hay trong những cái cái cổ của ta, nó khiến ta bao giờ cũng phải nhớ ta là ta, không phải là ai, thì cái công việc ta làm quyết nhiên không phải là vô ích. Làm người nước Nam nên biết truyện cổ nước Nam. Tinh thần người Nam hiện ra ở đấy, tinh hoa nước Nammuốn lưu lại cũng ở đấy.” CÂU QUOTE HAY “Làm người nước Nam nên biết truyện cổ nước Nam. Tinh thần người Nam hiện ra ở đấy, tinh hoa nước Nammuốn lưu lại cũng ở đấy.” “Thành trì cổ có sụp đổ, vùi dập xuống đất còn hòng có lúc, có người đào bới, mô phỏng mà xây đắp lại được. Chớ những truyện cổ, không ai ghi chép, cứ để trong lời nói, trong cái lối gọi là “truyền khẩu, truyền tụng” mà đã quên đi, là mất hẳn, sau này thật không tài nào cứu vớt, gây dựng lại cho được.” VỀ TÁC GIẢ Nguyễn Văn Ngọc (1/3/1890 - 26/4/1942) tự Ôn Như là nhà văn, nhà giáo, nhà nghiên cứu văn hoá Việt Nam. Ông đặc biệt say mê nền văn hoá dân gian, đã giành cả cuộc đời để sưu tầm, khai thác và phổ biến nền văn học dân gian. Giá sản phẩm trên Tiki đã bao gồm thuế theo luật hiện hành. Bên cạnh đó, tuỳ vào loại sản phẩm, hình thức và địa chỉ giao hàng mà có thể phát sinh thêm chi phí khác như phí vận chuyển, phụ phí hàng cồng kềnh, thuế nhập khẩu (đối với đơn hàng giao từ nước ngoài có giá trị trên 1 triệu đồng).....",0,0,https://salt.tikicdn.com/ts/product/4a/2e/6a/c1485754e3cdace2d2f14e9b91b65ffa.jpg,https://salt.tikicdn.com/cache/w1200/ts/product/4a/2e/6a/c1485754e3cdace2d2f14e9b91b65ffa.jpg,https://salt.tikicdn.com/cache/w300/ts/product/4a/2e/6a/c1485754e3cdace2d2f14e9b91b65ffa.jpg,https://salt.tikicdn.com/cache/200x280/ts/product/4a/2e/6a/c1485754e3cdace2d2f14e9b91b65ffa.jpg,https://salt.tikicdn.com/cache/200x280/ts/product/4a/2e/6a/c1485754e3cdace2d2f14e9b91b65ffa.jpg,1000,0
273461304,Thành Ngữ Tục Ngữ Việt Nam Dành Cho Học Sinh,32300,"    Thành Ngữ Tục Ngữ Việt Nam Dành Cho Học Sinh   Kho tàng thành ngữ, tục ngữ đóng góp vai trò quan trọng trong nền văn học Việt Nam. Thành ngữ, tục ngữ nói về tất cả các chủ đề, hiện tượng, sự v...","Thành Ngữ Tục Ngữ Việt Nam Dành Cho Học Sinh Kho tàng thành ngữ, tục ngữ đóng góp vai trò quan trọng trong nền văn học Việt Nam. Thành ngữ, tục ngữ nói về tất cả các chủ đề, hiện tượng, sự việc khác nhau trong đời sống nhân dân. Từ những đức tính tốt đẹp con người cần có như cần cù, chăm chỉ, đoàn kết, tình cảm giữa các thành viên trong gia đình đến tình yêu thương đồng bào; những bài học lao động sản xuất được đúc kết qua nhiều đời. Thành ngữ, tục ngữ thiên về trí tuệ nên thường được ví von là “trí khôn dân gian”. Trí khôn đó rất phong phú mà cũng rất đa dạng nhưng lại được diễn đạt bằng ngôn từ ngắn gọn, súc tích, dễ nhớ, giàu hình ảnh và nhịp điệu. Thành ngữ, tục ngữ chính là văn học nói dân gian nên thường được nhân dân vận dụng trong đời sống sinh hoạt, giao tiếp cộng đồng và xã hội hay hẹp hơn như lời ăn tiếng nói và khuyên răn. Giá sản phẩm trên Tiki đã bao gồm thuế theo luật hiện hành. Bên cạnh đó, tuỳ vào loại sản phẩm, hình thức và địa chỉ giao hàng mà có thể phát sinh thêm chi phí khác như phí vận chuyển, phụ phí hàng cồng kềnh, thuế nhập khẩu (đối với đơn hàng giao từ nước ngoài có giá trị trên 1 triệu đồng).....",0,0,"https://salt.tikicdn.com/ts/product/ea/c5/68/bf11e4d25abdf1aff5529277f5ff21b4.jpg, https://salt.tikicdn.com/ts/product/9a/5a/d3/42a9746ae14b014f94f3404aef2d7773.jpg, https://salt.tikicdn.com/ts/product/bc/1a/2b/679044f7354b6c024ede62e29d567f5e.jpg, https://salt.tikicdn.com/ts/product/c1/e0/0e/1542c32db3f462483f4f37dca2717504.jpg, https://salt.tikicdn.com/ts/product/08/f1/9a/c274b357d294667db20448272f3c4da1.jpg, https://salt.tikicdn.com/ts/product/4b/79/18/98dc3d5fe6207038c048384ab47f09d6.jpg, https://salt.tikicdn.com/ts/product/5d/de/32/4a402885243430aec365d27872b1f59f.jpg, https://salt.tikicdn.com/ts/product/32/bc/33/94e361e866b30d692c21fa465f52c305.jpg","https://salt.tikicdn.com/cache/w1200/ts/product/ea/c5/68/bf11e4d25abdf1aff5529277f5ff21b4.jpg, https://salt.tikicdn.com/cache/w1200/ts/product/9a/5a/d3/42a9746ae14b014f94f3404aef2d7773.jpg, https://salt.tikicdn.com/cache/w1200/ts/product/bc/1a/2b/679044f7354b6c024ede62e29d567f5e.jpg, https://salt.tikicdn.com/cache/w1200/ts/product/c1/e0/0e/1542c32db3f462483f4f37dca2717504.jpg, https://salt.tikicdn.com/cache/w1200/ts/product/08/f1/9a/c274b357d294667db20448272f3c4da1.jpg, https://salt.tikicdn.com/cache/w1200/ts/product/4b/79/18/98dc3d5fe6207038c048384ab47f09d6.jpg, https://salt.tikicdn.com/cache/w1200/ts/product/5d/de/32/4a402885243430aec365d27872b1f59f.jpg, https://salt.tikicdn.com/cache/w1200/ts/product/32/bc/33/94e361e866b30d692c21fa465f52c305.jpg","https://salt.tikicdn.com/cache/w300/ts/product/ea/c5/68/bf11e4d25abdf1aff5529277f5ff21b4.jpg, https://salt.tikicdn.com/cache/w300/ts/product/9a/5a/d3/42a9746ae14b014f94f3404aef2d7773.jpg, https://salt.tikicdn.com/cache/w300/ts/product/bc/1a/2b/679044f7354b6c024ede62e29d567f5e.jpg, https://salt.tikicdn.com/cache/w300/ts/product/c1/e0/0e/1542c32db3f462483f4f37dca2717504.jpg, https://salt.tikicdn.com/cache/w300/ts/product/08/f1/9a/c274b357d294667db20448272f3c4da1.jpg, https://salt.tikicdn.com/cache/w300/ts/product/4b/79/18/98dc3d5fe6207038c048384ab47f09d6.jpg, https://salt.tikicdn.com/cache/w300/ts/product/5d/de/32/4a402885243430aec365d27872b1f59f.jpg, https://salt.tikicdn.com/cache/w300/ts/product/32/bc/33/94e361e866b30d692c21fa465f52c305.jpg","https://salt.tikicdn.com/cache/200x280/ts/product/ea/c5/68/bf11e4d25abdf1aff5529277f5ff21b4.jpg, https://salt.tikicdn.com/cache/200x280/ts/product/9a/5a/d3/42a9746ae14b014f94f3404aef2d7773.jpg, https://salt.tikicdn.com/cache/200x280/ts/product/bc/1a/2b/679044f7354b6c024ede62e29d567f5e.jpg, https://salt.tikicdn.com/cache/200x280/ts/product/c1/e0/0e/1542c32db3f462483f4f37dca2717504.jpg, https://salt.tikicdn.com/cache/200x280/ts/product/08/f1/9a/c274b357d294667db20448272f3c4da1.jpg, https://salt.tikicdn.com/cache/200x280/ts/product/4b/79/18/98dc3d5fe6207038c048384ab47f09d6.jpg, https://salt.tikicdn.com/cache/200x280/ts/product/5d/de/32/4a402885243430aec365d27872b1f59f.jpg, https://salt.tikicdn.com/cache/200x280/ts/product/32/bc/33/94e361e866b30d692c21fa465f52c305.jpg","https://salt.tikicdn.com/cache/200x280/ts/product/ea/c5/68/bf11e4d25abdf1aff5529277f5ff21b4.jpg, https://salt.tikicdn.com/cache/200x280/ts/product/9a/5a/d3/42a9746ae14b014f94f3404aef2d7773.jpg, https://salt.tikicdn.com/cache/200x280/ts/product/bc/1a/2b/679044f7354b6c024ede62e29d567f5e.jpg, https://salt.tikicdn.com/cache/200x280/ts/product/c1/e0/0e/1542c32db3f462483f4f37dca2717504.jpg, https://salt.tikicdn.com/cache/200x280/ts/product/08/f1/9a/c274b357d294667db20448272f3c4da1.jpg, https://salt.tikicdn.com/cache/200x280/ts/product/4b/79/18/98dc3d5fe6207038c048384ab47f09d6.jpg, https://salt.tikicdn.com/cache/200x280/ts/product/5d/de/32/4a402885243430aec365d27872b1f59f.jpg, https://salt.tikicdn.com/cache/200x280/ts/product/32/bc/33/94e361e866b30d692c21fa465f52c305.jpg",1000,0
252976253,"Thành Ngữ - Tục Ngữ, Ca Dao - Dân Ca Việt Nam",83550,"Cuốn sách THÀNH NGỮ - TỤC NGỮ - CA DAO - DÂN CA VIỆT NAM: Học Thành ngữ Tục ngữ ca dao, Dân ca chính là học cách sống, kinh nghiệm sống, cách làm người.Hy vọng cuốn sách Thành ngữ Tục ngữ ca dao, D...","Cuốn sách THÀNH NGỮ - TỤC NGỮ - CA DAO - DÂN CA VIỆT NAM: Học Thành ngữ Tục ngữ ca dao, Dân ca chính là học cách sống, kinh nghiệm sống, cách làm người. Hy vọng cuốn sách Thành ngữ Tục ngữ ca dao, Dân ca Việt Nam sẽ giúp ích các em học sinh trong quá trình học tập văn hóa cũng như trong đời sống hàng ngày. Công ty phát hành: Trí Việt Nhà xuất bản: Nhà Xuất Bản Hồng Đức Tác giả: Phúc Hải (tuyển chọn) Loại bìa: Bìa mềm Kích thước: 14.5 x 20.5 cm Số trang: 448 Ngày xuất bản:2023 Giá sản phẩm trên Tiki đã bao gồm thuế theo luật hiện hành. Bên cạnh đó, tuỳ vào loại sản phẩm, hình thức và địa chỉ giao hàng mà có thể phát sinh thêm chi phí khác như phí vận chuyển, phụ phí hàng cồng kềnh, thuế nhập khẩu (đối với đơn hàng giao từ nước ngoài có giá trị trên 1 triệu đồng).....",0,0,"https://salt.tikicdn.com/ts/product/28/db/2b/a8d76d459263277cac0ad5ed54e93c9f.jpg, https://salt.tikicdn.com/ts/product/02/8d/b9/34f18be4d75382fb7277389b682198eb.jpg","https://salt.tikicdn.com/cache/w1200/ts/product/28/db/2b/a8d76d459263277cac0ad5ed54e93c9f.jpg, https://salt.tikicdn.com/cache/w1200/ts/product/02/8d/b9/34f18be4d75382fb7277389b682198eb.jpg","https://salt.tikicdn.com/cache/w300/ts/product/28/db/2b/a8d76d459263277cac0ad5ed54e93c9f.jpg, https://salt.tikicdn.com/cache/w300/ts/product/02/8d/b9/34f18be4d75382fb7277389b682198eb.jpg","https://salt.tikicdn.com/cache/200x280/ts/product/28/db/2b/a8d76d459263277cac0ad5ed54e93c9f.jpg, https://salt.tikicdn.com/cache/200x280/ts/product/02/8d/b9/34f18be4d75382fb7277389b682198eb.jpg","https://salt.tikicdn.com/cache/200x280/ts/product/28/db/2b/a8d76d459263277cac0ad5ed54e93c9f.jpg, https://salt.tikicdn.com/cache/200x280/ts/product/02/8d/b9/34f18be4d75382fb7277389b682198eb.jpg",1000,0
250067571,Hán Việt Thành Ngữ Cố Sự,180000,"Cuốn Từ Điển Hán-Việt Thành Ngữ Cố Sự này sẽ giúp cho mọi người, dù thuộc nhiều trình độ hiểu biết khác nhau, đều tìm thấy sự ích lợi và hứng thú khi lật giở từng trang sách. Đối với những người có sở...","Cuốn Từ Điển Hán-Việt Thành Ngữ Cố Sự này sẽ giúp cho mọi người, dù thuộc nhiều trình độ hiểu biết khác nhau, đều tìm thấy sự ích lợi và hứng thú khi lật giở từng trang sách. Đối với những người có sở học uyên thâm về chữ Hán, họ sẽ thích thú khi thấy các câu, các chữ được phân tích đều luôn đi kèm với Hán-tự (do công của tác giả đã cố gắng học thêm nhu liệu điện toán Twinbridge để có thể gõ được tiếng Hoa). Điều này sẽ giúp cho phần tra cứu được rõ ràng hơn, tránh cảnh suy đoán hoặc hiểu lầm vì nhiều chữ Hán tuy có cùng phát âm nhưng nhiều khi lại mang ý nghĩa khác nhau, và chỉ có cách nhìn mặt chữ thì mới biết rõ ý nghĩa của nó. Thí dụ đơn giản và dễ hiểu nhất là chữ ""Tử"" có thể là ""Chết"", nhưng cũng có thể là ""Con"", và còn có thể có nhiều nghĩa khác nữa, tuỳ theo cách viết của nó bằng chữ Hán. Chúng tôi tin rằng nhiều người, nhất là những ai làm việc trong ngành truyền thông, hoặc có dính líu ít nhiều trong việc sử dụng chữ nghĩa, đều sẽ thấy nhiều điều ích lợi khi có thêm được một cuốn sách dùng làm tài liệu để tra cứu như cuốn Từ Điển Hán-Việt Thành Ngữ Cố Sự này. Nhưng có lẽ tất cả những ai còn quan tâm hoặc yêu mến tiếng Việt chắc chắn cũng sẽ lấy làm thích thú khi lần giở những trang trong cuốn sách này. Với lối trình bày trong sáng, dẫn giải rõ ràng, và thu lượm công phu rất nhiều những thành ngữ phong phú dễ lôi cuốn người đọc, dù là người không có vốn liếng về tiếng Hán-Việt, cuốn sách có thể được đọc như là một cuốn truyện để tiêu khiển trong những lúc trà dư tửu hậu, nhưng đồng thời lại giúp mở mang kiến thức cho người đọc. Xem thế thì quả là Bác sĩ Hoàng Xuân Chỉnh đã để lại một món quà quý giá cho gia tài văn hoá nước Việt. Tuy là một ông cụ cao niên sắp bước vào tuổi 90, thay vì ngồi an hưởng tuổi già hoặc lao mình vào những lạc thú vô bổ khác vào lúc cuối đời, ông vẫn tiếp tục làm việc một cách nghiêm túc, tự mình đặt ra khuôn phép để siêng năng làm việc hàng ngày mà không cần phải chờ đợi sự tài trợ nào từ các trường đại học hoặc các sáng hội từ thiện. Việc làm của ông đúng là đã thực hiện được cái hoài bão hết sức cao đẹp là ""Sinh vô ích y thời, tử vô hậu y địa, thị tự tư dã"" (có nghĩa là ""Sống mà không làm điều gì ích lợi cho đời thì lúc chết đi cũng chẳng lưu lại điều gì trên thế gian""). Giá sản phẩm trên Tiki đã bao gồm thuế theo luật hiện hành. Bên cạnh đó, tuỳ vào loại sản phẩm, hình thức và địa chỉ giao hàng mà có thể phát sinh thêm chi phí khác như phí vận chuyển, phụ phí hàng cồng kềnh, thuế nhập khẩu (đối với đơn hàng giao từ nước ngoài có giá trị trên 1 triệu đồng).....",0,0,https://salt.tikicdn.com/ts/product/bf/f9/cd/15f41dc9abc5160693a3cd9649971fee.jpg,https://salt.tikicdn.com/cache/w1200/ts/product/bf/f9/cd/15f41dc9abc5160693a3cd9649971fee.jpg,https://salt.tikicdn.com/cache/w300/ts/product/bf/f9/cd/15f41dc9abc5160693a3cd9649971fee.jpg,https://salt.tikicdn.com/cache/200x280/ts/product/bf/f9/cd/15f41dc9abc5160693a3cd9649971fee.jpg,https://salt.tikicdn.com/cache/200x280/ts/product/bf/f9/cd/15f41dc9abc5160693a3cd9649971fee.jpg,1000,0
213741525,Thành Ngữ Tục Ngữ Việt Nam - Tặng kèm Bookmark,61000,"Mỗi người có một miền quê thương mến, rộng ra cho cả cộng đồng thì đó chính là cội nguồn dân tộc. Trân trọng nguồn cội dấu yêu là nền tảng căn bản để từng người con lớn lên lành mạnh. Để hiểu về dân t...","Mỗi người có một miền quê thương mến, rộng ra cho cả cộng đồng thì đó chính là cội nguồn dân tộc. Trân trọng nguồn cội dấu yêu là nền tảng căn bản để từng người con lớn lên lành mạnh. Để hiểu về dân tộc mình thì bước đầu tiên là học rành rẽ ngôn ngữ, câu chữ từ xưa truyền lại. Ông cha ta để lại rất nhiều cụm từ, câu nói, bài thơ ngắn gọn, giản dị, giàu nhịp điệu và hình ả Thuộc những cụm từ ấy, ta giàu thêm vốn từ, ta biết thêm kinh nghiệm, và tâm hồn ta cũng “giàu có” rất nhiều. Đó là những câu thành ngữ, tục ngữ, ca dao, dân  Cuốn sách này lựa ra những thành ngữ và tục ngữ thường gặp và dễ hiểu với bạn đọc trên 3 tuổi, thêm chú dẫn những khái niệm cổ và khó, thêm các cụm từ gần gặ giúp các bạn đọc ít mà hiểu nhiều. Giá sản phẩm trên Tiki đã bao gồm thuế theo luật hiện hành. Bên cạnh đó, tuỳ vào loại sản phẩm, hình thức và địa chỉ giao hàng mà có thể phát sinh thêm chi phí khác như phí vận chuyển, phụ phí hàng cồng kềnh, thuế nhập khẩu (đối với đơn hàng giao từ nước ngoài có giá trị trên 1 triệu đồng).....",0,0,https://salt.tikicdn.com/ts/product/d2/9a/a2/1cf812b8a6f6d2b90e76e38094c04fe2.jpg,https://salt.tikicdn.com/cache/w1200/ts/product/d2/9a/a2/1cf812b8a6f6d2b90e76e38094c04fe2.jpg,https://salt.tikicdn.com/cache/w300/ts/product/d2/9a/a2/1cf812b8a6f6d2b90e76e38094c04fe2.jpg,https://salt.tikicdn.com/cache/200x280/ts/product/d2/9a/a2/1cf812b8a6f6d2b90e76e38094c04fe2.jpg,https://salt.tikicdn.com/cache/200x280/ts/product/d2/9a/a2/1cf812b8a6f6d2b90e76e38094c04fe2.jpg,1000,0
