id,name,price,short_description,description,rating_average,review_count,image_base_url,image_large_url,image_medium_url,image_small_url,image_thumbnail_url,stock,quantity_sold
179531064,Bộ 4 Bút bi ký STABILO bl@ck+ M 1.0mm xanh+ đỏ+ đen+ xanh lá (BLKM-C4),177000,Bút bi nước với thiết kế thanh lịch kết hợp giữa màu đen và bạc.Thân bút êm giúp viết thoải mái hơn.Thiết kế nút chống lăn.Xuất sứ: Đức...,"Bút bi nước với thiết kế thanh lịch kết hợp giữa màu đen và bạc. Thân bút êm giúp viết thoải mái hơn. Thiết kế nút chống lăn. Xuất sứ: Đức Giá sản phẩm trên Tiki đã bao gồm thuế theo luật hiện hành. Bên cạnh đó, tuỳ vào loại sản phẩm, hình thức và địa chỉ giao hàng mà có thể phát sinh thêm chi phí khác như phí vận chuyển, phụ phí hàng cồng kềnh, thuế nhập khẩu (đối với đơn hàng giao từ nước ngoài có giá trị trên 1 triệu đồng).....",5,1,"https://salt.tikicdn.com/ts/product/42/85/71/a38c0f9caafdba29aed02773d421ab9a.jpg, https://salt.tikicdn.com/ts/product/9b/9c/7f/57700fdf27b86330187b2cbd5fbdd54e.jpg, https://salt.tikicdn.com/ts/product/14/b0/b9/6cc5c76ae38c9646e03fd453e00e5c21.jpg","https://salt.tikicdn.com/cache/w1200/ts/product/42/85/71/a38c0f9caafdba29aed02773d421ab9a.jpg, https://salt.tikicdn.com/cache/w1200/ts/product/9b/9c/7f/57700fdf27b86330187b2cbd5fbdd54e.jpg, https://salt.tikicdn.com/cache/w1200/ts/product/14/b0/b9/6cc5c76ae38c9646e03fd453e00e5c21.jpg","https://salt.tikicdn.com/cache/w300/ts/product/42/85/71/a38c0f9caafdba29aed02773d421ab9a.jpg, https://salt.tikicdn.com/cache/w300/ts/product/9b/9c/7f/57700fdf27b86330187b2cbd5fbdd54e.jpg, https://salt.tikicdn.com/cache/w300/ts/product/14/b0/b9/6cc5c76ae38c9646e03fd453e00e5c21.jpg","https://salt.tikicdn.com/cache/200x280/ts/product/42/85/71/a38c0f9caafdba29aed02773d421ab9a.jpg, https://salt.tikicdn.com/cache/200x280/ts/product/9b/9c/7f/57700fdf27b86330187b2cbd5fbdd54e.jpg, https://salt.tikicdn.com/cache/200x280/ts/product/14/b0/b9/6cc5c76ae38c9646e03fd453e00e5c21.jpg","https://salt.tikicdn.com/cache/200x280/ts/product/42/85/71/a38c0f9caafdba29aed02773d421ab9a.jpg, https://salt.tikicdn.com/cache/200x280/ts/product/9b/9c/7f/57700fdf27b86330187b2cbd5fbdd54e.jpg, https://salt.tikicdn.com/cache/200x280/ts/product/14/b0/b9/6cc5c76ae38c9646e03fd453e00e5c21.jpg",1000,1
177141807,Bộ 8 bút bi nắp STABILO Re-Liner F (BP868F-C8),137000,"Mực khó phai, thấm nước không nhòeĐầu bi 0,7mm làm bằng hợp kim bền chắcTay cầm có các vân chống trơn trượtXuất sứ: Malaysia...","Mực khó phai, thấm nước không nhòe Đầu bi 0,7mm làm bằng hợp kim bền chắc Tay cầm có các vân chống trơn trượt Xuất sứ: Malaysia Giá sản phẩm trên Tiki đã bao gồm thuế theo luật hiện hành. Bên cạnh đó, tuỳ vào loại sản phẩm, hình thức và địa chỉ giao hàng mà có thể phát sinh thêm chi phí khác như phí vận chuyển, phụ phí hàng cồng kềnh, thuế nhập khẩu (đối với đơn hàng giao từ nước ngoài có giá trị trên 1 triệu đồng).....",0,0,"https://salt.tikicdn.com/ts/product/56/d4/d6/e780d7e4f2b39ddbc164c7c870c34b81.jpg, https://salt.tikicdn.com/ts/product/d1/a3/35/53bd6ee0b994e5ea134b42815a1acf64.jpg, https://salt.tikicdn.com/ts/product/b1/88/75/48ebd77f7c89e22614c3fa040e9dca88.jpg, https://salt.tikicdn.com/ts/product/52/3c/90/3c45c8c901c57434c74a0b1cc1afb9ab.jpg","https://salt.tikicdn.com/cache/w1200/ts/product/56/d4/d6/e780d7e4f2b39ddbc164c7c870c34b81.jpg, https://salt.tikicdn.com/cache/w1200/ts/product/d1/a3/35/53bd6ee0b994e5ea134b42815a1acf64.jpg, https://salt.tikicdn.com/cache/w1200/ts/product/b1/88/75/48ebd77f7c89e22614c3fa040e9dca88.jpg, https://salt.tikicdn.com/cache/w1200/ts/product/52/3c/90/3c45c8c901c57434c74a0b1cc1afb9ab.jpg","https://salt.tikicdn.com/cache/w300/ts/product/56/d4/d6/e780d7e4f2b39ddbc164c7c870c34b81.jpg, https://salt.tikicdn.com/cache/w300/ts/product/d1/a3/35/53bd6ee0b994e5ea134b42815a1acf64.jpg, https://salt.tikicdn.com/cache/w300/ts/product/b1/88/75/48ebd77f7c89e22614c3fa040e9dca88.jpg, https://salt.tikicdn.com/cache/w300/ts/product/52/3c/90/3c45c8c901c57434c74a0b1cc1afb9ab.jpg","https://salt.tikicdn.com/cache/200x280/ts/product/56/d4/d6/e780d7e4f2b39ddbc164c7c870c34b81.jpg, https://salt.tikicdn.com/cache/200x280/ts/product/d1/a3/35/53bd6ee0b994e5ea134b42815a1acf64.jpg, https://salt.tikicdn.com/cache/200x280/ts/product/b1/88/75/48ebd77f7c89e22614c3fa040e9dca88.jpg, https://salt.tikicdn.com/cache/200x280/ts/product/52/3c/90/3c45c8c901c57434c74a0b1cc1afb9ab.jpg","https://salt.tikicdn.com/cache/200x280/ts/product/56/d4/d6/e780d7e4f2b39ddbc164c7c870c34b81.jpg, https://salt.tikicdn.com/cache/200x280/ts/product/d1/a3/35/53bd6ee0b994e5ea134b42815a1acf64.jpg, https://salt.tikicdn.com/cache/200x280/ts/product/b1/88/75/48ebd77f7c89e22614c3fa040e9dca88.jpg, https://salt.tikicdn.com/cache/200x280/ts/product/52/3c/90/3c45c8c901c57434c74a0b1cc1afb9ab.jpg",1000,0
169381115,Viết Bi Bấm 0.7 mm Zebra F301-GR - Mực Xanh,45900,    Viết Bi Bấm 0.7 mm Zebra F301-GR - Mực Xanh ...,"Viết Bi Bấm 0.7 mm Zebra F301-GR - Mực Xanh Giá sản phẩm trên Tiki đã bao gồm thuế theo luật hiện hành. Bên cạnh đó, tuỳ vào loại sản phẩm, hình thức và địa chỉ giao hàng mà có thể phát sinh thêm chi phí khác như phí vận chuyển, phụ phí hàng cồng kềnh, thuế nhập khẩu (đối với đơn hàng giao từ nước ngoài có giá trị trên 1 triệu đồng).....",5,2,"https://salt.tikicdn.com/ts/product/09/4c/72/4b927f2a4c2cf519afd58b8cb10d0c48.jpg, https://salt.tikicdn.com/ts/product/ae/b9/68/a1a469b97ea93612914b88e23a4ccb25.jpg, https://salt.tikicdn.com/ts/product/08/65/94/63e51ce076e130e7f991d7862a71f3c4.jpg, https://salt.tikicdn.com/ts/product/34/56/54/981cb427b32d66de95a95f8b3100fe24.jpg","https://salt.tikicdn.com/cache/w1200/ts/product/09/4c/72/4b927f2a4c2cf519afd58b8cb10d0c48.jpg, https://salt.tikicdn.com/cache/w1200/ts/product/ae/b9/68/a1a469b97ea93612914b88e23a4ccb25.jpg, https://salt.tikicdn.com/cache/w1200/ts/product/08/65/94/63e51ce076e130e7f991d7862a71f3c4.jpg, https://salt.tikicdn.com/cache/w1200/ts/product/34/56/54/981cb427b32d66de95a95f8b3100fe24.jpg","https://salt.tikicdn.com/cache/w300/ts/product/09/4c/72/4b927f2a4c2cf519afd58b8cb10d0c48.jpg, https://salt.tikicdn.com/cache/w300/ts/product/ae/b9/68/a1a469b97ea93612914b88e23a4ccb25.jpg, https://salt.tikicdn.com/cache/w300/ts/product/08/65/94/63e51ce076e130e7f991d7862a71f3c4.jpg, https://salt.tikicdn.com/cache/w300/ts/product/34/56/54/981cb427b32d66de95a95f8b3100fe24.jpg","https://salt.tikicdn.com/cache/200x280/ts/product/09/4c/72/4b927f2a4c2cf519afd58b8cb10d0c48.jpg, https://salt.tikicdn.com/cache/200x280/ts/product/ae/b9/68/a1a469b97ea93612914b88e23a4ccb25.jpg, https://salt.tikicdn.com/cache/200x280/ts/product/08/65/94/63e51ce076e130e7f991d7862a71f3c4.jpg, https://salt.tikicdn.com/cache/200x280/ts/product/34/56/54/981cb427b32d66de95a95f8b3100fe24.jpg","https://salt.tikicdn.com/cache/200x280/ts/product/09/4c/72/4b927f2a4c2cf519afd58b8cb10d0c48.jpg, https://salt.tikicdn.com/cache/200x280/ts/product/ae/b9/68/a1a469b97ea93612914b88e23a4ccb25.jpg, https://salt.tikicdn.com/cache/200x280/ts/product/08/65/94/63e51ce076e130e7f991d7862a71f3c4.jpg, https://salt.tikicdn.com/cache/200x280/ts/product/34/56/54/981cb427b32d66de95a95f8b3100fe24.jpg",1000,2
169379721,Bút Bi Suprimo Schneider 135604 - Mực Xanh Lá,19500,    Bút Bi Suprimo Schneider 135604 - Mực Xanh Lá ...,"Bút Bi Suprimo Schneider 135604 - Mực Xanh Lá Giá sản phẩm trên Tiki đã bao gồm thuế theo luật hiện hành. Bên cạnh đó, tuỳ vào loại sản phẩm, hình thức và địa chỉ giao hàng mà có thể phát sinh thêm chi phí khác như phí vận chuyển, phụ phí hàng cồng kềnh, thuế nhập khẩu (đối với đơn hàng giao từ nước ngoài có giá trị trên 1 triệu đồng).....",0,0,"https://salt.tikicdn.com/ts/product/05/9f/93/eec96346823b93b10a566ecf71f9728b.jpg, https://salt.tikicdn.com/ts/product/17/6f/60/168e6f8e8792282b95f2e1a19ad465e9.jpg, https://salt.tikicdn.com/ts/product/05/17/01/c9867a4f368f9ba3c94b5c4e4b057461.jpg, https://salt.tikicdn.com/ts/product/d8/5a/a1/ae403511ba9454cdbfe0e58cb9483426.jpg","https://salt.tikicdn.com/cache/w1200/ts/product/05/9f/93/eec96346823b93b10a566ecf71f9728b.jpg, https://salt.tikicdn.com/cache/w1200/ts/product/17/6f/60/168e6f8e8792282b95f2e1a19ad465e9.jpg, https://salt.tikicdn.com/cache/w1200/ts/product/05/17/01/c9867a4f368f9ba3c94b5c4e4b057461.jpg, https://salt.tikicdn.com/cache/w1200/ts/product/d8/5a/a1/ae403511ba9454cdbfe0e58cb9483426.jpg","https://salt.tikicdn.com/cache/w300/ts/product/05/9f/93/eec96346823b93b10a566ecf71f9728b.jpg, https://salt.tikicdn.com/cache/w300/ts/product/17/6f/60/168e6f8e8792282b95f2e1a19ad465e9.jpg, https://salt.tikicdn.com/cache/w300/ts/product/05/17/01/c9867a4f368f9ba3c94b5c4e4b057461.jpg, https://salt.tikicdn.com/cache/w300/ts/product/d8/5a/a1/ae403511ba9454cdbfe0e58cb9483426.jpg","https://salt.tikicdn.com/cache/200x280/ts/product/05/9f/93/eec96346823b93b10a566ecf71f9728b.jpg, https://salt.tikicdn.com/cache/200x280/ts/product/17/6f/60/168e6f8e8792282b95f2e1a19ad465e9.jpg, https://salt.tikicdn.com/cache/200x280/ts/product/05/17/01/c9867a4f368f9ba3c94b5c4e4b057461.jpg, https://salt.tikicdn.com/cache/200x280/ts/product/d8/5a/a1/ae403511ba9454cdbfe0e58cb9483426.jpg","https://salt.tikicdn.com/cache/200x280/ts/product/05/9f/93/eec96346823b93b10a566ecf71f9728b.jpg, https://salt.tikicdn.com/cache/200x280/ts/product/17/6f/60/168e6f8e8792282b95f2e1a19ad465e9.jpg, https://salt.tikicdn.com/cache/200x280/ts/product/05/17/01/c9867a4f368f9ba3c94b5c4e4b057461.jpg, https://salt.tikicdn.com/cache/200x280/ts/product/d8/5a/a1/ae403511ba9454cdbfe0e58cb9483426.jpg",1000,0
165184073,Vỉ 3 Bút Bi Thiên Long TL-089,12740,"THÔNG TIN CHI TIẾTThương hiệu:Thiên LongModel:TL-089Số lượng:3 câyVỉ 3 Bút Bi TL-089Vỉ 3 Cây Bút Bi Thiên Long TL-089 được thiết kế theo dạng bấm cò với phần thân thon gọn, ...","THÔNG TIN CHI TIẾT Thương hiệu: Thiên Long Model: TL-089 Số lượng: 3 cây Vỉ 3 Bút Bi TL-089 Vỉ 3 Cây Bút Bi Thiên Long TL-089 được thiết kế theo dạng bấm cò với phần thân thon gọn, vừa tay cầm, trọng lượng nhẹ, giúp bạn dễ dàng sử dụng mọi lúc mọi nơi. Bút sử dụng loại mực mau khô, không làm ướt, rách bề mặt giấy khi viết, mang đến sự tiện lợi và thoải mái tối đa khi sử dụng. Có 3 màu mực cho bạn dễ lựa chọn: Đỏ, xanh, đen. Bút bi Thiên Long TL-089 với kích thước đầu bi chỉ 0.5mm, cho bạn nét chữ thanh mảnh, sắc nét trên từng trang giấy. Ngoài ra, đầu bi nhỏ còn giúp cho bút không hao mực, bạn có thể thoải mái ghi chép, viết lách. Vỉ gô cây tiện lợi, giúp tiết kiệm chi phí và thời gian mua sắm cho người dùng. Giá sản phẩm trên Tiki đã bao gồm thuế theo luật hiện hành. Bên cạnh đó, tuỳ vào loại sản phẩm, hình thức và địa chỉ giao hàng mà có thể phát sinh thêm chi phí khác như phí vận chuyển, phụ phí hàng cồng kềnh, thuế nhập khẩu (đối với đơn hàng giao từ nước ngoài có giá trị trên 1 triệu đồng).....",0,0,https://salt.tikicdn.com/ts/product/a0/88/21/358f1c4dfda258f2bd0daa101a665a77.jpg,https://salt.tikicdn.com/cache/w1200/ts/product/a0/88/21/358f1c4dfda258f2bd0daa101a665a77.jpg,https://salt.tikicdn.com/cache/w300/ts/product/a0/88/21/358f1c4dfda258f2bd0daa101a665a77.jpg,https://salt.tikicdn.com/cache/200x280/ts/product/a0/88/21/358f1c4dfda258f2bd0daa101a665a77.jpg,https://salt.tikicdn.com/cache/200x280/ts/product/a0/88/21/358f1c4dfda258f2bd0daa101a665a77.jpg,1000,0
158623867,Bút Bi 4 Màu 0.7mm Morning Glory - 81059 (Mẫu Màu Giao Ngẫu Nhiên),22900,    Bút Bi 4 Màu 0.7mm Morning Glory - 81059 (Mẫu Màu Giao Ngẫu Nhiên) ...,"Bút Bi 4 Màu 0.7mm Morning Glory - 81059 (Mẫu Màu Giao Ngẫu Nhiên) Giá sản phẩm trên Tiki đã bao gồm thuế theo luật hiện hành. Bên cạnh đó, tuỳ vào loại sản phẩm, hình thức và địa chỉ giao hàng mà có thể phát sinh thêm chi phí khác như phí vận chuyển, phụ phí hàng cồng kềnh, thuế nhập khẩu (đối với đơn hàng giao từ nước ngoài có giá trị trên 1 triệu đồng).....",0,0,"https://salt.tikicdn.com/ts/product/09/f5/0f/e6f112e29f4e4698a06656eb934eb5d5.jpg, https://salt.tikicdn.com/ts/product/9a/d1/71/8b6e45844b7b4f41a16e7c5cb044a61b.jpg, https://salt.tikicdn.com/ts/product/b4/e4/27/895a7b8a475151ec4c086a7893da3cf4.jpg, https://salt.tikicdn.com/ts/product/b0/6f/2a/33896af8744c3ecb1c34fc211005ba19.jpg, https://salt.tikicdn.com/ts/product/98/eb/79/ce3eb19c90eb052de8c04966a4f696e0.jpg, https://salt.tikicdn.com/ts/product/09/db/9f/34d77311d978ef127a9a810908a7e474.jpg, https://salt.tikicdn.com/ts/product/91/ac/90/b0c1960b29471293cf21ed06c38d7c3a.jpg","https://salt.tikicdn.com/cache/w1200/ts/product/09/f5/0f/e6f112e29f4e4698a06656eb934eb5d5.jpg, https://salt.tikicdn.com/cache/w1200/ts/product/9a/d1/71/8b6e45844b7b4f41a16e7c5cb044a61b.jpg, https://salt.tikicdn.com/cache/w1200/ts/product/b4/e4/27/895a7b8a475151ec4c086a7893da3cf4.jpg, https://salt.tikicdn.com/cache/w1200/ts/product/b0/6f/2a/33896af8744c3ecb1c34fc211005ba19.jpg, https://salt.tikicdn.com/cache/w1200/ts/product/98/eb/79/ce3eb19c90eb052de8c04966a4f696e0.jpg, https://salt.tikicdn.com/cache/w1200/ts/product/09/db/9f/34d77311d978ef127a9a810908a7e474.jpg, https://salt.tikicdn.com/cache/w1200/ts/product/91/ac/90/b0c1960b29471293cf21ed06c38d7c3a.jpg","https://salt.tikicdn.com/cache/w300/ts/product/09/f5/0f/e6f112e29f4e4698a06656eb934eb5d5.jpg, https://salt.tikicdn.com/cache/w300/ts/product/9a/d1/71/8b6e45844b7b4f41a16e7c5cb044a61b.jpg, https://salt.tikicdn.com/cache/w300/ts/product/b4/e4/27/895a7b8a475151ec4c086a7893da3cf4.jpg, https://salt.tikicdn.com/cache/w300/ts/product/b0/6f/2a/33896af8744c3ecb1c34fc211005ba19.jpg, https://salt.tikicdn.com/cache/w300/ts/product/98/eb/79/ce3eb19c90eb052de8c04966a4f696e0.jpg, https://salt.tikicdn.com/cache/w300/ts/product/09/db/9f/34d77311d978ef127a9a810908a7e474.jpg, https://salt.tikicdn.com/cache/w300/ts/product/91/ac/90/b0c1960b29471293cf21ed06c38d7c3a.jpg","https://salt.tikicdn.com/cache/200x280/ts/product/09/f5/0f/e6f112e29f4e4698a06656eb934eb5d5.jpg, https://salt.tikicdn.com/cache/200x280/ts/product/9a/d1/71/8b6e45844b7b4f41a16e7c5cb044a61b.jpg, https://salt.tikicdn.com/cache/200x280/ts/product/b4/e4/27/895a7b8a475151ec4c086a7893da3cf4.jpg, https://salt.tikicdn.com/cache/200x280/ts/product/b0/6f/2a/33896af8744c3ecb1c34fc211005ba19.jpg, https://salt.tikicdn.com/cache/200x280/ts/product/98/eb/79/ce3eb19c90eb052de8c04966a4f696e0.jpg, https://salt.tikicdn.com/cache/200x280/ts/product/09/db/9f/34d77311d978ef127a9a810908a7e474.jpg, https://salt.tikicdn.com/cache/200x280/ts/product/91/ac/90/b0c1960b29471293cf21ed06c38d7c3a.jpg","https://salt.tikicdn.com/cache/200x280/ts/product/09/f5/0f/e6f112e29f4e4698a06656eb934eb5d5.jpg, https://salt.tikicdn.com/cache/200x280/ts/product/9a/d1/71/8b6e45844b7b4f41a16e7c5cb044a61b.jpg, https://salt.tikicdn.com/cache/200x280/ts/product/b4/e4/27/895a7b8a475151ec4c086a7893da3cf4.jpg, https://salt.tikicdn.com/cache/200x280/ts/product/b0/6f/2a/33896af8744c3ecb1c34fc211005ba19.jpg, https://salt.tikicdn.com/cache/200x280/ts/product/98/eb/79/ce3eb19c90eb052de8c04966a4f696e0.jpg, https://salt.tikicdn.com/cache/200x280/ts/product/09/db/9f/34d77311d978ef127a9a810908a7e474.jpg, https://salt.tikicdn.com/cache/200x280/ts/product/91/ac/90/b0c1960b29471293cf21ed06c38d7c3a.jpg",1000,0
121172114,Hộp 60 Cây Bút Bi Bấm Đầu 0.7mm 4 màu trong 1-BAOKE/B38,70000,"       Nhãn hiệu : BAOKE   tên sản phẩm:Baoke bút bi   Mục SỐ. :B38   Nguyên liệu chính : Nhựa, kim loại,    Màu bút : Đen, xanh, trắng, vàng   Màu mực :Màu xanh da trời   Đầu bút : 0,7 mm ...","Nhãn hiệu : BAOKE tên sản phẩm:Baoke bút bi Mục SỐ. :B38 Nguyên liệu chính : Nhựa, kim loại, Màu bút : Đen, xanh, trắng, vàng Màu mực :Màu xanh da trời Đầu bút : 0,7 mm MOQ của thương hiệu BAOKE 60 chiếc MOQ của OEM Có thể thương lượng Sử dụng : Văn phòng, Trường học, Nhà riêng, In hoặc màu tùy chỉnh Có sẵn để tùy chỉnh. Mẫu vật : Mẫu là miễn phí, phí vận chuyển do khách hàng tính. Giá sản phẩm trên Tiki đã bao gồm thuế theo luật hiện hành. Bên cạnh đó, tuỳ vào loại sản phẩm, hình thức và địa chỉ giao hàng mà có thể phát sinh thêm chi phí khác như phí vận chuyển, phụ phí hàng cồng kềnh, thuế nhập khẩu (đối với đơn hàng giao từ nước ngoài có giá trị trên 1 triệu đồng)..... Sản phẩm này là tài sản cá nhân được bán bởi Nhà Bán Hàng Cá Nhân và không thuộc đối tượng phải chịu thuế GTGT. Do đó hoá đơn VAT không được cung cấp trong trường hợp này.",0,0,"https://salt.tikicdn.com/ts/product/c3/56/fd/8c124b5b60a94029820d438a3c4e679c.jpg, https://salt.tikicdn.com/ts/product/56/0d/44/270bb8e334246d59ddeea5ec117638d6.jpg, https://salt.tikicdn.com/ts/product/50/20/4d/10ed864868be366ed5285d21577526d6.jpg, https://salt.tikicdn.com/ts/product/2a/0a/28/c1b2ebd3e4d1ccb750099c6d4ac7dacf.jpg, https://salt.tikicdn.com/ts/product/68/75/a8/a3f3ed33994c8615bdd194001699b959.jpg, https://salt.tikicdn.com/ts/product/02/28/49/bb35583886648b24c210e409def4402f.jpg, https://salt.tikicdn.com/ts/product/e4/93/c0/b874beac215af18eb54beb867b446b27.jpg, https://salt.tikicdn.com/ts/product/e4/99/58/3722faad7d215a8c2d542693f0b38f12.jpg","https://salt.tikicdn.com/cache/w1200/ts/product/c3/56/fd/8c124b5b60a94029820d438a3c4e679c.jpg, https://salt.tikicdn.com/cache/w1200/ts/product/56/0d/44/270bb8e334246d59ddeea5ec117638d6.jpg, https://salt.tikicdn.com/cache/w1200/ts/product/50/20/4d/10ed864868be366ed5285d21577526d6.jpg, https://salt.tikicdn.com/cache/w1200/ts/product/2a/0a/28/c1b2ebd3e4d1ccb750099c6d4ac7dacf.jpg, https://salt.tikicdn.com/cache/w1200/ts/product/68/75/a8/a3f3ed33994c8615bdd194001699b959.jpg, https://salt.tikicdn.com/cache/w1200/ts/product/02/28/49/bb35583886648b24c210e409def4402f.jpg, https://salt.tikicdn.com/cache/w1200/ts/product/e4/93/c0/b874beac215af18eb54beb867b446b27.jpg, https://salt.tikicdn.com/cache/w1200/ts/product/e4/99/58/3722faad7d215a8c2d542693f0b38f12.jpg","https://salt.tikicdn.com/cache/w300/ts/product/c3/56/fd/8c124b5b60a94029820d438a3c4e679c.jpg, https://salt.tikicdn.com/cache/w300/ts/product/56/0d/44/270bb8e334246d59ddeea5ec117638d6.jpg, https://salt.tikicdn.com/cache/w300/ts/product/50/20/4d/10ed864868be366ed5285d21577526d6.jpg, https://salt.tikicdn.com/cache/w300/ts/product/2a/0a/28/c1b2ebd3e4d1ccb750099c6d4ac7dacf.jpg, https://salt.tikicdn.com/cache/w300/ts/product/68/75/a8/a3f3ed33994c8615bdd194001699b959.jpg, https://salt.tikicdn.com/cache/w300/ts/product/02/28/49/bb35583886648b24c210e409def4402f.jpg, https://salt.tikicdn.com/cache/w300/ts/product/e4/93/c0/b874beac215af18eb54beb867b446b27.jpg, https://salt.tikicdn.com/cache/w300/ts/product/e4/99/58/3722faad7d215a8c2d542693f0b38f12.jpg","https://salt.tikicdn.com/cache/200x280/ts/product/c3/56/fd/8c124b5b60a94029820d438a3c4e679c.jpg, https://salt.tikicdn.com/cache/200x280/ts/product/56/0d/44/270bb8e334246d59ddeea5ec117638d6.jpg, https://salt.tikicdn.com/cache/200x280/ts/product/50/20/4d/10ed864868be366ed5285d21577526d6.jpg, https://salt.tikicdn.com/cache/200x280/ts/product/2a/0a/28/c1b2ebd3e4d1ccb750099c6d4ac7dacf.jpg, https://salt.tikicdn.com/cache/200x280/ts/product/68/75/a8/a3f3ed33994c8615bdd194001699b959.jpg, https://salt.tikicdn.com/cache/200x280/ts/product/02/28/49/bb35583886648b24c210e409def4402f.jpg, https://salt.tikicdn.com/cache/200x280/ts/product/e4/93/c0/b874beac215af18eb54beb867b446b27.jpg, https://salt.tikicdn.com/cache/200x280/ts/product/e4/99/58/3722faad7d215a8c2d542693f0b38f12.jpg","https://salt.tikicdn.com/cache/200x280/ts/product/c3/56/fd/8c124b5b60a94029820d438a3c4e679c.jpg, https://salt.tikicdn.com/cache/200x280/ts/product/56/0d/44/270bb8e334246d59ddeea5ec117638d6.jpg, https://salt.tikicdn.com/cache/200x280/ts/product/50/20/4d/10ed864868be366ed5285d21577526d6.jpg, https://salt.tikicdn.com/cache/200x280/ts/product/2a/0a/28/c1b2ebd3e4d1ccb750099c6d4ac7dacf.jpg, https://salt.tikicdn.com/cache/200x280/ts/product/68/75/a8/a3f3ed33994c8615bdd194001699b959.jpg, https://salt.tikicdn.com/cache/200x280/ts/product/02/28/49/bb35583886648b24c210e409def4402f.jpg, https://salt.tikicdn.com/cache/200x280/ts/product/e4/93/c0/b874beac215af18eb54beb867b446b27.jpg, https://salt.tikicdn.com/cache/200x280/ts/product/e4/99/58/3722faad7d215a8c2d542693f0b38f12.jpg",1000,0
121172010,Hộp 24 Cây-Bút Bi Để Bàn- Mực Đen/Xanh-BAOKE/TB780,168000,       1 、 Đầu bút bi bằng thép titan bền hơn đảm bảo viết trơn tru hơn để cung cấp một đường thẳng nhất quán mà không bị bỏ qua.   2 、 Điểm nhấn bằng kim loại thời trang với lớp hoàn thiện in ho...,"1 、 Đầu bút bi bằng thép titan bền hơn đảm bảo viết trơn tru hơn để cung cấp một đường thẳng nhất quán mà không bị bỏ qua. 2 、 Điểm nhấn bằng kim loại thời trang với lớp hoàn thiện in hoa văn chất lượng cao. 3 、 Với trang trí kim cương ở đầu nắp, tăng thêm hương vị quý phái. 4 、 Kẹp kim loại tiện lợi cho phép bạn thêm nó vào bất kỳ sổ ghi chép, nhật ký, bảng kế hoạch hoặc túi nào để dễ dàng vận chuyển. Giá sản phẩm trên Tiki đã bao gồm thuế theo luật hiện hành. Bên cạnh đó, tuỳ vào loại sản phẩm, hình thức và địa chỉ giao hàng mà có thể phát sinh thêm chi phí khác như phí vận chuyển, phụ phí hàng cồng kềnh, thuế nhập khẩu (đối với đơn hàng giao từ nước ngoài có giá trị trên 1 triệu đồng).....",0,0,"https://salt.tikicdn.com/ts/product/1a/db/be/2a56b246537ae533122d229b3fa5a3e4.jpg, https://salt.tikicdn.com/ts/product/59/5e/87/0f86fd00939cdb72d12f9cd2711cf682.jpg, https://salt.tikicdn.com/ts/product/5c/ce/e0/4ab976323f571006c9353f60ee602efb.jpg, https://salt.tikicdn.com/ts/product/aa/64/a3/8c15933aa7d4bff654bacf8354ddb99c.jpg, https://salt.tikicdn.com/ts/product/e1/d2/4b/6f3948aadd8a09668fe422e37a1d7d00.jpg, https://salt.tikicdn.com/ts/product/e2/d6/7c/c2df754f77fe1a70c43f4ce1366cd520.jpg, https://salt.tikicdn.com/ts/product/ee/95/41/541281fe0d86301e5cb090c07ba7811b.jpg","https://salt.tikicdn.com/cache/w1200/ts/product/1a/db/be/2a56b246537ae533122d229b3fa5a3e4.jpg, https://salt.tikicdn.com/cache/w1200/ts/product/59/5e/87/0f86fd00939cdb72d12f9cd2711cf682.jpg, https://salt.tikicdn.com/cache/w1200/ts/product/5c/ce/e0/4ab976323f571006c9353f60ee602efb.jpg, https://salt.tikicdn.com/cache/w1200/ts/product/aa/64/a3/8c15933aa7d4bff654bacf8354ddb99c.jpg, https://salt.tikicdn.com/cache/w1200/ts/product/e1/d2/4b/6f3948aadd8a09668fe422e37a1d7d00.jpg, https://salt.tikicdn.com/cache/w1200/ts/product/e2/d6/7c/c2df754f77fe1a70c43f4ce1366cd520.jpg, https://salt.tikicdn.com/cache/w1200/ts/product/ee/95/41/541281fe0d86301e5cb090c07ba7811b.jpg","https://salt.tikicdn.com/cache/w300/ts/product/1a/db/be/2a56b246537ae533122d229b3fa5a3e4.jpg, https://salt.tikicdn.com/cache/w300/ts/product/59/5e/87/0f86fd00939cdb72d12f9cd2711cf682.jpg, https://salt.tikicdn.com/cache/w300/ts/product/5c/ce/e0/4ab976323f571006c9353f60ee602efb.jpg, https://salt.tikicdn.com/cache/w300/ts/product/aa/64/a3/8c15933aa7d4bff654bacf8354ddb99c.jpg, https://salt.tikicdn.com/cache/w300/ts/product/e1/d2/4b/6f3948aadd8a09668fe422e37a1d7d00.jpg, https://salt.tikicdn.com/cache/w300/ts/product/e2/d6/7c/c2df754f77fe1a70c43f4ce1366cd520.jpg, https://salt.tikicdn.com/cache/w300/ts/product/ee/95/41/541281fe0d86301e5cb090c07ba7811b.jpg","https://salt.tikicdn.com/cache/200x280/ts/product/1a/db/be/2a56b246537ae533122d229b3fa5a3e4.jpg, https://salt.tikicdn.com/cache/200x280/ts/product/59/5e/87/0f86fd00939cdb72d12f9cd2711cf682.jpg, https://salt.tikicdn.com/cache/200x280/ts/product/5c/ce/e0/4ab976323f571006c9353f60ee602efb.jpg, https://salt.tikicdn.com/cache/200x280/ts/product/aa/64/a3/8c15933aa7d4bff654bacf8354ddb99c.jpg, https://salt.tikicdn.com/cache/200x280/ts/product/e1/d2/4b/6f3948aadd8a09668fe422e37a1d7d00.jpg, https://salt.tikicdn.com/cache/200x280/ts/product/e2/d6/7c/c2df754f77fe1a70c43f4ce1366cd520.jpg, https://salt.tikicdn.com/cache/200x280/ts/product/ee/95/41/541281fe0d86301e5cb090c07ba7811b.jpg","https://salt.tikicdn.com/cache/200x280/ts/product/1a/db/be/2a56b246537ae533122d229b3fa5a3e4.jpg, https://salt.tikicdn.com/cache/200x280/ts/product/59/5e/87/0f86fd00939cdb72d12f9cd2711cf682.jpg, https://salt.tikicdn.com/cache/200x280/ts/product/5c/ce/e0/4ab976323f571006c9353f60ee602efb.jpg, https://salt.tikicdn.com/cache/200x280/ts/product/aa/64/a3/8c15933aa7d4bff654bacf8354ddb99c.jpg, https://salt.tikicdn.com/cache/200x280/ts/product/e1/d2/4b/6f3948aadd8a09668fe422e37a1d7d00.jpg, https://salt.tikicdn.com/cache/200x280/ts/product/e2/d6/7c/c2df754f77fe1a70c43f4ce1366cd520.jpg, https://salt.tikicdn.com/cache/200x280/ts/product/ee/95/41/541281fe0d86301e5cb090c07ba7811b.jpg",1000,0
