id,name,price,short_description,description,rating_average,review_count,image_base_url,image_large_url,image_medium_url,image_small_url,image_thumbnail_url,stock,quantity_sold
97516996,Bút Bi Officetex OT-BP016BU - Mực Xanh,3300,"Bút Bi OT-BP016BU - Mực Xanh   Sản phẩm là dòng sản phẩm mới nhất của Công ty BITEX , với những tính năng ưu việt:   - Viết êm trơn, mực ra đều , liên tục, và không lem.   - Đầu bi làm bằng th...","Bút Bi OT-BP016BU - Mực Xanh Sản phẩm là dòng sản phẩm mới nhất của Công ty BITEX , với những tính năng ưu việt: - Viết êm trơn, mực ra đều , liên tục, và không lem. - Đầu bi làm bằng thép không rỉ. - Không bị chảy mực. Sản phẩm Đạt tiêu chuẩn châu ÂU EN 71-3 và tiêu chuẩn Mỹ ASTM F963-11 Lưu ý: - Tránh va chạm vào các vật cứng quá mạnh. - Bảo quản nơi khô ráo thoáng mát, tránh tiếp xúc với nhiệt độ cao. Giá sản phẩm trên Tiki đã bao gồm thuế theo luật hiện hành. Bên cạnh đó, tuỳ vào loại sản phẩm, hình thức và địa chỉ giao hàng mà có thể phát sinh thêm chi phí khác như phí vận chuyển, phụ phí hàng cồng kềnh, thuế nhập khẩu (đối với đơn hàng giao từ nước ngoài có giá trị trên 1 triệu đồng).....",5,2,"https://salt.tikicdn.com/ts/product/dc/f3/7f/95203176f56d8fe579ebbed31fb561cf.jpg, https://salt.tikicdn.com/ts/product/2c/73/ca/74aa90a3291cb934bdb72631eeb6d1d8.jpg, https://salt.tikicdn.com/ts/product/d1/1d/55/c3f081a8d37f270df638424f8e5e5b10.png, https://salt.tikicdn.com/ts/product/3f/8d/32/2f3d90e5579ba54da6f07c7a9ee06d4b.png","https://salt.tikicdn.com/cache/w1200/ts/product/dc/f3/7f/95203176f56d8fe579ebbed31fb561cf.jpg, https://salt.tikicdn.com/cache/w1200/ts/product/2c/73/ca/74aa90a3291cb934bdb72631eeb6d1d8.jpg, https://salt.tikicdn.com/cache/w1200/ts/product/d1/1d/55/c3f081a8d37f270df638424f8e5e5b10.png, https://salt.tikicdn.com/cache/w1200/ts/product/3f/8d/32/2f3d90e5579ba54da6f07c7a9ee06d4b.png","https://salt.tikicdn.com/cache/w300/ts/product/dc/f3/7f/95203176f56d8fe579ebbed31fb561cf.jpg, https://salt.tikicdn.com/cache/w300/ts/product/2c/73/ca/74aa90a3291cb934bdb72631eeb6d1d8.jpg, https://salt.tikicdn.com/cache/w300/ts/product/d1/1d/55/c3f081a8d37f270df638424f8e5e5b10.png, https://salt.tikicdn.com/cache/w300/ts/product/3f/8d/32/2f3d90e5579ba54da6f07c7a9ee06d4b.png","https://salt.tikicdn.com/cache/200x280/ts/product/dc/f3/7f/95203176f56d8fe579ebbed31fb561cf.jpg, https://salt.tikicdn.com/cache/200x280/ts/product/2c/73/ca/74aa90a3291cb934bdb72631eeb6d1d8.jpg, https://salt.tikicdn.com/cache/200x280/ts/product/d1/1d/55/c3f081a8d37f270df638424f8e5e5b10.png, https://salt.tikicdn.com/cache/200x280/ts/product/3f/8d/32/2f3d90e5579ba54da6f07c7a9ee06d4b.png","https://salt.tikicdn.com/cache/200x280/ts/product/dc/f3/7f/95203176f56d8fe579ebbed31fb561cf.jpg, https://salt.tikicdn.com/cache/200x280/ts/product/2c/73/ca/74aa90a3291cb934bdb72631eeb6d1d8.jpg, https://salt.tikicdn.com/cache/200x280/ts/product/d1/1d/55/c3f081a8d37f270df638424f8e5e5b10.png, https://salt.tikicdn.com/cache/200x280/ts/product/3f/8d/32/2f3d90e5579ba54da6f07c7a9ee06d4b.png",1000,2
96555380,Bút Bi Stacom 0.5mm BP1015 - Mực Xanh,3800,"Bút Bi Stacom 0.5mm BP1015   Bút có kiểu dáng hiện đại, vừa tay cầm, tạo sự thoải mái cho người sử dụng.   Ngòi bút êm ái, mực ra đều không bị nhòe, cho chữ viết sắc nét và đẹp như mong muốn.   Mực...","Bút Bi Stacom 0.5mm BP1015 Bút có kiểu dáng hiện đại, vừa tay cầm, tạo sự thoải mái cho người sử dụng. Ngòi bút êm ái, mực ra đều không bị nhòe, cho chữ viết sắc nét và đẹp như mong muốn. Mực gel cao cấp, mau khô, không đóng cặn, không độc hại, an toàn cho sức khỏe. Ngòi bút sản xuất theo công nghệ tiên tiến nên viết êm, mực chảy đều, nét viết mềm mại Các phân tử màu không hòa tan trong nước nên mực kháng nước và bền mầu. Mực ra đều, đậm, nhanh khô và không bị lem. Phần đệm tay tạo cảo giác êm ái và không gây mỏi tay khi viết lâu. Giá sản phẩm trên Tiki đã bao gồm thuế theo luật hiện hành. Bên cạnh đó, tuỳ vào loại sản phẩm, hình thức và địa chỉ giao hàng mà có thể phát sinh thêm chi phí khác như phí vận chuyển, phụ phí hàng cồng kềnh, thuế nhập khẩu (đối với đơn hàng giao từ nước ngoài có giá trị trên 1 triệu đồng).....",3.7,3,"https://salt.tikicdn.com/ts/product/6a/8e/54/7b94f9c4cfe28f42eb3349556825416b.jpg, https://salt.tikicdn.com/ts/product/fb/36/fe/efa707b2c5314b5a0ad97720b72df8a6.jpg, https://salt.tikicdn.com/ts/product/cd/c0/e2/29ae627ec002e9ffa078a3024d036d16.jpg, https://salt.tikicdn.com/ts/product/49/14/30/15a6c115c08fc328f8ca64964cd5971c.jpg","https://salt.tikicdn.com/cache/w1200/ts/product/6a/8e/54/7b94f9c4cfe28f42eb3349556825416b.jpg, https://salt.tikicdn.com/cache/w1200/ts/product/fb/36/fe/efa707b2c5314b5a0ad97720b72df8a6.jpg, https://salt.tikicdn.com/cache/w1200/ts/product/cd/c0/e2/29ae627ec002e9ffa078a3024d036d16.jpg, https://salt.tikicdn.com/cache/w1200/ts/product/49/14/30/15a6c115c08fc328f8ca64964cd5971c.jpg","https://salt.tikicdn.com/cache/w300/ts/product/6a/8e/54/7b94f9c4cfe28f42eb3349556825416b.jpg, https://salt.tikicdn.com/cache/w300/ts/product/fb/36/fe/efa707b2c5314b5a0ad97720b72df8a6.jpg, https://salt.tikicdn.com/cache/w300/ts/product/cd/c0/e2/29ae627ec002e9ffa078a3024d036d16.jpg, https://salt.tikicdn.com/cache/w300/ts/product/49/14/30/15a6c115c08fc328f8ca64964cd5971c.jpg","https://salt.tikicdn.com/cache/200x280/ts/product/6a/8e/54/7b94f9c4cfe28f42eb3349556825416b.jpg, https://salt.tikicdn.com/cache/200x280/ts/product/fb/36/fe/efa707b2c5314b5a0ad97720b72df8a6.jpg, https://salt.tikicdn.com/cache/200x280/ts/product/cd/c0/e2/29ae627ec002e9ffa078a3024d036d16.jpg, https://salt.tikicdn.com/cache/200x280/ts/product/49/14/30/15a6c115c08fc328f8ca64964cd5971c.jpg","https://salt.tikicdn.com/cache/200x280/ts/product/6a/8e/54/7b94f9c4cfe28f42eb3349556825416b.jpg, https://salt.tikicdn.com/cache/200x280/ts/product/fb/36/fe/efa707b2c5314b5a0ad97720b72df8a6.jpg, https://salt.tikicdn.com/cache/200x280/ts/product/cd/c0/e2/29ae627ec002e9ffa078a3024d036d16.jpg, https://salt.tikicdn.com/cache/200x280/ts/product/49/14/30/15a6c115c08fc328f8ca64964cd5971c.jpg",1000,3
83750690,Bút Bi Artline ERB-4400 - 0.7mm - Xanh Đậm,35500,"Bút Bi Artline ERB-4400 - 0.7mm - Xanh Đen   Bút bi được thiết kế vừa với tay cầm, êm và ra đều mực. Ngòi bút bi siêu cứng, được chế tạo với độ chính xác cực cao. Phù hợp cho các bạn học sinh, sinh v...","Bút Bi Artline ERB-4400 - 0.7mm - Xanh Đen Bút bi được thiết kế vừa với tay cầm, êm và ra đều mực. Ngòi bút bi siêu cứng, được chế tạo với độ chính xác cực cao. Phù hợp cho các bạn học sinh, sinh viên và nhân viên văn phòng,… Bút có nắp đậy kèm thanh cài gắn trên thân nắp thuận tiện cho cài bút vào tài liệu hay túi áo vô cùng tiện dụng. Viết cực êm, thoải mái, không có hiện tượng ứ đọng mực ở đầu bút khi dùng lâu. Hạn chế tắt mực nên thời gian sử dụng lâu dài và bền hơn. Giá sản phẩm trên Tiki đã bao gồm thuế theo luật hiện hành. Bên cạnh đó, tuỳ vào loại sản phẩm, hình thức và địa chỉ giao hàng mà có thể phát sinh thêm chi phí khác như phí vận chuyển, phụ phí hàng cồng kềnh, thuế nhập khẩu (đối với đơn hàng giao từ nước ngoài có giá trị trên 1 triệu đồng).....",0,0,"https://salt.tikicdn.com/ts/product/00/3b/a3/aecf817e37c57589118b614aa6513c4e.jpg, https://salt.tikicdn.com/ts/product/a5/bd/fd/2d2cacbc51145e25fcaefe9d065fe147.jpg, https://salt.tikicdn.com/ts/product/e1/99/ed/257a5d6fdd9b1cbfc4062cc518f421da.jpg","https://salt.tikicdn.com/cache/w1200/ts/product/00/3b/a3/aecf817e37c57589118b614aa6513c4e.jpg, https://salt.tikicdn.com/cache/w1200/ts/product/a5/bd/fd/2d2cacbc51145e25fcaefe9d065fe147.jpg, https://salt.tikicdn.com/cache/w1200/ts/product/e1/99/ed/257a5d6fdd9b1cbfc4062cc518f421da.jpg","https://salt.tikicdn.com/cache/w300/ts/product/00/3b/a3/aecf817e37c57589118b614aa6513c4e.jpg, https://salt.tikicdn.com/cache/w300/ts/product/a5/bd/fd/2d2cacbc51145e25fcaefe9d065fe147.jpg, https://salt.tikicdn.com/cache/w300/ts/product/e1/99/ed/257a5d6fdd9b1cbfc4062cc518f421da.jpg","https://salt.tikicdn.com/cache/200x280/ts/product/00/3b/a3/aecf817e37c57589118b614aa6513c4e.jpg, https://salt.tikicdn.com/cache/200x280/ts/product/a5/bd/fd/2d2cacbc51145e25fcaefe9d065fe147.jpg, https://salt.tikicdn.com/cache/200x280/ts/product/e1/99/ed/257a5d6fdd9b1cbfc4062cc518f421da.jpg","https://salt.tikicdn.com/cache/200x280/ts/product/00/3b/a3/aecf817e37c57589118b614aa6513c4e.jpg, https://salt.tikicdn.com/cache/200x280/ts/product/a5/bd/fd/2d2cacbc51145e25fcaefe9d065fe147.jpg, https://salt.tikicdn.com/cache/200x280/ts/product/e1/99/ed/257a5d6fdd9b1cbfc4062cc518f421da.jpg",1000,0
277586133,Combo 40 cây Bút bi mực xanh đậm TL 027  - 0.7mm mẫu mới bền đẹp ,103550,-Combo 40 cây Bút bi mực xanh đậm TL 027 - 0.7mm mẫu mới bền đẹp--Xuất xứ : Việt Nam-Nét bút : 0.7mm-Loại bút  : bút bi-Bút bi TL 089 - 0.7mm-Bút nhựa đủ màu mực xanh màu đậm-Màu sắc : giao ngẫ...,"-Combo 40 cây Bút bi mực xanh đậm TL 027 - 0.7mm mẫu mới bền đẹp - -Xuất xứ : Việt Nam -Nét bút : 0.7mm -Loại bút  : bút bi -Bút bi TL 089 - 0.7mm -Bút nhựa đủ màu mực xanh màu đậm -Màu sắc : giao ngẫu nhiên -Bên cạnh việc sử dụng để ghi chép, bút bi còn đem đến 6 công dụng sau : 1. Sử dụng để ký ... 2. Quà tặng học sinh. ... 3. Sử dụng làm sản phẩm truyền thông, quảng bá thương hiệu. ... 4. Dành cho các nghệ nhân, họa sĩ sáng tác nghệ thuật. ... 5. Biến hóa trở thành những món đồ handmade. ... Giá sản phẩm trên Tiki đã bao gồm thuế theo luật hiện hành. Bên cạnh đó, tuỳ vào loại sản phẩm, hình thức và địa chỉ giao hàng mà có thể phát sinh thêm chi phí khác như phí vận chuyển, phụ phí hàng cồng kềnh, thuế nhập khẩu (đối với đơn hàng giao từ nước ngoài có giá trị trên 1 triệu đồng)..... Sản phẩm này là tài sản cá nhân được bán bởi Nhà Bán Hàng Cá Nhân và không thuộc đối tượng phải chịu thuế GTGT. Do đó hoá đơn VAT không được cung cấp trong trường hợp này.",0,0,"https://salt.tikicdn.com/ts/product/88/03/b1/1d25c271ec183a00bb5657952c97ffa2.jpg, https://salt.tikicdn.com/ts/product/8d/5a/b3/b38be8e6da653ed32ed00f54d743f191.jpg, https://salt.tikicdn.com/ts/product/bf/8b/14/07ab90c0e3bf37c236baa9707070d16c.jpg, https://salt.tikicdn.com/ts/product/8d/5a/b3/3ebc0e557c437560475f4e94bb280478.jpg, https://salt.tikicdn.com/ts/product/bf/8b/14/b6c398a62181cf6137e3a006862209d6.jpg, https://salt.tikicdn.com/ts/product/88/03/b1/4a86f239112defa045d31cf20d64fb9b.jpg","https://salt.tikicdn.com/cache/w1200/ts/product/88/03/b1/1d25c271ec183a00bb5657952c97ffa2.jpg, https://salt.tikicdn.com/cache/w1200/ts/product/8d/5a/b3/b38be8e6da653ed32ed00f54d743f191.jpg, https://salt.tikicdn.com/cache/w1200/ts/product/bf/8b/14/07ab90c0e3bf37c236baa9707070d16c.jpg, https://salt.tikicdn.com/cache/w1200/ts/product/8d/5a/b3/3ebc0e557c437560475f4e94bb280478.jpg, https://salt.tikicdn.com/cache/w1200/ts/product/bf/8b/14/b6c398a62181cf6137e3a006862209d6.jpg, https://salt.tikicdn.com/cache/w1200/ts/product/88/03/b1/4a86f239112defa045d31cf20d64fb9b.jpg","https://salt.tikicdn.com/cache/w300/ts/product/88/03/b1/1d25c271ec183a00bb5657952c97ffa2.jpg, https://salt.tikicdn.com/cache/w300/ts/product/8d/5a/b3/b38be8e6da653ed32ed00f54d743f191.jpg, https://salt.tikicdn.com/cache/w300/ts/product/bf/8b/14/07ab90c0e3bf37c236baa9707070d16c.jpg, https://salt.tikicdn.com/cache/w300/ts/product/8d/5a/b3/3ebc0e557c437560475f4e94bb280478.jpg, https://salt.tikicdn.com/cache/w300/ts/product/bf/8b/14/b6c398a62181cf6137e3a006862209d6.jpg, https://salt.tikicdn.com/cache/w300/ts/product/88/03/b1/4a86f239112defa045d31cf20d64fb9b.jpg","https://salt.tikicdn.com/cache/200x280/ts/product/88/03/b1/1d25c271ec183a00bb5657952c97ffa2.jpg, https://salt.tikicdn.com/cache/200x280/ts/product/8d/5a/b3/b38be8e6da653ed32ed00f54d743f191.jpg, https://salt.tikicdn.com/cache/200x280/ts/product/bf/8b/14/07ab90c0e3bf37c236baa9707070d16c.jpg, https://salt.tikicdn.com/cache/200x280/ts/product/8d/5a/b3/3ebc0e557c437560475f4e94bb280478.jpg, https://salt.tikicdn.com/cache/200x280/ts/product/bf/8b/14/b6c398a62181cf6137e3a006862209d6.jpg, https://salt.tikicdn.com/cache/200x280/ts/product/88/03/b1/4a86f239112defa045d31cf20d64fb9b.jpg","https://salt.tikicdn.com/cache/200x280/ts/product/88/03/b1/1d25c271ec183a00bb5657952c97ffa2.jpg, https://salt.tikicdn.com/cache/200x280/ts/product/8d/5a/b3/b38be8e6da653ed32ed00f54d743f191.jpg, https://salt.tikicdn.com/cache/200x280/ts/product/bf/8b/14/07ab90c0e3bf37c236baa9707070d16c.jpg, https://salt.tikicdn.com/cache/200x280/ts/product/8d/5a/b3/3ebc0e557c437560475f4e94bb280478.jpg, https://salt.tikicdn.com/cache/200x280/ts/product/bf/8b/14/b6c398a62181cf6137e3a006862209d6.jpg, https://salt.tikicdn.com/cache/200x280/ts/product/88/03/b1/4a86f239112defa045d31cf20d64fb9b.jpg",1000,0
277586127,Bút bi mực xanh đậm TL  027 - 0.7mm - Bịch 40 cây mẫu mới,103550,-Bút bi mực xanh đậm TL 027 - 0.7mm - Bịch 40 cây mẫu mới-Xuất xứ : Việt Nam-Nét bút : 0.7mm-Loại bút  : bút bi-Bút bi TL 089 - 0.7mm-Bút nhựa đủ màu mực xanh màu đậm-Màu sắc : giao ngẫu nhiên-...,"-Bút bi mực xanh đậm TL 027 - 0.7mm - Bịch 40 cây mẫu mới -Xuất xứ : Việt Nam -Nét bút : 0.7mm -Loại bút  : bút bi -Bút bi TL 089 - 0.7mm -Bút nhựa đủ màu mực xanh màu đậm -Màu sắc : giao ngẫu nhiên -Bên cạnh việc sử dụng để ghi chép, bút bi còn đem đến 6 công dụng sau : 1. Sử dụng để ký ... 2. Quà tặng học sinh. ... 3. Sử dụng làm sản phẩm truyền thông, quảng bá thương hiệu. ... 4. Dành cho các nghệ nhân, họa sĩ sáng tác nghệ thuật. ... 5. Biến hóa trở thành những món đồ handmade. ... Giá sản phẩm trên Tiki đã bao gồm thuế theo luật hiện hành. Bên cạnh đó, tuỳ vào loại sản phẩm, hình thức và địa chỉ giao hàng mà có thể phát sinh thêm chi phí khác như phí vận chuyển, phụ phí hàng cồng kềnh, thuế nhập khẩu (đối với đơn hàng giao từ nước ngoài có giá trị trên 1 triệu đồng)..... Sản phẩm này là tài sản cá nhân được bán bởi Nhà Bán Hàng Cá Nhân và không thuộc đối tượng phải chịu thuế GTGT. Do đó hoá đơn VAT không được cung cấp trong trường hợp này.",0,0,"https://salt.tikicdn.com/ts/product/8d/5a/b3/1237c12e3f59ed6919c56f1b0703884e.jpg, https://salt.tikicdn.com/ts/product/88/03/b1/71d1ebdcf833846d790aef553f1ac94b.jpg, https://salt.tikicdn.com/ts/product/bf/8b/14/32d219c096afef1e794cd6e15a245311.jpg, https://salt.tikicdn.com/ts/product/88/03/b1/e1bf7e461d99b52ea3e9000c79240aaf.jpg, https://salt.tikicdn.com/ts/product/8d/5a/b3/800c29f4d75fa727312b5e5a125fd319.jpg, https://salt.tikicdn.com/ts/product/bf/8b/14/e757e64727d1cef3714adce260ede367.jpg","https://salt.tikicdn.com/cache/w1200/ts/product/8d/5a/b3/1237c12e3f59ed6919c56f1b0703884e.jpg, https://salt.tikicdn.com/cache/w1200/ts/product/88/03/b1/71d1ebdcf833846d790aef553f1ac94b.jpg, https://salt.tikicdn.com/cache/w1200/ts/product/bf/8b/14/32d219c096afef1e794cd6e15a245311.jpg, https://salt.tikicdn.com/cache/w1200/ts/product/88/03/b1/e1bf7e461d99b52ea3e9000c79240aaf.jpg, https://salt.tikicdn.com/cache/w1200/ts/product/8d/5a/b3/800c29f4d75fa727312b5e5a125fd319.jpg, https://salt.tikicdn.com/cache/w1200/ts/product/bf/8b/14/e757e64727d1cef3714adce260ede367.jpg","https://salt.tikicdn.com/cache/w300/ts/product/8d/5a/b3/1237c12e3f59ed6919c56f1b0703884e.jpg, https://salt.tikicdn.com/cache/w300/ts/product/88/03/b1/71d1ebdcf833846d790aef553f1ac94b.jpg, https://salt.tikicdn.com/cache/w300/ts/product/bf/8b/14/32d219c096afef1e794cd6e15a245311.jpg, https://salt.tikicdn.com/cache/w300/ts/product/88/03/b1/e1bf7e461d99b52ea3e9000c79240aaf.jpg, https://salt.tikicdn.com/cache/w300/ts/product/8d/5a/b3/800c29f4d75fa727312b5e5a125fd319.jpg, https://salt.tikicdn.com/cache/w300/ts/product/bf/8b/14/e757e64727d1cef3714adce260ede367.jpg","https://salt.tikicdn.com/cache/200x280/ts/product/8d/5a/b3/1237c12e3f59ed6919c56f1b0703884e.jpg, https://salt.tikicdn.com/cache/200x280/ts/product/88/03/b1/71d1ebdcf833846d790aef553f1ac94b.jpg, https://salt.tikicdn.com/cache/200x280/ts/product/bf/8b/14/32d219c096afef1e794cd6e15a245311.jpg, https://salt.tikicdn.com/cache/200x280/ts/product/88/03/b1/e1bf7e461d99b52ea3e9000c79240aaf.jpg, https://salt.tikicdn.com/cache/200x280/ts/product/8d/5a/b3/800c29f4d75fa727312b5e5a125fd319.jpg, https://salt.tikicdn.com/cache/200x280/ts/product/bf/8b/14/e757e64727d1cef3714adce260ede367.jpg","https://salt.tikicdn.com/cache/200x280/ts/product/8d/5a/b3/1237c12e3f59ed6919c56f1b0703884e.jpg, https://salt.tikicdn.com/cache/200x280/ts/product/88/03/b1/71d1ebdcf833846d790aef553f1ac94b.jpg, https://salt.tikicdn.com/cache/200x280/ts/product/bf/8b/14/32d219c096afef1e794cd6e15a245311.jpg, https://salt.tikicdn.com/cache/200x280/ts/product/88/03/b1/e1bf7e461d99b52ea3e9000c79240aaf.jpg, https://salt.tikicdn.com/cache/200x280/ts/product/8d/5a/b3/800c29f4d75fa727312b5e5a125fd319.jpg, https://salt.tikicdn.com/cache/200x280/ts/product/bf/8b/14/e757e64727d1cef3714adce260ede367.jpg",1000,0
277519606,Quà tặng - Bút bi xanh Bepharco,20000,"Bút Bi Xanh Bepharco – Viết Êm, Mực Đều, Thiết Kế Đẹp Màu mực xanh chuẩn nét: Bút bi Bepharco sử dụng mực xanh đậm, rõ ràng, phù hợp cho học tập, ghi chép và làm việc. Chiều dài 14.5 cm: Kích thước ...","Bút Bi Xanh Bepharco – Viết Êm, Mực Đều, Thiết Kế Đẹp Màu mực xanh chuẩn nét: Bút bi Bepharco sử dụng mực xanh đậm, rõ ràng, phù hợp cho học tập, ghi chép và làm việc. Chiều dài 14.5 cm: Kích thước vừa tay, dễ cầm nắm, tạo sự thoải mái khi viết trong thời gian dài. Thiết kế đẹp mắt, sang trọng: ️ Thân bút thanh mảnh, hiện đại, phù hợp với mọi đối tượng sử dụng. ️ Đầu bút trơn tru, giúp viết êm tay, không lem, không nhòe. ️ Chất liệu bền bỉ, nhẹ nhàng, dễ mang theo. Ứng dụng đa dạng: Bút bi xanh Bepharco thích hợp cho học sinh, sinh viên, nhân viên văn phòng, dùng trong các sự kiện, hội nghị hoặc làm quà tặng ý nghĩa. Giá sản phẩm trên Tiki đã bao gồm thuế theo luật hiện hành. Bên cạnh đó, tuỳ vào loại sản phẩm, hình thức và địa chỉ giao hàng mà có thể phát sinh thêm chi phí khác như phí vận chuyển, phụ phí hàng cồng kềnh, thuế nhập khẩu (đối với đơn hàng giao từ nước ngoài có giá trị trên 1 triệu đồng).....",0,0,"https://salt.tikicdn.com/ts/product/59/3f/9e/c9f9ab17568521ee4c313ccb8d8cbba0.png, https://salt.tikicdn.com/ts/product/98/f9/5e/af110cd05cdb03a69e68d243523f6b39.png, https://salt.tikicdn.com/ts/product/af/01/e5/1ec3d2c730336955fccae51cecc10d91.png","https://salt.tikicdn.com/cache/w1200/ts/product/59/3f/9e/c9f9ab17568521ee4c313ccb8d8cbba0.png, https://salt.tikicdn.com/cache/w1200/ts/product/98/f9/5e/af110cd05cdb03a69e68d243523f6b39.png, https://salt.tikicdn.com/cache/w1200/ts/product/af/01/e5/1ec3d2c730336955fccae51cecc10d91.png","https://salt.tikicdn.com/cache/w300/ts/product/59/3f/9e/c9f9ab17568521ee4c313ccb8d8cbba0.png, https://salt.tikicdn.com/cache/w300/ts/product/98/f9/5e/af110cd05cdb03a69e68d243523f6b39.png, https://salt.tikicdn.com/cache/w300/ts/product/af/01/e5/1ec3d2c730336955fccae51cecc10d91.png","https://salt.tikicdn.com/cache/200x280/ts/product/59/3f/9e/c9f9ab17568521ee4c313ccb8d8cbba0.png, https://salt.tikicdn.com/cache/200x280/ts/product/98/f9/5e/af110cd05cdb03a69e68d243523f6b39.png, https://salt.tikicdn.com/cache/200x280/ts/product/af/01/e5/1ec3d2c730336955fccae51cecc10d91.png","https://salt.tikicdn.com/cache/200x280/ts/product/59/3f/9e/c9f9ab17568521ee4c313ccb8d8cbba0.png, https://salt.tikicdn.com/cache/200x280/ts/product/98/f9/5e/af110cd05cdb03a69e68d243523f6b39.png, https://salt.tikicdn.com/cache/200x280/ts/product/af/01/e5/1ec3d2c730336955fccae51cecc10d91.png",1000,0
277509344,Bút bi cao cấp Lamy Al-star Denim bản 2025,980000,Thời trang với nhôm màu. Những người sử dụng LAMY AL-star đánh giá cao sự nhẹ nhàng đặc biệt của chất liệu mạnh mẽ nhưng bền bỉ của nó. Tay cầm trong suốt của bút giúp người dùng thấy được rõ ràng về...,"Thời trang với nhôm màu. Những người sử dụng LAMY AL-star đánh giá cao sự nhẹ nhàng đặc biệt của chất liệu mạnh mẽ nhưng bền bỉ của nó. Tay cầm trong suốt của bút giúp người dùng thấy được rõ ràng về hoạt động bên trong của bút. LAMY AL-star là sự kết hợp của các vật liệu tạo nên sự mạnh mẽ và sang trọng, loạt sản phẩm này mang đến nhiều bất ngờ với các phiên bản đặc biệt mang màu sắc hiện đại, hướng đến phong cách sống - truyền cảm hứng cho các nhà văn thể hiện cá tính đương đại của mình. Thiết kế bút giúp bạn có thể viết trong thời gian dài mà không bị mỏi. Vỏ bút cứng cáp được làm từ nhôm màu thời trang chất lượng cao với nhiều màu sắc cá tính để bạn chọn lựa và nắp được trang bị kẹp kim loại có tác động lò xo tự động được mạ crom. LAMY AL-star dùng đi kèm ruột bi LAMY M 16 M Kích thước: 139 x 13 x 13 mm Trọng lượng: 18 g Giá sản phẩm trên Tiki đã bao gồm thuế theo luật hiện hành. Bên cạnh đó, tuỳ vào loại sản phẩm, hình thức và địa chỉ giao hàng mà có thể phát sinh thêm chi phí khác như phí vận chuyển, phụ phí hàng cồng kềnh, thuế nhập khẩu (đối với đơn hàng giao từ nước ngoài có giá trị trên 1 triệu đồng).....",0,0,"https://salt.tikicdn.com/ts/product/b9/5e/f5/3bff2d79c36cd44af56f19e8c6e9fcfa.png, https://salt.tikicdn.com/ts/product/23/86/53/f15f7bf8bfffb41e37865d7c1e94f0c6.png, https://salt.tikicdn.com/ts/product/43/1e/0e/54b00276d3950d908b352863f0c0562d.png","https://salt.tikicdn.com/cache/w1200/ts/product/b9/5e/f5/3bff2d79c36cd44af56f19e8c6e9fcfa.png, https://salt.tikicdn.com/cache/w1200/ts/product/23/86/53/f15f7bf8bfffb41e37865d7c1e94f0c6.png, https://salt.tikicdn.com/cache/w1200/ts/product/43/1e/0e/54b00276d3950d908b352863f0c0562d.png","https://salt.tikicdn.com/cache/w300/ts/product/b9/5e/f5/3bff2d79c36cd44af56f19e8c6e9fcfa.png, https://salt.tikicdn.com/cache/w300/ts/product/23/86/53/f15f7bf8bfffb41e37865d7c1e94f0c6.png, https://salt.tikicdn.com/cache/w300/ts/product/43/1e/0e/54b00276d3950d908b352863f0c0562d.png","https://salt.tikicdn.com/cache/200x280/ts/product/b9/5e/f5/3bff2d79c36cd44af56f19e8c6e9fcfa.png, https://salt.tikicdn.com/cache/200x280/ts/product/23/86/53/f15f7bf8bfffb41e37865d7c1e94f0c6.png, https://salt.tikicdn.com/cache/200x280/ts/product/43/1e/0e/54b00276d3950d908b352863f0c0562d.png","https://salt.tikicdn.com/cache/200x280/ts/product/b9/5e/f5/3bff2d79c36cd44af56f19e8c6e9fcfa.png, https://salt.tikicdn.com/cache/200x280/ts/product/23/86/53/f15f7bf8bfffb41e37865d7c1e94f0c6.png, https://salt.tikicdn.com/cache/200x280/ts/product/43/1e/0e/54b00276d3950d908b352863f0c0562d.png",1000,0
