id,name,price,short_description,description,rating_average,review_count,image_base_url,image_large_url,image_medium_url,image_small_url,image_thumbnail_url,stock,quantity_sold
277427155,Sách kỹ năng sống tiếng Anh - Peace of Mind,538650,THÔNG TIN CƠ BẢN: Công ty phát hành: Transworld Publishers Ltd Nhà xuất bản: Transworld Publishers Ltd Tác giả: Thich Nhat Hanh  Kích thước: 210 x 134 x 12 (mm)  Số trang: 160  Năm xuất bản: 08/...,"THÔNG TIN CƠ BẢN: Công ty phát hành: Transworld Publishers Ltd Nhà xuất bản: Transworld Publishers Ltd Tác giả: Thich Nhat Hanh Kích thước: 210 x 134 x 12 (mm) Số trang: 160 Năm xuất bản: 08/05/2014 Loại bìa: Bìa mềm NỘI DUNG: Trong Peace of Mind, Thiền sư Thích Nhất Hạnh nhắc nhở chúng ta rằng việc hòa hợp thân và tâm là cách duy nhất để thực sự sống trọn vẹn trong từng khoảnh khắc. Kết hợp trí tuệ cổ xưa và tư duy hiện đại về chánh niệm, Peace of Mind là một cuốn sách tưởng chừng đơn giản nhưng lại mang đến nền tảng thực tiễn để hiểu rõ các nguyên tắc về sự nhận thức thân-tâm. Bằng cách giới thiệu những công cụ thiết yếu giúp duy trì sự an lành đích thực, cuốn sách này hỗ trợ bạn kiểm soát cuộc sống, giảm căng thẳng và tìm thấy sự bình yên cũng như hạnh phúc trong thế giới đầy bộn bề này. In Peace of Mind, Zen Master Thich Nhat Hanh reminds us that integrating body and mind is the only way to feel truly alive in each moment. Bringing together ancient wisdom and contemporary thinking on the subject of mindfulness, Peace of Mind is a deceptively simple book which provides a practical foundation for understanding the principles of mind/body awareness. As it introduces critical tools for sustaining authentic wellbeing, it helps us to take control of our lives, de-stress and find peace and happiness in this frantic world. Giá sản phẩm trên Tiki đã bao gồm thuế theo luật hiện hành. Bên cạnh đó, tuỳ vào loại sản phẩm, hình thức và địa chỉ giao hàng mà có thể phát sinh thêm chi phí khác như phí vận chuyển, phụ phí hàng cồng kềnh, thuế nhập khẩu (đối với đơn hàng giao từ nước ngoài có giá trị trên 1 triệu đồng).....",0,0,https://salt.tikicdn.com/ts/product/6f/ca/b4/f0964e8520762a4cc3638e017f37013b.jpg,https://salt.tikicdn.com/cache/w1200/ts/product/6f/ca/b4/f0964e8520762a4cc3638e017f37013b.jpg,https://salt.tikicdn.com/cache/w300/ts/product/6f/ca/b4/f0964e8520762a4cc3638e017f37013b.jpg,https://salt.tikicdn.com/cache/200x280/ts/product/6f/ca/b4/f0964e8520762a4cc3638e017f37013b.jpg,https://salt.tikicdn.com/cache/200x280/ts/product/6f/ca/b4/f0964e8520762a4cc3638e017f37013b.jpg,1000,0
195696971,Fake Accounts,162900,"    Fake Accounts   SHORTLISTED FOR THE BOLLINGER EVERYMAN WODEHOUSE PRIZE   A wry, provocative and very funny debut novel about identity, authenticity and the self in the age of the internet   ...","Fake Accounts SHORTLISTED FOR THE BOLLINGER EVERYMAN WODEHOUSE PRIZE A wry, provocative and very funny debut novel about identity, authenticity and the self in the age of the internet 'I loved it' Zadie Smith 'Brilliant, very funny' Guardian 'Prepare to feel very seen' I-D On the eve of Donald Trump's inauguration, a young woman snoops through her boyfriend's phone and makes a startling discovery: he's an anonymous Internet conspiracy theorist, and a popular one at that. Already fluent in Internet fakery, irony, and outrage, she's not exactly shocked by the revelation. But this is only the first in a series of bizarre twists that expose a world whose truths are shaped by online lies. Suddenly left with no reason to stay in New York - or be anywhere in particular - she flees to Berlin, and embarks on her own cycles of manipulation in the deceptive spaces of her daily life, from dating apps to expat social events, open-plan offices to bureaucratic waiting rooms. Narrated in a voice as seductive as it is subtly subversive, Fake Accounts is a wry, provocative and very funny debut novel about identity and authenticity in the age of the internet. Giá sản phẩm trên Tiki đã bao gồm thuế theo luật hiện hành. Bên cạnh đó, tuỳ vào loại sản phẩm, hình thức và địa chỉ giao hàng mà có thể phát sinh thêm chi phí khác như phí vận chuyển, phụ phí hàng cồng kềnh, thuế nhập khẩu (đối với đơn hàng giao từ nước ngoài có giá trị trên 1 triệu đồng).....",0,0,"https://salt.tikicdn.com/ts/product/b5/4b/e3/0aeff164859ca0d4965798601238f525.jpg, https://salt.tikicdn.com/ts/product/35/04/d1/cfc24da3107ade5ff5b57aeba254ddc6.jpg, https://salt.tikicdn.com/ts/product/03/ea/98/877c343b8d05954a5a3191847040ae66.jpg, https://salt.tikicdn.com/ts/product/d2/23/4c/487380046c37a1e718152bf3f69941cd.jpg, https://salt.tikicdn.com/ts/product/a0/43/f5/6edb23e0883c62fde612428bc5f98a03.jpg, https://salt.tikicdn.com/ts/product/8a/29/75/66e281705df590b03b2e9ff38e764977.jpg, https://salt.tikicdn.com/ts/product/63/5c/94/e7303bba44c75c80de10d9f53e1c74f0.jpg","https://salt.tikicdn.com/cache/w1200/ts/product/b5/4b/e3/0aeff164859ca0d4965798601238f525.jpg, https://salt.tikicdn.com/cache/w1200/ts/product/35/04/d1/cfc24da3107ade5ff5b57aeba254ddc6.jpg, https://salt.tikicdn.com/cache/w1200/ts/product/03/ea/98/877c343b8d05954a5a3191847040ae66.jpg, https://salt.tikicdn.com/cache/w1200/ts/product/d2/23/4c/487380046c37a1e718152bf3f69941cd.jpg, https://salt.tikicdn.com/cache/w1200/ts/product/a0/43/f5/6edb23e0883c62fde612428bc5f98a03.jpg, https://salt.tikicdn.com/cache/w1200/ts/product/8a/29/75/66e281705df590b03b2e9ff38e764977.jpg, https://salt.tikicdn.com/cache/w1200/ts/product/63/5c/94/e7303bba44c75c80de10d9f53e1c74f0.jpg","https://salt.tikicdn.com/cache/w300/ts/product/b5/4b/e3/0aeff164859ca0d4965798601238f525.jpg, https://salt.tikicdn.com/cache/w300/ts/product/35/04/d1/cfc24da3107ade5ff5b57aeba254ddc6.jpg, https://salt.tikicdn.com/cache/w300/ts/product/03/ea/98/877c343b8d05954a5a3191847040ae66.jpg, https://salt.tikicdn.com/cache/w300/ts/product/d2/23/4c/487380046c37a1e718152bf3f69941cd.jpg, https://salt.tikicdn.com/cache/w300/ts/product/a0/43/f5/6edb23e0883c62fde612428bc5f98a03.jpg, https://salt.tikicdn.com/cache/w300/ts/product/8a/29/75/66e281705df590b03b2e9ff38e764977.jpg, https://salt.tikicdn.com/cache/w300/ts/product/63/5c/94/e7303bba44c75c80de10d9f53e1c74f0.jpg","https://salt.tikicdn.com/cache/200x280/ts/product/b5/4b/e3/0aeff164859ca0d4965798601238f525.jpg, https://salt.tikicdn.com/cache/200x280/ts/product/35/04/d1/cfc24da3107ade5ff5b57aeba254ddc6.jpg, https://salt.tikicdn.com/cache/200x280/ts/product/03/ea/98/877c343b8d05954a5a3191847040ae66.jpg, https://salt.tikicdn.com/cache/200x280/ts/product/d2/23/4c/487380046c37a1e718152bf3f69941cd.jpg, https://salt.tikicdn.com/cache/200x280/ts/product/a0/43/f5/6edb23e0883c62fde612428bc5f98a03.jpg, https://salt.tikicdn.com/cache/200x280/ts/product/8a/29/75/66e281705df590b03b2e9ff38e764977.jpg, https://salt.tikicdn.com/cache/200x280/ts/product/63/5c/94/e7303bba44c75c80de10d9f53e1c74f0.jpg","https://salt.tikicdn.com/cache/200x280/ts/product/b5/4b/e3/0aeff164859ca0d4965798601238f525.jpg, https://salt.tikicdn.com/cache/200x280/ts/product/35/04/d1/cfc24da3107ade5ff5b57aeba254ddc6.jpg, https://salt.tikicdn.com/cache/200x280/ts/product/03/ea/98/877c343b8d05954a5a3191847040ae66.jpg, https://salt.tikicdn.com/cache/200x280/ts/product/d2/23/4c/487380046c37a1e718152bf3f69941cd.jpg, https://salt.tikicdn.com/cache/200x280/ts/product/a0/43/f5/6edb23e0883c62fde612428bc5f98a03.jpg, https://salt.tikicdn.com/cache/200x280/ts/product/8a/29/75/66e281705df590b03b2e9ff38e764977.jpg, https://salt.tikicdn.com/cache/200x280/ts/product/63/5c/94/e7303bba44c75c80de10d9f53e1c74f0.jpg",1000,0
65589699,The Wait: A Powerful Practice for Finding the Love of Your Life and the Life You Love,415800,"Wait (Hardcover)       Hardcover: 272 pages    Publisher: Howard Books (28 Jan. 2016)    Product Dimensions: 15.2 x 2.5 x 22.9 cm         <iframe style=""position: absolute; top: ...","Wait (Hardcover) Hardcover: 272 pages Publisher: Howard Books (28 Jan. 2016) Product Dimensions: 15.2 x 2.5 x 22.9 cm Hollywood power couple DeVon Franklin and Meagan Good candidly share about their courtship and marriage, and the key to their success waiting. President/CEO of Franklin Entertainment and former Sony Pictures executive DeVon Franklin and award-winning actress Meagan Good have learned sometimes all we can do is wait for the one to come into our lives. They spent years crossing paths but it wasn t until they were thrown together while working on the film Jumping the Broom that their storybook romance began. Faced with starting a new relationship and wanting to avoid potentially devastating relationship pitfalls, DeVon and Meagan chose to do something almost unheard of in today s society abstain from sex until they were married. In The Wait , DeVon and Meagan share the life-changing message that waiting rather than rushing a relationship can help you find the person you re meant to be with. Filled with candid his-and-hers accounts of the most important moments of their relationship, and practical advice on how waiting for everything from dating to sex can transform relationships, allowing you to find a deep connection based on patience, trust, and faith."" Giá sản phẩm trên Tiki đã bao gồm thuế theo luật hiện hành. Bên cạnh đó, tuỳ vào loại sản phẩm, hình thức và địa chỉ giao hàng mà có thể phát sinh thêm chi phí khác như phí vận chuyển, phụ phí hàng cồng kềnh, thuế nhập khẩu (đối với đơn hàng giao từ nước ngoài có giá trị trên 1 triệu đồng).....",0,0,"https://salt.tikicdn.com/ts/product/cb/dc/22/213e6fa9b2e97aa97d6a0471c7befbd7.jpg, https://salt.tikicdn.com/ts/product/e2/37/5e/fca36d1137a0adf3edcd3ebbe7954fcc.jpg, https://salt.tikicdn.com/ts/product/74/ca/5a/fb803be0d2ed2fdb874ba0314ca174cd.jpg, https://salt.tikicdn.com/ts/product/6a/14/ed/4a09df0e11fe95d787fb23e4f34f13fe.jpg, https://salt.tikicdn.com/ts/product/5d/fb/61/474b28f4a43b69fbf9f5a527a1f889fe.jpg, https://salt.tikicdn.com/ts/product/77/92/41/75a63f733e5e4088c767a3c4e3b51fa3.jpg, https://salt.tikicdn.com/ts/product/51/79/3b/1a4388e7d7bdd13484a8f0ac1826f4ae.jpg, https://salt.tikicdn.com/ts/product/f7/10/62/6304c72b815a8f44d15569b8cfef9f07.jpg, https://salt.tikicdn.com/ts/product/95/32/d9/35d66e8ae6da87724cfd0e77b46816f7.jpg, https://salt.tikicdn.com/ts/product/f3/4a/39/c8ab6f1443c63180abf719fed696e071.jpg, https://salt.tikicdn.com/ts/product/c0/aa/67/62dba0c707427a1643490ae3483a172d.jpg, https://salt.tikicdn.com/ts/product/24/3d/f6/6e891158683af3fd37216dffede37e49.jpg, https://salt.tikicdn.com/ts/product/ee/64/ea/7e4524c0658c341bb63a5ead17eec407.jpg, https://salt.tikicdn.com/ts/product/0d/3c/74/4703f316cc0d72216faf4b10d234f2f2.jpg, https://salt.tikicdn.com/ts/product/82/eb/2e/2777c74a475135ccd403e90ebb8c661b.jpg, https://salt.tikicdn.com/ts/product/e1/15/17/d38dd39d48fa2806da770ba20b9a20db.jpg, https://salt.tikicdn.com/ts/product/c6/04/2c/93ec4770d3260f99f98f40c81fbdb0d2.jpg","https://salt.tikicdn.com/cache/w1200/ts/product/cb/dc/22/213e6fa9b2e97aa97d6a0471c7befbd7.jpg, https://salt.tikicdn.com/cache/w1200/ts/product/e2/37/5e/fca36d1137a0adf3edcd3ebbe7954fcc.jpg, https://salt.tikicdn.com/cache/w1200/ts/product/74/ca/5a/fb803be0d2ed2fdb874ba0314ca174cd.jpg, https://salt.tikicdn.com/cache/w1200/ts/product/6a/14/ed/4a09df0e11fe95d787fb23e4f34f13fe.jpg, https://salt.tikicdn.com/cache/w1200/ts/product/5d/fb/61/474b28f4a43b69fbf9f5a527a1f889fe.jpg, https://salt.tikicdn.com/cache/w1200/ts/product/77/92/41/75a63f733e5e4088c767a3c4e3b51fa3.jpg, https://salt.tikicdn.com/cache/w1200/ts/product/51/79/3b/1a4388e7d7bdd13484a8f0ac1826f4ae.jpg, https://salt.tikicdn.com/cache/w1200/ts/product/f7/10/62/6304c72b815a8f44d15569b8cfef9f07.jpg, https://salt.tikicdn.com/cache/w1200/ts/product/95/32/d9/35d66e8ae6da87724cfd0e77b46816f7.jpg, https://salt.tikicdn.com/cache/w1200/ts/product/f3/4a/39/c8ab6f1443c63180abf719fed696e071.jpg, https://salt.tikicdn.com/cache/w1200/ts/product/c0/aa/67/62dba0c707427a1643490ae3483a172d.jpg, https://salt.tikicdn.com/cache/w1200/ts/product/24/3d/f6/6e891158683af3fd37216dffede37e49.jpg, https://salt.tikicdn.com/cache/w1200/ts/product/ee/64/ea/7e4524c0658c341bb63a5ead17eec407.jpg, https://salt.tikicdn.com/cache/w1200/ts/product/0d/3c/74/4703f316cc0d72216faf4b10d234f2f2.jpg, https://salt.tikicdn.com/cache/w1200/ts/product/82/eb/2e/2777c74a475135ccd403e90ebb8c661b.jpg, https://salt.tikicdn.com/cache/w1200/ts/product/e1/15/17/d38dd39d48fa2806da770ba20b9a20db.jpg, https://salt.tikicdn.com/cache/w1200/ts/product/c6/04/2c/93ec4770d3260f99f98f40c81fbdb0d2.jpg","https://salt.tikicdn.com/cache/w300/ts/product/cb/dc/22/213e6fa9b2e97aa97d6a0471c7befbd7.jpg, https://salt.tikicdn.com/cache/w300/ts/product/e2/37/5e/fca36d1137a0adf3edcd3ebbe7954fcc.jpg, https://salt.tikicdn.com/cache/w300/ts/product/74/ca/5a/fb803be0d2ed2fdb874ba0314ca174cd.jpg, https://salt.tikicdn.com/cache/w300/ts/product/6a/14/ed/4a09df0e11fe95d787fb23e4f34f13fe.jpg, https://salt.tikicdn.com/cache/w300/ts/product/5d/fb/61/474b28f4a43b69fbf9f5a527a1f889fe.jpg, https://salt.tikicdn.com/cache/w300/ts/product/77/92/41/75a63f733e5e4088c767a3c4e3b51fa3.jpg, https://salt.tikicdn.com/cache/w300/ts/product/51/79/3b/1a4388e7d7bdd13484a8f0ac1826f4ae.jpg, https://salt.tikicdn.com/cache/w300/ts/product/f7/10/62/6304c72b815a8f44d15569b8cfef9f07.jpg, https://salt.tikicdn.com/cache/w300/ts/product/95/32/d9/35d66e8ae6da87724cfd0e77b46816f7.jpg, https://salt.tikicdn.com/cache/w300/ts/product/f3/4a/39/c8ab6f1443c63180abf719fed696e071.jpg, https://salt.tikicdn.com/cache/w300/ts/product/c0/aa/67/62dba0c707427a1643490ae3483a172d.jpg, https://salt.tikicdn.com/cache/w300/ts/product/24/3d/f6/6e891158683af3fd37216dffede37e49.jpg, https://salt.tikicdn.com/cache/w300/ts/product/ee/64/ea/7e4524c0658c341bb63a5ead17eec407.jpg, https://salt.tikicdn.com/cache/w300/ts/product/0d/3c/74/4703f316cc0d72216faf4b10d234f2f2.jpg, https://salt.tikicdn.com/cache/w300/ts/product/82/eb/2e/2777c74a475135ccd403e90ebb8c661b.jpg, https://salt.tikicdn.com/cache/w300/ts/product/e1/15/17/d38dd39d48fa2806da770ba20b9a20db.jpg, https://salt.tikicdn.com/cache/w300/ts/product/c6/04/2c/93ec4770d3260f99f98f40c81fbdb0d2.jpg","https://salt.tikicdn.com/cache/200x280/ts/product/cb/dc/22/213e6fa9b2e97aa97d6a0471c7befbd7.jpg, https://salt.tikicdn.com/cache/200x280/ts/product/e2/37/5e/fca36d1137a0adf3edcd3ebbe7954fcc.jpg, https://salt.tikicdn.com/cache/200x280/ts/product/74/ca/5a/fb803be0d2ed2fdb874ba0314ca174cd.jpg, https://salt.tikicdn.com/cache/200x280/ts/product/6a/14/ed/4a09df0e11fe95d787fb23e4f34f13fe.jpg, https://salt.tikicdn.com/cache/200x280/ts/product/5d/fb/61/474b28f4a43b69fbf9f5a527a1f889fe.jpg, https://salt.tikicdn.com/cache/200x280/ts/product/77/92/41/75a63f733e5e4088c767a3c4e3b51fa3.jpg, https://salt.tikicdn.com/cache/200x280/ts/product/51/79/3b/1a4388e7d7bdd13484a8f0ac1826f4ae.jpg, https://salt.tikicdn.com/cache/200x280/ts/product/f7/10/62/6304c72b815a8f44d15569b8cfef9f07.jpg, https://salt.tikicdn.com/cache/200x280/ts/product/95/32/d9/35d66e8ae6da87724cfd0e77b46816f7.jpg, https://salt.tikicdn.com/cache/200x280/ts/product/f3/4a/39/c8ab6f1443c63180abf719fed696e071.jpg, https://salt.tikicdn.com/cache/200x280/ts/product/c0/aa/67/62dba0c707427a1643490ae3483a172d.jpg, https://salt.tikicdn.com/cache/200x280/ts/product/24/3d/f6/6e891158683af3fd37216dffede37e49.jpg, https://salt.tikicdn.com/cache/200x280/ts/product/ee/64/ea/7e4524c0658c341bb63a5ead17eec407.jpg, https://salt.tikicdn.com/cache/200x280/ts/product/0d/3c/74/4703f316cc0d72216faf4b10d234f2f2.jpg, https://salt.tikicdn.com/cache/200x280/ts/product/82/eb/2e/2777c74a475135ccd403e90ebb8c661b.jpg, https://salt.tikicdn.com/cache/200x280/ts/product/e1/15/17/d38dd39d48fa2806da770ba20b9a20db.jpg, https://salt.tikicdn.com/cache/200x280/ts/product/c6/04/2c/93ec4770d3260f99f98f40c81fbdb0d2.jpg","https://salt.tikicdn.com/cache/200x280/ts/product/cb/dc/22/213e6fa9b2e97aa97d6a0471c7befbd7.jpg, https://salt.tikicdn.com/cache/200x280/ts/product/e2/37/5e/fca36d1137a0adf3edcd3ebbe7954fcc.jpg, https://salt.tikicdn.com/cache/200x280/ts/product/74/ca/5a/fb803be0d2ed2fdb874ba0314ca174cd.jpg, https://salt.tikicdn.com/cache/200x280/ts/product/6a/14/ed/4a09df0e11fe95d787fb23e4f34f13fe.jpg, https://salt.tikicdn.com/cache/200x280/ts/product/5d/fb/61/474b28f4a43b69fbf9f5a527a1f889fe.jpg, https://salt.tikicdn.com/cache/200x280/ts/product/77/92/41/75a63f733e5e4088c767a3c4e3b51fa3.jpg, https://salt.tikicdn.com/cache/200x280/ts/product/51/79/3b/1a4388e7d7bdd13484a8f0ac1826f4ae.jpg, https://salt.tikicdn.com/cache/200x280/ts/product/f7/10/62/6304c72b815a8f44d15569b8cfef9f07.jpg, https://salt.tikicdn.com/cache/200x280/ts/product/95/32/d9/35d66e8ae6da87724cfd0e77b46816f7.jpg, https://salt.tikicdn.com/cache/200x280/ts/product/f3/4a/39/c8ab6f1443c63180abf719fed696e071.jpg, https://salt.tikicdn.com/cache/200x280/ts/product/c0/aa/67/62dba0c707427a1643490ae3483a172d.jpg, https://salt.tikicdn.com/cache/200x280/ts/product/24/3d/f6/6e891158683af3fd37216dffede37e49.jpg, https://salt.tikicdn.com/cache/200x280/ts/product/ee/64/ea/7e4524c0658c341bb63a5ead17eec407.jpg, https://salt.tikicdn.com/cache/200x280/ts/product/0d/3c/74/4703f316cc0d72216faf4b10d234f2f2.jpg, https://salt.tikicdn.com/cache/200x280/ts/product/82/eb/2e/2777c74a475135ccd403e90ebb8c661b.jpg, https://salt.tikicdn.com/cache/200x280/ts/product/e1/15/17/d38dd39d48fa2806da770ba20b9a20db.jpg, https://salt.tikicdn.com/cache/200x280/ts/product/c6/04/2c/93ec4770d3260f99f98f40c81fbdb0d2.jpg",1000,0
20659764,The 1-Minute Writer: 396 Microprompts to Spark Creativity and Recharge Your Writing,349000,"Are you a “would-be” writer? That is, someone who wants to write, but finds themselves too busy, too tired, or just uninspired. The 1-Minute Writer has the solution to all of those problems and shows ...","Are you a “would-be” writer? That is, someone who wants to write, but finds themselves too busy, too tired, or just uninspired. The 1-Minute Writer has the solution to all of those problems and shows you that you can start writing—and keep the creativity going—every day, no matter how little time you have. The 1-Minute Writer includes writing prompts you can complete while standing in line for coffee, riding the subway home after work, waiting for your kid at the dentist—and everywhere in between. Each prompt has four variations: a one-minute prompt, a five-minute prompt, a ten-minute prompt, and a twenty-minute prompt. You can choose prompts based on both the time you have available and the kind of writing you’d like to do. Watch the words pour out of you when you realize just how easy writing is when you tackle it in manageable chunks! There are a lot of writing books out there—maybe you’ve tried some before—but none quite like The 1-Minute Writer. Let these brief prompts encourage and empower you to become the writer you’ve always known you are! Giá sản phẩm trên Tiki đã bao gồm thuế theo luật hiện hành. Bên cạnh đó, tuỳ vào loại sản phẩm, hình thức và địa chỉ giao hàng mà có thể phát sinh thêm chi phí khác như phí vận chuyển, phụ phí hàng cồng kềnh, thuế nhập khẩu (đối với đơn hàng giao từ nước ngoài có giá trị trên 1 triệu đồng).....",0,0,https://salt.tikicdn.com/ts/product/58/23/eb/a0a1bc35b709f51429e21ef141de8fb7.jpg,https://salt.tikicdn.com/cache/w1200/ts/product/58/23/eb/a0a1bc35b709f51429e21ef141de8fb7.jpg,https://salt.tikicdn.com/cache/w300/ts/product/58/23/eb/a0a1bc35b709f51429e21ef141de8fb7.jpg,https://salt.tikicdn.com/cache/200x280/ts/product/58/23/eb/a0a1bc35b709f51429e21ef141de8fb7.jpg,https://salt.tikicdn.com/cache/200x280/ts/product/58/23/eb/a0a1bc35b709f51429e21ef141de8fb7.jpg,1000,0
