id,name,price,short_description,description,rating_average,review_count,image_base_url,image_large_url,image_medium_url,image_small_url,image_thumbnail_url,stock,quantity_sold
276555673,Set 12 Bút Highlight Đánh Dấu Milkliner 2 Đầu,79000,"Set 12 Bút Highlight Đánh Dấu Milkliner 2 ĐầuBút Highlight Milkliner là bút đánh dấu 2 đầu:Fine (0.5mm): dùng để gạch chân, tô viền hoặc vẽ Bold (3mm): đánh dấu, tô khoảng chữ hoặc đi nét dày, viế...","Set 12 Bút Highlight Đánh Dấu Milkliner 2 Đầu Bút Highlight Milkliner là bút đánh dấu 2 đầu: Fine (0.5mm): dùng để gạch chân, tô viền hoặc vẽ Bold (3mm): đánh dấu, tô khoảng chữ hoặc đi nét dày, viết tiêu đề Một vật dụng không thể thiếu Đầu bút hightlight ra mực đều, nét viết mềm mại, êm tay, độ đậm vừa phải. Màu lên chuẩn, không quá chói nhưng vẫn rõ nét. Đây chính là chiếc bút chắc chắn phải sở hữu cho tất cả những ai thường xuyên phải ghi chép như học sinh, sinh viên, nhân viên văn phòng hay những người làm nghệ thuật chuyên sáng tạo, người thường soạn thảo hoặc phải lên ý tưởng, take note công việc, Phù hợp với mọi nhu cầu sử dụng Một set bút highlight gồm bút với 12 màu khác nhau và đều là những tone màu dễ sử dụng, phổ biển khi dùng cho bullet journal, planner, đánh dấu tài liệu, trang trí scrapbook, Một set bút highlight sẽ giúp bạn tiết kiệm chi phí phải bỏ ra, chỉ cần mua một lần mà có thể sử dụng lâu dài và với nhiều mục đích khác nhau, đa năng và tiện lợi Bút highlight Milkliner lên màu chuẩn, không lem mực, không thấm ra mặt sau của giấy. Đồng thời ngòi bút 2 đầu đều viết rất êm, nét chữ mềm mại và ra mực đều, không bị tụ mực khi sử dụng. Đây chắc chắn là sản phẩm giúp bạn sắp xếp và ghi nhớ công việc của mình một cách hiệu quả, khoa học hơn rất nhiều. Giá sản phẩm trên Tiki đã bao gồm thuế theo luật hiện hành. Bên cạnh đó, tuỳ vào loại sản phẩm, hình thức và địa chỉ giao hàng mà có thể phát sinh thêm chi phí khác như phí vận chuyển, phụ phí hàng cồng kềnh, thuế nhập khẩu (đối với đơn hàng giao từ nước ngoài có giá trị trên 1 triệu đồng).....",0,0,"https://salt.tikicdn.com/ts/product/11/d0/95/9049d22dc8a02f4e92e0db778e98c0a9.jpg, https://salt.tikicdn.com/ts/product/51/52/64/a530eeb8dfe25a4208ad29d199d83f22.jpg, https://salt.tikicdn.com/ts/product/11/d3/50/0312c57b95a678262263101e0a55c02c.jpg, https://salt.tikicdn.com/ts/product/a8/5b/41/5f3340c954c218b721c8884a6daac040.jpg, https://salt.tikicdn.com/ts/product/d2/5e/be/a43a277cf1ee07a393b08352a3960aaa.jpg","https://salt.tikicdn.com/cache/w1200/ts/product/11/d0/95/9049d22dc8a02f4e92e0db778e98c0a9.jpg, https://salt.tikicdn.com/cache/w1200/ts/product/51/52/64/a530eeb8dfe25a4208ad29d199d83f22.jpg, https://salt.tikicdn.com/cache/w1200/ts/product/11/d3/50/0312c57b95a678262263101e0a55c02c.jpg, https://salt.tikicdn.com/cache/w1200/ts/product/a8/5b/41/5f3340c954c218b721c8884a6daac040.jpg, https://salt.tikicdn.com/cache/w1200/ts/product/d2/5e/be/a43a277cf1ee07a393b08352a3960aaa.jpg","https://salt.tikicdn.com/cache/w300/ts/product/11/d0/95/9049d22dc8a02f4e92e0db778e98c0a9.jpg, https://salt.tikicdn.com/cache/w300/ts/product/51/52/64/a530eeb8dfe25a4208ad29d199d83f22.jpg, https://salt.tikicdn.com/cache/w300/ts/product/11/d3/50/0312c57b95a678262263101e0a55c02c.jpg, https://salt.tikicdn.com/cache/w300/ts/product/a8/5b/41/5f3340c954c218b721c8884a6daac040.jpg, https://salt.tikicdn.com/cache/w300/ts/product/d2/5e/be/a43a277cf1ee07a393b08352a3960aaa.jpg","https://salt.tikicdn.com/cache/200x280/ts/product/11/d0/95/9049d22dc8a02f4e92e0db778e98c0a9.jpg, https://salt.tikicdn.com/cache/200x280/ts/product/51/52/64/a530eeb8dfe25a4208ad29d199d83f22.jpg, https://salt.tikicdn.com/cache/200x280/ts/product/11/d3/50/0312c57b95a678262263101e0a55c02c.jpg, https://salt.tikicdn.com/cache/200x280/ts/product/a8/5b/41/5f3340c954c218b721c8884a6daac040.jpg, https://salt.tikicdn.com/cache/200x280/ts/product/d2/5e/be/a43a277cf1ee07a393b08352a3960aaa.jpg","https://salt.tikicdn.com/cache/200x280/ts/product/11/d0/95/9049d22dc8a02f4e92e0db778e98c0a9.jpg, https://salt.tikicdn.com/cache/200x280/ts/product/51/52/64/a530eeb8dfe25a4208ad29d199d83f22.jpg, https://salt.tikicdn.com/cache/200x280/ts/product/11/d3/50/0312c57b95a678262263101e0a55c02c.jpg, https://salt.tikicdn.com/cache/200x280/ts/product/a8/5b/41/5f3340c954c218b721c8884a6daac040.jpg, https://salt.tikicdn.com/cache/200x280/ts/product/d2/5e/be/a43a277cf1ee07a393b08352a3960aaa.jpg",1000,0
276477035,"Bút Nhớ Dòng Deli, Bút Highlight",8500,"TÍNH NĂNG SẢN PHẨM:️Màu mực tươi sáng️Sử dụng màu mực in tươi sáng, sắc màu rực rỡ️Không gây độc gây hại, sử dụng an toàn️Chất liệu tốt️An toàn, không độc hạiTHÔNG TIN SẢN PHẨM:Tên sản phẩm: Bút nhớ ...","TÍNH NĂNG SẢN PHẨM: ️Màu mực tươi sáng ️Sử dụng màu mực in tươi sáng, sắc màu rực rỡ ️Không gây độc gây hại, sử dụng an toàn ️Chất liệu tốt ️An toàn, không độc hại THÔNG TIN SẢN PHẨM: Tên sản phẩm: Bút nhớ dòng Deli Mã sản phẩm: S625/ ES621S Quy cách đóng gói: 1 chiếc Giá sản phẩm trên Tiki đã bao gồm thuế theo luật hiện hành. Bên cạnh đó, tuỳ vào loại sản phẩm, hình thức và địa chỉ giao hàng mà có thể phát sinh thêm chi phí khác như phí vận chuyển, phụ phí hàng cồng kềnh, thuế nhập khẩu (đối với đơn hàng giao từ nước ngoài có giá trị trên 1 triệu đồng).....",0,0,"https://salt.tikicdn.com/ts/product/d1/6b/da/d47d86a8acd9557963a442c7ec125e69.png, https://salt.tikicdn.com/ts/product/ed/e4/68/13a7e9ac0374e79706723982605f45f4.png, https://salt.tikicdn.com/ts/product/a7/6c/27/64f15329aec82777e5146df34997fc45.png, https://salt.tikicdn.com/ts/product/5b/ca/58/2dd811c48d920e7d2ac2bfc62d0e9c34.png, https://salt.tikicdn.com/ts/product/0a/11/5a/2d9c8177ba9062166a6a5d836c965c0c.png, https://salt.tikicdn.com/ts/product/7a/32/b5/afdab82d2963238e9d960714e134db01.png, https://salt.tikicdn.com/ts/product/d6/eb/25/2f359af2a00f404f3ccdab36b42f286c.png, https://salt.tikicdn.com/ts/product/c2/c4/46/654a8a025c198a94fe5002919bc28fa3.png","https://salt.tikicdn.com/cache/w1200/ts/product/d1/6b/da/d47d86a8acd9557963a442c7ec125e69.png, https://salt.tikicdn.com/cache/w1200/ts/product/ed/e4/68/13a7e9ac0374e79706723982605f45f4.png, https://salt.tikicdn.com/cache/w1200/ts/product/a7/6c/27/64f15329aec82777e5146df34997fc45.png, https://salt.tikicdn.com/cache/w1200/ts/product/5b/ca/58/2dd811c48d920e7d2ac2bfc62d0e9c34.png, https://salt.tikicdn.com/cache/w1200/ts/product/0a/11/5a/2d9c8177ba9062166a6a5d836c965c0c.png, https://salt.tikicdn.com/cache/w1200/ts/product/7a/32/b5/afdab82d2963238e9d960714e134db01.png, https://salt.tikicdn.com/cache/w1200/ts/product/d6/eb/25/2f359af2a00f404f3ccdab36b42f286c.png, https://salt.tikicdn.com/cache/w1200/ts/product/c2/c4/46/654a8a025c198a94fe5002919bc28fa3.png","https://salt.tikicdn.com/cache/w300/ts/product/d1/6b/da/d47d86a8acd9557963a442c7ec125e69.png, https://salt.tikicdn.com/cache/w300/ts/product/ed/e4/68/13a7e9ac0374e79706723982605f45f4.png, https://salt.tikicdn.com/cache/w300/ts/product/a7/6c/27/64f15329aec82777e5146df34997fc45.png, https://salt.tikicdn.com/cache/w300/ts/product/5b/ca/58/2dd811c48d920e7d2ac2bfc62d0e9c34.png, https://salt.tikicdn.com/cache/w300/ts/product/0a/11/5a/2d9c8177ba9062166a6a5d836c965c0c.png, https://salt.tikicdn.com/cache/w300/ts/product/7a/32/b5/afdab82d2963238e9d960714e134db01.png, https://salt.tikicdn.com/cache/w300/ts/product/d6/eb/25/2f359af2a00f404f3ccdab36b42f286c.png, https://salt.tikicdn.com/cache/w300/ts/product/c2/c4/46/654a8a025c198a94fe5002919bc28fa3.png","https://salt.tikicdn.com/cache/200x280/ts/product/d1/6b/da/d47d86a8acd9557963a442c7ec125e69.png, https://salt.tikicdn.com/cache/200x280/ts/product/ed/e4/68/13a7e9ac0374e79706723982605f45f4.png, https://salt.tikicdn.com/cache/200x280/ts/product/a7/6c/27/64f15329aec82777e5146df34997fc45.png, https://salt.tikicdn.com/cache/200x280/ts/product/5b/ca/58/2dd811c48d920e7d2ac2bfc62d0e9c34.png, https://salt.tikicdn.com/cache/200x280/ts/product/0a/11/5a/2d9c8177ba9062166a6a5d836c965c0c.png, https://salt.tikicdn.com/cache/200x280/ts/product/7a/32/b5/afdab82d2963238e9d960714e134db01.png, https://salt.tikicdn.com/cache/200x280/ts/product/d6/eb/25/2f359af2a00f404f3ccdab36b42f286c.png, https://salt.tikicdn.com/cache/200x280/ts/product/c2/c4/46/654a8a025c198a94fe5002919bc28fa3.png","https://salt.tikicdn.com/cache/200x280/ts/product/d1/6b/da/d47d86a8acd9557963a442c7ec125e69.png, https://salt.tikicdn.com/cache/200x280/ts/product/ed/e4/68/13a7e9ac0374e79706723982605f45f4.png, https://salt.tikicdn.com/cache/200x280/ts/product/a7/6c/27/64f15329aec82777e5146df34997fc45.png, https://salt.tikicdn.com/cache/200x280/ts/product/5b/ca/58/2dd811c48d920e7d2ac2bfc62d0e9c34.png, https://salt.tikicdn.com/cache/200x280/ts/product/0a/11/5a/2d9c8177ba9062166a6a5d836c965c0c.png, https://salt.tikicdn.com/cache/200x280/ts/product/7a/32/b5/afdab82d2963238e9d960714e134db01.png, https://salt.tikicdn.com/cache/200x280/ts/product/d6/eb/25/2f359af2a00f404f3ccdab36b42f286c.png, https://salt.tikicdn.com/cache/200x280/ts/product/c2/c4/46/654a8a025c198a94fe5002919bc28fa3.png",1000,0
275749164,Bút dạ quang màu pastel - Eco Style Highlighter Thiên Long HL-015/ECO - Không mất nét khi photocopy,14000,Thông số kĩ thuật :Tên danh mục Bút dạ quangThương hiệu Thiên LongBề rộng nét viết 4.0mmChất liệu TEXa G2341 (Certified Biobased USDA - Mỹ) và Vỏ trấu phế phẩm nông nghiệp.Đóng gói 01...,"Thông số kĩ thuật : Tên danh mục Bút dạ quang Thương hiệu Thiên Long Bề rộng nét viết 4.0mm Chất liệu TEXa G2341 (Certified Biobased USDA - Mỹ) và Vỏ trấu phế phẩm nông nghiệp. Đóng gói 01 cây/ kiện. Trọng lượng 25 gram Kích thước bút 108.3 x 21.2 x 14.8 mm Tiêu chuẩn TCCS 016:2011/TL-BDQ Khuyến cáo Tránh nguồn nhiệt, hóa chất. Không thích hợp cho trẻ dưới 3 tuổi. Đặc tính sản phẩm: Bút dùng để đánh dấu trên giấy tập học sinh, các loại sách hoặc giấy photocopy mà không làm mất nét chữ bên dưới. Giá sản phẩm trên Tiki đã bao gồm thuế theo luật hiện hành. Bên cạnh đó, tuỳ vào loại sản phẩm, hình thức và địa chỉ giao hàng mà có thể phát sinh thêm chi phí khác như phí vận chuyển, phụ phí hàng cồng kềnh, thuế nhập khẩu (đối với đơn hàng giao từ nước ngoài có giá trị trên 1 triệu đồng).....",0,0,"https://salt.tikicdn.com/ts/product/71/28/b2/990b33f5220d9e0adfe378fc7afe49f0.jpg, https://salt.tikicdn.com/ts/product/ca/1d/f1/d45bfac03f51d56134854608a6d0cde1.jpg, https://salt.tikicdn.com/ts/product/64/f5/ae/0c5600018a7a87323ee3009c6e731a09.jpg, https://salt.tikicdn.com/ts/product/e1/88/34/386b5d8909362bea58dadbf51e5cbe84.jpg, https://salt.tikicdn.com/ts/product/67/b3/fa/20f10a330753864244cd0b06dbf079b6.jpg, https://salt.tikicdn.com/ts/product/8d/74/20/dfa9c6a8b86fd87670df3e778c387acd.jpg","https://salt.tikicdn.com/cache/w1200/ts/product/71/28/b2/990b33f5220d9e0adfe378fc7afe49f0.jpg, https://salt.tikicdn.com/cache/w1200/ts/product/ca/1d/f1/d45bfac03f51d56134854608a6d0cde1.jpg, https://salt.tikicdn.com/cache/w1200/ts/product/64/f5/ae/0c5600018a7a87323ee3009c6e731a09.jpg, https://salt.tikicdn.com/cache/w1200/ts/product/e1/88/34/386b5d8909362bea58dadbf51e5cbe84.jpg, https://salt.tikicdn.com/cache/w1200/ts/product/67/b3/fa/20f10a330753864244cd0b06dbf079b6.jpg, https://salt.tikicdn.com/cache/w1200/ts/product/8d/74/20/dfa9c6a8b86fd87670df3e778c387acd.jpg","https://salt.tikicdn.com/cache/w300/ts/product/71/28/b2/990b33f5220d9e0adfe378fc7afe49f0.jpg, https://salt.tikicdn.com/cache/w300/ts/product/ca/1d/f1/d45bfac03f51d56134854608a6d0cde1.jpg, https://salt.tikicdn.com/cache/w300/ts/product/64/f5/ae/0c5600018a7a87323ee3009c6e731a09.jpg, https://salt.tikicdn.com/cache/w300/ts/product/e1/88/34/386b5d8909362bea58dadbf51e5cbe84.jpg, https://salt.tikicdn.com/cache/w300/ts/product/67/b3/fa/20f10a330753864244cd0b06dbf079b6.jpg, https://salt.tikicdn.com/cache/w300/ts/product/8d/74/20/dfa9c6a8b86fd87670df3e778c387acd.jpg","https://salt.tikicdn.com/cache/200x280/ts/product/71/28/b2/990b33f5220d9e0adfe378fc7afe49f0.jpg, https://salt.tikicdn.com/cache/200x280/ts/product/ca/1d/f1/d45bfac03f51d56134854608a6d0cde1.jpg, https://salt.tikicdn.com/cache/200x280/ts/product/64/f5/ae/0c5600018a7a87323ee3009c6e731a09.jpg, https://salt.tikicdn.com/cache/200x280/ts/product/e1/88/34/386b5d8909362bea58dadbf51e5cbe84.jpg, https://salt.tikicdn.com/cache/200x280/ts/product/67/b3/fa/20f10a330753864244cd0b06dbf079b6.jpg, https://salt.tikicdn.com/cache/200x280/ts/product/8d/74/20/dfa9c6a8b86fd87670df3e778c387acd.jpg","https://salt.tikicdn.com/cache/200x280/ts/product/71/28/b2/990b33f5220d9e0adfe378fc7afe49f0.jpg, https://salt.tikicdn.com/cache/200x280/ts/product/ca/1d/f1/d45bfac03f51d56134854608a6d0cde1.jpg, https://salt.tikicdn.com/cache/200x280/ts/product/64/f5/ae/0c5600018a7a87323ee3009c6e731a09.jpg, https://salt.tikicdn.com/cache/200x280/ts/product/e1/88/34/386b5d8909362bea58dadbf51e5cbe84.jpg, https://salt.tikicdn.com/cache/200x280/ts/product/67/b3/fa/20f10a330753864244cd0b06dbf079b6.jpg, https://salt.tikicdn.com/cache/200x280/ts/product/8d/74/20/dfa9c6a8b86fd87670df3e778c387acd.jpg",1000,0
273684254,Set 4 bút highlight dạ quang đánh dấu dòng ombre,40000,Bút Highlight/ dạ quang màu là sản phẩm vô cùng tiện lợi và không thể thiếu trong học tập và làm việc.Bút highlight dạ quang đánh dấu không chỉ được sử dụng để làm nổi bật những dòng/chữ trong khối v...,"Bút Highlight/ dạ quang màu là sản phẩm vô cùng tiện lợi và không thể thiếu trong học tập và làm việc. Bút highlight dạ quang đánh dấu không chỉ được sử dụng để làm nổi bật những dòng/chữ trong khối văn bản mà còn được sử dụng để viết tiêu đề, tô màu cũng như trang trí văn bản. ------------------------------------------------------------------------------------------ ƯU ĐIỂM: Ngòi bút tiện lợi, màu sắc dịu nhẹ và dễ sử dụng, mực mau khô và không mùi Kích thước (hộp) 12.6x5.6 Nét bút 1-4mm Trọng lượng (hộp) 100GR Màu Sắc 4 màu/ bộ Ngòi viết: Có thể dùng góc xiên và nhọn đáp ứng nhu cầu sử dụng khác nhau. Nét 4mm dùng để làm nổi bật dòng cần thiết nhanh chóng trong khối văn bản. Nét 1mm nhỏ phù hợp để gạch chân các từ riêng lẻ Màu sắc đa dạng Tone màu pastel dễ sử dụng và dịu nhẹ cho mắt. Thân bút bằng nhựa được thiết kế để cầm thoải mái, tránh mỏi tay khi sử dụng lâu. Giá sản phẩm trên Tiki đã bao gồm thuế theo luật hiện hành. Bên cạnh đó, tuỳ vào loại sản phẩm, hình thức và địa chỉ giao hàng mà có thể phát sinh thêm chi phí khác như phí vận chuyển, phụ phí hàng cồng kềnh, thuế nhập khẩu (đối với đơn hàng giao từ nước ngoài có giá trị trên 1 triệu đồng).....",5,1,"https://salt.tikicdn.com/ts/product/ff/e3/84/3ec09f356bbffe8f3275f5719d0afed8.jpg, https://salt.tikicdn.com/ts/product/a9/24/33/cd9916004bc189debde658e0063a6728.jpg, https://salt.tikicdn.com/ts/product/df/45/fd/a11d2601838d6f9171605539d6464f20.jpg, https://salt.tikicdn.com/ts/product/9c/96/a5/583666baddb799a048f9668df2ac2895.jpg, https://salt.tikicdn.com/ts/product/73/92/38/74d59c7fc8813a356d31fea38439221c.jpg, https://salt.tikicdn.com/ts/product/48/d9/c6/eafd82f26290217c8d1ddb901c613102.jpg, https://salt.tikicdn.com/ts/product/dc/8b/fd/805e9d492ef064ba39b23fe80d44c1f9.jpg","https://salt.tikicdn.com/cache/w1200/ts/product/ff/e3/84/3ec09f356bbffe8f3275f5719d0afed8.jpg, https://salt.tikicdn.com/cache/w1200/ts/product/a9/24/33/cd9916004bc189debde658e0063a6728.jpg, https://salt.tikicdn.com/cache/w1200/ts/product/df/45/fd/a11d2601838d6f9171605539d6464f20.jpg, https://salt.tikicdn.com/cache/w1200/ts/product/9c/96/a5/583666baddb799a048f9668df2ac2895.jpg, https://salt.tikicdn.com/cache/w1200/ts/product/73/92/38/74d59c7fc8813a356d31fea38439221c.jpg, https://salt.tikicdn.com/cache/w1200/ts/product/48/d9/c6/eafd82f26290217c8d1ddb901c613102.jpg, https://salt.tikicdn.com/cache/w1200/ts/product/dc/8b/fd/805e9d492ef064ba39b23fe80d44c1f9.jpg","https://salt.tikicdn.com/cache/w300/ts/product/ff/e3/84/3ec09f356bbffe8f3275f5719d0afed8.jpg, https://salt.tikicdn.com/cache/w300/ts/product/a9/24/33/cd9916004bc189debde658e0063a6728.jpg, https://salt.tikicdn.com/cache/w300/ts/product/df/45/fd/a11d2601838d6f9171605539d6464f20.jpg, https://salt.tikicdn.com/cache/w300/ts/product/9c/96/a5/583666baddb799a048f9668df2ac2895.jpg, https://salt.tikicdn.com/cache/w300/ts/product/73/92/38/74d59c7fc8813a356d31fea38439221c.jpg, https://salt.tikicdn.com/cache/w300/ts/product/48/d9/c6/eafd82f26290217c8d1ddb901c613102.jpg, https://salt.tikicdn.com/cache/w300/ts/product/dc/8b/fd/805e9d492ef064ba39b23fe80d44c1f9.jpg","https://salt.tikicdn.com/cache/200x280/ts/product/ff/e3/84/3ec09f356bbffe8f3275f5719d0afed8.jpg, https://salt.tikicdn.com/cache/200x280/ts/product/a9/24/33/cd9916004bc189debde658e0063a6728.jpg, https://salt.tikicdn.com/cache/200x280/ts/product/df/45/fd/a11d2601838d6f9171605539d6464f20.jpg, https://salt.tikicdn.com/cache/200x280/ts/product/9c/96/a5/583666baddb799a048f9668df2ac2895.jpg, https://salt.tikicdn.com/cache/200x280/ts/product/73/92/38/74d59c7fc8813a356d31fea38439221c.jpg, https://salt.tikicdn.com/cache/200x280/ts/product/48/d9/c6/eafd82f26290217c8d1ddb901c613102.jpg, https://salt.tikicdn.com/cache/200x280/ts/product/dc/8b/fd/805e9d492ef064ba39b23fe80d44c1f9.jpg","https://salt.tikicdn.com/cache/200x280/ts/product/ff/e3/84/3ec09f356bbffe8f3275f5719d0afed8.jpg, https://salt.tikicdn.com/cache/200x280/ts/product/a9/24/33/cd9916004bc189debde658e0063a6728.jpg, https://salt.tikicdn.com/cache/200x280/ts/product/df/45/fd/a11d2601838d6f9171605539d6464f20.jpg, https://salt.tikicdn.com/cache/200x280/ts/product/9c/96/a5/583666baddb799a048f9668df2ac2895.jpg, https://salt.tikicdn.com/cache/200x280/ts/product/73/92/38/74d59c7fc8813a356d31fea38439221c.jpg, https://salt.tikicdn.com/cache/200x280/ts/product/48/d9/c6/eafd82f26290217c8d1ddb901c613102.jpg, https://salt.tikicdn.com/cache/200x280/ts/product/dc/8b/fd/805e9d492ef064ba39b23fe80d44c1f9.jpg",1000,1
273681447,Set 6 bút highlight dạ quang đánh dấu dòng Pastel 2 đầu ,45000,CHI TIẾT SẢN PHẨM:Set 6 bút Highlight dạ quang màu pastel Fruorescent Pen là sản phẩm vô cùng tiện lợi và không thể thiếu trong học tập và làm việc.Bút highlight dạ quang đánh dấu không chỉ được sử ...,"CHI TIẾT SẢN PHẨM: Set 6 bút Highlight dạ quang màu pastel Fruorescent Pen là sản phẩm vô cùng tiện lợi và không thể thiếu trong học tập và làm việc. Bút highlight dạ quang đánh dấu không chỉ được sử dụng để làm nổi bật những dòng/chữ trong khối văn bản mà còn được sử dụng để viết tiêu đề, tô màu cũng như trang trí văn bản. ƯU ĐIỂM: 2 đầu ngòi tiện lợi, màu sắc dịu nhẹ và dễ sử dụng, mực mau khô và không mùi Kích thước (hộp) 14x10 cm / 16x10cm / 15x11 cm Ngòi bút 5mm & 2mm Trọng lượng (hộp) 150GR Màu Sắc 6 màu Xuất xứ Trung Quốc Ngòi viết: Có 2 đầu bút (5mm & 2mm) xiên và nhọn đáp ứng nhu cầu sử dụng khác nhau. Nét 5mm dùng để làm nổi bật dòng cần thiết nhanh chóng trong khối văn bản. Nét 2mm nhỏ phù hợp để gạch chân các từ riêng lẻ Màu sắc đa dạng gồm 6 màu:  Hồng, Tím, Cam, Vàng, Xanh lá và Xanh da trời Tone màu pastel dễ sử dụng và dịu nhẹ cho mắt. Thân bút bằng nhựa được thiết kế để cầm thoải mái, tránh mỏi tay khi sử dụng lâu. Nắp bút chắc chắn, 2 nắp có thể gắn lên nhau dễ dàng trong quá trình sử dụng. Giá sản phẩm trên Tiki đã bao gồm thuế theo luật hiện hành. Bên cạnh đó, tuỳ vào loại sản phẩm, hình thức và địa chỉ giao hàng mà có thể phát sinh thêm chi phí khác như phí vận chuyển, phụ phí hàng cồng kềnh, thuế nhập khẩu (đối với đơn hàng giao từ nước ngoài có giá trị trên 1 triệu đồng).....",4.5,2,"https://salt.tikicdn.com/ts/product/4f/ba/f7/5afa1a06a6c23706e7876fc4b1aac432.jpg, https://salt.tikicdn.com/ts/product/d6/91/58/0daed15a046999f4aa8097e6bcbe4b8f.jpg, https://salt.tikicdn.com/ts/product/4e/b4/60/881cf7d2e8ee10da5b0f978c81fba70b.jpg, https://salt.tikicdn.com/ts/product/c5/fd/11/637e29765e3430129cc77c2ec40c16de.jpg, https://salt.tikicdn.com/ts/product/b9/3c/48/1e6ced0cfe5909c3c99cb0c1d6e1b928.jpg, https://salt.tikicdn.com/ts/product/c7/f8/c1/e193e39f09855360f8c566badfe351f0.jpg, https://salt.tikicdn.com/ts/product/72/47/cd/cdb19e19cf8dc1f32b58940449a919eb.jpg","https://salt.tikicdn.com/cache/w1200/ts/product/4f/ba/f7/5afa1a06a6c23706e7876fc4b1aac432.jpg, https://salt.tikicdn.com/cache/w1200/ts/product/d6/91/58/0daed15a046999f4aa8097e6bcbe4b8f.jpg, https://salt.tikicdn.com/cache/w1200/ts/product/4e/b4/60/881cf7d2e8ee10da5b0f978c81fba70b.jpg, https://salt.tikicdn.com/cache/w1200/ts/product/c5/fd/11/637e29765e3430129cc77c2ec40c16de.jpg, https://salt.tikicdn.com/cache/w1200/ts/product/b9/3c/48/1e6ced0cfe5909c3c99cb0c1d6e1b928.jpg, https://salt.tikicdn.com/cache/w1200/ts/product/c7/f8/c1/e193e39f09855360f8c566badfe351f0.jpg, https://salt.tikicdn.com/cache/w1200/ts/product/72/47/cd/cdb19e19cf8dc1f32b58940449a919eb.jpg","https://salt.tikicdn.com/cache/w300/ts/product/4f/ba/f7/5afa1a06a6c23706e7876fc4b1aac432.jpg, https://salt.tikicdn.com/cache/w300/ts/product/d6/91/58/0daed15a046999f4aa8097e6bcbe4b8f.jpg, https://salt.tikicdn.com/cache/w300/ts/product/4e/b4/60/881cf7d2e8ee10da5b0f978c81fba70b.jpg, https://salt.tikicdn.com/cache/w300/ts/product/c5/fd/11/637e29765e3430129cc77c2ec40c16de.jpg, https://salt.tikicdn.com/cache/w300/ts/product/b9/3c/48/1e6ced0cfe5909c3c99cb0c1d6e1b928.jpg, https://salt.tikicdn.com/cache/w300/ts/product/c7/f8/c1/e193e39f09855360f8c566badfe351f0.jpg, https://salt.tikicdn.com/cache/w300/ts/product/72/47/cd/cdb19e19cf8dc1f32b58940449a919eb.jpg","https://salt.tikicdn.com/cache/200x280/ts/product/4f/ba/f7/5afa1a06a6c23706e7876fc4b1aac432.jpg, https://salt.tikicdn.com/cache/200x280/ts/product/d6/91/58/0daed15a046999f4aa8097e6bcbe4b8f.jpg, https://salt.tikicdn.com/cache/200x280/ts/product/4e/b4/60/881cf7d2e8ee10da5b0f978c81fba70b.jpg, https://salt.tikicdn.com/cache/200x280/ts/product/c5/fd/11/637e29765e3430129cc77c2ec40c16de.jpg, https://salt.tikicdn.com/cache/200x280/ts/product/b9/3c/48/1e6ced0cfe5909c3c99cb0c1d6e1b928.jpg, https://salt.tikicdn.com/cache/200x280/ts/product/c7/f8/c1/e193e39f09855360f8c566badfe351f0.jpg, https://salt.tikicdn.com/cache/200x280/ts/product/72/47/cd/cdb19e19cf8dc1f32b58940449a919eb.jpg","https://salt.tikicdn.com/cache/200x280/ts/product/4f/ba/f7/5afa1a06a6c23706e7876fc4b1aac432.jpg, https://salt.tikicdn.com/cache/200x280/ts/product/d6/91/58/0daed15a046999f4aa8097e6bcbe4b8f.jpg, https://salt.tikicdn.com/cache/200x280/ts/product/4e/b4/60/881cf7d2e8ee10da5b0f978c81fba70b.jpg, https://salt.tikicdn.com/cache/200x280/ts/product/c5/fd/11/637e29765e3430129cc77c2ec40c16de.jpg, https://salt.tikicdn.com/cache/200x280/ts/product/b9/3c/48/1e6ced0cfe5909c3c99cb0c1d6e1b928.jpg, https://salt.tikicdn.com/cache/200x280/ts/product/c7/f8/c1/e193e39f09855360f8c566badfe351f0.jpg, https://salt.tikicdn.com/cache/200x280/ts/product/72/47/cd/cdb19e19cf8dc1f32b58940449a919eb.jpg",1000,2
