id,name,price,short_description,description,rating_average,review_count,image_base_url,image_large_url,image_medium_url,image_small_url,image_thumbnail_url,stock,quantity_sold
275022684,Bút Dạ Quang Thân Màu - Stacom HL113Y - Màu Vàng,6600,"    Bút Dạ Quang Thân Màu - Stacom HL113Y - Màu Vàng   Bút có màu sắc bắt mắt giúp bạn làm nổi bật chủ đề muốn nhấn mạnh.   Chất liệu mực an toàn cho người dùng, màu mực ra đều và nhanh, tránh le...","Bút Dạ Quang Thân Màu - Stacom HL113Y - Màu Vàng Bút có màu sắc bắt mắt giúp bạn làm nổi bật chủ đề muốn nhấn mạnh. Chất liệu mực an toàn cho người dùng, màu mực ra đều và nhanh, tránh lem hay ướt trang giấy. Kiểu dáng nhỏ gọn, phần tay cầm không trơn giúp dễ dàng khi sử dụng. Mực dạng nước phù hợp cho các loại giấy: giấy thường, giấy copy, giấy fax. Là một trong những sản phẩm bút viết không thể thiếu của giới sinh viên, học sinh hay văn phò Giá sản phẩm trên Tiki đã bao gồm thuế theo luật hiện hành. Bên cạnh đó, tuỳ vào loại sản phẩm, hình thức và địa chỉ giao hàng mà có thể phát sinh thêm chi phí khác như phí vận chuyển, phụ phí hàng cồng kềnh, thuế nhập khẩu (đối với đơn hàng giao từ nước ngoài có giá trị trên 1 triệu đồng).....",0,0,"https://salt.tikicdn.com/ts/product/27/b3/7d/aed1491a87a1e0ac7cf0bf7035dac471.jpg, https://salt.tikicdn.com/ts/product/a6/16/73/89e74ea6e744101f3282f4a943a6435d.jpg, https://salt.tikicdn.com/ts/product/2d/06/0f/4e5698abb3fa61a6585b24ceda28a223.jpg, https://salt.tikicdn.com/ts/product/22/ab/4e/0f430554d8ce23ae8460ca9106a83777.jpg, https://salt.tikicdn.com/ts/product/5d/53/16/e25cfb9a5e29f6b4d560efba9b5af948.jpg","https://salt.tikicdn.com/cache/w1200/ts/product/27/b3/7d/aed1491a87a1e0ac7cf0bf7035dac471.jpg, https://salt.tikicdn.com/cache/w1200/ts/product/a6/16/73/89e74ea6e744101f3282f4a943a6435d.jpg, https://salt.tikicdn.com/cache/w1200/ts/product/2d/06/0f/4e5698abb3fa61a6585b24ceda28a223.jpg, https://salt.tikicdn.com/cache/w1200/ts/product/22/ab/4e/0f430554d8ce23ae8460ca9106a83777.jpg, https://salt.tikicdn.com/cache/w1200/ts/product/5d/53/16/e25cfb9a5e29f6b4d560efba9b5af948.jpg","https://salt.tikicdn.com/cache/w300/ts/product/27/b3/7d/aed1491a87a1e0ac7cf0bf7035dac471.jpg, https://salt.tikicdn.com/cache/w300/ts/product/a6/16/73/89e74ea6e744101f3282f4a943a6435d.jpg, https://salt.tikicdn.com/cache/w300/ts/product/2d/06/0f/4e5698abb3fa61a6585b24ceda28a223.jpg, https://salt.tikicdn.com/cache/w300/ts/product/22/ab/4e/0f430554d8ce23ae8460ca9106a83777.jpg, https://salt.tikicdn.com/cache/w300/ts/product/5d/53/16/e25cfb9a5e29f6b4d560efba9b5af948.jpg","https://salt.tikicdn.com/cache/200x280/ts/product/27/b3/7d/aed1491a87a1e0ac7cf0bf7035dac471.jpg, https://salt.tikicdn.com/cache/200x280/ts/product/a6/16/73/89e74ea6e744101f3282f4a943a6435d.jpg, https://salt.tikicdn.com/cache/200x280/ts/product/2d/06/0f/4e5698abb3fa61a6585b24ceda28a223.jpg, https://salt.tikicdn.com/cache/200x280/ts/product/22/ab/4e/0f430554d8ce23ae8460ca9106a83777.jpg, https://salt.tikicdn.com/cache/200x280/ts/product/5d/53/16/e25cfb9a5e29f6b4d560efba9b5af948.jpg","https://salt.tikicdn.com/cache/200x280/ts/product/27/b3/7d/aed1491a87a1e0ac7cf0bf7035dac471.jpg, https://salt.tikicdn.com/cache/200x280/ts/product/a6/16/73/89e74ea6e744101f3282f4a943a6435d.jpg, https://salt.tikicdn.com/cache/200x280/ts/product/2d/06/0f/4e5698abb3fa61a6585b24ceda28a223.jpg, https://salt.tikicdn.com/cache/200x280/ts/product/22/ab/4e/0f430554d8ce23ae8460ca9106a83777.jpg, https://salt.tikicdn.com/cache/200x280/ts/product/5d/53/16/e25cfb9a5e29f6b4d560efba9b5af948.jpg",1000,0
273344153,Bút Dạ Quang G-Star GS-045 - Màu Xanh Lá,8500,"    Bút Dạ Quang G-Star GS-045   Màu dạ quang mạnh, tươi sáng, nét tô hoặc đánh dấu đều và liên tục, không làm lem chữ khi tô chồng lên.   Với thiết kế đầu lớn, độ phản quang tốt, mực dạ quang kh...","Bút Dạ Quang G-Star GS-045 Màu dạ quang mạnh, tươi sáng, nét tô hoặc đánh dấu đều và liên tục, không làm lem chữ khi tô chồng lên. Với thiết kế đầu lớn, độ phản quang tốt, mực dạ quang không để lại vết đen khi qua photocopy hay fax. Đây cũng chính là đặc điểm vượt trội của mẫu bút này. Bút phù hợp cho các loại giấy: giấy thường, giấy copy, giấy fax. Mực mau khô, lâu phai, dễ dàng rửa sạch khi vết mực dính ở tay và trên vải với xà phòng. Với kích thước nhỏ gọn, bạn có thể dễ dàng cất giữ bút trong bóp viết, ba lô, túi xách, dễ dàng mang theo khi đi học, đi làm, tiện lợi sử dụng mọi lúc, mọi nơi. Giá sản phẩm trên Tiki đã bao gồm thuế theo luật hiện hành. Bên cạnh đó, tuỳ vào loại sản phẩm, hình thức và địa chỉ giao hàng mà có thể phát sinh thêm chi phí khác như phí vận chuyển, phụ phí hàng cồng kềnh, thuế nhập khẩu (đối với đơn hàng giao từ nước ngoài có giá trị trên 1 triệu đồng).....",0,0,"https://salt.tikicdn.com/ts/product/51/88/05/8e32fab674d408436fb921a8544a9cc7.jpg, https://salt.tikicdn.com/ts/product/64/82/60/25e9dff345ed0f952e72fb4c6a34abdb.jpg, https://salt.tikicdn.com/ts/product/b7/80/2c/30c6ee3982c66ee4a5761f46b1e87516.jpg, https://salt.tikicdn.com/ts/product/35/5c/14/287bb7d12246482cfa3d32f4362eb986.jpg","https://salt.tikicdn.com/cache/w1200/ts/product/51/88/05/8e32fab674d408436fb921a8544a9cc7.jpg, https://salt.tikicdn.com/cache/w1200/ts/product/64/82/60/25e9dff345ed0f952e72fb4c6a34abdb.jpg, https://salt.tikicdn.com/cache/w1200/ts/product/b7/80/2c/30c6ee3982c66ee4a5761f46b1e87516.jpg, https://salt.tikicdn.com/cache/w1200/ts/product/35/5c/14/287bb7d12246482cfa3d32f4362eb986.jpg","https://salt.tikicdn.com/cache/w300/ts/product/51/88/05/8e32fab674d408436fb921a8544a9cc7.jpg, https://salt.tikicdn.com/cache/w300/ts/product/64/82/60/25e9dff345ed0f952e72fb4c6a34abdb.jpg, https://salt.tikicdn.com/cache/w300/ts/product/b7/80/2c/30c6ee3982c66ee4a5761f46b1e87516.jpg, https://salt.tikicdn.com/cache/w300/ts/product/35/5c/14/287bb7d12246482cfa3d32f4362eb986.jpg","https://salt.tikicdn.com/cache/200x280/ts/product/51/88/05/8e32fab674d408436fb921a8544a9cc7.jpg, https://salt.tikicdn.com/cache/200x280/ts/product/64/82/60/25e9dff345ed0f952e72fb4c6a34abdb.jpg, https://salt.tikicdn.com/cache/200x280/ts/product/b7/80/2c/30c6ee3982c66ee4a5761f46b1e87516.jpg, https://salt.tikicdn.com/cache/200x280/ts/product/35/5c/14/287bb7d12246482cfa3d32f4362eb986.jpg","https://salt.tikicdn.com/cache/200x280/ts/product/51/88/05/8e32fab674d408436fb921a8544a9cc7.jpg, https://salt.tikicdn.com/cache/200x280/ts/product/64/82/60/25e9dff345ed0f952e72fb4c6a34abdb.jpg, https://salt.tikicdn.com/cache/200x280/ts/product/b7/80/2c/30c6ee3982c66ee4a5761f46b1e87516.jpg, https://salt.tikicdn.com/cache/200x280/ts/product/35/5c/14/287bb7d12246482cfa3d32f4362eb986.jpg",1000,0
273331410,Bút Dạ Quang Pastel - Bitex HL05 - Mild Purple,8500,"    Bút Dạ Quang Pastel - Bitex HL05   - Sản phẩm được sản xuất theo công nghệ hiện đại, đạt tiêu chuẩn chất lượng quốc tế.   - Kiểu dáng thon gọn, trẻ trung, không lăn khi đặt trên bàn .   - Lư...","Bút Dạ Quang Pastel - Bitex HL05 - Sản phẩm được sản xuất theo công nghệ hiện đại, đạt tiêu chuẩn chất lượng quốc tế. - Kiểu dáng thon gọn, trẻ trung, không lăn khi đặt trên bàn . - Lượng mực nhiều , tăng thời gian sử dụng - Màu dạ quang pastel, không làm lem nét chữ của mực khi viết chồng lên và không để lại vết khi qua photocopy. - Màu mực tươi sáng, phản quang tốt, nét viết hoặc đánh dấu đều và liên tục. - Đầu bút và ruột bút bằng polyester, dạng vát xéo, vỏ bọc bằng nhựa PP không độc hại. - Bề rộng nét viết: 6 mm Giá sản phẩm trên Tiki đã bao gồm thuế theo luật hiện hành. Bên cạnh đó, tuỳ vào loại sản phẩm, hình thức và địa chỉ giao hàng mà có thể phát sinh thêm chi phí khác như phí vận chuyển, phụ phí hàng cồng kềnh, thuế nhập khẩu (đối với đơn hàng giao từ nước ngoài có giá trị trên 1 triệu đồng).....",5,1,"https://salt.tikicdn.com/ts/product/01/78/47/c3cc3f4af4a0d4b07b1dab3a4911de17.jpg, https://salt.tikicdn.com/ts/product/61/f3/8d/ebaced3a103adb986461c5e89ee093ba.jpg, https://salt.tikicdn.com/ts/product/a6/42/02/c2a490f38c0f8c1288d6f66a7ddf2c18.jpg, https://salt.tikicdn.com/ts/product/01/78/47/8ac7c0ace612ebf483c99ee63b12c322.jpg, https://salt.tikicdn.com/ts/product/33/eb/17/85b2d9453b97e8e04c9ef00d3596e33c.jpg","https://salt.tikicdn.com/cache/w1200/ts/product/01/78/47/c3cc3f4af4a0d4b07b1dab3a4911de17.jpg, https://salt.tikicdn.com/cache/w1200/ts/product/61/f3/8d/ebaced3a103adb986461c5e89ee093ba.jpg, https://salt.tikicdn.com/cache/w1200/ts/product/a6/42/02/c2a490f38c0f8c1288d6f66a7ddf2c18.jpg, https://salt.tikicdn.com/cache/w1200/ts/product/01/78/47/8ac7c0ace612ebf483c99ee63b12c322.jpg, https://salt.tikicdn.com/cache/w1200/ts/product/33/eb/17/85b2d9453b97e8e04c9ef00d3596e33c.jpg","https://salt.tikicdn.com/cache/w300/ts/product/01/78/47/c3cc3f4af4a0d4b07b1dab3a4911de17.jpg, https://salt.tikicdn.com/cache/w300/ts/product/61/f3/8d/ebaced3a103adb986461c5e89ee093ba.jpg, https://salt.tikicdn.com/cache/w300/ts/product/a6/42/02/c2a490f38c0f8c1288d6f66a7ddf2c18.jpg, https://salt.tikicdn.com/cache/w300/ts/product/01/78/47/8ac7c0ace612ebf483c99ee63b12c322.jpg, https://salt.tikicdn.com/cache/w300/ts/product/33/eb/17/85b2d9453b97e8e04c9ef00d3596e33c.jpg","https://salt.tikicdn.com/cache/200x280/ts/product/01/78/47/c3cc3f4af4a0d4b07b1dab3a4911de17.jpg, https://salt.tikicdn.com/cache/200x280/ts/product/61/f3/8d/ebaced3a103adb986461c5e89ee093ba.jpg, https://salt.tikicdn.com/cache/200x280/ts/product/a6/42/02/c2a490f38c0f8c1288d6f66a7ddf2c18.jpg, https://salt.tikicdn.com/cache/200x280/ts/product/01/78/47/8ac7c0ace612ebf483c99ee63b12c322.jpg, https://salt.tikicdn.com/cache/200x280/ts/product/33/eb/17/85b2d9453b97e8e04c9ef00d3596e33c.jpg","https://salt.tikicdn.com/cache/200x280/ts/product/01/78/47/c3cc3f4af4a0d4b07b1dab3a4911de17.jpg, https://salt.tikicdn.com/cache/200x280/ts/product/61/f3/8d/ebaced3a103adb986461c5e89ee093ba.jpg, https://salt.tikicdn.com/cache/200x280/ts/product/a6/42/02/c2a490f38c0f8c1288d6f66a7ddf2c18.jpg, https://salt.tikicdn.com/cache/200x280/ts/product/01/78/47/8ac7c0ace612ebf483c99ee63b12c322.jpg, https://salt.tikicdn.com/cache/200x280/ts/product/33/eb/17/85b2d9453b97e8e04c9ef00d3596e33c.jpg",1000,1
273017406,Bút Dạ Quang - Thiên Long HL-03 - Màu Xanh Biển,9900,"    Bút Dạ Quang - Thiên Long HL-03   Bút dạ quang HL03 có những đặc điểm nổi bật   - Bút dạ quang HL03 có 2 đầu bút: Một đầu nhỏ và một đầu lớn, giúp đa dạng nét viết, thuận tiện khi sử dụng. Sả...","Bút Dạ Quang - Thiên Long HL-03 Bút dạ quang HL03 có những đặc điểm nổi bật - Bút dạ quang HL03 có 2 đầu bút: Một đầu nhỏ và một đầu lớn, giúp đa dạng nét viết, thuận tiện khi sử dụng. Sản phẩm được sản xuất theo công nghệ hiện đại, đạt tiêu chuẩn chất lượng quốc tế. - Kiểu dáng thon gọn, trẻ trung Màu dạ quang mạnh, không làm lem nét chữ của mực khi viết chồng lên và không để lại vết khi qua photocopy đây là đặt điểm vượt trội của bút dạ quang HL03. Đặc tính sản phẩm bút dạ quang HL03 - Màu mực tươi sáng, phản quang tốt. Nét viết hoặc đánh dấu đều và liên tục. Không độc hại. - Thiết kế hai đầu bút thuận tiện. Đầu bút và ruột bút bằng polyester. Vỏ bọc bằng nhựa PP. Bề rộng nét viết: - Đầu bút nhỏ 0.6mm và đầu bút lớn 4mm. - Bút dạ quang FO-HL03 có 5 màu mực: Vàng, cam, hồng, xanh lá, xanh biển. Giá sản phẩm trên Tiki đã bao gồm thuế theo luật hiện hành. Bên cạnh đó, tuỳ vào loại sản phẩm, hình thức và địa chỉ giao hàng mà có thể phát sinh thêm chi phí khác như phí vận chuyển, phụ phí hàng cồng kềnh, thuế nhập khẩu (đối với đơn hàng giao từ nước ngoài có giá trị trên 1 triệu đồng).....",0,0,"https://salt.tikicdn.com/ts/product/54/64/be/5c293dcd2babb457dd36eab6aad5ab90.jpg, https://salt.tikicdn.com/ts/product/16/1f/16/24d3fdb4df12cdfdc7c5ea01355c4d3e.jpg, https://salt.tikicdn.com/ts/product/99/6b/9d/41b0c145c76aeb08b4085d5f2c660d14.jpg, https://salt.tikicdn.com/ts/product/25/cf/61/03504c5d7c7997f5ee30902c42b54005.jpg, https://salt.tikicdn.com/ts/product/e2/1d/1d/62bba5ab94097f02b69471e7d96af7d5.jpg, https://salt.tikicdn.com/ts/product/4a/8f/8a/0273bf3d9bbbf4b7350465c117998c66.jpg","https://salt.tikicdn.com/cache/w1200/ts/product/54/64/be/5c293dcd2babb457dd36eab6aad5ab90.jpg, https://salt.tikicdn.com/cache/w1200/ts/product/16/1f/16/24d3fdb4df12cdfdc7c5ea01355c4d3e.jpg, https://salt.tikicdn.com/cache/w1200/ts/product/99/6b/9d/41b0c145c76aeb08b4085d5f2c660d14.jpg, https://salt.tikicdn.com/cache/w1200/ts/product/25/cf/61/03504c5d7c7997f5ee30902c42b54005.jpg, https://salt.tikicdn.com/cache/w1200/ts/product/e2/1d/1d/62bba5ab94097f02b69471e7d96af7d5.jpg, https://salt.tikicdn.com/cache/w1200/ts/product/4a/8f/8a/0273bf3d9bbbf4b7350465c117998c66.jpg","https://salt.tikicdn.com/cache/w300/ts/product/54/64/be/5c293dcd2babb457dd36eab6aad5ab90.jpg, https://salt.tikicdn.com/cache/w300/ts/product/16/1f/16/24d3fdb4df12cdfdc7c5ea01355c4d3e.jpg, https://salt.tikicdn.com/cache/w300/ts/product/99/6b/9d/41b0c145c76aeb08b4085d5f2c660d14.jpg, https://salt.tikicdn.com/cache/w300/ts/product/25/cf/61/03504c5d7c7997f5ee30902c42b54005.jpg, https://salt.tikicdn.com/cache/w300/ts/product/e2/1d/1d/62bba5ab94097f02b69471e7d96af7d5.jpg, https://salt.tikicdn.com/cache/w300/ts/product/4a/8f/8a/0273bf3d9bbbf4b7350465c117998c66.jpg","https://salt.tikicdn.com/cache/200x280/ts/product/54/64/be/5c293dcd2babb457dd36eab6aad5ab90.jpg, https://salt.tikicdn.com/cache/200x280/ts/product/16/1f/16/24d3fdb4df12cdfdc7c5ea01355c4d3e.jpg, https://salt.tikicdn.com/cache/200x280/ts/product/99/6b/9d/41b0c145c76aeb08b4085d5f2c660d14.jpg, https://salt.tikicdn.com/cache/200x280/ts/product/25/cf/61/03504c5d7c7997f5ee30902c42b54005.jpg, https://salt.tikicdn.com/cache/200x280/ts/product/e2/1d/1d/62bba5ab94097f02b69471e7d96af7d5.jpg, https://salt.tikicdn.com/cache/200x280/ts/product/4a/8f/8a/0273bf3d9bbbf4b7350465c117998c66.jpg","https://salt.tikicdn.com/cache/200x280/ts/product/54/64/be/5c293dcd2babb457dd36eab6aad5ab90.jpg, https://salt.tikicdn.com/cache/200x280/ts/product/16/1f/16/24d3fdb4df12cdfdc7c5ea01355c4d3e.jpg, https://salt.tikicdn.com/cache/200x280/ts/product/99/6b/9d/41b0c145c76aeb08b4085d5f2c660d14.jpg, https://salt.tikicdn.com/cache/200x280/ts/product/25/cf/61/03504c5d7c7997f5ee30902c42b54005.jpg, https://salt.tikicdn.com/cache/200x280/ts/product/e2/1d/1d/62bba5ab94097f02b69471e7d96af7d5.jpg, https://salt.tikicdn.com/cache/200x280/ts/product/4a/8f/8a/0273bf3d9bbbf4b7350465c117998c66.jpg",1000,0
271318178,Bút dạ quang Hồng Hà Pastel HH01 - 3565,2500,"1. MÔ TẢ SẢN PHẨM- Bút dạ quang Pastel HH01 - 3565 sản xuất theo công nghệ hiện đại. Kiểu dáng thôn gọn, trẻ trung, màu sắc pastel tươi sáng, hợp xu hướng.2. ĐẶC ĐIỂM SẢN PHẨM- Chất liệu: nhựa ABS v...","1. MÔ TẢ SẢN PHẨM - Bút dạ quang Pastel HH01 - 3565 sản xuất theo công nghệ hiện đại. Kiểu dáng thôn gọn, trẻ trung, màu sắc pastel tươi sáng, hợp xu hướng. 2. ĐẶC ĐIỂM SẢN PHẨM - Chất liệu: nhựa ABS và fiber - Kích thước: 100x8mm - Hình dạng ngòi: vát xéo - Bề rộng nét viết: Đầu to 4mm - Màu sắc: Vàng, Cam, Hồng, Tím, Xanh dương, Xanh lá - Thương hiệu: Văn phòng phẩm Hồng Hà - Xuất xứ: Việt Nam 3. ĐỐI TƯỢNG SỬ DỤNG - Sản phẩm tiện ích trong học tập, làm việc dành cho học sinh, sinh viên và giới văn phòng. 4. CÁCH SỬ DỤNG VÀ BẢO QUẢN - Để xa nguồn nhiệt. - Bảo quản nơi khô ráo, thoáng mát, tránh nơi có độ ẩm cao. ️ Quý khách vui lòng quay lại clip khi mở hàng để làm bằng chứng khiếu nại với shop khi gặp vấn đề liên quan đến sản phẩm. Shop chỉ giải quyết khiếu nại khi có video clip đầy đủ. ️ Để mua sỉ, mua số lượng lớn, Quý khách hàng vui lòng nhắn tin trực tiếp với shop. Xin cảm ơn! Liên hệ với chúng tôi để đặt mua sản phẩm nhanh chóng và tham khảo thêm nhiều dụng cụ học tập thiết thực cho con yêu tại đây. Hân hạnh phục vụ quý khách! #vanphongphamhongha #vpphongha #hongha#dodunghocsinh#dungcuhoctap#butdaquang#buthighlight Giá sản phẩm trên Tiki đã bao gồm thuế theo luật hiện hành. Bên cạnh đó, tuỳ vào loại sản phẩm, hình thức và địa chỉ giao hàng mà có thể phát sinh thêm chi phí khác như phí vận chuyển, phụ phí hàng cồng kềnh, thuế nhập khẩu (đối với đơn hàng giao từ nước ngoài có giá trị trên 1 triệu đồng).....",0,0,"https://salt.tikicdn.com/ts/product/1d/74/2f/6695bfe87487a824457fb4c39cbbffab.jpg, https://salt.tikicdn.com/ts/product/0c/8e/2b/7a1de2fe896820f0e450e8bdb775d224.jpg","https://salt.tikicdn.com/cache/w1200/ts/product/1d/74/2f/6695bfe87487a824457fb4c39cbbffab.jpg, https://salt.tikicdn.com/cache/w1200/ts/product/0c/8e/2b/7a1de2fe896820f0e450e8bdb775d224.jpg","https://salt.tikicdn.com/cache/w300/ts/product/1d/74/2f/6695bfe87487a824457fb4c39cbbffab.jpg, https://salt.tikicdn.com/cache/w300/ts/product/0c/8e/2b/7a1de2fe896820f0e450e8bdb775d224.jpg","https://salt.tikicdn.com/cache/200x280/ts/product/1d/74/2f/6695bfe87487a824457fb4c39cbbffab.jpg, https://salt.tikicdn.com/cache/200x280/ts/product/0c/8e/2b/7a1de2fe896820f0e450e8bdb775d224.jpg","https://salt.tikicdn.com/cache/200x280/ts/product/1d/74/2f/6695bfe87487a824457fb4c39cbbffab.jpg, https://salt.tikicdn.com/cache/200x280/ts/product/0c/8e/2b/7a1de2fe896820f0e450e8bdb775d224.jpg",1000,0
263944980,Bút Dạ Quang Pastel - Bitex HL05 - Mild Blue,8500,"    Bút Dạ Quang Pastel - Bitex HL05   - Sản phẩm được sản xuất theo công nghệ hiện đại, đạt tiêu chuẩn chất lượng quốc tế.   - Kiểu dáng thon gọn, trẻ trung, không lăn khi đặt trên bàn .   - Lư...","Bút Dạ Quang Pastel - Bitex HL05 - Sản phẩm được sản xuất theo công nghệ hiện đại, đạt tiêu chuẩn chất lượng quốc tế. - Kiểu dáng thon gọn, trẻ trung, không lăn khi đặt trên bàn . - Lượng mực nhiều , tăng thời gian sử dụng - Màu dạ quang pastel, không làm lem nét chữ của mực khi viết chồng lên và không để lại vết khi qua photocopy. - Màu mực tươi sáng, phản quang tốt, nét viết hoặc đánh dấu đều và liên tục. - Đầu bút và ruột bút bằng polyester, dạng vát xéo, vỏ bọc bằng nhựa PP không độc hại. - Bề rộng nét viết: 6 mm Giá sản phẩm trên Tiki đã bao gồm thuế theo luật hiện hành. Bên cạnh đó, tuỳ vào loại sản phẩm, hình thức và địa chỉ giao hàng mà có thể phát sinh thêm chi phí khác như phí vận chuyển, phụ phí hàng cồng kềnh, thuế nhập khẩu (đối với đơn hàng giao từ nước ngoài có giá trị trên 1 triệu đồng).....",5,1,"https://salt.tikicdn.com/ts/product/99/9c/0b/1c81f88b383c74c95c2a60c226598b36.jpg, https://salt.tikicdn.com/ts/product/f5/f6/fa/fef6525ca212ee15802d6ac3c0a8c9ad.jpg, https://salt.tikicdn.com/ts/product/b7/2a/f5/c45b6422adf5435abe052659ae1cc2cf.jpg, https://salt.tikicdn.com/ts/product/24/b2/c5/ef59053855c818a3307356d53354d411.jpg","https://salt.tikicdn.com/cache/w1200/ts/product/99/9c/0b/1c81f88b383c74c95c2a60c226598b36.jpg, https://salt.tikicdn.com/cache/w1200/ts/product/f5/f6/fa/fef6525ca212ee15802d6ac3c0a8c9ad.jpg, https://salt.tikicdn.com/cache/w1200/ts/product/b7/2a/f5/c45b6422adf5435abe052659ae1cc2cf.jpg, https://salt.tikicdn.com/cache/w1200/ts/product/24/b2/c5/ef59053855c818a3307356d53354d411.jpg","https://salt.tikicdn.com/cache/w300/ts/product/99/9c/0b/1c81f88b383c74c95c2a60c226598b36.jpg, https://salt.tikicdn.com/cache/w300/ts/product/f5/f6/fa/fef6525ca212ee15802d6ac3c0a8c9ad.jpg, https://salt.tikicdn.com/cache/w300/ts/product/b7/2a/f5/c45b6422adf5435abe052659ae1cc2cf.jpg, https://salt.tikicdn.com/cache/w300/ts/product/24/b2/c5/ef59053855c818a3307356d53354d411.jpg","https://salt.tikicdn.com/cache/200x280/ts/product/99/9c/0b/1c81f88b383c74c95c2a60c226598b36.jpg, https://salt.tikicdn.com/cache/200x280/ts/product/f5/f6/fa/fef6525ca212ee15802d6ac3c0a8c9ad.jpg, https://salt.tikicdn.com/cache/200x280/ts/product/b7/2a/f5/c45b6422adf5435abe052659ae1cc2cf.jpg, https://salt.tikicdn.com/cache/200x280/ts/product/24/b2/c5/ef59053855c818a3307356d53354d411.jpg","https://salt.tikicdn.com/cache/200x280/ts/product/99/9c/0b/1c81f88b383c74c95c2a60c226598b36.jpg, https://salt.tikicdn.com/cache/200x280/ts/product/f5/f6/fa/fef6525ca212ee15802d6ac3c0a8c9ad.jpg, https://salt.tikicdn.com/cache/200x280/ts/product/b7/2a/f5/c45b6422adf5435abe052659ae1cc2cf.jpg, https://salt.tikicdn.com/cache/200x280/ts/product/24/b2/c5/ef59053855c818a3307356d53354d411.jpg",1000,1
263944978,Bút Dạ Quang Pastel - Bitex HL05 - Mild Pink,9000,"    Bút Dạ Quang Pastel - Bitex HL05   - Sản phẩm được sản xuất theo công nghệ hiện đại, đạt tiêu chuẩn chất lượng quốc tế.   - Kiểu dáng thon gọn, trẻ trung, không lăn khi đặt trên bàn .   - Lư...","Bút Dạ Quang Pastel - Bitex HL05 - Sản phẩm được sản xuất theo công nghệ hiện đại, đạt tiêu chuẩn chất lượng quốc tế. - Kiểu dáng thon gọn, trẻ trung, không lăn khi đặt trên bàn . - Lượng mực nhiều , tăng thời gian sử dụng - Màu dạ quang pastel, không làm lem nét chữ của mực khi viết chồng lên và không để lại vết khi qua photocopy. - Màu mực tươi sáng, phản quang tốt, nét viết hoặc đánh dấu đều và liên tục. - Đầu bút và ruột bút bằng polyester, dạng vát xéo, vỏ bọc bằng nhựa PP không độc hại. - Bề rộng nét viết: 6 mm Giá sản phẩm trên Tiki đã bao gồm thuế theo luật hiện hành. Bên cạnh đó, tuỳ vào loại sản phẩm, hình thức và địa chỉ giao hàng mà có thể phát sinh thêm chi phí khác như phí vận chuyển, phụ phí hàng cồng kềnh, thuế nhập khẩu (đối với đơn hàng giao từ nước ngoài có giá trị trên 1 triệu đồng).....",5,1,"https://salt.tikicdn.com/ts/product/9c/ba/a6/93794658dde3c93009dc45108054598b.jpg, https://salt.tikicdn.com/ts/product/98/48/92/51059b949f48fe05cf3ea2ca79644c17.jpg, https://salt.tikicdn.com/ts/product/2c/33/c6/f62faa85f7d5448c5e090ed1295c0b73.jpg, https://salt.tikicdn.com/ts/product/9c/ba/a6/d2340cf79244a63556efdbd3049e3586.jpg, https://salt.tikicdn.com/ts/product/76/d1/c6/fe8e32b8140c5bbd7a3aa84eb9b5e1fc.jpg","https://salt.tikicdn.com/cache/w1200/ts/product/9c/ba/a6/93794658dde3c93009dc45108054598b.jpg, https://salt.tikicdn.com/cache/w1200/ts/product/98/48/92/51059b949f48fe05cf3ea2ca79644c17.jpg, https://salt.tikicdn.com/cache/w1200/ts/product/2c/33/c6/f62faa85f7d5448c5e090ed1295c0b73.jpg, https://salt.tikicdn.com/cache/w1200/ts/product/9c/ba/a6/d2340cf79244a63556efdbd3049e3586.jpg, https://salt.tikicdn.com/cache/w1200/ts/product/76/d1/c6/fe8e32b8140c5bbd7a3aa84eb9b5e1fc.jpg","https://salt.tikicdn.com/cache/w300/ts/product/9c/ba/a6/93794658dde3c93009dc45108054598b.jpg, https://salt.tikicdn.com/cache/w300/ts/product/98/48/92/51059b949f48fe05cf3ea2ca79644c17.jpg, https://salt.tikicdn.com/cache/w300/ts/product/2c/33/c6/f62faa85f7d5448c5e090ed1295c0b73.jpg, https://salt.tikicdn.com/cache/w300/ts/product/9c/ba/a6/d2340cf79244a63556efdbd3049e3586.jpg, https://salt.tikicdn.com/cache/w300/ts/product/76/d1/c6/fe8e32b8140c5bbd7a3aa84eb9b5e1fc.jpg","https://salt.tikicdn.com/cache/200x280/ts/product/9c/ba/a6/93794658dde3c93009dc45108054598b.jpg, https://salt.tikicdn.com/cache/200x280/ts/product/98/48/92/51059b949f48fe05cf3ea2ca79644c17.jpg, https://salt.tikicdn.com/cache/200x280/ts/product/2c/33/c6/f62faa85f7d5448c5e090ed1295c0b73.jpg, https://salt.tikicdn.com/cache/200x280/ts/product/9c/ba/a6/d2340cf79244a63556efdbd3049e3586.jpg, https://salt.tikicdn.com/cache/200x280/ts/product/76/d1/c6/fe8e32b8140c5bbd7a3aa84eb9b5e1fc.jpg","https://salt.tikicdn.com/cache/200x280/ts/product/9c/ba/a6/93794658dde3c93009dc45108054598b.jpg, https://salt.tikicdn.com/cache/200x280/ts/product/98/48/92/51059b949f48fe05cf3ea2ca79644c17.jpg, https://salt.tikicdn.com/cache/200x280/ts/product/2c/33/c6/f62faa85f7d5448c5e090ed1295c0b73.jpg, https://salt.tikicdn.com/cache/200x280/ts/product/9c/ba/a6/d2340cf79244a63556efdbd3049e3586.jpg, https://salt.tikicdn.com/cache/200x280/ts/product/76/d1/c6/fe8e32b8140c5bbd7a3aa84eb9b5e1fc.jpg",1000,1
