id,name,price,short_description,description,rating_average,review_count,image_base_url,image_large_url,image_medium_url,image_small_url,image_thumbnail_url,stock,quantity_sold
276892274,Bút Dạ Quang Hoshi 2 Đầu - Thiên Long HL-018/HS - Màu Vàng,13900,"    Bút Dạ Quang Hoshi 2 Đầu - Thiên Long HL-018/HS   - Bút dạ quang HL-018/HS có 2 đầu bút: Một đầu nhỏ và một đầu lớn, giúp đa dạng nét viết, thuận tiện khi sử dụng. Sản phẩm được sản xuất theo ...","Bút Dạ Quang Hoshi 2 Đầu - Thiên Long HL-018/HS - Bút dạ quang HL-018/HS có 2 đầu bút: Một đầu nhỏ và một đầu lớn, giúp đa dạng nét viết, thuận tiện khi sử dụng. Sản phẩm được sản xuất theo công nghệ hiện đại, đạt tiêu chuẩn chất lượng quốc tế. - Kiểu dáng thon gọn, trẻ trung Màu dạ quang mạnh, không làm lem nét chữ của mực khi viết chồng lên và không để lại vết khi qua photocopy đây là đặt điểm vượt trội của bút dạ quang HL03. Đặc tính sản phẩm bút dạ quang HL-018/HS - Màu mực tươi sáng, phản quang tốt. Nét viết hoặc đánh dấu đều và liên tục. Không độc hại. - Thiết kế hai đầu bút thuận tiện. Đầu bút và ruột bút bằng polyester. Vỏ bọc bằng nhựa PP. Bề rộng nét viết: - Đầu bút nhỏ 1mm và đầu bút lớn 4mm. Giá sản phẩm trên Tiki đã bao gồm thuế theo luật hiện hành. Bên cạnh đó, tuỳ vào loại sản phẩm, hình thức và địa chỉ giao hàng mà có thể phát sinh thêm chi phí khác như phí vận chuyển, phụ phí hàng cồng kềnh, thuế nhập khẩu (đối với đơn hàng giao từ nước ngoài có giá trị trên 1 triệu đồng).....",0,0,"https://salt.tikicdn.com/ts/product/2c/ef/f2/f0c2f86b4f436b730cce3da95b9f73d1.jpg, https://salt.tikicdn.com/ts/product/79/0f/27/4637e12764d51c237ccd19dacf02aa98.jpg","https://salt.tikicdn.com/cache/w1200/ts/product/2c/ef/f2/f0c2f86b4f436b730cce3da95b9f73d1.jpg, https://salt.tikicdn.com/cache/w1200/ts/product/79/0f/27/4637e12764d51c237ccd19dacf02aa98.jpg","https://salt.tikicdn.com/cache/w300/ts/product/2c/ef/f2/f0c2f86b4f436b730cce3da95b9f73d1.jpg, https://salt.tikicdn.com/cache/w300/ts/product/79/0f/27/4637e12764d51c237ccd19dacf02aa98.jpg","https://salt.tikicdn.com/cache/200x280/ts/product/2c/ef/f2/f0c2f86b4f436b730cce3da95b9f73d1.jpg, https://salt.tikicdn.com/cache/200x280/ts/product/79/0f/27/4637e12764d51c237ccd19dacf02aa98.jpg","https://salt.tikicdn.com/cache/200x280/ts/product/2c/ef/f2/f0c2f86b4f436b730cce3da95b9f73d1.jpg, https://salt.tikicdn.com/cache/200x280/ts/product/79/0f/27/4637e12764d51c237ccd19dacf02aa98.jpg",1000,0
276889635,Bút dạ quang HL-02,37000,"Đặc điểm nổi bật:- Sản phẩm được sản xuất theo công nghệ hiện đại, đạt tiêu chuẩn chất lượng quốc tế.- Kiểu dáng thon gọn, trẻ trung, không lăn khi đặt trên bàn .- Lượng mực nhiều , tăng thời gian sử ...","Đặc điểm nổi bật: - Sản phẩm được sản xuất theo công nghệ hiện đại, đạt tiêu chuẩn chất lượng quốc tế. - Kiểu dáng thon gọn, trẻ trung, không lăn khi đặt trên bàn . - Lượng mực nhiều , tăng thời gian sử dụng - Màu dạ quang mạnh, không làm lem nét chữ của mực khi viết chồng lên và không để lại vết khi qua photocopy. Đây là đặc điểm vượt trội của bút dạ quang FO-HL02 Đặc tính sản phẩm bút dạ quang FO-HL02 : - Màu mực tươi sáng, phản quang tốt. Nét viết hoặc đánh dấu đều và liên tục. Không độc hại. - Đầu bút và ruột bút bằng polyester, dạng vát xéo. Vỏ bọc bằng nhựa PP. - Bề rộng nét viết: 4mm - Bút dạ quang FO-HL02 có 5 màu mực: Vàng, cam, hồng, xanh lá, xanh biển. Giá sản phẩm trên Tiki đã bao gồm thuế theo luật hiện hành. Bên cạnh đó, tuỳ vào loại sản phẩm, hình thức và địa chỉ giao hàng mà có thể phát sinh thêm chi phí khác như phí vận chuyển, phụ phí hàng cồng kềnh, thuế nhập khẩu (đối với đơn hàng giao từ nước ngoài có giá trị trên 1 triệu đồng).....",0,0,https://salt.tikicdn.com/ts/product/c4/62/5c/2747b8050d15964aeaa0ca1da2845045.png,https://salt.tikicdn.com/cache/w1200/ts/product/c4/62/5c/2747b8050d15964aeaa0ca1da2845045.png,https://salt.tikicdn.com/cache/w300/ts/product/c4/62/5c/2747b8050d15964aeaa0ca1da2845045.png,https://salt.tikicdn.com/cache/200x280/ts/product/c4/62/5c/2747b8050d15964aeaa0ca1da2845045.png,https://salt.tikicdn.com/cache/200x280/ts/product/c4/62/5c/2747b8050d15964aeaa0ca1da2845045.png,1000,0
276557507,Bút Dạ Quang FO-HL05,7000,"- Sản phẩm được sản xuất theo công nghệ hiện đại, đạt tiêu chuẩn chất lượng quốc tế.- Kiểu dáng thon gọn, trẻ trung, không lăn khi đặt trên bàn - Lượng mực nhiều, tăng thời gian sử dụng .- Màu dạ quan...","- Sản phẩm được sản xuất theo công nghệ hiện đại, đạt tiêu chuẩn chất lượng quốc tế. - Kiểu dáng thon gọn, trẻ trung, không lăn khi đặt trên bàn - Lượng mực nhiều, tăng thời gian sử dụng . - Màu dạ quang mạnh, không làm lem nét chữ của mực khi viết chồng lên và không để lại vết khi qua photocopy. Giá sản phẩm trên Tiki đã bao gồm thuế theo luật hiện hành. Bên cạnh đó, tuỳ vào loại sản phẩm, hình thức và địa chỉ giao hàng mà có thể phát sinh thêm chi phí khác như phí vận chuyển, phụ phí hàng cồng kềnh, thuế nhập khẩu (đối với đơn hàng giao từ nước ngoài có giá trị trên 1 triệu đồng).....",0,0,https://salt.tikicdn.com/ts/product/38/10/a6/ebe798d92993e4c70a778d1ec7a47aee.jpg,https://salt.tikicdn.com/cache/w1200/ts/product/38/10/a6/ebe798d92993e4c70a778d1ec7a47aee.jpg,https://salt.tikicdn.com/cache/w300/ts/product/38/10/a6/ebe798d92993e4c70a778d1ec7a47aee.jpg,https://salt.tikicdn.com/cache/200x280/ts/product/38/10/a6/ebe798d92993e4c70a778d1ec7a47aee.jpg,https://salt.tikicdn.com/cache/200x280/ts/product/38/10/a6/ebe798d92993e4c70a778d1ec7a47aee.jpg,1000,0
276447380,Bút dạ quang Marvy Uchida 20,10000,"MARVY 20 với một thiết kế đơn giản nhưng lại là những trải nghiệm tuyệt vời khi sử dụng• Công dụng: bút dạ quang,sử dụng trong văn phòng, học tập• Màu sắc : vàng, cam, hồng, xanh lá, tím xanh lá• K...","MARVY 20 với một thiết kế đơn giản nhưng lại là những trải nghiệm tuyệt vời khi sử dụng • Công dụng: bút dạ quang,sử dụng trong văn phòng, học tập • Màu sắc : vàng, cam, hồng, xanh lá, tím xanh lá • Kiểu dáng: Kiểu dáng nhỏ gọn, phần tay cầm không trơn giúp dễ dàng khi sử dụng • Bề mặt: . Mực dạng nước phù hợp cho các loại giấy: giấy thường, giấy copy, giấy fax • Điều làm nên khác biệt: Bút có màu sắc bắt mắt giúp bạn làm nổi bật chủ đề muốn nhấn mạnh. Chất liệu mực an toàn cho người dùng, màu mực ra đều và nhanh, tránh lem hay ướt trang giấy. Mực không bị đen hay tối khi scan hay copy. Thông tin sản phẩm: • Nhà phân phối độc quyền tại Việt Nam: Công ty Cổ phần Quốc Anh. • Thương hiệu: MARVY UCHIDA. • Xuất xứ: Nhật Bản • Loại sản phẩm: Bút dạ quang • Size ngòi: đầu vuông • Màu trong combo: 1 cây/màu/ combo MARVY UCHIDA_ CREATING IN COLOR Giá sản phẩm trên Tiki đã bao gồm thuế theo luật hiện hành. Bên cạnh đó, tuỳ vào loại sản phẩm, hình thức và địa chỉ giao hàng mà có thể phát sinh thêm chi phí khác như phí vận chuyển, phụ phí hàng cồng kềnh, thuế nhập khẩu (đối với đơn hàng giao từ nước ngoài có giá trị trên 1 triệu đồng).....",0,0,https://salt.tikicdn.com/ts/product/a6/c5/c0/9d31dd01b3d8941a9d69f259520724b3.jpg,https://salt.tikicdn.com/cache/w1200/ts/product/a6/c5/c0/9d31dd01b3d8941a9d69f259520724b3.jpg,https://salt.tikicdn.com/cache/w300/ts/product/a6/c5/c0/9d31dd01b3d8941a9d69f259520724b3.jpg,https://salt.tikicdn.com/cache/200x280/ts/product/a6/c5/c0/9d31dd01b3d8941a9d69f259520724b3.jpg,https://salt.tikicdn.com/cache/200x280/ts/product/a6/c5/c0/9d31dd01b3d8941a9d69f259520724b3.jpg,1000,0
275615468,Bút Dạ Quang Classic Pastel Maped - Màu Tím,23400,"    Bút Dạ Quang Classic Pastel Maped - Màu Tím   Sản phẩm là một trong những loại bút dạ quang có kiểu dáng thân dẹt to độc đáo.   Những ưu điểm nổi bật về màu mực và độ phản quang, lại không độ...","Bút Dạ Quang Classic Pastel Maped - Màu Tím Sản phẩm là một trong những loại bút dạ quang có kiểu dáng thân dẹt to độc đáo. Những ưu điểm nổi bật về màu mực và độ phản quang, lại không độc hại cho người dùng khiến mẫu bút này nhận được sự yêu chuộng của mọi đối tượng khách hàng. Bút được sử dụng để đánh dấu, tô sáng, highligth các thông tin quan trọng, là trợ thủ đắc lực trong quá trình học tập và làm việc của bạn. Màu mực tươi sáng, phản quang tốt Màu dạ quang mạnh, tươi sáng, nét tô hoặc đánh dấu đều và liên tục, không làm lem chữ khi tô chồng lên. Với thiết kế đầu lớn, độ phản quang tốt, mực dạ quang không để lại vết đen khi qua photocopy hay fax. Đây cũng chính là đặc điểm vượt trội của mẫu bút này. Bút phù hợp cho các loại giấy: giấy thường, giấy copy, giấy fax. Mực mau khô, lâu phai, dễ dàng rửa sạch khi vết mực dính ở tay và trên vải với xà phòng. Tiện lợi mang theo Với các tính năng nổi bật, kích thước vừa phải, bạn có thể dễ dàng cất giữ bút trong bóp viết, ba lô, túi xách, dễ dàng mang theo khi đi học, đi làm, tiện lợi sử dụng mọi lúc, mọi nơi. Chất lượng an toàn Với Bút Dạ Quang Classic PASTEL, bạn sẽ hoàn toàn yên tâm khi sử dụng vì sản phẩm dùng chất liệu mực an toàn, không độc hại, đảm bảo cho sức khỏe người tiêu dùng. Giá sản phẩm trên Tiki đã bao gồm thuế theo luật hiện hành. Bên cạnh đó, tuỳ vào loại sản phẩm, hình thức và địa chỉ giao hàng mà có thể phát sinh thêm chi phí khác như phí vận chuyển, phụ phí hàng cồng kềnh, thuế nhập khẩu (đối với đơn hàng giao từ nước ngoài có giá trị trên 1 triệu đồng).....",0,0,"https://salt.tikicdn.com/ts/product/76/53/7a/785319aa0c2324101fa71271902c3764.jpg, https://salt.tikicdn.com/ts/product/15/e9/a6/057feb3395446f538d302bdf8ff7206d.jpg, https://salt.tikicdn.com/ts/product/ed/2b/b1/a7dce3f2f915896455ec29e4493dfd0a.jpg, https://salt.tikicdn.com/ts/product/0b/33/6d/81a2c7d30367a06ed8aaaf0d02908e6f.jpg, https://salt.tikicdn.com/ts/product/2f/4a/f3/2de7b536a58ef08aef9bfee0dcc0a4c5.jpg, https://salt.tikicdn.com/ts/product/75/6c/24/80e4d4888e321c76bcda4255ac602a60.jpg","https://salt.tikicdn.com/cache/w1200/ts/product/76/53/7a/785319aa0c2324101fa71271902c3764.jpg, https://salt.tikicdn.com/cache/w1200/ts/product/15/e9/a6/057feb3395446f538d302bdf8ff7206d.jpg, https://salt.tikicdn.com/cache/w1200/ts/product/ed/2b/b1/a7dce3f2f915896455ec29e4493dfd0a.jpg, https://salt.tikicdn.com/cache/w1200/ts/product/0b/33/6d/81a2c7d30367a06ed8aaaf0d02908e6f.jpg, https://salt.tikicdn.com/cache/w1200/ts/product/2f/4a/f3/2de7b536a58ef08aef9bfee0dcc0a4c5.jpg, https://salt.tikicdn.com/cache/w1200/ts/product/75/6c/24/80e4d4888e321c76bcda4255ac602a60.jpg","https://salt.tikicdn.com/cache/w300/ts/product/76/53/7a/785319aa0c2324101fa71271902c3764.jpg, https://salt.tikicdn.com/cache/w300/ts/product/15/e9/a6/057feb3395446f538d302bdf8ff7206d.jpg, https://salt.tikicdn.com/cache/w300/ts/product/ed/2b/b1/a7dce3f2f915896455ec29e4493dfd0a.jpg, https://salt.tikicdn.com/cache/w300/ts/product/0b/33/6d/81a2c7d30367a06ed8aaaf0d02908e6f.jpg, https://salt.tikicdn.com/cache/w300/ts/product/2f/4a/f3/2de7b536a58ef08aef9bfee0dcc0a4c5.jpg, https://salt.tikicdn.com/cache/w300/ts/product/75/6c/24/80e4d4888e321c76bcda4255ac602a60.jpg","https://salt.tikicdn.com/cache/200x280/ts/product/76/53/7a/785319aa0c2324101fa71271902c3764.jpg, https://salt.tikicdn.com/cache/200x280/ts/product/15/e9/a6/057feb3395446f538d302bdf8ff7206d.jpg, https://salt.tikicdn.com/cache/200x280/ts/product/ed/2b/b1/a7dce3f2f915896455ec29e4493dfd0a.jpg, https://salt.tikicdn.com/cache/200x280/ts/product/0b/33/6d/81a2c7d30367a06ed8aaaf0d02908e6f.jpg, https://salt.tikicdn.com/cache/200x280/ts/product/2f/4a/f3/2de7b536a58ef08aef9bfee0dcc0a4c5.jpg, https://salt.tikicdn.com/cache/200x280/ts/product/75/6c/24/80e4d4888e321c76bcda4255ac602a60.jpg","https://salt.tikicdn.com/cache/200x280/ts/product/76/53/7a/785319aa0c2324101fa71271902c3764.jpg, https://salt.tikicdn.com/cache/200x280/ts/product/15/e9/a6/057feb3395446f538d302bdf8ff7206d.jpg, https://salt.tikicdn.com/cache/200x280/ts/product/ed/2b/b1/a7dce3f2f915896455ec29e4493dfd0a.jpg, https://salt.tikicdn.com/cache/200x280/ts/product/0b/33/6d/81a2c7d30367a06ed8aaaf0d02908e6f.jpg, https://salt.tikicdn.com/cache/200x280/ts/product/2f/4a/f3/2de7b536a58ef08aef9bfee0dcc0a4c5.jpg, https://salt.tikicdn.com/cache/200x280/ts/product/75/6c/24/80e4d4888e321c76bcda4255ac602a60.jpg",1000,0
275615462,Bút Dạ Quang Classic Pastel Maped - Màu Xanh Lá Non,23400,"    Bút Dạ Quang Classic Pastel Maped - Màu Xanh Lá Non   Sản phẩm là một trong những loại bút dạ quang có kiểu dáng thân dẹt to độc đáo.   Những ưu điểm nổi bật về màu mực và độ phản quang, lại ...","Bút Dạ Quang Classic Pastel Maped - Màu Xanh Lá Non Sản phẩm là một trong những loại bút dạ quang có kiểu dáng thân dẹt to độc đáo. Những ưu điểm nổi bật về màu mực và độ phản quang, lại không độc hại cho người dùng khiến mẫu bút này nhận được sự yêu chuộng của mọi đối tượng khách hàng. Bút được sử dụng để đánh dấu, tô sáng, highligth các thông tin quan trọng, là trợ thủ đắc lực trong quá trình học tập và làm việc của bạn. Màu mực tươi sáng, phản quang tốt Màu dạ quang mạnh, tươi sáng, nét tô hoặc đánh dấu đều và liên tục, không làm lem chữ khi tô chồng lên. Với thiết kế đầu lớn, độ phản quang tốt, mực dạ quang không để lại vết đen khi qua photocopy hay fax. Đây cũng chính là đặc điểm vượt trội của mẫu bút này. Bút phù hợp cho các loại giấy: giấy thường, giấy copy, giấy fax. Mực mau khô, lâu phai, dễ dàng rửa sạch khi vết mực dính ở tay và trên vải với xà phòng. Tiện lợi mang theo Với các tính năng nổi bật, kích thước vừa phải, bạn có thể dễ dàng cất giữ bút trong bóp viết, ba lô, túi xách, dễ dàng mang theo khi đi học, đi làm, tiện lợi sử dụng mọi lúc, mọi nơi. Chất lượng an toàn Với Bút Dạ Quang Classic PASTEL, bạn sẽ hoàn toàn yên tâm khi sử dụng vì sản phẩm dùng chất liệu mực an toàn, không độc hại, đảm bảo cho sức khỏe người tiêu dùng. Giá sản phẩm trên Tiki đã bao gồm thuế theo luật hiện hành. Bên cạnh đó, tuỳ vào loại sản phẩm, hình thức và địa chỉ giao hàng mà có thể phát sinh thêm chi phí khác như phí vận chuyển, phụ phí hàng cồng kềnh, thuế nhập khẩu (đối với đơn hàng giao từ nước ngoài có giá trị trên 1 triệu đồng).....",0,0,"https://salt.tikicdn.com/ts/product/ce/3d/8c/8d3996080740ccbe6d6fa3aff1138c08.jpg, https://salt.tikicdn.com/ts/product/15/e9/a6/de4b15ed87e6df98045ce0f7f863b8d4.jpg, https://salt.tikicdn.com/ts/product/ed/2b/b1/9f234095868bb872b6e1d5d4208a0d68.jpg, https://salt.tikicdn.com/ts/product/a9/ae/c4/ee2ca688c894757ccec0d270fe6d664b.jpg, https://salt.tikicdn.com/ts/product/9d/e0/17/c8e9a3f7b8f50f3c658e36236d1916c2.jpg, https://salt.tikicdn.com/ts/product/9f/85/30/f2aa7db8316082564cb041a047d2636c.jpg","https://salt.tikicdn.com/cache/w1200/ts/product/ce/3d/8c/8d3996080740ccbe6d6fa3aff1138c08.jpg, https://salt.tikicdn.com/cache/w1200/ts/product/15/e9/a6/de4b15ed87e6df98045ce0f7f863b8d4.jpg, https://salt.tikicdn.com/cache/w1200/ts/product/ed/2b/b1/9f234095868bb872b6e1d5d4208a0d68.jpg, https://salt.tikicdn.com/cache/w1200/ts/product/a9/ae/c4/ee2ca688c894757ccec0d270fe6d664b.jpg, https://salt.tikicdn.com/cache/w1200/ts/product/9d/e0/17/c8e9a3f7b8f50f3c658e36236d1916c2.jpg, https://salt.tikicdn.com/cache/w1200/ts/product/9f/85/30/f2aa7db8316082564cb041a047d2636c.jpg","https://salt.tikicdn.com/cache/w300/ts/product/ce/3d/8c/8d3996080740ccbe6d6fa3aff1138c08.jpg, https://salt.tikicdn.com/cache/w300/ts/product/15/e9/a6/de4b15ed87e6df98045ce0f7f863b8d4.jpg, https://salt.tikicdn.com/cache/w300/ts/product/ed/2b/b1/9f234095868bb872b6e1d5d4208a0d68.jpg, https://salt.tikicdn.com/cache/w300/ts/product/a9/ae/c4/ee2ca688c894757ccec0d270fe6d664b.jpg, https://salt.tikicdn.com/cache/w300/ts/product/9d/e0/17/c8e9a3f7b8f50f3c658e36236d1916c2.jpg, https://salt.tikicdn.com/cache/w300/ts/product/9f/85/30/f2aa7db8316082564cb041a047d2636c.jpg","https://salt.tikicdn.com/cache/200x280/ts/product/ce/3d/8c/8d3996080740ccbe6d6fa3aff1138c08.jpg, https://salt.tikicdn.com/cache/200x280/ts/product/15/e9/a6/de4b15ed87e6df98045ce0f7f863b8d4.jpg, https://salt.tikicdn.com/cache/200x280/ts/product/ed/2b/b1/9f234095868bb872b6e1d5d4208a0d68.jpg, https://salt.tikicdn.com/cache/200x280/ts/product/a9/ae/c4/ee2ca688c894757ccec0d270fe6d664b.jpg, https://salt.tikicdn.com/cache/200x280/ts/product/9d/e0/17/c8e9a3f7b8f50f3c658e36236d1916c2.jpg, https://salt.tikicdn.com/cache/200x280/ts/product/9f/85/30/f2aa7db8316082564cb041a047d2636c.jpg","https://salt.tikicdn.com/cache/200x280/ts/product/ce/3d/8c/8d3996080740ccbe6d6fa3aff1138c08.jpg, https://salt.tikicdn.com/cache/200x280/ts/product/15/e9/a6/de4b15ed87e6df98045ce0f7f863b8d4.jpg, https://salt.tikicdn.com/cache/200x280/ts/product/ed/2b/b1/9f234095868bb872b6e1d5d4208a0d68.jpg, https://salt.tikicdn.com/cache/200x280/ts/product/a9/ae/c4/ee2ca688c894757ccec0d270fe6d664b.jpg, https://salt.tikicdn.com/cache/200x280/ts/product/9d/e0/17/c8e9a3f7b8f50f3c658e36236d1916c2.jpg, https://salt.tikicdn.com/cache/200x280/ts/product/9f/85/30/f2aa7db8316082564cb041a047d2636c.jpg",1000,0
275490599,Bút Dạ Quang Boss Mini - Stabilo HL07-31 - Màu Xanh Dương,40400,"    Bút Dạ Quang Boss Mini - Stabilo HL07   Sản phẩm là vật dụng không thể thiếu trong văn phòng của bạn. Với bút Dạ Quang Stabilo Boss Mini HL07, công việc của bạn sẽ suôn sẻ, trôi chảy hơn.   M...","Bút Dạ Quang Boss Mini - Stabilo HL07 Sản phẩm là vật dụng không thể thiếu trong văn phòng của bạn. Với bút Dạ Quang Stabilo Boss Mini HL07, công việc của bạn sẽ suôn sẻ, trôi chảy hơn. Màu sắc nổi bật : Sở hữu thiết kế thông minh, bút cầm khá chắc tay và dễ sử dụng giúp đánh dấu những phần quan trọng, cho bạn ghi nhớ dễ dàng. Bút vừa có thể trang trí, đánh dấu và có khả năng phát quang nên giúp ích rất nhiều cho bạn. An toàn, tiết kiệm : Bút có thể bơm mực giúp tiết kiệm chi phí, mực dạng nước dùng cho giấy thường, giấy  đặc biệt không để lại dấu vết khi muốn photo, fax vô cùng tiện lợi. Sử dụng bởi các nguyên liệu tốt cho môi trường. Mực không chứa độc tố nên rất an toàn cho sức khỏe người tiêu dùng. Nhỏ gọn dễ mang theo : Với kích thuớc nhỏ gọn, bạn có thể dễ dàng cất giữ bút trong ba lô và mang theo khi đi học, đi làm. Bạn sẽ hoàn toàn yên tâm với chất lượng của bút Dạ Quang Stabilo Boss Mini HL07. Giá sản phẩm trên Tiki đã bao gồm thuế theo luật hiện hành. Bên cạnh đó, tuỳ vào loại sản phẩm, hình thức và địa chỉ giao hàng mà có thể phát sinh thêm chi phí khác như phí vận chuyển, phụ phí hàng cồng kềnh, thuế nhập khẩu (đối với đơn hàng giao từ nước ngoài có giá trị trên 1 triệu đồng).....",0,0,"https://salt.tikicdn.com/ts/product/b2/d1/dc/7b997bd1c7b5157fe4321a04d9f36ac8.jpg, https://salt.tikicdn.com/ts/product/ac/ed/c6/952b48e74b0aac3bbe8975cfe0af3fa5.jpg, https://salt.tikicdn.com/ts/product/a7/53/93/1a60e9c017b75822e149777dc038e977.jpg, https://salt.tikicdn.com/ts/product/0c/1e/5d/ab92cd90ac2d7d98e4fa5881d932db37.jpg, https://salt.tikicdn.com/ts/product/d5/b2/c3/d7d6b75691b812891cfe616052f85748.jpg","https://salt.tikicdn.com/cache/w1200/ts/product/b2/d1/dc/7b997bd1c7b5157fe4321a04d9f36ac8.jpg, https://salt.tikicdn.com/cache/w1200/ts/product/ac/ed/c6/952b48e74b0aac3bbe8975cfe0af3fa5.jpg, https://salt.tikicdn.com/cache/w1200/ts/product/a7/53/93/1a60e9c017b75822e149777dc038e977.jpg, https://salt.tikicdn.com/cache/w1200/ts/product/0c/1e/5d/ab92cd90ac2d7d98e4fa5881d932db37.jpg, https://salt.tikicdn.com/cache/w1200/ts/product/d5/b2/c3/d7d6b75691b812891cfe616052f85748.jpg","https://salt.tikicdn.com/cache/w300/ts/product/b2/d1/dc/7b997bd1c7b5157fe4321a04d9f36ac8.jpg, https://salt.tikicdn.com/cache/w300/ts/product/ac/ed/c6/952b48e74b0aac3bbe8975cfe0af3fa5.jpg, https://salt.tikicdn.com/cache/w300/ts/product/a7/53/93/1a60e9c017b75822e149777dc038e977.jpg, https://salt.tikicdn.com/cache/w300/ts/product/0c/1e/5d/ab92cd90ac2d7d98e4fa5881d932db37.jpg, https://salt.tikicdn.com/cache/w300/ts/product/d5/b2/c3/d7d6b75691b812891cfe616052f85748.jpg","https://salt.tikicdn.com/cache/200x280/ts/product/b2/d1/dc/7b997bd1c7b5157fe4321a04d9f36ac8.jpg, https://salt.tikicdn.com/cache/200x280/ts/product/ac/ed/c6/952b48e74b0aac3bbe8975cfe0af3fa5.jpg, https://salt.tikicdn.com/cache/200x280/ts/product/a7/53/93/1a60e9c017b75822e149777dc038e977.jpg, https://salt.tikicdn.com/cache/200x280/ts/product/0c/1e/5d/ab92cd90ac2d7d98e4fa5881d932db37.jpg, https://salt.tikicdn.com/cache/200x280/ts/product/d5/b2/c3/d7d6b75691b812891cfe616052f85748.jpg","https://salt.tikicdn.com/cache/200x280/ts/product/b2/d1/dc/7b997bd1c7b5157fe4321a04d9f36ac8.jpg, https://salt.tikicdn.com/cache/200x280/ts/product/ac/ed/c6/952b48e74b0aac3bbe8975cfe0af3fa5.jpg, https://salt.tikicdn.com/cache/200x280/ts/product/a7/53/93/1a60e9c017b75822e149777dc038e977.jpg, https://salt.tikicdn.com/cache/200x280/ts/product/0c/1e/5d/ab92cd90ac2d7d98e4fa5881d932db37.jpg, https://salt.tikicdn.com/cache/200x280/ts/product/d5/b2/c3/d7d6b75691b812891cfe616052f85748.jpg",1000,0
