id,name,price,short_description,description,rating_average,review_count,image_base_url,image_large_url,image_medium_url,image_small_url,image_thumbnail_url,stock,quantity_sold
277377716,LEGO City: Happy to Help! (with Harl Hubbs minifigure),239000,This fun-filled activity book follows the misadventures ...,"This fun-filled activity book follows the misadventures Giá sản phẩm trên Tiki đã bao gồm thuế theo luật hiện hành. Bên cạnh đó, tuỳ vào loại sản phẩm, hình thức và địa chỉ giao hàng mà có thể phát sinh thêm chi phí khác như phí vận chuyển, phụ phí hàng cồng kềnh, thuế nhập khẩu (đối với đơn hàng giao từ nước ngoài có giá trị trên 1 triệu đồng).....",0,0,https://salt.tikicdn.com/ts/product/c8/97/f5/bebbf7485d7422f25bc54358297d87e4.jpg,https://salt.tikicdn.com/cache/w1200/ts/product/c8/97/f5/bebbf7485d7422f25bc54358297d87e4.jpg,https://salt.tikicdn.com/cache/w300/ts/product/c8/97/f5/bebbf7485d7422f25bc54358297d87e4.jpg,https://salt.tikicdn.com/cache/200x280/ts/product/c8/97/f5/bebbf7485d7422f25bc54358297d87e4.jpg,https://salt.tikicdn.com/cache/200x280/ts/product/c8/97/f5/bebbf7485d7422f25bc54358297d87e4.jpg,1000,0
274124145,Early Years Wipe-Clean Starting To Add,179000,"This fun book is a perfect introduction to addition and helps little children to develop pen control. Count animals at the zoo, create pairs at a picnic, write number sequences and lots more. Dur...","This fun book is a perfect introduction to addition and helps little children to develop pen control. Count animals at the zoo, create pairs at a picnic, write number sequences and lots more. Durable, wipe-clean pages mean children can practise again and again, and there are helpful notes and tips for grown-ups at the back. Giá sản phẩm trên Tiki đã bao gồm thuế theo luật hiện hành. Bên cạnh đó, tuỳ vào loại sản phẩm, hình thức và địa chỉ giao hàng mà có thể phát sinh thêm chi phí khác như phí vận chuyển, phụ phí hàng cồng kềnh, thuế nhập khẩu (đối với đơn hàng giao từ nước ngoài có giá trị trên 1 triệu đồng).....",0,0,https://salt.tikicdn.com/ts/product/59/a2/02/f490207b8d7282252c9a2d8a3557f72d.jpg,https://salt.tikicdn.com/cache/w1200/ts/product/59/a2/02/f490207b8d7282252c9a2d8a3557f72d.jpg,https://salt.tikicdn.com/cache/w300/ts/product/59/a2/02/f490207b8d7282252c9a2d8a3557f72d.jpg,https://salt.tikicdn.com/cache/200x280/ts/product/59/a2/02/f490207b8d7282252c9a2d8a3557f72d.jpg,https://salt.tikicdn.com/cache/200x280/ts/product/59/a2/02/f490207b8d7282252c9a2d8a3557f72d.jpg,1000,0
274123749,Early Years Wipe-Clean Numbers 1 to 10,179000,"Little ones will enjoy learning the number sequence 1 to 10 with this fun activity book. Count vegetables in a garden, draw the route around a mini golf course, trace numbers on hot air balloons ...","Little ones will enjoy learning the number sequence 1 to 10 with this fun activity book. Count vegetables in a garden, draw the route around a mini golf course, trace numbers on hot air balloons and lots more. Durable, wipe-clean pages mean children can practise again and again, and there are helpful notes and tips for grown-ups at the back. Giá sản phẩm trên Tiki đã bao gồm thuế theo luật hiện hành. Bên cạnh đó, tuỳ vào loại sản phẩm, hình thức và địa chỉ giao hàng mà có thể phát sinh thêm chi phí khác như phí vận chuyển, phụ phí hàng cồng kềnh, thuế nhập khẩu (đối với đơn hàng giao từ nước ngoài có giá trị trên 1 triệu đồng).....",0,0,https://salt.tikicdn.com/ts/product/4f/75/e6/2bc0084e15612813f928a5ae28978af3.jpg,https://salt.tikicdn.com/cache/w1200/ts/product/4f/75/e6/2bc0084e15612813f928a5ae28978af3.jpg,https://salt.tikicdn.com/cache/w300/ts/product/4f/75/e6/2bc0084e15612813f928a5ae28978af3.jpg,https://salt.tikicdn.com/cache/200x280/ts/product/4f/75/e6/2bc0084e15612813f928a5ae28978af3.jpg,https://salt.tikicdn.com/cache/200x280/ts/product/4f/75/e6/2bc0084e15612813f928a5ae28978af3.jpg,1000,0
274123675,Early Years Wipe-Clean Numbers 1 to 20,179000,"Perfect preparation for starting school, this fun book helps children develop pen control and practise essential maths skills taught in the Early Years Foundation Stage. Engaging activities and f...","Perfect preparation for starting school, this fun book helps children develop pen control and practise essential maths skills taught in the Early Years Foundation Stage. Engaging activities and friendly animals help build confidence in counting to 20, number recognition and number formation. Parents' notes suggest how to support children's learning, and a fold-out number formation page can be left open as children work through the book. Giá sản phẩm trên Tiki đã bao gồm thuế theo luật hiện hành. Bên cạnh đó, tuỳ vào loại sản phẩm, hình thức và địa chỉ giao hàng mà có thể phát sinh thêm chi phí khác như phí vận chuyển, phụ phí hàng cồng kềnh, thuế nhập khẩu (đối với đơn hàng giao từ nước ngoài có giá trị trên 1 triệu đồng).....",0,0,https://salt.tikicdn.com/ts/product/6e/91/9c/9289fdbd4ca6b6a99b0406513bd9a5bc.jpg,https://salt.tikicdn.com/cache/w1200/ts/product/6e/91/9c/9289fdbd4ca6b6a99b0406513bd9a5bc.jpg,https://salt.tikicdn.com/cache/w300/ts/product/6e/91/9c/9289fdbd4ca6b6a99b0406513bd9a5bc.jpg,https://salt.tikicdn.com/cache/200x280/ts/product/6e/91/9c/9289fdbd4ca6b6a99b0406513bd9a5bc.jpg,https://salt.tikicdn.com/cache/200x280/ts/product/6e/91/9c/9289fdbd4ca6b6a99b0406513bd9a5bc.jpg,1000,0
274122710,Early Years Wipe-Clean First Sums,179000,Lively illustrations and friendly characters introduce young children to simple addition and subtraction activities. There are numbers and pictures to trace over on every page to develop pen cont...,"Lively illustrations and friendly characters introduce young children to simple addition and subtraction activities. There are numbers and pictures to trace over on every page to develop pen control and early maths skills while keeping learning fun. Giá sản phẩm trên Tiki đã bao gồm thuế theo luật hiện hành. Bên cạnh đó, tuỳ vào loại sản phẩm, hình thức và địa chỉ giao hàng mà có thể phát sinh thêm chi phí khác như phí vận chuyển, phụ phí hàng cồng kềnh, thuế nhập khẩu (đối với đơn hàng giao từ nước ngoài có giá trị trên 1 triệu đồng).....",0,0,https://salt.tikicdn.com/ts/product/61/71/db/e8a9e2268f9c90003c6c10899ddf627c.jpg,https://salt.tikicdn.com/cache/w1200/ts/product/61/71/db/e8a9e2268f9c90003c6c10899ddf627c.jpg,https://salt.tikicdn.com/cache/w300/ts/product/61/71/db/e8a9e2268f9c90003c6c10899ddf627c.jpg,https://salt.tikicdn.com/cache/200x280/ts/product/61/71/db/e8a9e2268f9c90003c6c10899ddf627c.jpg,https://salt.tikicdn.com/cache/200x280/ts/product/61/71/db/e8a9e2268f9c90003c6c10899ddf627c.jpg,1000,0
274122389,Activity Book: Starting School,199000,"This friendly write-in book is packed full of engaging activities to prepare children for starting school. Lively illustrations and cute animal characters keep learning fun, with activities speci...","This friendly write-in book is packed full of engaging activities to prepare children for starting school. Lively illustrations and cute animal characters keep learning fun, with activities specifically designed to appeal to 3-5 year olds. Children can trace, draw and write as they discover all the things they need to know about school. Giá sản phẩm trên Tiki đã bao gồm thuế theo luật hiện hành. Bên cạnh đó, tuỳ vào loại sản phẩm, hình thức và địa chỉ giao hàng mà có thể phát sinh thêm chi phí khác như phí vận chuyển, phụ phí hàng cồng kềnh, thuế nhập khẩu (đối với đơn hàng giao từ nước ngoài có giá trị trên 1 triệu đồng).....",0,0,https://salt.tikicdn.com/ts/product/ef/99/28/a0dc9cf3440d865f5a6b3c253be0b2ac.jpg,https://salt.tikicdn.com/cache/w1200/ts/product/ef/99/28/a0dc9cf3440d865f5a6b3c253be0b2ac.jpg,https://salt.tikicdn.com/cache/w300/ts/product/ef/99/28/a0dc9cf3440d865f5a6b3c253be0b2ac.jpg,https://salt.tikicdn.com/cache/200x280/ts/product/ef/99/28/a0dc9cf3440d865f5a6b3c253be0b2ac.jpg,https://salt.tikicdn.com/cache/200x280/ts/product/ef/99/28/a0dc9cf3440d865f5a6b3c253be0b2ac.jpg,1000,0
270997254,Wipe Clean Activities: Unicorn Magic,149000,"Wipe Clean Activities: Unicorn Magic Packed with fun activities and stickers to keep young children interested and entertained through summer day, rainy days, long journeys and holidays. With spot t...","Wipe Clean Activities: Unicorn Magic Packed with fun activities and stickers to keep young children interested and entertained through summer day, rainy days, long journeys and holidays. With spot the differences, mazes, games to play, doodles, stickers and much more, kids can have hours of fun! Giá sản phẩm trên Tiki đã bao gồm thuế theo luật hiện hành. Bên cạnh đó, tuỳ vào loại sản phẩm, hình thức và địa chỉ giao hàng mà có thể phát sinh thêm chi phí khác như phí vận chuyển, phụ phí hàng cồng kềnh, thuế nhập khẩu (đối với đơn hàng giao từ nước ngoài có giá trị trên 1 triệu đồng).....",0,0,https://salt.tikicdn.com/ts/product/1c/98/89/a85c123ed78d600d2611ca2e9d92f297.jpg,https://salt.tikicdn.com/cache/w1200/ts/product/1c/98/89/a85c123ed78d600d2611ca2e9d92f297.jpg,https://salt.tikicdn.com/cache/w300/ts/product/1c/98/89/a85c123ed78d600d2611ca2e9d92f297.jpg,https://salt.tikicdn.com/cache/200x280/ts/product/1c/98/89/a85c123ed78d600d2611ca2e9d92f297.jpg,https://salt.tikicdn.com/cache/200x280/ts/product/1c/98/89/a85c123ed78d600d2611ca2e9d92f297.jpg,1000,0
267340640,How To Draw: Includes Wipe-Clean Pen,219000,"How To Draw: Includes Wipe-Clean PenKids will love to learn how to copy, draw, trace, and more with this fabulously creative activity book. The helpful steps and tips inside encourage young artists t...","How To Draw: Includes Wipe-Clean Pen Kids will love to learn how to copy, draw, trace, and more with this fabulously creative activity book. The helpful steps and tips inside encourage young artists to draw a range of familiar objects and animals using simple shapes and outlines. Includes 24 pull-out pages of tracing paper, and 32 pull-out pages of colored craft paper to encourage individual creativity. Giá sản phẩm trên Tiki đã bao gồm thuế theo luật hiện hành. Bên cạnh đó, tuỳ vào loại sản phẩm, hình thức và địa chỉ giao hàng mà có thể phát sinh thêm chi phí khác như phí vận chuyển, phụ phí hàng cồng kềnh, thuế nhập khẩu (đối với đơn hàng giao từ nước ngoài có giá trị trên 1 triệu đồng).....",0,0,https://salt.tikicdn.com/ts/product/63/61/e2/d1f59c31712ecc69b082f4caab432091.jpg,https://salt.tikicdn.com/cache/w1200/ts/product/63/61/e2/d1f59c31712ecc69b082f4caab432091.jpg,https://salt.tikicdn.com/cache/w300/ts/product/63/61/e2/d1f59c31712ecc69b082f4caab432091.jpg,https://salt.tikicdn.com/cache/200x280/ts/product/63/61/e2/d1f59c31712ecc69b082f4caab432091.jpg,https://salt.tikicdn.com/cache/200x280/ts/product/63/61/e2/d1f59c31712ecc69b082f4caab432091.jpg,1000,0
267338692,Uppercase Alphabet: Wipe Clean Workbooks,189000,"Uppercase Alphabet: Wipe Clean WorkbooksWipe clean workbook on uppercase letters, full of exercises and activities to help prepare children aged three and over for school....","Uppercase Alphabet: Wipe Clean Workbooks Wipe clean workbook on uppercase letters, full of exercises and activities to help prepare children aged three and over for school. Giá sản phẩm trên Tiki đã bao gồm thuế theo luật hiện hành. Bên cạnh đó, tuỳ vào loại sản phẩm, hình thức và địa chỉ giao hàng mà có thể phát sinh thêm chi phí khác như phí vận chuyển, phụ phí hàng cồng kềnh, thuế nhập khẩu (đối với đơn hàng giao từ nước ngoài có giá trị trên 1 triệu đồng).....",0,0,https://salt.tikicdn.com/ts/product/98/34/63/2844866e8ecb2da863322fcc53a8bf4a.jpg,https://salt.tikicdn.com/cache/w1200/ts/product/98/34/63/2844866e8ecb2da863322fcc53a8bf4a.jpg,https://salt.tikicdn.com/cache/w300/ts/product/98/34/63/2844866e8ecb2da863322fcc53a8bf4a.jpg,https://salt.tikicdn.com/cache/200x280/ts/product/98/34/63/2844866e8ecb2da863322fcc53a8bf4a.jpg,https://salt.tikicdn.com/cache/200x280/ts/product/98/34/63/2844866e8ecb2da863322fcc53a8bf4a.jpg,1000,0
262799094,First Words,129000,"First Words First Words is packed full of charming illustrations and simple labels to encourage children to look, point and learn. With added number, shape, colour, quizzes and more, this book is no...","First Words First Words is packed full of charming illustrations and simple labels to encourage children to look, point and learn. With added number, shape, colour, quizzes and more, this book is not only great for encouraging first words and word association, but for preparing little minds for a lifetime of learning and introducing important everyday words and concepts. Giá sản phẩm trên Tiki đã bao gồm thuế theo luật hiện hành. Bên cạnh đó, tuỳ vào loại sản phẩm, hình thức và địa chỉ giao hàng mà có thể phát sinh thêm chi phí khác như phí vận chuyển, phụ phí hàng cồng kềnh, thuế nhập khẩu (đối với đơn hàng giao từ nước ngoài có giá trị trên 1 triệu đồng).....",0,0,https://salt.tikicdn.com/ts/product/a7/56/3c/1cfc246b30a8bdc28c0cbebb89746be6.jpg,https://salt.tikicdn.com/cache/w1200/ts/product/a7/56/3c/1cfc246b30a8bdc28c0cbebb89746be6.jpg,https://salt.tikicdn.com/cache/w300/ts/product/a7/56/3c/1cfc246b30a8bdc28c0cbebb89746be6.jpg,https://salt.tikicdn.com/cache/200x280/ts/product/a7/56/3c/1cfc246b30a8bdc28c0cbebb89746be6.jpg,https://salt.tikicdn.com/cache/200x280/ts/product/a7/56/3c/1cfc246b30a8bdc28c0cbebb89746be6.jpg,1000,0
258314181,Peppa Pig: Practise with Peppa: Wipe-Clean First Numbers,99000,Phát triển và thực hành các kỹ năng số đầu tiên với Peppa Pig và những người bạn trong cuốn sách hoạt động lau sạch đầy màu sắc này. Trẻ em sẽ học cách viết các số từ 1-10 và bắt đầu liên kết các từ s...,"Phát triển và thực hành các kỹ năng số đầu tiên với Peppa Pig và những người bạn trong cuốn sách hoạt động lau sạch đầy màu sắc này. Trẻ em sẽ học cách viết các số từ 1-10 và bắt đầu liên kết các từ số với các chữ số (một = 1) thông qua một loạt các hoạt động vui nhộn theo chủ đề Peppa. Lý tưởng cho những độc giả nhỏ tuổi đang bắt đầu đi học và đang phát triển các kỹ năng viết số đầu tiên và kiểm soát bút chì. Trẻ có thể lau sạch trang và thực hành lặp đi lặp lại. Bao gồm một cây bút miễn phí. Để những học viên tự tin hơn, tại sao không thử Thực hành với Peppa: Wipe-Clean First Counting để thực hành các số đến 20? Giá sản phẩm trên Tiki đã bao gồm thuế theo luật hiện hành. Bên cạnh đó, tuỳ vào loại sản phẩm, hình thức và địa chỉ giao hàng mà có thể phát sinh thêm chi phí khác như phí vận chuyển, phụ phí hàng cồng kềnh, thuế nhập khẩu (đối với đơn hàng giao từ nước ngoài có giá trị trên 1 triệu đồng).....",0,0,https://salt.tikicdn.com/ts/product/f3/d8/49/76e35a6958aeca5dc7df06aed169d0e4.jpg,https://salt.tikicdn.com/cache/w1200/ts/product/f3/d8/49/76e35a6958aeca5dc7df06aed169d0e4.jpg,https://salt.tikicdn.com/cache/w300/ts/product/f3/d8/49/76e35a6958aeca5dc7df06aed169d0e4.jpg,https://salt.tikicdn.com/cache/200x280/ts/product/f3/d8/49/76e35a6958aeca5dc7df06aed169d0e4.jpg,https://salt.tikicdn.com/cache/200x280/ts/product/f3/d8/49/76e35a6958aeca5dc7df06aed169d0e4.jpg,1000,0
155786841,Sách tẩy xóa tiếng Anh- Ready for Writting 3-5 age,292000,"THÔNG TIN SÁCH Loại bìa: Bìa cứng Số trang: 24Kích thước: 216 x 276 x 18mmPerfect preparation for starting school, this fun book helps children develop pen control and practise essential pre-writin...","THÔNG TIN SÁCH Loại bìa: Bìa cứng Số trang: 24 Kích thước: 216 x 276 x 18mm Perfect preparation for starting school, this fun book helps children develop pen control and practise essential pre-writing and writing skills taught in the Early Years Foundation Stage. On every page there are pictures and letters to trace over with the special pen. The engaging activities and friendly animals help build confidence in writing letter shapes and the correct lower-case letter formations. Chuẩn bị hoàn hảo cho việc bắt đầu đi học, cuốn sách vui nhộn này giúp trẻ phát triển khả năng điều khiển bút và thực hành các kỹ năng viết và viết trước khi viết cần thiết được dạy trong Giai đoạn Dự bị Mầm non. Trên mỗi trang có hình ảnh và chữ cái để theo dõi bằng bút đặc biệt. Các hoạt động hấp dẫn và động vật thân thiện giúp xây dựng sự tự tin khi viết các hình dạng chữ cái và các dạng chữ cái viết thường đúng. Giá sản phẩm trên Tiki đã bao gồm thuế theo luật hiện hành. Bên cạnh đó, tuỳ vào loại sản phẩm, hình thức và địa chỉ giao hàng mà có thể phát sinh thêm chi phí khác như phí vận chuyển, phụ phí hàng cồng kềnh, thuế nhập khẩu (đối với đơn hàng giao từ nước ngoài có giá trị trên 1 triệu đồng).....",0,0,https://salt.tikicdn.com/ts/product/61/f4/af/3c2417b37cdfd53175150f3637bd4eca.png,https://salt.tikicdn.com/cache/w1200/ts/product/61/f4/af/3c2417b37cdfd53175150f3637bd4eca.png,https://salt.tikicdn.com/cache/w300/ts/product/61/f4/af/3c2417b37cdfd53175150f3637bd4eca.png,https://salt.tikicdn.com/cache/200x280/ts/product/61/f4/af/3c2417b37cdfd53175150f3637bd4eca.png,https://salt.tikicdn.com/cache/200x280/ts/product/61/f4/af/3c2417b37cdfd53175150f3637bd4eca.png,1000,0
116148015,Sách tẩy xóa tiếng Anh - Wipe-Clean: First Pen Control,213000, Wipe-Clean: First Pen ControlMột cuốn sách tẩy - xóa gồm các hoạt động vui chơi giúp trẻ mầm non thực hành cách điều khiển bút - điều cần thiết cho việc học viết. Trẻ em có thể lần theo các dấu chấm...,"Wipe-Clean: First Pen Control Một cuốn sách tẩy - xóa gồm các hoạt động vui chơi giúp trẻ mầm non thực hành cách điều khiển bút - điều cần thiết cho việc học viết. Trẻ em có thể lần theo các dấu chấm trên mỗi trang để vẽ thành trì lâu đài, thêm câu chuyện về những chú khỉ táo tợn vào cảnh rừng rậm hoặc hoàn thành một người tuyết lạnh giá. Hoàn hảo cho trẻ em sắp bắt đầu đi học, những người được mong đợi có thể cầm bút và viết tên của chính mình trước khi làm như vậy. Các trang sạch và bút đặc biệt cho phép trẻ em quay lại các trang yêu thích của chúng nhiều lần. A wipe-clean book of fun activities to help preschool children practise their pen control – essential for learning to write. Children can trace over the dots on each page to draw a castle stronghold, add cheeky monkeys’ tales to a jungle scene or complete a frosty snowman. Perfect for children who are about to start school, who are expected to be able to hold a pen and write their own name before they do so. The wipe-clean pages and special pen enable children to return to their favourite pages again and again. Giá sản phẩm trên Tiki đã bao gồm thuế theo luật hiện hành. Bên cạnh đó, tuỳ vào loại sản phẩm, hình thức và địa chỉ giao hàng mà có thể phát sinh thêm chi phí khác như phí vận chuyển, phụ phí hàng cồng kềnh, thuế nhập khẩu (đối với đơn hàng giao từ nước ngoài có giá trị trên 1 triệu đồng).....",0,0,https://salt.tikicdn.com/ts/product/94/31/48/932c7ba382ed8ce83ab353238bcbea8d.jpg,https://salt.tikicdn.com/cache/w1200/ts/product/94/31/48/932c7ba382ed8ce83ab353238bcbea8d.jpg,https://salt.tikicdn.com/cache/w300/ts/product/94/31/48/932c7ba382ed8ce83ab353238bcbea8d.jpg,https://salt.tikicdn.com/cache/200x280/ts/product/94/31/48/932c7ba382ed8ce83ab353238bcbea8d.jpg,https://salt.tikicdn.com/cache/200x280/ts/product/94/31/48/932c7ba382ed8ce83ab353238bcbea8d.jpg,1000,0
116148000,Sách tẩy xóa tiếng Anh - Wipe-Clean Pen Control,213000,"Wipe-Clean Pen ControlMột cuốn sách tẩy - xóa với các hoạt động vẽ và dấu vết để giúp trẻ thực hành cầm và thao tác với bút. Những đứa trẻ nhỏ có thể giải quyết mê cung cỗ máy quái vật, tham gia các ...","Wipe-Clean Pen Control Một cuốn sách tẩy - xóa với các hoạt động vẽ và dấu vết để giúp trẻ thực hành cầm và thao tác với bút. Những đứa trẻ nhỏ có thể giải quyết mê cung cỗ máy quái vật, tham gia các dấu chấm trong một chuyến dã ngoại và lần theo các vòng tròn, vòng lặp và vòng xoáy do pháo hoa tạo ra trên bầu trời. Với một cây bút lau đặc biệt, do đó những sai lầm dễ dàng sửa chữa và các hoạt động có thể được thực hiện lại nhiều lần. Một cách thú vị để phát triển kỹ năng điều khiển bút cần thiết cho việc học viết. A wipe-clean book with drawing and tracing activities to help children practise holding and manipulating a pen. Little children can solve the monster machine maze, join the dots in a picnic and trace over the circles, loops and swirls made by fireworks in the sky. With a special wipe-clean pen so mistakes are easy to correct and the activities can be done again and again. A fun way to develop the pen control skills that are essential for learning to write. Giá sản phẩm trên Tiki đã bao gồm thuế theo luật hiện hành. Bên cạnh đó, tuỳ vào loại sản phẩm, hình thức và địa chỉ giao hàng mà có thể phát sinh thêm chi phí khác như phí vận chuyển, phụ phí hàng cồng kềnh, thuế nhập khẩu (đối với đơn hàng giao từ nước ngoài có giá trị trên 1 triệu đồng).....",0,0,https://salt.tikicdn.com/ts/product/eb/bb/3f/c86b895097c43b049703b57e04962177.jpg,https://salt.tikicdn.com/cache/w1200/ts/product/eb/bb/3f/c86b895097c43b049703b57e04962177.jpg,https://salt.tikicdn.com/cache/w300/ts/product/eb/bb/3f/c86b895097c43b049703b57e04962177.jpg,https://salt.tikicdn.com/cache/200x280/ts/product/eb/bb/3f/c86b895097c43b049703b57e04962177.jpg,https://salt.tikicdn.com/cache/200x280/ts/product/eb/bb/3f/c86b895097c43b049703b57e04962177.jpg,1000,0
116144305,Sách tẩy xóa tiếng Anh - Wipe-Clean: Doodles,213000,"Wipe-Clean: DoodlesTrẻ nhỏ sẽ rất vui vẻ khi vẽ nguệch ngoạc và vẽ những cảnh được minh họa rực rỡ trong cuốn sách sạch này. Có các mẫu để vẽ nguệch ngoạc và các cảnh để hoàn thành, bao gồm cả quái v...","Wipe-Clean: Doodles Trẻ nhỏ sẽ rất vui vẻ khi vẽ nguệch ngoạc và vẽ những cảnh được minh họa rực rỡ trong cuốn sách sạch này. Có các mẫu để vẽ nguệch ngoạc và các cảnh để hoàn thành, bao gồm cả quái vật để tạo và bánh để trang trí. Một cách thú vị và hấp dẫn cho trẻ nhỏ để học và phát triển khả năng điều khiển bút. Mỗi trang đều được lau sạch để trẻ em có thể vẽ nguệch ngoạc trên chúng nhiều lần bằng bút đặc biệt để đảm bảo niềm vui lâu dài. Young children will have great fun doodling and drawing on the brightly illustrated scenes in this wipe-clean book. There are patterns to doodle and scenes to complete, including monsters to create and cakes to decorate. A fun and engaging way for young children to learn and develop pen control. Each page is wipe-clean so that children can doodle on them again and again with the special pen to ensure enduring fun. Giá sản phẩm trên Tiki đã bao gồm thuế theo luật hiện hành. Bên cạnh đó, tuỳ vào loại sản phẩm, hình thức và địa chỉ giao hàng mà có thể phát sinh thêm chi phí khác như phí vận chuyển, phụ phí hàng cồng kềnh, thuế nhập khẩu (đối với đơn hàng giao từ nước ngoài có giá trị trên 1 triệu đồng).....",0,0,https://salt.tikicdn.com/ts/product/7d/f9/28/026e3c7de51300c1b7c85ec140d4a06a.jpg,https://salt.tikicdn.com/cache/w1200/ts/product/7d/f9/28/026e3c7de51300c1b7c85ec140d4a06a.jpg,https://salt.tikicdn.com/cache/w300/ts/product/7d/f9/28/026e3c7de51300c1b7c85ec140d4a06a.jpg,https://salt.tikicdn.com/cache/200x280/ts/product/7d/f9/28/026e3c7de51300c1b7c85ec140d4a06a.jpg,https://salt.tikicdn.com/cache/200x280/ts/product/7d/f9/28/026e3c7de51300c1b7c85ec140d4a06a.jpg,1000,0
