id,name,price,short_description,description,rating_average,review_count,image_base_url,image_large_url,image_medium_url,image_small_url,image_thumbnail_url,stock,quantity_sold
274120182,Wipe Clean Workbook: Pen Control and Tracing,199000,"Teaching your child how to hold and use a pen is a key skill that you can encourage with this wipe-clean workbook from Roger Priddy.On each page there is a simple activity to do, and the exercises bu...","Teaching your child how to hold and use a pen is a key skill that you can encourage with this wipe-clean workbook from Roger Priddy. On each page there is a simple activity to do, and the exercises build in complexity throughout the book. Included with the book is a special pen, and the wipe-clean pages enable children to practice over and over to improve their pen control and writing skills. With bright photographic images to engage and encourage, this early-learning workbook will support your child as they prepare for school. Giá sản phẩm trên Tiki đã bao gồm thuế theo luật hiện hành. Bên cạnh đó, tuỳ vào loại sản phẩm, hình thức và địa chỉ giao hàng mà có thể phát sinh thêm chi phí khác như phí vận chuyển, phụ phí hàng cồng kềnh, thuế nhập khẩu (đối với đơn hàng giao từ nước ngoài có giá trị trên 1 triệu đồng).....",0,0,https://salt.tikicdn.com/ts/product/10/e3/66/0d082cc2fc2d65b529b368dd3c23f752.jpg,https://salt.tikicdn.com/cache/w1200/ts/product/10/e3/66/0d082cc2fc2d65b529b368dd3c23f752.jpg,https://salt.tikicdn.com/cache/w300/ts/product/10/e3/66/0d082cc2fc2d65b529b368dd3c23f752.jpg,https://salt.tikicdn.com/cache/200x280/ts/product/10/e3/66/0d082cc2fc2d65b529b368dd3c23f752.jpg,https://salt.tikicdn.com/cache/200x280/ts/product/10/e3/66/0d082cc2fc2d65b529b368dd3c23f752.jpg,1000,0
271356481,Wipe Clean Workbook: Everyday Math,199000,"Help your child to learn the math they’ll use in everyday life with this wipe-clean workbook from bestselling author Roger Priddy.Through everyday activities, such as going to the store, children will...","Help your child to learn the math they’ll use in everyday life with this wipe-clean workbook from bestselling author Roger Priddy. Through everyday activities, such as going to the store, children will learn first math skills, including weight, money, measurement, and fractions. Included with the book is a special pen, and the wipe-clean pages enable children to practice over and over again until they have mastered each skill. With bright photographic images to engage and encourage, this early-learning workbook will support your child during their early school years. Giá sản phẩm trên Tiki đã bao gồm thuế theo luật hiện hành. Bên cạnh đó, tuỳ vào loại sản phẩm, hình thức và địa chỉ giao hàng mà có thể phát sinh thêm chi phí khác như phí vận chuyển, phụ phí hàng cồng kềnh, thuế nhập khẩu (đối với đơn hàng giao từ nước ngoài có giá trị trên 1 triệu đồng).....",0,0,https://salt.tikicdn.com/ts/product/e7/69/dd/ddd5bb216e036dbd9da443c5281839b2.jpg,https://salt.tikicdn.com/cache/w1200/ts/product/e7/69/dd/ddd5bb216e036dbd9da443c5281839b2.jpg,https://salt.tikicdn.com/cache/w300/ts/product/e7/69/dd/ddd5bb216e036dbd9da443c5281839b2.jpg,https://salt.tikicdn.com/cache/200x280/ts/product/e7/69/dd/ddd5bb216e036dbd9da443c5281839b2.jpg,https://salt.tikicdn.com/cache/200x280/ts/product/e7/69/dd/ddd5bb216e036dbd9da443c5281839b2.jpg,1000,0
271219943,Wipe Clean Workbook: Starting Spelling,199000,"Wipe Clean Workbook: Starting Spelling Priddy Books' Wipe Clean Workbook: Starting Spelling is the perfect introduction to spelling for young children. With flip-over pages and a wipe-clean pen, chi...","Wipe Clean Workbook: Starting Spelling Priddy Books' Wipe Clean Workbook: Starting Spelling is the perfect introduction to spelling for young children. With flip-over pages and a wipe-clean pen, children aged 5-7 can complete the exercises and then wipe the pages clean and practice again and again! With 48 pages of engaging activities, this workbook covers a range of topics taught in the syllabus such as the alphabet, phonics, CVC words, letter sounds, vowels and consonants, and much more. Learning is even more fun with the crosswords, word searches, code cracking, and memory quizzes in this book. Approved by educational consultants, every page is filled with familiar words to practice spelling, which will develop children's pen control, reading and comprehension skills, and attention span. Giá sản phẩm trên Tiki đã bao gồm thuế theo luật hiện hành. Bên cạnh đó, tuỳ vào loại sản phẩm, hình thức và địa chỉ giao hàng mà có thể phát sinh thêm chi phí khác như phí vận chuyển, phụ phí hàng cồng kềnh, thuế nhập khẩu (đối với đơn hàng giao từ nước ngoài có giá trị trên 1 triệu đồng).....",0,0,https://salt.tikicdn.com/ts/product/db/bf/79/965096e59c51601e1511bffdab4e31fe.jpg,https://salt.tikicdn.com/cache/w1200/ts/product/db/bf/79/965096e59c51601e1511bffdab4e31fe.jpg,https://salt.tikicdn.com/cache/w300/ts/product/db/bf/79/965096e59c51601e1511bffdab4e31fe.jpg,https://salt.tikicdn.com/cache/200x280/ts/product/db/bf/79/965096e59c51601e1511bffdab4e31fe.jpg,https://salt.tikicdn.com/cache/200x280/ts/product/db/bf/79/965096e59c51601e1511bffdab4e31fe.jpg,1000,0
271192420,Priddy Learning: My First Wipe Clean Words : A Fun Early Learning Book,209000,Priddy Learning: My First Wipe Clean Words : A Fun Early Learning Book Roger Priddy's My First Wipe Clean: Words is an ideal introduction to first words for your baby or toddler.This board book has ...,"Priddy Learning: My First Wipe Clean Words : A Fun Early Learning Book Roger Priddy's My First Wipe Clean: Words is an ideal introduction to first words for your baby or toddler. This board book has simple first words that encourage young children to develop their vocabulary. Its handle shape and bold, colorful design make it a fun learning tool, and the wipe clean pages mean children can practice pen control again and again. It even comes with its own dry-wipe pen. Part of the Priddy Learning series which also includes; Priddy Learning: My First Clock Book, Priddy Learning: My First Wipe Clean ABC, Priddy Learning: My First Wipe Clean Pen Control, Priddy Learning: My First Wipe Clean Starting School Priddy Learning: Priddy Learning: My First Farm, Priddy Learning: My First Grocery Store, Priddy Learning: My First Animals, Priddy Learning: Ready for School, and Priddy Learning: My First Let's Spell. Giá sản phẩm trên Tiki đã bao gồm thuế theo luật hiện hành. Bên cạnh đó, tuỳ vào loại sản phẩm, hình thức và địa chỉ giao hàng mà có thể phát sinh thêm chi phí khác như phí vận chuyển, phụ phí hàng cồng kềnh, thuế nhập khẩu (đối với đơn hàng giao từ nước ngoài có giá trị trên 1 triệu đồng).....",0,0,https://salt.tikicdn.com/ts/product/58/77/d2/2a8f0a474e3cae27f8079f77e9b18d55.jpg,https://salt.tikicdn.com/cache/w1200/ts/product/58/77/d2/2a8f0a474e3cae27f8079f77e9b18d55.jpg,https://salt.tikicdn.com/cache/w300/ts/product/58/77/d2/2a8f0a474e3cae27f8079f77e9b18d55.jpg,https://salt.tikicdn.com/cache/200x280/ts/product/58/77/d2/2a8f0a474e3cae27f8079f77e9b18d55.jpg,https://salt.tikicdn.com/cache/200x280/ts/product/58/77/d2/2a8f0a474e3cae27f8079f77e9b18d55.jpg,1000,0
2462747,Peppa Pig - Practise With Peppa : Wipe-Clean First Numbers (Practise First Numbers 1 - 10),132000,Develop and practise first number skills with Peppa Pig and friends in this colourful wipe-clean activity book. Children will learn how to write the numbers 1-10 and begin to link number words with th...,"Develop and practise first number skills with Peppa Pig and friends in this colourful wipe-clean activity book. Children will learn how to write the numbers 1-10 and begin to link number words with the numerals (one = 1) through a range of fun Peppa-themed activities. Ideal for young readers who are starting school and developing first number skills and pencil control. Children can wipe the page clean and practise again and again. Includes a free pen. For more confident learners, why not also try Practise with Peppa: Wipe-Clean First Counting to practise numbers up to 20. Giá sản phẩm trên Tiki đã bao gồm thuế theo luật hiện hành. Bên cạnh đó, tuỳ vào loại sản phẩm, hình thức và địa chỉ giao hàng mà có thể phát sinh thêm chi phí khác như phí vận chuyển, phụ phí hàng cồng kềnh, thuế nhập khẩu (đối với đơn hàng giao từ nước ngoài có giá trị trên 1 triệu đồng).....",5,2,"https://salt.tikicdn.com/ts/product/1a/09/7d/d6edcbe815b35c36540f078e066af940.jpg, https://salt.tikicdn.com/ts/product/11/53/57/d348072a52dcb32fee8980908c25c681.jpg, https://salt.tikicdn.com/ts/product/6a/c9/64/6ad1a6a82afdd36af8b4d6fa4e682dac.jpg, https://salt.tikicdn.com/ts/product/72/1f/f3/42e38aec82aa07ec049f23c39778f1fe.jpg, https://salt.tikicdn.com/ts/product/86/76/b5/33416d9378a2fc58cecaf8c138709b65.jpg","https://salt.tikicdn.com/cache/w1200/ts/product/1a/09/7d/d6edcbe815b35c36540f078e066af940.jpg, https://salt.tikicdn.com/cache/w1200/ts/product/11/53/57/d348072a52dcb32fee8980908c25c681.jpg, https://salt.tikicdn.com/cache/w1200/ts/product/6a/c9/64/6ad1a6a82afdd36af8b4d6fa4e682dac.jpg, https://salt.tikicdn.com/cache/w1200/ts/product/72/1f/f3/42e38aec82aa07ec049f23c39778f1fe.jpg, https://salt.tikicdn.com/cache/w1200/ts/product/86/76/b5/33416d9378a2fc58cecaf8c138709b65.jpg","https://salt.tikicdn.com/cache/w300/ts/product/1a/09/7d/d6edcbe815b35c36540f078e066af940.jpg, https://salt.tikicdn.com/cache/w300/ts/product/11/53/57/d348072a52dcb32fee8980908c25c681.jpg, https://salt.tikicdn.com/cache/w300/ts/product/6a/c9/64/6ad1a6a82afdd36af8b4d6fa4e682dac.jpg, https://salt.tikicdn.com/cache/w300/ts/product/72/1f/f3/42e38aec82aa07ec049f23c39778f1fe.jpg, https://salt.tikicdn.com/cache/w300/ts/product/86/76/b5/33416d9378a2fc58cecaf8c138709b65.jpg","https://salt.tikicdn.com/cache/200x280/ts/product/1a/09/7d/d6edcbe815b35c36540f078e066af940.jpg, https://salt.tikicdn.com/cache/200x280/ts/product/11/53/57/d348072a52dcb32fee8980908c25c681.jpg, https://salt.tikicdn.com/cache/200x280/ts/product/6a/c9/64/6ad1a6a82afdd36af8b4d6fa4e682dac.jpg, https://salt.tikicdn.com/cache/200x280/ts/product/72/1f/f3/42e38aec82aa07ec049f23c39778f1fe.jpg, https://salt.tikicdn.com/cache/200x280/ts/product/86/76/b5/33416d9378a2fc58cecaf8c138709b65.jpg","https://salt.tikicdn.com/cache/200x280/ts/product/1a/09/7d/d6edcbe815b35c36540f078e066af940.jpg, https://salt.tikicdn.com/cache/200x280/ts/product/11/53/57/d348072a52dcb32fee8980908c25c681.jpg, https://salt.tikicdn.com/cache/200x280/ts/product/6a/c9/64/6ad1a6a82afdd36af8b4d6fa4e682dac.jpg, https://salt.tikicdn.com/cache/200x280/ts/product/72/1f/f3/42e38aec82aa07ec049f23c39778f1fe.jpg, https://salt.tikicdn.com/cache/200x280/ts/product/86/76/b5/33416d9378a2fc58cecaf8c138709b65.jpg",1000,2
2208853,Sách tẩy xóa tiếng Anh - Usborne Usborne Key Skills Wipe-clean Grammar & Punctuation 7-8,255000,"Wipe-Clean Grammar And Punctuation 7-8This entertaining wipe-clean activity book will help children practice and understand the rules of written English. Topics include clauses, conjunctions, adverbs...","Wipe-Clean Grammar And Punctuation 7-8 This entertaining wipe-clean activity book will help children practice and understand the rules of written English. Topics include clauses, conjunctions, adverbs, direct speech, present perfect tense and paragraphs. Part of the Usborne Key Skills series that supports the English lessons children learn at school. Includes secret notes for grown-ups. Giá sản phẩm trên Tiki đã bao gồm thuế theo luật hiện hành. Bên cạnh đó, tuỳ vào loại sản phẩm, hình thức và địa chỉ giao hàng mà có thể phát sinh thêm chi phí khác như phí vận chuyển, phụ phí hàng cồng kềnh, thuế nhập khẩu (đối với đơn hàng giao từ nước ngoài có giá trị trên 1 triệu đồng).....",5,1,https://salt.tikicdn.com/ts/product/19/a8/f7/fc4d3d61256906922086301410cf277c.jpg,https://salt.tikicdn.com/cache/w1200/ts/product/19/a8/f7/fc4d3d61256906922086301410cf277c.jpg,https://salt.tikicdn.com/cache/w300/ts/product/19/a8/f7/fc4d3d61256906922086301410cf277c.jpg,https://salt.tikicdn.com/cache/200x280/ts/product/19/a8/f7/fc4d3d61256906922086301410cf277c.jpg,https://salt.tikicdn.com/cache/200x280/ts/product/19/a8/f7/fc4d3d61256906922086301410cf277c.jpg,1000,1
2208689,Sách tẩy xóa tiếng Anh - Usborne Dinosaur Activities,243000,"Wipe-Clean Dinosaur ActivitiesA fun and colourful wipe-clean book full of dinosaur-themed activities. Children can join the dots around Terry Pterodactyls’ wings, circle the difference between Ivan a...","Wipe-Clean Dinosaur Activities A fun and colourful wipe-clean book full of dinosaur-themed activities. Children can join the dots around Terry Pterodactyls’ wings, circle the difference between Ivan and Isaac Ichthyosaurus and draw a line to Minty Maiasaura’s babies, then wipe clean and try again. The activities help develop pen control, an essential skill for learning to write. Giá sản phẩm trên Tiki đã bao gồm thuế theo luật hiện hành. Bên cạnh đó, tuỳ vào loại sản phẩm, hình thức và địa chỉ giao hàng mà có thể phát sinh thêm chi phí khác như phí vận chuyển, phụ phí hàng cồng kềnh, thuế nhập khẩu (đối với đơn hàng giao từ nước ngoài có giá trị trên 1 triệu đồng).....",5,1,https://salt.tikicdn.com/ts/product/6d/4d/f6/0b71ccb6133c5d16fcae859e4727b75a.jpg,https://salt.tikicdn.com/cache/w1200/ts/product/6d/4d/f6/0b71ccb6133c5d16fcae859e4727b75a.jpg,https://salt.tikicdn.com/cache/w300/ts/product/6d/4d/f6/0b71ccb6133c5d16fcae859e4727b75a.jpg,https://salt.tikicdn.com/cache/200x280/ts/product/6d/4d/f6/0b71ccb6133c5d16fcae859e4727b75a.jpg,https://salt.tikicdn.com/cache/200x280/ts/product/6d/4d/f6/0b71ccb6133c5d16fcae859e4727b75a.jpg,1000,1
2206983,Sách tẩy xóa tiếng Anh - Usborne Big Wipe-Clean Activity Book,401000,"Big Wipe Clean Activity BookContains lots of different activities for young children, including mazes, dot-to-dots and doodling. This title features wipe-clean pages so that the activities can be don...","Big Wipe Clean Activity Book Contains lots of different activities for young children, including mazes, dot-to-dots and doodling. This title features wipe-clean pages so that the activities can be done again and again. It offers an useful way to help practise pen control. It also includes a wipe-clean pen. Usborne Publishing, often called Usborne Books, is a United Kingdom-based publisher of children's literature. Founded by Peter Usborne in 1973, Usborne Publishing uses an in-house team of writers, editors and designers and is translated into over 100 languages. Its sister company Usborne Books at Home, a direct sales association selling to families, schools and communities, was founded in 1981 and won the Direct Sales Association Award for Innovation in 2004. To coincide with the 2008 National Year of Reading, Usborne created the Usborne Reading Programme with a marketing campaign to encourage beginner readers. The programme is a collection of over 150 titles graded in seven levels covering a range of subjects, both fiction and non-fiction. Giá sản phẩm trên Tiki đã bao gồm thuế theo luật hiện hành. Bên cạnh đó, tuỳ vào loại sản phẩm, hình thức và địa chỉ giao hàng mà có thể phát sinh thêm chi phí khác như phí vận chuyển, phụ phí hàng cồng kềnh, thuế nhập khẩu (đối với đơn hàng giao từ nước ngoài có giá trị trên 1 triệu đồng).....",0,0,https://salt.tikicdn.com/ts/product/38/ba/d8/f8c211631f865d3838da20b66f66c035.jpg,https://salt.tikicdn.com/cache/w1200/ts/product/38/ba/d8/f8c211631f865d3838da20b66f66c035.jpg,https://salt.tikicdn.com/cache/w300/ts/product/38/ba/d8/f8c211631f865d3838da20b66f66c035.jpg,https://salt.tikicdn.com/cache/200x280/ts/product/38/ba/d8/f8c211631f865d3838da20b66f66c035.jpg,https://salt.tikicdn.com/cache/200x280/ts/product/38/ba/d8/f8c211631f865d3838da20b66f66c035.jpg,1000,0
2175537,Sách tẩy xóa tiếng Anh - Usborne Key Skills Wipe-Clean: Spelling 7-8,281000,"Wipe-Clean Spelling 7-8Part of the Usborne Key Skills series that supports the English lessons children learn at school, this entertaining book is filled with prefix and suffix related activities, in...","Wipe-Clean Spelling 7-8 Part of the Usborne Key Skills series that supports the English lessons children learn at school, this entertaining book is filled with prefix and suffix related activities, including making words negative, adding word endings and a spelling quiz. Wipe-clean pages offer endless practice, and answers and secret notes for grown-ups are at the back. Giá sản phẩm trên Tiki đã bao gồm thuế theo luật hiện hành. Bên cạnh đó, tuỳ vào loại sản phẩm, hình thức và địa chỉ giao hàng mà có thể phát sinh thêm chi phí khác như phí vận chuyển, phụ phí hàng cồng kềnh, thuế nhập khẩu (đối với đơn hàng giao từ nước ngoài có giá trị trên 1 triệu đồng).....",0,0,https://salt.tikicdn.com/ts/product/66/85/22/1e2ff506c2cb16e0ea3d6328d758e0c9.jpg,https://salt.tikicdn.com/cache/w1200/ts/product/66/85/22/1e2ff506c2cb16e0ea3d6328d758e0c9.jpg,https://salt.tikicdn.com/cache/w300/ts/product/66/85/22/1e2ff506c2cb16e0ea3d6328d758e0c9.jpg,https://salt.tikicdn.com/cache/200x280/ts/product/66/85/22/1e2ff506c2cb16e0ea3d6328d758e0c9.jpg,https://salt.tikicdn.com/cache/200x280/ts/product/66/85/22/1e2ff506c2cb16e0ea3d6328d758e0c9.jpg,1000,0
519752,Schoolies Board Books Chalk Fun,162000,"Schoolies Board Books Chalk Fun Learning to draw is fun with the Schoolies! There are outlines to trace round and then color in, encouraging the development of fine motor skills. Comes with four colo...","Schoolies Board Books Chalk Fun Learning to draw is fun with the Schoolies! There are outlines to trace round and then color in, encouraging the development of fine motor skills. Comes with four colored chalks to use on the chalkboard style pages, which wipe clean so the book can be used over and over again. Giá sản phẩm trên Tiki đã bao gồm thuế theo luật hiện hành. Bên cạnh đó, tuỳ vào loại sản phẩm, hình thức và địa chỉ giao hàng mà có thể phát sinh thêm chi phí khác như phí vận chuyển, phụ phí hàng cồng kềnh, thuế nhập khẩu (đối với đơn hàng giao từ nước ngoài có giá trị trên 1 triệu đồng).....",0,0,"https://salt.tikicdn.com/ts/product/91/28/ba/d6c8ff1e5eacd4ea98420bee8b8900b7.jpg, https://salt.tikicdn.com/ts/product/7c/8b/c2/ebf531aa8ecadcbf19b392ac48e8fdc6.jpg, https://salt.tikicdn.com/ts/product/b2/e1/6a/c9dd68d5fdea63ee2b0adfdfe7e5e9ff.jpg, https://salt.tikicdn.com/ts/product/3f/78/16/6fc328009b948b17be565589ca4673e2.jpg, https://salt.tikicdn.com/ts/product/f6/31/e7/e83659deda0d0fc423543ea9ae1a91fa.jpg, https://salt.tikicdn.com/ts/product/d3/89/58/a63585c22d0d9e5dbc556118acf44825.jpg, https://salt.tikicdn.com/ts/product/fe/e4/38/55e665147731771ed83a241d9d230338.jpg, https://salt.tikicdn.com/ts/product/d7/a1/be/5940c259590020118b4f643b5277c67d.jpg, https://salt.tikicdn.com/ts/product/d1/83/c9/f9b2259b46d416eaf782fc5a45aec85c.jpg, https://salt.tikicdn.com/ts/product/f3/de/dd/631c36a26ab39c0d95dfc2099fbf6790.jpg","https://salt.tikicdn.com/cache/w1200/ts/product/91/28/ba/d6c8ff1e5eacd4ea98420bee8b8900b7.jpg, https://salt.tikicdn.com/cache/w1200/ts/product/7c/8b/c2/ebf531aa8ecadcbf19b392ac48e8fdc6.jpg, https://salt.tikicdn.com/cache/w1200/ts/product/b2/e1/6a/c9dd68d5fdea63ee2b0adfdfe7e5e9ff.jpg, https://salt.tikicdn.com/cache/w1200/ts/product/3f/78/16/6fc328009b948b17be565589ca4673e2.jpg, https://salt.tikicdn.com/cache/w1200/ts/product/f6/31/e7/e83659deda0d0fc423543ea9ae1a91fa.jpg, https://salt.tikicdn.com/cache/w1200/ts/product/d3/89/58/a63585c22d0d9e5dbc556118acf44825.jpg, https://salt.tikicdn.com/cache/w1200/ts/product/fe/e4/38/55e665147731771ed83a241d9d230338.jpg, https://salt.tikicdn.com/cache/w1200/ts/product/d7/a1/be/5940c259590020118b4f643b5277c67d.jpg, https://salt.tikicdn.com/cache/w1200/ts/product/d1/83/c9/f9b2259b46d416eaf782fc5a45aec85c.jpg, https://salt.tikicdn.com/cache/w1200/ts/product/f3/de/dd/631c36a26ab39c0d95dfc2099fbf6790.jpg","https://salt.tikicdn.com/cache/w300/ts/product/91/28/ba/d6c8ff1e5eacd4ea98420bee8b8900b7.jpg, https://salt.tikicdn.com/cache/w300/ts/product/7c/8b/c2/ebf531aa8ecadcbf19b392ac48e8fdc6.jpg, https://salt.tikicdn.com/cache/w300/ts/product/b2/e1/6a/c9dd68d5fdea63ee2b0adfdfe7e5e9ff.jpg, https://salt.tikicdn.com/cache/w300/ts/product/3f/78/16/6fc328009b948b17be565589ca4673e2.jpg, https://salt.tikicdn.com/cache/w300/ts/product/f6/31/e7/e83659deda0d0fc423543ea9ae1a91fa.jpg, https://salt.tikicdn.com/cache/w300/ts/product/d3/89/58/a63585c22d0d9e5dbc556118acf44825.jpg, https://salt.tikicdn.com/cache/w300/ts/product/fe/e4/38/55e665147731771ed83a241d9d230338.jpg, https://salt.tikicdn.com/cache/w300/ts/product/d7/a1/be/5940c259590020118b4f643b5277c67d.jpg, https://salt.tikicdn.com/cache/w300/ts/product/d1/83/c9/f9b2259b46d416eaf782fc5a45aec85c.jpg, https://salt.tikicdn.com/cache/w300/ts/product/f3/de/dd/631c36a26ab39c0d95dfc2099fbf6790.jpg","https://salt.tikicdn.com/cache/200x280/ts/product/91/28/ba/d6c8ff1e5eacd4ea98420bee8b8900b7.jpg, https://salt.tikicdn.com/cache/200x280/ts/product/7c/8b/c2/ebf531aa8ecadcbf19b392ac48e8fdc6.jpg, https://salt.tikicdn.com/cache/200x280/ts/product/b2/e1/6a/c9dd68d5fdea63ee2b0adfdfe7e5e9ff.jpg, https://salt.tikicdn.com/cache/200x280/ts/product/3f/78/16/6fc328009b948b17be565589ca4673e2.jpg, https://salt.tikicdn.com/cache/200x280/ts/product/f6/31/e7/e83659deda0d0fc423543ea9ae1a91fa.jpg, https://salt.tikicdn.com/cache/200x280/ts/product/d3/89/58/a63585c22d0d9e5dbc556118acf44825.jpg, https://salt.tikicdn.com/cache/200x280/ts/product/fe/e4/38/55e665147731771ed83a241d9d230338.jpg, https://salt.tikicdn.com/cache/200x280/ts/product/d7/a1/be/5940c259590020118b4f643b5277c67d.jpg, https://salt.tikicdn.com/cache/200x280/ts/product/d1/83/c9/f9b2259b46d416eaf782fc5a45aec85c.jpg, https://salt.tikicdn.com/cache/200x280/ts/product/f3/de/dd/631c36a26ab39c0d95dfc2099fbf6790.jpg","https://salt.tikicdn.com/cache/200x280/ts/product/91/28/ba/d6c8ff1e5eacd4ea98420bee8b8900b7.jpg, https://salt.tikicdn.com/cache/200x280/ts/product/7c/8b/c2/ebf531aa8ecadcbf19b392ac48e8fdc6.jpg, https://salt.tikicdn.com/cache/200x280/ts/product/b2/e1/6a/c9dd68d5fdea63ee2b0adfdfe7e5e9ff.jpg, https://salt.tikicdn.com/cache/200x280/ts/product/3f/78/16/6fc328009b948b17be565589ca4673e2.jpg, https://salt.tikicdn.com/cache/200x280/ts/product/f6/31/e7/e83659deda0d0fc423543ea9ae1a91fa.jpg, https://salt.tikicdn.com/cache/200x280/ts/product/d3/89/58/a63585c22d0d9e5dbc556118acf44825.jpg, https://salt.tikicdn.com/cache/200x280/ts/product/fe/e4/38/55e665147731771ed83a241d9d230338.jpg, https://salt.tikicdn.com/cache/200x280/ts/product/d7/a1/be/5940c259590020118b4f643b5277c67d.jpg, https://salt.tikicdn.com/cache/200x280/ts/product/d1/83/c9/f9b2259b46d416eaf782fc5a45aec85c.jpg, https://salt.tikicdn.com/cache/200x280/ts/product/f3/de/dd/631c36a26ab39c0d95dfc2099fbf6790.jpg",1000,0
