id,name,price,short_description,description,rating_average,review_count,image_base_url,image_large_url,image_medium_url,image_small_url,image_thumbnail_url,stock,quantity_sold
277392527,Sách - Biểu Tượng Và Không Gian Kiến Trúc - Đô Thị - NXB Xây Dựng,75460,"      Cuốn “ Biểu tượng & không gian kiến trúc – đô thị” được biên soạn bởi Lê Thanh Sơn, Trưởng khoa Kiến trúc nội thất- trường Đại học Kiến trúc TP. . Cuốn sách không nhằm giải quyết toàn bộ...","Cuốn “ Biểu tượng & không gian kiến trúc – đô thị” được biên soạn bởi Lê Thanh Sơn, Trưởng khoa Kiến trúc nội thất- trường Đại học Kiến trúc TP. . Cuốn sách không nhằm giải quyết toàn bộ những vấn đề quan yếu trong định hướng thiết kế kiến trúc và đô thị hiện nay là hướng về truyền thống mà nội dung chủ yếu là giới thiệu một phương thức tiếp cận vấn đề, để soi rọi những hướng đi hướng tới việc đề cao và kế thừa các giá trị của văn hóa và kiến trúc truyền thống, từ đó có thái độ tiếp cận cần thiết trong việc giải quyết mối quan hệ giữa truyền thống và hiện đại của kiến trúc Việt Nam hiện nay. Cuốn sách giúp bạn đọc có bước khởi đầu trong việc hình thành những luận đề khoa học cho việc giải quyết mối quan hệ giữa truyền thống và hiện đại; giữa hình thức và nội dung trong sáng tạo và giảng dạy kiến trúc; giữa kiến trúc và đô thị học với những ngành khoa học xã hội nhân văn khác... Thực hiện mục tiêu này, tác giả đã cố gắng phác họa một trong những yếu tố tiêu biểu của không gian kiến trúc, đó là yếu tố biểu tượng trong không gian kiến trúc - đô thị, trong yêu cầu hướng đến những triển vọng vận dụng vào trong kiến trúc hiện đại. Trang Lời nói đầu 5 1. Mở đầu 7 2. Những dấu ấn của biểu tượng trong không gian kiến trúc xa xưa 12 3. … và hiện nay… 33 4. Biểu tượng trong các không gian kiến trúc Việt Nam truyền thống 47 · Các quần cư dân gian 51 · Chùa 60 · Tháp 63 · Đình 66 · Kiến trúc cung đình 68 · Đô thành 76 5. Đôi lời về ký hiệu - biểu tượng & kiến trúc 83 6. Sự tự kiếm tìm của kiến trúc hiện đại 100 MỘT SỐ THUẬT NGỮ ĐƯỢC SỬ DỤNG 125 TÀI LIỆU THAM KHẢO 128 Giá sản phẩm trên Tiki đã bao gồm thuế theo luật hiện hành. Bên cạnh đó, tuỳ vào loại sản phẩm, hình thức và địa chỉ giao hàng mà có thể phát sinh thêm chi phí khác như phí vận chuyển, phụ phí hàng cồng kềnh, thuế nhập khẩu (đối với đơn hàng giao từ nước ngoài có giá trị trên 1 triệu đồng).....",0,0,"https://salt.tikicdn.com/ts/product/af/53/3e/0a5ded1a790e44623fb24b4f34bb5f32.jpg, https://salt.tikicdn.com/ts/product/da/64/a9/444cec7e00782b9f366b525342fa98fe.jpg","https://salt.tikicdn.com/cache/w1200/ts/product/af/53/3e/0a5ded1a790e44623fb24b4f34bb5f32.jpg, https://salt.tikicdn.com/cache/w1200/ts/product/da/64/a9/444cec7e00782b9f366b525342fa98fe.jpg","https://salt.tikicdn.com/cache/w300/ts/product/af/53/3e/0a5ded1a790e44623fb24b4f34bb5f32.jpg, https://salt.tikicdn.com/cache/w300/ts/product/da/64/a9/444cec7e00782b9f366b525342fa98fe.jpg","https://salt.tikicdn.com/cache/200x280/ts/product/af/53/3e/0a5ded1a790e44623fb24b4f34bb5f32.jpg, https://salt.tikicdn.com/cache/200x280/ts/product/da/64/a9/444cec7e00782b9f366b525342fa98fe.jpg","https://salt.tikicdn.com/cache/200x280/ts/product/af/53/3e/0a5ded1a790e44623fb24b4f34bb5f32.jpg, https://salt.tikicdn.com/cache/200x280/ts/product/da/64/a9/444cec7e00782b9f366b525342fa98fe.jpg",1000,0
277392505,Sách - Kiến Trúc Cổ Việt Nam - NXB Xây Dựng,104860,    Cuốn sách này gồm 5 chương sau:     Chương 1: Hoàn cảnh sản sinh và lược trình phát triển nền kiến trúc cổ truyền dân tộc Việt Nam.   Chương 2: Các loại hình kiến trúc cổ và dân gian Việt Na...,"Cuốn sách này gồm 5 chương sau: Chương 1: Hoàn cảnh sản sinh và lược trình phát triển nền kiến trúc cổ truyền dân tộc Việt Nam. Chương 2: Các loại hình kiến trúc cổ và dân gian Việt Nam. Chương 3: Vật liệu và phương thức xây dựng kiến trúc cổ và dân gian Việt Nam. Chương 4: Nghệ thuật trang trí, điêu khắc và màu sắc trong kiến trúc cổ Việt Nam. Chương 5: Nghệ thuật bố cục tạo hình và những đặc trưng cơ bản của nền kiến trúc truyền thống Việt Nam. SẢN PHẨM TẶNG KÈM SỔ TAY XƯƠNG RỒNG MẪU NGẪU NHIÊN Giá sản phẩm trên Tiki đã bao gồm thuế theo luật hiện hành. Bên cạnh đó, tuỳ vào loại sản phẩm, hình thức và địa chỉ giao hàng mà có thể phát sinh thêm chi phí khác như phí vận chuyển, phụ phí hàng cồng kềnh, thuế nhập khẩu (đối với đơn hàng giao từ nước ngoài có giá trị trên 1 triệu đồng).....",0,0,https://salt.tikicdn.com/ts/product/1d/7f/30/4a628929e30f915ae04d00837e4dbe4f.jpg,https://salt.tikicdn.com/cache/w1200/ts/product/1d/7f/30/4a628929e30f915ae04d00837e4dbe4f.jpg,https://salt.tikicdn.com/cache/w300/ts/product/1d/7f/30/4a628929e30f915ae04d00837e4dbe4f.jpg,https://salt.tikicdn.com/cache/200x280/ts/product/1d/7f/30/4a628929e30f915ae04d00837e4dbe4f.jpg,https://salt.tikicdn.com/cache/200x280/ts/product/1d/7f/30/4a628929e30f915ae04d00837e4dbe4f.jpg,1000,0
277392504,Sách - Kiến Trúc Nhà Ở - NXB Xây Dựng,141120,"    Khái niệm nhà ở trong tiếng Anh (house), Pháp (maison), Ý (casa) đều có mục đích chung là dùng để chỉ một thực thể vật chất làm nơi cư ngụ của con người; trong đó, kiến trúc luôn được liên kết ...","Khái niệm nhà ở trong tiếng Anh (house), Pháp (maison), Ý (casa) đều có mục đích chung là dùng để chỉ một thực thể vật chất làm nơi cư ngụ của con người; trong đó, kiến trúc luôn được liên kết với những vấn đề về bản sắc thị giác và bản sắc văn hóa. Giá sản phẩm trên Tiki đã bao gồm thuế theo luật hiện hành. Bên cạnh đó, tuỳ vào loại sản phẩm, hình thức và địa chỉ giao hàng mà có thể phát sinh thêm chi phí khác như phí vận chuyển, phụ phí hàng cồng kềnh, thuế nhập khẩu (đối với đơn hàng giao từ nước ngoài có giá trị trên 1 triệu đồng).....",0,0,https://salt.tikicdn.com/ts/product/7e/32/0b/b1e101d3b5e5743f150d5d7e2140f29f.jpg,https://salt.tikicdn.com/cache/w1200/ts/product/7e/32/0b/b1e101d3b5e5743f150d5d7e2140f29f.jpg,https://salt.tikicdn.com/cache/w300/ts/product/7e/32/0b/b1e101d3b5e5743f150d5d7e2140f29f.jpg,https://salt.tikicdn.com/cache/200x280/ts/product/7e/32/0b/b1e101d3b5e5743f150d5d7e2140f29f.jpg,https://salt.tikicdn.com/cache/200x280/ts/product/7e/32/0b/b1e101d3b5e5743f150d5d7e2140f29f.jpg,1000,0
277392500,Sách - Nguyên Lý Thiết Kế Nhà Dân Dụng - Kiến Trúc Nhà Ở - NXB Xây Dựng,141120,"    Sách - Nguyên Lý Thiết Kế Nhà Dân Dụng - Kiến Trúc Nhà ở  Cuốn ""Nhà ở và nhà công cộng"" trước đây là phần hai của bộ sách ""Nguyên lí thiết kế kiến trúc dân dụng"",tiếp theo phần một là cuốn ""Kh...","Sách - Nguyên Lý Thiết Kế Nhà Dân Dụng - Kiến Trúc Nhà ở Cuốn ""Nhà ở và nhà công cộng"" trước đây là phần hai của bộ sách ""Nguyên lí thiết kế kiến trúc dân dụng"",tiếp theo phần một là cuốn ""Khái niệm kiến trúc và cơ sở sáng tác"".Để nội dung sách bổ ích và hiệu quả hơn tác giả cập nhật bổ sung thêm nhiều thông tin mới, nay cuốn sách chung đó được tách thành 2 cuốn riêng: Cuốn thứ nhất: Kiến trúc nhà ở. Cuốn thứ hai: Kiến trúc nhà công cộng. Nội dung cuốn sách thứ nhất nhằm cung cấp cho sinh viên kiến trúc những kiến thức bắt đầu chuyên sâu về loại hình kiến trúc nhà ở, từ đặc điểm loại hình, lược sử quá trình phát triển, phân loạ đến các nguyên tắc và tiêu chuẩn thiết kế từng phần tạo nên các loại công trình cụ thể kèm vài ví dụ tốt để minh hoạ, cùng các triển vọng và xu hướng phát triển của chúng trong tương lai. Qua môn học, sinh viên không chỉ được mở rộng kiến thức về lí thuyết kiến trúc mà còn được thấy rõ hơn mối quan hệ giữa tiến bộ kĩ thuật và khoa học với kiến trúc và đời sống xã hội, có đủ kiến thức và phương pháp luận để thực hiện những bài tập lớn thực hành, và các đồ án môn học của năm thứ hai và thứ ba. Vì sinh viên sẽ còn được trở lại nghiên cứu sâu hơn nội dung này ở năm thứ tư và trong quá trình làm đồ án môn học, nên nhóm tác giả sẽ chỉ trình bày ở đây những kiến thức cơ sở, các nguyên lí chung và các loại nhà đơn giản, phổ cập nhất. Các vấn đề phức tạp đòi hỏi tri thức liên ngành tổng hợp và mở rộng sẽ được trình bầy trong cuốn tiếp sau, ứng với nội dung môn học tự chọn ""chuyên đề nâng cao kiến trúc"" phục vụ chuyên ngành sâu ở các năm cuối. Trên tinh thần giáo trình phải bảo đảm được ba tính ""cơ bản, hiện đại và Việt Nam"" nên nội dung cuốn sách đã cố gắng cung cấp cho sinh viên một cách hệ thống, chủ yếu không chỉ những kiến thức thành tựu chung của khoa học kĩ thuật và nghệ thuật xây dựng thế giới với tính chính xác và được cô đọng mà còn cố gắng lồng cài với chúng các kinh nghiệm và cách xử lí truyền thống đáp ứng các điều kiện và yêu cầu đặc thù Việt Nam, đế trang bị thêm cho sinh viên những kiến thức thực tiễn vốn rất cần cho nghề nghiệp kiến trúc - nghề sáng tạo nghệ thuật, tuy cần nhiều mơ ước, sự bay bổng nhưng không được viển vông xa rời thực tế đất nước, phục vụ tốt cho con người Việt Nam. Nội dung cuốn sách được trình bày với ý đồ rõ ràng cần có kèm theo nhiều hình minh hoạ vì tác giả cho rằng ngôn ngữ có sức biểu cảm mạnh và hàm súc của kiến trúc chính là ở đường nét và hình khối. Lời nói giải thích bao nhiêu cũng có thể không đủ nhưng hình ảnh minh hoạ, các ví dụ về sáng tác tốt của các kiến trúc sư lỗi lạc không chỉ cụ thể hoá những lí thuyết đã trình bày mà qua sự phân tích nghiền ngẫm từ các hình vẽ đó sinh viên sẽ còn thu nhập được nhiều điều bổ ích hơn bởi những thông tin đa nghĩa tiềm ẩn trong các hình minh hoạ vốn rất khó diễn tả đủ bằng lời. Cuốn sách phục vụ bổ ích cho không những các sinh viên kiến trúc các hệ đào tạo chính quy hay ban đêm, tại chứ, mà còn cho kiến trúc sư trẻ, các học viên cao học nghiên cứu sinh ngành kiến trúc và các bạn đọc quan tâm đến ngành xây dựng, kiến trúc nói chung. Giá sản phẩm trên Tiki đã bao gồm thuế theo luật hiện hành. Bên cạnh đó, tuỳ vào loại sản phẩm, hình thức và địa chỉ giao hàng mà có thể phát sinh thêm chi phí khác như phí vận chuyển, phụ phí hàng cồng kềnh, thuế nhập khẩu (đối với đơn hàng giao từ nước ngoài có giá trị trên 1 triệu đồng).....",0,0,"https://salt.tikicdn.com/ts/product/17/8a/2c/2f77cc94b81b2342800822f17a36adcf.jpg, https://salt.tikicdn.com/ts/product/be/99/c6/ee9d0c2ef26ef1b694e12da755c9543e.jpg, https://salt.tikicdn.com/ts/product/d0/90/3f/fc759857e818d89b9b18925ee6f5cd79.jpg","https://salt.tikicdn.com/cache/w1200/ts/product/17/8a/2c/2f77cc94b81b2342800822f17a36adcf.jpg, https://salt.tikicdn.com/cache/w1200/ts/product/be/99/c6/ee9d0c2ef26ef1b694e12da755c9543e.jpg, https://salt.tikicdn.com/cache/w1200/ts/product/d0/90/3f/fc759857e818d89b9b18925ee6f5cd79.jpg","https://salt.tikicdn.com/cache/w300/ts/product/17/8a/2c/2f77cc94b81b2342800822f17a36adcf.jpg, https://salt.tikicdn.com/cache/w300/ts/product/be/99/c6/ee9d0c2ef26ef1b694e12da755c9543e.jpg, https://salt.tikicdn.com/cache/w300/ts/product/d0/90/3f/fc759857e818d89b9b18925ee6f5cd79.jpg","https://salt.tikicdn.com/cache/200x280/ts/product/17/8a/2c/2f77cc94b81b2342800822f17a36adcf.jpg, https://salt.tikicdn.com/cache/200x280/ts/product/be/99/c6/ee9d0c2ef26ef1b694e12da755c9543e.jpg, https://salt.tikicdn.com/cache/200x280/ts/product/d0/90/3f/fc759857e818d89b9b18925ee6f5cd79.jpg","https://salt.tikicdn.com/cache/200x280/ts/product/17/8a/2c/2f77cc94b81b2342800822f17a36adcf.jpg, https://salt.tikicdn.com/cache/200x280/ts/product/be/99/c6/ee9d0c2ef26ef1b694e12da755c9543e.jpg, https://salt.tikicdn.com/cache/200x280/ts/product/d0/90/3f/fc759857e818d89b9b18925ee6f5cd79.jpg",1000,0
277392486,Sách - Nguyên Lý Thiết Kế Kiến Trúc Dân Dụng - Kiến Trúc Nhà Công Cộng - NXB Xây Dựng,156800,    Mục Lục  Trang  Lời nói đầu  PHẦN I  CÁC CƠ SỞ CHUNG  Chương 1. Đặc điểm và yêu cầu kiến trúc nhà công cộng  5  Chương 2. Các bộ phần của nhà công cộng  29  Chương 3. Hệ thống mạng lướ...,"Mục Lục Trang Lời nói đầu PHẦN I CÁC CƠ SỞ CHUNG Chương 1. Đặc điểm và yêu cầu kiến trúc nhà công cộng 5 Chương 2. Các bộ phần của nhà công cộng 29 Chương 3. Hệ thống mạng lưới công trình và không gian dịch vụ công cộng, cách xác định sức chứa hợp lí, yêu cầu về địa điểm xây dựng và các không chế về mặt quy hoạch 86 Chương 4. Phân khu hợp nhóm giải pháp tổ hợp không gian hình khối kiến trúc 1 Chương 5. Thiết kế nhìn rõ trong phòng khán giả 136 Chương 6. Thiết kế và kiểm tra thoát người Chương 7. Thiết kế hệ thống kĩ thuật trong nhà công cộng 168 Chương 8. Đặc điểm kết cấu và thẩm mỹ kiến trúc nhà công cộng 182 PHẦN II MỘT SỐ KIÊU NHÀ THÔNG DỤNG Chương 1. Nhà trẻ và mẫu giảo tám nhóm 2 Chương 2. Trường tiểu học 12 - 12 lớp 220 Chương 3. Nhà hàng ăn uống 235 Chương 4. Thiết kế rạp chiếu bóng 245 Chương 5. Thiết kế khách sạn 261 Chương 6. Kiến trúc bảo tàng đặc điểm yêu cầu và sơ đồ công năng bảo tàng 285 Chương 7. Kiến trúc nhà thi đấu và bể bơi có mái 3 Phụ lục 333 Tài liệu tham khảo 349 Giá sản phẩm trên Tiki đã bao gồm thuế theo luật hiện hành. Bên cạnh đó, tuỳ vào loại sản phẩm, hình thức và địa chỉ giao hàng mà có thể phát sinh thêm chi phí khác như phí vận chuyển, phụ phí hàng cồng kềnh, thuế nhập khẩu (đối với đơn hàng giao từ nước ngoài có giá trị trên 1 triệu đồng).....",0,0,https://salt.tikicdn.com/ts/product/e9/da/b9/270c9c1d50670301bf6fd1c4440aedab.jpg,https://salt.tikicdn.com/cache/w1200/ts/product/e9/da/b9/270c9c1d50670301bf6fd1c4440aedab.jpg,https://salt.tikicdn.com/cache/w300/ts/product/e9/da/b9/270c9c1d50670301bf6fd1c4440aedab.jpg,https://salt.tikicdn.com/cache/200x280/ts/product/e9/da/b9/270c9c1d50670301bf6fd1c4440aedab.jpg,https://salt.tikicdn.com/cache/200x280/ts/product/e9/da/b9/270c9c1d50670301bf6fd1c4440aedab.jpg,1000,0
277392478,Sách - Ngữ Pháp Kiến Trúc - NXB Xây Dựng,175420,    Giới thiệu nội dung:  Cuốn sách này sẽ cho bạn biết và gọi đích danh tất cả những yếu tố kiến trúc và hiểu rõ hơn cách thức mà các kiến trúc sư đã thiết kế và xây dựng những tòa nhà trong quá ...,"Giới thiệu nội dung: Cuốn sách này sẽ cho bạn biết và gọi đích danh tất cả những yếu tố kiến trúc và hiểu rõ hơn cách thức mà các kiến trúc sư đã thiết kế và xây dựng những tòa nhà trong quá khứ, từ Amenhotep đến Palladio, từ Vitruvius đến Wren. Giá sản phẩm trên Tiki đã bao gồm thuế theo luật hiện hành. Bên cạnh đó, tuỳ vào loại sản phẩm, hình thức và địa chỉ giao hàng mà có thể phát sinh thêm chi phí khác như phí vận chuyển, phụ phí hàng cồng kềnh, thuế nhập khẩu (đối với đơn hàng giao từ nước ngoài có giá trị trên 1 triệu đồng).....",0,0,https://salt.tikicdn.com/ts/product/b7/11/77/8f147de6cfd4220e2b03f67e1eea1545.jpg,https://salt.tikicdn.com/cache/w1200/ts/product/b7/11/77/8f147de6cfd4220e2b03f67e1eea1545.jpg,https://salt.tikicdn.com/cache/w300/ts/product/b7/11/77/8f147de6cfd4220e2b03f67e1eea1545.jpg,https://salt.tikicdn.com/cache/200x280/ts/product/b7/11/77/8f147de6cfd4220e2b03f67e1eea1545.jpg,https://salt.tikicdn.com/cache/200x280/ts/product/b7/11/77/8f147de6cfd4220e2b03f67e1eea1545.jpg,1000,0
277392444,Sách - Nội Thất Và Thiết Kế Nội Thất - NXB Xây Dựng,252840,"    Cuốn sách là tài liệu giảng dạy và học tập của giảng viên và sinh viên ngành kiến trúc, đồng thời là tài liệu tham khảo cho bạn đọc công tác trong các chuyên ngành có liên quan tới kiến trúc. ...","Cuốn sách là tài liệu giảng dạy và học tập của giảng viên và sinh viên ngành kiến trúc, đồng thời là tài liệu tham khảo cho bạn đọc công tác trong các chuyên ngành có liên quan tới kiến trúc. Giá sản phẩm trên Tiki đã bao gồm thuế theo luật hiện hành. Bên cạnh đó, tuỳ vào loại sản phẩm, hình thức và địa chỉ giao hàng mà có thể phát sinh thêm chi phí khác như phí vận chuyển, phụ phí hàng cồng kềnh, thuế nhập khẩu (đối với đơn hàng giao từ nước ngoài có giá trị trên 1 triệu đồng).....",0,0,"https://salt.tikicdn.com/ts/product/d0/f7/07/e20b2e3b5ea18e208847c384a063a812.jpg, https://salt.tikicdn.com/ts/product/0f/36/e5/db2a1bc77185e5085c745fcfc34099cd.jpg, https://salt.tikicdn.com/ts/product/cd/eb/b0/f457f6e191d3a1634609b4cf03c097de.jpg, https://salt.tikicdn.com/ts/product/0c/ec/9c/1cc1d69823178a605085e143cb86baf5.jpg, https://salt.tikicdn.com/ts/product/75/75/52/997fdeed1b760d51666e78fdcc5b143b.jpg, https://salt.tikicdn.com/ts/product/6c/d5/37/c829d02c19ef6d16ee33cb63de37ae0d.jpg, https://salt.tikicdn.com/ts/product/f8/44/c8/6956875259b37882fb4dd523ad789308.jpg, https://salt.tikicdn.com/ts/product/f9/a8/90/69527d662f5413fa493fa1b35e7c3145.jpg","https://salt.tikicdn.com/cache/w1200/ts/product/d0/f7/07/e20b2e3b5ea18e208847c384a063a812.jpg, https://salt.tikicdn.com/cache/w1200/ts/product/0f/36/e5/db2a1bc77185e5085c745fcfc34099cd.jpg, https://salt.tikicdn.com/cache/w1200/ts/product/cd/eb/b0/f457f6e191d3a1634609b4cf03c097de.jpg, https://salt.tikicdn.com/cache/w1200/ts/product/0c/ec/9c/1cc1d69823178a605085e143cb86baf5.jpg, https://salt.tikicdn.com/cache/w1200/ts/product/75/75/52/997fdeed1b760d51666e78fdcc5b143b.jpg, https://salt.tikicdn.com/cache/w1200/ts/product/6c/d5/37/c829d02c19ef6d16ee33cb63de37ae0d.jpg, https://salt.tikicdn.com/cache/w1200/ts/product/f8/44/c8/6956875259b37882fb4dd523ad789308.jpg, https://salt.tikicdn.com/cache/w1200/ts/product/f9/a8/90/69527d662f5413fa493fa1b35e7c3145.jpg","https://salt.tikicdn.com/cache/w300/ts/product/d0/f7/07/e20b2e3b5ea18e208847c384a063a812.jpg, https://salt.tikicdn.com/cache/w300/ts/product/0f/36/e5/db2a1bc77185e5085c745fcfc34099cd.jpg, https://salt.tikicdn.com/cache/w300/ts/product/cd/eb/b0/f457f6e191d3a1634609b4cf03c097de.jpg, https://salt.tikicdn.com/cache/w300/ts/product/0c/ec/9c/1cc1d69823178a605085e143cb86baf5.jpg, https://salt.tikicdn.com/cache/w300/ts/product/75/75/52/997fdeed1b760d51666e78fdcc5b143b.jpg, https://salt.tikicdn.com/cache/w300/ts/product/6c/d5/37/c829d02c19ef6d16ee33cb63de37ae0d.jpg, https://salt.tikicdn.com/cache/w300/ts/product/f8/44/c8/6956875259b37882fb4dd523ad789308.jpg, https://salt.tikicdn.com/cache/w300/ts/product/f9/a8/90/69527d662f5413fa493fa1b35e7c3145.jpg","https://salt.tikicdn.com/cache/200x280/ts/product/d0/f7/07/e20b2e3b5ea18e208847c384a063a812.jpg, https://salt.tikicdn.com/cache/200x280/ts/product/0f/36/e5/db2a1bc77185e5085c745fcfc34099cd.jpg, https://salt.tikicdn.com/cache/200x280/ts/product/cd/eb/b0/f457f6e191d3a1634609b4cf03c097de.jpg, https://salt.tikicdn.com/cache/200x280/ts/product/0c/ec/9c/1cc1d69823178a605085e143cb86baf5.jpg, https://salt.tikicdn.com/cache/200x280/ts/product/75/75/52/997fdeed1b760d51666e78fdcc5b143b.jpg, https://salt.tikicdn.com/cache/200x280/ts/product/6c/d5/37/c829d02c19ef6d16ee33cb63de37ae0d.jpg, https://salt.tikicdn.com/cache/200x280/ts/product/f8/44/c8/6956875259b37882fb4dd523ad789308.jpg, https://salt.tikicdn.com/cache/200x280/ts/product/f9/a8/90/69527d662f5413fa493fa1b35e7c3145.jpg","https://salt.tikicdn.com/cache/200x280/ts/product/d0/f7/07/e20b2e3b5ea18e208847c384a063a812.jpg, https://salt.tikicdn.com/cache/200x280/ts/product/0f/36/e5/db2a1bc77185e5085c745fcfc34099cd.jpg, https://salt.tikicdn.com/cache/200x280/ts/product/cd/eb/b0/f457f6e191d3a1634609b4cf03c097de.jpg, https://salt.tikicdn.com/cache/200x280/ts/product/0c/ec/9c/1cc1d69823178a605085e143cb86baf5.jpg, https://salt.tikicdn.com/cache/200x280/ts/product/75/75/52/997fdeed1b760d51666e78fdcc5b143b.jpg, https://salt.tikicdn.com/cache/200x280/ts/product/6c/d5/37/c829d02c19ef6d16ee33cb63de37ae0d.jpg, https://salt.tikicdn.com/cache/200x280/ts/product/f8/44/c8/6956875259b37882fb4dd523ad789308.jpg, https://salt.tikicdn.com/cache/200x280/ts/product/f9/a8/90/69527d662f5413fa493fa1b35e7c3145.jpg",1000,0
277392428,Sách - Kiến Trúc Nội Thất - Đặng Thái Hoàng - NXB Xây Dựng,105840,"    Thiết kế nội thất là một bộ môn quan trọng, gắn bó mật thiết với các kiến trúc sư cũng như những họa sĩ học ngành Nội thất ở Trường Đại học Mỹ thuật Công nghiệp. Nó cũng là mối quan tâm nói chu...","Thiết kế nội thất là một bộ môn quan trọng, gắn bó mật thiết với các kiến trúc sư cũng như những họa sĩ học ngành Nội thất ở Trường Đại học Mỹ thuật Công nghiệp. Nó cũng là mối quan tâm nói chung với tất cả mọi người, những người yêu mến văn hóa nghệ thuật hay muốn làm nội thất cho các phòng, sắp xếp công năng và làm đẹp không gian sống cho ngôi nhà của mình. Trong khi thiết kế kiến trúc được tiến hành để đáp ứng các nhu cầu vật chất và tinh thần của con người thì thiết kế nội thất đồng nghĩa với việc thiết kế một cảnh tượng nghệ thuật bên trong, thiết kế kiến trúc nội thất là căn cứ trên một kiến trúc hiện tồn hay kiến trúc cho trước, không ngừng phát triển và mở rộng các lĩnh vực nội dung nghệ thuật kiến trúc liên quan bên trong, đồng thời coi trọng việc giải quyết các vấn đề kỹ thuật tạo thành các kiến trúc nội thất hoàn chỉnh. Giá sản phẩm trên Tiki đã bao gồm thuế theo luật hiện hành. Bên cạnh đó, tuỳ vào loại sản phẩm, hình thức và địa chỉ giao hàng mà có thể phát sinh thêm chi phí khác như phí vận chuyển, phụ phí hàng cồng kềnh, thuế nhập khẩu (đối với đơn hàng giao từ nước ngoài có giá trị trên 1 triệu đồng).....",0,0,https://salt.tikicdn.com/ts/product/6c/de/30/fe865dc7a12f41de18a09f26d68b38dc.jpg,https://salt.tikicdn.com/cache/w1200/ts/product/6c/de/30/fe865dc7a12f41de18a09f26d68b38dc.jpg,https://salt.tikicdn.com/cache/w300/ts/product/6c/de/30/fe865dc7a12f41de18a09f26d68b38dc.jpg,https://salt.tikicdn.com/cache/200x280/ts/product/6c/de/30/fe865dc7a12f41de18a09f26d68b38dc.jpg,https://salt.tikicdn.com/cache/200x280/ts/product/6c/de/30/fe865dc7a12f41de18a09f26d68b38dc.jpg,1000,0
