id,name,price,short_description,description,rating_average,review_count,image_base_url,image_large_url,image_medium_url,image_small_url,image_thumbnail_url,stock,quantity_sold
277327194,Giáo trình Lí thuyết âm nhạc cơ bản,90250,Cuốn giáo trình  Lí thuyết âm nhạc cơ bản được biên soạn để phục vụ công tác giảng dạy của giảng viên học tập của sinh viên chuyên ngành Sư phạm Âm nhạc bậc cử nhân trong học phần Lí thuyết âm nhạc cơ...,"Cuốn giáo trình  Lí thuyết âm nhạc cơ bản được biên soạn để phục vụ công tác giảng dạy của giảng viên học tập của sinh viên chuyên ngành Sư phạm Âm nhạc bậc cử nhân trong học phần Lí thuyết âm nhạc cơ bản – học phần bắt buộc trong khối học vấn chuyên ngành của Chương trình đào tạo cử nhân Sư phạm Âm nhạc, Trường Đại học Sư phạm Hà Nội. Giáo trình được biên soạn dựa trên một số giáo trình lí thuyết âm nhạc cơ bản và các tài liệu khác liên quan của nhiều tác giả khác nhau đã được công bố trong và ngoài nước, kết hợp với kiến thức chuyên môn của nhóm tác giả đã tích luỹ, trải nghiệm thực tế qua nhiều năm công tác trong ngành Âm nhạc. Căn cứ vào đặc thù của bậc cử nhân chuyên ngành Sư phạm Âm nhạc, giáo trình được xây dựng với mục tiêu giúp sinh viên sau khi học xong học phần Lí thuyết âm nhạc cơ bản: Thứ nhất: Hiểu và trình bày được những khái niệm, quy ước và kí hiệu cơ bản về các phương tiện diễn tả trong âm nhạc. Thứ hai: Hiểu và phân tích được nội hàm của các yếu tố về thuộc tính của âm thanh, tiết tấu, nhịp độ, thang âm, điệu thức, giọng, giai điệu, hợp âm, sự hoá, các thủ pháp biểu diễn,... trên cơ sở đó, có thể xác định được các yếu tố này trong tác phẩm âm nhạc. Thứ ba: Áp dụng được kiến thức lí thuyết âm nhạc vào việc học tập các môn học khác như Kí – Xướng âm, Hoà thanh, Thanh nhạc, Nhạc cụ, Phân tích tác phẩm âm nhạc,... Bên cạnh đó, có thể vận dụng vào thực tiễn dạy học âm nhạc ở trường phổ thông, đáp ứng yêu cầu của Chương trình Giáo dục phổ thông 2018 nói chung và Chương trình giáo dục phổ thông 2018 môn Âm nhạc nói riêng. Thư tư: Vận dụng được các kiến thức trong giáo trình làm cơ sở cho việc học tập chuyên môn âm nhạc ở các trình độ cao hơn. Với mục tiêu nêu trên, giáo trình được xây dựng theo mạch kiến thức logic từ thấp lên cao, từ đơn giản đến phức tạp, phù hợp khả năng tiếp thu của sinh viên chuyên ngành Sư phạm Âm nhạc. Kết cấu giáo trình vừa đảm bảo củng cố kiến thức, kĩ năng âm nhạc vững chắc cho sinh viên, vừa bám sát mục tiêu và nội dung chương trình đào tạo, gắn kết với những yêu cầu cần đạt của môn Âm nhạc ở trường phổ thông theo Chương trình giáo dục phổ thông 2018. Giáo trình nghiêng về tính lí thuyết, vì vậy cần tăng cường tính thực hành thông qua các câu hỏi, bài tập để giúp sinh viên tiếp thu kiến thức trên lớp hiệu quả và có thể vận dụng kiến thức đó vào thực tế học tập các môn học của chuyên ngành khác. Cụ thể, trong nội dung bài học ở mỗi chương cần thực hiện như sau: – Hướng dẫn sinh viên tự đọc và trả lời các câu hỏi lí thuyết trước khi lên lớp. – Thời lượng dành cho việc giảng dạy kiến thức mới trong mỗi bài học ở từng chương được trình bày ngắn gọn, súc tích (Giáo trình dành thời lượng không nhỏ cho phần làm bài tập và thảo luận). – Ngoài việc sử dụng những nội dung chính trong giáo trình, giảng viên có thể bổ sung thêm các ví dụ minh hoạ bằng âm thanh, hình ảnh để bài giảng thêm phong phú và sinh động, giúp người học nắm bắt bài học nhanh và hiệu quả. – Người dạy nên quan tâm gắn kết các mạch nội dung của giáo trình với các yêu cầu cần đạt và kiến thức của môn Âm nhạc ở trường phổ thông, tránh tình trạng kiến thức bài học xa rời thực tiễn. Các phương pháp giảng dạy và cách thức kiểm tra, đánh giá được lựa chọn, gợi ý trong giáo trình đảm bảo tính hợp lí, cập nhật và hỗ trợ đắc lực cho giảng viên trong quá trình giảng dạy môn học. Giá sản phẩm trên Tiki đã bao gồm thuế theo luật hiện hành. Bên cạnh đó, tuỳ vào loại sản phẩm, hình thức và địa chỉ giao hàng mà có thể phát sinh thêm chi phí khác như phí vận chuyển, phụ phí hàng cồng kềnh, thuế nhập khẩu (đối với đơn hàng giao từ nước ngoài có giá trị trên 1 triệu đồng).....",0,0,https://salt.tikicdn.com/ts/product/a9/9c/7c/0e01c98d8bebbe68df0a3ea1f966a756.png,https://salt.tikicdn.com/cache/w1200/ts/product/a9/9c/7c/0e01c98d8bebbe68df0a3ea1f966a756.png,https://salt.tikicdn.com/cache/w300/ts/product/a9/9c/7c/0e01c98d8bebbe68df0a3ea1f966a756.png,https://salt.tikicdn.com/cache/200x280/ts/product/a9/9c/7c/0e01c98d8bebbe68df0a3ea1f966a756.png,https://salt.tikicdn.com/cache/200x280/ts/product/a9/9c/7c/0e01c98d8bebbe68df0a3ea1f966a756.png,1000,0
277327184,Giáo trình Lí luận và phương pháp dạy học Âm nhạc,114000,"Giáo trình Lí luận và phương pháp dạy học âm nhạc gồm 5 chương, được biên soạn với mục tiêu đào tạo cử nhân Sư phạm âm nhạc ở các trường sư phạm trên cơ sở khung chương trình đào tạo tín chỉ của học p...","Giáo trình Lí luận và phương pháp dạy học âm nhạc gồm 5 chương, được biên soạn với mục tiêu đào tạo cử nhân Sư phạm âm nhạc ở các trường sư phạm trên cơ sở khung chương trình đào tạo tín chỉ của học phần Lí luận và phương pháp dạy học âm nhạc. Giáo trình Lí luận và phương pháp dạy học âm nhạc có sự tiếp nối và kế thừa những công trình nghiên cứu về lí luận và phương pháp dạy học âm nhạc trước đó, đồng thời cũng cập nhật những nội dung theo xu hướng phát triển nghệ thuật nói chung và phát triển giáo dục âm nhạc nói riêng ở trong nước và trên thế giới nhằm góp phần đáp ứng yêu cầu đào tạo giáo viên hệ cử nhân chuyên ngành Sư phạm  m nhạc trong giai đoạn đổi mới giáo dục hiện nay. Giá sản phẩm trên Tiki đã bao gồm thuế theo luật hiện hành. Bên cạnh đó, tuỳ vào loại sản phẩm, hình thức và địa chỉ giao hàng mà có thể phát sinh thêm chi phí khác như phí vận chuyển, phụ phí hàng cồng kềnh, thuế nhập khẩu (đối với đơn hàng giao từ nước ngoài có giá trị trên 1 triệu đồng).....",0,0,https://salt.tikicdn.com/ts/product/cd/7c/11/acaac2c3002f020f299027f0dea2bd35.png,https://salt.tikicdn.com/cache/w1200/ts/product/cd/7c/11/acaac2c3002f020f299027f0dea2bd35.png,https://salt.tikicdn.com/cache/w300/ts/product/cd/7c/11/acaac2c3002f020f299027f0dea2bd35.png,https://salt.tikicdn.com/cache/200x280/ts/product/cd/7c/11/acaac2c3002f020f299027f0dea2bd35.png,https://salt.tikicdn.com/cache/200x280/ts/product/cd/7c/11/acaac2c3002f020f299027f0dea2bd35.png,1000,0
276597652,"Pháp luật đại cương. Dùng trong các trường đại học và trung cấp (xuất bản lần thứ 21, có sửa chữa, bổ sung) - bản in 2024",131720,"Khoa học nhà nước và pháp luật đại cương nghiên cứu vấn đề nhà nước và pháp luật, bản chất, vai trò xã hội, những quy luật đặc thù, cơ bản nhất của sự xuất hiện, tồn tại và phát triển của chúng; đồng ...","Khoa học nhà nước và pháp luật đại cương nghiên cứu vấn đề nhà nước và pháp luật, bản chất, vai trò xã hội, những quy luật đặc thù, cơ bản nhất của sự xuất hiện, tồn tại và phát triển của chúng; đồng thời nghiên cứu những nét khái quát nhất của hệ thống pháp luật Việt Nam và pháp luật quốc tế. Vì vậy, trong những năm qua, khoa học nhà nước và pháp luật đại cương được coi là một môn học chính thức, quan trọng trong chương trình đại học đại cương, đã được Bộ Giáo dục và Đào tạo quy định giảng dạy tại các trường đại học, cao đẳng, trung cấp.. Nhằm góp phần phục vụ công tác đào tạo, bồi dưỡng những kiến thức cơ bản về nhà nước và pháp luật cho học sinh, sinh viên; cung cấp thêm tài liệu nghiên cứu, tham khảo cho giảng viên các trường đại học, cao đẳng, trung cấp, Nhà xuất bản Chính trị 5 quốc gia Sự thật xuất bản lần thứ 21, có sửa chữa, bổ sung cuốn sách Pháp luật đại cương (Dùng trong các trường đại học, cao đẳng và trung cấp) của Tiến sĩ Luật học Lê Minh Toàn. Trong lần xuất bản này, tác giả đã thay thế toàn bộ nội dung của mục X (Bảo hiểm xã hội) Chương 8 theo quy định của Luật bảo hiểm xã hội năm 2024; sửa mục XI Chương 8; bổ sung tiểu mục 2.1, mục I Chương 9 (Pháp luật kinh doanh) theo quy định của Luật hợp tác xã năm 2023; lược bỏ bớt một số nội dung ở các chương khác cho ngắn gọn, súc tích. Trân trọng giới thiệu tới quý vị bạn đọc. Giá sản phẩm trên Tiki đã bao gồm thuế theo luật hiện hành. Bên cạnh đó, tuỳ vào loại sản phẩm, hình thức và địa chỉ giao hàng mà có thể phát sinh thêm chi phí khác như phí vận chuyển, phụ phí hàng cồng kềnh, thuế nhập khẩu (đối với đơn hàng giao từ nước ngoài có giá trị trên 1 triệu đồng).....",0,0,"https://salt.tikicdn.com/ts/product/c6/1c/93/d8cbaa564900832ef772d228771d8c7b.jpg, https://salt.tikicdn.com/ts/product/91/a3/90/27418a68ce42eeae4c7aada1e4292efb.jpg, https://salt.tikicdn.com/ts/product/93/1d/a7/d75a5a60c270bf395b5342b110e2751d.jpg, https://salt.tikicdn.com/ts/product/1d/c2/c4/78804fc22a837090f73f170af53b3ad1.jpg, https://salt.tikicdn.com/ts/product/09/9f/20/bd86d45e129060b4f610a3906a5f795f.jpg, https://salt.tikicdn.com/ts/product/3c/4a/07/2f89b12b965643cb86d2405e73e26368.jpg, https://salt.tikicdn.com/ts/product/41/2d/34/f8aa3ff1b22d8933cf0da34e8452de85.jpg, https://salt.tikicdn.com/ts/product/4f/8c/25/5b795a4999e32c704a62cfbadee8ad60.jpg, https://salt.tikicdn.com/ts/product/59/e3/a5/caa86c61f4b3e214f6ddb0a2ffa87493.jpg, https://salt.tikicdn.com/ts/product/19/e1/89/b4e58fd601c7f4126fc29a1bde88dfc9.jpg, https://salt.tikicdn.com/ts/product/87/0e/0f/08cce6b18ed9551c9a3ebafa5b298752.jpg, https://salt.tikicdn.com/ts/product/3b/b3/f6/ff1f807e95abd2d7eb14de71a8808da3.jpg, https://salt.tikicdn.com/ts/product/95/d5/0e/ca4aad2859e0a18decbe5bab40b53d7c.jpg, https://salt.tikicdn.com/ts/product/a8/cc/3e/fe4fe9a9ed75e5cf415725ad26c01d64.jpg, https://salt.tikicdn.com/ts/product/ae/7b/4d/41684fc60c16d266f98fe478c9d83da0.jpg, https://salt.tikicdn.com/ts/product/b0/a9/2a/6e1d4b275b27e95837ec4e507c9b0170.jpg, https://salt.tikicdn.com/ts/product/b2/7c/88/df8ea8d5cc67c50e36e2813af70a8b21.jpg, https://salt.tikicdn.com/ts/product/19/ce/c2/3928cefcdc5abf1940cc66194b774b83.jpg, https://salt.tikicdn.com/ts/product/d0/86/1f/479dfc2253a2a1c5e6268cdce0a1396c.jpg, https://salt.tikicdn.com/ts/product/ed/69/42/d4e632173271206310d74dd7b3c74c27.jpg","https://salt.tikicdn.com/cache/w1200/ts/product/c6/1c/93/d8cbaa564900832ef772d228771d8c7b.jpg, https://salt.tikicdn.com/cache/w1200/ts/product/91/a3/90/27418a68ce42eeae4c7aada1e4292efb.jpg, https://salt.tikicdn.com/cache/w1200/ts/product/93/1d/a7/d75a5a60c270bf395b5342b110e2751d.jpg, https://salt.tikicdn.com/cache/w1200/ts/product/1d/c2/c4/78804fc22a837090f73f170af53b3ad1.jpg, https://salt.tikicdn.com/cache/w1200/ts/product/09/9f/20/bd86d45e129060b4f610a3906a5f795f.jpg, https://salt.tikicdn.com/cache/w1200/ts/product/3c/4a/07/2f89b12b965643cb86d2405e73e26368.jpg, https://salt.tikicdn.com/cache/w1200/ts/product/41/2d/34/f8aa3ff1b22d8933cf0da34e8452de85.jpg, https://salt.tikicdn.com/cache/w1200/ts/product/4f/8c/25/5b795a4999e32c704a62cfbadee8ad60.jpg, https://salt.tikicdn.com/cache/w1200/ts/product/59/e3/a5/caa86c61f4b3e214f6ddb0a2ffa87493.jpg, https://salt.tikicdn.com/cache/w1200/ts/product/19/e1/89/b4e58fd601c7f4126fc29a1bde88dfc9.jpg, https://salt.tikicdn.com/cache/w1200/ts/product/87/0e/0f/08cce6b18ed9551c9a3ebafa5b298752.jpg, https://salt.tikicdn.com/cache/w1200/ts/product/3b/b3/f6/ff1f807e95abd2d7eb14de71a8808da3.jpg, https://salt.tikicdn.com/cache/w1200/ts/product/95/d5/0e/ca4aad2859e0a18decbe5bab40b53d7c.jpg, https://salt.tikicdn.com/cache/w1200/ts/product/a8/cc/3e/fe4fe9a9ed75e5cf415725ad26c01d64.jpg, https://salt.tikicdn.com/cache/w1200/ts/product/ae/7b/4d/41684fc60c16d266f98fe478c9d83da0.jpg, https://salt.tikicdn.com/cache/w1200/ts/product/b0/a9/2a/6e1d4b275b27e95837ec4e507c9b0170.jpg, https://salt.tikicdn.com/cache/w1200/ts/product/b2/7c/88/df8ea8d5cc67c50e36e2813af70a8b21.jpg, https://salt.tikicdn.com/cache/w1200/ts/product/19/ce/c2/3928cefcdc5abf1940cc66194b774b83.jpg, https://salt.tikicdn.com/cache/w1200/ts/product/d0/86/1f/479dfc2253a2a1c5e6268cdce0a1396c.jpg, https://salt.tikicdn.com/cache/w1200/ts/product/ed/69/42/d4e632173271206310d74dd7b3c74c27.jpg","https://salt.tikicdn.com/cache/w300/ts/product/c6/1c/93/d8cbaa564900832ef772d228771d8c7b.jpg, https://salt.tikicdn.com/cache/w300/ts/product/91/a3/90/27418a68ce42eeae4c7aada1e4292efb.jpg, https://salt.tikicdn.com/cache/w300/ts/product/93/1d/a7/d75a5a60c270bf395b5342b110e2751d.jpg, https://salt.tikicdn.com/cache/w300/ts/product/1d/c2/c4/78804fc22a837090f73f170af53b3ad1.jpg, https://salt.tikicdn.com/cache/w300/ts/product/09/9f/20/bd86d45e129060b4f610a3906a5f795f.jpg, https://salt.tikicdn.com/cache/w300/ts/product/3c/4a/07/2f89b12b965643cb86d2405e73e26368.jpg, https://salt.tikicdn.com/cache/w300/ts/product/41/2d/34/f8aa3ff1b22d8933cf0da34e8452de85.jpg, https://salt.tikicdn.com/cache/w300/ts/product/4f/8c/25/5b795a4999e32c704a62cfbadee8ad60.jpg, https://salt.tikicdn.com/cache/w300/ts/product/59/e3/a5/caa86c61f4b3e214f6ddb0a2ffa87493.jpg, https://salt.tikicdn.com/cache/w300/ts/product/19/e1/89/b4e58fd601c7f4126fc29a1bde88dfc9.jpg, https://salt.tikicdn.com/cache/w300/ts/product/87/0e/0f/08cce6b18ed9551c9a3ebafa5b298752.jpg, https://salt.tikicdn.com/cache/w300/ts/product/3b/b3/f6/ff1f807e95abd2d7eb14de71a8808da3.jpg, https://salt.tikicdn.com/cache/w300/ts/product/95/d5/0e/ca4aad2859e0a18decbe5bab40b53d7c.jpg, https://salt.tikicdn.com/cache/w300/ts/product/a8/cc/3e/fe4fe9a9ed75e5cf415725ad26c01d64.jpg, https://salt.tikicdn.com/cache/w300/ts/product/ae/7b/4d/41684fc60c16d266f98fe478c9d83da0.jpg, https://salt.tikicdn.com/cache/w300/ts/product/b0/a9/2a/6e1d4b275b27e95837ec4e507c9b0170.jpg, https://salt.tikicdn.com/cache/w300/ts/product/b2/7c/88/df8ea8d5cc67c50e36e2813af70a8b21.jpg, https://salt.tikicdn.com/cache/w300/ts/product/19/ce/c2/3928cefcdc5abf1940cc66194b774b83.jpg, https://salt.tikicdn.com/cache/w300/ts/product/d0/86/1f/479dfc2253a2a1c5e6268cdce0a1396c.jpg, https://salt.tikicdn.com/cache/w300/ts/product/ed/69/42/d4e632173271206310d74dd7b3c74c27.jpg","https://salt.tikicdn.com/cache/200x280/ts/product/c6/1c/93/d8cbaa564900832ef772d228771d8c7b.jpg, https://salt.tikicdn.com/cache/200x280/ts/product/91/a3/90/27418a68ce42eeae4c7aada1e4292efb.jpg, https://salt.tikicdn.com/cache/200x280/ts/product/93/1d/a7/d75a5a60c270bf395b5342b110e2751d.jpg, https://salt.tikicdn.com/cache/200x280/ts/product/1d/c2/c4/78804fc22a837090f73f170af53b3ad1.jpg, https://salt.tikicdn.com/cache/200x280/ts/product/09/9f/20/bd86d45e129060b4f610a3906a5f795f.jpg, https://salt.tikicdn.com/cache/200x280/ts/product/3c/4a/07/2f89b12b965643cb86d2405e73e26368.jpg, https://salt.tikicdn.com/cache/200x280/ts/product/41/2d/34/f8aa3ff1b22d8933cf0da34e8452de85.jpg, https://salt.tikicdn.com/cache/200x280/ts/product/4f/8c/25/5b795a4999e32c704a62cfbadee8ad60.jpg, https://salt.tikicdn.com/cache/200x280/ts/product/59/e3/a5/caa86c61f4b3e214f6ddb0a2ffa87493.jpg, https://salt.tikicdn.com/cache/200x280/ts/product/19/e1/89/b4e58fd601c7f4126fc29a1bde88dfc9.jpg, https://salt.tikicdn.com/cache/200x280/ts/product/87/0e/0f/08cce6b18ed9551c9a3ebafa5b298752.jpg, https://salt.tikicdn.com/cache/200x280/ts/product/3b/b3/f6/ff1f807e95abd2d7eb14de71a8808da3.jpg, https://salt.tikicdn.com/cache/200x280/ts/product/95/d5/0e/ca4aad2859e0a18decbe5bab40b53d7c.jpg, https://salt.tikicdn.com/cache/200x280/ts/product/a8/cc/3e/fe4fe9a9ed75e5cf415725ad26c01d64.jpg, https://salt.tikicdn.com/cache/200x280/ts/product/ae/7b/4d/41684fc60c16d266f98fe478c9d83da0.jpg, https://salt.tikicdn.com/cache/200x280/ts/product/b0/a9/2a/6e1d4b275b27e95837ec4e507c9b0170.jpg, https://salt.tikicdn.com/cache/200x280/ts/product/b2/7c/88/df8ea8d5cc67c50e36e2813af70a8b21.jpg, https://salt.tikicdn.com/cache/200x280/ts/product/19/ce/c2/3928cefcdc5abf1940cc66194b774b83.jpg, https://salt.tikicdn.com/cache/200x280/ts/product/d0/86/1f/479dfc2253a2a1c5e6268cdce0a1396c.jpg, https://salt.tikicdn.com/cache/200x280/ts/product/ed/69/42/d4e632173271206310d74dd7b3c74c27.jpg","https://salt.tikicdn.com/cache/200x280/ts/product/c6/1c/93/d8cbaa564900832ef772d228771d8c7b.jpg, https://salt.tikicdn.com/cache/200x280/ts/product/91/a3/90/27418a68ce42eeae4c7aada1e4292efb.jpg, https://salt.tikicdn.com/cache/200x280/ts/product/93/1d/a7/d75a5a60c270bf395b5342b110e2751d.jpg, https://salt.tikicdn.com/cache/200x280/ts/product/1d/c2/c4/78804fc22a837090f73f170af53b3ad1.jpg, https://salt.tikicdn.com/cache/200x280/ts/product/09/9f/20/bd86d45e129060b4f610a3906a5f795f.jpg, https://salt.tikicdn.com/cache/200x280/ts/product/3c/4a/07/2f89b12b965643cb86d2405e73e26368.jpg, https://salt.tikicdn.com/cache/200x280/ts/product/41/2d/34/f8aa3ff1b22d8933cf0da34e8452de85.jpg, https://salt.tikicdn.com/cache/200x280/ts/product/4f/8c/25/5b795a4999e32c704a62cfbadee8ad60.jpg, https://salt.tikicdn.com/cache/200x280/ts/product/59/e3/a5/caa86c61f4b3e214f6ddb0a2ffa87493.jpg, https://salt.tikicdn.com/cache/200x280/ts/product/19/e1/89/b4e58fd601c7f4126fc29a1bde88dfc9.jpg, https://salt.tikicdn.com/cache/200x280/ts/product/87/0e/0f/08cce6b18ed9551c9a3ebafa5b298752.jpg, https://salt.tikicdn.com/cache/200x280/ts/product/3b/b3/f6/ff1f807e95abd2d7eb14de71a8808da3.jpg, https://salt.tikicdn.com/cache/200x280/ts/product/95/d5/0e/ca4aad2859e0a18decbe5bab40b53d7c.jpg, https://salt.tikicdn.com/cache/200x280/ts/product/a8/cc/3e/fe4fe9a9ed75e5cf415725ad26c01d64.jpg, https://salt.tikicdn.com/cache/200x280/ts/product/ae/7b/4d/41684fc60c16d266f98fe478c9d83da0.jpg, https://salt.tikicdn.com/cache/200x280/ts/product/b0/a9/2a/6e1d4b275b27e95837ec4e507c9b0170.jpg, https://salt.tikicdn.com/cache/200x280/ts/product/b2/7c/88/df8ea8d5cc67c50e36e2813af70a8b21.jpg, https://salt.tikicdn.com/cache/200x280/ts/product/19/ce/c2/3928cefcdc5abf1940cc66194b774b83.jpg, https://salt.tikicdn.com/cache/200x280/ts/product/d0/86/1f/479dfc2253a2a1c5e6268cdce0a1396c.jpg, https://salt.tikicdn.com/cache/200x280/ts/product/ed/69/42/d4e632173271206310d74dd7b3c74c27.jpg",1000,0
