id,name,price,short_description,description,rating_average,review_count,image_base_url,image_large_url,image_medium_url,image_small_url,image_thumbnail_url,stock,quantity_sold
121089351,"Sách - The Night Flower - Sách Nói Về Loài Hoa Xương Rồng Nở Về Đêm, Cây Xương Rồng Saguaro Trên Sa Mạc Sonoran Ở Arizona - Á Châu Book, Bìa Cứng, In Màu",395000,"Sách - The Night Flower An exquisitely illustrated non-fiction picture book about a desert flower that blooms for just one night a year.As the summer sun sets over the Arizonan desert, wildlife ga...","Sách - The Night Flower An exquisitely illustrated non-fiction picture book about a desert flower that blooms for just one night a year. As the summer sun sets over the Arizonan desert, wildlife gathers to witness a very special annual event. The night flower is about to bloom. This celebration transforms the quiet desert for just a short few hours into a riot of colour and sound, as mammals and insects congregate from miles away to take part in this miracle of nature. From pollinating fruit bats to howling mice and reptilian monsters, explore the unusual wildlife the desert has to offer in this beautiful rhyming non-fiction picture book. Giá sản phẩm trên Tiki đã bao gồm thuế theo luật hiện hành. Bên cạnh đó, tuỳ vào loại sản phẩm, hình thức và địa chỉ giao hàng mà có thể phát sinh thêm chi phí khác như phí vận chuyển, phụ phí hàng cồng kềnh, thuế nhập khẩu (đối với đơn hàng giao từ nước ngoài có giá trị trên 1 triệu đồng).....",0,0,"https://salt.tikicdn.com/ts/product/cc/90/62/ad8603df356456adab8e70a6cd9a377f.jpg, https://salt.tikicdn.com/ts/product/93/85/a7/b375ac0c1fa5dddc650c837fa25cadd1.jpg, https://salt.tikicdn.com/ts/product/6f/b7/87/dfa98b981c958130c13f1844882a7a6a.jpg, https://salt.tikicdn.com/ts/product/b8/c8/9c/5209c4750ac7d45960122f4521cbe7e4.jpg","https://salt.tikicdn.com/cache/w1200/ts/product/cc/90/62/ad8603df356456adab8e70a6cd9a377f.jpg, https://salt.tikicdn.com/cache/w1200/ts/product/93/85/a7/b375ac0c1fa5dddc650c837fa25cadd1.jpg, https://salt.tikicdn.com/cache/w1200/ts/product/6f/b7/87/dfa98b981c958130c13f1844882a7a6a.jpg, https://salt.tikicdn.com/cache/w1200/ts/product/b8/c8/9c/5209c4750ac7d45960122f4521cbe7e4.jpg","https://salt.tikicdn.com/cache/w300/ts/product/cc/90/62/ad8603df356456adab8e70a6cd9a377f.jpg, https://salt.tikicdn.com/cache/w300/ts/product/93/85/a7/b375ac0c1fa5dddc650c837fa25cadd1.jpg, https://salt.tikicdn.com/cache/w300/ts/product/6f/b7/87/dfa98b981c958130c13f1844882a7a6a.jpg, https://salt.tikicdn.com/cache/w300/ts/product/b8/c8/9c/5209c4750ac7d45960122f4521cbe7e4.jpg","https://salt.tikicdn.com/cache/200x280/ts/product/cc/90/62/ad8603df356456adab8e70a6cd9a377f.jpg, https://salt.tikicdn.com/cache/200x280/ts/product/93/85/a7/b375ac0c1fa5dddc650c837fa25cadd1.jpg, https://salt.tikicdn.com/cache/200x280/ts/product/6f/b7/87/dfa98b981c958130c13f1844882a7a6a.jpg, https://salt.tikicdn.com/cache/200x280/ts/product/b8/c8/9c/5209c4750ac7d45960122f4521cbe7e4.jpg","https://salt.tikicdn.com/cache/200x280/ts/product/cc/90/62/ad8603df356456adab8e70a6cd9a377f.jpg, https://salt.tikicdn.com/cache/200x280/ts/product/93/85/a7/b375ac0c1fa5dddc650c837fa25cadd1.jpg, https://salt.tikicdn.com/cache/200x280/ts/product/6f/b7/87/dfa98b981c958130c13f1844882a7a6a.jpg, https://salt.tikicdn.com/cache/200x280/ts/product/b8/c8/9c/5209c4750ac7d45960122f4521cbe7e4.jpg",1000,0
116194923,Extreme Sports Level 2,90000,"Up in the air! Down on the ground! Under the water! Extreme sports are new, exciting, and dangerous! Learn about extreme sports from aerial ballet to zorbing. Read about the crazy people who love extr...","Up in the air! Down on the ground! Under the water! Extreme sports are new, exciting, and dangerous! Learn about extreme sports from aerial ballet to zorbing. Read about the crazy people who love extreme sports. Are extreme sports for you? Giá sản phẩm trên Tiki đã bao gồm thuế theo luật hiện hành. Bên cạnh đó, tuỳ vào loại sản phẩm, hình thức và địa chỉ giao hàng mà có thể phát sinh thêm chi phí khác như phí vận chuyển, phụ phí hàng cồng kềnh, thuế nhập khẩu (đối với đơn hàng giao từ nước ngoài có giá trị trên 1 triệu đồng).....",0,0,https://salt.tikicdn.com/ts/product/92/d7/96/9d3cc95d3dccbc246bac8ee2924cc88e.jpg,https://salt.tikicdn.com/cache/w1200/ts/product/92/d7/96/9d3cc95d3dccbc246bac8ee2924cc88e.jpg,https://salt.tikicdn.com/cache/w300/ts/product/92/d7/96/9d3cc95d3dccbc246bac8ee2924cc88e.jpg,https://salt.tikicdn.com/cache/200x280/ts/product/92/d7/96/9d3cc95d3dccbc246bac8ee2924cc88e.jpg,https://salt.tikicdn.com/cache/200x280/ts/product/92/d7/96/9d3cc95d3dccbc246bac8ee2924cc88e.jpg,1000,0
116188974,The Missing Coins Level 1,90000,"Pete and Carla are students. One day they look at some very old coins and stamps in a shop. Pete wants to buy some stamps, but they are very expensive. Later that day some coins are missing from the s...","Pete and Carla are students. One day they look at some very old coins and stamps in a shop. Pete wants to buy some stamps, but they are very expensive. Later that day some coins are missing from the shop – and the shopkeeper wants to find Pete. Hình ảnh có thể thay đổi theo từng đợt nhập hàng Giá sản phẩm trên Tiki đã bao gồm thuế theo luật hiện hành. Bên cạnh đó, tuỳ vào loại sản phẩm, hình thức và địa chỉ giao hàng mà có thể phát sinh thêm chi phí khác như phí vận chuyển, phụ phí hàng cồng kềnh, thuế nhập khẩu (đối với đơn hàng giao từ nước ngoài có giá trị trên 1 triệu đồng).....",0,0,"https://salt.tikicdn.com/ts/product/db/14/c4/ca3f398416179e283e7a2cc4b4c6fe40.jpg, https://salt.tikicdn.com/ts/product/27/79/76/63281f81e17dcdcc45672f9eb6d5441a.png","https://salt.tikicdn.com/cache/w1200/ts/product/db/14/c4/ca3f398416179e283e7a2cc4b4c6fe40.jpg, https://salt.tikicdn.com/cache/w1200/ts/product/27/79/76/63281f81e17dcdcc45672f9eb6d5441a.png","https://salt.tikicdn.com/cache/w300/ts/product/db/14/c4/ca3f398416179e283e7a2cc4b4c6fe40.jpg, https://salt.tikicdn.com/cache/w300/ts/product/27/79/76/63281f81e17dcdcc45672f9eb6d5441a.png","https://salt.tikicdn.com/cache/200x280/ts/product/db/14/c4/ca3f398416179e283e7a2cc4b4c6fe40.jpg, https://salt.tikicdn.com/cache/200x280/ts/product/27/79/76/63281f81e17dcdcc45672f9eb6d5441a.png","https://salt.tikicdn.com/cache/200x280/ts/product/db/14/c4/ca3f398416179e283e7a2cc4b4c6fe40.jpg, https://salt.tikicdn.com/cache/200x280/ts/product/27/79/76/63281f81e17dcdcc45672f9eb6d5441a.png",1000,0
115941673,The Fireboy Level ES,100000,Hapu is poor and lives in ancient Egypt. His father works hard making gold tables and chairs. Hapu also helps him. But his father becomes ill because he works so hard. Hapu decided that he's going to ...,"Hapu is poor and lives in ancient Egypt. His father works hard making gold tables and chairs. Hapu also helps him. But his father becomes ill because he works so hard. Hapu decided that he's going to help him by making something for someone very rich. But will his dream come true? Giá sản phẩm trên Tiki đã bao gồm thuế theo luật hiện hành. Bên cạnh đó, tuỳ vào loại sản phẩm, hình thức và địa chỉ giao hàng mà có thể phát sinh thêm chi phí khác như phí vận chuyển, phụ phí hàng cồng kềnh, thuế nhập khẩu (đối với đơn hàng giao từ nước ngoài có giá trị trên 1 triệu đồng).....",0,0,https://salt.tikicdn.com/ts/product/11/73/dc/8e8bcbbf8f5eed58a177401a2facffac.jpg,https://salt.tikicdn.com/cache/w1200/ts/product/11/73/dc/8e8bcbbf8f5eed58a177401a2facffac.jpg,https://salt.tikicdn.com/cache/w300/ts/product/11/73/dc/8e8bcbbf8f5eed58a177401a2facffac.jpg,https://salt.tikicdn.com/cache/200x280/ts/product/11/73/dc/8e8bcbbf8f5eed58a177401a2facffac.jpg,https://salt.tikicdn.com/cache/200x280/ts/product/11/73/dc/8e8bcbbf8f5eed58a177401a2facffac.jpg,1000,0
102133185,"My Book Of Dinosaurs And Prehistoric Life: Animals And Plants To Amaze, Surprise, And Astonish!",286100,"My Book Of Dinosaurs And Prehistoric Life: Animals And Plants To Amaze, Surprise, And Astonish!   Travel back in time to discover the incredible plants and animals of prehistoric Earth. It's the ulti...","My Book Of Dinosaurs And Prehistoric Life: Animals And Plants To Amaze, Surprise, And Astonish! Travel back in time to discover the incredible plants and animals of prehistoric Earth. It's the ultimate first dinosaur book for young readers! From the first living cells to fearsome dinosaurs and giant mammals, this children's book brings your budding palaeontologist face-to-face with these awe-inspiring creatures! The Prehistoric World Awaits! Packed with jaw-dropping images, fascinating dinosaur facts and straight-forward explanations, it's the perfect gift for children aged 5 to 8 with a love of prehistoric beasts and dinosaurs. Inside the pages of this dinosaur encyclopedia from DK Books, you'll discover: - Large pictures and clear, jargon-free text for curious minds - A handy, pronunciation guide for each animal or plant - Visual index arranged chronologically, so species can be found quickly - Detailed profiles of 50 species with key information and fun facts such as size, time period and location Little dinosaur lovers will be captivated by the amazing range of prehistoric beasts on display! Detailed artworks bring the past to life, painting a spectacular portrait of the supersized, the scary, and the downright bizarre animals and plants that inhabited Earth in ancient times. Throughout the pages of this fascinating prehistoric book, you'll discover how the Earth has changed over time, why fossils formed, and the arrival of early humans. A pronunciation guide helps kids with tricky names and encourages early learning and language development. The helpful visual index provides a quick overview of every species in the book. Learn more about prehistoric animals and plants, their extinction and even the evolution of early humans. Your little one will love reading about famous favourites such as the mighty Tyrannosaurus and the huge Woolly Mammoths! They will also get to know lesser-known organisms, including sail-backed Dimetrodon and aeroplane-sized pterosaur Quetzalcoatlus. These profiles are jargon-free and based on the latest science to take your little one through the evolutionary journey from fossil formation to the ice ages. Giá sản phẩm trên Tiki đã bao gồm thuế theo luật hiện hành. Bên cạnh đó, tuỳ vào loại sản phẩm, hình thức và địa chỉ giao hàng mà có thể phát sinh thêm chi phí khác như phí vận chuyển, phụ phí hàng cồng kềnh, thuế nhập khẩu (đối với đơn hàng giao từ nước ngoài có giá trị trên 1 triệu đồng).....",0,0,"https://salt.tikicdn.com/ts/product/95/25/8d/b0fb99b8f4e981e9ea4b92499c038acf.jpg, https://salt.tikicdn.com/ts/product/d2/1b/42/cc4939540c9cb81fb2defe7bb9371b09.jpg, https://salt.tikicdn.com/ts/product/8a/fe/46/292977e26856afcfa6ad8caf11e5d25c.jpg, https://salt.tikicdn.com/ts/product/99/f5/0d/a8d140ba8c3ea5b769bc22f8967686f8.jpg, https://salt.tikicdn.com/ts/product/9a/18/0a/15ec109c15c609c472f3bb7f4bc6669a.jpg, https://salt.tikicdn.com/ts/product/67/ba/6d/3139a3c3dbf1e30776ad236ae282f27f.jpg, https://salt.tikicdn.com/ts/product/8c/90/d6/304a35ebf7bf567924e6030b3def37fc.jpg, https://salt.tikicdn.com/ts/product/5c/97/23/6e8130dd4c0b3b9d17e06b6a6f1aebbe.jpg","https://salt.tikicdn.com/cache/w1200/ts/product/95/25/8d/b0fb99b8f4e981e9ea4b92499c038acf.jpg, https://salt.tikicdn.com/cache/w1200/ts/product/d2/1b/42/cc4939540c9cb81fb2defe7bb9371b09.jpg, https://salt.tikicdn.com/cache/w1200/ts/product/8a/fe/46/292977e26856afcfa6ad8caf11e5d25c.jpg, https://salt.tikicdn.com/cache/w1200/ts/product/99/f5/0d/a8d140ba8c3ea5b769bc22f8967686f8.jpg, https://salt.tikicdn.com/cache/w1200/ts/product/9a/18/0a/15ec109c15c609c472f3bb7f4bc6669a.jpg, https://salt.tikicdn.com/cache/w1200/ts/product/67/ba/6d/3139a3c3dbf1e30776ad236ae282f27f.jpg, https://salt.tikicdn.com/cache/w1200/ts/product/8c/90/d6/304a35ebf7bf567924e6030b3def37fc.jpg, https://salt.tikicdn.com/cache/w1200/ts/product/5c/97/23/6e8130dd4c0b3b9d17e06b6a6f1aebbe.jpg","https://salt.tikicdn.com/cache/w300/ts/product/95/25/8d/b0fb99b8f4e981e9ea4b92499c038acf.jpg, https://salt.tikicdn.com/cache/w300/ts/product/d2/1b/42/cc4939540c9cb81fb2defe7bb9371b09.jpg, https://salt.tikicdn.com/cache/w300/ts/product/8a/fe/46/292977e26856afcfa6ad8caf11e5d25c.jpg, https://salt.tikicdn.com/cache/w300/ts/product/99/f5/0d/a8d140ba8c3ea5b769bc22f8967686f8.jpg, https://salt.tikicdn.com/cache/w300/ts/product/9a/18/0a/15ec109c15c609c472f3bb7f4bc6669a.jpg, https://salt.tikicdn.com/cache/w300/ts/product/67/ba/6d/3139a3c3dbf1e30776ad236ae282f27f.jpg, https://salt.tikicdn.com/cache/w300/ts/product/8c/90/d6/304a35ebf7bf567924e6030b3def37fc.jpg, https://salt.tikicdn.com/cache/w300/ts/product/5c/97/23/6e8130dd4c0b3b9d17e06b6a6f1aebbe.jpg","https://salt.tikicdn.com/cache/200x280/ts/product/95/25/8d/b0fb99b8f4e981e9ea4b92499c038acf.jpg, https://salt.tikicdn.com/cache/200x280/ts/product/d2/1b/42/cc4939540c9cb81fb2defe7bb9371b09.jpg, https://salt.tikicdn.com/cache/200x280/ts/product/8a/fe/46/292977e26856afcfa6ad8caf11e5d25c.jpg, https://salt.tikicdn.com/cache/200x280/ts/product/99/f5/0d/a8d140ba8c3ea5b769bc22f8967686f8.jpg, https://salt.tikicdn.com/cache/200x280/ts/product/9a/18/0a/15ec109c15c609c472f3bb7f4bc6669a.jpg, https://salt.tikicdn.com/cache/200x280/ts/product/67/ba/6d/3139a3c3dbf1e30776ad236ae282f27f.jpg, https://salt.tikicdn.com/cache/200x280/ts/product/8c/90/d6/304a35ebf7bf567924e6030b3def37fc.jpg, https://salt.tikicdn.com/cache/200x280/ts/product/5c/97/23/6e8130dd4c0b3b9d17e06b6a6f1aebbe.jpg","https://salt.tikicdn.com/cache/200x280/ts/product/95/25/8d/b0fb99b8f4e981e9ea4b92499c038acf.jpg, https://salt.tikicdn.com/cache/200x280/ts/product/d2/1b/42/cc4939540c9cb81fb2defe7bb9371b09.jpg, https://salt.tikicdn.com/cache/200x280/ts/product/8a/fe/46/292977e26856afcfa6ad8caf11e5d25c.jpg, https://salt.tikicdn.com/cache/200x280/ts/product/99/f5/0d/a8d140ba8c3ea5b769bc22f8967686f8.jpg, https://salt.tikicdn.com/cache/200x280/ts/product/9a/18/0a/15ec109c15c609c472f3bb7f4bc6669a.jpg, https://salt.tikicdn.com/cache/200x280/ts/product/67/ba/6d/3139a3c3dbf1e30776ad236ae282f27f.jpg, https://salt.tikicdn.com/cache/200x280/ts/product/8c/90/d6/304a35ebf7bf567924e6030b3def37fc.jpg, https://salt.tikicdn.com/cache/200x280/ts/product/5c/97/23/6e8130dd4c0b3b9d17e06b6a6f1aebbe.jpg",1000,0
55286829,A Voice for the Spirit Bears: How One Boy Inspired Millions to Save a Rare Animal,429700,"A Voice for the Spirit Bears: How One Boy Inspired Millions to Save a Rare Animal   As a child, Simon Jackson found navigating the world of the school playground difficult. He felt most at home in th...","A Voice for the Spirit Bears: How One Boy Inspired Millions to Save a Rare Animal As a child, Simon Jackson found navigating the world of the school playground difficult. He felt most at home in the woodlands, learning about and photographing wildlife. As a teenager, he became fascinated with spirit bears, a rare subspecies of black bear with creamy white fur. These elusive creatures were losing their habitat to deforestation, and Simon knew he had to do something to protect them. He decided he would become the voice for the spirit bears. But first, he would have to find his own. Carmen Oliver's inspiring true story is based on the early life of Simon Jackson, who founded the Spirit Bear Youth Coalition. On his remarkable journey to protect the spirit bears, he met Dr. Jane Goodall and eventually hiked the Great Bear Rainforest --- the home of these elusive animals. Katy Dockrill's captivating art adds depth and beauty to the story. Photos and additional details about Simon Jackson's life and about spirit bears are included in the end matter. Part of the CitizenKid collection, this book demonstrates how one child can be a voice for change. Simon's story is an excellent example of growth mindset at work, highlighting personal growth and overcoming obstacles through activism. This book can also be used to lead discussions about character education as it relates to courage, resilience and perseverance. In addition, it has strong science curriculum links to the environment, animal habitats and the effects of clear-cutting. Giá sản phẩm trên Tiki đã bao gồm thuế theo luật hiện hành. Bên cạnh đó, tuỳ vào loại sản phẩm, hình thức và địa chỉ giao hàng mà có thể phát sinh thêm chi phí khác như phí vận chuyển, phụ phí hàng cồng kềnh, thuế nhập khẩu (đối với đơn hàng giao từ nước ngoài có giá trị trên 1 triệu đồng).....",0,0,"https://salt.tikicdn.com/ts/product/99/b3/e1/8c16d6d002aa0f12b7f53012bdd8dc89.jpg, https://salt.tikicdn.com/ts/product/f3/4e/24/6e54978face1f5f45c2e7e30ba9eec62.jpg, https://salt.tikicdn.com/ts/product/1b/0d/ef/b586af3b4535d94b19ae60e28a5d50f1.png, https://salt.tikicdn.com/ts/product/1e/c4/60/ed76cc0ca96bd076222471ba22e34d82.jpg, https://salt.tikicdn.com/ts/product/f8/e9/5e/a2ea054747f1b1b99b7ca8446cfdb74c.jpg, https://salt.tikicdn.com/ts/product/06/90/25/a4ea5ae011f0a04b7f62d13d8501fb57.jpg, https://salt.tikicdn.com/ts/product/cd/d9/5a/24f2d1e9edde1b9caf49d29a0f7685cf.jpg, https://salt.tikicdn.com/ts/product/f6/be/41/ca7e6cc259af2beaab4f2eb4c07f459c.jpg, https://salt.tikicdn.com/ts/product/d2/68/98/591d792b7520822ab5a3ee7d489f7029.jpg, https://salt.tikicdn.com/ts/product/ab/c8/bd/ce5f67521a76baf5f93e210f84f3cc84.jpg, https://salt.tikicdn.com/ts/product/09/cf/e6/987c91df5a6d776461b9d0d614d9b976.jpg, https://salt.tikicdn.com/ts/product/6f/28/3b/a93f822beae3624f75f72e77fa688d79.jpg, https://salt.tikicdn.com/ts/product/4e/08/ef/723da271202663bea2c70d91b9960d55.jpg, https://salt.tikicdn.com/ts/product/a8/df/52/cc74524b1480e142e221af3fb8b3d321.jpg, https://salt.tikicdn.com/ts/product/fa/8e/2f/1f412aeb9628bbafeb40efe54ddcac91.jpg","https://salt.tikicdn.com/cache/w1200/ts/product/99/b3/e1/8c16d6d002aa0f12b7f53012bdd8dc89.jpg, https://salt.tikicdn.com/cache/w1200/ts/product/f3/4e/24/6e54978face1f5f45c2e7e30ba9eec62.jpg, https://salt.tikicdn.com/cache/w1200/ts/product/1b/0d/ef/b586af3b4535d94b19ae60e28a5d50f1.png, https://salt.tikicdn.com/cache/w1200/ts/product/1e/c4/60/ed76cc0ca96bd076222471ba22e34d82.jpg, https://salt.tikicdn.com/cache/w1200/ts/product/f8/e9/5e/a2ea054747f1b1b99b7ca8446cfdb74c.jpg, https://salt.tikicdn.com/cache/w1200/ts/product/06/90/25/a4ea5ae011f0a04b7f62d13d8501fb57.jpg, https://salt.tikicdn.com/cache/w1200/ts/product/cd/d9/5a/24f2d1e9edde1b9caf49d29a0f7685cf.jpg, https://salt.tikicdn.com/cache/w1200/ts/product/f6/be/41/ca7e6cc259af2beaab4f2eb4c07f459c.jpg, https://salt.tikicdn.com/cache/w1200/ts/product/d2/68/98/591d792b7520822ab5a3ee7d489f7029.jpg, https://salt.tikicdn.com/cache/w1200/ts/product/ab/c8/bd/ce5f67521a76baf5f93e210f84f3cc84.jpg, https://salt.tikicdn.com/cache/w1200/ts/product/09/cf/e6/987c91df5a6d776461b9d0d614d9b976.jpg, https://salt.tikicdn.com/cache/w1200/ts/product/6f/28/3b/a93f822beae3624f75f72e77fa688d79.jpg, https://salt.tikicdn.com/cache/w1200/ts/product/4e/08/ef/723da271202663bea2c70d91b9960d55.jpg, https://salt.tikicdn.com/cache/w1200/ts/product/a8/df/52/cc74524b1480e142e221af3fb8b3d321.jpg, https://salt.tikicdn.com/cache/w1200/ts/product/fa/8e/2f/1f412aeb9628bbafeb40efe54ddcac91.jpg","https://salt.tikicdn.com/cache/w300/ts/product/99/b3/e1/8c16d6d002aa0f12b7f53012bdd8dc89.jpg, https://salt.tikicdn.com/cache/w300/ts/product/f3/4e/24/6e54978face1f5f45c2e7e30ba9eec62.jpg, https://salt.tikicdn.com/cache/w300/ts/product/1b/0d/ef/b586af3b4535d94b19ae60e28a5d50f1.png, https://salt.tikicdn.com/cache/w300/ts/product/1e/c4/60/ed76cc0ca96bd076222471ba22e34d82.jpg, https://salt.tikicdn.com/cache/w300/ts/product/f8/e9/5e/a2ea054747f1b1b99b7ca8446cfdb74c.jpg, https://salt.tikicdn.com/cache/w300/ts/product/06/90/25/a4ea5ae011f0a04b7f62d13d8501fb57.jpg, https://salt.tikicdn.com/cache/w300/ts/product/cd/d9/5a/24f2d1e9edde1b9caf49d29a0f7685cf.jpg, https://salt.tikicdn.com/cache/w300/ts/product/f6/be/41/ca7e6cc259af2beaab4f2eb4c07f459c.jpg, https://salt.tikicdn.com/cache/w300/ts/product/d2/68/98/591d792b7520822ab5a3ee7d489f7029.jpg, https://salt.tikicdn.com/cache/w300/ts/product/ab/c8/bd/ce5f67521a76baf5f93e210f84f3cc84.jpg, https://salt.tikicdn.com/cache/w300/ts/product/09/cf/e6/987c91df5a6d776461b9d0d614d9b976.jpg, https://salt.tikicdn.com/cache/w300/ts/product/6f/28/3b/a93f822beae3624f75f72e77fa688d79.jpg, https://salt.tikicdn.com/cache/w300/ts/product/4e/08/ef/723da271202663bea2c70d91b9960d55.jpg, https://salt.tikicdn.com/cache/w300/ts/product/a8/df/52/cc74524b1480e142e221af3fb8b3d321.jpg, https://salt.tikicdn.com/cache/w300/ts/product/fa/8e/2f/1f412aeb9628bbafeb40efe54ddcac91.jpg","https://salt.tikicdn.com/cache/200x280/ts/product/99/b3/e1/8c16d6d002aa0f12b7f53012bdd8dc89.jpg, https://salt.tikicdn.com/cache/200x280/ts/product/f3/4e/24/6e54978face1f5f45c2e7e30ba9eec62.jpg, https://salt.tikicdn.com/cache/200x280/ts/product/1b/0d/ef/b586af3b4535d94b19ae60e28a5d50f1.png, https://salt.tikicdn.com/cache/200x280/ts/product/1e/c4/60/ed76cc0ca96bd076222471ba22e34d82.jpg, https://salt.tikicdn.com/cache/200x280/ts/product/f8/e9/5e/a2ea054747f1b1b99b7ca8446cfdb74c.jpg, https://salt.tikicdn.com/cache/200x280/ts/product/06/90/25/a4ea5ae011f0a04b7f62d13d8501fb57.jpg, https://salt.tikicdn.com/cache/200x280/ts/product/cd/d9/5a/24f2d1e9edde1b9caf49d29a0f7685cf.jpg, https://salt.tikicdn.com/cache/200x280/ts/product/f6/be/41/ca7e6cc259af2beaab4f2eb4c07f459c.jpg, https://salt.tikicdn.com/cache/200x280/ts/product/d2/68/98/591d792b7520822ab5a3ee7d489f7029.jpg, https://salt.tikicdn.com/cache/200x280/ts/product/ab/c8/bd/ce5f67521a76baf5f93e210f84f3cc84.jpg, https://salt.tikicdn.com/cache/200x280/ts/product/09/cf/e6/987c91df5a6d776461b9d0d614d9b976.jpg, https://salt.tikicdn.com/cache/200x280/ts/product/6f/28/3b/a93f822beae3624f75f72e77fa688d79.jpg, https://salt.tikicdn.com/cache/200x280/ts/product/4e/08/ef/723da271202663bea2c70d91b9960d55.jpg, https://salt.tikicdn.com/cache/200x280/ts/product/a8/df/52/cc74524b1480e142e221af3fb8b3d321.jpg, https://salt.tikicdn.com/cache/200x280/ts/product/fa/8e/2f/1f412aeb9628bbafeb40efe54ddcac91.jpg","https://salt.tikicdn.com/cache/200x280/ts/product/99/b3/e1/8c16d6d002aa0f12b7f53012bdd8dc89.jpg, https://salt.tikicdn.com/cache/200x280/ts/product/f3/4e/24/6e54978face1f5f45c2e7e30ba9eec62.jpg, https://salt.tikicdn.com/cache/200x280/ts/product/1b/0d/ef/b586af3b4535d94b19ae60e28a5d50f1.png, https://salt.tikicdn.com/cache/200x280/ts/product/1e/c4/60/ed76cc0ca96bd076222471ba22e34d82.jpg, https://salt.tikicdn.com/cache/200x280/ts/product/f8/e9/5e/a2ea054747f1b1b99b7ca8446cfdb74c.jpg, https://salt.tikicdn.com/cache/200x280/ts/product/06/90/25/a4ea5ae011f0a04b7f62d13d8501fb57.jpg, https://salt.tikicdn.com/cache/200x280/ts/product/cd/d9/5a/24f2d1e9edde1b9caf49d29a0f7685cf.jpg, https://salt.tikicdn.com/cache/200x280/ts/product/f6/be/41/ca7e6cc259af2beaab4f2eb4c07f459c.jpg, https://salt.tikicdn.com/cache/200x280/ts/product/d2/68/98/591d792b7520822ab5a3ee7d489f7029.jpg, https://salt.tikicdn.com/cache/200x280/ts/product/ab/c8/bd/ce5f67521a76baf5f93e210f84f3cc84.jpg, https://salt.tikicdn.com/cache/200x280/ts/product/09/cf/e6/987c91df5a6d776461b9d0d614d9b976.jpg, https://salt.tikicdn.com/cache/200x280/ts/product/6f/28/3b/a93f822beae3624f75f72e77fa688d79.jpg, https://salt.tikicdn.com/cache/200x280/ts/product/4e/08/ef/723da271202663bea2c70d91b9960d55.jpg, https://salt.tikicdn.com/cache/200x280/ts/product/a8/df/52/cc74524b1480e142e221af3fb8b3d321.jpg, https://salt.tikicdn.com/cache/200x280/ts/product/fa/8e/2f/1f412aeb9628bbafeb40efe54ddcac91.jpg",1000,0
