id,name,price,short_description,description,rating_average,review_count,image_base_url,image_large_url,image_medium_url,image_small_url,image_thumbnail_url,stock,quantity_sold
274676325,Explore My World: Honey Bees,103500,"    In this charming picture book, curious little kids will learn all about the bustling world of honeybees and the important role they play in our te ecosystem.   These engaging Explore My World ...","In this charming picture book, curious little kids will learn all about the bustling world of honeybees and the important role they play in our te ecosystem. These engaging Explore My World picture books on subjects kids care about combine simple stories with unforgettable photography. They invite little kids to take their first big steps toward understanding the world around them and are just the thing for parents and kids to curl up with and read aloud. Giá sản phẩm trên Tiki đã bao gồm thuế theo luật hiện hành. Bên cạnh đó, tuỳ vào loại sản phẩm, hình thức và địa chỉ giao hàng mà có thể phát sinh thêm chi phí khác như phí vận chuyển, phụ phí hàng cồng kềnh, thuế nhập khẩu (đối với đơn hàng giao từ nước ngoài có giá trị trên 1 triệu đồng).....",0,0,"https://salt.tikicdn.com/ts/product/84/41/03/a143d5af8b2a2c39a0d62613c30a7cd5.jpg, https://salt.tikicdn.com/ts/product/62/23/e8/5fb70ba7589bc6f6d983063822cf5b2e.jpg, https://salt.tikicdn.com/ts/product/4e/de/6e/42205b76b331e06bd8440a8f92fcafa5.jpg, https://salt.tikicdn.com/ts/product/97/54/cc/419ffa2f144fd8850623f00df06c5825.jpg, https://salt.tikicdn.com/ts/product/42/b2/50/67e409b0f7652132f1e04152e3993905.jpg, https://salt.tikicdn.com/ts/product/61/0b/be/2992c0e93e6860b1b425cefc6f17135e.jpg, https://salt.tikicdn.com/ts/product/73/3d/20/88dbf0503d6ff5564ff069d151707be2.jpg, https://salt.tikicdn.com/ts/product/36/b8/03/e4f4a16e5d2b7faa9fb661a25cdbf310.jpg","https://salt.tikicdn.com/cache/w1200/ts/product/84/41/03/a143d5af8b2a2c39a0d62613c30a7cd5.jpg, https://salt.tikicdn.com/cache/w1200/ts/product/62/23/e8/5fb70ba7589bc6f6d983063822cf5b2e.jpg, https://salt.tikicdn.com/cache/w1200/ts/product/4e/de/6e/42205b76b331e06bd8440a8f92fcafa5.jpg, https://salt.tikicdn.com/cache/w1200/ts/product/97/54/cc/419ffa2f144fd8850623f00df06c5825.jpg, https://salt.tikicdn.com/cache/w1200/ts/product/42/b2/50/67e409b0f7652132f1e04152e3993905.jpg, https://salt.tikicdn.com/cache/w1200/ts/product/61/0b/be/2992c0e93e6860b1b425cefc6f17135e.jpg, https://salt.tikicdn.com/cache/w1200/ts/product/73/3d/20/88dbf0503d6ff5564ff069d151707be2.jpg, https://salt.tikicdn.com/cache/w1200/ts/product/36/b8/03/e4f4a16e5d2b7faa9fb661a25cdbf310.jpg","https://salt.tikicdn.com/cache/w300/ts/product/84/41/03/a143d5af8b2a2c39a0d62613c30a7cd5.jpg, https://salt.tikicdn.com/cache/w300/ts/product/62/23/e8/5fb70ba7589bc6f6d983063822cf5b2e.jpg, https://salt.tikicdn.com/cache/w300/ts/product/4e/de/6e/42205b76b331e06bd8440a8f92fcafa5.jpg, https://salt.tikicdn.com/cache/w300/ts/product/97/54/cc/419ffa2f144fd8850623f00df06c5825.jpg, https://salt.tikicdn.com/cache/w300/ts/product/42/b2/50/67e409b0f7652132f1e04152e3993905.jpg, https://salt.tikicdn.com/cache/w300/ts/product/61/0b/be/2992c0e93e6860b1b425cefc6f17135e.jpg, https://salt.tikicdn.com/cache/w300/ts/product/73/3d/20/88dbf0503d6ff5564ff069d151707be2.jpg, https://salt.tikicdn.com/cache/w300/ts/product/36/b8/03/e4f4a16e5d2b7faa9fb661a25cdbf310.jpg","https://salt.tikicdn.com/cache/200x280/ts/product/84/41/03/a143d5af8b2a2c39a0d62613c30a7cd5.jpg, https://salt.tikicdn.com/cache/200x280/ts/product/62/23/e8/5fb70ba7589bc6f6d983063822cf5b2e.jpg, https://salt.tikicdn.com/cache/200x280/ts/product/4e/de/6e/42205b76b331e06bd8440a8f92fcafa5.jpg, https://salt.tikicdn.com/cache/200x280/ts/product/97/54/cc/419ffa2f144fd8850623f00df06c5825.jpg, https://salt.tikicdn.com/cache/200x280/ts/product/42/b2/50/67e409b0f7652132f1e04152e3993905.jpg, https://salt.tikicdn.com/cache/200x280/ts/product/61/0b/be/2992c0e93e6860b1b425cefc6f17135e.jpg, https://salt.tikicdn.com/cache/200x280/ts/product/73/3d/20/88dbf0503d6ff5564ff069d151707be2.jpg, https://salt.tikicdn.com/cache/200x280/ts/product/36/b8/03/e4f4a16e5d2b7faa9fb661a25cdbf310.jpg","https://salt.tikicdn.com/cache/200x280/ts/product/84/41/03/a143d5af8b2a2c39a0d62613c30a7cd5.jpg, https://salt.tikicdn.com/cache/200x280/ts/product/62/23/e8/5fb70ba7589bc6f6d983063822cf5b2e.jpg, https://salt.tikicdn.com/cache/200x280/ts/product/4e/de/6e/42205b76b331e06bd8440a8f92fcafa5.jpg, https://salt.tikicdn.com/cache/200x280/ts/product/97/54/cc/419ffa2f144fd8850623f00df06c5825.jpg, https://salt.tikicdn.com/cache/200x280/ts/product/42/b2/50/67e409b0f7652132f1e04152e3993905.jpg, https://salt.tikicdn.com/cache/200x280/ts/product/61/0b/be/2992c0e93e6860b1b425cefc6f17135e.jpg, https://salt.tikicdn.com/cache/200x280/ts/product/73/3d/20/88dbf0503d6ff5564ff069d151707be2.jpg, https://salt.tikicdn.com/cache/200x280/ts/product/36/b8/03/e4f4a16e5d2b7faa9fb661a25cdbf310.jpg",1000,0
274673949,500 Fantastic Facts - Dinosaurs,192600,    500 Fantastic Facts - Dinosaurs   Discover the wonders of the prehistoric world with this amazing pictorial reference guide and fact-packed introduction to dinosaurs. Embark on a discovery of ...,"500 Fantastic Facts - Dinosaurs Discover the wonders of the prehistoric world with this amazing pictorial reference guide and fact-packed introduction to dinosaurs. Embark on a discovery of 500 fantastic facts which will fascinate and educate children of all ages. Giá sản phẩm trên Tiki đã bao gồm thuế theo luật hiện hành. Bên cạnh đó, tuỳ vào loại sản phẩm, hình thức và địa chỉ giao hàng mà có thể phát sinh thêm chi phí khác như phí vận chuyển, phụ phí hàng cồng kềnh, thuế nhập khẩu (đối với đơn hàng giao từ nước ngoài có giá trị trên 1 triệu đồng).....",0,0,"https://salt.tikicdn.com/ts/product/02/73/7d/31cb978e263c5dedc189aa2f0a6497e9.jpg, https://salt.tikicdn.com/ts/product/97/19/22/f72765bcea4a75214ba6f2e2d10fffd4.jpg, https://salt.tikicdn.com/ts/product/c4/33/57/50aa3a58f8e4b5c4367604fdb4eface5.jpg","https://salt.tikicdn.com/cache/w1200/ts/product/02/73/7d/31cb978e263c5dedc189aa2f0a6497e9.jpg, https://salt.tikicdn.com/cache/w1200/ts/product/97/19/22/f72765bcea4a75214ba6f2e2d10fffd4.jpg, https://salt.tikicdn.com/cache/w1200/ts/product/c4/33/57/50aa3a58f8e4b5c4367604fdb4eface5.jpg","https://salt.tikicdn.com/cache/w300/ts/product/02/73/7d/31cb978e263c5dedc189aa2f0a6497e9.jpg, https://salt.tikicdn.com/cache/w300/ts/product/97/19/22/f72765bcea4a75214ba6f2e2d10fffd4.jpg, https://salt.tikicdn.com/cache/w300/ts/product/c4/33/57/50aa3a58f8e4b5c4367604fdb4eface5.jpg","https://salt.tikicdn.com/cache/200x280/ts/product/02/73/7d/31cb978e263c5dedc189aa2f0a6497e9.jpg, https://salt.tikicdn.com/cache/200x280/ts/product/97/19/22/f72765bcea4a75214ba6f2e2d10fffd4.jpg, https://salt.tikicdn.com/cache/200x280/ts/product/c4/33/57/50aa3a58f8e4b5c4367604fdb4eface5.jpg","https://salt.tikicdn.com/cache/200x280/ts/product/02/73/7d/31cb978e263c5dedc189aa2f0a6497e9.jpg, https://salt.tikicdn.com/cache/200x280/ts/product/97/19/22/f72765bcea4a75214ba6f2e2d10fffd4.jpg, https://salt.tikicdn.com/cache/200x280/ts/product/c4/33/57/50aa3a58f8e4b5c4367604fdb4eface5.jpg",1000,0
274143818,"Hello, Frog: Touch, Feel And Reveal",189000,"Hello, Frog: Touch, Feel And RevealJoin Frog on a jungle journey, and say hello to lots of friendly creatures along the way.This tactile board book is an incredible interactive adventure, packed wit...","Hello, Frog: Touch, Feel And Reveal Join Frog on a jungle journey, and say hello to lots of friendly creatures along the way. This tactile board book is an incredible interactive adventure, packed with touch-and-feels, flaps and peek-through holes. Follow Frog as he explores all kinds of wildlife, from a hummingbird and a snake to a monkey and a moth. Simple text and flaps allow little learners to recognise other animals and plants too, making this a fun and stimulating book to share with your child. Bold, bright illustrations from Sophie Ledesma bring the natural world to life. Giá sản phẩm trên Tiki đã bao gồm thuế theo luật hiện hành. Bên cạnh đó, tuỳ vào loại sản phẩm, hình thức và địa chỉ giao hàng mà có thể phát sinh thêm chi phí khác như phí vận chuyển, phụ phí hàng cồng kềnh, thuế nhập khẩu (đối với đơn hàng giao từ nước ngoài có giá trị trên 1 triệu đồng).....",0,0,https://salt.tikicdn.com/ts/product/b9/45/ea/272d28faf94fa173c1f539e50da248b6.jpg,https://salt.tikicdn.com/cache/w1200/ts/product/b9/45/ea/272d28faf94fa173c1f539e50da248b6.jpg,https://salt.tikicdn.com/cache/w300/ts/product/b9/45/ea/272d28faf94fa173c1f539e50da248b6.jpg,https://salt.tikicdn.com/cache/200x280/ts/product/b9/45/ea/272d28faf94fa173c1f539e50da248b6.jpg,https://salt.tikicdn.com/cache/200x280/ts/product/b9/45/ea/272d28faf94fa173c1f539e50da248b6.jpg,1000,0
274142738,Lots To Spot Sticker Book: Out And About!,109000,"Lots To Spot Sticker Book: Out And About!Lots to Spot Out and About! contains more than 100 objects to spot and talk about with your preschooler, as well as BIG stickers. Improve your toddler's vo...","Lots To Spot Sticker Book: Out And About! Lots to Spot Out and About! contains more than 100 objects to spot and talk about with your preschooler, as well as BIG stickers. Improve your toddler's vocabulary and encourage discussion Spotting activities based on colours, numbers, shapes and opposites Large, easy-to-peel stickers for little hands Little minds can take a journey into the big wide world with this colourful sticker book. Themed spreads – such as At the leisure centre, Going shopping and In the library – present a wide range of places to visit and different modes of transport used to get there. Children will love using the big stickers to complete the boldy illustrated pages, and doing the spotting activities, which explore colours, numbers, opposites and more Giá sản phẩm trên Tiki đã bao gồm thuế theo luật hiện hành. Bên cạnh đó, tuỳ vào loại sản phẩm, hình thức và địa chỉ giao hàng mà có thể phát sinh thêm chi phí khác như phí vận chuyển, phụ phí hàng cồng kềnh, thuế nhập khẩu (đối với đơn hàng giao từ nước ngoài có giá trị trên 1 triệu đồng).....",0,0,https://salt.tikicdn.com/ts/product/d0/6a/9b/de9c198d3962687589fa50d646aa54c0.jpg,https://salt.tikicdn.com/cache/w1200/ts/product/d0/6a/9b/de9c198d3962687589fa50d646aa54c0.jpg,https://salt.tikicdn.com/cache/w300/ts/product/d0/6a/9b/de9c198d3962687589fa50d646aa54c0.jpg,https://salt.tikicdn.com/cache/200x280/ts/product/d0/6a/9b/de9c198d3962687589fa50d646aa54c0.jpg,https://salt.tikicdn.com/cache/200x280/ts/product/d0/6a/9b/de9c198d3962687589fa50d646aa54c0.jpg,1000,0
274118254,Sticker Book - Wol Chemistry,99000,"Cuốn sách với các kiến thức vĩ đại sẽ cung cấp cho bé các thông tin khám phá về hóa học. Sách gồm nhiều hình ảnh minh họa đặc sắc và những nhãn dán đẹp mắt, một cuốn sách dành cho tất cả mọi ngườ...","Cuốn sách với các kiến thức vĩ đại sẽ cung cấp cho bé các thông tin khám phá về hóa học. Sách gồm nhiều hình ảnh minh họa đặc sắc và những nhãn dán đẹp mắt, một cuốn sách dành cho tất cả mọi người để đọc và học về hóa học. Giá sản phẩm trên Tiki đã bao gồm thuế theo luật hiện hành. Bên cạnh đó, tuỳ vào loại sản phẩm, hình thức và địa chỉ giao hàng mà có thể phát sinh thêm chi phí khác như phí vận chuyển, phụ phí hàng cồng kềnh, thuế nhập khẩu (đối với đơn hàng giao từ nước ngoài có giá trị trên 1 triệu đồng).....",0,0,https://salt.tikicdn.com/ts/product/52/a9/fe/fbf49a604f31ed24f1ccba18b7ac681d.jpg,https://salt.tikicdn.com/cache/w1200/ts/product/52/a9/fe/fbf49a604f31ed24f1ccba18b7ac681d.jpg,https://salt.tikicdn.com/cache/w300/ts/product/52/a9/fe/fbf49a604f31ed24f1ccba18b7ac681d.jpg,https://salt.tikicdn.com/cache/200x280/ts/product/52/a9/fe/fbf49a604f31ed24f1ccba18b7ac681d.jpg,https://salt.tikicdn.com/cache/200x280/ts/product/52/a9/fe/fbf49a604f31ed24f1ccba18b7ac681d.jpg,1000,0
271293918,First Dinosaur Book,229000,"Children can set off on an incredible adventure through the Age of the Dinosaurs with the help of appealing, contemporary artwork, fun text and wow facts. Powerful predators, Jurassic giants and fo...","Children can set off on an incredible adventure through the Age of the Dinosaurs with the help of appealing, contemporary artwork, fun text and wow facts. Powerful predators, Jurassic giants and fossil hunting are just some of the topics covered. Also included is a Dinosaur Gallery wall poster and a useful glossary. Giá sản phẩm trên Tiki đã bao gồm thuế theo luật hiện hành. Bên cạnh đó, tuỳ vào loại sản phẩm, hình thức và địa chỉ giao hàng mà có thể phát sinh thêm chi phí khác như phí vận chuyển, phụ phí hàng cồng kềnh, thuế nhập khẩu (đối với đơn hàng giao từ nước ngoài có giá trị trên 1 triệu đồng).....",0,0,https://salt.tikicdn.com/ts/product/24/ba/a9/203ed14e03efa189ea27387cea2374b0.jpg,https://salt.tikicdn.com/cache/w1200/ts/product/24/ba/a9/203ed14e03efa189ea27387cea2374b0.jpg,https://salt.tikicdn.com/cache/w300/ts/product/24/ba/a9/203ed14e03efa189ea27387cea2374b0.jpg,https://salt.tikicdn.com/cache/200x280/ts/product/24/ba/a9/203ed14e03efa189ea27387cea2374b0.jpg,https://salt.tikicdn.com/cache/200x280/ts/product/24/ba/a9/203ed14e03efa189ea27387cea2374b0.jpg,1000,0
271293850,100 Facts Horses And Ponies,109000,"100 Facts Horses and Ponies is bursting with fantastic images, fun activities and amazing facts.Kids learn more easily with bitesized informationPhotographs and artworks aid children who learn thro...","100 Facts Horses and Ponies is bursting with fantastic images, fun activities and amazing facts. Kids learn more easily with bitesized information Photographs and artworks aid children who learn through visual prompts Activities allow children to put what they have learned into practice 100 Facts Horses and Ponies includes key topics about these hooved mammals in simple numbered facts. Every page features beautiful illustrations and photographs that support a child's understanding of the text. This non-fiction title is a perfect horse book for kids aged 7+ who want to learn more about these majestic animals. Giá sản phẩm trên Tiki đã bao gồm thuế theo luật hiện hành. Bên cạnh đó, tuỳ vào loại sản phẩm, hình thức và địa chỉ giao hàng mà có thể phát sinh thêm chi phí khác như phí vận chuyển, phụ phí hàng cồng kềnh, thuế nhập khẩu (đối với đơn hàng giao từ nước ngoài có giá trị trên 1 triệu đồng).....",0,0,https://salt.tikicdn.com/ts/product/e0/1f/4a/8e8cc48e99fa665cca9d41cf6e3e1f35.jpg,https://salt.tikicdn.com/cache/w1200/ts/product/e0/1f/4a/8e8cc48e99fa665cca9d41cf6e3e1f35.jpg,https://salt.tikicdn.com/cache/w300/ts/product/e0/1f/4a/8e8cc48e99fa665cca9d41cf6e3e1f35.jpg,https://salt.tikicdn.com/cache/200x280/ts/product/e0/1f/4a/8e8cc48e99fa665cca9d41cf6e3e1f35.jpg,https://salt.tikicdn.com/cache/200x280/ts/product/e0/1f/4a/8e8cc48e99fa665cca9d41cf6e3e1f35.jpg,1000,0
263104382,"Big Questions, Big World: What makes me special?",259000,Quy cách: Bìa mềmNgôn ngữ: tiếng Anh####This humorous picture book helps children explore the big questions around what makes each of us unique.Questions include: Who am I? What are memories? Why d...,"Quy cách : Bìa mềm Ngôn ngữ: tiếng Anh #### This humorous picture book helps children explore the big questions around what makes each of us unique. Questions include: Who am I? What are memories? Why do I have feelings? Do I need language to think? Could there ever be another me? The book is part of the series, 'Big Questions, Big World' for children aged 7 plus. With lots of humorous illustrations and different scenarios to consider, the books help the reader to gain confidence in their own ideas and to think critically. They are a great introduction to philosophical thinking and encourage the reader to learn through challenging ideas. Giá sản phẩm trên Tiki đã bao gồm thuế theo luật hiện hành. Bên cạnh đó, tuỳ vào loại sản phẩm, hình thức và địa chỉ giao hàng mà có thể phát sinh thêm chi phí khác như phí vận chuyển, phụ phí hàng cồng kềnh, thuế nhập khẩu (đối với đơn hàng giao từ nước ngoài có giá trị trên 1 triệu đồng).....",0,0,https://salt.tikicdn.com/ts/product/76/0f/c5/80bc584e8bc0f6988a76aa939c88255b.jpg,https://salt.tikicdn.com/cache/w1200/ts/product/76/0f/c5/80bc584e8bc0f6988a76aa939c88255b.jpg,https://salt.tikicdn.com/cache/w300/ts/product/76/0f/c5/80bc584e8bc0f6988a76aa939c88255b.jpg,https://salt.tikicdn.com/cache/200x280/ts/product/76/0f/c5/80bc584e8bc0f6988a76aa939c88255b.jpg,https://salt.tikicdn.com/cache/200x280/ts/product/76/0f/c5/80bc584e8bc0f6988a76aa939c88255b.jpg,1000,0
263097875,Wonder Of Learning - Discover Dinosaurs Foldout Reference Book,198900,"    Wonder Of Learning - Discover Dinosaurs Foldout Reference Book   Explore the incredible world of the dinosaurs, who ruled the earth millions of years ago!   This exciting reference book makes...","Wonder Of Learning - Discover Dinosaurs Foldout Reference Book Explore the incredible world of the dinosaurs, who ruled the earth millions of years ago! This exciting reference book makes learning more enjoyable than ever before. Each section unfolds to reveal extra-large pages of fun information and colourful illustrations. Giá sản phẩm trên Tiki đã bao gồm thuế theo luật hiện hành. Bên cạnh đó, tuỳ vào loại sản phẩm, hình thức và địa chỉ giao hàng mà có thể phát sinh thêm chi phí khác như phí vận chuyển, phụ phí hàng cồng kềnh, thuế nhập khẩu (đối với đơn hàng giao từ nước ngoài có giá trị trên 1 triệu đồng).....",0,0,"https://salt.tikicdn.com/ts/product/69/48/69/b997fdd4122132f96f895244ad66c3f2.jpg, https://salt.tikicdn.com/ts/product/e3/62/8d/07c8f681e7dd0ef9b0daae3104607809.jpg, https://salt.tikicdn.com/ts/product/d0/6e/6a/4180c7fde6eeb5562934fceaa6181bad.jpg, https://salt.tikicdn.com/ts/product/7a/a0/0a/0f9d758d68d8267d65ceeab001a73871.jpg, https://salt.tikicdn.com/ts/product/f8/aa/a1/0c5cd98f8a35078d0d953035b7a8dbf0.jpg, https://salt.tikicdn.com/ts/product/c4/ac/7e/d79ba4a01a4ae68c5f4678b52a782834.jpg","https://salt.tikicdn.com/cache/w1200/ts/product/69/48/69/b997fdd4122132f96f895244ad66c3f2.jpg, https://salt.tikicdn.com/cache/w1200/ts/product/e3/62/8d/07c8f681e7dd0ef9b0daae3104607809.jpg, https://salt.tikicdn.com/cache/w1200/ts/product/d0/6e/6a/4180c7fde6eeb5562934fceaa6181bad.jpg, https://salt.tikicdn.com/cache/w1200/ts/product/7a/a0/0a/0f9d758d68d8267d65ceeab001a73871.jpg, https://salt.tikicdn.com/cache/w1200/ts/product/f8/aa/a1/0c5cd98f8a35078d0d953035b7a8dbf0.jpg, https://salt.tikicdn.com/cache/w1200/ts/product/c4/ac/7e/d79ba4a01a4ae68c5f4678b52a782834.jpg","https://salt.tikicdn.com/cache/w300/ts/product/69/48/69/b997fdd4122132f96f895244ad66c3f2.jpg, https://salt.tikicdn.com/cache/w300/ts/product/e3/62/8d/07c8f681e7dd0ef9b0daae3104607809.jpg, https://salt.tikicdn.com/cache/w300/ts/product/d0/6e/6a/4180c7fde6eeb5562934fceaa6181bad.jpg, https://salt.tikicdn.com/cache/w300/ts/product/7a/a0/0a/0f9d758d68d8267d65ceeab001a73871.jpg, https://salt.tikicdn.com/cache/w300/ts/product/f8/aa/a1/0c5cd98f8a35078d0d953035b7a8dbf0.jpg, https://salt.tikicdn.com/cache/w300/ts/product/c4/ac/7e/d79ba4a01a4ae68c5f4678b52a782834.jpg","https://salt.tikicdn.com/cache/200x280/ts/product/69/48/69/b997fdd4122132f96f895244ad66c3f2.jpg, https://salt.tikicdn.com/cache/200x280/ts/product/e3/62/8d/07c8f681e7dd0ef9b0daae3104607809.jpg, https://salt.tikicdn.com/cache/200x280/ts/product/d0/6e/6a/4180c7fde6eeb5562934fceaa6181bad.jpg, https://salt.tikicdn.com/cache/200x280/ts/product/7a/a0/0a/0f9d758d68d8267d65ceeab001a73871.jpg, https://salt.tikicdn.com/cache/200x280/ts/product/f8/aa/a1/0c5cd98f8a35078d0d953035b7a8dbf0.jpg, https://salt.tikicdn.com/cache/200x280/ts/product/c4/ac/7e/d79ba4a01a4ae68c5f4678b52a782834.jpg","https://salt.tikicdn.com/cache/200x280/ts/product/69/48/69/b997fdd4122132f96f895244ad66c3f2.jpg, https://salt.tikicdn.com/cache/200x280/ts/product/e3/62/8d/07c8f681e7dd0ef9b0daae3104607809.jpg, https://salt.tikicdn.com/cache/200x280/ts/product/d0/6e/6a/4180c7fde6eeb5562934fceaa6181bad.jpg, https://salt.tikicdn.com/cache/200x280/ts/product/7a/a0/0a/0f9d758d68d8267d65ceeab001a73871.jpg, https://salt.tikicdn.com/cache/200x280/ts/product/f8/aa/a1/0c5cd98f8a35078d0d953035b7a8dbf0.jpg, https://salt.tikicdn.com/cache/200x280/ts/product/c4/ac/7e/d79ba4a01a4ae68c5f4678b52a782834.jpg",1000,0
263097519,Awesome Fierce Dinosaurs,228900,    Awesome Fierce Dinosaurs   Elevate your knowledge with 250 curious facts about some of the most fearsome dinosaurs to have ever existed on Earth. Do you dare to discover the fiercest of them a...,"Awesome Fierce Dinosaurs Elevate your knowledge with 250 curious facts about some of the most fearsome dinosaurs to have ever existed on Earth. Do you dare to discover the fiercest of them all? From horrible hunters, supersize sauropods, deadly defenders and more, this unique Elevate book features raised pictures and ranking reveals to encourage curiosity and exploration of some of the most fierce dinosaurs and prehistoric creatures that ever lived on Earth. From terrifying Tyrannosaurus rex and armoured Ankylosaurus to vicious Velociraptor and spiky Triceratops, this book is packed with 250 facts to discover and learn as you challenge yourself to guess which dinosaurs are fierce, which are fiercer and which dinosaurs are the fiercest! Giá sản phẩm trên Tiki đã bao gồm thuế theo luật hiện hành. Bên cạnh đó, tuỳ vào loại sản phẩm, hình thức và địa chỉ giao hàng mà có thể phát sinh thêm chi phí khác như phí vận chuyển, phụ phí hàng cồng kềnh, thuế nhập khẩu (đối với đơn hàng giao từ nước ngoài có giá trị trên 1 triệu đồng).....",0,0,"https://salt.tikicdn.com/ts/product/5a/df/32/d12ad364993073639ff9451661bd0d78.jpg, https://salt.tikicdn.com/ts/product/09/0d/30/8165734f66c1742b8f6dc35b45657917.jpg, https://salt.tikicdn.com/ts/product/f8/99/c0/a469860450f2f9a5d139ade1023db6f6.jpg, https://salt.tikicdn.com/ts/product/bd/bf/76/b052cdf90bf751d73d0b45404c9a41fd.jpg","https://salt.tikicdn.com/cache/w1200/ts/product/5a/df/32/d12ad364993073639ff9451661bd0d78.jpg, https://salt.tikicdn.com/cache/w1200/ts/product/09/0d/30/8165734f66c1742b8f6dc35b45657917.jpg, https://salt.tikicdn.com/cache/w1200/ts/product/f8/99/c0/a469860450f2f9a5d139ade1023db6f6.jpg, https://salt.tikicdn.com/cache/w1200/ts/product/bd/bf/76/b052cdf90bf751d73d0b45404c9a41fd.jpg","https://salt.tikicdn.com/cache/w300/ts/product/5a/df/32/d12ad364993073639ff9451661bd0d78.jpg, https://salt.tikicdn.com/cache/w300/ts/product/09/0d/30/8165734f66c1742b8f6dc35b45657917.jpg, https://salt.tikicdn.com/cache/w300/ts/product/f8/99/c0/a469860450f2f9a5d139ade1023db6f6.jpg, https://salt.tikicdn.com/cache/w300/ts/product/bd/bf/76/b052cdf90bf751d73d0b45404c9a41fd.jpg","https://salt.tikicdn.com/cache/200x280/ts/product/5a/df/32/d12ad364993073639ff9451661bd0d78.jpg, https://salt.tikicdn.com/cache/200x280/ts/product/09/0d/30/8165734f66c1742b8f6dc35b45657917.jpg, https://salt.tikicdn.com/cache/200x280/ts/product/f8/99/c0/a469860450f2f9a5d139ade1023db6f6.jpg, https://salt.tikicdn.com/cache/200x280/ts/product/bd/bf/76/b052cdf90bf751d73d0b45404c9a41fd.jpg","https://salt.tikicdn.com/cache/200x280/ts/product/5a/df/32/d12ad364993073639ff9451661bd0d78.jpg, https://salt.tikicdn.com/cache/200x280/ts/product/09/0d/30/8165734f66c1742b8f6dc35b45657917.jpg, https://salt.tikicdn.com/cache/200x280/ts/product/f8/99/c0/a469860450f2f9a5d139ade1023db6f6.jpg, https://salt.tikicdn.com/cache/200x280/ts/product/bd/bf/76/b052cdf90bf751d73d0b45404c9a41fd.jpg",1000,0
