id,name,price,short_description,description,rating_average,review_count,image_base_url,image_large_url,image_medium_url,image_small_url,image_thumbnail_url,stock,quantity_sold
277400904,Lift-the-Flap Questions & Answers About the Weather,269000,Lift-the-Flap Questions & Answers About the Weather Where does weather comes from? Can it really rain cats and dogs? What are rainbows made of? These are just some of the 60+ questions that make...,"Lift-the-Flap Questions & Answers About the Weather Where does weather comes from? Can it really rain cats and dogs? What are rainbows made of? These are just some of the 60+ questions that make Questions and Answers about Weather such a fascinating book. Children won't be able to resist lifting the flaps to find out the answers. Giá sản phẩm trên Tiki đã bao gồm thuế theo luật hiện hành. Bên cạnh đó, tuỳ vào loại sản phẩm, hình thức và địa chỉ giao hàng mà có thể phát sinh thêm chi phí khác như phí vận chuyển, phụ phí hàng cồng kềnh, thuế nhập khẩu (đối với đơn hàng giao từ nước ngoài có giá trị trên 1 triệu đồng).....",0,0,https://salt.tikicdn.com/ts/product/bc/60/69/81eab400dd5583beab5ddd75bc7ca9d1.jpg,https://salt.tikicdn.com/cache/w1200/ts/product/bc/60/69/81eab400dd5583beab5ddd75bc7ca9d1.jpg,https://salt.tikicdn.com/cache/w300/ts/product/bc/60/69/81eab400dd5583beab5ddd75bc7ca9d1.jpg,https://salt.tikicdn.com/cache/200x280/ts/product/bc/60/69/81eab400dd5583beab5ddd75bc7ca9d1.jpg,https://salt.tikicdn.com/cache/200x280/ts/product/bc/60/69/81eab400dd5583beab5ddd75bc7ca9d1.jpg,1000,0
274674224,Pond Life To Spot,96300,"    Pond Life To Spot   Children can enjoy exploring watery worlds with this little book identifying different plants and animals that live near ponds, rivers and canals. 60 kinds of animals, bugs...","Pond Life To Spot Children can enjoy exploring watery worlds with this little book identifying different plants and animals that live near ponds, rivers and canals. 60 kinds of animals, bugs, trees and plants are grouped by type, with a helpful description, an eye-catching illustration and a sticker for each one. There's a chart and stickers at the back, so they can keep track of the things they've seen. Giá sản phẩm trên Tiki đã bao gồm thuế theo luật hiện hành. Bên cạnh đó, tuỳ vào loại sản phẩm, hình thức và địa chỉ giao hàng mà có thể phát sinh thêm chi phí khác như phí vận chuyển, phụ phí hàng cồng kềnh, thuế nhập khẩu (đối với đơn hàng giao từ nước ngoài có giá trị trên 1 triệu đồng).....",0,0,"https://salt.tikicdn.com/ts/product/b6/e5/14/9fddb170bba89b2c14e012dfafd1af18.jpg, https://salt.tikicdn.com/ts/product/f6/3a/73/e552155d112971708c81eebce941d879.jpg, https://salt.tikicdn.com/ts/product/c5/49/4a/237c6c8aaa2e867ae85a074d98aef100.jpg, https://salt.tikicdn.com/ts/product/1c/b5/cf/10be7ba75acf81dc60beb2c4d7cd0fa2.jpg, https://salt.tikicdn.com/ts/product/76/e7/61/8bd6e4adcebc95c6cbc2fbcfc6f59d8e.jpg","https://salt.tikicdn.com/cache/w1200/ts/product/b6/e5/14/9fddb170bba89b2c14e012dfafd1af18.jpg, https://salt.tikicdn.com/cache/w1200/ts/product/f6/3a/73/e552155d112971708c81eebce941d879.jpg, https://salt.tikicdn.com/cache/w1200/ts/product/c5/49/4a/237c6c8aaa2e867ae85a074d98aef100.jpg, https://salt.tikicdn.com/cache/w1200/ts/product/1c/b5/cf/10be7ba75acf81dc60beb2c4d7cd0fa2.jpg, https://salt.tikicdn.com/cache/w1200/ts/product/76/e7/61/8bd6e4adcebc95c6cbc2fbcfc6f59d8e.jpg","https://salt.tikicdn.com/cache/w300/ts/product/b6/e5/14/9fddb170bba89b2c14e012dfafd1af18.jpg, https://salt.tikicdn.com/cache/w300/ts/product/f6/3a/73/e552155d112971708c81eebce941d879.jpg, https://salt.tikicdn.com/cache/w300/ts/product/c5/49/4a/237c6c8aaa2e867ae85a074d98aef100.jpg, https://salt.tikicdn.com/cache/w300/ts/product/1c/b5/cf/10be7ba75acf81dc60beb2c4d7cd0fa2.jpg, https://salt.tikicdn.com/cache/w300/ts/product/76/e7/61/8bd6e4adcebc95c6cbc2fbcfc6f59d8e.jpg","https://salt.tikicdn.com/cache/200x280/ts/product/b6/e5/14/9fddb170bba89b2c14e012dfafd1af18.jpg, https://salt.tikicdn.com/cache/200x280/ts/product/f6/3a/73/e552155d112971708c81eebce941d879.jpg, https://salt.tikicdn.com/cache/200x280/ts/product/c5/49/4a/237c6c8aaa2e867ae85a074d98aef100.jpg, https://salt.tikicdn.com/cache/200x280/ts/product/1c/b5/cf/10be7ba75acf81dc60beb2c4d7cd0fa2.jpg, https://salt.tikicdn.com/cache/200x280/ts/product/76/e7/61/8bd6e4adcebc95c6cbc2fbcfc6f59d8e.jpg","https://salt.tikicdn.com/cache/200x280/ts/product/b6/e5/14/9fddb170bba89b2c14e012dfafd1af18.jpg, https://salt.tikicdn.com/cache/200x280/ts/product/f6/3a/73/e552155d112971708c81eebce941d879.jpg, https://salt.tikicdn.com/cache/200x280/ts/product/c5/49/4a/237c6c8aaa2e867ae85a074d98aef100.jpg, https://salt.tikicdn.com/cache/200x280/ts/product/1c/b5/cf/10be7ba75acf81dc60beb2c4d7cd0fa2.jpg, https://salt.tikicdn.com/cache/200x280/ts/product/76/e7/61/8bd6e4adcebc95c6cbc2fbcfc6f59d8e.jpg",1000,0
274168199,Jungle Book,749000,"For fans of all ages, legendary British writer Rudyard Kipling’s complete collection of enchanting fables set in India—the basis of the beloved animated Disney film and a modern cinematic retelling fr...","For fans of all ages, legendary British writer Rudyard Kipling’s complete collection of enchanting fables set in India—the basis of the beloved animated Disney film and a modern cinematic retelling from director Jon Favreau—now available in a deluxe four-color illustrated collectible edition. The Jungle Book features stunning artwork and nine 3-D interactive elements crafted by MinaLima Design, the award-winning design studio behind the graphics for the Harry Potter film franchise and the illustrated classic Peter Pan. Since its publication in 1894, Rudyard Kipling’s beloved masterpiece The Jungle Book has been celebrated by generations of readers. Composed of seven tales, each one accompanied by a poem, The Jungle Book is a coming of age fantasy that introduces a lush, colorful world full of adventure and danger. The first three tales include some of the most charming and unforgettable characters in literature—the man-cub Mowgli, the black panther Bagheera, the wise brown bear Baloo, the ruthless tiger Shere Khan, and the hypnotic python Kaa. The other four tales each tell the story of a different animal, such as the travels of the white seal Kotick; the battle between the courageous mongoose Rikki-Tikki-Tavi and the deadly cobra Nag; Toomai and the elephant dance; and the camp animals of the queen’s guard. The second volume in Harper Design’s newest series of deluxe reimagined children’s classics, this beautiful unabridged edition takes readers deep into the heart of the Indian jungle with specially commissioned four-color illustrations and nine exclusive interactive features that will delight readers, including a map of the lost Indian city where Mowgli is taken by the monkeys; a trifold detailing the Laws of the Jungle; a spinning dial of the elephant dance; and a map of Kotick’s route to find a new home. Giá sản phẩm trên Tiki đã bao gồm thuế theo luật hiện hành. Bên cạnh đó, tuỳ vào loại sản phẩm, hình thức và địa chỉ giao hàng mà có thể phát sinh thêm chi phí khác như phí vận chuyển, phụ phí hàng cồng kềnh, thuế nhập khẩu (đối với đơn hàng giao từ nước ngoài có giá trị trên 1 triệu đồng).....",0,0,https://salt.tikicdn.com/ts/product/ef/fb/f0/7f3261f1cd855585c1bacbaac3f56618.jpg,https://salt.tikicdn.com/cache/w1200/ts/product/ef/fb/f0/7f3261f1cd855585c1bacbaac3f56618.jpg,https://salt.tikicdn.com/cache/w300/ts/product/ef/fb/f0/7f3261f1cd855585c1bacbaac3f56618.jpg,https://salt.tikicdn.com/cache/200x280/ts/product/ef/fb/f0/7f3261f1cd855585c1bacbaac3f56618.jpg,https://salt.tikicdn.com/cache/200x280/ts/product/ef/fb/f0/7f3261f1cd855585c1bacbaac3f56618.jpg,1000,0
274142390,Little Genius: Reading & Writing Fun Educational Workbook,69000,"Little Genius: Reading & Writing Fun Educational WorkbookMake learning fun for your little genius! Open the door to learning with these fun educational workbooks, available for three age gro...","Little Genius: Reading & Writing Fun Educational Workbook Make learning fun for your little genius! Open the door to learning with these fun educational workbooks, available for three age groups. They are perfect for little ones at every stage of learning. Giá sản phẩm trên Tiki đã bao gồm thuế theo luật hiện hành. Bên cạnh đó, tuỳ vào loại sản phẩm, hình thức và địa chỉ giao hàng mà có thể phát sinh thêm chi phí khác như phí vận chuyển, phụ phí hàng cồng kềnh, thuế nhập khẩu (đối với đơn hàng giao từ nước ngoài có giá trị trên 1 triệu đồng).....",0,0,https://salt.tikicdn.com/ts/product/80/c2/11/28ffe118c1e1319aea52d740ee29e048.jpg,https://salt.tikicdn.com/cache/w1200/ts/product/80/c2/11/28ffe118c1e1319aea52d740ee29e048.jpg,https://salt.tikicdn.com/cache/w300/ts/product/80/c2/11/28ffe118c1e1319aea52d740ee29e048.jpg,https://salt.tikicdn.com/cache/200x280/ts/product/80/c2/11/28ffe118c1e1319aea52d740ee29e048.jpg,https://salt.tikicdn.com/cache/200x280/ts/product/80/c2/11/28ffe118c1e1319aea52d740ee29e048.jpg,1000,0
274114479,Kindness Makes Us Strong,169000,"Whether we share a toy or rescue an animal, all acts of kindness - no matter how big or small - make our community stronger!        ...","Whether we share a toy or rescue an animal, all acts of kindness - no matter how big or small - make our community stronger! Giá sản phẩm trên Tiki đã bao gồm thuế theo luật hiện hành. Bên cạnh đó, tuỳ vào loại sản phẩm, hình thức và địa chỉ giao hàng mà có thể phát sinh thêm chi phí khác như phí vận chuyển, phụ phí hàng cồng kềnh, thuế nhập khẩu (đối với đơn hàng giao từ nước ngoài có giá trị trên 1 triệu đồng).....",0,0,https://salt.tikicdn.com/ts/product/7e/e8/a4/9e6aa50f36243f3fd6aefc0652f84ffc.jpg,https://salt.tikicdn.com/cache/w1200/ts/product/7e/e8/a4/9e6aa50f36243f3fd6aefc0652f84ffc.jpg,https://salt.tikicdn.com/cache/w300/ts/product/7e/e8/a4/9e6aa50f36243f3fd6aefc0652f84ffc.jpg,https://salt.tikicdn.com/cache/200x280/ts/product/7e/e8/a4/9e6aa50f36243f3fd6aefc0652f84ffc.jpg,https://salt.tikicdn.com/cache/200x280/ts/product/7e/e8/a4/9e6aa50f36243f3fd6aefc0652f84ffc.jpg,1000,0
274114296,The Animal Book,249000,"These books are the ultimate guides, with hundreds of incredible facts, stunning photographs and artworks and fantastic design. Kids aged 9+ will be enthralled and excited from start to finish. ...","These books are the ultimate guides, with hundreds of incredible facts, stunning photographs and artworks and fantastic design. Kids aged 9+ will be enthralled and excited from start to finish. Giá sản phẩm trên Tiki đã bao gồm thuế theo luật hiện hành. Bên cạnh đó, tuỳ vào loại sản phẩm, hình thức và địa chỉ giao hàng mà có thể phát sinh thêm chi phí khác như phí vận chuyển, phụ phí hàng cồng kềnh, thuế nhập khẩu (đối với đơn hàng giao từ nước ngoài có giá trị trên 1 triệu đồng).....",0,0,https://salt.tikicdn.com/ts/product/da/b3/aa/f74ce461a6f2ab278751ea215ab2eb98.jpg,https://salt.tikicdn.com/cache/w1200/ts/product/da/b3/aa/f74ce461a6f2ab278751ea215ab2eb98.jpg,https://salt.tikicdn.com/cache/w300/ts/product/da/b3/aa/f74ce461a6f2ab278751ea215ab2eb98.jpg,https://salt.tikicdn.com/cache/200x280/ts/product/da/b3/aa/f74ce461a6f2ab278751ea215ab2eb98.jpg,https://salt.tikicdn.com/cache/200x280/ts/product/da/b3/aa/f74ce461a6f2ab278751ea215ab2eb98.jpg,1000,0
263098029,Wonder Of Learning - My Fold-Out Book Of Bugs,165600,    Wonder Of Learning - My Fold-Out Book Of Bugs   Learn about the amazing world of bugs in this fun fold-out reference book. ...,"Wonder Of Learning - My Fold-Out Book Of Bugs Learn about the amazing world of bugs in this fun fold-out reference book. Giá sản phẩm trên Tiki đã bao gồm thuế theo luật hiện hành. Bên cạnh đó, tuỳ vào loại sản phẩm, hình thức và địa chỉ giao hàng mà có thể phát sinh thêm chi phí khác như phí vận chuyển, phụ phí hàng cồng kềnh, thuế nhập khẩu (đối với đơn hàng giao từ nước ngoài có giá trị trên 1 triệu đồng).....",0,0,"https://salt.tikicdn.com/ts/product/e3/c0/80/edb9995c95ee8d24d94d03db1e5e9465.jpg, https://salt.tikicdn.com/ts/product/0b/10/24/9af60bbe8f33190b152828f2f1311505.jpg, https://salt.tikicdn.com/ts/product/2e/fe/26/ee5c6242eb06359a01c7d44a55c944ef.jpg, https://salt.tikicdn.com/ts/product/24/b2/c2/370567490aef5e85a3d36e2727adfe84.jpg, https://salt.tikicdn.com/ts/product/22/5b/cf/2843590e76dbc6c8ac6646c7b8cbf7d7.jpg, https://salt.tikicdn.com/ts/product/c3/4c/9e/0634b9e5a28f2c16304671b6192e3d69.jpg, https://salt.tikicdn.com/ts/product/fe/24/ae/087b88bc2539ec4f8702d7678f3916b0.jpg","https://salt.tikicdn.com/cache/w1200/ts/product/e3/c0/80/edb9995c95ee8d24d94d03db1e5e9465.jpg, https://salt.tikicdn.com/cache/w1200/ts/product/0b/10/24/9af60bbe8f33190b152828f2f1311505.jpg, https://salt.tikicdn.com/cache/w1200/ts/product/2e/fe/26/ee5c6242eb06359a01c7d44a55c944ef.jpg, https://salt.tikicdn.com/cache/w1200/ts/product/24/b2/c2/370567490aef5e85a3d36e2727adfe84.jpg, https://salt.tikicdn.com/cache/w1200/ts/product/22/5b/cf/2843590e76dbc6c8ac6646c7b8cbf7d7.jpg, https://salt.tikicdn.com/cache/w1200/ts/product/c3/4c/9e/0634b9e5a28f2c16304671b6192e3d69.jpg, https://salt.tikicdn.com/cache/w1200/ts/product/fe/24/ae/087b88bc2539ec4f8702d7678f3916b0.jpg","https://salt.tikicdn.com/cache/w300/ts/product/e3/c0/80/edb9995c95ee8d24d94d03db1e5e9465.jpg, https://salt.tikicdn.com/cache/w300/ts/product/0b/10/24/9af60bbe8f33190b152828f2f1311505.jpg, https://salt.tikicdn.com/cache/w300/ts/product/2e/fe/26/ee5c6242eb06359a01c7d44a55c944ef.jpg, https://salt.tikicdn.com/cache/w300/ts/product/24/b2/c2/370567490aef5e85a3d36e2727adfe84.jpg, https://salt.tikicdn.com/cache/w300/ts/product/22/5b/cf/2843590e76dbc6c8ac6646c7b8cbf7d7.jpg, https://salt.tikicdn.com/cache/w300/ts/product/c3/4c/9e/0634b9e5a28f2c16304671b6192e3d69.jpg, https://salt.tikicdn.com/cache/w300/ts/product/fe/24/ae/087b88bc2539ec4f8702d7678f3916b0.jpg","https://salt.tikicdn.com/cache/200x280/ts/product/e3/c0/80/edb9995c95ee8d24d94d03db1e5e9465.jpg, https://salt.tikicdn.com/cache/200x280/ts/product/0b/10/24/9af60bbe8f33190b152828f2f1311505.jpg, https://salt.tikicdn.com/cache/200x280/ts/product/2e/fe/26/ee5c6242eb06359a01c7d44a55c944ef.jpg, https://salt.tikicdn.com/cache/200x280/ts/product/24/b2/c2/370567490aef5e85a3d36e2727adfe84.jpg, https://salt.tikicdn.com/cache/200x280/ts/product/22/5b/cf/2843590e76dbc6c8ac6646c7b8cbf7d7.jpg, https://salt.tikicdn.com/cache/200x280/ts/product/c3/4c/9e/0634b9e5a28f2c16304671b6192e3d69.jpg, https://salt.tikicdn.com/cache/200x280/ts/product/fe/24/ae/087b88bc2539ec4f8702d7678f3916b0.jpg","https://salt.tikicdn.com/cache/200x280/ts/product/e3/c0/80/edb9995c95ee8d24d94d03db1e5e9465.jpg, https://salt.tikicdn.com/cache/200x280/ts/product/0b/10/24/9af60bbe8f33190b152828f2f1311505.jpg, https://salt.tikicdn.com/cache/200x280/ts/product/2e/fe/26/ee5c6242eb06359a01c7d44a55c944ef.jpg, https://salt.tikicdn.com/cache/200x280/ts/product/24/b2/c2/370567490aef5e85a3d36e2727adfe84.jpg, https://salt.tikicdn.com/cache/200x280/ts/product/22/5b/cf/2843590e76dbc6c8ac6646c7b8cbf7d7.jpg, https://salt.tikicdn.com/cache/200x280/ts/product/c3/4c/9e/0634b9e5a28f2c16304671b6192e3d69.jpg, https://salt.tikicdn.com/cache/200x280/ts/product/fe/24/ae/087b88bc2539ec4f8702d7678f3916b0.jpg",1000,0
263097788,Little Wonders - Habitats - Multi-Flap,165600,    Little Wonders - Habitats - Multi-Flap   Habitats from all around the world!   What on earth is a habitat?   Explore all the world's amazing places and the animals that live there. Giant fla...,"Little Wonders - Habitats - Multi-Flap Habitats from all around the world! What on earth is a habitat? Explore all the world's amazing places and the animals that live there. Giant flaps, bold illustrations and an enormous, fold out page will feed the most curious of minds. Discover the world, one little wonder at a time. Giá sản phẩm trên Tiki đã bao gồm thuế theo luật hiện hành. Bên cạnh đó, tuỳ vào loại sản phẩm, hình thức và địa chỉ giao hàng mà có thể phát sinh thêm chi phí khác như phí vận chuyển, phụ phí hàng cồng kềnh, thuế nhập khẩu (đối với đơn hàng giao từ nước ngoài có giá trị trên 1 triệu đồng).....",0,0,"https://salt.tikicdn.com/ts/product/a4/2e/2d/8ebc3538b8eccada71bf55143021b108.jpg, https://salt.tikicdn.com/ts/product/cb/a5/70/8183888f23edf58cf866febf9983fded.jpg, https://salt.tikicdn.com/ts/product/35/d4/f0/2066a7feeb9692419ed6835c4b85cc65.jpg, https://salt.tikicdn.com/ts/product/72/f5/b9/e85a3a56c7d8a0b7d5b143ffca6e2687.jpg, https://salt.tikicdn.com/ts/product/3c/07/1f/91638cf7b94adc73363c0b118a28ce50.jpg, https://salt.tikicdn.com/ts/product/7e/30/86/60ef79b79eefcff41405058b07e34a77.jpg, https://salt.tikicdn.com/ts/product/a5/06/5e/d01087d5b894023f3130fbc5d383b34a.jpg","https://salt.tikicdn.com/cache/w1200/ts/product/a4/2e/2d/8ebc3538b8eccada71bf55143021b108.jpg, https://salt.tikicdn.com/cache/w1200/ts/product/cb/a5/70/8183888f23edf58cf866febf9983fded.jpg, https://salt.tikicdn.com/cache/w1200/ts/product/35/d4/f0/2066a7feeb9692419ed6835c4b85cc65.jpg, https://salt.tikicdn.com/cache/w1200/ts/product/72/f5/b9/e85a3a56c7d8a0b7d5b143ffca6e2687.jpg, https://salt.tikicdn.com/cache/w1200/ts/product/3c/07/1f/91638cf7b94adc73363c0b118a28ce50.jpg, https://salt.tikicdn.com/cache/w1200/ts/product/7e/30/86/60ef79b79eefcff41405058b07e34a77.jpg, https://salt.tikicdn.com/cache/w1200/ts/product/a5/06/5e/d01087d5b894023f3130fbc5d383b34a.jpg","https://salt.tikicdn.com/cache/w300/ts/product/a4/2e/2d/8ebc3538b8eccada71bf55143021b108.jpg, https://salt.tikicdn.com/cache/w300/ts/product/cb/a5/70/8183888f23edf58cf866febf9983fded.jpg, https://salt.tikicdn.com/cache/w300/ts/product/35/d4/f0/2066a7feeb9692419ed6835c4b85cc65.jpg, https://salt.tikicdn.com/cache/w300/ts/product/72/f5/b9/e85a3a56c7d8a0b7d5b143ffca6e2687.jpg, https://salt.tikicdn.com/cache/w300/ts/product/3c/07/1f/91638cf7b94adc73363c0b118a28ce50.jpg, https://salt.tikicdn.com/cache/w300/ts/product/7e/30/86/60ef79b79eefcff41405058b07e34a77.jpg, https://salt.tikicdn.com/cache/w300/ts/product/a5/06/5e/d01087d5b894023f3130fbc5d383b34a.jpg","https://salt.tikicdn.com/cache/200x280/ts/product/a4/2e/2d/8ebc3538b8eccada71bf55143021b108.jpg, https://salt.tikicdn.com/cache/200x280/ts/product/cb/a5/70/8183888f23edf58cf866febf9983fded.jpg, https://salt.tikicdn.com/cache/200x280/ts/product/35/d4/f0/2066a7feeb9692419ed6835c4b85cc65.jpg, https://salt.tikicdn.com/cache/200x280/ts/product/72/f5/b9/e85a3a56c7d8a0b7d5b143ffca6e2687.jpg, https://salt.tikicdn.com/cache/200x280/ts/product/3c/07/1f/91638cf7b94adc73363c0b118a28ce50.jpg, https://salt.tikicdn.com/cache/200x280/ts/product/7e/30/86/60ef79b79eefcff41405058b07e34a77.jpg, https://salt.tikicdn.com/cache/200x280/ts/product/a5/06/5e/d01087d5b894023f3130fbc5d383b34a.jpg","https://salt.tikicdn.com/cache/200x280/ts/product/a4/2e/2d/8ebc3538b8eccada71bf55143021b108.jpg, https://salt.tikicdn.com/cache/200x280/ts/product/cb/a5/70/8183888f23edf58cf866febf9983fded.jpg, https://salt.tikicdn.com/cache/200x280/ts/product/35/d4/f0/2066a7feeb9692419ed6835c4b85cc65.jpg, https://salt.tikicdn.com/cache/200x280/ts/product/72/f5/b9/e85a3a56c7d8a0b7d5b143ffca6e2687.jpg, https://salt.tikicdn.com/cache/200x280/ts/product/3c/07/1f/91638cf7b94adc73363c0b118a28ce50.jpg, https://salt.tikicdn.com/cache/200x280/ts/product/7e/30/86/60ef79b79eefcff41405058b07e34a77.jpg, https://salt.tikicdn.com/cache/200x280/ts/product/a5/06/5e/d01087d5b894023f3130fbc5d383b34a.jpg",1000,0
248741593,Jungle Book & Second Jungle Book,120000,"The Jungle Book introduces Mowgli, the human foundling adopted by a family of wolves. It tells of the enmity between him and the tiger Shere Khan, who killed Mowgli's parents, and of the friendship be...","The Jungle Book introduces Mowgli, the human foundling adopted by a family of wolves. It tells of the enmity between him and the tiger Shere Khan, who killed Mowgli's parents, and of the friendship between the man-cub and Bagheera, the black panther, and Baloo, the sleepy brown bear, who instructs Mowgli in the Laws of the Jungle. The Second Jungle Book contains some of the most thrilling of the Mowgli stories. It includes Red Dog, in which Mowgli forms an unlikely alliance with the python Kaa, How Fear Came and Letting in the Jungle as well as The Spring Running, which brings Mowgli to manhood and the realisation that he must leave Bagheera, Baloo and his other friends for the world of man. Giá sản phẩm trên Tiki đã bao gồm thuế theo luật hiện hành. Bên cạnh đó, tuỳ vào loại sản phẩm, hình thức và địa chỉ giao hàng mà có thể phát sinh thêm chi phí khác như phí vận chuyển, phụ phí hàng cồng kềnh, thuế nhập khẩu (đối với đơn hàng giao từ nước ngoài có giá trị trên 1 triệu đồng).....",0,0,https://salt.tikicdn.com/ts/product/03/39/92/2fe450721ea948dbd1aec5de64865c74.jpg,https://salt.tikicdn.com/cache/w1200/ts/product/03/39/92/2fe450721ea948dbd1aec5de64865c74.jpg,https://salt.tikicdn.com/cache/w300/ts/product/03/39/92/2fe450721ea948dbd1aec5de64865c74.jpg,https://salt.tikicdn.com/cache/200x280/ts/product/03/39/92/2fe450721ea948dbd1aec5de64865c74.jpg,https://salt.tikicdn.com/cache/200x280/ts/product/03/39/92/2fe450721ea948dbd1aec5de64865c74.jpg,1000,0
