id,name,price,short_description,description,rating_average,review_count,image_base_url,image_large_url,image_medium_url,image_small_url,image_thumbnail_url,stock,quantity_sold
489825,Sách thiếu nhi tiếng Anh - Usborne What makes it rain?,459000,"What Makes It Rain? With flaps to lift on every page, this delightful book answers the questions that all young children ask about the weather, from Where does wind come from? to Why is it colder in ...","What Makes It Rain? With flaps to lift on every page, this delightful book answers the questions that all young children ask about the weather, from Where does wind come from? to Why is it colder in winter? With surprising facts and weather forecasting tips, it makes a brilliant introduction to weather, which is a UK National Curriculum topic for Years 1 and 2. Giá sản phẩm trên Tiki đã bao gồm thuế theo luật hiện hành. Bên cạnh đó, tuỳ vào loại sản phẩm, hình thức và địa chỉ giao hàng mà có thể phát sinh thêm chi phí khác như phí vận chuyển, phụ phí hàng cồng kềnh, thuế nhập khẩu (đối với đơn hàng giao từ nước ngoài có giá trị trên 1 triệu đồng).....",0,0,https://salt.tikicdn.com/media/catalog/product/5/1/5178oodad6l-_sx424_bo1-204-203-200_.u2487.d20160928.t100004.811777.jpg,https://salt.tikicdn.com/cache/w1200/media/catalog/product/5/1/5178oodad6l-_sx424_bo1-204-203-200_.u2487.d20160928.t100004.811777.jpg,https://salt.tikicdn.com/cache/w300/media/catalog/product/5/1/5178oodad6l-_sx424_bo1-204-203-200_.u2487.d20160928.t100004.811777.jpg,https://salt.tikicdn.com/cache/200x280/media/catalog/product/5/1/5178oodad6l-_sx424_bo1-204-203-200_.u2487.d20160928.t100004.811777.jpg,https://salt.tikicdn.com/cache/200x280/media/catalog/product/5/1/5178oodad6l-_sx424_bo1-204-203-200_.u2487.d20160928.t100004.811777.jpg,1000,0
277370436,"Sách ngoại văn: Weird And Wonderful Nature -Tales Of More Than 100 Unique Animals, Plants, And Phenomena",555800,"    Weird And Wonderful Nature -Tales Of More Than 100 Unique Animals, Plants, And Phenomena   Enjoy more than 100 extraordinary stories of unusual species, behaviours, and objects all told by aut...","Weird And Wonderful Nature -Tales Of More Than 100 Unique Animals, Plants, And Phenomena Enjoy more than 100 extraordinary stories of unusual species, behaviours, and objects all told by author Ben Hoare. Why do Mexican jumping beans jump? How do sea cucumbers defend themselves? What causes the northern lights? This book is filled with facts about the most surprising and curious plants, animals, rocks, and phenomena in nature. Children aged 7-9 can read stories of more than one hundred unique animals, plants and phenomena and learn about the weird and wonderful side of the natural world. Weird and Wonderful Nature is the third installment of the DK Treasure's series, exploring the many bizarre animals and plants that are uniquely adapted to their way of life. This fascinating nature book for kids offers: - Facts from a range of topics, from animals to plants and rocks to natural phenomena, that are guaranteed to wow adults and children alike. - Large photographs that show each species or item in incredible detail, with diagrams help to support understanding. - A gold foil cover and beautiful illustrations, making this book an ideal gift for young nature lovers. In Weird and Wonderful Nature, Ben Hoare's friendly, informative explanations are paired with photographs and charming illustrations to make sure every page captivates the imagination, while a glossary and index help to navigate the chapters. The third title by best selling author Ben Hoare, after Nature's Treasures and The Secret World of Plants, this is the ideal gift book series that will be treasured for years to come. More in the Series Weird and Wonderful Nature is part of DK's Treasure's series. Complete the series and inspire your child's curiosity in natural world with Nature's Treasures, or bring out their inner botanist with The Secret World of Plants. Giá sản phẩm trên Tiki đã bao gồm thuế theo luật hiện hành. Bên cạnh đó, tuỳ vào loại sản phẩm, hình thức và địa chỉ giao hàng mà có thể phát sinh thêm chi phí khác như phí vận chuyển, phụ phí hàng cồng kềnh, thuế nhập khẩu (đối với đơn hàng giao từ nước ngoài có giá trị trên 1 triệu đồng).....",0,0,"https://salt.tikicdn.com/ts/product/2b/ca/21/068453c05513ae16314d4af27dc0edbb.jpg, https://salt.tikicdn.com/ts/product/7c/65/d7/0cf95fc0ebf5f218bedf490150deda4d.jpg, https://salt.tikicdn.com/ts/product/e2/6b/eb/c08713238798c3dd74e11bc4e57a00f9.jpg, https://salt.tikicdn.com/ts/product/90/54/60/b47587108ab9d72c56543d3896603f09.jpg, https://salt.tikicdn.com/ts/product/02/07/0b/bd112cbd1f0a3fe1d16339be53f14ef8.jpg, https://salt.tikicdn.com/ts/product/3a/e9/4e/73125ab3a50eec7fee57f826791bcf00.jpg, https://salt.tikicdn.com/ts/product/bf/a3/f0/bdb6f8eece136b4b55422b60bde46cf6.jpg, https://salt.tikicdn.com/ts/product/04/40/2c/4851c833de70fc952a823d9655355fd2.jpg, https://salt.tikicdn.com/ts/product/58/c2/9b/c9260ff32203da050cc8dc78cea02a7b.jpg, https://salt.tikicdn.com/ts/product/e5/78/e6/ccd07bbbbcb0122fd78bacd16df94ed2.jpg","https://salt.tikicdn.com/cache/w1200/ts/product/2b/ca/21/068453c05513ae16314d4af27dc0edbb.jpg, https://salt.tikicdn.com/cache/w1200/ts/product/7c/65/d7/0cf95fc0ebf5f218bedf490150deda4d.jpg, https://salt.tikicdn.com/cache/w1200/ts/product/e2/6b/eb/c08713238798c3dd74e11bc4e57a00f9.jpg, https://salt.tikicdn.com/cache/w1200/ts/product/90/54/60/b47587108ab9d72c56543d3896603f09.jpg, https://salt.tikicdn.com/cache/w1200/ts/product/02/07/0b/bd112cbd1f0a3fe1d16339be53f14ef8.jpg, https://salt.tikicdn.com/cache/w1200/ts/product/3a/e9/4e/73125ab3a50eec7fee57f826791bcf00.jpg, https://salt.tikicdn.com/cache/w1200/ts/product/bf/a3/f0/bdb6f8eece136b4b55422b60bde46cf6.jpg, https://salt.tikicdn.com/cache/w1200/ts/product/04/40/2c/4851c833de70fc952a823d9655355fd2.jpg, https://salt.tikicdn.com/cache/w1200/ts/product/58/c2/9b/c9260ff32203da050cc8dc78cea02a7b.jpg, https://salt.tikicdn.com/cache/w1200/ts/product/e5/78/e6/ccd07bbbbcb0122fd78bacd16df94ed2.jpg","https://salt.tikicdn.com/cache/w300/ts/product/2b/ca/21/068453c05513ae16314d4af27dc0edbb.jpg, https://salt.tikicdn.com/cache/w300/ts/product/7c/65/d7/0cf95fc0ebf5f218bedf490150deda4d.jpg, https://salt.tikicdn.com/cache/w300/ts/product/e2/6b/eb/c08713238798c3dd74e11bc4e57a00f9.jpg, https://salt.tikicdn.com/cache/w300/ts/product/90/54/60/b47587108ab9d72c56543d3896603f09.jpg, https://salt.tikicdn.com/cache/w300/ts/product/02/07/0b/bd112cbd1f0a3fe1d16339be53f14ef8.jpg, https://salt.tikicdn.com/cache/w300/ts/product/3a/e9/4e/73125ab3a50eec7fee57f826791bcf00.jpg, https://salt.tikicdn.com/cache/w300/ts/product/bf/a3/f0/bdb6f8eece136b4b55422b60bde46cf6.jpg, https://salt.tikicdn.com/cache/w300/ts/product/04/40/2c/4851c833de70fc952a823d9655355fd2.jpg, https://salt.tikicdn.com/cache/w300/ts/product/58/c2/9b/c9260ff32203da050cc8dc78cea02a7b.jpg, https://salt.tikicdn.com/cache/w300/ts/product/e5/78/e6/ccd07bbbbcb0122fd78bacd16df94ed2.jpg","https://salt.tikicdn.com/cache/200x280/ts/product/2b/ca/21/068453c05513ae16314d4af27dc0edbb.jpg, https://salt.tikicdn.com/cache/200x280/ts/product/7c/65/d7/0cf95fc0ebf5f218bedf490150deda4d.jpg, https://salt.tikicdn.com/cache/200x280/ts/product/e2/6b/eb/c08713238798c3dd74e11bc4e57a00f9.jpg, https://salt.tikicdn.com/cache/200x280/ts/product/90/54/60/b47587108ab9d72c56543d3896603f09.jpg, https://salt.tikicdn.com/cache/200x280/ts/product/02/07/0b/bd112cbd1f0a3fe1d16339be53f14ef8.jpg, https://salt.tikicdn.com/cache/200x280/ts/product/3a/e9/4e/73125ab3a50eec7fee57f826791bcf00.jpg, https://salt.tikicdn.com/cache/200x280/ts/product/bf/a3/f0/bdb6f8eece136b4b55422b60bde46cf6.jpg, https://salt.tikicdn.com/cache/200x280/ts/product/04/40/2c/4851c833de70fc952a823d9655355fd2.jpg, https://salt.tikicdn.com/cache/200x280/ts/product/58/c2/9b/c9260ff32203da050cc8dc78cea02a7b.jpg, https://salt.tikicdn.com/cache/200x280/ts/product/e5/78/e6/ccd07bbbbcb0122fd78bacd16df94ed2.jpg","https://salt.tikicdn.com/cache/200x280/ts/product/2b/ca/21/068453c05513ae16314d4af27dc0edbb.jpg, https://salt.tikicdn.com/cache/200x280/ts/product/7c/65/d7/0cf95fc0ebf5f218bedf490150deda4d.jpg, https://salt.tikicdn.com/cache/200x280/ts/product/e2/6b/eb/c08713238798c3dd74e11bc4e57a00f9.jpg, https://salt.tikicdn.com/cache/200x280/ts/product/90/54/60/b47587108ab9d72c56543d3896603f09.jpg, https://salt.tikicdn.com/cache/200x280/ts/product/02/07/0b/bd112cbd1f0a3fe1d16339be53f14ef8.jpg, https://salt.tikicdn.com/cache/200x280/ts/product/3a/e9/4e/73125ab3a50eec7fee57f826791bcf00.jpg, https://salt.tikicdn.com/cache/200x280/ts/product/bf/a3/f0/bdb6f8eece136b4b55422b60bde46cf6.jpg, https://salt.tikicdn.com/cache/200x280/ts/product/04/40/2c/4851c833de70fc952a823d9655355fd2.jpg, https://salt.tikicdn.com/cache/200x280/ts/product/58/c2/9b/c9260ff32203da050cc8dc78cea02a7b.jpg, https://salt.tikicdn.com/cache/200x280/ts/product/e5/78/e6/ccd07bbbbcb0122fd78bacd16df94ed2.jpg",1000,0
274676238,High: Soar To New Heights,398700,"    High: Soar To New Heights   What wonders are soaring far above your head? Come on a journey to meet the creatures who live high in the treetops, the birds that ride the wind, the people who ha...","High: Soar To New Heights What wonders are soaring far above your head? Come on a journey to meet the creatures who live high in the treetops, the birds that ride the wind, the people who have braved the highest mountain summits, and the stories we tell to explain the night-time's dazzling stars. There is a whole world in the sky, waiting to be High is an illustrated non-fiction book that explores the natural world above us and the efforts humans have made to venture high above the Earth, from early flying machines to modern skyscrapers. Linking seemingly diverse subject matter, it invites the reader to explore the wonder of the universe. Giá sản phẩm trên Tiki đã bao gồm thuế theo luật hiện hành. Bên cạnh đó, tuỳ vào loại sản phẩm, hình thức và địa chỉ giao hàng mà có thể phát sinh thêm chi phí khác như phí vận chuyển, phụ phí hàng cồng kềnh, thuế nhập khẩu (đối với đơn hàng giao từ nước ngoài có giá trị trên 1 triệu đồng).....",0,0,"https://salt.tikicdn.com/ts/product/46/cf/61/6c08b7d267967eba56f52c177447fee8.jpg, https://salt.tikicdn.com/ts/product/41/27/1d/94ddc703c29331cd5050f97fe36ae01b.jpg, https://salt.tikicdn.com/ts/product/63/2f/81/8ab6381a03b15b8e8f082d557e70abd8.jpg, https://salt.tikicdn.com/ts/product/b3/1e/6d/58b0913c0a5e36a8b635fa4445db5c69.jpg, https://salt.tikicdn.com/ts/product/15/46/ec/92107d7cc8c808d6d58547d7a474f16e.jpg, https://salt.tikicdn.com/ts/product/31/38/e6/a5890f58ff1c06c9b8f7c2776413b5a4.jpg, https://salt.tikicdn.com/ts/product/91/35/47/f656af84b3d5f6d532053e97ffa68d31.jpg, https://salt.tikicdn.com/ts/product/a1/e2/e4/a82b716721f92f99b989127f54b81dd3.jpg, https://salt.tikicdn.com/ts/product/67/df/bb/4fde03ab63eb3cbb83e4c77466489c1e.jpg, https://salt.tikicdn.com/ts/product/a0/0f/2f/64a5593fbcf83a4e710407867a04058c.jpg, https://salt.tikicdn.com/ts/product/97/41/df/92c139870a0675b0f87f9ebafa153957.jpg","https://salt.tikicdn.com/cache/w1200/ts/product/46/cf/61/6c08b7d267967eba56f52c177447fee8.jpg, https://salt.tikicdn.com/cache/w1200/ts/product/41/27/1d/94ddc703c29331cd5050f97fe36ae01b.jpg, https://salt.tikicdn.com/cache/w1200/ts/product/63/2f/81/8ab6381a03b15b8e8f082d557e70abd8.jpg, https://salt.tikicdn.com/cache/w1200/ts/product/b3/1e/6d/58b0913c0a5e36a8b635fa4445db5c69.jpg, https://salt.tikicdn.com/cache/w1200/ts/product/15/46/ec/92107d7cc8c808d6d58547d7a474f16e.jpg, https://salt.tikicdn.com/cache/w1200/ts/product/31/38/e6/a5890f58ff1c06c9b8f7c2776413b5a4.jpg, https://salt.tikicdn.com/cache/w1200/ts/product/91/35/47/f656af84b3d5f6d532053e97ffa68d31.jpg, https://salt.tikicdn.com/cache/w1200/ts/product/a1/e2/e4/a82b716721f92f99b989127f54b81dd3.jpg, https://salt.tikicdn.com/cache/w1200/ts/product/67/df/bb/4fde03ab63eb3cbb83e4c77466489c1e.jpg, https://salt.tikicdn.com/cache/w1200/ts/product/a0/0f/2f/64a5593fbcf83a4e710407867a04058c.jpg, https://salt.tikicdn.com/cache/w1200/ts/product/97/41/df/92c139870a0675b0f87f9ebafa153957.jpg","https://salt.tikicdn.com/cache/w300/ts/product/46/cf/61/6c08b7d267967eba56f52c177447fee8.jpg, https://salt.tikicdn.com/cache/w300/ts/product/41/27/1d/94ddc703c29331cd5050f97fe36ae01b.jpg, https://salt.tikicdn.com/cache/w300/ts/product/63/2f/81/8ab6381a03b15b8e8f082d557e70abd8.jpg, https://salt.tikicdn.com/cache/w300/ts/product/b3/1e/6d/58b0913c0a5e36a8b635fa4445db5c69.jpg, https://salt.tikicdn.com/cache/w300/ts/product/15/46/ec/92107d7cc8c808d6d58547d7a474f16e.jpg, https://salt.tikicdn.com/cache/w300/ts/product/31/38/e6/a5890f58ff1c06c9b8f7c2776413b5a4.jpg, https://salt.tikicdn.com/cache/w300/ts/product/91/35/47/f656af84b3d5f6d532053e97ffa68d31.jpg, https://salt.tikicdn.com/cache/w300/ts/product/a1/e2/e4/a82b716721f92f99b989127f54b81dd3.jpg, https://salt.tikicdn.com/cache/w300/ts/product/67/df/bb/4fde03ab63eb3cbb83e4c77466489c1e.jpg, https://salt.tikicdn.com/cache/w300/ts/product/a0/0f/2f/64a5593fbcf83a4e710407867a04058c.jpg, https://salt.tikicdn.com/cache/w300/ts/product/97/41/df/92c139870a0675b0f87f9ebafa153957.jpg","https://salt.tikicdn.com/cache/200x280/ts/product/46/cf/61/6c08b7d267967eba56f52c177447fee8.jpg, https://salt.tikicdn.com/cache/200x280/ts/product/41/27/1d/94ddc703c29331cd5050f97fe36ae01b.jpg, https://salt.tikicdn.com/cache/200x280/ts/product/63/2f/81/8ab6381a03b15b8e8f082d557e70abd8.jpg, https://salt.tikicdn.com/cache/200x280/ts/product/b3/1e/6d/58b0913c0a5e36a8b635fa4445db5c69.jpg, https://salt.tikicdn.com/cache/200x280/ts/product/15/46/ec/92107d7cc8c808d6d58547d7a474f16e.jpg, https://salt.tikicdn.com/cache/200x280/ts/product/31/38/e6/a5890f58ff1c06c9b8f7c2776413b5a4.jpg, https://salt.tikicdn.com/cache/200x280/ts/product/91/35/47/f656af84b3d5f6d532053e97ffa68d31.jpg, https://salt.tikicdn.com/cache/200x280/ts/product/a1/e2/e4/a82b716721f92f99b989127f54b81dd3.jpg, https://salt.tikicdn.com/cache/200x280/ts/product/67/df/bb/4fde03ab63eb3cbb83e4c77466489c1e.jpg, https://salt.tikicdn.com/cache/200x280/ts/product/a0/0f/2f/64a5593fbcf83a4e710407867a04058c.jpg, https://salt.tikicdn.com/cache/200x280/ts/product/97/41/df/92c139870a0675b0f87f9ebafa153957.jpg","https://salt.tikicdn.com/cache/200x280/ts/product/46/cf/61/6c08b7d267967eba56f52c177447fee8.jpg, https://salt.tikicdn.com/cache/200x280/ts/product/41/27/1d/94ddc703c29331cd5050f97fe36ae01b.jpg, https://salt.tikicdn.com/cache/200x280/ts/product/63/2f/81/8ab6381a03b15b8e8f082d557e70abd8.jpg, https://salt.tikicdn.com/cache/200x280/ts/product/b3/1e/6d/58b0913c0a5e36a8b635fa4445db5c69.jpg, https://salt.tikicdn.com/cache/200x280/ts/product/15/46/ec/92107d7cc8c808d6d58547d7a474f16e.jpg, https://salt.tikicdn.com/cache/200x280/ts/product/31/38/e6/a5890f58ff1c06c9b8f7c2776413b5a4.jpg, https://salt.tikicdn.com/cache/200x280/ts/product/91/35/47/f656af84b3d5f6d532053e97ffa68d31.jpg, https://salt.tikicdn.com/cache/200x280/ts/product/a1/e2/e4/a82b716721f92f99b989127f54b81dd3.jpg, https://salt.tikicdn.com/cache/200x280/ts/product/67/df/bb/4fde03ab63eb3cbb83e4c77466489c1e.jpg, https://salt.tikicdn.com/cache/200x280/ts/product/a0/0f/2f/64a5593fbcf83a4e710407867a04058c.jpg, https://salt.tikicdn.com/cache/200x280/ts/product/97/41/df/92c139870a0675b0f87f9ebafa153957.jpg",1000,0
274675742,Seashore Life To Spot,96300,"    Seashore Life To Spot   This tful little book helps readers identify 60 different types of shore life, from puffins and basking sharks to sea holly and hermit crabs. The pages are d by locatio...","Seashore Life To Spot This tful little book helps readers identify 60 different types of shore life, from puffins and basking sharks to sea holly and hermit crabs. The pages are d by location, showing creatures and plants you might find on sand and pebble beaches, among the rocks, in shallow water and near cliffs. There's also a spotting chart and stickers to add so you can keep track of everything you've spotted. Giá sản phẩm trên Tiki đã bao gồm thuế theo luật hiện hành. Bên cạnh đó, tuỳ vào loại sản phẩm, hình thức và địa chỉ giao hàng mà có thể phát sinh thêm chi phí khác như phí vận chuyển, phụ phí hàng cồng kềnh, thuế nhập khẩu (đối với đơn hàng giao từ nước ngoài có giá trị trên 1 triệu đồng).....",0,0,"https://salt.tikicdn.com/ts/product/1a/12/04/b069a0600d614b97c71ac6c17e7f137a.jpg, https://salt.tikicdn.com/ts/product/30/a8/a1/5b08bbdb20bb9d43eee4fb2e41479698.jpg, https://salt.tikicdn.com/ts/product/8a/91/69/c93bc088f80867c0aceb143a95b84813.jpg, https://salt.tikicdn.com/ts/product/3b/8b/62/6b16eba54f19abdf67fa1c34e50e6eb2.jpg, https://salt.tikicdn.com/ts/product/9b/b4/f9/da1e3e5d2c0c38456cc603866c7c2846.jpg","https://salt.tikicdn.com/cache/w1200/ts/product/1a/12/04/b069a0600d614b97c71ac6c17e7f137a.jpg, https://salt.tikicdn.com/cache/w1200/ts/product/30/a8/a1/5b08bbdb20bb9d43eee4fb2e41479698.jpg, https://salt.tikicdn.com/cache/w1200/ts/product/8a/91/69/c93bc088f80867c0aceb143a95b84813.jpg, https://salt.tikicdn.com/cache/w1200/ts/product/3b/8b/62/6b16eba54f19abdf67fa1c34e50e6eb2.jpg, https://salt.tikicdn.com/cache/w1200/ts/product/9b/b4/f9/da1e3e5d2c0c38456cc603866c7c2846.jpg","https://salt.tikicdn.com/cache/w300/ts/product/1a/12/04/b069a0600d614b97c71ac6c17e7f137a.jpg, https://salt.tikicdn.com/cache/w300/ts/product/30/a8/a1/5b08bbdb20bb9d43eee4fb2e41479698.jpg, https://salt.tikicdn.com/cache/w300/ts/product/8a/91/69/c93bc088f80867c0aceb143a95b84813.jpg, https://salt.tikicdn.com/cache/w300/ts/product/3b/8b/62/6b16eba54f19abdf67fa1c34e50e6eb2.jpg, https://salt.tikicdn.com/cache/w300/ts/product/9b/b4/f9/da1e3e5d2c0c38456cc603866c7c2846.jpg","https://salt.tikicdn.com/cache/200x280/ts/product/1a/12/04/b069a0600d614b97c71ac6c17e7f137a.jpg, https://salt.tikicdn.com/cache/200x280/ts/product/30/a8/a1/5b08bbdb20bb9d43eee4fb2e41479698.jpg, https://salt.tikicdn.com/cache/200x280/ts/product/8a/91/69/c93bc088f80867c0aceb143a95b84813.jpg, https://salt.tikicdn.com/cache/200x280/ts/product/3b/8b/62/6b16eba54f19abdf67fa1c34e50e6eb2.jpg, https://salt.tikicdn.com/cache/200x280/ts/product/9b/b4/f9/da1e3e5d2c0c38456cc603866c7c2846.jpg","https://salt.tikicdn.com/cache/200x280/ts/product/1a/12/04/b069a0600d614b97c71ac6c17e7f137a.jpg, https://salt.tikicdn.com/cache/200x280/ts/product/30/a8/a1/5b08bbdb20bb9d43eee4fb2e41479698.jpg, https://salt.tikicdn.com/cache/200x280/ts/product/8a/91/69/c93bc088f80867c0aceb143a95b84813.jpg, https://salt.tikicdn.com/cache/200x280/ts/product/3b/8b/62/6b16eba54f19abdf67fa1c34e50e6eb2.jpg, https://salt.tikicdn.com/cache/200x280/ts/product/9b/b4/f9/da1e3e5d2c0c38456cc603866c7c2846.jpg",1000,0
274674928,Lift The Flaps: Dinosaurs,128700,"    Lift The Flaps: Dinosaurs (Fact Book for Kids)   Lift the flaps to discover astounding secrets about dinosaurs, from Jurassic giants to Cretaceous carnivores!   Find out why a T. rex's bite w...","Lift The Flaps: Dinosaurs (Fact Book for Kids) Lift the flaps to discover astounding secrets about dinosaurs, from Jurassic giants to Cretaceous carnivores! Find out why a T. rex's bite was so bone-shattering, and what dinosaur droppings tell us about their lives, with unbelievable facts and drawings that reveal every awesome detail of the prehistoric world. Look out for the rest of the range for more early learning fun based on fascinating topics! Other titles in the series: - Animals - Human Body - Space Giá sản phẩm trên Tiki đã bao gồm thuế theo luật hiện hành. Bên cạnh đó, tuỳ vào loại sản phẩm, hình thức và địa chỉ giao hàng mà có thể phát sinh thêm chi phí khác như phí vận chuyển, phụ phí hàng cồng kềnh, thuế nhập khẩu (đối với đơn hàng giao từ nước ngoài có giá trị trên 1 triệu đồng).....",0,0,"https://salt.tikicdn.com/ts/product/34/00/2e/a3ba8600700895f6e74f22c356139063.jpg, https://salt.tikicdn.com/ts/product/12/53/7c/3c479a788dc9883f0accfba5cbfa97a4.jpg, https://salt.tikicdn.com/ts/product/c4/04/34/1482921e4ee15ae3fcec93ad0e1462db.jpg, https://salt.tikicdn.com/ts/product/53/ee/77/45ceb4e8af3aacd8d2f0584bf76d5118.jpg","https://salt.tikicdn.com/cache/w1200/ts/product/34/00/2e/a3ba8600700895f6e74f22c356139063.jpg, https://salt.tikicdn.com/cache/w1200/ts/product/12/53/7c/3c479a788dc9883f0accfba5cbfa97a4.jpg, https://salt.tikicdn.com/cache/w1200/ts/product/c4/04/34/1482921e4ee15ae3fcec93ad0e1462db.jpg, https://salt.tikicdn.com/cache/w1200/ts/product/53/ee/77/45ceb4e8af3aacd8d2f0584bf76d5118.jpg","https://salt.tikicdn.com/cache/w300/ts/product/34/00/2e/a3ba8600700895f6e74f22c356139063.jpg, https://salt.tikicdn.com/cache/w300/ts/product/12/53/7c/3c479a788dc9883f0accfba5cbfa97a4.jpg, https://salt.tikicdn.com/cache/w300/ts/product/c4/04/34/1482921e4ee15ae3fcec93ad0e1462db.jpg, https://salt.tikicdn.com/cache/w300/ts/product/53/ee/77/45ceb4e8af3aacd8d2f0584bf76d5118.jpg","https://salt.tikicdn.com/cache/200x280/ts/product/34/00/2e/a3ba8600700895f6e74f22c356139063.jpg, https://salt.tikicdn.com/cache/200x280/ts/product/12/53/7c/3c479a788dc9883f0accfba5cbfa97a4.jpg, https://salt.tikicdn.com/cache/200x280/ts/product/c4/04/34/1482921e4ee15ae3fcec93ad0e1462db.jpg, https://salt.tikicdn.com/cache/200x280/ts/product/53/ee/77/45ceb4e8af3aacd8d2f0584bf76d5118.jpg","https://salt.tikicdn.com/cache/200x280/ts/product/34/00/2e/a3ba8600700895f6e74f22c356139063.jpg, https://salt.tikicdn.com/cache/200x280/ts/product/12/53/7c/3c479a788dc9883f0accfba5cbfa97a4.jpg, https://salt.tikicdn.com/cache/200x280/ts/product/c4/04/34/1482921e4ee15ae3fcec93ad0e1462db.jpg, https://salt.tikicdn.com/cache/200x280/ts/product/53/ee/77/45ceb4e8af3aacd8d2f0584bf76d5118.jpg",1000,0
273307924,My Fun Book Of Questions And Answers,189000,"My Fun Book Of Questions And AnswersLooking at all that is fun and fascinating about our world, and filled to the brim with illustrations and photographs. This factbook is perfect for any child who l...","My Fun Book Of Questions And Answers Looking at all that is fun and fascinating about our world, and filled to the brim with illustrations and photographs. This factbook is perfect for any child who loves finding out answers to questions. Features facts on science, the human body, planet Earth, oceans, plants and animals. Such as: Why do flamingos have long legs? What is the biggest cat? and What are bones made from? Ideal for kids with a big appetite for cool facts. Giá sản phẩm trên Tiki đã bao gồm thuế theo luật hiện hành. Bên cạnh đó, tuỳ vào loại sản phẩm, hình thức và địa chỉ giao hàng mà có thể phát sinh thêm chi phí khác như phí vận chuyển, phụ phí hàng cồng kềnh, thuế nhập khẩu (đối với đơn hàng giao từ nước ngoài có giá trị trên 1 triệu đồng).....",0,0,https://salt.tikicdn.com/ts/product/27/f6/45/2ba06ecd6c755c41be3268f67b497342.jpg,https://salt.tikicdn.com/cache/w1200/ts/product/27/f6/45/2ba06ecd6c755c41be3268f67b497342.jpg,https://salt.tikicdn.com/cache/w300/ts/product/27/f6/45/2ba06ecd6c755c41be3268f67b497342.jpg,https://salt.tikicdn.com/cache/200x280/ts/product/27/f6/45/2ba06ecd6c755c41be3268f67b497342.jpg,https://salt.tikicdn.com/cache/200x280/ts/product/27/f6/45/2ba06ecd6c755c41be3268f67b497342.jpg,1000,0
271294185,Tales Of The Woodland,209000,Tales of the WoodlandThis beautiful story collection by Catherine Veitch tells the stories of four woodland animals from around the world. Children will be captivated by a deer who loves solving myst...,"Tales of the Woodland This beautiful story collection by Catherine Veitch tells the stories of four woodland animals from around the world. Children will be captivated by a deer who loves solving mysteries, a proud butterfly who starts to make friends, a mischievous shrew, and a jay who learns to share with others. Each story unfolds through a wonderful backdrop of artwork, packed with charming detail, and explores themes that children can relate to. Giá sản phẩm trên Tiki đã bao gồm thuế theo luật hiện hành. Bên cạnh đó, tuỳ vào loại sản phẩm, hình thức và địa chỉ giao hàng mà có thể phát sinh thêm chi phí khác như phí vận chuyển, phụ phí hàng cồng kềnh, thuế nhập khẩu (đối với đơn hàng giao từ nước ngoài có giá trị trên 1 triệu đồng).....",0,0,https://salt.tikicdn.com/ts/product/8a/eb/40/1b5fb919e251e4287a3cdf1091832e96.jpg,https://salt.tikicdn.com/cache/w1200/ts/product/8a/eb/40/1b5fb919e251e4287a3cdf1091832e96.jpg,https://salt.tikicdn.com/cache/w300/ts/product/8a/eb/40/1b5fb919e251e4287a3cdf1091832e96.jpg,https://salt.tikicdn.com/cache/200x280/ts/product/8a/eb/40/1b5fb919e251e4287a3cdf1091832e96.jpg,https://salt.tikicdn.com/cache/200x280/ts/product/8a/eb/40/1b5fb919e251e4287a3cdf1091832e96.jpg,1000,0
