id,name,price,short_description,description,rating_average,review_count,image_base_url,image_large_url,image_medium_url,image_small_url,image_thumbnail_url,stock,quantity_sold
276591065,Dẫn luận ngôn ngữ học,74000,Dẫn luận ngôn ngữ họcTác giả:              Vũ Đức Nghiệu (Chủ biên) - Nguyễn Văn HiệpNhà xuất bản:      NXB Đại Học Quốc Gia Hà NộiNăm xuất bản:    2024Số trang:               372Bìa sách:       ...,"Dẫn luận ngôn ngữ học Tác giả:              Vũ Đức Nghiệu (Chủ biên) - Nguyễn Văn Hiệp Nhà xuất bản:      NXB Đại Học Quốc Gia Hà Nội Năm xuất bản:    2024 Số trang:               372 Bìa sách:              Bìa mềm Kích thước: 14,5x21,5cm Giáo trình ""Dẫn luận ngôn ngữ học"" này được biên soạn để phục vụ chương trình môn học được Đại học Quốc gia Hà Nội phê duyệt... Giáo trình gồm 18 chương, mỗi chương không nhất thiết cân đối về số trang và được phân bố theo nội dung của từng vấn đề. Cuối mỗi chương , chúng tôi đều cung cấp  danh sách một số tài liệu đọc bổ sung mà sinh viên dễ tìm kiếm. Những tài liệu in bằng tiếng Việt, chúng tôi đều ghi tên tài liệu, tác giả... Giá sản phẩm trên Tiki đã bao gồm thuế theo luật hiện hành. Bên cạnh đó, tuỳ vào loại sản phẩm, hình thức và địa chỉ giao hàng mà có thể phát sinh thêm chi phí khác như phí vận chuyển, phụ phí hàng cồng kềnh, thuế nhập khẩu (đối với đơn hàng giao từ nước ngoài có giá trị trên 1 triệu đồng).....",5,1,"https://salt.tikicdn.com/ts/product/7f/2e/ef/7799644018e984318741a3cd651c92d6.png, https://salt.tikicdn.com/ts/product/90/a2/9b/2e382236cb9aec29ed721a554951916b.png, https://salt.tikicdn.com/ts/product/d5/6c/b6/59de85b4b10c195aac0cc2a39e7b2c02.jpg, https://salt.tikicdn.com/ts/product/82/a7/d9/32f8b6e1fce82ebb68284e5b5e1c68d8.jpg, https://salt.tikicdn.com/ts/product/1d/cd/a0/26747235a2393e5277cc5e9d845fd4c2.jpg, https://salt.tikicdn.com/ts/product/2e/03/eb/480215ffcc96cd0c2369cabbbfe87d33.jpg","https://salt.tikicdn.com/cache/w1200/ts/product/7f/2e/ef/7799644018e984318741a3cd651c92d6.png, https://salt.tikicdn.com/cache/w1200/ts/product/90/a2/9b/2e382236cb9aec29ed721a554951916b.png, https://salt.tikicdn.com/cache/w1200/ts/product/d5/6c/b6/59de85b4b10c195aac0cc2a39e7b2c02.jpg, https://salt.tikicdn.com/cache/w1200/ts/product/82/a7/d9/32f8b6e1fce82ebb68284e5b5e1c68d8.jpg, https://salt.tikicdn.com/cache/w1200/ts/product/1d/cd/a0/26747235a2393e5277cc5e9d845fd4c2.jpg, https://salt.tikicdn.com/cache/w1200/ts/product/2e/03/eb/480215ffcc96cd0c2369cabbbfe87d33.jpg","https://salt.tikicdn.com/cache/w300/ts/product/7f/2e/ef/7799644018e984318741a3cd651c92d6.png, https://salt.tikicdn.com/cache/w300/ts/product/90/a2/9b/2e382236cb9aec29ed721a554951916b.png, https://salt.tikicdn.com/cache/w300/ts/product/d5/6c/b6/59de85b4b10c195aac0cc2a39e7b2c02.jpg, https://salt.tikicdn.com/cache/w300/ts/product/82/a7/d9/32f8b6e1fce82ebb68284e5b5e1c68d8.jpg, https://salt.tikicdn.com/cache/w300/ts/product/1d/cd/a0/26747235a2393e5277cc5e9d845fd4c2.jpg, https://salt.tikicdn.com/cache/w300/ts/product/2e/03/eb/480215ffcc96cd0c2369cabbbfe87d33.jpg","https://salt.tikicdn.com/cache/200x280/ts/product/7f/2e/ef/7799644018e984318741a3cd651c92d6.png, https://salt.tikicdn.com/cache/200x280/ts/product/90/a2/9b/2e382236cb9aec29ed721a554951916b.png, https://salt.tikicdn.com/cache/200x280/ts/product/d5/6c/b6/59de85b4b10c195aac0cc2a39e7b2c02.jpg, https://salt.tikicdn.com/cache/200x280/ts/product/82/a7/d9/32f8b6e1fce82ebb68284e5b5e1c68d8.jpg, https://salt.tikicdn.com/cache/200x280/ts/product/1d/cd/a0/26747235a2393e5277cc5e9d845fd4c2.jpg, https://salt.tikicdn.com/cache/200x280/ts/product/2e/03/eb/480215ffcc96cd0c2369cabbbfe87d33.jpg","https://salt.tikicdn.com/cache/200x280/ts/product/7f/2e/ef/7799644018e984318741a3cd651c92d6.png, https://salt.tikicdn.com/cache/200x280/ts/product/90/a2/9b/2e382236cb9aec29ed721a554951916b.png, https://salt.tikicdn.com/cache/200x280/ts/product/d5/6c/b6/59de85b4b10c195aac0cc2a39e7b2c02.jpg, https://salt.tikicdn.com/cache/200x280/ts/product/82/a7/d9/32f8b6e1fce82ebb68284e5b5e1c68d8.jpg, https://salt.tikicdn.com/cache/200x280/ts/product/1d/cd/a0/26747235a2393e5277cc5e9d845fd4c2.jpg, https://salt.tikicdn.com/cache/200x280/ts/product/2e/03/eb/480215ffcc96cd0c2369cabbbfe87d33.jpg",1000,1
274691226,Cơ Sở Ngôn Ngữ Học Và Tiếng Việt (Tái bản lần thứ mười lăm) - Mai Ngọc Chừ; Vũ Đức Nghiệu; Hoàng Trọng Phiến,79200,...,"Giá sản phẩm trên Tiki đã bao gồm thuế theo luật hiện hành. Bên cạnh đó, tuỳ vào loại sản phẩm, hình thức và địa chỉ giao hàng mà có thể phát sinh thêm chi phí khác như phí vận chuyển, phụ phí hàng cồng kềnh, thuế nhập khẩu (đối với đơn hàng giao từ nước ngoài có giá trị trên 1 triệu đồng).....",0,0,"https://salt.tikicdn.com/ts/product/5f/71/a0/299755ba52c42d8babfa81982ef43c0d.jpg, https://salt.tikicdn.com/ts/product/84/85/ca/14c8210e05b1d4c30ffc5c3cad10fc2c.jpg, https://salt.tikicdn.com/ts/product/d5/98/be/51ccde801b7c23adb7fb9e3e29038c0f.jpg, https://salt.tikicdn.com/ts/product/1e/a6/d5/d1d93e7fcbac0672066f3afbfdef02ee.jpg, https://salt.tikicdn.com/ts/product/f0/4e/c0/bea4db6ff9219220af1de3996925ef14.jpg, https://salt.tikicdn.com/ts/product/9b/f4/c7/2379b8b7a8ad92c9e3eeca442c83fb4b.jpg","https://salt.tikicdn.com/cache/w1200/ts/product/5f/71/a0/299755ba52c42d8babfa81982ef43c0d.jpg, https://salt.tikicdn.com/cache/w1200/ts/product/84/85/ca/14c8210e05b1d4c30ffc5c3cad10fc2c.jpg, https://salt.tikicdn.com/cache/w1200/ts/product/d5/98/be/51ccde801b7c23adb7fb9e3e29038c0f.jpg, https://salt.tikicdn.com/cache/w1200/ts/product/1e/a6/d5/d1d93e7fcbac0672066f3afbfdef02ee.jpg, https://salt.tikicdn.com/cache/w1200/ts/product/f0/4e/c0/bea4db6ff9219220af1de3996925ef14.jpg, https://salt.tikicdn.com/cache/w1200/ts/product/9b/f4/c7/2379b8b7a8ad92c9e3eeca442c83fb4b.jpg","https://salt.tikicdn.com/cache/w300/ts/product/5f/71/a0/299755ba52c42d8babfa81982ef43c0d.jpg, https://salt.tikicdn.com/cache/w300/ts/product/84/85/ca/14c8210e05b1d4c30ffc5c3cad10fc2c.jpg, https://salt.tikicdn.com/cache/w300/ts/product/d5/98/be/51ccde801b7c23adb7fb9e3e29038c0f.jpg, https://salt.tikicdn.com/cache/w300/ts/product/1e/a6/d5/d1d93e7fcbac0672066f3afbfdef02ee.jpg, https://salt.tikicdn.com/cache/w300/ts/product/f0/4e/c0/bea4db6ff9219220af1de3996925ef14.jpg, https://salt.tikicdn.com/cache/w300/ts/product/9b/f4/c7/2379b8b7a8ad92c9e3eeca442c83fb4b.jpg","https://salt.tikicdn.com/cache/200x280/ts/product/5f/71/a0/299755ba52c42d8babfa81982ef43c0d.jpg, https://salt.tikicdn.com/cache/200x280/ts/product/84/85/ca/14c8210e05b1d4c30ffc5c3cad10fc2c.jpg, https://salt.tikicdn.com/cache/200x280/ts/product/d5/98/be/51ccde801b7c23adb7fb9e3e29038c0f.jpg, https://salt.tikicdn.com/cache/200x280/ts/product/1e/a6/d5/d1d93e7fcbac0672066f3afbfdef02ee.jpg, https://salt.tikicdn.com/cache/200x280/ts/product/f0/4e/c0/bea4db6ff9219220af1de3996925ef14.jpg, https://salt.tikicdn.com/cache/200x280/ts/product/9b/f4/c7/2379b8b7a8ad92c9e3eeca442c83fb4b.jpg","https://salt.tikicdn.com/cache/200x280/ts/product/5f/71/a0/299755ba52c42d8babfa81982ef43c0d.jpg, https://salt.tikicdn.com/cache/200x280/ts/product/84/85/ca/14c8210e05b1d4c30ffc5c3cad10fc2c.jpg, https://salt.tikicdn.com/cache/200x280/ts/product/d5/98/be/51ccde801b7c23adb7fb9e3e29038c0f.jpg, https://salt.tikicdn.com/cache/200x280/ts/product/1e/a6/d5/d1d93e7fcbac0672066f3afbfdef02ee.jpg, https://salt.tikicdn.com/cache/200x280/ts/product/f0/4e/c0/bea4db6ff9219220af1de3996925ef14.jpg, https://salt.tikicdn.com/cache/200x280/ts/product/9b/f4/c7/2379b8b7a8ad92c9e3eeca442c83fb4b.jpg",1000,0
273644777,Sách - Destination B1 & B2 Grammar and Vocabulary Kèm Đáp Án - MC,338000,Combo 2 Cuốn Destination B1 & B2 Grammar and Vocabulary (Tái Bản Có File Nghe) - Kèm Đáp ÁnDestination B1: Grammar & Vocabulary được thiết kế dành cho những người chuẩn bị thi B1 - FCE. Cuốn ...,"Combo 2 Cuốn Destination B1 & B2 Grammar and Vocabulary (Tái Bản Có File Nghe) - Kèm Đáp Án Destination B1: Grammar & Vocabulary được thiết kế dành cho những người chuẩn bị thi B1 - FCE. Cuốn sách tập trung vào những kiến thức ngữ pháp, từ vựng tiếng Anh thường xuyên sử dụng trong bài thi B1, thích hợp dành cho người học ở trình độ Intermediate, Upper Intermediate hoặc Advanced. Tài liệu trong sách dựa theo mức trình độ B1 chuẩn khung châu Âu. Toàn bộ 28 units của sách chia ra lần lượt phần Ngữ pháp và từ vựng đan xen nhau. Sau mỗi 2 units Destination B1: Grammar & Vocabulary sẽ cung cấp phần Preview 2 unit vừa học để các bạn ôn tập lại kiến thức vừa học. Điều này giúp các bạn nắm vững và nhớ lâu kiến thức. Đây thực sự là cuốn sách này quả thật rất hay và hữu ích cho việc học và luyện tập ngữ pháp cũng như từ vựng tiếng Anh. Ưu điểm của cuốn sách này là nội dung rất phong phú với nhiều dạng bài tập giúp người học luyện tập và tiếp xúc với nhiều dạng bài khác nhau. Đặc biệt là có lời giải kèm theo để giúp người học có thể tự kiểm tra kết quả của mình. 2. Destination B2 Grammar & Vocabulary Destination B2: Grammar & Vocabulary được thiết kế dành cho những người chuẩn bị thi B2 - FCE. Cuốn sách tập trung vào những kiến thức ngữ pháp, từ vựng tiếng Anh thường xuyên sử dụng trong bài thi B2, thích hợp dành cho người học ở trình độ Intermediate, Upper Intermediate hoặc Advanced. Tài liệu trong sách dựa theo mức trình độ B1, B2, C1 và C2 chuẩn khung châu Âu. Đây thực sự là cuốn sách này quả thật rất hay và hữu ích cho việc học và luyện tập ngữ pháp cũng như từ vựng tiếng Anh. Ưu điểm của cuốn sách này là nội dung rất phong phú với nhiều dạng bài tập giúp người học luyện tập và tiếp xúc với nhiều dạng bài khác nhau. Đặc biệt là có lời giải kèm theo để giúp người học có thể tự kiểm tra kết quả của mình. 1. Destination B1 Grammar and Vocabulary Nhà xuất bản: Hồng Đức Bìa: bìa mềm Tác giả: Malcolm Mann số trang: 248 Kích thước: 19x27 Năm xuất bản: 2023 Công ty phát hành:MCBooks Destination B1: Grammar & Vocabulary được thiết kế dành cho những người chuẩn bị thi B1 - FCE. Cuốn sách tập trung vào những kiến thức ngữ pháp, từ vựng tiếng Anh thường xuyên sử dụng trong bài thi B1, thích hợp dành cho người học ở trình độ Intermediate, Upper Intermediate hoặc Advanced. Tài liệu trong sách dựa theo mức trình độ B1 chuẩn khung châu Âu. Toàn bộ 28 units của sách chia ra lần lượt phần Ngữ pháp và từ vựng đan xen nhau. Sau mỗi 2 units Destination B1: Grammar & Vocabulary sẽ cung cấp phần Preview 2 unit vừa học để các bạn ôn tập lại kiến thức vừa học. Điều này giúp các bạn nắm vững và nhớ lâu kiến thức. Đây thực sự là cuốn sách này quả thật rất hay và hữu ích cho việc học và luyện tập ngữ pháp cũng như từ vựng tiếng Anh. Ưu điểm của cuốn sách này là nội dung rất phong phú với nhiều dạng bài tập giúp người học luyện tập và tiếp xúc với nhiều dạng bài khác nhau. Đặc biệt là có lời giải kèm theo để giúp người học có thể tự kiểm tra kết quả của mình. 2. Destination B2 Grammar & Vocabulary Nhà xuất bản: Hồng Đức Tác giả: Malcolm Mann Số trang 250 Khổ sách 19 x 27 Ngày xuất bản 2023 Công ty phát hành:MCBooks Destination B2: Grammar & Vocabulary được thiết kế dành cho những người chuẩn bị thi B2 - FCE. Cuốn sách tập trung vào những kiến thức ngữ pháp, từ vựng tiếng Anh thường xuyên sử dụng trong bài thi B2, thích hợp dành cho người học ở trình độ Intermediate, Upper Intermediate hoặc Advanced. Tài liệu trong sách dựa theo mức trình độ B1, B2, C1 và C2 chuẩn khung châu Âu. Đây thực sự là cuốn sách này quả thật rất hay và hữu ích cho việc học và luyện tập ngữ pháp cũng như từ vựng tiếng Anh. Ưu điểm của cuốn sách này là nội dung rất phong phú với nhiều dạng bài tập giúp người học luyện tập và tiếp xúc với nhiều dạng bài khác nhau. Đặc biệt là có lời giải kèm theo để giúp người học có thể tự kiểm tra kết quả của mình. Giá sản phẩm trên Tiki đã bao gồm thuế theo luật hiện hành. Bên cạnh đó, tuỳ vào loại sản phẩm, hình thức và địa chỉ giao hàng mà có thể phát sinh thêm chi phí khác như phí vận chuyển, phụ phí hàng cồng kềnh, thuế nhập khẩu (đối với đơn hàng giao từ nước ngoài có giá trị trên 1 triệu đồng).....",0,0,"https://salt.tikicdn.com/ts/product/7f/92/35/ebe01f21b20f7149fe4991463bf482ee.png, https://salt.tikicdn.com/ts/product/82/c1/1e/01e26d70f857d5f9d3e9a6092f1384fa.jpg, https://salt.tikicdn.com/ts/product/79/18/dd/fc8e845b8d9b5a25f9f2dcd959e9cfc9.jpg, https://salt.tikicdn.com/ts/product/06/e7/2d/0260907748e747bbfc5ce5baea624689.jpg, https://salt.tikicdn.com/ts/product/38/b3/48/07d463a7af0dac1756d081d9eca38b4b.jpg, https://salt.tikicdn.com/ts/product/08/b7/03/195c2c694df4f10a68a6408d9b593125.jpg, https://salt.tikicdn.com/ts/product/20/7d/ac/a01a400d3ec7636d989af7ef82cfdf85.jpg","https://salt.tikicdn.com/cache/w1200/ts/product/7f/92/35/ebe01f21b20f7149fe4991463bf482ee.png, https://salt.tikicdn.com/cache/w1200/ts/product/82/c1/1e/01e26d70f857d5f9d3e9a6092f1384fa.jpg, https://salt.tikicdn.com/cache/w1200/ts/product/79/18/dd/fc8e845b8d9b5a25f9f2dcd959e9cfc9.jpg, https://salt.tikicdn.com/cache/w1200/ts/product/06/e7/2d/0260907748e747bbfc5ce5baea624689.jpg, https://salt.tikicdn.com/cache/w1200/ts/product/38/b3/48/07d463a7af0dac1756d081d9eca38b4b.jpg, https://salt.tikicdn.com/cache/w1200/ts/product/08/b7/03/195c2c694df4f10a68a6408d9b593125.jpg, https://salt.tikicdn.com/cache/w1200/ts/product/20/7d/ac/a01a400d3ec7636d989af7ef82cfdf85.jpg","https://salt.tikicdn.com/cache/w300/ts/product/7f/92/35/ebe01f21b20f7149fe4991463bf482ee.png, https://salt.tikicdn.com/cache/w300/ts/product/82/c1/1e/01e26d70f857d5f9d3e9a6092f1384fa.jpg, https://salt.tikicdn.com/cache/w300/ts/product/79/18/dd/fc8e845b8d9b5a25f9f2dcd959e9cfc9.jpg, https://salt.tikicdn.com/cache/w300/ts/product/06/e7/2d/0260907748e747bbfc5ce5baea624689.jpg, https://salt.tikicdn.com/cache/w300/ts/product/38/b3/48/07d463a7af0dac1756d081d9eca38b4b.jpg, https://salt.tikicdn.com/cache/w300/ts/product/08/b7/03/195c2c694df4f10a68a6408d9b593125.jpg, https://salt.tikicdn.com/cache/w300/ts/product/20/7d/ac/a01a400d3ec7636d989af7ef82cfdf85.jpg","https://salt.tikicdn.com/cache/200x280/ts/product/7f/92/35/ebe01f21b20f7149fe4991463bf482ee.png, https://salt.tikicdn.com/cache/200x280/ts/product/82/c1/1e/01e26d70f857d5f9d3e9a6092f1384fa.jpg, https://salt.tikicdn.com/cache/200x280/ts/product/79/18/dd/fc8e845b8d9b5a25f9f2dcd959e9cfc9.jpg, https://salt.tikicdn.com/cache/200x280/ts/product/06/e7/2d/0260907748e747bbfc5ce5baea624689.jpg, https://salt.tikicdn.com/cache/200x280/ts/product/38/b3/48/07d463a7af0dac1756d081d9eca38b4b.jpg, https://salt.tikicdn.com/cache/200x280/ts/product/08/b7/03/195c2c694df4f10a68a6408d9b593125.jpg, https://salt.tikicdn.com/cache/200x280/ts/product/20/7d/ac/a01a400d3ec7636d989af7ef82cfdf85.jpg","https://salt.tikicdn.com/cache/200x280/ts/product/7f/92/35/ebe01f21b20f7149fe4991463bf482ee.png, https://salt.tikicdn.com/cache/200x280/ts/product/82/c1/1e/01e26d70f857d5f9d3e9a6092f1384fa.jpg, https://salt.tikicdn.com/cache/200x280/ts/product/79/18/dd/fc8e845b8d9b5a25f9f2dcd959e9cfc9.jpg, https://salt.tikicdn.com/cache/200x280/ts/product/06/e7/2d/0260907748e747bbfc5ce5baea624689.jpg, https://salt.tikicdn.com/cache/200x280/ts/product/38/b3/48/07d463a7af0dac1756d081d9eca38b4b.jpg, https://salt.tikicdn.com/cache/200x280/ts/product/08/b7/03/195c2c694df4f10a68a6408d9b593125.jpg, https://salt.tikicdn.com/cache/200x280/ts/product/20/7d/ac/a01a400d3ec7636d989af7ef82cfdf85.jpg",1000,0
271450840,Combo Ngữ pháp Tiếng Việt Tập 1+2,113000,Bộ sách Ngữ pháp tiếng Việt gồm hai tập (do Diệp Quang Ban chủ biên) được biên soạn theo chương trình cải tiến dùng cho sinh viên khoa Ngữ văn các trường Đại học Sư phạm trong cả nước :Tập một (in lầ...,"Bộ sách Ngữ pháp tiếng Việt gồm hai tập (do Diệp Quang Ban chủ biên) được biên soạn theo chương trình cải tiến dùng cho sinh viên khoa Ngữ văn các trường Đại học Sư phạm trong cả nước : Tập một (in lần đầu 1991) gồm có : Mở đầu (do Diệp Quang Ban viết) Phần một : Cấu tạo từ (từ xét ở phương diện cấu tạo ngữ pháp – do Diệp Quang Ban viết) Phần hai : Từ loại (do Hoàng Văn Thung viết) Tập hai (do Diệp Quang Ban viết) (in lần đầu 1992) gồm có : Phần ba : Cụm từ Phần bốn : Câu Bộ Ngữ pháp tiếng Việt này viết theo tinh thần vừa kế thừa kiến thức truyền thống đã và đang được lưu hành, vừa bổ sung kiến thức là thành tựu của giới nghiên cứu tiếng Việt vài năm lại đây. Bộ sách đã được Hội đồng thẩm định sách đại học của Bộ Giáo dục và Đào tạo (bộ phận thuộc Bộ Giáo dục cũ) giới thiệu làm sách dùng chung cho các trường Đại học Sư phạm. Giá sản phẩm trên Tiki đã bao gồm thuế theo luật hiện hành. Bên cạnh đó, tuỳ vào loại sản phẩm, hình thức và địa chỉ giao hàng mà có thể phát sinh thêm chi phí khác như phí vận chuyển, phụ phí hàng cồng kềnh, thuế nhập khẩu (đối với đơn hàng giao từ nước ngoài có giá trị trên 1 triệu đồng).....",0,0,https://salt.tikicdn.com/ts/product/3f/cd/05/47f25fc1ce9fe76be2da9281561adae5.jpg,https://salt.tikicdn.com/cache/w1200/ts/product/3f/cd/05/47f25fc1ce9fe76be2da9281561adae5.jpg,https://salt.tikicdn.com/cache/w300/ts/product/3f/cd/05/47f25fc1ce9fe76be2da9281561adae5.jpg,https://salt.tikicdn.com/cache/200x280/ts/product/3f/cd/05/47f25fc1ce9fe76be2da9281561adae5.jpg,https://salt.tikicdn.com/cache/200x280/ts/product/3f/cd/05/47f25fc1ce9fe76be2da9281561adae5.jpg,1000,0
270068334,Giáo trình dẫn luận ngôn ngữ học,65000,Giáo trình Dẫn luận ngôn ngữ họcTác giả: Bùi Minh ToánNhà xuất bản: NXB Đại học Sư phạmPhát hành bởi: Nhà xuất bản Đại học Sư phạmKích thước: 17 x 24Số trang: 191Năm xuất bản: 2023Giáo trình Dẫ...,"Giáo trình Dẫn luận ngôn ngữ học Tác giả: Bùi Minh Toán Nhà xuất bản: NXB Đại học Sư phạm Phát hành bởi: Nhà xuất bản Đại học Sư phạm Kích thước: 17 x 24 Số trang: 191 Năm xuất bản: 2023 Giáo trình Dẫn luận Ngôn ngữ học được biên soạn để phục vụ cho việc học tập học phần tương ứng trong chương trình đào tạo giáo viên Ngữ văn Trung học phổ thông ở Khoa Ngữ văn của các Trường Đại học Sư phạm Giá sản phẩm trên Tiki đã bao gồm thuế theo luật hiện hành. Bên cạnh đó, tuỳ vào loại sản phẩm, hình thức và địa chỉ giao hàng mà có thể phát sinh thêm chi phí khác như phí vận chuyển, phụ phí hàng cồng kềnh, thuế nhập khẩu (đối với đơn hàng giao từ nước ngoài có giá trị trên 1 triệu đồng)..... Giá sản phẩm trên Tiki đã bao gồm thuế theo luật hiện hành. Bên cạnh đó, tuỳ vào loại sản phẩm, hình thức và địa chỉ giao hàng mà có thể phát sinh thêm chi phí khác như phí vận chuyển, phụ phí hàng cồng kềnh, thuế nhập khẩu (đối với đơn hàng giao từ nước ngoài có giá trị trên 1 triệu đồng).....",0,0,"https://salt.tikicdn.com/ts/product/e8/6f/62/455721e7a84fedf35dea69c0a2176c58.jpg, https://salt.tikicdn.com/ts/product/6f/ca/88/9a2333d93829f55f10e457a708296651.jpg, https://salt.tikicdn.com/ts/product/64/25/c2/8d4e58aa9359203284a14dd7d1b36ff9.jpg","https://salt.tikicdn.com/cache/w1200/ts/product/e8/6f/62/455721e7a84fedf35dea69c0a2176c58.jpg, https://salt.tikicdn.com/cache/w1200/ts/product/6f/ca/88/9a2333d93829f55f10e457a708296651.jpg, https://salt.tikicdn.com/cache/w1200/ts/product/64/25/c2/8d4e58aa9359203284a14dd7d1b36ff9.jpg","https://salt.tikicdn.com/cache/w300/ts/product/e8/6f/62/455721e7a84fedf35dea69c0a2176c58.jpg, https://salt.tikicdn.com/cache/w300/ts/product/6f/ca/88/9a2333d93829f55f10e457a708296651.jpg, https://salt.tikicdn.com/cache/w300/ts/product/64/25/c2/8d4e58aa9359203284a14dd7d1b36ff9.jpg","https://salt.tikicdn.com/cache/200x280/ts/product/e8/6f/62/455721e7a84fedf35dea69c0a2176c58.jpg, https://salt.tikicdn.com/cache/200x280/ts/product/6f/ca/88/9a2333d93829f55f10e457a708296651.jpg, https://salt.tikicdn.com/cache/200x280/ts/product/64/25/c2/8d4e58aa9359203284a14dd7d1b36ff9.jpg","https://salt.tikicdn.com/cache/200x280/ts/product/e8/6f/62/455721e7a84fedf35dea69c0a2176c58.jpg, https://salt.tikicdn.com/cache/200x280/ts/product/6f/ca/88/9a2333d93829f55f10e457a708296651.jpg, https://salt.tikicdn.com/cache/200x280/ts/product/64/25/c2/8d4e58aa9359203284a14dd7d1b36ff9.jpg",1000,0
