id,name,price,short_description,description,rating_average,review_count,image_base_url,image_large_url,image_medium_url,image_small_url,image_thumbnail_url,stock,quantity_sold
195526953,"Tiếng Việt Thực Hành (Tái bản lần 23 năm 2024) - Bùi Minh Toán (Chủ biên), Lê A, Đỗ Việt Hùng",65000,"Ngày 12 tháng 9 năm 1995, Bộ trưởng Bộ Giáo dục và Đào tạo ra Quyết định số 3244 | GD - ĐT về việc ban hành Bộ chương trình Giáo dục đại cương (giai đoạn I). Trong đó, chương trình môn Tiếng Việt thực...","Ngày 12 tháng 9 năm 1995, Bộ trưởng Bộ Giáo dục và Đào tạo ra Quyết định số 3244 | GD - ĐT về việc ban hành Bộ chương trình Giáo dục đại cương (giai đoạn I). Trong đó, chương trình môn Tiếng Việt thực hành (in ở tr. 4, 5, 6) là một trong những chương trình có vai trò quan trọng trong đào tạo sinh viên đại cương. Song, trên thực tế, việc dạy – học môn Tiếng Việt thực hành còn mang nhiều tính thụ động, chủ yếu theo phương thức dạy chay – học chay. Giáo viên và học sinh chưa có một cuốn giáo trình thống nhất. Điều đó gây không ít khó khăn cho cả thầy và trò khi dạy – học và thực hành tiếng Việt. Trước thực trạng đó, chúng tôi mạnh dạn biên soạn cuốn ""Tiếng Việt thực hành"" nhằm phần nào đáp ứng nhu cầu dạy – học môn này trong nhà trường ""đại cương"". Cuốn sách được biên soạn bám sát chương trình Tiếng Việt thực hành do Bộ Giáo dục và Đào tạo ban hành. Nội dung sách gồm hai phần chính được biên soạn đan xen vào nhau trong từng chương : I – Giản yếu về lí thuyết II – Hệ thống bài tập thực hành loại anh là mô qui nó Với cách biên như vậy, hi vọng sách sẽ góp phần giảm soan bớt đi những khó khăn hiện có trong thực hành tiếng Việt. , cuốn sách cản nước cấp và Đây là cuốn sách được biên soạn theo một chương trình mới nên chắc chắn không tránh khỏi những sơ suất. Trong quá trình sử dụng, mong bạn đọc đóng góp ý ý kiến để những lần tái bản sau, sách được tốt hơn. Giá sản phẩm trên Tiki đã bao gồm thuế theo luật hiện hành. Bên cạnh đó, tuỳ vào loại sản phẩm, hình thức và địa chỉ giao hàng mà có thể phát sinh thêm chi phí khác như phí vận chuyển, phụ phí hàng cồng kềnh, thuế nhập khẩu (đối với đơn hàng giao từ nước ngoài có giá trị trên 1 triệu đồng).....",5,7,"https://salt.tikicdn.com/ts/product/6a/8b/e6/9c2ea48b08de42015472d33f69d52283.jpg, https://salt.tikicdn.com/ts/product/58/da/c6/75103239593b5c8a9ead527894a78e45.jpg, https://salt.tikicdn.com/ts/product/77/40/68/e155cc229a0b41187397e6c5287c2a2f.jpg","https://salt.tikicdn.com/cache/w1200/ts/product/6a/8b/e6/9c2ea48b08de42015472d33f69d52283.jpg, https://salt.tikicdn.com/cache/w1200/ts/product/58/da/c6/75103239593b5c8a9ead527894a78e45.jpg, https://salt.tikicdn.com/cache/w1200/ts/product/77/40/68/e155cc229a0b41187397e6c5287c2a2f.jpg","https://salt.tikicdn.com/cache/w300/ts/product/6a/8b/e6/9c2ea48b08de42015472d33f69d52283.jpg, https://salt.tikicdn.com/cache/w300/ts/product/58/da/c6/75103239593b5c8a9ead527894a78e45.jpg, https://salt.tikicdn.com/cache/w300/ts/product/77/40/68/e155cc229a0b41187397e6c5287c2a2f.jpg","https://salt.tikicdn.com/cache/200x280/ts/product/6a/8b/e6/9c2ea48b08de42015472d33f69d52283.jpg, https://salt.tikicdn.com/cache/200x280/ts/product/58/da/c6/75103239593b5c8a9ead527894a78e45.jpg, https://salt.tikicdn.com/cache/200x280/ts/product/77/40/68/e155cc229a0b41187397e6c5287c2a2f.jpg","https://salt.tikicdn.com/cache/200x280/ts/product/6a/8b/e6/9c2ea48b08de42015472d33f69d52283.jpg, https://salt.tikicdn.com/cache/200x280/ts/product/58/da/c6/75103239593b5c8a9ead527894a78e45.jpg, https://salt.tikicdn.com/cache/200x280/ts/product/77/40/68/e155cc229a0b41187397e6c5287c2a2f.jpg",1000,7
193419513,BÀI TẬP LẬP TRÌNH VỚI NGÔN NGỮ C++ TỪ CƠ BẢN ĐẾN NÂNG CAO - TẬP 1,141300,...,"Giá sản phẩm trên Tiki đã bao gồm thuế theo luật hiện hành. Bên cạnh đó, tuỳ vào loại sản phẩm, hình thức và địa chỉ giao hàng mà có thể phát sinh thêm chi phí khác như phí vận chuyển, phụ phí hàng cồng kềnh, thuế nhập khẩu (đối với đơn hàng giao từ nước ngoài có giá trị trên 1 triệu đồng).....",5,3,"https://salt.tikicdn.com/ts/product/e2/63/1d/b988b02f9e411d9d313438efd142e785.jpg, https://salt.tikicdn.com/ts/product/2c/71/75/ebbd120e73a918ca5890616a699587bd.jpg, https://salt.tikicdn.com/ts/product/47/f8/98/a9566d158745523acc441fcdcc4bdb8a.jpg, https://salt.tikicdn.com/ts/product/5c/ea/3b/6a6c9330fea65047ab8341c6bbdbb516.jpg, https://salt.tikicdn.com/ts/product/65/54/23/cfcec7c2965e723fe698cde671a5bd15.jpg, https://salt.tikicdn.com/ts/product/80/5d/7c/d0d7870099a109065372ef1e7cb4f72c.jpg, https://salt.tikicdn.com/ts/product/ac/3a/f1/aea4532faabcaa3c8a55cbde1fe928af.jpg, https://salt.tikicdn.com/ts/product/f0/6a/92/982242b15a221a8bdb744fc216829031.jpg","https://salt.tikicdn.com/cache/w1200/ts/product/e2/63/1d/b988b02f9e411d9d313438efd142e785.jpg, https://salt.tikicdn.com/cache/w1200/ts/product/2c/71/75/ebbd120e73a918ca5890616a699587bd.jpg, https://salt.tikicdn.com/cache/w1200/ts/product/47/f8/98/a9566d158745523acc441fcdcc4bdb8a.jpg, https://salt.tikicdn.com/cache/w1200/ts/product/5c/ea/3b/6a6c9330fea65047ab8341c6bbdbb516.jpg, https://salt.tikicdn.com/cache/w1200/ts/product/65/54/23/cfcec7c2965e723fe698cde671a5bd15.jpg, https://salt.tikicdn.com/cache/w1200/ts/product/80/5d/7c/d0d7870099a109065372ef1e7cb4f72c.jpg, https://salt.tikicdn.com/cache/w1200/ts/product/ac/3a/f1/aea4532faabcaa3c8a55cbde1fe928af.jpg, https://salt.tikicdn.com/cache/w1200/ts/product/f0/6a/92/982242b15a221a8bdb744fc216829031.jpg","https://salt.tikicdn.com/cache/w300/ts/product/e2/63/1d/b988b02f9e411d9d313438efd142e785.jpg, https://salt.tikicdn.com/cache/w300/ts/product/2c/71/75/ebbd120e73a918ca5890616a699587bd.jpg, https://salt.tikicdn.com/cache/w300/ts/product/47/f8/98/a9566d158745523acc441fcdcc4bdb8a.jpg, https://salt.tikicdn.com/cache/w300/ts/product/5c/ea/3b/6a6c9330fea65047ab8341c6bbdbb516.jpg, https://salt.tikicdn.com/cache/w300/ts/product/65/54/23/cfcec7c2965e723fe698cde671a5bd15.jpg, https://salt.tikicdn.com/cache/w300/ts/product/80/5d/7c/d0d7870099a109065372ef1e7cb4f72c.jpg, https://salt.tikicdn.com/cache/w300/ts/product/ac/3a/f1/aea4532faabcaa3c8a55cbde1fe928af.jpg, https://salt.tikicdn.com/cache/w300/ts/product/f0/6a/92/982242b15a221a8bdb744fc216829031.jpg","https://salt.tikicdn.com/cache/200x280/ts/product/e2/63/1d/b988b02f9e411d9d313438efd142e785.jpg, https://salt.tikicdn.com/cache/200x280/ts/product/2c/71/75/ebbd120e73a918ca5890616a699587bd.jpg, https://salt.tikicdn.com/cache/200x280/ts/product/47/f8/98/a9566d158745523acc441fcdcc4bdb8a.jpg, https://salt.tikicdn.com/cache/200x280/ts/product/5c/ea/3b/6a6c9330fea65047ab8341c6bbdbb516.jpg, https://salt.tikicdn.com/cache/200x280/ts/product/65/54/23/cfcec7c2965e723fe698cde671a5bd15.jpg, https://salt.tikicdn.com/cache/200x280/ts/product/80/5d/7c/d0d7870099a109065372ef1e7cb4f72c.jpg, https://salt.tikicdn.com/cache/200x280/ts/product/ac/3a/f1/aea4532faabcaa3c8a55cbde1fe928af.jpg, https://salt.tikicdn.com/cache/200x280/ts/product/f0/6a/92/982242b15a221a8bdb744fc216829031.jpg","https://salt.tikicdn.com/cache/200x280/ts/product/e2/63/1d/b988b02f9e411d9d313438efd142e785.jpg, https://salt.tikicdn.com/cache/200x280/ts/product/2c/71/75/ebbd120e73a918ca5890616a699587bd.jpg, https://salt.tikicdn.com/cache/200x280/ts/product/47/f8/98/a9566d158745523acc441fcdcc4bdb8a.jpg, https://salt.tikicdn.com/cache/200x280/ts/product/5c/ea/3b/6a6c9330fea65047ab8341c6bbdbb516.jpg, https://salt.tikicdn.com/cache/200x280/ts/product/65/54/23/cfcec7c2965e723fe698cde671a5bd15.jpg, https://salt.tikicdn.com/cache/200x280/ts/product/80/5d/7c/d0d7870099a109065372ef1e7cb4f72c.jpg, https://salt.tikicdn.com/cache/200x280/ts/product/ac/3a/f1/aea4532faabcaa3c8a55cbde1fe928af.jpg, https://salt.tikicdn.com/cache/200x280/ts/product/f0/6a/92/982242b15a221a8bdb744fc216829031.jpg",1000,3
155495111,GIÁO TRÌNH PHẠN VĂN,110000,"GIÁO TRÌNH PHẠN VĂNQuyển sách Giáo khoa căn bản về Ngữ pháp Sanskrit theo tiêu chuẩn Đại học của CHLB Đức, do Thomas Lehmann và Đỗ Quốc Bảo, Giáo sư, Tiến sĩ chuyên ngành Cổ Ấn-độ học Đại học Heidelb...","GIÁO TRÌNH PHẠN VĂN Quyển sách Giáo khoa căn bản về Ngữ pháp Sanskrit theo tiêu chuẩn Đại học của CHLB Đức, do Thomas Lehmann và Đỗ Quốc Bảo , Giáo sư, Tiến sĩ chuyên ngành Cổ Ấn-độ học Đại học Heidelberg biên soạn. Hương Tích ấn hành tháng 5/ 2020. Tác giả giữ bản quyền. ___ “… Khoảng năm 2000, tôi gặp Đỗ Quốc Bảo tại Già-lam. Biết anh đang theo học chuyên môn Sanskrit với các Giáo sư Sanskrit hàng đầu hiện tại ở Đức, tôi đề nghị anh mở lớp Sanskrit ngắn hạn, đồng thời soạn một quyển Giáo khoa Phạn ngữ thích hợp cho trình độ tăng ni sinh Việt nam. Khoá học chỉ diễn ra một thời gian cực ngắn với số học viên khá ít. Không chỉ riêng anh thất vọng, mà tôi cũng thất vọng không kém. Sau này, khi giảng Thành duy thức và Câu-xá cho một số thầy cô, tôi đã cố gắng nêu những điểm khó trong bản Hán mà nếu không biết đến ngữ pháp Sanskrit thì không thể hiểu được, với mục đích khơi dậy hứng thú học Phạn ngữ. Cụ thể như trong bài tựa Thành duy thức , Khuy Cơ sớ giải rất rõ, câu tụng “đảnh lễ Duy thức tánh” thuộc biến cách bảy (sở y/ư cách, Thuật ký: 聲境第七攝; Hán thường gọi là sở y cách 所依第七囀聲), và câu tụng “Mãn Phần thành tịnh giả” thuộc biến cách bốn (sở dữ cách, 第四囀攝,此梵本音。一切所敬皆第四囀故, Hán gọi là vị cách 第四為聲). Nếu không rõ ý nghĩa các biến cách danh từ này thì sẽ không biết “ai đảnh lễ ai ở đâu” Cho đến khi giảng Câu-xá , do có nguyên bản Sanskrit, và các bản dịch đối chiếu từ Hán, Tạng, Nhật, Pháp và Anh, tuy vậy, dễ thấy các điểm ngữ pháp trong đó vô cùng phức tạp mà các bản Hán không thể chuyển dịch. Qua sớ giải của Yaśomitra, nhiều quy tắc từ Pāṇini được dẫn và giải, cho thấy các bản Hán nhiều khi đã phải lược qua vì không có từ hoặc khái niệm tương đương… Sanskrit thuộc loại ngôn ngữ đa âm tiết; mỗi từ được hợp thành bởi nhiều yếu tố. Các từ chuyển tải ý nghĩa của mỗi yếu tố, mặc dù được chỉ định như là từ chuyên biệt ngữ pháp, thảy đều mang nội hàm triết học, phản ảnh tư duy Ấn-độ cổ đại. Lấy ví dụ, trong các từ được gọi là động từ, nó bao gồm phần chính mà ta gọi là ngữ căn hay gốc động từ, vốn dịch Việt của từ Anh verbal root , nguyên Phạn ngữ của nó là dhātu , Hán dịch là tự giới . Cùng với tiền tố prefix của nó, và hậu tố biến hoá của nó, termination , nguyên Phạn ngữ là pratyaya , Hán dịch là tự duyên . Từ dhātu mặc dù được dùng trong phạm trù ngữ pháp ở đây vẫn phản ánh tư duy triết học như trong các luận thư Abhidharma . Nội hàm của từ dhātu mang tính triết học trong bài tụng dưới đây dẫn từ Luận Nhiếp Đại thừa (Mahā-yānasaṃgrahaśāstra) vẫn áp dụng cho từ dhātu như là động từ căn trong phạm trù ngữ pháp: anādikāliko dhātuḥ sarvadharmasamāśrayaḥ | tasmin sati gatiḥ sarvā nirvāṇādhigamo ’pi ca || Hiểu nội hàm của từ dhātu trong cả hai ngữ cảnh khác nhau này cho thấy mối quan hệ mật thiết trong tư duy triết học và tư duy ngôn ngữ học. Ý nghĩa này càng được thấy rõ tầm quan trọng khi trong nhiều Kinh đức Phật truy nguyên gốc của một từ thông dụng từ dhātu của nó… Một ít thí dụ dẫn trên chỉ muốn cho thấy các từ chuyên biệt của ngữ pháp đều phản ánh những tư duy triết học. Đây là điểm khó cho biên soạn Giáo trình cũng như Ngữ pháp Sanskrit bằng ngôn ngữ phương vực của mình. Các nhà Phạn học phương Tây khi biên soạn các sách ngữ pháp Sanskrit đã không thể tìm thấy những từ chuyên biệt ngữ pháp Sanskrit tương đương trong kho từ vựng ngữ pháp, mà chỉ mượn một số từ trong từ vựng ngữ pháp La-tinh xem là tương đương, chỉ về mặt hình thức và kỹ thuật. Dù vậy, số từ vựng được xem là tương đương này vẫn không đủ, so với kho từ vựng ngữ pháp Sanskrit phong phú. Về phần tiếng Việt, hầu hết từ vựng ngữ pháp trong hiện tại phần lớn chỉ tìm thấy những từ thông dụng dịch từ các ngôn ngữ Anh hay Pháp, số lượng thật nghèo nàn. Trong nhiều thảo luận với Đỗ Quốc Bảo về vấn đề này, tôi biết anh đã dụng công quá nhiều để có thể giúp người học có một kiến thức cơ bản từ vựng ngữ học Sanskrit để sau đó khả dĩ đi sâu vào các văn bản Phật giáo, từ các Kinh Phật thuyết cho đến các luận thư Abhidharma. Làm được điều này, đòi hỏi soạn giả phải thông thạo tiếng Việt có vốn liếng từ Hán căn bản, và nhất là nắm vững ý nghĩa các từ chuyên biệt ngữ pháp trên cơ sở tư duy triết học. Cái gọi là “tiếng Việt thuần tuý”, từ chối tất cả có gốc Hán, hầu như chỉ là sáo rỗng. Người Nhật cũng học Hán, chịu ảnh hưởng văn minh Hán tộc, nhưng qua lịch sử phát triển, đã thâu thái thành bản sắc cá biệt của mình. Khi tiếp xúc với văn minh phương Tây, họ thấy nhiều từ trong các lãnh vực khoa học, kinh tế, tôn giáo trong các ngôn ngữ phương Tây khó tìm thấy tương đương trong kho từ vựng Hán đã được Nhật hoá. Họ đã tạo thêm những từ mới vay mượn các từ Hán cổ để dịch các từ như philosophy , hay economy/ economics , thành các từ Nhật bằng Hán tự gọi là kanji như triết học, kinh tế Người Hoa hiện tại vẫn phải dùng các từ này, vốn không là những từ sáng tạo của Hán tộc, mà của người Nhật. Vậy thì, chúng ta dùng các từ Hán cổ để dịch những từ Sanskrit mà trong kho ngôn ngữ Việt hoặc thuần giống hoặc Việt hoá từ Hán trong chừng mực có thể gần với nội hàm của từ Sanskrit được hiểu trong phạm trù ngữ pháp mà cũng không làm mất đi tư duy triết học trong đó. Đây là điều mà tôi cảm nhận Đỗ Quốc Bảo đang cố gắng. Nhiều từ anh dùng trong các tập Giáo trình và Ngữ pháp Sanskrit có thể rất lạ tai với các học viên hay độc giả vốn chỉ quen với các từ ngữ pháp trong tiếng Anh hoặc Pháp. Trong thực tế, một từ mới phát sinh trong các quan hệ xã hội, nếu nó phản ánh được trạng thái tồn tại cũng như mối quan hệ xã hội giữa người và người, nó sẽ sống và phát triển lâu dài. Nếu nó không phản ánh được như vậy, chỉ trong một thời sẽ bị quên lãng, hoặc biến mất. Cho nên, nhiều từ ngữ pháp trong tập ngữ pháp này cũng rất lạ tai đối với tôi, nhưng tôi vẫn sẵn sàng chấp nhận. Cho đến khi nếu tôi cảm thấy, hay tìm thấy từ nào khác hơn có thể thay thế, tôi sẽ đề nghị thay thế. Vậy tôi mong tập sách này sẽ giúp những vị có nhiều cảm hứng trong việc học Sanskrit không chỉ dừng lại ở cảm hứng đối với ngôn ngữ kỳ diệu Sanskrit, mà từ căn bản này đi sâu vào tư duy triết học trong Phật học, và có thể rộng hơn nữa, khuynh hướng tư duy triết học Ấn cổ đại.” Thị ngạn am, đầu xuân Canh Tý, 2020 Tuệ Sỹ Giá sản phẩm trên Tiki đã bao gồm thuế theo luật hiện hành. Bên cạnh đó, tuỳ vào loại sản phẩm, hình thức và địa chỉ giao hàng mà có thể phát sinh thêm chi phí khác như phí vận chuyển, phụ phí hàng cồng kềnh, thuế nhập khẩu (đối với đơn hàng giao từ nước ngoài có giá trị trên 1 triệu đồng).....",0,0,https://salt.tikicdn.com/ts/product/77/38/22/8a3900966d66285eff94b63df05eb405.jpg,https://salt.tikicdn.com/cache/w1200/ts/product/77/38/22/8a3900966d66285eff94b63df05eb405.jpg,https://salt.tikicdn.com/cache/w300/ts/product/77/38/22/8a3900966d66285eff94b63df05eb405.jpg,https://salt.tikicdn.com/cache/200x280/ts/product/77/38/22/8a3900966d66285eff94b63df05eb405.jpg,https://salt.tikicdn.com/cache/200x280/ts/product/77/38/22/8a3900966d66285eff94b63df05eb405.jpg,1000,0
115706444,Kỹ Năng Phiên Dịch,116000,"Phiên dịch là một nghề chuyên môn (a profession). Do đó, phiên dịch viên phải không ngừng trau dồi năng lực ngôn ngữ, trang bị cho mình vốn kiến thức sâu rộng và mài giũa các kỹ năng cần thiết. Được đ...","Phiên dịch là một nghề chuyên môn (a profession). Do đó, phiên dịch viên phải không ngừng trau dồi năng lực ngôn ngữ, trang bị cho mình vốn kiến thức sâu rộng và mài giũa các kỹ năng cần thiết. Được đúc kết từ kinh nghiệm của tác giả qua nhiều năm đảm nhiệm đồng thời ba vai trò: phiên dịch viên, giáo sư giảng dạy bộ môn Phiên dịch, và nhà điều hành doanh nghiệp phái cử, cơ sở đào tạo phiên dịch viên, Kỹ năng phiên dịch là cuốn cẩm nang cung cấp đầy đủ hành trang trên con đường trở thành một phiên dịch viên chuyên nghiệp. Cuốn sách này hữu ích đối với các thầy, cô giảng dạy thực hành phiên dịch, lý thuyết phiên dịch, cũng như những người đã, đang và sẽ trở thành phiên dịch viên trong tương lai. Giá sản phẩm trên Tiki đã bao gồm thuế theo luật hiện hành. Bên cạnh đó, tuỳ vào loại sản phẩm, hình thức và địa chỉ giao hàng mà có thể phát sinh thêm chi phí khác như phí vận chuyển, phụ phí hàng cồng kềnh, thuế nhập khẩu (đối với đơn hàng giao từ nước ngoài có giá trị trên 1 triệu đồng).....",0,0,"https://salt.tikicdn.com/ts/product/b5/02/f1/92942f88f3c8ec2773047b33d8d991b3.jpg, https://salt.tikicdn.com/ts/product/4f/a8/a6/4adec9aa0a5cb1a99a932927be08a4d3.jpg","https://salt.tikicdn.com/cache/w1200/ts/product/b5/02/f1/92942f88f3c8ec2773047b33d8d991b3.jpg, https://salt.tikicdn.com/cache/w1200/ts/product/4f/a8/a6/4adec9aa0a5cb1a99a932927be08a4d3.jpg","https://salt.tikicdn.com/cache/w300/ts/product/b5/02/f1/92942f88f3c8ec2773047b33d8d991b3.jpg, https://salt.tikicdn.com/cache/w300/ts/product/4f/a8/a6/4adec9aa0a5cb1a99a932927be08a4d3.jpg","https://salt.tikicdn.com/cache/200x280/ts/product/b5/02/f1/92942f88f3c8ec2773047b33d8d991b3.jpg, https://salt.tikicdn.com/cache/200x280/ts/product/4f/a8/a6/4adec9aa0a5cb1a99a932927be08a4d3.jpg","https://salt.tikicdn.com/cache/200x280/ts/product/b5/02/f1/92942f88f3c8ec2773047b33d8d991b3.jpg, https://salt.tikicdn.com/cache/200x280/ts/product/4f/a8/a6/4adec9aa0a5cb1a99a932927be08a4d3.jpg",1000,0
533078,Từ Điển Ngân Hàng (Anh - Trung - Việt),70000,Từ Điển Ngân Hàng (Anh - Trung - Việt) Quyển Từ Điển Ngân Hàng (Anh - Trung - Việt) được biên soạn nhằm cung cấp một cách có hệ thống các từ chuyên ngành trong lĩnh vực Ngân hàng theo 3 ngôn ngữ Anh ...,"Từ Điển Ngân Hàng (Anh - Trung - Việt) Quyển Từ Điển Ngân Hàng (Anh - Trung - Việt) được biên soạn nhằm cung cấp một cách có hệ thống các từ chuyên ngành trong lĩnh vực Ngân hàng theo 3 ngôn ngữ Anh - Trung - Việt. Nội dung của từ điển bao gồm các nội dung với những điểm nổi bật như sau: - Mỗi mục từ trong sách này, dù là từ đơn hay từ phức, đều sắp xếp theo trật tự thuận của mẫu tự tiếng Anh. Trừ chữ đầu mục từ được viết chữ in hoa, còn lại đều dùng chữ in thường. - Từ phức do nhiều từ đơn tạo thành, trước hết căn cứ trật tự thuận của bảng mẫu tự tiếng Anh để xếp từ thứ nhất, sau đó tiếp tục căn cứ vào trật tự thuận để xếp từ thứ hai, cứ thế xếp tiếp. Từ đơn được nối tiếp bằng dấu nối ""_"" được xem như từ phức. - Chữ viết tắt hay rút gọn của từ đơn hoặc từ phức được để trong dấu ngoặc đơn (), đồng thời chữ viết tắt cũng kê ra toàn thể chữ đầy đủ trong dấu ngoặc đơn (). - Khi một từ đơn hoặc từ phức tiếng Anh được dịch thành các từ đồng nghĩa thì dùng dấu phẩy để ngăn cách "","", khi từ tiếng Anh có nhiều nghĩa khác nhau, các từ dịch ra được ngăn cách bằng dấu chấm phẩy "";"". - Một số từ đơn hay từ phức trong tiếng Anh khi dịch ra có ý nghĩa tương đối trừu tượng hoặc dễ lẫn với từ khác, khi dịch đưa thêm giải thích ngắn gọn trong ngoặc đơn. - Có một số từ đơn hoặc từ phức có ý nghĩa gần với từ đơn hoặc từ phức khác. Ở sau mục từ đó có ghi thêm (xem x x x).Tất cả các từ ngoại lai đều đánh dấu hoa thị * ở bên phải từ. Giá sản phẩm trên Tiki đã bao gồm thuế theo luật hiện hành. Bên cạnh đó, tuỳ vào loại sản phẩm, hình thức và địa chỉ giao hàng mà có thể phát sinh thêm chi phí khác như phí vận chuyển, phụ phí hàng cồng kềnh, thuế nhập khẩu (đối với đơn hàng giao từ nước ngoài có giá trị trên 1 triệu đồng).....",0,0,https://salt.tikicdn.com/media/catalog/product/i/m/img221.u2469.d20160803.t115014.59935.jpg,https://salt.tikicdn.com/cache/w1200/media/catalog/product/i/m/img221.u2469.d20160803.t115014.59935.jpg,https://salt.tikicdn.com/cache/w300/media/catalog/product/i/m/img221.u2469.d20160803.t115014.59935.jpg,https://salt.tikicdn.com/cache/200x280/media/catalog/product/i/m/img221.u2469.d20160803.t115014.59935.jpg,https://salt.tikicdn.com/cache/200x280/media/catalog/product/i/m/img221.u2469.d20160803.t115014.59935.jpg,1000,0
