id,name,price,short_description,description,rating_average,review_count,image_base_url,image_large_url,image_medium_url,image_small_url,image_thumbnail_url,stock,quantity_sold
277348251,Tâm Lý Học Tội Phạm - Khi Kẻ Yếu Trở Thành Kẻ Săn Mồi,126000,"“Tâm lý học tội phạm - Khi kẻ yếu trở thành kẻ săn mồi” là phần tiếp theo của “Tâm lý học tội phạm - Phác họa chân dung kẻ phạm tội”, cuốn sách từng tạo nên cơn sốt tội phạm đình đám một thời.Ở phần ...","“Tâm lý học tội phạm - Khi kẻ yếu trở thành kẻ săn mồi ” là phần tiếp theo của “Tâm lý học tội phạm - Phác họa chân dung kẻ phạm tội” , cuốn sách từng tạo nên cơn sốt tội phạm đình đám một thời. Ở phần 2 này, cuốn sách sẽ đưa bạn đi sâu vào thế giới tinh thần biến thái và vặn vẹo của 24 tên sát nhân hàng loạt khét tiếng nhất thế giới, những kẻ từng được đưa vào làm hình mẫu tội phạm trong phim ảnh. Không chỉ tiết lộ những tội ác khó tưởng như ăn não bạn tù, xẻ thịt người làm bánh mì, phân xác nạn nhân làm thức ăn cho lợn … cuốn sách còn giúp độc giả giải đáp thắc mắc: Có gì trong bộ não của những kẻ giết người hàng loạt? Chúng là tội phạm bẩm sinh hay được “đào tạo” để trở thành sát nhân? Bằng góc nhìn khách quan và lập luận sắc bén, tác giả Ngưng Thị Uyên Thâm đã chỉ ra rằng: Trong các loại tội phạm, tội phạm giết người hàng loạt là loại điên cuồng nhất, tàn nhẫn nhất và khó hiểu nhất. Chúng không thể kiểm soát được ham muốn giết chóc của mình. Bởi đã một khi đã nếm trải khoái cảm trong quá trình chà đạp nạn nhân, chúng rất khó lòng dừng tay. Chúng khát máu tựa như người đi trên sa mạc khát nước. Chỉ đến khi tự sát hoặc bị bắt, bằng không, chúng sẽ luôn tìm kiếm và sát hại mọi “con mồi” trong tầm mắt. Cách tốt nhất để hiểu về những tên sát nhân hàng loạt chính là hiểu câu chuyện của riêng chúng. Có những kẻ từng trải qua tuổi thơ nghèo khó, hỗn loạn và bạo lực. Có những kẻ lại phải chịu đựng nỗi đau vượt ngoài sức tưởng tượng để rồi biến thành ác quỷ… Thông qua 24 hồ sơ CÓ THẬT, bạn đọc sẽ tiếp thu thêm kiến thức về sự phức tạp trong tâm lý con người. Trong thế giới nội tâm của chúng ta tồn tại một con quái thú đang ẩn náu, khi con quái thú ấy bị một nhân tố nhỏ bé đánh thức, chúng ta đều có khả năng trở thành tội phạm, thậm chí là loại khủng khiếp nhất - tội phạm giết người hàng loạt. “Tâm lý học tội phạm - Khi kẻ yếu trở thành kẻ săn mồi” hứa hẹn sẽ dẫn bạn qua những cung bậc cảm xúc từ kinh ngạc đến ghê sợ, đồng thời làm thỏa mãn sự tò mò của bạn về những góc khuất đen tối nhất trong tâm lý của những kẻ giết người hàng loạt, đi đến tận gốc rễ đằng sau nơi tội ác được hình thành. Giá sản phẩm trên Tiki đã bao gồm thuế theo luật hiện hành. Bên cạnh đó, tuỳ vào loại sản phẩm, hình thức và địa chỉ giao hàng mà có thể phát sinh thêm chi phí khác như phí vận chuyển, phụ phí hàng cồng kềnh, thuế nhập khẩu (đối với đơn hàng giao từ nước ngoài có giá trị trên 1 triệu đồng).....",0,0,"https://salt.tikicdn.com/ts/product/60/1f/ab/3fa2fbd94db917cfa7b78fc8e1fc80e1.jpg, https://salt.tikicdn.com/ts/product/09/cb/8e/c0e5883358cef6ff326a37b5875995dd.jpg, https://salt.tikicdn.com/ts/product/4a/78/28/be727b0da9af92dc410ef46ab4d32dc4.jpg","https://salt.tikicdn.com/cache/w1200/ts/product/60/1f/ab/3fa2fbd94db917cfa7b78fc8e1fc80e1.jpg, https://salt.tikicdn.com/cache/w1200/ts/product/09/cb/8e/c0e5883358cef6ff326a37b5875995dd.jpg, https://salt.tikicdn.com/cache/w1200/ts/product/4a/78/28/be727b0da9af92dc410ef46ab4d32dc4.jpg","https://salt.tikicdn.com/cache/w300/ts/product/60/1f/ab/3fa2fbd94db917cfa7b78fc8e1fc80e1.jpg, https://salt.tikicdn.com/cache/w300/ts/product/09/cb/8e/c0e5883358cef6ff326a37b5875995dd.jpg, https://salt.tikicdn.com/cache/w300/ts/product/4a/78/28/be727b0da9af92dc410ef46ab4d32dc4.jpg","https://salt.tikicdn.com/cache/200x280/ts/product/60/1f/ab/3fa2fbd94db917cfa7b78fc8e1fc80e1.jpg, https://salt.tikicdn.com/cache/200x280/ts/product/09/cb/8e/c0e5883358cef6ff326a37b5875995dd.jpg, https://salt.tikicdn.com/cache/200x280/ts/product/4a/78/28/be727b0da9af92dc410ef46ab4d32dc4.jpg","https://salt.tikicdn.com/cache/200x280/ts/product/60/1f/ab/3fa2fbd94db917cfa7b78fc8e1fc80e1.jpg, https://salt.tikicdn.com/cache/200x280/ts/product/09/cb/8e/c0e5883358cef6ff326a37b5875995dd.jpg, https://salt.tikicdn.com/cache/200x280/ts/product/4a/78/28/be727b0da9af92dc410ef46ab4d32dc4.jpg",1000,0
276860812,Tâm Lý Học Tội Phạm – Khi Kẻ Yếu Trở Thành Kẻ Săn Mồi,106000,"TÂM LÝ HỌC TỘI PHẠM - KHI KẺ YẾU TRỞ THÀNH KẺ SĂN MỒI“Tâm lý học tội phạm - Khi kẻ yếu trở thành kẻ săn mồi” là phần tiếp theo của “Tâm lý học tội phạm - Phác họa chân dung kẻ phạm tội”, cuốn sách từ...","TÂM LÝ HỌC TỘI PHẠM - KHI KẺ YẾU TRỞ THÀNH KẺ SĂN MỒI “Tâm lý học tội phạm - Khi kẻ yếu trở thành kẻ săn mồi” là phần tiếp theo của “Tâm lý học tội phạm - Phác họa chân dung kẻ phạm tội”, cuốn sách từng tạo nên cơn sốt tội phạm đình đám một thời. Ở phần 2 này, cuốn sách sẽ đưa bạn đi sâu vào thế giới tinh thần biến thái và vặn vẹo của 24 tên sát nhân hàng loạt khét tiếng nhất thế giới, những kẻ từng được đưa vào làm hình mẫu tội phạm trong phim ảnh. Không chỉ tiết lộ những tội ác khó tưởng như ăn não bạn tù, xẻ thịt người làm bánh mì, phân xác nạn nhân làm thức ăn cho lợn … cuốn sách còn giúp độc giả giải đáp thắc mắc: Có gì trong bộ não của những kẻ giết người hàng loạt? Chúng là tội phạm bẩm sinh hay được “đào tạo” để trở thành sát nhân? Bằng góc nhìn khách quan và lập luận sắc bén, tác giả Ngưng Thị Uyên Thâm đã chỉ ra rằng: Trong các loại tội phạm, tội phạm giết người hàng loạt là loại điên cuồng nhất, tàn nhẫn nhất và khó hiểu nhất. Chúng không thể kiểm soát được ham muốn giết chóc của mình. Bởi đã một khi đã nếm trải khoái cảm trong quá trình chà đạp nạn nhân, chúng rất khó lòng dừng tay. Chúng khát máu tựa như người đi trên sa mạc khát nước. Chỉ đến khi tự sát hoặc bị bắt, bằng không, chúng sẽ luôn tìm kiếm và sát hại mọi “con mồi” trong tầm mắt. Cách tốt nhất để hiểu về những tên sát nhân hàng loạt chính là hiểu câu chuyện của riêng chúng. Có những kẻ từng trải qua tuổi thơ nghèo khó, hỗn loạn và bạo lực. Có những kẻ lại phải chịu đựng nỗi đau vượt ngoài sức tưởng tượng để rồi biến thành ác quỷ… Thông qua 24 hồ sơ CÓ THẬT, bạn đọc sẽ tiếp thu thêm kiến thức về sự phức tạp trong tâm lý con người. Trong thế giới nội tâm của chúng ta tồn tại một con quái thú đang ẩn náu, khi con quái thú ấy bị một nhân tố nhỏ bé đánh thức, chúng ta đều có khả năng trở thành tội phạm, thậm chí là loại khủng khiếp nhất - tội phạm giết người hàng loạt. “Tâm lý học tội phạm - Khi kẻ yếu trở thành kẻ săn mồi” hứa hẹn sẽ dẫn bạn qua những cung bậc cảm xúc từ kinh ngạc đến ghê sợ, đồng thời làm thỏa mãn sự tò mò của bạn về những góc khuất đen tối nhất trong tâm lý của những kẻ giết người hàng loạt, đi đến tận gốc rễ đằng sau nơi tội ác được hình thành. Giá sản phẩm trên Tiki đã bao gồm thuế theo luật hiện hành. Bên cạnh đó, tuỳ vào loại sản phẩm, hình thức và địa chỉ giao hàng mà có thể phát sinh thêm chi phí khác như phí vận chuyển, phụ phí hàng cồng kềnh, thuế nhập khẩu (đối với đơn hàng giao từ nước ngoài có giá trị trên 1 triệu đồng).....",5,1,"https://salt.tikicdn.com/ts/product/8f/9c/89/251c028f79d164782349b983a841b53b.png, https://salt.tikicdn.com/ts/product/b7/7a/ae/1dd6e778191d4eef5d175bff37a111e0.png, https://salt.tikicdn.com/ts/product/d3/cc/87/2149243b4da9cd2b4839476b2818489e.png, https://salt.tikicdn.com/ts/product/11/9f/6c/06b0fc959f38f60a6168e4aeb67cc584.png, https://salt.tikicdn.com/ts/product/f8/47/70/7b72d741bed789ff8fdd69c7ad0022f1.png","https://salt.tikicdn.com/cache/w1200/ts/product/8f/9c/89/251c028f79d164782349b983a841b53b.png, https://salt.tikicdn.com/cache/w1200/ts/product/b7/7a/ae/1dd6e778191d4eef5d175bff37a111e0.png, https://salt.tikicdn.com/cache/w1200/ts/product/d3/cc/87/2149243b4da9cd2b4839476b2818489e.png, https://salt.tikicdn.com/cache/w1200/ts/product/11/9f/6c/06b0fc959f38f60a6168e4aeb67cc584.png, https://salt.tikicdn.com/cache/w1200/ts/product/f8/47/70/7b72d741bed789ff8fdd69c7ad0022f1.png","https://salt.tikicdn.com/cache/w300/ts/product/8f/9c/89/251c028f79d164782349b983a841b53b.png, https://salt.tikicdn.com/cache/w300/ts/product/b7/7a/ae/1dd6e778191d4eef5d175bff37a111e0.png, https://salt.tikicdn.com/cache/w300/ts/product/d3/cc/87/2149243b4da9cd2b4839476b2818489e.png, https://salt.tikicdn.com/cache/w300/ts/product/11/9f/6c/06b0fc959f38f60a6168e4aeb67cc584.png, https://salt.tikicdn.com/cache/w300/ts/product/f8/47/70/7b72d741bed789ff8fdd69c7ad0022f1.png","https://salt.tikicdn.com/cache/200x280/ts/product/8f/9c/89/251c028f79d164782349b983a841b53b.png, https://salt.tikicdn.com/cache/200x280/ts/product/b7/7a/ae/1dd6e778191d4eef5d175bff37a111e0.png, https://salt.tikicdn.com/cache/200x280/ts/product/d3/cc/87/2149243b4da9cd2b4839476b2818489e.png, https://salt.tikicdn.com/cache/200x280/ts/product/11/9f/6c/06b0fc959f38f60a6168e4aeb67cc584.png, https://salt.tikicdn.com/cache/200x280/ts/product/f8/47/70/7b72d741bed789ff8fdd69c7ad0022f1.png","https://salt.tikicdn.com/cache/200x280/ts/product/8f/9c/89/251c028f79d164782349b983a841b53b.png, https://salt.tikicdn.com/cache/200x280/ts/product/b7/7a/ae/1dd6e778191d4eef5d175bff37a111e0.png, https://salt.tikicdn.com/cache/200x280/ts/product/d3/cc/87/2149243b4da9cd2b4839476b2818489e.png, https://salt.tikicdn.com/cache/200x280/ts/product/11/9f/6c/06b0fc959f38f60a6168e4aeb67cc584.png, https://salt.tikicdn.com/cache/200x280/ts/product/f8/47/70/7b72d741bed789ff8fdd69c7ad0022f1.png",1000,1
276750335,Ghi Chép Trọng Án 2,141000,"Thế giới của tội ác không đơn thuần chỉ có hai màu đen trắng, mà luôn ẩn chứa những lớp màu xám khó lường. Tiếp nối những câu chuyện hình sự kịch tính từ Tập 1, Trong ""Ghi chép trọng án 2"", tác giả L...","Thế giới của tội ác không đơn thuần chỉ có hai màu đen trắng, mà luôn ẩn chứa những lớp màu xám khó lường. Tiếp nối những câu chuyện hình sự kịch tính từ Tập 1, Trong ""Ghi chép trọng án 2"", tác giả Lưu Tinh Thần một lần nữa đưa độc giả vào cuộc hành trình lật mở những góc tối sâu kín nhất trong tâm hồn con người, nơi ranh giới giữa thiện và ác mong manh đến mức tưởng chừng như tan biến. Mỗi vụ án là một màn đấu trí không khoan nhượng, mỗi trang sách là một bản tường thuật chân thực và chi tiết. Độc giả sẽ cùng bước vào những hiện trường án mạng tưởng như dễ đoán nhưng lại cất giấu bí ẩn chết người. Từng chi tiết nhỏ nhặt, từng dấu vết mờ nhạt trên hiện trường đều có thể là chìa khóa để vén bức màn bí mật. Nhưng liệu bạn có đủ tỉnh táo để nhìn ra sự thật, hay sẽ bị cuốn vào vòng xoáy của những giả thuyết đánh lừa? Cuốn sách không chỉ dừng lại ở việc mô tả sự tàn bạo của tội phạm mà còn khai thác sâu sắc tâm lý của cảnh sát - Những con người thực thi công lý, từng ngày đấu tranh với mặt trái của xã hội. Họ không chỉ đối mặt với sự nguy hiểm từ kẻ phạm tội mà còn phải giằng xé với những quyết định khó khăn trên ranh giới mong manh giữa thiện và ác. Với văn phong sắc bén cùng nghiệp vụ cảnh sát của mình, Lưu Tinh Thần đã kể lại những vụ án căng thẳng đến nghẹt thở. Bạn sẽ bị cuốn vào cuộc truy bắt nghẹt thở qua những ngõ nhỏ chật hẹp, những trận phục kích nơi bóng tối che giấu mọi tội ác. Cuốn sách còn đưa ra những câu hỏi khiến người đọc phải trăn trở: ""Điều gì làm nên công lý? Và khi nào công lý trở nên nguy hiểm?"" Nếu bạn yêu thích dòng sách tâm lý - hình sự, ""Ghi chép trọng án 2"" sẽ là lựa chọn không thể bỏ qua. Đây không chỉ là cuốn sách gỡ nút thắt của nhiều vụ án hình sự nghiêm trọng, mà còn là bài học sâu sắc về bản chất con người, nơi ranh giới thiện và ác không dễ dàng phân định và dễ bị biến chất trước những cám dỗ và lợi ích. Giá sản phẩm trên Tiki đã bao gồm thuế theo luật hiện hành. Bên cạnh đó, tuỳ vào loại sản phẩm, hình thức và địa chỉ giao hàng mà có thể phát sinh thêm chi phí khác như phí vận chuyển, phụ phí hàng cồng kềnh, thuế nhập khẩu (đối với đơn hàng giao từ nước ngoài có giá trị trên 1 triệu đồng).....",5,1,"https://salt.tikicdn.com/ts/product/ff/50/3f/7de5c53134a7df376c4bd9cb6df5b71a.jpg, https://salt.tikicdn.com/ts/product/8d/af/29/aa2f6f657f9ad8b8910fae38b8289f8c.JPG, https://salt.tikicdn.com/ts/product/e1/c4/26/3a4a5fdcb6da285e93e6b9aba0db2a85.jpg","https://salt.tikicdn.com/cache/w1200/ts/product/ff/50/3f/7de5c53134a7df376c4bd9cb6df5b71a.jpg, https://salt.tikicdn.com/cache/w1200/ts/product/8d/af/29/aa2f6f657f9ad8b8910fae38b8289f8c.JPG, https://salt.tikicdn.com/cache/w1200/ts/product/e1/c4/26/3a4a5fdcb6da285e93e6b9aba0db2a85.jpg","https://salt.tikicdn.com/cache/w300/ts/product/ff/50/3f/7de5c53134a7df376c4bd9cb6df5b71a.jpg, https://salt.tikicdn.com/cache/w300/ts/product/8d/af/29/aa2f6f657f9ad8b8910fae38b8289f8c.JPG, https://salt.tikicdn.com/cache/w300/ts/product/e1/c4/26/3a4a5fdcb6da285e93e6b9aba0db2a85.jpg","https://salt.tikicdn.com/cache/200x280/ts/product/ff/50/3f/7de5c53134a7df376c4bd9cb6df5b71a.jpg, https://salt.tikicdn.com/cache/200x280/ts/product/8d/af/29/aa2f6f657f9ad8b8910fae38b8289f8c.JPG, https://salt.tikicdn.com/cache/200x280/ts/product/e1/c4/26/3a4a5fdcb6da285e93e6b9aba0db2a85.jpg","https://salt.tikicdn.com/cache/200x280/ts/product/ff/50/3f/7de5c53134a7df376c4bd9cb6df5b71a.jpg, https://salt.tikicdn.com/cache/200x280/ts/product/8d/af/29/aa2f6f657f9ad8b8910fae38b8289f8c.JPG, https://salt.tikicdn.com/cache/200x280/ts/product/e1/c4/26/3a4a5fdcb6da285e93e6b9aba0db2a85.jpg",1000,1
276606899,Combo Hồ Sơ Tâm Lý Phạm Tội (Bộ 5 Tập) - AZ,1090250,Combo Hồ Sơ Tâm Lý Phạm Tội (Bộ 5 Tập) Bộ sách gồm 5 cuốn:1. Hồ Sơ Tâm Lý Phạm Tội - Tập 12. Hồ Sơ Tâm Lý Phạm Tội - Tập 23. Hồ Sơ Tâm Lý Phạm Tội - Tập 34. Hồ Sơ Tâm Lý Phạm Tội - Tập 45. Hồ S...,"Combo Hồ Sơ Tâm Lý Phạm Tội (Bộ 5 Tập) Bộ sách gồm 5 cuốn: 1. Hồ Sơ Tâm Lý Phạm Tội - Tập 1 2. Hồ Sơ Tâm Lý Phạm Tội - Tập 2 3. Hồ Sơ Tâm Lý Phạm Tội - Tập 3 4. Hồ Sơ Tâm Lý Phạm Tội - Tập 4 5. Hồ Sơ Tâm Lý Phạm Tội - Tập 5 Hắn là Đội trưởng Đội Hình sự, con trai độc nhất của một gia tộc giàu có, thích la cà quán xá vỉa hè, hành sự khó lường, coi thường khuôn phép, lên núi đao xuống biển lửa vẫn một lòng bảo vệ công lý. Anh là nhà tâm lý học trẻ tuổi xuất chúng, vì bị chèn ép mà mất đi tất cả, phải che giấu bản thân, trở thành quản lý ký túc xá trường tiểu học. Hình Tòng Liên chưa từng nghĩ rằng có một ngày Lâm Thần sẽ xuất hiện trong màn mưa, nói với hắn: “Xin hãy cho tôi tham gia điều tra.” Cát trắng bên các thi thể, xe bus học sinh bị bắt cóc, buổi livestream những vụ tự sát trong trường học, hàng loạt vụ kỳ án liên tục xảy ra. Những phương thức gây án đáng sợ, kẻ thủ ác vẫn là một ẩn số, họ quyết chiến đấu bằng cả sinh mạng mình. … Chẳng ai biết rồi cuối cùng nhân loại sẽ đi về đâu. Nhưng bộ não là một cơ quan kỳ diệu thôi thúc chúng ta khám phá vũ trụ, khám phá những bí ẩn trong tâm trí con người. Đến tận cuối cuộc đời, chúng ta vẫn luôn hy vọng có thể trở thành người tốt hơn. Hướng thiện, kiếm tìm sự thật, khao khát cái đẹp và chiến đấu đến cùng với bản tính động vật tiềm tàng bên trong con người mình, đó chính là nhân tính. == Công ty phát hành Nhà Sách AZ Việt Nam Năm Xuất Bản 2024 Tác Giả Trường Nhị Kích Thước 16 x 24 cm Nhà Xuất bản Dân Trí Bìa Mềm Giá sản phẩm trên Tiki đã bao gồm thuế theo luật hiện hành. Bên cạnh đó, tuỳ vào loại sản phẩm, hình thức và địa chỉ giao hàng mà có thể phát sinh thêm chi phí khác như phí vận chuyển, phụ phí hàng cồng kềnh, thuế nhập khẩu (đối với đơn hàng giao từ nước ngoài có giá trị trên 1 triệu đồng).....",0,0,"https://salt.tikicdn.com/ts/product/41/62/6f/db0a0c42dad48b3354c901649ff7c279.jpg, https://salt.tikicdn.com/ts/product/43/be/9e/071db7028cc6820b53350eea91a2c167.jpg, https://salt.tikicdn.com/ts/product/e7/07/20/bb29955ed635922365e44c33af85c972.jpg, https://salt.tikicdn.com/ts/product/ef/4e/75/9624701dd0705b1186091133d922b176.jpg, https://salt.tikicdn.com/ts/product/32/aa/29/e13efcd2fae4722cfa09dc074791c465.jpg, https://salt.tikicdn.com/ts/product/32/27/bb/6bc633383d8008edafd0c519a64949ba.jpg","https://salt.tikicdn.com/cache/w1200/ts/product/41/62/6f/db0a0c42dad48b3354c901649ff7c279.jpg, https://salt.tikicdn.com/cache/w1200/ts/product/43/be/9e/071db7028cc6820b53350eea91a2c167.jpg, https://salt.tikicdn.com/cache/w1200/ts/product/e7/07/20/bb29955ed635922365e44c33af85c972.jpg, https://salt.tikicdn.com/cache/w1200/ts/product/ef/4e/75/9624701dd0705b1186091133d922b176.jpg, https://salt.tikicdn.com/cache/w1200/ts/product/32/aa/29/e13efcd2fae4722cfa09dc074791c465.jpg, https://salt.tikicdn.com/cache/w1200/ts/product/32/27/bb/6bc633383d8008edafd0c519a64949ba.jpg","https://salt.tikicdn.com/cache/w300/ts/product/41/62/6f/db0a0c42dad48b3354c901649ff7c279.jpg, https://salt.tikicdn.com/cache/w300/ts/product/43/be/9e/071db7028cc6820b53350eea91a2c167.jpg, https://salt.tikicdn.com/cache/w300/ts/product/e7/07/20/bb29955ed635922365e44c33af85c972.jpg, https://salt.tikicdn.com/cache/w300/ts/product/ef/4e/75/9624701dd0705b1186091133d922b176.jpg, https://salt.tikicdn.com/cache/w300/ts/product/32/aa/29/e13efcd2fae4722cfa09dc074791c465.jpg, https://salt.tikicdn.com/cache/w300/ts/product/32/27/bb/6bc633383d8008edafd0c519a64949ba.jpg","https://salt.tikicdn.com/cache/200x280/ts/product/41/62/6f/db0a0c42dad48b3354c901649ff7c279.jpg, https://salt.tikicdn.com/cache/200x280/ts/product/43/be/9e/071db7028cc6820b53350eea91a2c167.jpg, https://salt.tikicdn.com/cache/200x280/ts/product/e7/07/20/bb29955ed635922365e44c33af85c972.jpg, https://salt.tikicdn.com/cache/200x280/ts/product/ef/4e/75/9624701dd0705b1186091133d922b176.jpg, https://salt.tikicdn.com/cache/200x280/ts/product/32/aa/29/e13efcd2fae4722cfa09dc074791c465.jpg, https://salt.tikicdn.com/cache/200x280/ts/product/32/27/bb/6bc633383d8008edafd0c519a64949ba.jpg","https://salt.tikicdn.com/cache/200x280/ts/product/41/62/6f/db0a0c42dad48b3354c901649ff7c279.jpg, https://salt.tikicdn.com/cache/200x280/ts/product/43/be/9e/071db7028cc6820b53350eea91a2c167.jpg, https://salt.tikicdn.com/cache/200x280/ts/product/e7/07/20/bb29955ed635922365e44c33af85c972.jpg, https://salt.tikicdn.com/cache/200x280/ts/product/ef/4e/75/9624701dd0705b1186091133d922b176.jpg, https://salt.tikicdn.com/cache/200x280/ts/product/32/aa/29/e13efcd2fae4722cfa09dc074791c465.jpg, https://salt.tikicdn.com/cache/200x280/ts/product/32/27/bb/6bc633383d8008edafd0c519a64949ba.jpg",1000,0
