id,name,price,short_description,description,rating_average,review_count,image_base_url,image_large_url,image_medium_url,image_small_url,image_thumbnail_url,stock,quantity_sold
272392345,Sách Combo 2 Cuốn: Không Phải Sói Nhưng Cũng Đừng Là Cừu + Chuyện Tâm Lý Trong Phòng Pháp Lý - Bản Quyền,228500,        Combo 2 Cuốn: Không Phải Sói Nhưng Cũng Đừng Là Cừu + Chuyện Tâm Lý Trong Phòng Pháp Lý  1. Không Phải Sói Nhưng Cũng Đừng Là Cừu  Tác giả: Lê Bảo Ngọc  Thể loại: sách kỹ năng sống  Bìa mề...,"Combo 2 Cuốn: Không Phải Sói Nhưng Cũng Đừng Là Cừu + Chuyện Tâm Lý Trong Phòng Pháp Lý 1. Không Phải Sói Nhưng Cũng Đừng Là Cừu Tác giả: Lê Bảo Ngọc Thể loại: sách kỹ năng sống Bìa mềm NXB Thế Giới Số trang: 296 trang ISBN: 9786043653083 Mã công ty: 8935325006685 Giá bìa: 128.000 VNĐ Ngày phát hành: 08/07/2022 Thông tin quà tặng kèm: bookmark 2 mặt SÓI VÀ CỪU - BẠN KHÔNG TỐT NHƯ BẠN NGHĨ ĐÂU! Làn ranh của việc ngây thơ hay xấu xa đôi khi mỏng manh hơn bạn nghĩ. Bạn làm một việc mà mình cho là đúng, kết quả lại bị mọi người khiển trách. Bạn ủng hộ một quan điểm của ai đó, và số đông khác lại ủng hộ một quan điểm trái chiều. Rốt cuộc thì bạn sai hay họ sai? Cuốn sách “Không phải sói nhưng cũng đừng là cừu” đến từ tác giả Lê Bảo Ngọc sẽ giúp bạn hiểu rõ hơn những khía cạnh sắc sảo phía sau những nhận định đúng, sai đơn thuần của mỗi người. Những câu hỏi đầy tính tranh cãi như “Cứu người hay cứu chó?”, “Một kẻ thô lỗ trong lớp vỏ “thẳng tính” khác với người EQ thấp như thế nào?”, “Vì sao một bộ phận nữ giới lại victim blaming đối với nạn nhân bị xâm hại?”, được tác giả đưa ra trong “Không phải sói nhưng cũng đừng là cừu”. Bằng từng chương sách của mình, tác giả vạch rõ cho bạn rằng “thật sự thế nào mới là người tốt”, ngây thơ và xấu xa có ranh giới rõ ràng như thế không, rốt cuộc bạn có là người tốt như mình vẫn luôn nghĩ? Trong thời đại mà mọi thứ đều rất chóng vánh này, ranh giới giữa tốt và xấu, đúng và sai đôi lúc là không tồn tại. Cái tốt mà chúng ta nghĩ, hóa ra lại là xấu trong mắt kẻ khác. Cái đúng ở thời điểm này, đến một thời điểm khác lại trở thành sai. Tốt đẹp hay xấu xa, thật khó phân định. Cuốn sách “Không phải sói nhưng cũng đừng là cừu” của tác giả Lê Bảo Ngọc - admin Tâm Lý Học Tổ Kén đồng thời là Giám đốc Trung tâm Pháp Luật và Văn hóa sẽ là câu trả lời thấu suốt và khiến bạn phải đặt ra câu hỏi cho lối tư duy bấy lâu bạn luôn nghĩ là đúng. Bạn sẽ là người giải phóng chính mình, khỏi gông xiềng của định kiến, quy chuẩn cũ kĩ vốn được thiết lập lên để mang lại lợi ích cho kẻ khác. Và bạn sẽ không còn phải lăn tăn giữa tốt và xấu, sói hay cừu, vì điều đó là không quan trọng. Bạn sẽ tìm được chính mình và muốn là chính mình sau từng trang sách của “Không phải sói mà cũng đừng là cừu"" Không phải sói, cũng đừng là cừu - Cuốn sách đập tan những định kiến cũ kỹ, kiến tạo tư duy và giúp bạn xây dựng lại chính mình! = = = = = = = 2. Chuyện Tâm Lý Trong Phòng Pháp Lý Tác giả Lê Bảo Ngọc Thể loại Sách kỹ năng sống Nhà xuất bản NXB Thế Giới Giá bìa 128.000 VND Quà tặng kèm Bookmark Mã code 8935325015861 Mã ISBN 9786047773909 Loại bìa Bìa mềm Số trang 304 trang Ngày phát 8/10/2023 AI CŨNG LÀ NẠN NHÂN TRONG CÂU CHUYỆN CỦA CHÍNH MÌNH! • Có thật là “trẻ con không biết gì đâu”, “trẻ em không biết nói dối”? • Tại sao người bị bạo lực gia đình không nhanh chóng rời đi? • Tại sao người bị bắt nạt thường nghĩ đến tự sát thay vì trả thù? • Chuyện gì sẽ xảy đến nếu con người để bản năng động vật lấn át? Cuốn sách đánh dấu sự trở lại của tác giả “Không phải sói nhưng cũng đừng là cừu” - Luật gia Lê Bảo Ngọc. “Chuyện tâm lý trong phòng pháp lý” không phải cuốn sách tâm lý để thỏa mãn cái tôi của bạn. Cuốn sách là hàng trăm chiếc gương với đủ hình dạng méo tròn để bạn tự đặt câu hỏi về thế giới quan của mình và những người xung quanh. Ai cũng là nạn nhân trong câu chuyện của chính mình. Câu chuyện qua lời kể của “người bị hại” có thể không phải là sự thật như chúng ta từng nghĩ! • Chiến thắng ở phiên tòa có thật sự được yên và có cuộc sống hạnh phúc? • Thủ phạm nhiều khi lại chính là kẻ đi kiện nạn nhân… • Những tên tội phạm nhân danh tình yêu đã thao túng nạn nhân như thế nào? Những câu chuyện trong phòng pháp lý được tác giả Lê Bảo Ngọc kể lại ngắn gọn súc tích trong từng trang sách “Chuyện tâm lý trong phòng pháp lý”. Bằng việc thuật lại lời khai từ “nạn nhân” và sự thật cuối cùng, tác giả đã cho chúng ta thấy rõ ràng rằng “ai cũng là nạn nhân trong câu chuyện của chính mình”. Và từ chính những câu chuyện đó, bạn sẽ có thể tự đặt câu hỏi cho bản thân rằng, liệu khi mọi chuyện xảy ra bạn đã thật sự khách quan đánh giá sự việc không, hay bạn lại chính là một “nạn nhân” khác trong câu chuyện của bản thân? “Chuyện tâm lý trong phòng pháp lý” cũng mang tới phân tích tâm lý mà bạn có thể áp dụng vào đời sống hằng ngày của chính mình như cách để quan tâm đúng cách một người, nhận biết các loại người xuất hiện trong cuộc tranh cãi trên mạng xã hội và tâm lý chung của họ, Gooda tin rằng cuốn sách sẽ mang lại kiến thức thật bổ ích cùng những trải nghiệm thật tuyệt vời, hy vọng đây sẽ là 1 cuốn sách quý trên kệ sách của bạn! QUYỀN LỢI KHÁCH HÀNG KHI MUA SÁCH TẠI SHOP GOODA THƯ VIỆN SÁCH QUÝ: 1. Đảm bảo 100% sách gốc bản quyền từ NXB 2. Quy cách đóng gói cẩn thận, trận trọng từng quyển sách 3. Xử lí đơn đặt hàng nhanh 4. Chính sách hỗ trợ đổi sách cho khách hàng thuận tiện khi gặp sự cố Giá sản phẩm trên Tiki đã bao gồm thuế theo luật hiện hành. Bên cạnh đó, tuỳ vào loại sản phẩm, hình thức và địa chỉ giao hàng mà có thể phát sinh thêm chi phí khác như phí vận chuyển, phụ phí hàng cồng kềnh, thuế nhập khẩu (đối với đơn hàng giao từ nước ngoài có giá trị trên 1 triệu đồng).....",0,0,"https://salt.tikicdn.com/ts/product/4c/88/cc/93a031917b4257b0fbe0ffa1290e967f.jpg, https://salt.tikicdn.com/ts/product/ee/08/28/83e32a888519f52a30a86bed298dde46.jpg, https://salt.tikicdn.com/ts/product/ab/d2/9d/6b1e45c3c423d4a67dbf79c02056ea55.jpg","https://salt.tikicdn.com/cache/w1200/ts/product/4c/88/cc/93a031917b4257b0fbe0ffa1290e967f.jpg, https://salt.tikicdn.com/cache/w1200/ts/product/ee/08/28/83e32a888519f52a30a86bed298dde46.jpg, https://salt.tikicdn.com/cache/w1200/ts/product/ab/d2/9d/6b1e45c3c423d4a67dbf79c02056ea55.jpg","https://salt.tikicdn.com/cache/w300/ts/product/4c/88/cc/93a031917b4257b0fbe0ffa1290e967f.jpg, https://salt.tikicdn.com/cache/w300/ts/product/ee/08/28/83e32a888519f52a30a86bed298dde46.jpg, https://salt.tikicdn.com/cache/w300/ts/product/ab/d2/9d/6b1e45c3c423d4a67dbf79c02056ea55.jpg","https://salt.tikicdn.com/cache/200x280/ts/product/4c/88/cc/93a031917b4257b0fbe0ffa1290e967f.jpg, https://salt.tikicdn.com/cache/200x280/ts/product/ee/08/28/83e32a888519f52a30a86bed298dde46.jpg, https://salt.tikicdn.com/cache/200x280/ts/product/ab/d2/9d/6b1e45c3c423d4a67dbf79c02056ea55.jpg","https://salt.tikicdn.com/cache/200x280/ts/product/4c/88/cc/93a031917b4257b0fbe0ffa1290e967f.jpg, https://salt.tikicdn.com/cache/200x280/ts/product/ee/08/28/83e32a888519f52a30a86bed298dde46.jpg, https://salt.tikicdn.com/cache/200x280/ts/product/ab/d2/9d/6b1e45c3c423d4a67dbf79c02056ea55.jpg",1000,0
272048123,Một Cuốn Sách Về Tội Phạm - Các Loại Hình Tội Phạm Dưới Góc Nhìn Tâm Lý Học,113000,    Một Cuốn Sách Về Tội Phạm - Các Loại Hình Tội Phạm Dưới Góc Nhìn Tâm Lý Học      Nhà xuất bản : Nhà Xuất Bản Dân Trí.  Công ty phát hành : Shinebooks.  Tác giả : Jisun Park.  Kích thước :...,"Một Cuốn Sách Về Tội Phạm - Các Loại Hình Tội Phạm Dưới Góc Nhìn Tâm Lý Học Nhà xuất bản : Nhà Xuất Bản Dân Trí. Công ty phát hành : Shinebooks. Tác giả : Jisun Park. Kích thước : 14.5 x 20.5 x 1.5 cm. Số trang : 288. Ngày xuất bản : . Loại bìa : Bìa mềm. Mang tới một trải nghiệm vô cùng ám ảnh, dẫn dắt độc giả đến với những tội ác kinh hoàng và đáng sợ, Một cuốn sách về tội phạm đã đi sâu phân tích các đặc trưng cũng như động cơ gây án của tội phạm dưới góc nhìn tâm lý học, dựa trên những vụ án giết người hàng loạt gây chấn động bậc nhất tại Hàn Quốc, những vụ cưỡng bức tình dục tập thể, những cuộc thảm sát tàn khốc, đầy máu lạnh của kẻ thủ ác… Qua đó, sự thảm khốc của tội ác được thể hiện một cách chân thực, tàn bạo và như một lời cảnh tỉnh về tầm quan trọng của việc tìm ra sự thật, cuốn sách sẽ đem đến lời giải đáp cho câu hỏi rốt cuộc tội ác được sinh ra từ đâu và ai mới thực sự là kẻ gây ra những tội ác khủng khiếp nhất. Giá sản phẩm trên Tiki đã bao gồm thuế theo luật hiện hành. Bên cạnh đó, tuỳ vào loại sản phẩm, hình thức và địa chỉ giao hàng mà có thể phát sinh thêm chi phí khác như phí vận chuyển, phụ phí hàng cồng kềnh, thuế nhập khẩu (đối với đơn hàng giao từ nước ngoài có giá trị trên 1 triệu đồng).....",0,0,https://salt.tikicdn.com/ts/product/c6/7f/82/607d709b11ba5546cfcd6782b10fbad4.jpg,https://salt.tikicdn.com/cache/w1200/ts/product/c6/7f/82/607d709b11ba5546cfcd6782b10fbad4.jpg,https://salt.tikicdn.com/cache/w300/ts/product/c6/7f/82/607d709b11ba5546cfcd6782b10fbad4.jpg,https://salt.tikicdn.com/cache/200x280/ts/product/c6/7f/82/607d709b11ba5546cfcd6782b10fbad4.jpg,https://salt.tikicdn.com/cache/200x280/ts/product/c6/7f/82/607d709b11ba5546cfcd6782b10fbad4.jpg,1000,0
270711658,Tâm Lý Phạm Tội Của Những Kẻ Khốn Cùng,169000,    Tâm Lý Phạm Tội Của Những Kẻ Khốn Cùng      Nhà xuất bản : Nhà Xuất Bản Dân Trí.  Công ty phát hành : 1980 Books.  Tác giả : Peter Suber.  Kích thước : 13 x 19 cm.  Số trang : 280.  Ngà...,"Tâm Lý Phạm Tội Của Những Kẻ Khốn Cùng Nhà xuất bản : Nhà Xuất Bản Dân Trí. Công ty phát hành : 1980 Books. Tác giả : Peter Suber. Kích thước : 13 x 19 cm. Số trang : 280. Ngày xuất bản : . Loại bìa : Bìa mềm. Ranh giới thiện – ác mong manh tới mức nào? Trong cuốn sách Tâm Lý Phạm Tội Của Những Kẻ Khốn Cùng sẽ mang đến câu trả lời vô cùng chân thực từ một ví dụ giả định kinh điển của thế kỷ. Được lấy cảm hứng từ cuốn The case of the Speluncean Explorers (tạm dịch: Vụ án những nhà thám hiểm Speluncean) của tác giả Lon Fuller, được xuất bản lần đầu trên tạp chí Havard Law Review năm 1949. Cuốn sách kể về một vụ án pháp lý hư cấu được coi là vĩ đại nhất mọi thời đại, với những tư tưởng pháp luật hiển hình. Bản thảo gốc được in đầy đủ trong cuốn sách này, nói về năm nhà thám hiểm bị kẹt trong hang động, phải ăn thịt một người bạn đồng hành để có thể sống sót. Sau khi được giải cứu, họ bị truy tố tội danh giết người - một tội danh chắc chắn phải nhận án tử hình. Bản thảo của Fuller đã tạo ra năm vị thẩm phán Tòa án tối cao để đưa ra những tình huống pháp lý khó phân xử trong vụ án. Và trong cuốn sách này, tác giả Peter Suber đã tiếp tục thêm vào chín quan điểm mới hợp thời đại hơn để làm sáng tỏ được nguồn gốc tội ác của những nhà thám hiểm. Thông qua những lập luận được coi là “cuộc chiến pháp lý kinh điển của thế kỷ”, cuốn sách sẽ là câu trả lời thực sự thuyết phục cho câu hỏi “Tội ác sinh ra từ đâu?”. Hấp dẫn, hợp thời và logic là những điều dễ nhận thấy trong cuốn sách tâm lý tội phạm đặc biệt này. Đặc biệt với những góc nhìn pháp lý thuyết phục. Đặc biệt với kết cấu rõ ràng trong từng câu chữ, mang ý nghĩa tranh biện sắc bén và hợp lý. Đặc biệt với sự liên kết tới một vụ án cụ thể và hấp dẫn, được coi là một phương pháp giảng dạy dễ hiểu của nhiều nhánh trong luật học. Với phong cách tươi vui và giản dị của mình, Peter Suber đã khiến cuốn sách trở thành một công cụ vô giá cho ai mới tìm hiểu về những tư tưởng pháp lý đương đại cũng như nghiên cứu về tâm lý của một nhóm tội phạm đặc biệt – những kẻ ở trong hoàn cảnh tột cùng của nỗi thống khổ. Giá sản phẩm trên Tiki đã bao gồm thuế theo luật hiện hành. Bên cạnh đó, tuỳ vào loại sản phẩm, hình thức và địa chỉ giao hàng mà có thể phát sinh thêm chi phí khác như phí vận chuyển, phụ phí hàng cồng kềnh, thuế nhập khẩu (đối với đơn hàng giao từ nước ngoài có giá trị trên 1 triệu đồng).....",0,0,https://salt.tikicdn.com/ts/product/84/1f/d0/600e60aca5be8043001501c5367f801a.jpg,https://salt.tikicdn.com/cache/w1200/ts/product/84/1f/d0/600e60aca5be8043001501c5367f801a.jpg,https://salt.tikicdn.com/cache/w300/ts/product/84/1f/d0/600e60aca5be8043001501c5367f801a.jpg,https://salt.tikicdn.com/cache/200x280/ts/product/84/1f/d0/600e60aca5be8043001501c5367f801a.jpg,https://salt.tikicdn.com/cache/200x280/ts/product/84/1f/d0/600e60aca5be8043001501c5367f801a.jpg,1000,0
270707501,Tâm Lý Học Tội Phạm - Phác Họa Chân Dung Kẻ Phạm Tội,145000,    Tâm Lý Học Tội Phạm - Phác Họa Chân Dung Kẻ Phạm Tội      Nhà xuất bản : Nhà Xuất Bản Thanh Niên.  Công ty phát hành : Bebooks.  Tác giả : Diệp Hồng Vũ.  Kích thước : 16 x 24 cm.  Số tra...,"Tâm Lý Học Tội Phạm - Phác Họa Chân Dung Kẻ Phạm Tội Nhà xuất bản : Nhà Xuất Bản Thanh Niên. Công ty phát hành : Bebooks. Tác giả : Diệp Hồng Vũ. Kích thước : 16 x 24 cm. Số trang : 280. Ngày xuất bản : . Loại bìa : Bìa mềm. TÂM LÝ HỌC TỘI PHẠM - PHÁC HỌA CHÂN DUNG KẺ PHẠM TỘI Tội phạm, nhất là những vụ án mạng, luôn là một chủ đề thu hút sự quan tâm của công chúng, khơi gợi sự hiếu kỳ của bất cứ ai. Một khi đã bắt đầu theo dõi vụ án, hẳn bạn không thể không quan tâm tới kết cục, đặc biệt là cách thức và động cơ của kẻ sát nhân, từ những vụ án phạm vi hẹp cho đến những vụ án làm rúng động cả thế giới. Lấy 36 vụ án CÓ THẬT kinh điển nhất trong hồ sơ tội phạm của FBI, Tâm Lý Học Tội Phạm - Phác Họa Chân Dung Kẻ Phạm Tội mang đến cái nhìn toàn cảnh của các chuyên gia về chân dung tâm lý tội phạm. Trả lời cho câu hỏi: Làm thế nào phân tích được tâm lý và hành vi tội phạm, từ đó khôi phục sự thật thông qua các manh mối, từ hiện trường vụ án, thời gian, dấu tích,… để tìm ra kẻ sát nhân thực sự. Đằng sau máu và nước mắt là các câu chuyện rợn tóc gáy về tội ác, góc khuất xã hội và những màn đấu trí đầy gay cấn giữa điều tra viên và kẻ phạm tội. Trong số đó có những con quỷ ăn thịt người; những cô gái xinh đẹp nhưng xảo quyệt; và cả cách trả thù đầy man rợ của các nhà khoa học,… Một số đã sa vào lưới pháp luật ngay khi chúng vừa ra tay, nhưng cũng có những kẻ cứ vậy ngủ yên hơn hai mươi năm. Bằng giọng văn sắc bén, Tâm Lý Học Tội Phạm - Phác Họa Chân Dung Kẻ Phạm Tội hứa hẹn dẫn dắt người đọc đi qua các cung bậc cảm xúc từ tò mò, ngạc nhiên đến sợ hãi, hoang mang tận cùng. Chúng ta sẽ lần tìm về quá khứ để từng bước gỡ những nút thắt chưa được giải, khiến ta ""ngạt thở"" đọc tới tận trang cuối cùng. Hy vọng cuốn sách sẽ giúp bạn có cái nhìn sâu sắc, rõ ràng hơn về bộ môn tâm lý học tội phạm và có thể rèn luyện thêm sự tư duy, nhạy bén. Giá sản phẩm trên Tiki đã bao gồm thuế theo luật hiện hành. Bên cạnh đó, tuỳ vào loại sản phẩm, hình thức và địa chỉ giao hàng mà có thể phát sinh thêm chi phí khác như phí vận chuyển, phụ phí hàng cồng kềnh, thuế nhập khẩu (đối với đơn hàng giao từ nước ngoài có giá trị trên 1 triệu đồng).....",0,0,https://salt.tikicdn.com/ts/product/27/60/24/94794c8ec8965c8b780f848dde1ef2db.jpg,https://salt.tikicdn.com/cache/w1200/ts/product/27/60/24/94794c8ec8965c8b780f848dde1ef2db.jpg,https://salt.tikicdn.com/cache/w300/ts/product/27/60/24/94794c8ec8965c8b780f848dde1ef2db.jpg,https://salt.tikicdn.com/cache/200x280/ts/product/27/60/24/94794c8ec8965c8b780f848dde1ef2db.jpg,https://salt.tikicdn.com/cache/200x280/ts/product/27/60/24/94794c8ec8965c8b780f848dde1ef2db.jpg,1000,0
270706305,Tâm Lý Học Tội Phạm - Tập 1,149000,    Tâm Lý Học Tội Phạm - Tập 1      Nhà xuất bản : Nhà Xuất Bản ĐH Kinh Tế Quốc Dân.  Công ty phát hành : 1980 Books.  Tác giả : Stanton E. Samenow.  Kích thước : 13 x 20.5 cm.  Số trang : ...,"Tâm Lý Học Tội Phạm - Tập 1 Nhà xuất bản : Nhà Xuất Bản ĐH Kinh Tế Quốc Dân. Công ty phát hành : 1980 Books. Tác giả : Stanton E. Samenow. Kích thước : 13 x 20.5 cm. Số trang : 366. Ngày xuất bản : . Loại bìa : Bìa mềm. Tâm Lý Học Tội Phạm là bộ sách gồm 2 tập đề cập đến quyền lựa chọn, ý chí tự do, cái thiện và cái ác, phản ứng trước cám dỗ và sự thể hiện lòng dũng cảm hay hèn nhát khi đối mặt với nghịch cảnh của con người. Những cuốn sách thiêng liêng của các tôn giáo đều khuyên loài người không nên lừa dối, giận dữ và kiêu ngạo. Chúng ta nghĩ bản thân thế nào thì sẽ là như thế. Chúng ta không thể giúp một người từ bỏ tội ác và sống có trách nhiệm nếu không thể khiến anh ta thay đổi nhân tính, đó chính là ""suy nghĩ"". Ấn bản đầu tiên của cuốn sách Tâm Lý Học Tội Phạm được xuất bản năm 1984, và ấn bản thứ hai xuất bản năm 2004. Sau một thập kỷ, và đã đến lúc bổ sung thêm các thông tin cho cuốn sách này. Trong ấn bản này, bạn sẽ hiểu chi tiết về các quá trình tư duy và chiến thuật phổ biến đối với những kẻ phạm tội, bất kể lý lịch hay tội ác của chúng. Giờ đây, với cái nhìn sâu sắc hơn tác giả Stanton ow đã cung cấp cho độc giả một ấn bản cập nhật hoàn toàn về tác phẩm kinh điển của mình, bao gồm những sự nhận thức mới mẻ về tội ác đang được chú ý ngày nay, từ sự rình rập và bạo lực gia đình đến tội phạm cổ cồn và chính trị khủng bố. Ông đã từng có ba thập kỷ làm việc với tội phạm khẳng định lại lập luận của mình rằng các yếu tố như nghèo đói, ly hôn và bạo lực trên phương tiện truyền thông không gây ra tội phạm. Đúng hơn, như các tài liệu của Samenow ở đây, tất cả tội phạm đều có chung một suy nghĩ đặc biệt - thường thấy rõ trong thời thơ ấu - khác hẳn với suy nghĩ của một công dân có trách nhiệm. Trong khi các loại tội phạm mới ngày càng phổ biến hơn, hoặc ít nhất là dễ nhìn thấy hơn với công chúng - từ lạm dụng vợ chồng đến các vụ xả súng ở trường học - có rất ít thay đổi về cách tiếp cận của chúng ta đối với tội phạm. Các chương trình phục hồi dựa trên giả định rằng xã hội đổ lỗi cho tội phạm nhiều hơn là tội phạm, một giả định mà mối liên hệ nhân quả vẫn chưa được thiết lập, đã được chứng minh là không đầy đủ. Tội phạm tiếp tục xâm chiếm mọi khía cạnh của cuộc sống chúng ta, các tòa án hình sự và nhà tù luôn quá tải, và tỷ lệ tái phạm tiếp tục leo thang. Tiến sĩ Samenow, một nhà tâm lý học lâm sàng đã bác bỏ một cách hợp pháp những lời giải thích về hành vi tội phạm đổ lỗi cho hoàn cảnh, môi trường (xã hội, gia đình, truyền hình bạo lực,). Ông thường xuyên đưa ra những lời khái quát sâu rộng và không cung cấp gì khác ngoài những trường hợp có thật ủng hộ quan điểm của ông rằng tất cả tội phạm đều vi phạm pháp luật một cách có ý thức và cố ý. Hiểu biết thông thường về nguyên nhân phạm tội hiện vẫn là kim chỉ nam cho nhiều người vạch ra các chính sách phòng chống tội phạm. Các nhà hoạch định chính sách lãng phí hàng tỷ đô la khi họ ngây thơ tìm cách chống lại hành vi tội phạm bằng cách loại bỏ cái gọi là “nguyên nhân gốc rễ” về môi trường xung quanh. Điều quan trọng là chúng ta phải biết kẻ phạm tội là ai và làm thế nào và tại sao hắn lại hành động khác với những công dân có trách nhiệm. Từ sự hiểu biết đó có thể đưa ra những giải pháp hợp lý, nhân ái và hiệu quả. Giá sản phẩm trên Tiki đã bao gồm thuế theo luật hiện hành. Bên cạnh đó, tuỳ vào loại sản phẩm, hình thức và địa chỉ giao hàng mà có thể phát sinh thêm chi phí khác như phí vận chuyển, phụ phí hàng cồng kềnh, thuế nhập khẩu (đối với đơn hàng giao từ nước ngoài có giá trị trên 1 triệu đồng).....",0,0,https://salt.tikicdn.com/ts/product/b7/70/1b/74b631d29e0a553ad0e1bbb93b5b3747.jpg,https://salt.tikicdn.com/cache/w1200/ts/product/b7/70/1b/74b631d29e0a553ad0e1bbb93b5b3747.jpg,https://salt.tikicdn.com/cache/w300/ts/product/b7/70/1b/74b631d29e0a553ad0e1bbb93b5b3747.jpg,https://salt.tikicdn.com/cache/200x280/ts/product/b7/70/1b/74b631d29e0a553ad0e1bbb93b5b3747.jpg,https://salt.tikicdn.com/cache/200x280/ts/product/b7/70/1b/74b631d29e0a553ad0e1bbb93b5b3747.jpg,1000,0
