id,name,price,short_description,description,rating_average,review_count,image_base_url,image_large_url,image_medium_url,image_small_url,image_thumbnail_url,stock,quantity_sold
275325383,Kỳ thi năng lực Nhật ngữ: Point & Practice N3 - Đọc hiểu (NXB Trẻ),76500,    Giáo trình này là tập hợp những dạng đề giúp người thi có đủ năng lực tối thiểu cần thiết cho cuộc thi trong thời gian ngắn và tiến gần đến việc thi đậu. Mục tiêu nhắm đến là giúp người học trả...,"Giáo trình này là tập hợp những dạng đề giúp người thi có đủ năng lực tối thiểu cần thiết cho cuộc thi trong thời gian ngắn và tiến gần đến việc thi đậu. Mục tiêu nhắm đến là giúp người học trả lời được những câu hỏi về các đề mục học tập được tuyển chọn kỹ càng, qua đó hiểu sâu hơn về kiến thức đã học, nâng cao năng lực bản thân. Đặc điểm của quyển sách này 1. Được luyện các dạng đề có hình thức giống với kỳ thi thực tế. 2. Học cách thu hẹp mục đích từng bài đọc để tìm ra đáp án. 3. Tự học hiệu quả với Sơ đồ giải thích và bản dịch trong Quyển phụ. Giá sản phẩm trên Tiki đã bao gồm thuế theo luật hiện hành. Bên cạnh đó, tuỳ vào loại sản phẩm, hình thức và địa chỉ giao hàng mà có thể phát sinh thêm chi phí khác như phí vận chuyển, phụ phí hàng cồng kềnh, thuế nhập khẩu (đối với đơn hàng giao từ nước ngoài có giá trị trên 1 triệu đồng) Giá sản phẩm trên Tiki đã bao gồm thuế theo luật hiện hành. Bên cạnh đó, tuỳ vào loại sản phẩm, hình thức và địa chỉ giao hàng mà có thể phát sinh thêm chi phí khác như phí vận chuyển, phụ phí hàng cồng kềnh, thuế nhập khẩu (đối với đơn hàng giao từ nước ngoài có giá trị trên 1 triệu đồng).....",0,0,"https://salt.tikicdn.com/ts/product/bc/96/b5/1f3b5a3eba61cbe91a08322d5e21c093.jpg, https://salt.tikicdn.com/ts/product/01/c9/08/6c15d2c15531d50a8ef00249508fa3eb.jpg, https://salt.tikicdn.com/ts/product/30/a7/b1/ce867b97e7d5ef14db93128d7b910544.jpg, https://salt.tikicdn.com/ts/product/37/13/af/de0859eae292b0ac083088907451ff47.jpg, https://salt.tikicdn.com/ts/product/7c/cb/7f/bcd453d413ed7ca52a5cc39f48e9f445.jpg, https://salt.tikicdn.com/ts/product/83/19/38/71c744f142cdb9e082d5c91685a79c90.jpg, https://salt.tikicdn.com/ts/product/de/a0/7a/27a5b02a917cf9298b3b72a56ec0d58b.jpg, https://salt.tikicdn.com/ts/product/fe/79/6b/0739fbb1ab08cb1d3c76f6b2ca4156ee.jpg","https://salt.tikicdn.com/cache/w1200/ts/product/bc/96/b5/1f3b5a3eba61cbe91a08322d5e21c093.jpg, https://salt.tikicdn.com/cache/w1200/ts/product/01/c9/08/6c15d2c15531d50a8ef00249508fa3eb.jpg, https://salt.tikicdn.com/cache/w1200/ts/product/30/a7/b1/ce867b97e7d5ef14db93128d7b910544.jpg, https://salt.tikicdn.com/cache/w1200/ts/product/37/13/af/de0859eae292b0ac083088907451ff47.jpg, https://salt.tikicdn.com/cache/w1200/ts/product/7c/cb/7f/bcd453d413ed7ca52a5cc39f48e9f445.jpg, https://salt.tikicdn.com/cache/w1200/ts/product/83/19/38/71c744f142cdb9e082d5c91685a79c90.jpg, https://salt.tikicdn.com/cache/w1200/ts/product/de/a0/7a/27a5b02a917cf9298b3b72a56ec0d58b.jpg, https://salt.tikicdn.com/cache/w1200/ts/product/fe/79/6b/0739fbb1ab08cb1d3c76f6b2ca4156ee.jpg","https://salt.tikicdn.com/cache/w300/ts/product/bc/96/b5/1f3b5a3eba61cbe91a08322d5e21c093.jpg, https://salt.tikicdn.com/cache/w300/ts/product/01/c9/08/6c15d2c15531d50a8ef00249508fa3eb.jpg, https://salt.tikicdn.com/cache/w300/ts/product/30/a7/b1/ce867b97e7d5ef14db93128d7b910544.jpg, https://salt.tikicdn.com/cache/w300/ts/product/37/13/af/de0859eae292b0ac083088907451ff47.jpg, https://salt.tikicdn.com/cache/w300/ts/product/7c/cb/7f/bcd453d413ed7ca52a5cc39f48e9f445.jpg, https://salt.tikicdn.com/cache/w300/ts/product/83/19/38/71c744f142cdb9e082d5c91685a79c90.jpg, https://salt.tikicdn.com/cache/w300/ts/product/de/a0/7a/27a5b02a917cf9298b3b72a56ec0d58b.jpg, https://salt.tikicdn.com/cache/w300/ts/product/fe/79/6b/0739fbb1ab08cb1d3c76f6b2ca4156ee.jpg","https://salt.tikicdn.com/cache/200x280/ts/product/bc/96/b5/1f3b5a3eba61cbe91a08322d5e21c093.jpg, https://salt.tikicdn.com/cache/200x280/ts/product/01/c9/08/6c15d2c15531d50a8ef00249508fa3eb.jpg, https://salt.tikicdn.com/cache/200x280/ts/product/30/a7/b1/ce867b97e7d5ef14db93128d7b910544.jpg, https://salt.tikicdn.com/cache/200x280/ts/product/37/13/af/de0859eae292b0ac083088907451ff47.jpg, https://salt.tikicdn.com/cache/200x280/ts/product/7c/cb/7f/bcd453d413ed7ca52a5cc39f48e9f445.jpg, https://salt.tikicdn.com/cache/200x280/ts/product/83/19/38/71c744f142cdb9e082d5c91685a79c90.jpg, https://salt.tikicdn.com/cache/200x280/ts/product/de/a0/7a/27a5b02a917cf9298b3b72a56ec0d58b.jpg, https://salt.tikicdn.com/cache/200x280/ts/product/fe/79/6b/0739fbb1ab08cb1d3c76f6b2ca4156ee.jpg","https://salt.tikicdn.com/cache/200x280/ts/product/bc/96/b5/1f3b5a3eba61cbe91a08322d5e21c093.jpg, https://salt.tikicdn.com/cache/200x280/ts/product/01/c9/08/6c15d2c15531d50a8ef00249508fa3eb.jpg, https://salt.tikicdn.com/cache/200x280/ts/product/30/a7/b1/ce867b97e7d5ef14db93128d7b910544.jpg, https://salt.tikicdn.com/cache/200x280/ts/product/37/13/af/de0859eae292b0ac083088907451ff47.jpg, https://salt.tikicdn.com/cache/200x280/ts/product/7c/cb/7f/bcd453d413ed7ca52a5cc39f48e9f445.jpg, https://salt.tikicdn.com/cache/200x280/ts/product/83/19/38/71c744f142cdb9e082d5c91685a79c90.jpg, https://salt.tikicdn.com/cache/200x280/ts/product/de/a0/7a/27a5b02a917cf9298b3b72a56ec0d58b.jpg, https://salt.tikicdn.com/cache/200x280/ts/product/fe/79/6b/0739fbb1ab08cb1d3c76f6b2ca4156ee.jpg",1000,0
275237002,Sách - Kỳ thi năng lực Nhật ngữ: Point & Practice N3 - Chữ viết Từ vựng -NXB Trẻ,90000,    Giáo trình này là tập hợp những dạng đề giúp người thi có đủ năng lực tối thiểu cần thiết cho cuộc thi trong thời gian ngắn và tiến gần đến việc thi đậu. Mục tiêu nhắm đến là giúp người học trả...,"Giáo trình này là tập hợp những dạng đề giúp người thi có đủ năng lực tối thiểu cần thiết cho cuộc thi trong thời gian ngắn và tiến gần đến việc thi đậu. Mục tiêu nhắm đến là giúp người học trả lời được những câu hỏi về các đề mục học tập được tuyển chọn kỹ càng, qua đó hiểu sâu hơn về kiến thức đã học, nâng cao năng lực bản thân. Đặc điểm của quyển sách này 1. Tuyển chọn kỹ lưỡng các từ vựng quan trọng nhất. 2. Có thể học chung Từ vựng và Hán tự một cách hiệu quả. 3. Tự học hiệu quả phần giải thích. Giá sản phẩm trên Tiki đã bao gồm thuế theo luật hiện hành. Bên cạnh đó, tuỳ vào loại sản phẩm, hình thức và địa chỉ giao hàng mà có thể phát sinh thêm chi phí khác như phí vận chuyển, phụ phí hàng cồng kềnh, thuế nhập khẩu (đối với đơn hàng giao từ nước ngoài có giá trị trên 1 triệu đồng) Giá sản phẩm trên Tiki đã bao gồm thuế theo luật hiện hành. Bên cạnh đó, tuỳ vào loại sản phẩm, hình thức và địa chỉ giao hàng mà có thể phát sinh thêm chi phí khác như phí vận chuyển, phụ phí hàng cồng kềnh, thuế nhập khẩu (đối với đơn hàng giao từ nước ngoài có giá trị trên 1 triệu đồng).....",0,0,"https://salt.tikicdn.com/ts/product/06/c4/dd/44671ef21d750a8575e1a841363b0b21.jpg, https://salt.tikicdn.com/ts/product/02/c0/19/279d1756749c1c2094405b06b0f60709.jpg, https://salt.tikicdn.com/ts/product/45/14/c9/47ec10d78e36bec90977e714898dcdca.jpg, https://salt.tikicdn.com/ts/product/48/94/8d/57de80327c490d2c48c36a2ed0f21e38.jpg, https://salt.tikicdn.com/ts/product/7c/cb/7f/a7c0fa19991add8614b297824cdd1b3b.jpg, https://salt.tikicdn.com/ts/product/83/19/38/a13037eb889ef4c1a7457674447efbb9.jpg, https://salt.tikicdn.com/ts/product/de/a0/7a/d2537c536937ceaeb5ad2373fe7c2762.jpg, https://salt.tikicdn.com/ts/product/fe/79/6b/cb22635ef41a179e462af9e2cf182703.jpg","https://salt.tikicdn.com/cache/w1200/ts/product/06/c4/dd/44671ef21d750a8575e1a841363b0b21.jpg, https://salt.tikicdn.com/cache/w1200/ts/product/02/c0/19/279d1756749c1c2094405b06b0f60709.jpg, https://salt.tikicdn.com/cache/w1200/ts/product/45/14/c9/47ec10d78e36bec90977e714898dcdca.jpg, https://salt.tikicdn.com/cache/w1200/ts/product/48/94/8d/57de80327c490d2c48c36a2ed0f21e38.jpg, https://salt.tikicdn.com/cache/w1200/ts/product/7c/cb/7f/a7c0fa19991add8614b297824cdd1b3b.jpg, https://salt.tikicdn.com/cache/w1200/ts/product/83/19/38/a13037eb889ef4c1a7457674447efbb9.jpg, https://salt.tikicdn.com/cache/w1200/ts/product/de/a0/7a/d2537c536937ceaeb5ad2373fe7c2762.jpg, https://salt.tikicdn.com/cache/w1200/ts/product/fe/79/6b/cb22635ef41a179e462af9e2cf182703.jpg","https://salt.tikicdn.com/cache/w300/ts/product/06/c4/dd/44671ef21d750a8575e1a841363b0b21.jpg, https://salt.tikicdn.com/cache/w300/ts/product/02/c0/19/279d1756749c1c2094405b06b0f60709.jpg, https://salt.tikicdn.com/cache/w300/ts/product/45/14/c9/47ec10d78e36bec90977e714898dcdca.jpg, https://salt.tikicdn.com/cache/w300/ts/product/48/94/8d/57de80327c490d2c48c36a2ed0f21e38.jpg, https://salt.tikicdn.com/cache/w300/ts/product/7c/cb/7f/a7c0fa19991add8614b297824cdd1b3b.jpg, https://salt.tikicdn.com/cache/w300/ts/product/83/19/38/a13037eb889ef4c1a7457674447efbb9.jpg, https://salt.tikicdn.com/cache/w300/ts/product/de/a0/7a/d2537c536937ceaeb5ad2373fe7c2762.jpg, https://salt.tikicdn.com/cache/w300/ts/product/fe/79/6b/cb22635ef41a179e462af9e2cf182703.jpg","https://salt.tikicdn.com/cache/200x280/ts/product/06/c4/dd/44671ef21d750a8575e1a841363b0b21.jpg, https://salt.tikicdn.com/cache/200x280/ts/product/02/c0/19/279d1756749c1c2094405b06b0f60709.jpg, https://salt.tikicdn.com/cache/200x280/ts/product/45/14/c9/47ec10d78e36bec90977e714898dcdca.jpg, https://salt.tikicdn.com/cache/200x280/ts/product/48/94/8d/57de80327c490d2c48c36a2ed0f21e38.jpg, https://salt.tikicdn.com/cache/200x280/ts/product/7c/cb/7f/a7c0fa19991add8614b297824cdd1b3b.jpg, https://salt.tikicdn.com/cache/200x280/ts/product/83/19/38/a13037eb889ef4c1a7457674447efbb9.jpg, https://salt.tikicdn.com/cache/200x280/ts/product/de/a0/7a/d2537c536937ceaeb5ad2373fe7c2762.jpg, https://salt.tikicdn.com/cache/200x280/ts/product/fe/79/6b/cb22635ef41a179e462af9e2cf182703.jpg","https://salt.tikicdn.com/cache/200x280/ts/product/06/c4/dd/44671ef21d750a8575e1a841363b0b21.jpg, https://salt.tikicdn.com/cache/200x280/ts/product/02/c0/19/279d1756749c1c2094405b06b0f60709.jpg, https://salt.tikicdn.com/cache/200x280/ts/product/45/14/c9/47ec10d78e36bec90977e714898dcdca.jpg, https://salt.tikicdn.com/cache/200x280/ts/product/48/94/8d/57de80327c490d2c48c36a2ed0f21e38.jpg, https://salt.tikicdn.com/cache/200x280/ts/product/7c/cb/7f/a7c0fa19991add8614b297824cdd1b3b.jpg, https://salt.tikicdn.com/cache/200x280/ts/product/83/19/38/a13037eb889ef4c1a7457674447efbb9.jpg, https://salt.tikicdn.com/cache/200x280/ts/product/de/a0/7a/d2537c536937ceaeb5ad2373fe7c2762.jpg, https://salt.tikicdn.com/cache/200x280/ts/product/fe/79/6b/cb22635ef41a179e462af9e2cf182703.jpg",1000,0
275236675,"Combo Luyện Thi Năng Lực Nhật Ngữ N3 : Ngữ Pháp, Từ Vựng, Hán Tự, Đọc Hiểu, Nghe Hiểu Kèm File MP3 ( Tặng Kèm Viết )",315000,"    Combo Luyện Thi Năng Lực Nhật Ngữ N3 : Ngữ Pháp, Từ Vựng, Hán Tự, Đọc Hiểu, Nghe Hiểu Kèm CD ( Tặng Kèm Viết )   Bản đặc biệt tặng kèm viết BTS, mẫu ngẫu nhiên và số lượng có hạn.       Luyệ...","Combo Luyện Thi Năng Lực Nhật Ngữ N3 : Ngữ Pháp, Từ Vựng, Hán Tự, Đọc Hiểu, Nghe Hiểu Kèm CD ( Tặng Kèm Viết ) Bản đặc biệt tặng kèm viết BTS, mẫu ngẫu nhiên và số lượng có hạn. Luyện Thi Năng Lực Nhật Ngữ N3 Năng lực Nhật ngữ N3 là chứng chỉ tiếng Nhật cơ bản nhất mà các công ty Nhật và phần lớn các trường Đại học của Nhật Bản đều yêu cầu. Có nghĩa là nếu bạn có chứng chỉ năng lực Nhật ngữ N3 thì bạn sẽ có cơ hội vào làm việc trong các công ty Nhật hoặc qua Nhật du học. Bộ sách Nihongo somatome N3 này được xuất bản nhằm giúp bạn có được những kiến thức cần thiết một cách nhanh chóng, hiệu quả và hoàn thành tốt kỳ thi năng lực Nhật ngữ N3. Bộ sách này có 5 quyển: Hán tự (Kanji) , Từ vựng (Goi) , Đọc hiểu (Dokkai) , Nghe hiểu (Choukai) và Ngữ pháp (Bunpou ), do Nhà xuất bản ASK xuất bản và là một trong số các tựa sách học tiếng Nhật hàng đầu trong hệ thống phân phối sách Kinokuniya lớn nhất Nhật Bản. Hi vọng bộ sách sẽ giúp các bạn chuẩn bị tham gia kỳ thi năng lực Nhật ngữ JLPT nắm được những nội dung kiến thức cần phải có trong năng lực Nhật ngữ N3 một cách nhanh chóng, hiệu quả và tổng quát nhất trong khoảng thời gian từ 4 đến 6 tuần. Giá sản phẩm trên Tiki đã bao gồm thuế theo luật hiện hành. Bên cạnh đó, tuỳ vào loại sản phẩm, hình thức và địa chỉ giao hàng mà có thể phát sinh thêm chi phí khác như phí vận chuyển, phụ phí hàng cồng kềnh, thuế nhập khẩu (đối với đơn hàng giao từ nước ngoài có giá trị trên 1 triệu đồng) Giá sản phẩm trên Tiki đã bao gồm thuế theo luật hiện hành. Bên cạnh đó, tuỳ vào loại sản phẩm, hình thức và địa chỉ giao hàng mà có thể phát sinh thêm chi phí khác như phí vận chuyển, phụ phí hàng cồng kềnh, thuế nhập khẩu (đối với đơn hàng giao từ nước ngoài có giá trị trên 1 triệu đồng).....",0,0,"https://salt.tikicdn.com/ts/product/1e/d6/a7/ba6e318f5ca47adee18f16f613f2ccdd.jpg, https://salt.tikicdn.com/ts/product/52/f1/55/ef998a61531b78473439496ecfc84990.jpg, https://salt.tikicdn.com/ts/product/57/ca/44/a180f08d8fd7386cd7556f7781d09bc1.jpg, https://salt.tikicdn.com/ts/product/58/20/0b/8751e09537d7064ec65e6e9e0fd927f0.jpg, https://salt.tikicdn.com/ts/product/7c/14/c1/3acce5f3edc75988adab41e53e3183fc.jpg, https://salt.tikicdn.com/ts/product/99/03/89/4d8bba95201adbe8f245d63ca9887f72.jpg, https://salt.tikicdn.com/ts/product/9d/51/cd/0c1ee3d471c2292b22874659f4c46a4a.jpg, https://salt.tikicdn.com/ts/product/b5/8f/85/ac782e42629353ea81bf7ab1b9200dc7.jpg, https://salt.tikicdn.com/ts/product/ee/87/95/552a992684e4058a0e8c650d0e84af7b.jpg","https://salt.tikicdn.com/cache/w1200/ts/product/1e/d6/a7/ba6e318f5ca47adee18f16f613f2ccdd.jpg, https://salt.tikicdn.com/cache/w1200/ts/product/52/f1/55/ef998a61531b78473439496ecfc84990.jpg, https://salt.tikicdn.com/cache/w1200/ts/product/57/ca/44/a180f08d8fd7386cd7556f7781d09bc1.jpg, https://salt.tikicdn.com/cache/w1200/ts/product/58/20/0b/8751e09537d7064ec65e6e9e0fd927f0.jpg, https://salt.tikicdn.com/cache/w1200/ts/product/7c/14/c1/3acce5f3edc75988adab41e53e3183fc.jpg, https://salt.tikicdn.com/cache/w1200/ts/product/99/03/89/4d8bba95201adbe8f245d63ca9887f72.jpg, https://salt.tikicdn.com/cache/w1200/ts/product/9d/51/cd/0c1ee3d471c2292b22874659f4c46a4a.jpg, https://salt.tikicdn.com/cache/w1200/ts/product/b5/8f/85/ac782e42629353ea81bf7ab1b9200dc7.jpg, https://salt.tikicdn.com/cache/w1200/ts/product/ee/87/95/552a992684e4058a0e8c650d0e84af7b.jpg","https://salt.tikicdn.com/cache/w300/ts/product/1e/d6/a7/ba6e318f5ca47adee18f16f613f2ccdd.jpg, https://salt.tikicdn.com/cache/w300/ts/product/52/f1/55/ef998a61531b78473439496ecfc84990.jpg, https://salt.tikicdn.com/cache/w300/ts/product/57/ca/44/a180f08d8fd7386cd7556f7781d09bc1.jpg, https://salt.tikicdn.com/cache/w300/ts/product/58/20/0b/8751e09537d7064ec65e6e9e0fd927f0.jpg, https://salt.tikicdn.com/cache/w300/ts/product/7c/14/c1/3acce5f3edc75988adab41e53e3183fc.jpg, https://salt.tikicdn.com/cache/w300/ts/product/99/03/89/4d8bba95201adbe8f245d63ca9887f72.jpg, https://salt.tikicdn.com/cache/w300/ts/product/9d/51/cd/0c1ee3d471c2292b22874659f4c46a4a.jpg, https://salt.tikicdn.com/cache/w300/ts/product/b5/8f/85/ac782e42629353ea81bf7ab1b9200dc7.jpg, https://salt.tikicdn.com/cache/w300/ts/product/ee/87/95/552a992684e4058a0e8c650d0e84af7b.jpg","https://salt.tikicdn.com/cache/200x280/ts/product/1e/d6/a7/ba6e318f5ca47adee18f16f613f2ccdd.jpg, https://salt.tikicdn.com/cache/200x280/ts/product/52/f1/55/ef998a61531b78473439496ecfc84990.jpg, https://salt.tikicdn.com/cache/200x280/ts/product/57/ca/44/a180f08d8fd7386cd7556f7781d09bc1.jpg, https://salt.tikicdn.com/cache/200x280/ts/product/58/20/0b/8751e09537d7064ec65e6e9e0fd927f0.jpg, https://salt.tikicdn.com/cache/200x280/ts/product/7c/14/c1/3acce5f3edc75988adab41e53e3183fc.jpg, https://salt.tikicdn.com/cache/200x280/ts/product/99/03/89/4d8bba95201adbe8f245d63ca9887f72.jpg, https://salt.tikicdn.com/cache/200x280/ts/product/9d/51/cd/0c1ee3d471c2292b22874659f4c46a4a.jpg, https://salt.tikicdn.com/cache/200x280/ts/product/b5/8f/85/ac782e42629353ea81bf7ab1b9200dc7.jpg, https://salt.tikicdn.com/cache/200x280/ts/product/ee/87/95/552a992684e4058a0e8c650d0e84af7b.jpg","https://salt.tikicdn.com/cache/200x280/ts/product/1e/d6/a7/ba6e318f5ca47adee18f16f613f2ccdd.jpg, https://salt.tikicdn.com/cache/200x280/ts/product/52/f1/55/ef998a61531b78473439496ecfc84990.jpg, https://salt.tikicdn.com/cache/200x280/ts/product/57/ca/44/a180f08d8fd7386cd7556f7781d09bc1.jpg, https://salt.tikicdn.com/cache/200x280/ts/product/58/20/0b/8751e09537d7064ec65e6e9e0fd927f0.jpg, https://salt.tikicdn.com/cache/200x280/ts/product/7c/14/c1/3acce5f3edc75988adab41e53e3183fc.jpg, https://salt.tikicdn.com/cache/200x280/ts/product/99/03/89/4d8bba95201adbe8f245d63ca9887f72.jpg, https://salt.tikicdn.com/cache/200x280/ts/product/9d/51/cd/0c1ee3d471c2292b22874659f4c46a4a.jpg, https://salt.tikicdn.com/cache/200x280/ts/product/b5/8f/85/ac782e42629353ea81bf7ab1b9200dc7.jpg, https://salt.tikicdn.com/cache/200x280/ts/product/ee/87/95/552a992684e4058a0e8c650d0e84af7b.jpg",1000,0
275066543,Kỳ Thi Năng Lực Nhật Ngữ - JLPT N3 Point & Practice - Ngữ Pháp,104000,"Mã hàng8934974201724Tên Nhà Cung CấpNXB TrẻTác giảSaito Akiko, Tagawa Mao, Morita Ryoko, Koyano MihoNXBTrẻNăm XB2024Trọng lượng (gr)200Kích Thước Bao Bì26 x 19 x 0.9 cm...","Mã hàng 8934974201724 Tên Nhà Cung Cấp NXB Trẻ Tác giả Saito Akiko, Tagawa Mao, Morita Ryoko, Koyano Miho NXB Trẻ Năm XB 2024 Trọng lượng (gr) 200 Kích Thước Bao Bì 26 x 19 x 0.9 cm Số trang 187 Hình thức Bìa Mềm Kỳ Thi Năng Lực Nhật Ngữ - JLPT N3 Point & Practice - Ngữ Pháp Giáo trình này là tập hợp những dạng đề giúp người thi có đủ năng lực tối thiểu cần thiết cho cuộc thi trong thời gian ngắn và tiến gần đến việc thi đậu. Mục tiêu nhắm đến là giúp người học trả lời được những câu hỏi về các đề mục học tập được tuyển chọn kỹ càng, qua đó hiểu sâu hơn về kiến thức đã học, nâng cao năng lực bản thân. Đặc điểm của quyển sách này 1. Được luyện tập các dạng đề có hình thức giống với Kỳ thi năng lực Nhật ngữ thực tế. 2. Có thể tự học với phần Danh mục tóm tắt quy tắc và cách sử dụng các điểm ngữ pháp. 3. Có thể biết cách sử dụng điểm ngữ pháp gì trong ngữ cảnh nào thông qua các ví dụ và đoạn hội thoại. Giá sản phẩm trên Tiki đã bao gồm thuế theo luật hiện hành. Bên cạnh đó, tuỳ vào loại sản phẩm, hình thức và địa chỉ giao hàng mà có thể phát sinh thêm chi phí khác như phí vận chuyển, phụ phí hàng cồng kềnh, thuế nhập khẩu (đối với đơn hàng giao từ nước ngoài có giá trị trên 1 triệu đồng).....",0,0,"https://salt.tikicdn.com/ts/product/f5/f5/16/c9a3e6f5f31f0d42fd04f98baea3e7db.jpg, https://salt.tikicdn.com/ts/product/66/3d/a5/0fe925522b7d6a341b55bf1430ff47a0.jpg, https://salt.tikicdn.com/ts/product/ce/cf/96/1bd9edc93dc66bf8919174a103194436.jpg","https://salt.tikicdn.com/cache/w1200/ts/product/f5/f5/16/c9a3e6f5f31f0d42fd04f98baea3e7db.jpg, https://salt.tikicdn.com/cache/w1200/ts/product/66/3d/a5/0fe925522b7d6a341b55bf1430ff47a0.jpg, https://salt.tikicdn.com/cache/w1200/ts/product/ce/cf/96/1bd9edc93dc66bf8919174a103194436.jpg","https://salt.tikicdn.com/cache/w300/ts/product/f5/f5/16/c9a3e6f5f31f0d42fd04f98baea3e7db.jpg, https://salt.tikicdn.com/cache/w300/ts/product/66/3d/a5/0fe925522b7d6a341b55bf1430ff47a0.jpg, https://salt.tikicdn.com/cache/w300/ts/product/ce/cf/96/1bd9edc93dc66bf8919174a103194436.jpg","https://salt.tikicdn.com/cache/200x280/ts/product/f5/f5/16/c9a3e6f5f31f0d42fd04f98baea3e7db.jpg, https://salt.tikicdn.com/cache/200x280/ts/product/66/3d/a5/0fe925522b7d6a341b55bf1430ff47a0.jpg, https://salt.tikicdn.com/cache/200x280/ts/product/ce/cf/96/1bd9edc93dc66bf8919174a103194436.jpg","https://salt.tikicdn.com/cache/200x280/ts/product/f5/f5/16/c9a3e6f5f31f0d42fd04f98baea3e7db.jpg, https://salt.tikicdn.com/cache/200x280/ts/product/66/3d/a5/0fe925522b7d6a341b55bf1430ff47a0.jpg, https://salt.tikicdn.com/cache/200x280/ts/product/ce/cf/96/1bd9edc93dc66bf8919174a103194436.jpg",1000,0
275066175,Kỳ Thi Năng Lực Nhật Ngữ - JLPT N3 Point & Practice - Đọc Hiểu,77000,"Mã hàng8934974201717Tên Nhà Cung CấpNXB TrẻTác giảKumada Michiko, Fukuoka Rieko, Shimizu TomokoNXBTrẻNăm XB2024Trọng lượng (gr)140Kích Thước Bao Bì26 x 19 x 0.6 cmSố ...","Mã hàng 8934974201717 Tên Nhà Cung Cấp NXB Trẻ Tác giả Kumada Michiko, Fukuoka Rieko, Shimizu Tomoko NXB Trẻ Năm XB 2024 Trọng lượng (gr) 140 Kích Thước Bao Bì 26 x 19 x 0.6 cm Số trang 128 Hình thức Bìa Mềm Kỳ Thi Năng Lực Nhật Ngữ - JLPT N3 Point & Practice - Đọc Hiểu Giáo trình này là tập hợp những dạng đề giúp người thi có đủ năng lực tối thiểu cần thiết cho cuộc thi trong thời gian ngắn và tiến gần đến việc thi đậu. Mục tiêu nhắm đến là giúp người học trả lời được những câu hỏi về các đề mục học tập được tuyển chọn kỹ càng, qua đó hiểu sâu hơn về kiến thức đã học, nâng cao năng lực bản thân. Đặc điểm của quyển sách này 1. Được luyện các dạng đề có hình thức giống với kỳ thi thực tế. 2. Học cách thu hẹp mục đích từng bài đọc để tìm ra đáp án. 3. Tự học hiệu quả với Sơ đồ giải thích và bản dịch trong Quyển phụ. Giá sản phẩm trên Tiki đã bao gồm thuế theo luật hiện hành. Bên cạnh đó, tuỳ vào loại sản phẩm, hình thức và địa chỉ giao hàng mà có thể phát sinh thêm chi phí khác như phí vận chuyển, phụ phí hàng cồng kềnh, thuế nhập khẩu (đối với đơn hàng giao từ nước ngoài có giá trị trên 1 triệu đồng).....",0,0,"https://salt.tikicdn.com/ts/product/e4/2c/bf/02a439ae6b1eab59f091337e5a181c1c.jpg, https://salt.tikicdn.com/ts/product/74/64/1c/5deacb5974ebb45fa1259cff479ce9fc.jpg, https://salt.tikicdn.com/ts/product/aa/a2/f4/74289dfb21a5d905c633ac6b7f6e12a5.jpg","https://salt.tikicdn.com/cache/w1200/ts/product/e4/2c/bf/02a439ae6b1eab59f091337e5a181c1c.jpg, https://salt.tikicdn.com/cache/w1200/ts/product/74/64/1c/5deacb5974ebb45fa1259cff479ce9fc.jpg, https://salt.tikicdn.com/cache/w1200/ts/product/aa/a2/f4/74289dfb21a5d905c633ac6b7f6e12a5.jpg","https://salt.tikicdn.com/cache/w300/ts/product/e4/2c/bf/02a439ae6b1eab59f091337e5a181c1c.jpg, https://salt.tikicdn.com/cache/w300/ts/product/74/64/1c/5deacb5974ebb45fa1259cff479ce9fc.jpg, https://salt.tikicdn.com/cache/w300/ts/product/aa/a2/f4/74289dfb21a5d905c633ac6b7f6e12a5.jpg","https://salt.tikicdn.com/cache/200x280/ts/product/e4/2c/bf/02a439ae6b1eab59f091337e5a181c1c.jpg, https://salt.tikicdn.com/cache/200x280/ts/product/74/64/1c/5deacb5974ebb45fa1259cff479ce9fc.jpg, https://salt.tikicdn.com/cache/200x280/ts/product/aa/a2/f4/74289dfb21a5d905c633ac6b7f6e12a5.jpg","https://salt.tikicdn.com/cache/200x280/ts/product/e4/2c/bf/02a439ae6b1eab59f091337e5a181c1c.jpg, https://salt.tikicdn.com/cache/200x280/ts/product/74/64/1c/5deacb5974ebb45fa1259cff479ce9fc.jpg, https://salt.tikicdn.com/cache/200x280/ts/product/aa/a2/f4/74289dfb21a5d905c633ac6b7f6e12a5.jpg",1000,0
